"2012.04980","Michael Amir","Michael Amir, Noa Agmon, Alfred M. Bruckstein","A Discrete Model of Collective Marching on Rings","Corrected various typographical errors and some minor mathematical
  error in the statement of the theorem about erratic behavior. In an upcoming
  extended version we refine the bounds of Theorem 10 to O(log(k)n^2,mn)","International Symposium on Distributed Autonomous Robotic Systems
  2021, pp. 320-334",,,"cs.MA cs.DM math.DS","http://arxiv.org/licenses/nonexclusive-distrib/1.0/","  We study the collective motion of autonomous mobile agents on a ringlike
environment. The agents' dynamics is inspired by known laboratory experiments
on the dynamics of locust swarms. In these experiments, locusts placed at
arbitrary locations and initial orientations on a ring-shaped arena are
observed to eventually all march in the same direction. In this work we ask
whether, and how fast, a similar phenomenon occurs in a stochastic swarm of
simple agents whose goal is to maintain the same direction of motion for as
long as possible. The agents are randomly initiated as marching either
clockwise or counterclockwise on a wide ring-shaped region, which we model as
$k$ ""narrow"" concentric tracks on a cylinder. Collisions cause agents to change
their direction of motion. To avoid this, agents may decide to switch tracks so
as to merge with platoons of agents marching in their direction.
  We prove that such agents must eventually converge to a local consensus about
their direction of motion, meaning that all agents on each narrow track must
eventually march in the same direction. We give asymptotic bounds for the
expected amount of time it takes for such convergence or ""stabilization"" to
occur, which depends on the number of agents, the length of the tracks, and the
number of tracks. We show that when agents also have a small probability of
""erratic"", random track-jumping behaviour, a global consensus on the direction
of motion across all tracks will eventually be reached. Finally, we verify our
theoretical findings in numerical simulations.
","[{""version"":""v1"",""created"":""Wed, 9 Dec 2020 11:16:36 GMT""},{""version"":""v2"",""created"":""Fri, 11 Dec 2020 02:51:47 GMT""},{""version"":""v3"",""created"":""Fri, 18 Dec 2020 07:49:46 GMT""},{""version"":""v4"",""created"":""Sun, 11 Apr 2021 20:55:39 GMT""},{""version"":""v5"",""created"":""Mon, 30 May 2022 13:28:16 GMT""}]","2022-05-31"
"2012.04981","Jaume Jaume Bestard","Jaume Jaume Bestard, Ji\v{r}\'i \v{S}t\v{e}p\'an, Javier Trujillo
  Bueno","Improved near optimal angular quadratures for polarised radiative
  transfer in 3D MHD models","6 pages, 4 figures; published version in A&A","A&A 645, A101 (2021)","10.1051/0004-6361/202039424",,"astro-ph.SR astro-ph.GA","http://creativecommons.org/licenses/by/4.0/","  Accurate angular quadratures are crucial for the numerical solution of
three-dimensional (3D) radiative transfer problems, especially when the
spectral line polarisation produced by the scattering of anisotropic radiation
is included. There are two requirements for obtaining an optimal quadrature and
they are difficult to satisfy simultaneously: high accuracy and short computing
time. By imposing certain symmetries, we were recently able to derive a set of
near optimal angular quadratures. Here, we extend our previous investigation by
considering other symmetries. Moreover, we test the performance of our new
quadratures by numerically solving a radiative transfer problem of resonance
line polarisation in a 3D model of the solar atmosphere resulting from a
magneto-hydrodynamical simulation. The new angular quadratures derived here
outperform the previous ones in terms of the number of rays needed to achieve
any given accuracy.
","[{""version"":""v1"",""created"":""Wed, 9 Dec 2020 11:18:06 GMT""},{""version"":""v2"",""created"":""Fri, 22 Jan 2021 08:52:58 GMT""}]","2021-01-27"
"2012.04982","Manisha Luthra","Manisha Luthra, Sebastian Hennig, Kamran Razavi, Lin Wang and Boris
  Koldehofe","Operator as a Service: Stateful Serverless Complex Event Processing","10 pages, Published in the Proceedings of the IEEE International
  Conference on Big Data","2020 IEEE International Conference on Big Data (Big Data)","10.1109/BigData50022.2020.9378142",,"cs.NI cs.DC","http://creativecommons.org/licenses/by-nc-nd/4.0/","  Complex Event Processing (CEP) is a powerful paradigm for scalable data
management that is employed in many real-world scenarios such as detecting
credit card fraud in banks. The so-called complex events are expressed using a
specification language that is typically implemented and executed on a specific
runtime system. While the tight coupling of these two components has been
regarded as the key for supporting CEP at high performance, such dependencies
pose several inherent challenges as follows. (1) Application development atop a
CEP system requires extensive knowledge of how the runtime system operates,
which is typically highly complex in nature. (2) The specification language
dependence requires the need of domain experts and further restricts and
steepens the learning curve for application developers. In this paper, we
propose CEPLESS, a scalable data management system that decouples the
specification from the runtime system by building on the principles of
serverless computing. CEPLESS provides operator as a service and offers
flexibility by enabling the development of CEP application in any specification
language while abstracting away the complexity of the CEP runtime system. As
part of CEPLESS, we designed and evaluated novel mechanisms for in-memory
processing and batching that enables the stateful processing of CEP operators
even under high rates of ingested events. Our evaluation demonstrates that
CEPLESS can be easily integrated into existing CEP systems like Apache Flink
while attaining similar throughput under a high scale of events (up to 100K
events per second) and dynamic operator update in up to 238 ms.
","[{""version"":""v1"",""created"":""Wed, 9 Dec 2020 11:19:29 GMT""},{""version"":""v2"",""created"":""Mon, 14 Dec 2020 18:58:30 GMT""},{""version"":""v3"",""created"":""Mon, 28 Jun 2021 12:27:14 GMT""}]","2021-07-09"
"2012.04983","Eloi Zablocki","H\'edi Ben-Younes and \'Eloi Zablocki and Patrick P\'erez and Matthieu
  Cord","Driving Behavior Explanation with Multi-level Fusion","Accepted at NeurIPS Workshop ML4AD 2020","Pattern Recognition, Volume 123, March 2022, 108421","10.1016/j.patcog.2021.108421",,"cs.LG cs.AI cs.CV cs.RO","http://creativecommons.org/licenses/by-nc-nd/4.0/","  In this era of active development of autonomous vehicles, it becomes crucial
to provide driving systems with the capacity to explain their decisions. In
this work, we focus on generating high-level driving explanations as the
vehicle drives. We present BEEF, for BEhavior Explanation with Fusion, a deep
architecture which explains the behavior of a trajectory prediction model.
Supervised by annotations of human driving decisions justifications, BEEF
learns to fuse features from multiple levels. Leveraging recent advances in the
multi-modal fusion literature, BEEF is carefully designed to model the
correlations between high-level decisions features and mid-level perceptual
features. The flexibility and efficiency of our approach are validated with
extensive experiments on the HDD and BDD-X datasets.
","[{""version"":""v1"",""created"":""Wed, 9 Dec 2020 11:19:50 GMT""}]","2021-11-24"
"2012.04984","Eneko Osaba","Eneko Osaba, Esther Villar-Rodriguez, Izaskun Oregi and Aitor
  Moreno-Fernandez-de-Leceta","Hybrid Quantum Computing -- Tabu Search Algorithm for Partitioning
  Problems: preliminary study on the Traveling Salesman Problem","8 pages, 4 figures, paper accepted in IEEE Congress on Evolutionary
  Computation 2021",,,,"cs.ET cs.NE","http://arxiv.org/licenses/nonexclusive-distrib/1.0/","  Quantum Computing is considered as the next frontier in computing, and it is
attracting a lot of attention from the current scientific community. This kind
of computation provides to researchers with a revolutionary paradigm for
addressing complex optimization problems, offering a significant speed
advantage and an efficient search ability. Anyway, Quantum Computing is still
in an incipient stage of development. For this reason, present architectures
show certain limitations, which have motivated the carrying out of this paper.
In this paper, we introduce a novel solving scheme coined as hybrid Quantum
Computing - Tabu Search Algorithm. Main pillars of operation of the proposed
method are a greater control over the access to quantum resources, and a
considerable reduction of non-profitable accesses. To assess the quality of our
method, we have used 7 different Traveling Salesman Problem instances as
benchmarking set. The obtained outcomes support the preliminary conclusion that
our algorithm is an approach which offers promising results for solving
partitioning problems while it drastically reduces the access to quantum
computing resources. We also contribute to the field of Transfer Optimization
by developing an evolutionary multiform multitasking algorithm as
initialization method.
","[{""version"":""v1"",""created"":""Wed, 9 Dec 2020 11:21:50 GMT""},{""version"":""v2"",""created"":""Mon, 12 Apr 2021 13:59:57 GMT""}]","2021-04-13"
"2012.04985","Scott Liles D","S. D. Liles, F. Martins, D. S. Miserev, A. A. Kiselev, I. D.
  Thorvaldson, M. J. Rendell, I. K. Jin, F. E. Hudson, M. Veldhorst, K. M.
  Itoh, O. P. Sushkov, T. D. Ladd, A. S. Dzurak, A. R. Hamilton","Electrical control of the $g$-tensor of a single hole in a silicon MOS
  quantum dot","12 pages, 4 figures",,"10.1103/PhysRevB.104.235303",,"cond-mat.mes-hall","http://creativecommons.org/licenses/by/4.0/","  Single holes confined in semiconductor quantum dots are a promising platform
for spin qubit technology, due to the electrical tunability of the $g$-factor
of holes. However, the underlying mechanisms that enable electric spin control
remain unclear due to the complexity of hole spin states. Here, we study the
underlying hole spin physics of the first hole in a silicon planar MOS quantum
dot. We show that non-uniform electrode-induced strain produces nanometre-scale
variations in the HH-LH splitting. Importantly, we find that this
\RR{non-uniform strain causes} the HH-LH splitting to vary by up to 50\% across
the active region of the quantum dot. We show that local electric fields can be
used to displace the hole relative to the non-uniform strain profile, allowing
a new mechanism for electric modulation of the hole g-tensor. Using this
mechanism we demonstrate tuning of the hole $g$-factor by up to 500\%. In
addition, we observe a \RR{potential} sweet spot where
d$g_{(1\overline{1}0)}$/d$V$ = 0, offering a configuration to suppress spin
decoherence caused by electrical noise. These results open a path towards a
previously unexplored technology: engineering of \RR{non-uniform} strains to
optimise spin-based devices.
","[{""version"":""v1"",""created"":""Wed, 9 Dec 2020 11:24:37 GMT""},{""version"":""v2"",""created"":""Thu, 10 Dec 2020 01:27:53 GMT""},{""version"":""v3"",""created"":""Tue, 21 Dec 2021 02:07:38 GMT""}]","2021-12-22"
"2012.04986","Marianne Gauffriau","Marianne Gauffriau","Counting methods introduced into the bibliometric research literature
  1970-2018: A review",,,"10.1162/qss_a_00141",,"cs.DL","http://creativecommons.org/licenses/by/4.0/","  The present review of bibliometric counting methods investigates 1) the
number of unique counting methods in the bibliometric research literature, 2)
to what extent the counting methods can be categorized according to selected
characteristics of the counting methods, 3) methods and elements to assess the
internal validity of the counting methods, and 4) to what extent and with which
characteristics the counting methods are used in research evaluations.
  The review identifies 32 counting methods introduced during the period 1981 -
2018. Two frameworks categorize these counting methods. Framework 1 describes
selected mathematical properties of counting methods, and Framework 2 describes
arguments for choosing a counting method. Twenty of the 32 counting methods are
rank-dependent, fractionalized, and introduced to measure contribution,
participation, etc. of an object of study. Next, three criteria for internal
validity are used to identify five methods that test the adequacy of counting
methods, two elements that test sensitivity, and three elements that test
homogeneity of the counting methods. These methods and elements may be used to
assess the internal validity of counting methods. Finally, a literature search
finds research evaluations that use the counting methods. Only three of the 32
counting methods are used by four research evaluations or more. Of these three
counting methods, two are used with the same characteristics as defined in the
studies that introduced the counting methods.
  The review provides practitioners in research evaluation and researchers in
bibliometrics with a detailed foundation for working with counting methods. At
the same time, many of the findings in the review provide bases for future
investigations of counting methods.
","[{""version"":""v1"",""created"":""Wed, 9 Dec 2020 11:29:35 GMT""}]","2021-06-22"
"2012.04987","Biyang Guo","Biyang Guo, Songqiao Han, Xiao Han, Hailiang Huang, Ting Lu","Label Confusion Learning to Enhance Text Classification Models","8 pages,3 figures, 5 tables. Accepted by AAAI-21",,,,"cs.CL cs.AI","http://arxiv.org/licenses/nonexclusive-distrib/1.0/","  Representing a true label as a one-hot vector is a common practice in
training text classification models. However, the one-hot representation may
not adequately reflect the relation between the instances and labels, as labels
are often not completely independent and instances may relate to multiple
labels in practice. The inadequate one-hot representations tend to train the
model to be over-confident, which may result in arbitrary prediction and model
overfitting, especially for confused datasets (datasets with very similar
labels) or noisy datasets (datasets with labeling errors). While training
models with label smoothing (LS) can ease this problem in some degree, it still
fails to capture the realistic relation among labels. In this paper, we propose
a novel Label Confusion Model (LCM) as an enhancement component to current
popular text classification models. LCM can learn label confusion to capture
semantic overlap among labels by calculating the similarity between instances
and labels during training and generate a better label distribution to replace
the original one-hot label vector, thus improving the final classification
performance. Extensive experiments on five text classification benchmark
datasets reveal the effectiveness of LCM for several widely used deep learning
classification models. Further experiments also verify that LCM is especially
helpful for confused or noisy datasets and superior to the label smoothing
method.
","[{""version"":""v1"",""created"":""Wed, 9 Dec 2020 11:34:35 GMT""}]","2020-12-10"
"2012.04988","Hideo Takaoka","HIdeo Takaoka","Remarks on blow-up criteria for the derivative nonlinear Schrodinger
  equation under the optimal threshold setting","16 pages",,,,"math.AP","http://arxiv.org/licenses/nonexclusive-distrib/1.0/","  We study the Cauchy problem of the mass critical nonlinear Schrodinger
equation with derivative with the 4pi mass. One has the global well-posedness
in H^1 whenever ""the mass is strictly less than 4pi"" or whenever ""the mass is
equal to 4pi and the momentum is strictly less than zero"". In this paper, by
the concentration compact principle as originally done by Kenig-Merle, we
obtain the limiting profile of blow up solutions with the critical 4pi mass.
","[{""version"":""v1"",""created"":""Wed, 9 Dec 2020 11:39:28 GMT""}]","2020-12-10"
"2012.04989","Peng Zhang","Peng Zhang, Ryo Noguchi, Kenta Kuroda, Chun Lin, Kaishu Kawaguchi,
  Koichiro Yaji, Ayumi Harasawa, Mikk Lippmaa, Simin Nie, Hongming Weng, V.
  Kandyba, A. Giampietri, A. Barinov, Qiang Li, G.D. Gu, Shik Shin and Takeshi
  Kondo","Observation and control of the weak topological insulator state in ZrTe5","8 pages, 4 figures. Accepted by Nature Communications","Nature Communications 12, 406 (2021)","10.1038/s41467-020-20564-8",,"cond-mat.mtrl-sci","http://arxiv.org/licenses/nonexclusive-distrib/1.0/","  A quantum spin Hall insulator hosts topological states at the one-dimensional
edge, along which backscattering by nonmagnetic impurities is strictly
prohibited and dissipationless current flows. Its 3D analogue, a weak
topological insulator (WTI), possesses similar quasi-1D topological states
confined at side surfaces of crystals. The enhanced confinement could provide a
route for dissipationless current and better advantages for applications
relative to the widely studied strong topological insulators. However, the
topological side surface is usually not cleavable and is thus hard to observe
by angle-resolved photoemission spectroscopy (ARPES), which has hindered the
revealing of the electronic properties of WTIs. Here, we visualize the
topological surface states of the WTI candidate ZrTe5 for the first time by
spin and angle-resolved photoemission spectroscopy: a quasi-1D band with
spin-momentum locking was revealed on the side surface. We further demonstrate
that the bulk band gap in ZrTe5 is controlled by strain to the crystal,
realizing a more stabilized WTI state or an ideal Dirac semimetal state
depending on the direction of the external strain. The highly directional
spin-current and the tunable band gap we found in ZrTe5 will provide an
excellent platform for applications.
","[{""version"":""v1"",""created"":""Wed, 9 Dec 2020 11:41:08 GMT""}]","2021-01-20"
"2012.04990","Amir Mozammel","Mohsen Moradi, Amir Mozammel, Kangjian Qin, Erdal Arikan","Performance and Complexity of Sequential Decoding of PAC Codes",,,,,"cs.IT math.IT","http://creativecommons.org/licenses/by/4.0/","  Performance and complexity of sequential decoding of polarization-adjusted
convolutional (PAC) codes is studied. In particular, a performance and
computational complexity comparison of PAC codes with 5G polar codes and
convolutional codes is given. A method for bounding the complexity of
sequential decoding of PAC codes is proposed.
","[{""version"":""v1"",""created"":""Wed, 9 Dec 2020 11:42:47 GMT""},{""version"":""v2"",""created"":""Thu, 17 Dec 2020 12:01:59 GMT""}]","2020-12-18"
"2012.04991","Philipp Isserstedt","Philipp Isserstedt, Christian S. Fischer, Thorsten Steinert","Thermodynamics from the quark condensate","9 pages, 7 figures; v2: minor changes, version published in PRD","Phys. Rev. D 103, 054012 (2021)","10.1103/PhysRevD.103.054012",,"hep-ph","http://arxiv.org/licenses/nonexclusive-distrib/1.0/","  We present a method to compute thermodynamic quantities within functional
continuum frameworks that is independent of the employed truncation. As a proof
of principle, we first apply it to a Nambu-Jona-Lasinio model in mean-field
approximation. Then, we use the method with solutions obtained from a coupled
set of truncated Dyson-Schwinger equations for the quark and gluon propagators
of (2+1)-flavor quantum chromodynamics in Landau gauge to obtain the pressure,
entropy density, energy density, and interaction measure across the phase
diagram of strong-interaction matter. We also discuss the limitation of the
proposed method.
","[{""version"":""v1"",""created"":""Wed, 9 Dec 2020 11:50:20 GMT""},{""version"":""v2"",""created"":""Thu, 11 Mar 2021 20:49:46 GMT""}]","2021-03-15"
"2012.04992","Andrey Kutepov L","Andrey L. Kutepov","Elimination of the linearization error in APW/LAPW basis set:
  Dirac-Kohn-Sham equations","25 pages, 6 figures, 4 tables","Phys. Rev. B 103, 165101 (2021)","10.1103/PhysRevB.103.165101",,"cond-mat.mtrl-sci","http://arxiv.org/licenses/nonexclusive-distrib/1.0/","  A detailed account of the implementation of equations of the Relativistic
Density Functional Theory (RDFT) using basis sets of APW/LAPW type with
flexible extensions provided by local orbitals is given. Earlier discoveries of
the importance of the High Derivative Local Orbital (HDLO) extension of
APW/LAPW basis set for enhancing the accuracy of DFT calculations are confirmed
using fully relativistic approach and $\alpha$-U as an example. High Energy
Local Orbitals (HELO's), however indispensable for GW calculations, are
considerably less efficient in enhancing the accuracy of DFT applications. It
is shown, that a simplified approach to the relativistic effects, namely,
considering them only inside the muffin-tin (MT) spheres, produces basically
identical results (as compared to fully relativistic approach) for the
electronic free energy of the five materials considered in this work. By
comparing the effect of the simplified approach on the electronic free energy
with its effect on the electronic kinetic energy we conclude that the
insensitivity of the free energy to the way we describe the relativistic
effects in the interstitial region is related to the variational property of
this quantity.
","[{""version"":""v1"",""created"":""Wed, 9 Dec 2020 11:55:27 GMT""},{""version"":""v2"",""created"":""Sun, 14 Feb 2021 23:41:31 GMT""}]","2021-04-07"
"2012.04993","Francesco Solombrino","Giuliano Lazzaroni and Riccardo Molinarolo and Francesco Solombrino","Radial solutions for a dynamic debonding model in dimension two",,,,,"math.AP","http://creativecommons.org/licenses/by/4.0/","  In this paper we deal with a debonding model for a thin film in dimension
two, where the wave equation on a time-dependent domain is coupled with a flow
rule (Griffith's principle) for the evolution of the domain. We propose a
general definition of energy release rate, which is central in the formulation
of Griffith's criterion. Next, by means of an existence result, we show that
such definition is well posed in the special case of radial solutions, which
allows us to employ representation formulas typical of one-dimensional models.
","[{""version"":""v1"",""created"":""Wed, 9 Dec 2020 11:59:22 GMT""}]","2020-12-10"
"2012.04994","George Rupp","Eef van Beveren and George Rupp","Understanding the $f_0(980)$ and $a_0(980)$ masses as well as their
  widths","Invited contribution to the Gribov-90 Memorial Volume, to be
  published by World Scientific Publishing Company; 15 pages, 5 figures","World Scientific, Gribov-90 Memorial Volume, pp. 201-216 (2021)","10.1142/9789811238406_0020",,"hep-ph hep-ex","http://arxiv.org/licenses/nonexclusive-distrib/1.0/","  The low and approximately equal masses of the scalar mesons $f_0(980)$ and
$a_0(980)$, as well as their relatively small decay widths, are impossible to
understand in terms of standard $P$-wave quark-antiquark states. Here, these
mesons are studied in a unitarised quark-meson model, together with the other
light isoscalar scalar $f_0(500)$, as members of a complete scalar nonet below
about 1 GeV. They are shown to be dynamical states generated by a combination
of quark-confinement and strong-decay interactions, resulting in a large
breaking of $SU(3)_{\rm flavour}$ symmetry. This is illustrated with several
pole trajectories in the complex-energy plane as a function of the model's
decay coupling constant. Also, experimental evidence is presented of a still
much lighter scalar boson called $E(38)$, which may correspond to a novel kind
of mesons predicted by V. N. Gribov, as an observable manifestation of a
condensate of light quarks.
","[{""version"":""v1"",""created"":""Wed, 9 Dec 2020 11:59:41 GMT""}]","2021-06-11"
"2012.04995","Runze Wang","Run-Ze Wang, Zhen-Hua Ling, Jing-Bo Zhou, Yu Hu","Tracking Interaction States for Multi-Turn Text-to-SQL Semantic Parsing","Accepted by AAAI 2021",,,,"cs.CL","http://arxiv.org/licenses/nonexclusive-distrib/1.0/","  The task of multi-turn text-to-SQL semantic parsing aims to translate natural
language utterances in an interaction into SQL queries in order to answer them
using a database which normally contains multiple table schemas. Previous
studies on this task usually utilized contextual information to enrich
utterance representations and to further influence the decoding process. While
they ignored to describe and track the interaction states which are determined
by history SQL queries and are related with the intent of current utterance. In
this paper, two kinds of interaction states are defined based on schema items
and SQL keywords separately. A relational graph neural network and a non-linear
layer are designed to update the representations of these two states
respectively. The dynamic schema-state and SQL-state representations are then
utilized to decode the SQL query corresponding to current utterance.
Experimental results on the challenging CoSQL dataset demonstrate the
effectiveness of our proposed method, which achieves better performance than
other published methods on the task leaderboard.
","[{""version"":""v1"",""created"":""Wed, 9 Dec 2020 11:59:58 GMT""}]","2020-12-10"
