"2012.04835","Pengxiang Wu","Pengxiang Wu, Songzhu Zheng, Mayank Goswami, Dimitris Metaxas, Chao
  Chen","A Topological Filter for Learning with Label Noise","NeurIPS 2020, fixed some typos",,,,"cs.CV cs.LG","http://arxiv.org/licenses/nonexclusive-distrib/1.0/","  Noisy labels can impair the performance of deep neural networks. To tackle
this problem, in this paper, we propose a new method for filtering label noise.
Unlike most existing methods relying on the posterior probability of a noisy
classifier, we focus on the much richer spatial behavior of data in the latent
representational space. By leveraging the high-order topological information of
data, we are able to collect most of the clean data and train a high-quality
model. Theoretically we prove that this topological approach is guaranteed to
collect the clean data with high probability. Empirical results show that our
method outperforms the state-of-the-arts and is robust to a broad spectrum of
noise types and levels.
","[{""version"":""v1"",""created"":""Wed, 9 Dec 2020 02:52:45 GMT""},{""version"":""v2"",""created"":""Fri, 28 Jan 2022 00:58:26 GMT""}]","2022-01-31"
"2012.04836","Peng Gao","Peng Gao","Real zeros of quadratic Hecke $L$-functions","30 pages",,,,"math.NT","http://creativecommons.org/licenses/by/4.0/","  We study real zeros of a family of quadratic Hecke $L$-functions in the
Gaussian field to show that more than twenty percent of the members have no
zeros on the interval $(0, 1]$.
","[{""version"":""v1"",""created"":""Wed, 9 Dec 2020 03:04:53 GMT""}]","2020-12-10"
"2012.04837","Chaoqin Huang","Fei Ye, Huangjie Zheng, Chaoqin Huang, Ya Zhang","Deep Unsupervised Image Anomaly Detection: An Information Theoretic
  Framework",,,,,"cs.CV cs.LG stat.ML","http://creativecommons.org/licenses/by/4.0/","  Surrogate task based methods have recently shown great promise for
unsupervised image anomaly detection. However, there is no guarantee that the
surrogate tasks share the consistent optimization direction with anomaly
detection. In this paper, we return to a direct objective function for anomaly
detection with information theory, which maximizes the distance between normal
and anomalous data in terms of the joint distribution of images and their
representation. Unfortunately, this objective function is not directly
optimizable under the unsupervised setting where no anomalous data is provided
during training. Through mathematical analysis of the above objective function,
we manage to decompose it into four components. In order to optimize in an
unsupervised fashion, we show that, under the assumption that distribution of
the normal and anomalous data are separable in the latent space, its lower
bound can be considered as a function which weights the trade-off between
mutual information and entropy. This objective function is able to explain why
the surrogate task based methods are effective for anomaly detection and
further point out the potential direction of improvement. Based on this object
function we introduce a novel information theoretic framework for unsupervised
image anomaly detection. Extensive experiments have demonstrated that the
proposed framework significantly outperforms several state-of-the-arts on
multiple benchmark data sets.
","[{""version"":""v1"",""created"":""Wed, 9 Dec 2020 03:07:00 GMT""}]","2020-12-10"
"2012.04838","Ali Akhavan-Safaei","Ali Akhavan-Safaei, Mohsen Zayernouri","A Parallel Integrated Computational-Statistical Platform for Turbulent
  Transport Phenomena","8 pages, 3 figures",,,,"physics.flu-dyn","http://creativecommons.org/licenses/by/4.0/","  In this paper, we present an open-source, automated, and multi-faceted
computational-statistical platform to obtain synthetic homogeneous isotropic
turbulent flow and passive scalar transport. A parallel implementation of the
well-known pseudo-spectral method in addition to the comprehensive record of
the statistical and small-scale quantities of the turbulent transport are
offered for executing on distributed memory CPU-based supercomputers. The
user-friendly workflow and easy-to-run design of the developed package is
disclosed through an extensive and step-by-step example. The resulting low- and
high-order statistical records vividly verify well-established and
fully-developed turbulent state as well as the seamless statistical balance of
conservation laws. Post-processing tools provided in this platform would let
the user to readily construct multiple important transport quantities from the
primitive turbulent fields.
","[{""version"":""v1"",""created"":""Wed, 9 Dec 2020 03:13:03 GMT""}]","2020-12-10"
"2012.04839","Chenyang Zhao","Chenyang Zhao, Timothy Hospedales","Robust Domain Randomised Reinforcement Learning through Peer-to-Peer
  Distillation",,,,,"cs.LG","http://creativecommons.org/licenses/by/4.0/","  In reinforcement learning, domain randomisation is an increasingly popular
technique for learning more general policies that are robust to domain-shifts
at deployment. However, naively aggregating information from randomised domains
may lead to high variance in gradient estimation and unstable learning process.
To address this issue, we present a peer-to-peer online distillation strategy
for RL termed P2PDRL, where multiple workers are each assigned to a different
environment, and exchange knowledge through mutual regularisation based on
Kullback-Leibler divergence. Our experiments on continuous control tasks show
that P2PDRL enables robust learning across a wider randomisation distribution
than baselines, and more robust generalisation to new environments at testing.
","[{""version"":""v1"",""created"":""Wed, 9 Dec 2020 03:16:04 GMT""}]","2020-12-10"
"2012.04840","Medhat Elsayed","Medhat Elsayed, Melike Erol-Kantarci, Halim Yanikomeroglu","Transfer Reinforcement Learning for 5G-NR mm-Wave Networks",,,,,"cs.NI","http://creativecommons.org/licenses/by/4.0/","  In this paper, we aim at interference mitigation in 5G millimeter-Wave
(mm-Wave) communications by employing beamforming and Non-Orthogonal Multiple
Access (NOMA) techniques with the aim of improving network's aggregate rate.
Despite the potential capacity gains of mm-Wave and NOMA, many technical
challenges might hinder that performance gain. In particular, the performance
of Successive Interference Cancellation (SIC) diminishes rapidly as the number
of users increases per beam, which leads to higher intra-beam interference.
Furthermore, intersection regions between adjacent cells give rise to
inter-beam inter-cell interference. To mitigate both interference levels,
optimal selection of the number of beams in addition to best allocation of
users to those beams is essential. In this paper, we address the problem of
joint user-cell association and selection of number of beams for the purpose of
maximizing the aggregate network capacity. We propose three machine
learning-based algorithms; transfer Q-learning (TQL), Q-learning, and Best SINR
association with Density-based Spatial Clustering of Applications with Noise
(BSDC) algorithms and compare their performance under different scenarios.
Under mobility, TQL and Q-learning demonstrate 12% rate improvement over BSDC
at the highest offered traffic load. For stationary scenarios, Q-learning and
BSDC outperform TQL, however TQL achieves about 29% convergence speedup
compared to Q-learning.
","[{""version"":""v1"",""created"":""Wed, 9 Dec 2020 03:19:02 GMT""}]","2020-12-10"
"2012.04841","Rui Fan","Rui Fan, Christopher Bowd, Nicole Brye, Mark Christopher, Robert N.
  Weinreb, David Kriegman, Linda Zangwill","One-Vote Veto: Semi-Supervised Learning for Low-Shot Glaucoma Diagnosis",,,,,"cs.CV cs.AI cs.LG","http://arxiv.org/licenses/nonexclusive-distrib/1.0/","  Convolutional neural networks (CNNs) are a promising technique for automated
glaucoma diagnosis from images of the fundus, and these images are routinely
acquired as part of an ophthalmic exam. Nevertheless, CNNs typically require a
large amount of well-labeled data for training, which may not be available in
many biomedical image classification applications, especially when diseases are
rare and where labeling by experts is costly.
  This paper makes two contributions to address this issue: (1) It extends the
conventional twin neural network and introduces a training method for low-shot
learning when labeled data are limited and imbalanced, and (2) it introduces a
novel semi-supervised learning strategy that uses additional unlabeled training
data to achieve greater accuracy. Our proposed multi-task twin neural network
(MTTNN) can employ any backbone CNN, and we demonstrate with four backbone CNNs
that its accuracy with limited training data approaches the accuracy of
backbone CNNs trained with a dataset that is 50 times larger. We also introduce
One-Vote Veto (OVV) self-training, a semi-supervised learning strategy that is
designed specifically for MTTNNs. By taking both self-predictions and
contrastive-predictions of the unlabeled training data into account, OVV
self-training provides additional pseudo labels for fine tuning a pretrained
MTTNN. Using a large (imbalanced) dataset with 66715 fundus photographs
acquired over 15 years, extensive experimental results demonstrate the
effectiveness of low-shot learning with MTTNN and semi-supervised learning with
OVV self-training. Three additional, smaller clinical datasets of fundus images
acquired under different conditions (cameras, instruments, locations,
populations) are used to demonstrate the generalizability of the proposed
methods. Source code and pretrained models will be publicly available upon
publication.
","[{""version"":""v1"",""created"":""Wed, 9 Dec 2020 03:20:06 GMT""},{""version"":""v2"",""created"":""Tue, 19 Jan 2021 06:19:00 GMT""},{""version"":""v3"",""created"":""Fri, 26 Mar 2021 20:32:41 GMT""}]","2021-03-30"
"2012.04842","Shuhan Tan","Shuhan Tan, Yujun Shen, Bolei Zhou","Improving the Fairness of Deep Generative Models without Retraining","Project page: https://genforce.github.io/fairgen/",,,,"cs.CV cs.AI","http://arxiv.org/licenses/nonexclusive-distrib/1.0/","  Generative Adversarial Networks (GANs) advance face synthesis through
learning the underlying distribution of observed data. Despite the high-quality
generated faces, some minority groups can be rarely generated from the trained
models due to a biased image generation process. To study the issue, we first
conduct an empirical study on a pre-trained face synthesis model. We observe
that after training the GAN model not only carries the biases in the training
data but also amplifies them to some degree in the image generation process. To
further improve the fairness of image generation, we propose an interpretable
baseline method to balance the output facial attributes without retraining. The
proposed method shifts the interpretable semantic distribution in the latent
space for a more balanced image generation while preserving the sample
diversity. Besides producing more balanced data regarding a particular
attribute (e.g., race, gender, etc.), our method is generalizable to handle
more than one attribute at a time and synthesize samples of fine-grained
subgroups. We further show the positive applicability of the balanced data
sampled from GANs to quantify the biases in other face recognition systems,
like commercial face attribute classifiers and face super-resolution
algorithms.
","[{""version"":""v1"",""created"":""Wed, 9 Dec 2020 03:20:41 GMT""},{""version"":""v2"",""created"":""Mon, 29 Mar 2021 08:55:12 GMT""}]","2021-03-30"
"2012.04843","Qun Wang","Qun Wang, Fuhui Zhou, Rose Qingyang Hu, and Yi Qian","Energy Efficient Robust Beamforming and Cooperative Jamming Design for
  IRS-Assisted MISO Networks","arXiv admin note: text overlap with arXiv:1911.05133",,,,"cs.IT cs.SY eess.SY math.IT","http://arxiv.org/licenses/nonexclusive-distrib/1.0/","  Energy-efficient design and secure communications are of crucial importance
in wireless communication networks. However, the energy efficiency achieved by
using physical layer security can be limited by the channel conditions. In
order to tackle this problem, an intelligent reflecting surface (IRS) assisted
multiple input single output (MISO) network with independent cooperative
jamming is studied. The energy efficiency is maximized by jointly designing the
transmit and jamming beamforming and IRS phase-shift matrix under both the
perfect channel state information (CSI) and the imperfect CSI.
  In order to tackle the challenging non-convex fractional problems, an
algorithm based on semidefinite programming (SDP) relaxation is proposed for
solving energy efficiency maximization problem under the perfect CSI case while
an alternate optimization algorithm based on $\mathcal{S}$-procedure is used
for solving the problem under the imperfect CSI case.
  Simulation results demonstrate that the proposed design outperforms the
benchmark schemes in term of energy efficiency. Moreover, the tradeoff between
energy efficiency and the secrecy rate is found in the IRS-assisted MISO
network. Furthermore, it is shown that IRS can help improve energy efficiency
even with the uncertainty of the CSI.
","[{""version"":""v1"",""created"":""Wed, 9 Dec 2020 03:23:01 GMT""}]","2020-12-10"
"2012.04844","Tomoki Ishikura","Tomoki Ishikura, Akishige Yuguchi, Yuki Kitamura, Sung-Gwi Cho, Ming
  Ding, Jun Takamatsu, Wataru Sato, Sakiko Yoshikawa, Tsukasa Ogasawara","Toward an Affective Touch Robot: Subjective and Physiological Evaluation
  of Gentle Stroke Motion Using a Human-Imitation Hand","8 pages, 10 figures",,,,"cs.RO","http://arxiv.org/licenses/nonexclusive-distrib/1.0/","  Affective touch offers positive psychological and physiological benefits such
as the mitigation of stress and pain. If a robot could realize human-like
affective touch, it would open up new application areas, including supporting
care work. In this research, we focused on the gentle stroking motion of a
robot to evoke the same emotions that human touch would evoke: in other words,
an affective touch robot. We propose a robot that is able to gently stroke the
back of a human using our designed human-imitation hand. To evaluate the
emotional effects of this affective touch, we compared the results of a
combination of two agents (the human-imitation hand and the human hand), at two
stroke speeds (3 and 30 cm/s). The results of the subjective and physiological
evaluations highlighted the following three findings: 1) the subjects evaluated
strokes similarly with regard to the stroke speed of the human and
human-imitation hand, in both the subjective and physiological evaluations; 2)
the subjects felt greater pleasure and arousal at the faster stroke rate (30
cm/s rather than 3 cm/s); and 3) poorer fitting of the human-imitation hand due
to the bending of the back had a negative emotional effect on the subjects.
","[{""version"":""v1"",""created"":""Wed, 9 Dec 2020 03:24:38 GMT""}]","2020-12-10"
"2012.04845","Asaf Cohen","Erhan Bayraktar, Alekos Cecchin, Asaf Cohen, Fran\c{c}ois Delarue","Finite state mean field games with Wright Fisher common noise as limits
  of $N$-player weighted games",,,,,"math.PR math.OC","http://arxiv.org/licenses/nonexclusive-distrib/1.0/","  Forcing finite state mean field games by a relevant form of common noise is a
subtle issue, which has been addressed only recently. Among others, one
possible way is to subject the simplex valued dynamics of an equilibrium by a
so-called Wright-Fisher noise, very much in the spirit of stochastic models in
population genetics. A key feature is that such a random forcing preserves the
structure of the simplex, which is nothing but, in this setting, the
probability space over the state space of the game. The purpose of this article
is hence to elucidate the finite player version and, accordingly, to prove that
$N$-player equilibria indeed converge towards the solution of such a kind of
Wright-Fisher mean field game. Whilst part of the analysis is made easier by
the fact that the corresponding master equation has already been proved to be
uniquely solvable under the presence of the common noise, it becomes however
more subtle than in the standard setting because the mean field interaction
between the players now occurs through a weighted empirical measure. In other
words, each player carries its own weight, which hence may differ from $1/N$
and which, most of all, evolves with the common noise.
","[{""version"":""v1"",""created"":""Wed, 9 Dec 2020 03:29:06 GMT""},{""version"":""v2"",""created"":""Mon, 1 Nov 2021 21:22:47 GMT""}]","2021-11-03"
"2012.04846","Shaoli Huang","Shaoli Huang, Xinchao Wang, Dacheng Tao","SnapMix: Semantically Proportional Mixing for Augmenting Fine-grained
  Data","Accepted by AAAI2021",,,,"cs.CV cs.LG","http://creativecommons.org/licenses/by/4.0/","  Data mixing augmentation has proved effective in training deep models. Recent
methods mix labels mainly based on the mixture proportion of image pixels. As
the main discriminative information of a fine-grained image usually resides in
subtle regions, methods along this line are prone to heavy label noise in
fine-grained recognition. We propose in this paper a novel scheme, termed as
Semantically Proportional Mixing (SnapMix), which exploits class activation map
(CAM) to lessen the label noise in augmenting fine-grained data. SnapMix
generates the target label for a mixed image by estimating its intrinsic
semantic composition, and allows for asymmetric mixing operations and ensures
semantic correspondence between synthetic images and target labels. Experiments
show that our method consistently outperforms existing mixed-based approaches
on various datasets and under different network depths. Furthermore, by
incorporating the mid-level features, the proposed SnapMix achieves top-level
performance, demonstrating its potential to serve as a solid baseline for
fine-grained recognition. Our code is available at
https://github.com/Shaoli-Huang/SnapMix.git.
","[{""version"":""v1"",""created"":""Wed, 9 Dec 2020 03:37:30 GMT""}]","2020-12-10"
"2012.04847","Brendan Bowler","Brendan P. Bowler, William D. Cochran, Michael Endl, Kyle Franson,
  Timothy D. Brandt, Trent J. Dupuy, Phillip J. MacQueen, Kaitlin M. Kratter,
  Dimitri Mawet, Garreth Ruane","The McDonald Accelerating Stars Survey (MASS): White Dwarf Companions
  Accelerating the Sun-like Stars 12 Psc and HD 159062","Accepted to AJ",,"10.3847/1538-3881/abd243",,"astro-ph.SR","http://arxiv.org/licenses/nonexclusive-distrib/1.0/","  We present the discovery of a white dwarf companion to the G1 V star 12 Psc
found as part of a Keck adaptive optics imaging survey of long-term
accelerating stars from the McDonald Observatory Planet Search Program. Twenty
years of precise radial-velocity monitoring of 12 Psc with the Tull
Spectrograph at the Harlan J. Smith telescope reveals a moderate radial
acceleration ($\approx$10 m s$^{-1}$ yr $^{-1}$), which together with relative
astrometry from Keck/NIRC2 and the astrometric acceleration between $Hipparcos$
and $Gaia$ DR2 yields a dynamical mass of $M_B$ = 0.605$^{+0.021}_{-0.022}$
$M_{\odot}$ for 12 Psc B, a semi-major axis of 40$^{+2}_{-4}$ AU, and an
eccentricity of 0.84$\pm$0.08. We also report an updated orbit fit of the white
dwarf companion to the metal-poor (but barium-rich) G9 V dwarf HD 159062 based
on new radial velocity observations from the High-Resolution Spectrograph at
the Hobby-Eberly Telescope and astrometry from Keck/NIRC2. A joint fit of the
available relative astrometry, radial velocities, and tangential astrometric
acceleration yields a dynamical mass of $M_B$ = 0.609$^{+0.010}_{-0.011}$
$M_{\odot}$ for HD 159062 B, a semi-major axis of 60$^{+5}_{-7}$ AU, and
preference for circular orbits ($e$$<$0.42 at 95% confidence). 12 Psc B and HD
159062 B join a small list of resolved ""Sirius-like"" benchmark white dwarfs
with precise dynamical mass measurements which serve as valuable tests of white
dwarf mass-radius cooling models and probes of AGB wind accretion onto their
main-sequence companions.
","[{""version"":""v1"",""created"":""Wed, 9 Dec 2020 03:37:47 GMT""}]","2021-02-17"
"2012.04848","Xiaodi Wu","Kai-Min Chung, Yi Lee, Han-Hsuan Lin, and Xiaodi Wu","Constant-round Blind Classical Verification of Quantum Sampling","improved presentation. main results remain the same",,,,"quant-ph cs.CR","http://arxiv.org/licenses/nonexclusive-distrib/1.0/","  In a recent breakthrough, Mahadev constructed a classical verification of
quantum computation (CVQC) protocol for a classical client to delegate decision
problems in BQP to an untrusted quantum prover under computational assumptions.
In this work, we explore further the feasibility of CVQC with the more general
sampling problems in BQP and with the desirable blindness property. We
contribute affirmative solutions to both as follows.
  (1) Motivated by the sampling nature of many quantum applications (e.g.,
quantum algorithms for machine learning and quantum supremacy tasks), we
initiate the study of CVQC for quantum sampling problems (denoted by SampBQP).
More precisely, in a CVQC protocol for a SampBQP problem, the prover and the
verifier are given an input $x\in \{0,1\}^n$ and a quantum circuit $C$, and the
goal of the classical client is to learn a sample from the output $z \leftarrow
C(x)$ up to a small error, from its interaction with an untrusted prover. We
demonstrate its feasibility by constructing a four-message CVQC protocol for
SampBQP based on the quantum Learning With Error assumption.
  (2) The blindness of CVQC protocols refers to a property of the protocol
where the prover learns nothing, and hence is blind, about the client's input.
It is a highly desirable property that has been intensively studied for the
delegation of quantum computation. We provide a simple yet powerful generic
compiler that transforms any CVQC protocol to a blind one while preserving its
completeness and soundness errors as well as the number of rounds.
  Applying our compiler to (a parallel repetition of) Mahadev's CVQC protocol
for BQP and our CVQC protocol for SampBQP yields the first constant-round blind
CVQC protocol for BQP and SampBQP respectively, with negligible and inverse
polynomial soundness errors respectively, and negligible completeness errors.
","[{""version"":""v1"",""created"":""Wed, 9 Dec 2020 03:39:13 GMT""},{""version"":""v2"",""created"":""Mon, 25 Oct 2021 03:18:38 GMT""}]","2021-10-26"
"2012.04849","George Livadiotis","George Livadiotis, Maher A. Dayeh, Gary P. Zank","Estimation of turbulent heating of solar wind protons at 1AU","16 pages, 12 figures",,"10.3847/1538-4357/abc5c3",,"physics.space-ph","http://creativecommons.org/licenses/by/4.0/","  The paper presents a new method for deriving turbulent heating of the solar
wind using plasma moments and magnetic field data. We develop the method and
then apply it to compute the turbulent heating of the solar wind proton plasma
at 1AU. The method employs two physical properties of the expanding solar wind
plasma, the wave-particle thermodynamic equilibrium, and the transport of
entropic rate. We analyze plasma moments and field datasets taken from Wind
S/C, in order to compute (i) the fluctuating magnetic energy, (ii) the
corresponding correlation length, and (iii) the turbulent heating rate. We
identify their relationships with the solar wind speed, as well as the
variation of these relationships relative to solar wind and interplanetary
coronal mass ejection plasma.
","[{""version"":""v1"",""created"":""Wed, 9 Dec 2020 03:51:32 GMT""}]","2021-01-06"
"2012.04850","Zhen Chen","Zhen Chen, Ren-qian Zhang","A multi-period multi-product stochastic inventory problem with
  order-based loan",,,,,"math.OC cs.SY eess.SY","http://creativecommons.org/licenses/by/4.0/","  This paper investigates a multi-product stochastic inventory problem in which
a cash-constrained online retailer can adopt order-based loan provided by some
Chinese e-commerce platforms to speed up its cash recovery for deferred
revenue. We first build deterministic models for the problem and then develop
the corresponding stochastic programming models to maximize the retailers'
expected profit over the planning horizon. The uncertainty of customer demand
is represented by scenario trees, and a scenario reduction technique is used to
solve the problem when the scenario trees are too large. We conduct numerical
tests based on real data crawling from an online store. The results show that
the stochastic model outperforms the deterministic model, especially when the
retailer is less cash-constrained. Moreover, the retailer tends to choose using
order-based loan when its initial available cash is small or facing long
receipt delay length.
","[{""version"":""v1"",""created"":""Wed, 9 Dec 2020 03:52:38 GMT""}]","2020-12-10"
