"2012.04684","Thomas Cridge","S. Bailey, T. Cridge, L. A. Harland-Lang, A. D. Martin, R.S. Thorne","Parton distributions from LHC, HERA, Tevatron and fixed target data:
  MSHT20 PDFs","140 pages, 96 figures, 16 tables. Published version plus very minor
  alterations - version 4","The European Physical Journal C volume 81, Article number: 341
  (2021)","10.1140/epjc/s10052-021-09057-0","IPPP/20/58","hep-ph hep-ex","http://creativecommons.org/licenses/by/4.0/","  We present the new MSHT20 set of parton distribution functions (PDFs) of the
proton, determined from global analyses of the available hard scattering data.
The PDFs are made available at NNLO, NLO, and LO, and supersede the MMHT14
sets. They are obtained using the same basic framework, but the
parameterisation is now adapted and extended, and there are 32 pairs of
eigenvector PDFs. We also include a large number of new data sets: from the
final HERA combined data on total and heavy flavour structure functions, to
final Tevatron data, and in particular a significant number of new LHC 7 and 8
TeV data sets on vector boson production, inclusive jets and top quark
distributions. We include up to NNLO QCD corrections for all data sets that
play a major role in the fit, and NLO EW corrections where relevant. We find
that these updates have an important impact on the PDFs, and for the first time
the NNLO fit is strongly favoured over the NLO, reflecting the wider range and
in particular increased precision of data included in the fit. There are some
changes to central values and a significant reduction in the uncertainties of
the PDFs in many, though not all, cases. Nonetheless, the PDFs and the
resulting predictions are generally within one standard deviation of the MMHT14
results. The major changes are the $u-d$ valence quark difference at small $x$,
due to the improved parameterisation and new precise data, the $\bar d, \bar u$
difference at small $x$, due to a much improved parameterisation, and the
strange quark PDF due to the effect of LHC $W,Z$ data and inclusion of new NNLO
corrections for dimuon production in neutrino DIS. We discuss the
phenomenological impact of our results, and in general find reduced
uncertainties in predictions for processes such as Higgs, top quark pair and
$W,Z$ production at post LHC Run-II energies.
","[{""version"":""v1"",""created"":""Tue, 8 Dec 2020 19:12:34 GMT""},{""version"":""v2"",""created"":""Sun, 20 Dec 2020 16:39:19 GMT""},{""version"":""v3"",""created"":""Wed, 28 Jul 2021 09:12:57 GMT""},{""version"":""v4"",""created"":""Fri, 19 Aug 2022 16:25:33 GMT""}]","2022-08-22"
"2012.04685","Andrea Camposeo","Andrea Camposeo (1,2), Francesca D'Elia (2), Alberto Portone (1,2),
  Francesca Matino (1,2), Matteo Archimi (1,3), Silvia Conti (4), Gianluca
  Fiori (4), Dario Pisignano (1,3), Luana Persano (1,2) ((1) NEST, Istituto
  Nanoscienze, CNR, (2) NEST, Scuola Normale Superiore, (3) Dipartimento di
  Fisica, Universit\`a di Pisa, (4) Dipartimento di Ingegneria
  dell'Informazione, Universit\`a di Pisa)","Naturally-Degradable Photonic Devices with Transient Function by
  Heterostructured Waxy-Sublimating and Water-Soluble Materials","30 pages, 15 figures","Advanced Science, vol. 7, 2001594 (2020)","10.1002/advs.202001594",,"cond-mat.mtrl-sci physics.optics","http://arxiv.org/licenses/nonexclusive-distrib/1.0/","  Combined dry-wet transient materials and devices are introduced, which are
based on water-dissolvable dye-doped polymers layered onto non-polar cyclic
hydrocarbon sublimating substrates. Light-emitting heterostructures showing
amplified spontaneous emission are used as illumination sources for
speckle-free, full-field imaging, and transient optical labels are realized
that incorporate QR codes with stably encoded information. The transient
behavior is also studied at the microscopic scale, highlighting the real time
evolution of material domains in the sublimating compound. Finally, the
exhausted components are fully soluble in water thus being naturally
degradable.
","[{""version"":""v1"",""created"":""Tue, 8 Dec 2020 19:12:57 GMT""}]","2020-12-10"
"2012.04686","Tom Struck","Tom Struck, Javed Lindner, Arne Hollmann, Floyd Schauer, Andreas
  Schmidbauer, Dominique Bougeard, Lars R. Schreiber","Robust and fast post-processing of single-shot spin qubit detection
  events with a neural network",,,"10.1038/s41598-021-95562-x",,"quant-ph","http://creativecommons.org/licenses/by/4.0/","  Establishing low-error and fast detection methods for qubit readout is
crucial for efficient quantum error correction. Here, we test neural networks
to classify a collection of single-shot spin detection events, which are the
readout signal of our qubit measurements. This readout signal contains a
stochastic peak, for which a Bayesian inference filter including Gaussian noise
is theoretically optimal. Hence, we benchmark our neural networks trained by
various strategies versus this latter algorithm. Training of the network with
10$^{6}$ experimentally recorded single-shot readout traces does not improve
the post-processing performance. A network trained by synthetically generated
measurement traces performs similar in terms of the detection error and the
post-processing speed compared to the Bayesian inference filter. This neural
network turns out to be more robust to fluctuations in the signal offset,
length and delay as well as in the signal-to-noise ratio. Notably, we find an
increase of 7 % in the visibility of the Rabi-oscillation when we employ a
network trained by synthetic readout traces combined with measured signal noise
of our setup. Our contribution thus represents an example of the beneficial
role which software and hardware implementation of neural networks may play in
scalable spin qubit processor architectures.
","[{""version"":""v1"",""created"":""Tue, 8 Dec 2020 19:13:09 GMT""},{""version"":""v2"",""created"":""Mon, 22 Mar 2021 12:21:57 GMT""}]","2021-08-24"
"2012.04688","Goran Banjac","Goran Banjac, Jianzhe Zhen, Dick den Hertog, John Lygeros","Improving Tractability of Real-Time Control Schemes via Simplified
  $\mathcal{S}$-Lemma",,,,,"math.OC","http://arxiv.org/licenses/nonexclusive-distrib/1.0/","  Various control schemes rely on a solution of a convex optimization problem
involving a particular robust quadratic constraint, which can be reformulated
as a linear matrix inequality using the well-known $\mathcal{S}$-lemma.
However, the computational effort required to solve the resulting semidefinite
program may be prohibitively large for real-time applications requiring a
repeated solution of such a problem. We use some recent advances in robust
optimization that allow us to reformulate such a robust constraint as a set of
linear and second-order cone constraints, which are computationally better
suited to real-time applications. A numerical example demonstrates a huge
speedup that can be obtained using the proposed reformulation.
","[{""version"":""v1"",""created"":""Tue, 8 Dec 2020 19:21:41 GMT""}]","2020-12-10"
"2012.04689","Otto Brookes","Otto Brookes, Tilo Burghardt","A Dataset and Application for Facial Recognition of Individual Gorillas
  in Zoo Environments",,,,,"cs.CV cs.AI","http://creativecommons.org/licenses/by/4.0/","  We put forward a video dataset with 5k+ facial bounding box annotations
across a troop of 7 western lowland gorillas at Bristol Zoo Gardens. Training
on this dataset, we implement and evaluate a standard deep learning pipeline on
the task of facially recognising individual gorillas in a zoo environment. We
show that a basic YOLOv3-powered application is able to perform identifications
at 92% mAP when utilising single frames only. Tracking-by-detection-association
and identity voting across short tracklets yields an improved robust
performance of 97% mAP. To facilitate easy utilisation for enriching the
research capabilities of zoo environments, we publish the code, video dataset,
weights, and ground-truth annotations at data.bris.ac.uk.
","[{""version"":""v1"",""created"":""Tue, 8 Dec 2020 19:23:22 GMT""},{""version"":""v2"",""created"":""Fri, 26 Mar 2021 17:38:09 GMT""}]","2021-03-29"
"2012.04690","Evan Petrosky","Evan Petrosky, Hsiang-Chih Hwang, Nadia L. Zakamska, Vedant Chandra,
  and Matthew J. Hill","Variability, periodicity and contact binaries in WISE","23 pages, 15 figures. Accepted for Publication in MNRAS. The full
  catalog of WISE variables, periodic variables, and binaries is available at
  https://zakamska.johnshopkins.edu/data.htm",,"10.1093/mnras/stab592",,"astro-ph.SR","http://arxiv.org/licenses/nonexclusive-distrib/1.0/","  The time-series component of WISE is a valuable resource for the study of
variable objects. We present an analysis of an all-sky sample of ~450,000
AllWISE+NEOWISE infrared light curves of likely variables identified in
AllWISE. By computing periodograms of all these sources, we identify ~56,000
periodic variables. Of these, ~42,000 are short-period (P<1 day), near-contact
or contact eclipsing binaries, many of which are on the main sequence. We use
the periodic and aperiodic variables to test computationally inexpensive
methods of periodic variable classification and identification, utilizing
various measures of the probability distribution function of fluxes and of
timescales of variability. The combination of variability measures from our
periodogram and non-parametric analyses with infrared colors from WISE and
absolute magnitudes, colors and variability amplitude from Gaia is useful for
the identification and classification of periodic variables. Furthermore, we
show that the effectiveness of non-parametric methods for the identification of
periodic variables is comparable to that of the periodogram but at a much lower
computational cost. Future surveys can utilize these methods to accelerate more
traditional time-series analyses and to identify evolving sources missed by
periodogram-based selections.
","[{""version"":""v1"",""created"":""Tue, 8 Dec 2020 19:25:51 GMT""},{""version"":""v2"",""created"":""Thu, 25 Feb 2021 14:58:12 GMT""}]","2021-04-06"
"2012.04691","Charuhas Waman Shiveshwarkar","Charuhas Shiveshwarkar, Drew Jamieson, and Marilena Loverde","Scale-dependent halo bias and the squeezed limit bispectrum in the
  presence of radiation","11 pages, 13 figures","Phys. Rev. D 103, 103503 (2021)","10.1103/PhysRevD.103.103503","YITP-SB-2020-38","astro-ph.CO","http://arxiv.org/licenses/nonexclusive-distrib/1.0/","  We investigate the gravitational effect of large-scale radiation
perturbations on small-scale structure formation. In addition to making the
growth of matter perturbations scale dependent, the free-streaming of radiation
also affects the coupling between structure formation at small and large
scales. We study this using Separate Universe N-body simulations to compute the
(isotropized) squeezed-limit matter bispectrum and the linear halo bias. Our
results show that the scale dependence in the growth of long-wavelength matter
perturbations, caused by radiation, translates into these quantities acquiring
a non-trivial scale-dependence at $k\lesssim 0.05$ Mpc$^{-1}$. In a universe
with radiation composed of cosmic microwave background photons and three
species of massless neutrinos, the bias of halos with $b = 2$ at high $k$ will
decrease by $0.29\%,\ 0.45\%$ and $0.8\%$ between $k = 0.05$ Mpc$^{-1}$ and $k
= 0.0005$ Mpc$^{-1}$ at redshifts $z=0,\ 1$, and $3$ respectively. For objects
with $b\gg1$, these differences approach $0.43\%,\ 0.68\%$ and $1.2\%$
respectively.
","[{""version"":""v1"",""created"":""Tue, 8 Dec 2020 19:26:02 GMT""}]","2021-05-12"
"2012.04692","Amish Goel","Amish Goel, Pierre Moulin","Locally optimal detection of stochastic targeted universal adversarial
  perturbations","Submitted to ICASSP 2021",,,,"cs.CV","http://creativecommons.org/licenses/by-nc-nd/4.0/","  Deep learning image classifiers are known to be vulnerable to small
adversarial perturbations of input images. In this paper, we derive the locally
optimal generalized likelihood ratio test (LO-GLRT) based detector for
detecting stochastic targeted universal adversarial perturbations (UAPs) of the
classifier inputs. We also describe a supervised training method to learn the
detector's parameters, and demonstrate better performance of the detector
compared to other detection methods on several popular image classification
datasets.
","[{""version"":""v1"",""created"":""Tue, 8 Dec 2020 19:27:39 GMT""}]","2020-12-10"
"2012.04693","Yohsuke Matsuzawa","Yohsuke Matsuzawa","Vojta's conjecture, heights associated with subschemes, and primitive
  prime divisors in arithmetic dynamics","30 pages",,,,"math.NT math.AG math.DS","http://arxiv.org/licenses/nonexclusive-distrib/1.0/","  Assuming Vojta's conjecture, we give a sufficient condition for the limit \[
\lim_{n \to \infty} \frac{h_{Y}(f^{n}(x))}{h_{H}(f^{n}(x))} \] is equal to
zero, where $f \colon X \longrightarrow X$ is a surjective self-morphism on a
smooth projective variety $X$, $h_{H}$ is an ample height function on $X$, and
$h_{Y}$ is a global height function associated with a closed subscheme $Y
\subset X$ of codimension at least two. Based on this, we propose a conjecture
on a sufficient condition for the limit to be zero. We point out that our
conjecture implies Dynamical Mordell-Lang conjecture for endomorphisms on
$\mathbb{P}^{2}_{\overline{\mathbb{Q}}}$. We also discuss applications of
Vojta's conjecture with truncated counting function to the problem of the
existence of primitive prime divisors of coordinates of orbits of $f$
","[{""version"":""v1"",""created"":""Tue, 8 Dec 2020 19:27:53 GMT""}]","2020-12-10"
"2012.04694","Salah Nasri","Hemza Azri and Salah Nasri","Scalar-Connection Gravity and Spontaneous Scalarization",,"Phys. Rev. D 103, 024035 (2021)","10.1103/PhysRevD.103.024035",,"gr-qc hep-th","http://arxiv.org/licenses/nonexclusive-distrib/1.0/","  Scalar-tensor theories of gravity are known to allow significant deviations
from general relativity through various astrophysical phenomena. In this paper,
we formulate a scalar-connection gravity by setting up scalars and connection
configurations instead of metric. Since the matter sector is not
straightforward to conceive without a metric, we invoke cosmological fluids in
terms of their one-form velocity in the volume element of the invariant action.
This leads to gravitational equations with a perfect fluid source and a
generated metric, which are expected to produce reasonable deviations from
general relativity in the strong-field regime. As a relevant application, we
study spontaneous scalarization mechanism and show that the
Damour-Esposito-Far\`{e}se model arises in a certain class of scalar-connection
gravity. Furthermore, we investigate a general study in which the present
framework becomes distinguishable from the famed scalar-tensor theories.
","[{""version"":""v1"",""created"":""Tue, 8 Dec 2020 19:28:00 GMT""},{""version"":""v2"",""created"":""Wed, 20 Jan 2021 17:28:46 GMT""}]","2021-01-21"
"2012.04695","Zachary Stier","Zachary Stier","Short paths in PU(2)",,,,,"math.NT math.GR","http://arxiv.org/licenses/nonexclusive-distrib/1.0/","  Parzanchevski and Sarnak recently adapted an algorithm of Ross and Selinger
for factorization of PU(2)-diagonal elements to within distance $\varepsilon$
into an efficient probabilistic algorithm for any PU(2)-element, using at most
$3\log_p\frac{1}{\varepsilon^3}$ factors from certain well-chosen sets. The
Clifford+$T$ gates are one such set arising from $p=2$. In that setting, we
leverage recent work of Carvalho Pinto and Petit to improve this to
$\frac{7}{3}\log_2\frac{1}{\varepsilon^3}$, and implement the algorithm in
Haskell.
","[{""version"":""v1"",""created"":""Tue, 8 Dec 2020 19:28:28 GMT""}]","2020-12-10"
"2012.04696","Jaime Paradela","Marcel Guardia, Jaime Paradela, Tere-M. Seara and Claudio Vidal","Symbolic Dynamics in the Elliptic Isosceles Restricted Three Body
  Problem","26 pages, 3 figures",,"10.1016/j.jde.2021.05.017",,"math.DS","http://arxiv.org/licenses/nonexclusive-distrib/1.0/","  The elliptic isosceles restricted three body problem (REI3BP) models the
motion of a massless body under the influence of the Newtonian gravitational
force caused by two other bodies called the primaries. The primaries of masses
$m_{1}=m_{2}$ move along a degenerate Keplerian elliptic collision orbit (on a
line) under their gravitational attraction, whereas the third, massless
particle, moves on the plane perpendicular to their line of motion and passing
through the center of mass of the primaries. By symmetry, the component of the
angular momentum $G$ of the massless particle along the direction of the line
of the primaries is conserved.
  We show the existence of symbolic dynamics in the REI3BP for large $G$ by
building a Smale horseshoe on a certain subset of the phase space. As a
consequence we deduce that the REI3BP possesses oscillatory motions, namely
orbits which leave every bounded region but return infinitely often to some
fixed bounded region. The proof relies on the existence of transversal
homoclinic connections associated to an invariant manifold at infinity. Since
the distance between the stable and unstable manifolds of infinity is
exponentially small, Melnikov theory does not apply.
","[{""version"":""v1"",""created"":""Tue, 8 Dec 2020 19:29:00 GMT""},{""version"":""v2"",""created"":""Mon, 31 May 2021 08:05:04 GMT""}]","2021-06-01"
"2012.04697","Mengtao Tang","Mengtao Tang, Daniel Stark, Jacopo Chevallard, Stephane Charlot, Ryan
  Endsley and Enrico Congiu","Lyman-alpha spectroscopy of extreme [OIII] emitting galaxies at
  $z\simeq2-3$: Implications for Ly$\alpha$ visibility and LyC leakage at $z>6$","13 pages, 8 figure, accepted by MNRAS",,"10.1093/mnras/stab705",,"astro-ph.GA","http://arxiv.org/licenses/nonexclusive-distrib/1.0/","  Spectroscopic observations of massive $z>7$ galaxies selected to have
extremely large [OIII]+H$\beta$ equivalent width (EW $\sim1500$ \r{A}) have
recently revealed large Ly$\alpha$ detection rates, in contrast to the weak
emission seen in the general population. Why these systems are uniquely visible
in Ly$\alpha$ at redshifts where the IGM is likely significantly neutral is not
clear. With the goal of better understanding these results, we have begun a
campaign with MMT and Magellan to measure Ly$\alpha$ in galaxies with similar
[OIII]+H$\beta$ EWs at $z\simeq2-3$. At these redshifts, the IGM is highly
ionized, allowing us to clearly disentangle how the Ly$\alpha$ properties
depend on the [OIII]+H$\beta$ EW. Here we present Ly$\alpha$ EWs of $49$
galaxies at $z=2.2-3.7$ with intense [OIII]+H$\beta$ line emission (EW
$=300-3000$ \r{A}). Our results demonstrate that strong Ly$\alpha$ emission (EW
$>20$ \r{A}) becomes more common in galaxies with larger [OIII]+H$\beta$ EW,
reflecting a combination of increasingly efficient ionizing photon production
and enhanced transmission of Ly$\alpha$. Among the galaxies with the most
extreme [OIII]+H$\beta$ emission (EW $\sim1500$ \r{A}), we find that strong
Ly$\alpha$ emission is not ubiquitous, with only $50$ per cent of our
population showing Ly$\alpha$ EW $>20$ \r{A}. Our data suggest that the range
of Ly$\alpha$ strengths is related to the observed ellipticity, with those
systems that appear edge-on or elongated having weaker Ly$\alpha$ emission. We
use these results to interpret the anomalous Ly$\alpha$ properties seen in
$z>7$ galaxies with extreme [OIII]+H$\beta$ emission and discuss implications
for the escape of ionizing radiation from these extreme line emitting galaxies.
","[{""version"":""v1"",""created"":""Tue, 8 Dec 2020 19:34:01 GMT""},{""version"":""v2"",""created"":""Sat, 6 Mar 2021 16:07:48 GMT""}]","2021-03-17"
"2012.04698","Nishtha Madaan","Nishtha Madaan, Inkit Padhi, Naveen Panwar, Diptikalyan Saha","Generate Your Counterfactuals: Towards Controlled Counterfactual
  Generation for Text","Accepted at AAAI Conference on Artificial Intelligence (AAAI 2021)",,,,"cs.CL cs.AI cs.LG","http://arxiv.org/licenses/nonexclusive-distrib/1.0/","  Machine Learning has seen tremendous growth recently, which has led to larger
adoption of ML systems for educational assessments, credit risk, healthcare,
employment, criminal justice, to name a few. The trustworthiness of ML and NLP
systems is a crucial aspect and requires a guarantee that the decisions they
make are fair and robust. Aligned with this, we propose a framework GYC, to
generate a set of counterfactual text samples, which are crucial for testing
these ML systems. Our main contributions include a) We introduce GYC, a
framework to generate counterfactual samples such that the generation is
plausible, diverse, goal-oriented, and effective, b) We generate counterfactual
samples, that can direct the generation towards a corresponding condition such
as named-entity tag, semantic role label, or sentiment. Our experimental
results on various domains show that GYC generates counterfactual text samples
exhibiting the above four properties. GYC generates counterfactuals that can
act as test cases to evaluate a model and any text debiasing algorithm.
","[{""version"":""v1"",""created"":""Tue, 8 Dec 2020 19:34:53 GMT""},{""version"":""v2"",""created"":""Wed, 17 Mar 2021 18:24:46 GMT""}]","2021-03-19"
"2012.04699","David Saranchak","Daniel L. Felps, Amelia D. Schwickerath, Joyce D. Williams, Trung N.
  Vuong, Alan Briggs, Matthew Hunt, Evan Sakmar, David D. Saranchak, Tyler
  Shumaker","Class Clown: Data Redaction in Machine Unlearning at Enterprise Scale","8 pages, 7 figures",,,,"cs.CR","http://creativecommons.org/licenses/by/4.0/","  Individuals are gaining more control of their personal data through recent
data privacy laws such the General Data Protection Regulation and the
California Consumer Privacy Act. One aspect of these laws is the ability to
request a business to delete private information, the so called ""right to be
forgotten"" or ""right to erasure"". These laws have serious financial
implications for companies and organizations that train large, highly accurate
deep neural networks (DNNs) using these valuable consumer data sets. However, a
received redaction request poses complex technical challenges on how to comply
with the law while fulfilling core business operations. We introduce a DNN
model lifecycle maintenance process that establishes how to handle specific
data redaction requests and minimize the need to completely retrain the model.
Our process is based upon the membership inference attack as a compliance tool
for every point in the training set. These attack models quantify the privacy
risk of all training data points and form the basis of follow-on data redaction
from an accurate deployed model; excision is implemented through incorrect
label assignment within incremental model updates.
","[{""version"":""v1"",""created"":""Tue, 8 Dec 2020 19:35:09 GMT""}]","2020-12-10"
"2012.04700","Yoonsuck Choe","Khuong Nguyen and Yoonsuck Choe","Emergence of Different Modes of Tool Use in a Reaching and Dragging Task","11 pages, 10 figures, 14 pdf-embedded animations",,,,"cs.RO cs.AI cs.LG cs.NE","http://creativecommons.org/licenses/by-sa/4.0/","  Tool use is an important milestone in the evolution of intelligence. In this
paper, we investigate different modes of tool use that emerge in a reaching and
dragging task. In this task, a jointed arm with a gripper must grab a tool (T,
I, or L-shaped) and drag an object down to the target location (the bottom of
the arena). The simulated environment had real physics such as gravity and
friction. We trained a deep-reinforcement learning based controller (with raw
visual and proprioceptive input) with minimal reward shaping information to
tackle this task. We observed the emergence of a wide range of unexpected
behaviors, not directly encoded in the motor primitives or reward functions.
Examples include hitting the object to the target location, correcting error of
initial contact, throwing the tool toward the object, as well as normal
expected behavior such as wide sweep. Also, we further analyzed these behaviors
based on the type of tool and the initial position of the target object. Our
results show a rich repertoire of behaviors, beyond the basic built-in
mechanisms of the deep reinforcement learning method we used.
","[{""version"":""v1"",""created"":""Tue, 8 Dec 2020 19:37:58 GMT""}]","2020-12-10"
