"2002.06560","Leonardo Cabrer","Leonardo M. Cabrer and Hilary A. Priestley","Piggybacking over unbounded distributive lattices",,,,,"math.RA","http://arxiv.org/licenses/nonexclusive-distrib/1.0/","  This paper fills a gap in the literature on natural duality theory. It
concerns dual representations of categories of distributive-lattice-based
algebras in which the lattice reducts are not assumed to have bounds. The
development of theory to parallel what is known for the exhaustively-studied
bounded case was initially driven by need. This arose in connection with a
major investigation of Sugihara algebras and Sugihara monoids. The theorems in
this paper apply in a systematic way to a range of examples:varieties of
Sugihara type; other classes of algebras previously treated ad hoc; and further
classes as required.
","[{""version"":""v1"",""created"":""Sun, 16 Feb 2020 12:01:44 GMT""}]","2020-02-18"
"2002.06561","Li Shen","Enneng Yang, Xin Xin, Li Shen and Guibing Guo","Generalized Embedding Machines for Recommender Systems","8 pages",,,,"cs.LG cs.IR stat.ML","http://arxiv.org/licenses/nonexclusive-distrib/1.0/","  Factorization machine (FM) is an effective model for feature-based
recommendation which utilizes inner product to capture second-order feature
interactions. However, one of the major drawbacks of FM is that it couldn't
capture complex high-order interaction signals. A common solution is to change
the interaction function, such as stacking deep neural networks on the top of
FM. In this work, we propose an alternative approach to model high-order
interaction signals in the embedding level, namely Generalized Embedding
Machine (GEM). The embedding used in GEM encodes not only the information from
the feature itself but also the information from other correlated features.
Under such situation, the embedding becomes high-order. Then we can incorporate
GEM with FM and even its advanced variants to perform feature interactions.
More specifically, in this paper we utilize graph convolution networks (GCN) to
generate high-order embeddings. We integrate GEM with several FM-based models
and conduct extensive experiments on two real-world datasets. The results
demonstrate significant improvement of GEM over corresponding baselines.
","[{""version"":""v1"",""created"":""Sun, 16 Feb 2020 12:03:18 GMT""}]","2020-02-19"
"2002.06562","Luigi Bonati","Luigi Bonati, Valerio Rizzi and Michele Parrinello","Data-Driven Collective Variables for Enhanced Sampling",,"J. Phys. Chem. Lett. 2020, 11, 2998-3004","10.1021/acs.jpclett.0c00535",,"physics.chem-ph physics.comp-ph","http://arxiv.org/licenses/nonexclusive-distrib/1.0/","  Designing an appropriate set of collective variables is crucial to the
success of several enhanced sampling methods. Here we focus on how to obtain
such variables from information limited to the metastable states. We
characterize these states by a large set of descriptors and employ neural
networks to compress this information in a lower-dimensional space, using
Fisher's linear discriminant as an objective function to maximize the
discriminative power of the network. We test this method on alanine dipeptide,
using the non-linearly separable dataset composed by atomic distances. We then
study an intermolecular aldol reaction characterized by a concerted mechanism.
The resulting variables are able to promote sampling by drawing non-linear
paths in the physical space connecting the fluctuations between metastable
basins. Lastly, we interpret the behavior of the neural network by studying its
relation to the physical variables. Through the identification of its most
relevant features, we are able to gain chemical insight into the process.
","[{""version"":""v1"",""created"":""Sun, 16 Feb 2020 12:04:53 GMT""},{""version"":""v2"",""created"":""Tue, 7 Apr 2020 14:40:04 GMT""}]","2020-04-08"
"2002.06563","Liu Hong","Liangrong Peng, Wuyue Yang, Dongyan Zhang, Changjing Zhuge, Liu Hong","Epidemic analysis of COVID-19 in China by dynamical modeling","11 pages, 6 figures, 1 table",,,,"q-bio.PE","http://arxiv.org/licenses/nonexclusive-distrib/1.0/","  The outbreak of novel coronavirus-caused pneumonia (COVID-19) in Wuhan has
attracted worldwide attention. Here, we propose a generalized SEIR model to
analyze this epidemic. Based on the public data of National Health Commission
of China from Jan. 20th to Feb. 9th, 2020, we reliably estimate key epidemic
parameters and make predictions on the inflection point and possible ending
time for 5 different regions. According to optimistic estimation, the epidemics
in Beijing and Shanghai will end soon within two weeks, while for most part of
China, including the majority of cities in Hubei province, the success of
anti-epidemic will be no later than the middle of March. The situation in Wuhan
is still very severe, at least based on public data until Feb. 15th. We expect
it will end up at the beginning of April. Moreover, by inverse inference, we
find the outbreak of COVID-19 in Mainland, Hubei province and Wuhan all can be
dated back to the end of December 2019, and the doubling time is around two
days at the early stage.
","[{""version"":""v1"",""created"":""Sun, 16 Feb 2020 12:16:17 GMT""},{""version"":""v2"",""created"":""Thu, 25 Jun 2020 12:26:16 GMT""}]","2020-06-26"
"2002.06564","Ayelet Mizrahi","Ayelet Mizrahi and Aviv Zohar","Congestion Attacks in Payment Channel Networks",,,,,"cs.CR","http://arxiv.org/licenses/nonexclusive-distrib/1.0/","  Payment channel networks provide a fast and scalable solution to relay funds,
acting as a second layer to slower and less scalable blockchain protocols. In
this paper, we present an accessible, low-cost attack in which the attacker
paralyzes multiple payment network channels for several days. The attack is
based on overloading channels with requests that are kept unresolved until
their expiration time. Reaching the maximum allowed unresolved requests (HTLCs)
locks the channel for new payments. The attack is in fact inherent to the way
off-chain networks are constructed, since limits on the number of unresolved
payments are derived from limits on the blockchain. We consider three main
versions of the attack: one in which the attacker attempts to block as many
high liquidity channels as possible, one in which it disconnects as many pairs
of nodes as it can, and one in which it tries to isolate individual nodes from
the network. We evaluate the costs of these attacks on Bitcoin's Lightning
Network and compare how changes in the network have affected the cost of
attack. Specifically, we consider how recent changes to default parameters in
each of the main Lightning implementations contribute to the attacks. As we
evaluate the attacks, we also look at statistics on parameters in the Lightning
Network, which are of independent interest and compare the various
implementations of Lightning nodes. Finally, we suggest mitigation techniques
that make these attacks much harder to carry out.
","[{""version"":""v1"",""created"":""Sun, 16 Feb 2020 12:17:28 GMT""},{""version"":""v2"",""created"":""Thu, 18 Jun 2020 18:03:57 GMT""},{""version"":""v3"",""created"":""Wed, 25 Nov 2020 15:16:26 GMT""},{""version"":""v4"",""created"":""Sun, 31 Jan 2021 14:25:53 GMT""}]","2021-02-02"
"2002.06565","Zhan Li","Zhan Li","Boundedness of the base varieties of certain fibrations","26 pages",,,,"math.AG","http://arxiv.org/licenses/nonexclusive-distrib/1.0/","  It is conjectured that the base varieties of the Iitaka fibrations are
bounded when the Iitaka volumes are bounded above. We confirm this conjecture
for Iitaka $\epsilon$-lc Fano type fibrations.
","[{""version"":""v1"",""created"":""Sun, 16 Feb 2020 12:25:48 GMT""},{""version"":""v2"",""created"":""Tue, 5 May 2020 08:59:58 GMT""},{""version"":""v3"",""created"":""Wed, 25 Jan 2023 05:21:53 GMT""}]","2023-01-26"
"2002.06566","Jacqueline den Hartogh","J.W. den Hartogh, P. Eggenberger, S. Deheuvels","Asteroseismology of evolved stars to constrain the internal transport of
  angular momentum. III. Using the rotation rates of intermediate-mass stars to
  test the Fuller-formalism","Accepted in A&A as letter (reference: AA/2020/37568)","A&A 634, L16 (2020)","10.1051/0004-6361/202037568",,"astro-ph.SR","http://arxiv.org/licenses/nonexclusive-distrib/1.0/","  Context: The internal characteristics of stars, such as their core rotation
rates, are obtained via asteroseismic observations. A comparison of core
rotation rates found in this way with core rotation rates as predicted by
stellar evolution models demonstrate a large discrepancy. This means that there
must be a process of angular momentum transport missing in the current theory
of stellar evolution. A new formalism was recently proposed to fill in for this
missing process, which has the Tayler instability as its starting point
(hereafter referred to as `Fuller-formalism'). Aims: We investigate the effect
of the Fuller-formalism on the internal rotation of stellar models with an
initial mass of 2.5 Mo. Methods: Stellar evolution models, including the
Fuller-formalism, of intermediate-mass stars were calculated to make a
comparison between asteroseismically obtained core rotation rates in the core
He burning phase and in the white dwarf phase. Results: Our main results show
that models including the Fuller-formalism can match the core rotation rates
obtained for the core He burning phases. However, these models are unable to
match the rotation rates obtained for white dwarfs. When we exclude the
Fuller-formalism at the end of the core He burning phase, the white dwarf
rotation rates of the models match the observed rates. Conclusions: We conclude
that in the present form, the Fuller-formalism cannot be the sole solution for
the missing process of angular momentum transport in intermediate-mass stars.
","[{""version"":""v1"",""created"":""Sun, 16 Feb 2020 12:26:33 GMT""}]","2020-02-26"
"2002.06567","Jiajun Xian","Jiajun Xian, Dan Yang, Liming Pan, Wei Wang","The optimal edge for containing the spreading of SIS model",,,"10.1088/1742-5468/ab780d",,"physics.soc-ph","http://arxiv.org/licenses/nonexclusive-distrib/1.0/","  Numerous real-world systems, for instance, the communication platforms and
transportation systems, can be abstracted into complex networks. Containing
spreading dynamics (e.g., epidemic transmission and misinformation propagation)
in networked systems is a hot topic in multiple fronts. Most of the previous
strategies are based on the immunization of nodes. However, sometimes, these
node--based strategies can be impractical. For instance, in the train
transportation networks, it is dramatic to isolating train stations for flu
prevention. On the contrary, temporarily suspending some connections between
stations is more acceptable. Thus, we pay attention to the edge-based
containing strategy. In this study, we develop a theoretical framework to find
the optimal edge for containing the spreading of the
susceptible-infected-susceptible model on complex networks. In specific, by
performing a perturbation method to the discrete-Markovian-chain equations of
the SIS model, we derive a formula that approximately provides the decremental
outbreak size after the deactivation of a certain edge in the network. Then, we
determine the optimal edge by simply choosing the one with the largest
decremental outbreak size. Note that our proposed theoretical framework
incorporates the information of both network structure and spreading dynamics.
Finally, we test the performance of our method by extensive numerical
simulations. Results demonstrate that our strategy always outperforms other
strategies based only on structural properties (degree or edge betweenness
centrality). The theoretical framework in this study can be extended to other
spreading models and offers inspirations for further investigations on
edge-based immunization strategies.
","[{""version"":""v1"",""created"":""Sun, 16 Feb 2020 12:37:32 GMT""}]","2020-06-24"
"2002.06568","Zhiyuan Huang","Yifei Chen, Zhiyuan Huang, Fei Yu, Dakun Wu, Jianhua Fu, Ding Wang,
  Meng Pang, Yuxin Leng, and Zhizhan Xu","Photoionization-assisted, high-efficiency emission of dispersive wave in
  gas-filled hollow-core photonic crystal fibers",,,"10.1364/OE.393959",,"physics.optics","http://arxiv.org/licenses/nonexclusive-distrib/1.0/","  We demonstrate that the phase-matched dispersive wave (DW) emission within
the resonance band of a 25-cm-long gas-filled hollow-core photonic crystal
fiber (HC-PCF) can be strongly enhanced by the photoionization effect of the
pump pulse. In the experiments we observe that as the pulse energy increases,
the pump pulse gradually shifts to shorter wavelengths due to soliton-plasma
interactions. When the central wavelength of the blueshifting soliton is close
to the resonance band of the HC-PCF, high-efficiency energy transfer from the
pump light to the DW in the visible region can be obtained. During this DW
emission process, we also observe that the spectral center of the DW gradually
shifts to longer wavelengths leading to a slightly-increased DW bandwidth,
which can be well explained as the consequence of phase-matched coupling
between the pump pulse and the DW. In particular, at an input pulse energy of 6
uJ, the spectral ratio of the DW at the fiber output is measured to be as high
as ~53% together with a conversion efficiency of ~19%. These experimental
results, explained by numerical simulations, pave the way to high-brightness
light sources based on high-efficiency frequency-upconversion processes in
gas-filled HC-PCFs.
","[{""version"":""v1"",""created"":""Sun, 16 Feb 2020 12:37:58 GMT""}]","2020-06-24"
"2002.06569","Stergios Katsanoulis","George Haller, Stergios Katsanoulis, Markus Holzner, Bettina
  Frohnapfel, Davide Gatti","Objective barriers to the transport of dynamically active vector fields","50 pages, 40 figures, to be published in J. Fluid. Mech","J. Fluid Mech. 905 (2020) A17","10.1017/jfm.2020.737",,"physics.flu-dyn math.DS nlin.CD","http://arxiv.org/licenses/nonexclusive-distrib/1.0/","  We derive a theory for material surfaces that maximally inhibit the diffusive
transport of a dynamically active vector field, such as the linear momentum,
the angular momentum or the vorticity, in general fluid flows. These special
material surfaces (\emph{Lagrangian active barriers}) provide physics-based,
observer-independent boundaries of dynamically active coherent structures. We
find that Lagrangian active barriers evolve from invariant surfaces of an
associated steady and incompressible \emph{barrier equation}, whose right-hand
side is the time-averaged pullback of the viscous stress terms in the evolution
equation for the dynamically active vector field. Instantaneous limits of these
barriers mark objective \emph{Eulerian active barriers} to the short-term
diffusive transport of the dynamically active vector field. We obtain that in
unsteady Beltrami flows, Lagrangian and Eulerian active barriers coincide
exactly with purely advective transport barriers bounding observed coherent
structures. In more general flows, active barriers can be identified by
applying Lagrangian coherent structure (LCS) diagnostics, such as the
finite-time Lyapunov exponent and the polar rotation angle, to the appropriate
active barrier equation. In comparison to their passive counterparts, these
\emph{active LCS diagnostics} require no significant fluid particle separation
and hence provide substantially higher-resolved Lagrangian and Eulerian
coherent structure boundaries from temporally shorter velocity data sets. We
illustrate these results and their physical interpretation on two-dimensional,
homogeneous, isotropic turbulence and on a three-dimensional turbulent channel
flow.
","[{""version"":""v1"",""created"":""Sun, 16 Feb 2020 12:43:38 GMT""},{""version"":""v2"",""created"":""Thu, 16 Jul 2020 16:15:38 GMT""},{""version"":""v3"",""created"":""Tue, 1 Sep 2020 13:05:17 GMT""}]","2020-10-28"
"2002.06570","Ulrich Kuhl","Do Hyeok Jeon, Mattis Reisner, Fabrice Mortessagne, Tsampikos Kottos,
  Ulrich Kuhl","Non-Hermitian CT-Symmetric Spectral Protection of Nonlinear Defect Modes","9 pages, 5 figures including supplement","Phys. Rev. Lett. 125, 113901 (2020)","10.1103/PhysRevLett.125.113901",,"physics.app-ph nlin.CD physics.optics","http://arxiv.org/licenses/nonexclusive-distrib/1.0/","  We investigate, using a microwave platform consisting of a non-Hermitian
Su-Schrieffer-Heeger array of coupled dielectric resonators, the interplay of a
lossy nonlinearity and CT-symmetry in the formation of defect modes. The
measurements agree with the theory which predicts that, up to moderate pumping,
the defect mode is an eigenstate of the CT-symmetric operator and retains its
frequency at the center of the gap. At higher pumping values, the system
undergoes a self-induced explicit \CT-symmetry violation which removes the
spectral topological protection and alters the shape of the defect mode.
","[{""version"":""v1"",""created"":""Sun, 16 Feb 2020 12:45:58 GMT""}]","2020-09-16"
"2002.06571","Alessandro Pastore","A. Mantziris and A. Pastore and I. Vida\~na and D. P. Watts and M.
  Bashkanov and A. M. Romero","Neutron star matter equation of state including $d^*$-hexaquark degrees
  of freedom",,,"10.1051/0004-6361/202037749",,"nucl-th nucl-ex","http://arxiv.org/licenses/nonexclusive-distrib/1.0/","  We present an extension of a previous work where, assuming a simple free
bosonic gas supplemented with a relativistic meand field model to describe the
pure nucleonic part of the EoS, we studied the consequences that the first
non-trivial hexaquark $d^*$(2380) could have on the properties of neutron
stars. Compared to that exploratory work we employ a standard non-linear
Walecka model including additional terms that describe the interaction of the
$d^*(2380)$ di-baryon with the other particles of the system through the
exchange of $\sigma$- and $\omega$-meson fields. Our results have show that the
presence of the $d^*(2380)$ leads to maximum masses compatible with the recent
observations of $\sim 2$M$_\odot$ millisecond pulsars if the interaction of the
$d^*(2380)$ is slightly repulsive or the $d^*(2380)$ does not interacts at all.
An attractive interaction makes the equation of state too soft to be able to
support a $2$M$_\odot$ neutron star whereas an extremely repulsive one induces
the collapse of the neutron star into a black hole as soon as the $d^*(2380)$
appears.
","[{""version"":""v1"",""created"":""Sun, 16 Feb 2020 13:01:05 GMT""}]","2020-06-17"
"2002.06572","Matthias Sei{\ss}","Werner M. Seiler and Matthias Seiss","Singular Initial Value Problems for Scalar Quasi-Linear Ordinary
  Differential Equations","31 pages, 2 figures",,,,"math.DS","http://arxiv.org/licenses/nonexclusive-distrib/1.0/","  We discuss existence, non-uniqueness and regularity of one- and two-sided
solutions of initial value problems for scalar quasi-linear ordinary
differential equations where the initial condition corresponds to an impasse
point of the equation. With a differential geometric approach, we reduce the
problem to questions in dynamical systems theory. As an application, we discuss
in detail second-order equations of the form $g(x)u''=f(x,u,u')$ with an
initial condition imposed at a simple zero of $g$. This generalises results by
Liang and also makes them more transparent via our geometric approach.
","[{""version"":""v1"",""created"":""Sun, 16 Feb 2020 13:11:13 GMT""},{""version"":""v2"",""created"":""Fri, 21 Aug 2020 11:48:49 GMT""}]","2020-08-24"
"2002.06573","Pardyumn Kumar Sahoo","I. Radinschi, P.K. Sahoo, Th. Grammenos, S. Chattopadhyay and M. M.
  Cazacu","Localization of Energy and Momentum in an Asymptotically
  Reissner-Nordstr\""om Non-singular Black Hole Space-time Geometry","To appear in Universe","Universe, 6(5) (2020) 69","10.3390/universe6050069",,"gr-qc hep-th","http://arxiv.org/licenses/nonexclusive-distrib/1.0/","  The space-time geometry exterior to a new four-dimensional, spherically
symmetric and charged black hole solution that, through a coupling of general
relativity with a non-linear electrodynamics, is everywhere non-singular, for
small $r$ it behaves as a de Sitter metric, and asymptotically it behaves as
the Reissner-Nordstr\""{o}m metric, is considered in order to study the
energy-momentum localization. For the calculation of the energy and momentum
distributions, the Einstein, Landau-Lifshitz, Weinberg and M\o ller
energy-momentum complexes have been applied. The results obtained show that in
all prescriptions the energy depends on the mass $M$ of the black hole, the
charge $q$, two parameters $% a\in \mathbb{Z}^+$ and $\gamma\in \mathbb{R}^+$,
and on the radial coordinate $r$. The calculations performed in each
prescription show that all the momenta vanish. Additionally, some limiting and
particular cases for $r$ and $q$ are studied, and a possible connection with
strong gravitational lensing and micro lensing is attempted.
","[{""version"":""v1"",""created"":""Sun, 16 Feb 2020 13:11:18 GMT""},{""version"":""v2"",""created"":""Thu, 21 May 2020 06:13:44 GMT""}]","2020-05-26"
"2002.06574","Tatsuya Usuki","Tatsuya Usuki","Wave scattering in frequency domain","55 pages, 8 figures, v6 revised a typo of eq.6.4, v5 revised a typo
  in sec.6.1, v4 revised eq.6.6 and app.H, v3 revised typos in ch.4, v2 revised
  eq.3.7",,,,"physics.comp-ph cond-mat.mes-hall physics.optics","http://arxiv.org/licenses/nonexclusive-distrib/1.0/","  This report shows formulation of wave scattering in frequency domain. The
formulation provides an understanding of S-matrix solver which is named as
Scattering Matrix Analyzer (SMatrAn).
  The S-matrix has the whole of amplitude and phase information for reflected
and transmitted waves from a complicated scatterer. Accurate S-matrix leads to
quantitative evaluation of scattering wave.
  We can understand all formulas for the SMatrAn after reading this report. The
S-matrix provided by SMatrAn will give us detailed analysis on complicated
scattering in optical structure.
","[{""version"":""v1"",""created"":""Sun, 16 Feb 2020 13:18:16 GMT""},{""version"":""v2"",""created"":""Wed, 4 Mar 2020 13:09:40 GMT""},{""version"":""v3"",""created"":""Sat, 7 Mar 2020 14:28:03 GMT""},{""version"":""v4"",""created"":""Sun, 1 Nov 2020 11:10:13 GMT""},{""version"":""v5"",""created"":""Thu, 11 Feb 2021 04:56:35 GMT""},{""version"":""v6"",""created"":""Wed, 14 Apr 2021 12:32:56 GMT""}]","2021-04-15"
"2002.06575","Udit Singh Parihar","Sai Shubodh Puligilla, Satyajit Tourani, Tushar Vaidya, Udit Singh
  Parihar, Ravi Kiran Sarvadevabhatla and K. Madhava Krishna","Topological Mapping for Manhattan-like Repetitive Environments","Accepted to ICRA 2020. Project Page:
  https://github.com/Shubodh/ICRA2020",,,,"cs.CV cs.RO","http://arxiv.org/licenses/nonexclusive-distrib/1.0/","  We showcase a topological mapping framework for a challenging indoor
warehouse setting. At the most abstract level, the warehouse is represented as
a Topological Graph where the nodes of the graph represent a particular
warehouse topological construct (e.g. rackspace, corridor) and the edges denote
the existence of a path between two neighbouring nodes or topologies. At the
intermediate level, the map is represented as a Manhattan Graph where the nodes
and edges are characterized by Manhattan properties and as a Pose Graph at the
lower-most level of detail. The topological constructs are learned via a Deep
Convolutional Network while the relational properties between topological
instances are learnt via a Siamese-style Neural Network. In the paper, we show
that maintaining abstractions such as Topological Graph and Manhattan Graph
help in recovering an accurate Pose Graph starting from a highly erroneous and
unoptimized Pose Graph. We show how this is achieved by embedding topological
and Manhattan relations as well as Manhattan Graph aided loop closure relations
as constraints in the backend Pose Graph optimization framework. The recovery
of near ground-truth Pose Graph on real-world indoor warehouse scenes vindicate
the efficacy of the proposed framework.
","[{""version"":""v1"",""created"":""Sun, 16 Feb 2020 13:20:28 GMT""},{""version"":""v2"",""created"":""Sat, 22 Feb 2020 00:35:32 GMT""},{""version"":""v3"",""created"":""Tue, 10 Mar 2020 16:11:21 GMT""}]","2020-03-11"
"2002.06576","Alex Corbett","Michele Gintoli, Sharika Mohanan, Patrick Salter, Elizabeth Williams,
  James D. Beard, Gaspar Jekely, and Alexander D. Corbett","Spinning Disk -- Remote Focusing Microscopy","16 pages, 9 figures, 18 references",,"10.1364/BOE.389904",,"physics.optics physics.bio-ph physics.med-ph","http://arxiv.org/licenses/nonexclusive-distrib/1.0/","  Fast confocal imaging was achieved by combining remote focusing with
differential spinning disk optical sectioning to rapidly acquire images of live
samples at cellular resolution. Axial and lateral full width half maxima less
than 5 um and 490 nm respectively are demonstrated over 130 um axial range with
a 256 x 128 um field of view. A water-index calibration slide was used to
achieve an alignment that minimises image volume distortion. Application to
live biological samples was demonstrated by acquiring image volumes over a 24
um axial range at 1 volume/s, allowing for the detection of calcium-based
neuronal activity in Platynereis dumerilii larvae.
","[{""version"":""v1"",""created"":""Sun, 16 Feb 2020 13:24:57 GMT""}]","2020-09-28"
