"2002.06507","Fei Dong","Fei Dong and Keyou You and Lihua Xie and Qinglei Hu","Coordinate-free Circumnavigation of a Moving Target via a PD-like
  Controller","13 pages,17 figures",,"10.1109/TAES.2021.3127858",,"eess.SY cs.SY","http://arxiv.org/licenses/nonexclusive-distrib/1.0/","  This paper proposes a coordinate-free controller for a nonholonomic vehicle
to circumnavigate a fully-actuated moving target by using range-only
measurements. If the range rate is available, our Proportional Derivative
(PD)-like controller has a simple structure as the standard PD controller,
except the design of an additive constant bias and a saturation function in the
error feedback. We show that if the target is stationary, the vehicle
asymptotically encloses the target with a predefined radius at an exponential
convergence rate, i.e., an exact circumnavigation pattern can be completed. For
a moving target, the circumnavigation error converges to a small region whose
size is shown proportional to the maneuverability of the target, e.g., the
maximum linear speed and acceleration. Moreover, we design a second-order
sliding mode (SOSM) filter to estimate the range rate and show that the SOSM
filter can recover the range rate in a finite time. Finally, the effectiveness
and advantages of our controller are validated via both numerical simulations
and real experiments.
","[{""version"":""v1"",""created"":""Sun, 16 Feb 2020 05:10:05 GMT""},{""version"":""v2"",""created"":""Sun, 7 Feb 2021 08:40:52 GMT""},{""version"":""v3"",""created"":""Sun, 14 Nov 2021 03:25:18 GMT""}]","2021-11-16"
"2002.06508","Tongliang Liu","Songhua Wu, Xiaobo Xia, Tongliang Liu, Bo Han, Mingming Gong, Nannan
  Wang, Haifeng Liu, Gang Niu","Multi-Class Classification from Noisy-Similarity-Labeled Data",,,,,"cs.LG stat.ML","http://arxiv.org/licenses/nonexclusive-distrib/1.0/","  A similarity label indicates whether two instances belong to the same class
while a class label shows the class of the instance. Without class labels, a
multi-class classifier could be learned from similarity-labeled pairwise data
by meta classification learning. However, since the similarity label is less
informative than the class label, it is more likely to be noisy. Deep neural
networks can easily remember noisy data, leading to overfitting in
classification. In this paper, we propose a method for learning from only
noisy-similarity-labeled data. Specifically, to model the noise, we employ a
noise transition matrix to bridge the class-posterior probability between clean
and noisy data. We further estimate the transition matrix from only noisy data
and build a novel learning system to learn a classifier which can assign
noise-free class labels for instances. Moreover, we theoretically justify how
our proposed method generalizes for learning classifiers. Experimental results
demonstrate the superiority of the proposed method over the state-of-the-art
method on benchmark-simulated and real-world noisy-label datasets.
","[{""version"":""v1"",""created"":""Sun, 16 Feb 2020 05:10:21 GMT""}]","2020-02-18"
"2002.06509","Mircea Andrecut Dr","M. Andrecut","Fast Time Series Detrending with Applications to Heart Rate Variability
  Analysis","15 pages, 4 figures","International Journal of Modern Physics, Vol. 30, No. 09, 1950069
  (2019)","10.1142/S0129183119500694",,"physics.data-an eess.SP","http://arxiv.org/licenses/nonexclusive-distrib/1.0/","  Here we discuss a new fast detrending method for the non-stationary RR time
series used in Heart Rate Variability analysis. The described method is based
on the diffusion equation, and we show numerically that it is equivalent to the
widely used Smoothing Priors Approach (SPA) and Wavelet Smoothing Approach
(WSA) methods. The speed of the proposed method is comparable to the WSA method
and it is several orders of magnitude faster than the SPA method, which makes
it suitable for very long time series analysis.
","[{""version"":""v1"",""created"":""Sun, 16 Feb 2020 05:30:02 GMT""}]","2020-02-18"
"2002.06510","Tamio Oguchi","Hiroshi Katsumoto, Kunihiko Yamauchi, and Tamio Oguchi","First-principles Study on Piezoelectricity and Spontaneous Polarization
  in Bi(Fe,Co)O3",,,"10.7566/JPSJ.90.124712",,"cond-mat.mtrl-sci","http://arxiv.org/licenses/nonexclusive-distrib/1.0/","  Solid solution BiFe1-xCoxO3 shows anti-ferromagnetic order and pyroelectric
order, simultaneously. It has been known that BiFe1-xCoxO3 exhibits a
structural phase transition between monoclinic and tetragonal phases as x
increases. This kinds of transition is often called morphotoropic phase
boundary, which is well known to take place in a representative piezoelectric
oxide, PbZr1-xTixO3. In order to theoretically understand the piezoelectric
property in BiFe1-xCoxO3, we performed ab-initio electronic-structure
calculations and studied the structural stability, the magnetic property, and
the electronic polarization by means of super-cell approach. It turns out that
the large electric polarization and the particular pyramidal coordination
suppress the response of the electric polarization under strain. A way to
enhance the piezoelectric effect in BiFe1-xCoxO3 is proposed.
","[{""version"":""v1"",""created"":""Sun, 16 Feb 2020 05:41:33 GMT""}]","2021-12-15"
"2002.06511","Udit Raha","Ghanashyam Meher and Udit Raha","${}_{\Lambda\Lambda}^{5}$H and ${}_{\Lambda\Lambda}^{5}$He Hypernuclei
  reexamined in Halo/Cluster Effective Theory","21 pages and 11 figures (Accepted in Physical Review C)","Phys. Rev. C 103, 014001 (2021)","10.1103/PhysRevC.103.014001",,"nucl-th","http://arxiv.org/licenses/nonexclusive-distrib/1.0/","  The J=1/2 iso-doublet double-$\Lambda$-hypernuclei, namely,
${}_{\Lambda\Lambda}^{5}$H and ${}_{\Lambda\Lambda}^{5}$He, are examined as the
three-body cluster states, $\Lambda\Lambda t$ ($t\equiv {}^3$H or triton) and
$\Lambda\Lambda h$ ($h\equiv {}^3$He or helion), respectively, in a model
independent framework utilizing pionless halo effective theory. Both singlet
and triplet states of the constituent $\Lambda T$ ($T\equiv t,h$) sub-system
are used in the elastic channel for the study of $_\Lambda^4$H$-\Lambda$ and
$_\Lambda^4$He$-\Lambda$ scattering processes. A prototypical leading order
investigation using a sharp momentum cut-off regulator, irrespective of the
type of the elastic channel chosen, yields almost identical cut-off dependence
of the three-body binding energy or the double-$\Lambda$-separation energy
($B_{\Lambda\Lambda}$) is obtained for the mirror partners, evidently
suggesting good isospin symmetry in these three-body systems. Subsequently,
upon normalization of our solutions to the integral equation with respect to a
single pair of input data from an {\it ab initio} potential model analysis for
each mirror hypernuclei, yields $B_{\Lambda\Lambda}$ which agrees fairly well
with various erstwhile regulator independent potential models for our choice of
the cut-off regulator, $\sim 200$ MeV. This is either consistent with pionless
effective theory or with its slightly augmented version with a hard scale
around $2m_\pi$, where low-energy $\Lambda$-$\Lambda$ interactions dominated by
$\pi\pi$ or $\sigma$-meson exchange. Finally, to demonstrate the predictability
of our effective theory, we present preliminary estimates of the S-wave
$\Lambda\Lambda T$ three-body scattering lengths and the $\Lambda$-separation
energies.
","[{""version"":""v1"",""created"":""Sun, 16 Feb 2020 05:49:37 GMT""},{""version"":""v2"",""created"":""Mon, 11 Jan 2021 15:41:07 GMT""}]","2021-01-27"
"2002.06512","Vinod Ganapathy","Rakesh Rajan Beck and Abhishek Vijeev and Vinod Ganapathy","Privaros: A Framework for Privacy-Compliant Delivery Drones",,,"10.1145/3372297.3417858",,"cs.CR cs.OS","http://arxiv.org/licenses/nonexclusive-distrib/1.0/","  We present Privaros, a framework to enforce privacy policies on drones.
Privaros is designed for commercial delivery drones, such as the ones that will
likely be used by Amazon Prime Air. Such drones visit a number of host
airspaces, each of which may have different privacy requirements. Privaros
provides an information flow control framework to enforce the policies of these
hosts on the guest delivery drones. The mechanisms in Privaros are built on top
of ROS, a middleware popular in many drone platforms. This paper presents the
design and implementation of these mechanisms, describes how policies are
specified, and shows that Privaros's policy specification can be integrated
with India's Digital Sky portal. Our evaluation shows that a drone running
Privaros can robustly enforce various privacy policies specified by hosts, and
that its core mechanisms only marginally increase communication latency and
power consumption.
","[{""version"":""v1"",""created"":""Sun, 16 Feb 2020 05:51:41 GMT""},{""version"":""v2"",""created"":""Wed, 5 Aug 2020 04:42:57 GMT""},{""version"":""v3"",""created"":""Thu, 13 Aug 2020 18:00:46 GMT""}]","2020-08-17"
"2002.06513","Xiulai Xu Prof","Weixuan Zhang, Xin Xie, Huiming Hao, Jianchen Dang, Shan Xiao, Shushu
  Shi, Haiqiao Ni, Zhichuan Niu, Can Wang, Kuijuan Jin, Xiangdong Zhang and
  Xiulai Xu","Low-threshold topological nanolasers based on second-order corner state","15 pages, 4 figures","Light: Science & Applications, 9, 109 (2020)","10.1038/s41377-020-00352-1",,"physics.optics","http://arxiv.org/licenses/nonexclusive-distrib/1.0/","  The topological lasers, which are immune to imperfections and disorders, have
been recently demonstrated based on many kinds of robust edge states, being
mostly at microscale. The realization of 2D on-chip topological nanolasers,
having the small footprint, low threshold and high energy efficiency, is still
to be explored. Here, we report on the first experimental demonstration of the
topological nanolaser with high performance in 2D photonic crystal slab. Based
on the generalized 2D Su-Schrieffer-Heeger model, a topological nanocavity is
formed with the help of the Wannier-type 0D corner state. Laser behaviors with
low threshold about 1 $\mu W$ and high spontaneous emission coupling factor of
0.25 are observed with quantum dots as the active material. Such performance is
much better than that of topological edge lasers and comparable to conventional
photonic crystal nanolasers. Our experimental demonstration of the
low-threshold topological nanolaser will be of great significance to the
development of topological nanophotonic circuitry for manipulation of photons
in classical and quantum regimes.
","[{""version"":""v1"",""created"":""Sun, 16 Feb 2020 05:57:27 GMT""},{""version"":""v2"",""created"":""Fri, 3 Apr 2020 09:10:05 GMT""}]","2020-07-01"
"2002.06514","Shubhankar Patankar","Shubhankar P. Patankar, Jason Z. Kim, Fabio Pasqualetti, and Danielle
  S. Bassett","Path-dependent connectivity, not modularity, consistently predicts
  controllability of structural brain networks","32 pages, 7 figures in main text, and 22 pages, 11 figures in
  supplement",,"10.1162/netn_a_00157",,"q-bio.NC","http://creativecommons.org/licenses/by/4.0/","  The human brain displays rich communication dynamics that are thought to be
particularly well-reflected in its marked community structure. Yet, the precise
relationship between community structure in structural brain networks and the
communication dynamics that can emerge therefrom is not well-understood. In
addition to offering insight into the structure-function relationship of
networked systems, such an understanding is a critical step towards the ability
to manipulate the brain's large-scale dynamical activity in a targeted manner.
We investigate the role of community structure in the controllability of
structural brain networks. At the region level, we find that certain network
measures of community structure are sometimes statistically correlated with
measures of linear controllability. However, we then demonstrate that this
relationship depends on the distribution of network edge weights. We highlight
the complexity of the relationship between community structure and
controllability by performing numerical simulations using canonical graph
models with varying mesoscale architectures and edge weight distributions.
Finally, we demonstrate that weighted subgraph centrality, a measure rooted in
the graph spectrum, and which captures higher-order graph architecture, is a
stronger and more consistent predictor of controllability. Our study
contributes to an understanding of how the brain's diverse mesoscale structure
supports transient communication dynamics.
","[{""version"":""v1"",""created"":""Sun, 16 Feb 2020 06:07:17 GMT""},{""version"":""v2"",""created"":""Tue, 14 Jul 2020 00:55:45 GMT""},{""version"":""v3"",""created"":""Fri, 18 Dec 2020 08:49:17 GMT""}]","2020-12-23"
"2002.06515","Xiaowen Shi","Xiaowen Shi, Xin Li, Caili Wu, Shuchen Kong, Jing Yang, Liang He","A Real-Time Deep Network for Crowd Counting",,"IEEE ICASSP 2020",,,"cs.CV","http://arxiv.org/licenses/nonexclusive-distrib/1.0/","  Automatic analysis of highly crowded people has attracted extensive attention
from computer vision research. Previous approaches for crowd counting have
already achieved promising performance across various benchmarks. However, to
deal with the real situation, we hope the model run as fast as possible while
keeping accuracy. In this paper, we propose a compact convolutional neural
network for crowd counting which learns a more efficient model with a small
number of parameters. With three parallel filters executing the convolutional
operation on the input image simultaneously at the front of the network, our
model could achieve nearly real-time speed and save more computing resources.
Experiments on two benchmarks show that our proposed method not only takes a
balance between performance and efficiency which is more suitable for actual
scenes but also is superior to existing light-weight models in speed.
","[{""version"":""v1"",""created"":""Sun, 16 Feb 2020 06:09:22 GMT""}]","2020-02-18"
"2002.06516","Amadou Diadie Ba","Ba Amadou Diadie and Lo Gane Samb","Conditional Shannon, R\'eyni, and Tsallis entropies estimation and
  asymptotic limits: discrete case","28 pages, 4 figures",,,,"math.ST stat.ME stat.TH","http://arxiv.org/licenses/nonexclusive-distrib/1.0/","  A method of estimating the joint probability mass function of a pair of
discrete random variables is described. This estimator is used to construct the
conditional Shannon-R\'eyni-Tsallis entropies estimates. From there almost sure
rates of convergence and asymptotic normality are established. The theorical
results are validated by simulations.
","[{""version"":""v1"",""created"":""Sun, 16 Feb 2020 06:15:48 GMT""}]","2020-02-18"
"2002.06517","Kyungsu Kim","Hyungjun Kim, Kyungsu Kim, Jinseok Kim, Jae-Joon Kim","BinaryDuo: Reducing Gradient Mismatch in Binary Activation Network by
  Coupling Binary Activations",,,,,"cs.LG stat.ML","http://arxiv.org/licenses/nonexclusive-distrib/1.0/","  Binary Neural Networks (BNNs) have been garnering interest thanks to their
compute cost reduction and memory savings. However, BNNs suffer from
performance degradation mainly due to the gradient mismatch caused by
binarizing activations. Previous works tried to address the gradient mismatch
problem by reducing the discrepancy between activation functions used at
forward pass and its differentiable approximation used at backward pass, which
is an indirect measure. In this work, we use the gradient of smoothed loss
function to better estimate the gradient mismatch in quantized neural network.
Analysis using the gradient mismatch estimator indicates that using higher
precision for activation is more effective than modifying the differentiable
approximation of activation function. Based on the observation, we propose a
new training scheme for binary activation networks called BinaryDuo in which
two binary activations are coupled into a ternary activation during training.
Experimental results show that BinaryDuo outperforms state-of-the-art BNNs on
various benchmarks with the same amount of parameters and computing cost.
","[{""version"":""v1"",""created"":""Sun, 16 Feb 2020 06:18:53 GMT""}]","2020-02-18"
"2002.06518","Jingwei Xin","Jingwei Xin, Nannan Wang, Xinrui Jiang, Jie Li, Xinbo Gao, Zhifeng Li","Facial Attribute Capsules for Noise Face Super Resolution","To appear in AAAI 2020",,,,"cs.CV","http://arxiv.org/licenses/nonexclusive-distrib/1.0/","  Existing face super-resolution (SR) methods mainly assume the input image to
be noise-free. Their performance degrades drastically when applied to
real-world scenarios where the input image is always contaminated by noise. In
this paper, we propose a Facial Attribute Capsules Network (FACN) to deal with
the problem of high-scale super-resolution of noisy face image. Capsule is a
group of neurons whose activity vector models different properties of the same
entity. Inspired by the concept of capsule, we propose an integrated
representation model of facial information, which named Facial Attribute
Capsule (FAC). In the SR processing, we first generated a group of FACs from
the input LR face, and then reconstructed the HR face from this group of FACs.
Aiming to effectively improve the robustness of FAC to noise, we generate FAC
in semantic, probabilistic and facial attributes manners by means of integrated
learning strategy. Each FAC can be divided into two sub-capsules: Semantic
Capsule (SC) and Probabilistic Capsule (PC). Them describe an explicit facial
attribute in detail from two aspects of semantic representation and probability
distribution. The group of FACs model an image as a combination of facial
attribute information in the semantic space and probabilistic space by an
attribute-disentangling way. The diverse FACs could better combine the face
prior information to generate the face images with fine-grained semantic
attributes. Extensive benchmark experiments show that our method achieves
superior hallucination results and outperforms state-of-the-art for very low
resolution (LR) noise face image super resolution.
","[{""version"":""v1"",""created"":""Sun, 16 Feb 2020 06:22:28 GMT""}]","2020-02-18"
"2002.06519","Janet van Niekerk Dr","Janet van Niekerk, Haakon Bakka and Haavard Rue","A principled distance-based prior for the shape of the Weibull model",,,,,"stat.ME","http://arxiv.org/licenses/nonexclusive-distrib/1.0/","  The use of flat or weakly informative priors is popular due to the objective
a priori belief in the absence of strong prior information. In the case of the
Weibull model the improper uniform, equal parameter gamma and joint Jeffrey's
priors for the shape parameter are popular choices. The effects and behaviors
of these priors have yet to be established from a modeling viewpoint,
especially their ability to reduce to the simpler exponential model. In this
work we propose a new principled prior for the shape parameter of the Weibull
model, originating from a prior on the distance function, and advocate this new
prior as a principled choice in the absence of strong prior information. This
new prior can then be used in models with a Weibull modeling component, like
competing risks, joint and spatial models, to mention a few. This prior is
available in the R-INLA for use, and is applied in a joint
longitudinal-survival model framework using the INLA method.
","[{""version"":""v1"",""created"":""Sun, 16 Feb 2020 06:26:32 GMT""}]","2020-02-18"
"2002.06520","Masaki Kashiwara","Andrea D'Agnolo and Masaki Kashiwara","On a topological counterpart of regularization for holonomic D-modules","31 pages","J. \'Ec. polytech. Math., 8 (2021), 27--55","10.5802/jep.140",,"math.AG","http://arxiv.org/licenses/nonexclusive-distrib/1.0/","  On a complex manifold, the embedding of the category of regular holonomic
D-modules into that of holonomic D-modules has a left quasi-inverse functor
$\mathcal{M}\mapsto\mathcal{M}_{\mathrm{reg}}$, called regularization. Recall
that $\mathcal{M}_{\mathrm{reg}}$ is reconstructed from the de Rham complex of
$\mathcal{M}$ by the regular Riemann-Hilbert correspondence. Similarly, on a
topological space, the embedding of sheaves into enhanced ind-sheaves has a
left quasi-inverse functor, called here sheafification. Regularization and
sheafification are intertwined by the irregular Riemann-Hilbert correspondence.
Here, we study some of their properties. In particular, we provide a germ
formula for the sheafification of enhanced specialization and
microlocalization.
","[{""version"":""v1"",""created"":""Sun, 16 Feb 2020 06:43:01 GMT""}]","2021-07-13"
"2002.06521","Lan Liu","Lan Liu and Eric Tchetgen Tchetgen","Regression-based Negative Control of Homophily in Dyadic Peer Effect
  Analysis",,,,,"stat.ME","http://arxiv.org/licenses/nonexclusive-distrib/1.0/","  A prominent threat to causal inference about peer effects over social
networks is the presence of homophily bias, that is, social influence between
friends and families is entangled with common characteristics or underlying
similarities that form close connections. Analysis of social network data has
suggested that certain health conditions such as obesity and psychological
states including happiness and loneliness can spread over a network. However,
such analyses of peer effects or contagion effects have come under criticism
because homophily bias may compromise the causal statement. We develop a
regression-based approach which leverages a negative control exposure for
identification and estimation of contagion effects on additive or
multiplicative scales, in the presence of homophily bias. We apply our methods
to evaluate the peer effect of obesity in Framingham Offspring Study.
","[{""version"":""v1"",""created"":""Sun, 16 Feb 2020 06:43:19 GMT""}]","2020-02-18"
"2002.06522","Hai  Bui Xuan","Bui Xuan Hai, Binh-Minh Bui-Xuan, Le Van Chua, and Mai Hoang Bien","Intersection graphs of almost subnormal subgroups in general skew linear
  groups","11 pages",,,,"math.RA","http://arxiv.org/licenses/nonexclusive-distrib/1.0/","  Let $D$ be a division ring, $n$ a positive integer, and GL$_n(D)$ the general
linear group of degree $n$ over $D$. In this paper, we study the induced
subgraph of the intersection graph of GL$_n(D)$ generated by all non-trivial
proper almost subnormal subgroups of GL$_n(D)$. We show that this subgraph is
complete if it is non-null. This property will be used to study subgroup
structure of a division ring. In particular, we prove that every non-central
almost subnormal subgroup of the multiplicative group $D^*$ of a division ring
$D$ contains a non-central subnormal subgroup of $D^*$.
","[{""version"":""v1"",""created"":""Sun, 16 Feb 2020 06:55:32 GMT""}]","2020-02-18"
"2002.06523","Andrzej Bo\.zek","Andrzej Bo\.zek","Expanding total sieve and patterns in primes","14 pages, 4 figures, comments and constructive criticism are welcome,
  especially regarding legibility, correctness and completeness",,,,"math.GM","http://arxiv.org/licenses/nonexclusive-distrib/1.0/","  Let $\big(\mathcal{S}_n^{\alpha,\kappa,\mathfrak{r}}(z)\big)_{n=1}^\infty$ be
a sequence of the largest possible integer intervals, such that
$z\in\mathcal{S}_n^{\alpha,\kappa,\mathfrak{r}}(z)\subset\overline{\mathcal{M}}_n^{\alpha,\kappa,\mathfrak{r}}=\bigcup_{i=1}^n
[\mathfrak{r}_i]_{\mathfrak{p}_i}$ or
$\mathcal{S}_n^{\alpha,\kappa,\mathfrak{r}}(z)=\emptyset$, where
$\mathfrak{p}_i=p_{\alpha+\left\lceil i/\kappa\right\rceil-1}$ and
$z\in\mathbb{Z}$. We prove that
$\big(\#\mathcal{S}_n^{\alpha,\kappa,\mathfrak{r}}(z)\big)_{n=1}^\infty$
oscillates infinitely many times around $\beta_n\!=\!o\left(n^2\right)$ for any
fixed $\alpha\in\mathbb{Z}^+$, $\kappa\in\mathbb{Z}\cap[1,p_\alpha)$, and
$\mathfrak{r}_i\in\mathbb{Z}$. Let $T=(a_1,a_2,\ldots,a_k)$ be an admissible
$k$-tuple and let
$\mathcal{X}_n^{T,k,\rho,\eta}=\left\{x\in[\rho]_\eta\,:\,\{x\!+\!a_1,x\!+\!a_2,\ldots,x\!+\!a_k\}\cap\mathcal{M}_{n+\alpha-1}\neq\emptyset\right\}$
for each $n\in\mathbb{Z}^+$, where $\mathcal{M}_g=\bigcup_{i=1}^g [0]_{p_i}$.
We prove that for any $T$ and for some fixed $\alpha$, $\kappa$, $\rho$,
$\eta$, $z$, and $\mathfrak{r}$, there exists a linear bijection between
$\overline{\mathcal{M}}_{\kappa n}^{\alpha,\kappa,\mathfrak{r}}$ and
$\mathcal{X}_n^{T,k,\rho,\eta}$ for each $n\in\mathbb{Z}^+$. It implies that
the length of any expanding integer interval on which all occurrences of $T$
are sieved out by $\mathcal{M}_{n+\alpha-1}$ oscillates infinitely many times
around $\widetilde{\beta}_n=o\left(n^2\right)$. The concept of the sieve of
Eratosthenes asserts
$\mathcal{E}_n=[2,p^2_{n+\alpha})\cap\left(\mathbb{Z}\setminus\mathcal{M}_{n+\alpha-1}\right)\subset\mathbb{P}$.
Therefore, having $p^2_{n+\alpha}=\omega\left(n^2\right)$, we obtain that
$\mathcal{E}_n$ includes a subset matched to $T$ for infinitely many values of
$n$ and, consequently, $T$ matches infinitely many positions in the sequence of
primes.
","[{""version"":""v1"",""created"":""Sun, 16 Feb 2020 07:05:10 GMT""},{""version"":""v2"",""created"":""Tue, 31 Mar 2020 14:49:30 GMT""},{""version"":""v3"",""created"":""Wed, 8 Apr 2020 15:23:14 GMT""}]","2020-04-09"
