"2004.12118","Feng Liu","Feng Liu, Weiwen Liu, Xutao Li, Yunming Ye","Inter-sequence Enhanced Framework for Personalized Sequential
  Recommendation",,,,,"cs.IR","http://arxiv.org/licenses/nonexclusive-distrib/1.0/","  Modeling the sequential correlation of users' historical interactions is
essential in sequential recommendation. However, the majority of the approaches
mainly focus on modeling the \emph{intra-sequence} item correlation within each
individual sequence but neglect the \emph{inter-sequence} item correlation
across different user interaction sequences. Though several studies have been
aware of this issue, their method is either simple or implicit. To make better
use of such information, we propose an inter-sequence enhanced framework for
the Sequential Recommendation (ISSR). In ISSR, both inter-sequence and
intra-sequence item correlation are considered. Firstly, we equip graph neural
networks in the inter-sequence correlation encoder to capture the high-order
item correlation from the user-item bipartite graph and the item-item graph.
Then, based on the inter-sequence correlation encoder, we build GRU network and
attention network in the intra-sequence correlation encoder to model the item
sequential correlation within each individual sequence and temporal dynamics
for predicting users' preferences over candidate items. Additionally, we
conduct extensive experiments on three real-world datasets. The experimental
results demonstrate the superiority of ISSR over many state-of-the-art methods
and the effectiveness of the inter-sequence correlation encoder.
","[{""version"":""v1"",""created"":""Sat, 25 Apr 2020 11:57:00 GMT""},{""version"":""v2"",""created"":""Wed, 29 Apr 2020 03:23:44 GMT""}]","2020-04-30"
"2004.12119","Nimba Oshnik","Phila Rembold, Nimba Oshnik, Matthias M. M\""uller, Simone Montangero,
  Tommaso Calarco, and Elke Neu","Introduction to Quantum Optimal Control for Quantum Sensing with
  Nitrogen-Vacancy Centers in Diamond","29 pages, 24 figures, Review article","AVS Quantum Sci. 2, 024701 (2020)","10.1116/5.0006785",,"quant-ph","http://arxiv.org/licenses/nonexclusive-distrib/1.0/","  Diamond based quantum technology is a fast emerging field with both
scientific and technological importance. With the growing knowledge and
experience concerning diamond based quantum systems, comes an increased demand
for performance. Quantum optimal control (QOC) provides a direct solution to a
number of existing challenges as well as a basis for proposed future
applications. Together with a swift review of QOC strategies, quantum sensing
and other relevant quantum technology applications of nitrogen-vacancy (NV)
centers in diamond, we give the necessary background to summarize recent
advancements in the field of QOC assisted quantum applications with NV centers
in diamond.
","[{""version"":""v1"",""created"":""Sat, 25 Apr 2020 12:13:45 GMT""},{""version"":""v2"",""created"":""Thu, 18 Jun 2020 10:45:16 GMT""}]","2020-06-19"
"2004.12120","Jie Jiang","Xin-Yang Wang, and Jie Jiang","Gedanken experiments at high-order approximation: nearly extremal
  Reissner-Nordstrom black holes cannot be overcharged","7pages, 1 figure","J. High Energ. Phys. 2020, 161 (2020)","10.1007/JHEP05(2020)161",,"hep-th gr-qc","http://arxiv.org/licenses/nonexclusive-distrib/1.0/","  The new version of the gedanken experiment proposed by Sorce and Wald has
been used to examine the weak cosmic censorship conjecture (WCCC) for black
holes at the second-order approximation of the matter fields perturbation.
However, only considering the perturbation until the second-order approximation
is incomplete because there is an optimal option such that the existing
condition of the event horizon vanishes at second-order. For this circumstance,
we cannot judge whether the WCCC is satisfied at this order. In our
investigation, the $k$th-order perturbation inequality is generally derived.
Using the inequalities, we examine the WCCC for nearly extremal
Reissner-Nordst\""{o}m black holes at higher-order approximation. It is shown
that the WCCC cannot be violated yet after the perturbation. From this result,
it can be indicated that the WCCC is strictly satisfied at the perturbation
level for nearly extremal RN black holes.
","[{""version"":""v1"",""created"":""Sat, 25 Apr 2020 12:17:08 GMT""},{""version"":""v2"",""created"":""Sat, 9 May 2020 10:27:27 GMT""}]","2020-06-02"
"2004.12121","Noboru Ito","Noboru Ito","Based chord diagrams of spherical curves","21 pages, 21 figures, 15 tables","Kodai Math. J., 41 (2018), 375--396","10.2996/kmj/1530496848",,"math.GT","http://arxiv.org/licenses/nonexclusive-distrib/1.0/","  This paper demonstrates an approach for developing a framework to produce
invariants of base-point-free generic spherical curves under some chosen local
moves from Reidemeister moves using based chord diagrams. Our invariants not
only contain Arnold's classical generic spherical curve invariant but also new
invariants.
","[{""version"":""v1"",""created"":""Sat, 25 Apr 2020 12:21:40 GMT""}]","2022-06-14"
"2004.12122","Walid Kehila","Walid Kehila","On some congruences using multiple harmonic sums of length three and
  four","8 pages",,,,"math.NT math.CO","http://arxiv.org/licenses/nonexclusive-distrib/1.0/","  In the present paper, we determine the sums
$\sum_{j=1}^{p-1}\frac{H_j^{(s_1)}H_j^{(s_3)}}{j^{s_2}}$ and
$\sum_{j=1}^{p-1}\frac{H_j^{(s_1)}H_j^{(s_3)}H_j^{(s_4)}}{j^{s_2}}$ modulo $p$
and modulo $p^2$ in certain cases. This is done by using multiple harmonic sums
of length three and four, as well as, many other results. In addition, We
recover three congruences conjectured by Z.-W Sun and solved later by the
author himself and R. Me\v{s}trovi\'c.
","[{""version"":""v1"",""created"":""Sat, 25 Apr 2020 12:23:11 GMT""}]","2020-04-28"
"2004.12123","Miguel Mendez A","Davide Ninni, Miguel A. Mendez","MODULO: A software for Multiscale Proper Orthogonal Decomposition of
  data","submitted to Software X",,,,"physics.data-an physics.flu-dyn physics.ins-det","http://arxiv.org/licenses/nonexclusive-distrib/1.0/","  In the era of the Big Data revolution, methods for the automatic discovery of
regularities in large datasets are becoming essential tools in applied
sciences. This article presents an open software package, named MODULO (MODal
mULtiscale pOd), to perform the Multiscale Proper Orthogonal Decomposition
(mPOD) of numerical and experimental data. This novel decomposition combines
Multi-resolution Analysis (MRA) and standard Proper Orthogonal Decomposition
(POD) to allow for the optimal compromise between decomposition convergence and
spectral purity of its modes. The software is equipped with a Graphical User
Interface (GUI) and enriched by numerous examples and video tutorials (see
Youtube channel MODULO mPOD). The MATLAB source codes and an executable for
Windows users can be downloaded at
\url{https://github.com/mendezVKI/MODULO/releases}; a collection of exercises
in Matlab and Python are provided in \url{https://github.com/mendezVKI/MODULO}
","[{""version"":""v1"",""created"":""Sat, 25 Apr 2020 12:23:29 GMT""},{""version"":""v2"",""created"":""Wed, 11 Nov 2020 13:45:58 GMT""}]","2020-11-12"
"2004.12124","Jean-Francois Berret","Milad Radiom, Jean-Franccois Berret","Common trends in the epidemic of Covid-19 disease","15 pages, 5 figures, 2 tables","The European Physical Journal Plus 135, 517 (2020)","10.1140/epjp/s13360-020-00526-1",,"q-bio.PE physics.bio-ph","http://arxiv.org/licenses/nonexclusive-distrib/1.0/","  The discovery of SARS-CoV-2, the responsible virus for the Covid-19 epidemic,
has sparked a global health concern with many countries affected. Developing
models that can interpret the epidemic and give common trend parameters are
useful for prediction purposes by other countries that are at an earlier phase
of the epidemic; it is also useful for future planning against viral
respiratory diseases. One model is developed to interpret the fast-growth phase
of the epidemic and another model for an interpretation of the entire data set.
Both models agree reasonably with the data. It is shown by the first model that
during the fast phase, the number of new infected cases depends on the total
number of cases by a power-law relation with a scaling exponent equal to 0.82.
The second model gives a duplication time in the range 1 to 3 days early in the
start of the epidemic, and another parameter alpha = 0.1-0.5) that deviates the
progress of the epidemic from an exponential growth. Our models may be used for
data interpretation and for guiding predictions regarding this disease, e.g.
the onset of the maximum in the number of new cases.
","[{""version"":""v1"",""created"":""Sat, 25 Apr 2020 12:24:27 GMT""},{""version"":""v2"",""created"":""Wed, 10 Jun 2020 16:06:44 GMT""}]","2021-09-21"
"2004.12125","Pragya Shukla","Triparna Mondal and Pragya Shukla","Spectral statistics of multi-parametric Gaussian ensembles with chiral
  symmetry","28 Pages, 8 figures, new tables added for better parametric details",,"10.1103/PhysRevE.102.032131",,"cond-mat.stat-mech math-ph math.MP","http://arxiv.org/licenses/nonexclusive-distrib/1.0/","  The statistics of chiral matrix ensembles with uncorrelated but multivariate
Gaussian distributed elements is intuitively expected to be driven by many
parameters. Contrary to intuition, however, our theoretical analysis reveals
the existence of a single parameter, a function of all ensemble parameters,
which governs the dynamics of spectral statistics. The analysis not only
extends the similar formulation (known as complexity parameter formulation) for
the Hermitian ensembles without chirality to those with it but also reveals the
underlying connection between chiral complex systems with seemingly different
system conditions as well as to other complex systems e.g. multi-parametric
Wishart ensembles as well as generalized Calogero Sutherland Hamiltonian (CSH).
","[{""version"":""v1"",""created"":""Sat, 25 Apr 2020 12:26:33 GMT""},{""version"":""v2"",""created"":""Sat, 25 Jul 2020 05:47:15 GMT""}]","2020-10-28"
"2004.12126","Hongyu Lin","Hongyu Lin, Yaojie Lu, Jialong Tang, Xianpei Han, Le Sun, Zhicheng
  Wei, Nicholas Jing Yuan","A Rigorous Study on Named Entity Recognition: Can Fine-tuning Pretrained
  Model Lead to the Promised Land?","Accepted to EMNLP2020",,,,"cs.CL","http://arxiv.org/licenses/nonexclusive-distrib/1.0/","  Fine-tuning pretrained model has achieved promising performance on standard
NER benchmarks. Generally, these benchmarks are blessed with strong name
regularity, high mention coverage and sufficient context diversity.
Unfortunately, when scaling NER to open situations, these advantages may no
longer exist. And therefore it raises a critical question of whether previous
creditable approaches can still work well when facing these challenges. As
there is no currently available dataset to investigate this problem, this paper
proposes to conduct randomization test on standard benchmarks. Specifically, we
erase name regularity, mention coverage and context diversity respectively from
the benchmarks, in order to explore their impact on the generalization ability
of models. To further verify our conclusions, we also construct a new open NER
dataset that focuses on entity types with weaker name regularity and lower
mention coverage to verify our conclusion. From both randomization test and
empirical experiments, we draw the conclusions that 1) name regularity is
critical for the models to generalize to unseen mentions; 2) high mention
coverage may undermine the model generalization ability and 3) context patterns
may not require enormous data to capture when using pretrained encoders.
","[{""version"":""v1"",""created"":""Sat, 25 Apr 2020 12:30:16 GMT""},{""version"":""v2"",""created"":""Fri, 23 Oct 2020 07:06:06 GMT""}]","2020-10-26"
"2004.12127","Mengxue Guan","Meng-Xue Guan, En Wang, Pei-Wei You, Jia-Tao Sun and Sheng Meng","Manipulating Weyl quasiparticles by orbital-selective photoexcitation in
  WTe2",,,"10.1038/s41467-021-22056-9",,"cond-mat.mtrl-sci","http://arxiv.org/licenses/nonexclusive-distrib/1.0/","  Optical control of structural and electronic properties of Weyl semimetals
allows development of switchable and dissipationless topological devices at the
ultrafast scale. An unexpected orbitial-selective photoexcitation in type-II
Weyl material WTe2 is reported under linearly polarized light (LPL), inducing
striking transitions among several topologically-distinct phases. The symmetry
features of atomic orbitals comprising the Weyl bands result in asymmetric
electronic transitions near the Weyl points, and in turn an anisotropic
response of interlayer shear motion with respect to linear light polarization,
when a near-infrared laser pulse is applied. Consequently, not only
annihilation of Weyl quasiparticle pairs, but also increasing separation of
Weyl points can be achieved, complementing existing experimental observations.
Our results provide a new perspective on manipulating the singularity of Weyl
nodes and coherent control of electron and lattice quantum dynamics
simultaneously.
","[{""version"":""v1"",""created"":""Sat, 25 Apr 2020 12:31:09 GMT""}]","2021-04-14"
"2004.12128","Yuxin Xin","Yu-Xin Xin, Jin-Ming Bai, Bao-Li Lun, Yu-Feng Fan, Chuan-Jun Wang,
  Xiao-Wei Liu, Xiao-Guang Yu, Kai Ye, Teng-Fei Song, Liang Chang, Shou-Sheng
  He, Ji-Rong Mao, Liang Xu, Ding-Rong Xiong, Xi-Liang Zhang, Jian-Guo Wang, Xu
  Ding, Hai-Cheng Feng, Xiang-Kun Liu, Yang Huang, Bing-Qiu Chen","Astronomical Site Monitoring System at Lijiang Observatory","21 pages,40 figures","RAA 2020 Vol.20 No.9,149(18)","10.1088/1674-4527/20/9/149",,"astro-ph.IM","http://arxiv.org/licenses/nonexclusive-distrib/1.0/","  We installed two sets of Astronomical Site Monitoring System(ASMS) at Lijiang
Observatory(GMG), for the running of the 2.4-meter Lijiang optical
telescope(LJT) and the 1.6-meter Multi-channel Photometric Survey Telescope
(Mephisto). The Mephistro is under construction. ASMS has been running on
robotic mode since 2017. The core instruments: Cloud Sensor, All-Sky Camera and
Autonomous-DIMM that are developed by our group, together with the commercial
Meteorological Station and Sky Quality Meter, are combined into the
astronomical optical site monitoring system. The new Cloud Sensor's Cloud-Clear
Relationship is presented for the first time, which is used to calculate the
All-Sky cloud cover. We designed the Autonomous-DIMM located on a tower, with
the same height as LJT. The seeing data have been observed for a full year.
ASMS's data for the year 2019 are also analysed in detail, which are valuable
to observers.
","[{""version"":""v1"",""created"":""Sat, 25 Apr 2020 12:34:28 GMT""},{""version"":""v2"",""created"":""Tue, 28 Apr 2020 01:38:40 GMT""},{""version"":""v3"",""created"":""Fri, 28 Aug 2020 08:02:59 GMT""},{""version"":""v4"",""created"":""Thu, 22 Oct 2020 13:46:32 GMT""}]","2020-10-23"
"2004.12129","Abel Brodeur","Abel Brodeur, Andrew E. Clark, Sarah Fleche and Nattavudh Powdthavee","Assessing the impact of the coronavirus lockdown on unhappiness,
  loneliness, and boredom using Google Trends",,,,,"physics.soc-ph cs.CY cs.SI","http://arxiv.org/licenses/nonexclusive-distrib/1.0/","  The COVID-19 pandemic has led many governments to implement lockdowns. While
lockdowns may help to contain the spread of the virus, it is possible that
substantial damage to population well-being will result. This study relies on
Google Trends data and tests whether the lockdowns implemented in Europe and
America led to changes in well-being related topic search terms. Using
different methods to evaluate the causal effects of lockdown, we find a
substantial increase in the search intensity for boredom in Europe and the US.
We also found a significant increase in searches for loneliness, worry and
sadness, while searches for stress, suicide and divorce on the contrary fell.
Our results suggest that people's mental health may have been severely affected
by the lockdown.
","[{""version"":""v1"",""created"":""Sat, 25 Apr 2020 12:41:36 GMT""}]","2020-04-28"
"2004.12130","Philip Nadler","Philip Nadler, Shuo Wang, Rossella Arcucci, Xian Yang, Yike Guo","An Epidemiological Modelling Approach for Covid19 via Data Assimilation","Initial conference version accepted at International Conference of
  Machine Learning(ICML) workshop. Extended journal version was published in
  the European Journal of Epidemiology
  (https://doi.org/10.1007/s10654-020-00676-7). Please cite as accordingly",,"10.1007/s10654-020-00676-7",,"stat.AP cs.LG stat.ME stat.ML","http://arxiv.org/licenses/nonexclusive-distrib/1.0/","  The global pandemic of the 2019-nCov requires the evaluation of policy
interventions to mitigate future social and economic costs of quarantine
measures worldwide. We propose an epidemiological model for forecasting and
policy evaluation which incorporates new data in real-time through variational
data assimilation. We analyze and discuss infection rates in China, the US and
Italy. In particular, we develop a custom compartmental SIR model fit to
variables related to the epidemic in Chinese cities, named SITR model. We
compare and discuss model results which conducts updates as new observations
become available. A hybrid data assimilation approach is applied to make
results robust to initial conditions. We use the model to do inference on
infection numbers as well as parameters such as the disease transmissibility
rate or the rate of recovery. The parameterisation of the model is parsimonious
and extendable, allowing for the incorporation of additional data and
parameters of interest. This allows for scalability and the extension of the
model to other locations or the adaption of novel data sources.
","[{""version"":""v1"",""created"":""Sat, 25 Apr 2020 12:46:36 GMT""},{""version"":""v2"",""created"":""Fri, 21 Aug 2020 16:11:32 GMT""},{""version"":""v3"",""created"":""Thu, 29 Oct 2020 12:48:52 GMT""}]","2020-10-30"
"2004.12131","Philipp Petersen","Moritz Geist, Philipp Petersen, Mones Raslan, Reinhold Schneider,
  Gitta Kutyniok","Numerical Solution of the Parametric Diffusion Equation by Deep Neural
  Networks",,,,,"math.NA cs.LG cs.NA stat.ML","http://arxiv.org/licenses/nonexclusive-distrib/1.0/","  We perform a comprehensive numerical study of the effect of
approximation-theoretical results for neural networks on practical learning
problems in the context of numerical analysis. As the underlying model, we
study the machine-learning-based solution of parametric partial differential
equations. Here, approximation theory predicts that the performance of the
model should depend only very mildly on the dimension of the parameter space
and is determined by the intrinsic dimension of the solution manifold of the
parametric partial differential equation. We use various methods to establish
comparability between test-cases by minimizing the effect of the choice of
test-cases on the optimization and sampling aspects of the learning problem. We
find strong support for the hypothesis that approximation-theoretical effects
heavily influence the practical behavior of learning problems in numerical
analysis.
","[{""version"":""v1"",""created"":""Sat, 25 Apr 2020 12:48:31 GMT""}]","2020-04-28"
"2004.12132","Robert Williams","Robert Williams","Hubble Telescope 30 Years in Orbit: Personal Reflections","8 pages, 3 figures","Res Ast & Ap, 20, 44 (2020)","10.1088/1674-4527/20/4/44",,"astro-ph.IM","http://arxiv.org/licenses/nonexclusive-distrib/1.0/","  With an initial requirement to make observations a minimum of 5-10 years,
Hubble Space Telescope (HST) has continued to operate well for 30 years. It has
relied upon five servicing missions to repair and replace essential components.
Since the final Space Shuttle mission 10 years ago it has avoided major breaks
in its operation, with the only serious effects of ageing in space being a
progressive deterioration in the performance of the gyroscopes and sensitivity
of the instrument detectors. A number of factors were important in making HST a
scientific landmark. Ground-breaking discoveries have been made with HST----the
most important being the discovery of cosmic acceleration. When HST operation
ceases future observations in space should be assured with successful operation
of major missions now planned by NASA, ESA, and the China and Japanese Space
Agencies.
","[{""version"":""v1"",""created"":""Sat, 25 Apr 2020 12:58:43 GMT""}]","2020-05-06"
"2004.12133","Nikolaos Davis","Nikolaos G. Antoniou, Nikolaos Davis, Fotios K. Diakonos, Georgios
  Doultsinos, Nikolaos Kalntis, Alexandros Kanargias, Athanasios S. Kapoyannis,
  Vitalii Ozvenchuk, Costas N. Papanicolas, Andrzej Rybicki, Efstathios
  Stiliaris","Decoding the QCD critical behaviour in A+A collisions","26 pages, 9 figures, 2 tables; Preprint submitted to Nuclear Physics
  A",,,,"nucl-th hep-ph nucl-ex","http://arxiv.org/licenses/nonexclusive-distrib/1.0/","  In a systematic search for the QCD critical point in nuclear collisions, at
the CERN SPS, it was found that intermittency measurements in the freeze-out
state of central Si+Si collisions, at the maximum SPS energy, provide us with
an indication of sizeable critical fluctuations. Also, rather recently, a
weaker effect was traced in preliminary data of the Ar+Sc reaction for 10-20%
most central collisions at (approximately) the same energy. However, the
uncertainties in the analysis and the limitations of the experimental event
statistics make the interpretation of the above measurements (NA49, NA61/SHINE)
rather inconclusive, inviting for a further, phenomenological investigation
with complementary tools and theoretical ideas. To this end, in the present
work, we employ intermittency techniques within a model-independent analysis
scheme (AMIAS), a novel method from Data Science [arXiv:1205.6505], in order to
produce unbiased results for the parameters of the power-laws and in particular
for the associated power-law exponent (intermittency index) $\phi_2$. Using
data-sets at different peripheralities, we also study the dependence of the
$\phi_2$-value on the number of wounded nucleons, in order to uncover the
approach to the critical point. With these findings and the help of Ising-QCD
partition function, the interpretation of SPS intermittency measurements and
their links to the critical region, are discussed.
","[{""version"":""v1"",""created"":""Sat, 25 Apr 2020 13:01:15 GMT""}]","2020-04-28"
"2004.12134","Ning Liu","Ning Liu and Zhanchun Tu","Dynamics of Momentum Distribution and Structure Factor in a Weakly
  Interacting Bose Gas with a Periodical Modulation","5 pages, 3 figures","Communications in Theoretical Physics 72, 12, (2020) 125501","10.1088/1572-9494/abb7f0",,"cond-mat.quant-gas","http://arxiv.org/licenses/nonexclusive-distrib/1.0/","  The momentum distribution and dynamical structure factor in a weakly
interacting Bose gas with a time-dependent periodic modulation in terms of the
Bogoliubov treatment are investigated. The evolution equation related to the
Bogoliubov weights happens to be a solvable Mathieu equation when the coupling
strength is periodically modulated. An exact relation between the time
derivatives of momentum distribution and dynamical structure factor is derived,
which indicates that the single-particle property strongly related to the
two-body property in the evolutions of Bose-Einstein condensates. It is found
that the momentum distribution and dynamical structure factor cannot display
periodical behavior. For stable dynamics, some particular peaks in the curves
of momentum distribution and dynamical structure factor appear synchronously,
which is consistent with the derivative relation.
","[{""version"":""v1"",""created"":""Sat, 25 Apr 2020 13:01:48 GMT""},{""version"":""v2"",""created"":""Wed, 8 Jul 2020 10:56:22 GMT""},{""version"":""v3"",""created"":""Thu, 10 Dec 2020 11:49:09 GMT""}]","2020-12-11"
"2004.12135","Aradhita Chattopadhyaya","Aradhita Chattopadhyaya","Gravitational couplings in ${\cal N}=2$ heterotic compactifications with
  Wilson lines","37 pages, 1 figure, some typos fixed",,"10.1007/JHEP07(2020)185",,"hep-th","http://arxiv.org/licenses/nonexclusive-distrib/1.0/","  In this paper we compute the gravitational couplings of the heterotic string
compactified on $(K3\times T^2)/\mathbb{Z}_N$ and $E_8\times E_8$ and predict
the Gopakumar Vafa invariants of the dual Calabi Yau manifold in presence of
Wilson lines. Here $\mathbb{Z}_N$ acts as an automorphism on $K3$ associated
with the conjugacy classes of $M_{23}$ and a shift of $1/N$ on one of the $S^1$
of $T^2$. We study in detail the cases $N=2,3$ for standard and several
non-standard embeddings where $K3$ is realized as toroidal orbifolds
$T^4/\mathbb{Z}_4$ and $T^4/\mathbb{Z}_3$. From these computations we extract
the polynomial term in perturbative pre-potential for these orbifold models in
presence of a single Wilson line. We also show for standard embeddings the
integrality of the Gopakumar Vafa invariants depend on the integrality of
Fourier coefficients of Fourier transform of the twisted elliptic genus of $K3$
in presence of $n<8$ Wilson lines.
","[{""version"":""v1"",""created"":""Sat, 25 Apr 2020 13:06:51 GMT""},{""version"":""v2"",""created"":""Wed, 13 May 2020 13:22:20 GMT""}]","2020-08-26"
