"2004.12034","Mohammed Belkhatir","M. Maree, A. Kmail, M. Belkhatir","Analysis & Shortcomings of E-Recruitment Systems: Towards a
  Semantics-based Approach Addressing Knowledge Incompleteness and Limited
  Domain Coverage",,"J. Inf. Sci. 45(6) (2019)","10.1177/0165551518811449",,"cs.CY cs.IR","http://arxiv.org/licenses/nonexclusive-distrib/1.0/","  The rapid development of the Internet has led to introducing new methods for
e-recruitment and human resources management. These methods aim to
systematically address the limitations of conventional recruitment procedures
through incorporating natural language processing tools and semantics-based
methods. In this context, for a given job post, applicant resumes (usually
uploaded as free-text unstructured documents in different formats such as .pdf,
.doc, or .rtf) are matched/screened out using the conventional keyword-based
model enriched by additional resources such as occupational categories and
semantics-based techniques. Employing these techniques has proved to be
effective in reducing the cost, time, and efforts required in traditional
recruitment and candidate selection methods. However, the skill gap, i.e. the
propensity to precisely detect and extract relevant skills in applicant resumes
and job posts, and the hidden semantic dimensions encoded in applicant resumes
still form a major obstacle for e-recruitment systems. This is due to the fact
that resources exploited by current e-recruitment systems are obtained from
generic domain-independent sources, therefore resulting in knowledge
incompleteness and the lack of domain coverage. In this paper, we review
state-of-the-art e-recruitment approaches and highlight recent advancements in
this domain. An e-recruitment framework addressing current shortcomings through
the use of multiple cooperative semantic resources, feature extraction
techniques and skill relatedness measures is detailed. An instantiation of the
proposed framework is proposed and an experimental validation using a
real-world recruitment dataset from two employment portals demonstrates the
effectiveness of the proposed approach.
","[{""version"":""v1"",""created"":""Sat, 25 Apr 2020 01:25:35 GMT""}]","2020-04-28"
"2004.12035","Youjun Zhang","Zhang Youjun, Hou Mingqiang, Liu Guangtao, Zhang Chengwei, Prakapenka
  B. Vitali, Greenberg Eran, Fei Yingwei, Cohen R.E, and Lin Jung-Fu","Reconciliation of experiments and theory on transport properties of iron
  and the geodynamo","39 pages, 14 figures","Phys. Rev. Lett. 125, 078501 (2020)","10.1103/PhysRevLett.125.078501",,"physics.geo-ph cond-mat.mtrl-sci","http://arxiv.org/licenses/nonexclusive-distrib/1.0/","  The amount of heat transport from the core, which constrains the dynamics and
thermal evolution of the region, depends on the transport properties of iron.
Ohta et al.(2016) and Konopkova et al.(2016) measured electrical resistivity
and thermal conductivity of iron, respectively, in laser-heated diamond anvil
cells (DACs) at relevant Earth's core pressure-temperature (P-T) conditions,
and obtained dramatically contradictory results. Here we measure the electrical
resistivity of hcp-iron up to ~170 GPa and ~3,000 K using a four-probe van der
Pauw method coupled with homogeneous flat-top laser-heating in a DAC. We also
compute its electrical and thermal conductivity by first-principles methods
including electron-phonon and electron-electron scattering. We find that the
measured resistivity of hcp-iron increases almost linearly with increasing
temperature, and is consistent with current first-principles computations. The
proportionality coefficient between resistivity and thermal conductivity (the
Lorenz number) in hcp-iron differs from the ideal value (2.44*10^-8 W Omega
K^-2), so a non-ideal Lorenz number of ~(2.0-2.1)*10^-8 W Omega K^-2 is used to
convert the experimental resistivity to the thermal conductivity of hcp-Fe at
high P-T. The results constrain the resistivity and thermal conductivity of
hcp-iron to ~80(5) u Omega cm and ~100(10) W/mK, respectively, at conditions
near core-mantle boundary. Our results indicate an adiabatic heat flow of
~10(1) TW through the core-mantle boundary for a liquid Fe alloy outer core,
supporting a present-day geodynamo driven by thermal convection through the
core's secular cooling and by compositional convection through the latent heat
and gravitational energy during the inner core's solidification.
","[{""version"":""v1"",""created"":""Sat, 25 Apr 2020 01:40:07 GMT""}]","2020-08-19"
"2004.12036","Walter Bridges","Walter Bridges","Partitions into distinct parts with bounded largest part",,"Res. Number Theory 6 (2020)",,,"math.NT math.CO math.PR","http://arxiv.org/licenses/nonexclusive-distrib/1.0/","  We prove an asymptotic formula for the number of partitions of $n$ into
distinct parts where the largest part is at most $t\sqrt{n}$ for fixed $t \in
\mathbb{R}$. Our method follows a probabilistic approach of Romik, who gave a
simpler proof of Szekeres' asymptotic formula for distinct parts partitions
when instead the number of parts is bounded by $t\sqrt{n}$. Although equivalent
to a circle method/saddle-point method calculation, the probabilistic approach
predicts the shape of the asymptotic formula, to some degree.
","[{""version"":""v1"",""created"":""Sat, 25 Apr 2020 01:46:33 GMT""},{""version"":""v2"",""created"":""Mon, 9 Nov 2020 14:54:18 GMT""}]","2020-11-10"
"2004.12037","Mark Dykman","K. Moskovtsev and M. I. Dykman","Mobility of a spatially modulated electron liquid on the helium surface",,"Phys. Rev. B 101, 245435 (2020)","10.1103/PhysRevB.101.245435",,"cond-mat.mes-hall","http://arxiv.org/licenses/nonexclusive-distrib/1.0/","  We present the results of large-scale numerical simulations of the mobility
of a two-dimensional electron liquid on the helium surface in the presence of a
one-dimensional periodic potential. Even where the potential is much weaker
than the electron-electron interaction, it can strongly change the mobility.
The effect depends on the interrelation between the potential period and the
mean interelectron distance. It is most pronounced where the period is close to
the period of the Wigner crystal that would form if the liquid were cooled to a
lower temperature. The results suggest, in particular, that the correlation
length in the electron liquid can be found by measuring the mobility in a weak
periodic potential. The simulations are based on the microscopic model of the
electron scattering by the excitations in helium.
","[{""version"":""v1"",""created"":""Sat, 25 Apr 2020 01:46:46 GMT""}]","2020-07-01"
"2004.12038","Mohammed Belkhatir","M. Belkhatir","Fuzzy Logic Based Integration of Web Contextual Linguistic Structures
  for Enriching Conceptual Visual Representations",,,"10.1109/TETCI.2018.2849417",,"cs.MM cs.IR","http://arxiv.org/licenses/nonexclusive-distrib/1.0/","  Due to the difficulty of automatically mapping visual features with semantic
descriptors, state-of-the-art frameworks have exhibited poor performance in
terms of coverage and effectiveness for indexing the visual content. This
prompted us to investigate the use of both the Web as a large information
source from where to extract relevant contextual linguistic information and
bimodal visual-textual indexing as a technique to enrich the vocabulary of
index concepts. Our proposal is based on the Signal/Semantic approach for
multimedia indexing which generates multi-facetted conceptual representations
of the visual content. We propose to enrich these image representations with
concepts automatically extracted from the visual contextual information. We
specifically target the integration of semantic concepts which are more
specific than the initial index concepts since they represent the visual
content with greater accuracy and precision. Also, we aim to correct the faulty
indexes resulting from the automatic semantic tagging. Experimentally, the
details of the prototyping are given and the presented technique is tested in a
Web-scale evaluation on 30 queries representing elaborate image scenes.
","[{""version"":""v1"",""created"":""Sat, 25 Apr 2020 01:49:22 GMT""}]","2020-04-28"
"2004.12039","Heedong Do","Heedong Do, Namyoon Lee, Angel Lozano","Reconfigurable ULAs for Line-of-Sight MIMO Transmission","12 pages, 7 figures, submitted to IEEE Transactions on Wireless
  Communications",,,,"cs.IT eess.SP math.IT","http://arxiv.org/licenses/nonexclusive-distrib/1.0/","  This paper establishes an upper bound on the capacity of line-of-sight
multiantenna channels over all possible antenna arrangements and shows that
uniform linear arrays (ULAs) with an SNR-dependent rotation of transmitter or
receiver can closely approach such capacity---and in fact achieve it at low and
high SNR, and asymptotically in the numbers of antennas. Then, as an
alternative to mechanically rotating ULAs, we propose to electronically select
among multiple ULAs having a radial disposition at either transmitter or
receiver, and we bound the shortfall from capacity as a function of the number
of such ULAs. With only three ULAs, properly angled, 96% of the capacity can be
achieved. Finally, we further introduce reduced-complexity precoders and linear
receivers that capitalize on the structure of the channels spawned by these
configurable ULA architectures.
","[{""version"":""v1"",""created"":""Sat, 25 Apr 2020 01:58:02 GMT""}]","2020-04-28"
"2004.12040","Yomna Safaa El-Din MSc.","Yomna Safaa El-Din, Mohamed N. Moustafa, Hani Mahdi","Deep convolutional neural networks for face and iris presentation attack
  detection: Survey and case study","A preprint of a paper accepted by IET Biometrics journal and is
  subject to Institution of Engineering and Technology Copyright",,,,"cs.CV","http://arxiv.org/licenses/nonexclusive-distrib/1.0/","  Biometric presentation attack detection is gaining increasing attention.
Users of mobile devices find it more convenient to unlock their smart
applications with finger, face or iris recognition instead of passwords. In
this paper, we survey the approaches presented in the recent literature to
detect face and iris presentation attacks. Specifically, we investigate the
effectiveness of fine tuning very deep convolutional neural networks to the
task of face and iris antispoofing. We compare two different fine tuning
approaches on six publicly available benchmark datasets. Results show the
effectiveness of these deep models in learning discriminative features that can
tell apart real from fake biometric images with very low error rate.
Cross-dataset evaluation on face PAD showed better generalization than state of
the art. We also performed cross-dataset testing on iris PAD datasets in terms
of equal error rate which was not reported in literature before. Additionally,
we propose the use of a single deep network trained to detect both face and
iris attacks. We have not noticed accuracy degradation compared to networks
trained for only one biometric separately. Finally, we analyzed the learned
features by the network, in correlation with the image frequency components, to
justify its prediction decision.
","[{""version"":""v1"",""created"":""Sat, 25 Apr 2020 02:06:19 GMT""},{""version"":""v2"",""created"":""Wed, 29 Apr 2020 03:51:10 GMT""}]","2020-05-04"
"2004.12041","Gina Adam","Siyuan Huang, Brian D. Hoskins, Matthew W. Daniels, Mark D. Stiles,
  Gina C. Adam","Memory-efficient training with streaming dimensionality reduction",,,,,"cs.LG stat.ML","http://arxiv.org/licenses/nonexclusive-distrib/1.0/","  The movement of large quantities of data during the training of a Deep Neural
Network presents immense challenges for machine learning workloads. To minimize
this overhead, especially on the movement and calculation of gradient
information, we introduce streaming batch principal component analysis as an
update algorithm. Streaming batch principal component analysis uses stochastic
power iterations to generate a stochastic k-rank approximation of the network
gradient. We demonstrate that the low rank updates produced by streaming batch
principal component analysis can effectively train convolutional neural
networks on a variety of common datasets, with performance comparable to
standard mini batch gradient descent. These results can lead to both
improvements in the design of application specific integrated circuits for deep
learning and in the speed of synchronization of machine learning models trained
with data parallelism.
","[{""version"":""v1"",""created"":""Sat, 25 Apr 2020 02:13:43 GMT""}]","2020-04-28"
"2004.12042","Behnam Sherafat","Behnam Sherafat, Abbas Rashidi, Siyuan Song","A Software-Based Approach for Acoustical Modeling of Construction Job
  Sites with Multiple Operational Machines","10 pages",,,,"eess.SP","http://arxiv.org/licenses/nonexclusive-distrib/1.0/","  Several studies have been conducted to automatically recognize activities of
construction equipment using their generated sound patterns. Most of these
studies are focused on single-machine scenarios under controlled environments.
However, real construction job sites are more complex and often consist of
several types of equipment with different orientations, directions, and
locations working simultaneously. The current state-of-research for recognizing
activities of multiple machines on a job site is hardware-oriented, on the
basis of using microphone arrays (i.e., several single microphones installed on
a board under specific geometric layout) and beamforming principles for
classifying sound directions for each machine. While effective, the common
hardware-approach has limitations and using microphone arrays is not always a
feasible option at ordinary job sites. In this paper, the authors proposed a
software-oriented approach using Deep Neural Networks (DNNs) and Time-Frequency
Masks (TFMs) to address this issue. The proposed method requires using single
microphones, as the sound sources could be differentiated by training a DNN.
The presented approach has been tested and validated under simulated job site
conditions where two machines operated simultaneously. Results show that the
average accuracy for soft TFM is 38% higher than binary TFM.
","[{""version"":""v1"",""created"":""Sat, 25 Apr 2020 02:29:33 GMT""}]","2020-04-28"
"2004.12043","Kenneth Joseph","Kenneth Joseph and Jonathan H. Morgan","When do Word Embeddings Accurately Reflect Surveys on our Beliefs About
  People?","Accepted at ACL2020",,,,"cs.CL","http://arxiv.org/licenses/nonexclusive-distrib/1.0/","  Social biases are encoded in word embeddings. This presents a unique
opportunity to study society historically and at scale, and a unique danger
when embeddings are used in downstream applications. Here, we investigate the
extent to which publicly-available word embeddings accurately reflect beliefs
about certain kinds of people as measured via traditional survey methods. We
find that biases found in word embeddings do, on average, closely mirror survey
data across seventeen dimensions of social meaning. However, we also find that
biases in embeddings are much more reflective of survey data for some
dimensions of meaning (e.g. gender) than others (e.g. race), and that we can be
highly confident that embedding-based measures reflect survey data only for the
most salient biases.
","[{""version"":""v1"",""created"":""Sat, 25 Apr 2020 02:42:12 GMT""}]","2020-04-28"
"2004.12044","Alexander Patkowski","Alexander E Patkowski","A general double sum identity, mock theta functions, and Bailey pairs",,"Acta Arithmetica, Vol 198, No 4, (2021), 377--385","10.4064/aa200427-9-11",,"math.NT","http://arxiv.org/licenses/nonexclusive-distrib/1.0/","  We obtain some Bailey pairs associated with indefinite quadratic forms with
the $\beta_n$ connected to a finite sum. A new general identity is given, which
provides identities for $q$-hypergeometric series, including mock theta
functions.
","[{""version"":""v1"",""created"":""Sat, 25 Apr 2020 02:49:37 GMT""}]","2021-04-23"
"2004.12045","Markus Wagner","Ragav Sachdeva, Frank Neumann, Markus Wagner","The Dynamic Travelling Thief Problem: Benchmarks and Performance of
  Evolutionary Algorithms","Accepted for publication and presentation at ICONIP 2020,
  https://iconip2020.apnns.org/",,,,"cs.NE","http://arxiv.org/licenses/nonexclusive-distrib/1.0/","  Many real-world optimisation problems involve dynamic and stochastic
components. While problems with multiple interacting components are omnipresent
in inherently dynamic domains like supply-chain optimisation and logistics,
most research on dynamic problems focuses on single-component problems. With
this article, we define a number of scenarios based on the Travelling Thief
Problem to enable research on the effect of dynamic changes to sub-components.
Our investigations of 72 scenarios and seven algorithms show that -- depending
on the instance, the magnitude of the change, and the algorithms in the
portfolio -- it is preferable to either restart the optimisation from scratch
or to continue with the previously valid solutions.
","[{""version"":""v1"",""created"":""Sat, 25 Apr 2020 02:54:17 GMT""},{""version"":""v2"",""created"":""Sun, 10 May 2020 10:04:36 GMT""},{""version"":""v3"",""created"":""Tue, 15 Sep 2020 01:10:59 GMT""}]","2020-09-16"
"2004.12046","Keisuke Imoto","Keisuke Imoto and Seisuke Kyochi","Sound Event Detection Utilizing Graph Laplacian Regularization with
  Event Co-occurrence","Accepted to IEICE Transactions on Information and Systems",,,,"eess.AS cs.SD","http://arxiv.org/licenses/nonexclusive-distrib/1.0/","  A limited number of types of sound event occur in an acoustic scene and some
sound events tend to co-occur in the scene; for example, the sound events
""dishes"" and ""glass jingling"" are likely to co-occur in the acoustic scene
""cooking"". In this paper, we propose a method of sound event detection using
graph Laplacian regularization with sound event co-occurrence taken into
account. In the proposed method, the occurrences of sound events are expressed
as a graph whose nodes indicate the frequencies of event occurrence and whose
edges indicate the sound event co-occurrences. This graph representation is
then utilized for the model training of sound event detection, which is
optimized under an objective function with a regularization term considering
the graph structure of sound event occurrence and co-occurrence. Evaluation
experiments using the TUT Sound Events 2016 and 2017 detasets, and the TUT
Acoustic Scenes 2016 dataset show that the proposed method improves the
performance of sound event detection by 7.9 percentage points compared with the
conventional CNN-BiGRU-based detection method in terms of the segment-based F1
score. In particular, the experimental results indicate that the proposed
method enables the detection of co-occurring sound events more accurately than
the conventional method.
","[{""version"":""v1"",""created"":""Sat, 25 Apr 2020 03:14:53 GMT""}]","2020-04-28"
"2004.12047","Jerome Droniou","Jerome Droniou, Beniamin Goldys, Kim-Ngan Le","Design and convergence analysis of numerical methods for stochastic
  evolution equations with Leray-Lions operator",,,,,"math.NA cs.NA","http://arxiv.org/licenses/nonexclusive-distrib/1.0/","  *The gradient discretisation method (GDM) is a generic framework, covering
many classical methods (Finite Elements, Finite Volumes, Discontinuous
Galerkin, etc.), for designing and analysing numerical schemes for diffusion
models. In this paper, we study the GDM for a general stochastic evolution
problem based on a Leray--Lions type operator. The problem contains the
stochastic $p$-Laplace equation as a particular case. The convergence of the
Gradient Scheme (GS) solutions is proved by using Discrete Functional Analysis
techniques, Skorohod theorem and the Kolmogorov test. In particular, we provide
an independent proof of the existence of weak martingale solutions for the
problem. In this way, we lay foundations and provide techniques for proving
convergence of the GS approximating stochastic partial differential equations.
","[{""version"":""v1"",""created"":""Sat, 25 Apr 2020 03:19:09 GMT""},{""version"":""v2"",""created"":""Tue, 29 Dec 2020 22:18:19 GMT""}]","2021-01-01"
"2004.12048","Liang Wang","Liang Wang, Zhenghan Wang","In and around Abelian anyon models","substantial revisions with new introduction and an added summary
  section",,"10.1088/1751-8121/abc6c0",,"math.QA quant-ph","http://arxiv.org/licenses/nonexclusive-distrib/1.0/","  Anyon models are algebraic structures that model universal topological
properties in topological phases of matter and can be regarded as mathematical
characterization of topological order in two spacial dimensions. It is
conjectured that every anyon model, or mathematically unitary modular tensor
category, can be realized as the representation category of some chiral
conformal field theory, or mathematically vertex operator algebra/local
conformal net. This conjecture is known to be true for abelian anyon models
providing support for the conjecture. We reexamine abelian anyon models from
several different angles. First anyon models are algebraic data for both
topological quantum field theories and chiral conformal field theories. While
it is known that each abelian anyon model can be realized by a quantum abelian
Chern-Simons theory and chiral conformal field theory, the construction is not
algorithmic. Our goal is to provide such an explicit algorithm for a $K$-matrix
in Chern-Simons theory and a positive definite even one for a lattice conformal
field theory. Secondly anyon models and chiral conformal field theories
underlie the bulk-edge correspondence for topological phases of matter. But
there are interesting subtleties in this correspondence when stability of the
edge theory and topological symmetry are taken into consideration. Therefore,
our focus is on the algorithmic reconstruction of extremal chiral conformal
field theories with small central charges. Finally we conjecture that a much
stronger reconstruction holds for abelian anyon models: every abelian anyon
model can be realized as the representation category of some non-lattice
extremal vertex operator algebra generalizing the moonshine realization of the
trivial anyon model.
","[{""version"":""v1"",""created"":""Sat, 25 Apr 2020 03:39:43 GMT""},{""version"":""v2"",""created"":""Wed, 20 May 2020 14:37:23 GMT""},{""version"":""v3"",""created"":""Wed, 21 Oct 2020 02:23:51 GMT""}]","2020-12-30"
"2004.12049","\'Angel Guti\'errez Rubio","Angel Gutierrez-Rubio, Peter Stano, Daniel Loss","Optimal frequency estimation and its application to quantum dots","10 pages, 7 figures",,,,"cond-mat.mes-hall quant-ph","http://arxiv.org/licenses/nonexclusive-distrib/1.0/","  We address the interaction-time optimization for frequency estimation in a
two-level system. The goal is to estimate with maximum precision a stochastic
perturbation. Our approach is valid for any figure of merit used to define
optimality, and is illustrated for the variance and entropy. For the entropy,
we clarify the connection to maximum-likelihood estimation. We devise novel
estimation protocols with and without feedback. They outperform common
protocols given in the literature. We design a probabilistic self-consistent
protocol as an optimal estimation without feedback. It can improve current
experimental techniques and boost coherence times in quantum computing.
","[{""version"":""v1"",""created"":""Sat, 25 Apr 2020 03:44:02 GMT""},{""version"":""v2"",""created"":""Tue, 16 Feb 2021 14:00:26 GMT""}]","2021-02-17"
"2004.12050","Xianggao Wang","Xiang-Gao Wang (GXU), Long Li (GXU), Yuan-Pei Yang (YNU), Jia-Wei Luo
  (UNLV), Bing Zhang (UNLV), Da-Bin Lin (GXU), En-Wei Liang (GXU), Song-Mei Qin
  (GXUCM)","Is GRB 110715A the progenitor of FRB 171209?","Accepted for publication in ApJL; 8 pages, 5 figures",,"10.3847/2041-8213/ab8d1d",,"astro-ph.HE","http://arxiv.org/licenses/nonexclusive-distrib/1.0/","  The physical origin of fast radio bursts (FRBs) is unknown. Young magnetars
born from gamma-ray bursts (GRBs) have been suggested to be a possible central
engine of FRBs. We test such a hypothesis by systematically searching for
GRB-FRB spatial associations from 110 FRBs and 1440 GRBs. We find that one FRB
event, FRB 171209, discovered by the Parkes telescope is spatially coincident
with a historical long-duration GRB 110715A at $z=0.82$. The afterglow of GRB
110715A is consistent with being powered by a millisecond magnetar. The
extragalactic dispersion measure of FRB 171209 is in excess of that contributed
by the intergalactic medium, which can be interpreted as being contributed by a
young supernova remnant associated with the GRB. Overall, the significance of
the association is $(2.28 - 2.55) \sigma$. If the association is indeed
physical, our result suggests that the magnetars associated with long GRBs can
be the progenitors of at least some FRBs.
","[{""version"":""v1"",""created"":""Sat, 25 Apr 2020 03:55:39 GMT""}]","2020-05-20"
