"2004.11942","Leandro Salemi","Leandro Salemi, Marco Berritta and Peter M. Oppeneer","Quantitative comparison of electrically induced spin and orbital
  polarizations in heavy-metal/3d-metal bilayers","21 pages, 15 figures","Phys. Rev. Materials 5, 074407 (2021)","10.1103/PhysRevMaterials.5.074407",,"cond-mat.mtrl-sci","http://arxiv.org/licenses/nonexclusive-distrib/1.0/","  Electrical control of magnetization is of crucial importance for integrated
spintronics devices. Spin-orbit torques (SOT) in heavy-metal/ferromagnetic
heterostructures have emerged as promising tool to achieve efficiently
current-induced magnetization reversal. However, the microscopic origin of the
SOT is being debated,with the spin Hall effect (SHE) due to nonlocal spin
currents and the spin Rashba-Edelstein effect (SREE) due to local spin
polarization at the interface being the primary candidates. We investigate the
electrically induced out-of-equilibrium spin and orbital polarizations in pure
Pt films and in Pt/3d-metal (Co, Ni, Cu) bilayer films using ab initio
electronic structure methods and linear-response theory. We compute
atom-resolved response quantities that allow us to identify the induced
spin-polarization contributions that lead to fieldlike SOTs, mostly associated
with the SREE, and dampinglike (DL) SOTs, mostly associated with the SHE, and
compare their relative magnitude, dependence on the magnetization direction, as
well as their Pt-layer thickness dependence. We find that both the FL and DL
components contribute to the resulting SOT at the Pt/Co and Pt/Ni interfaces,
with the former contributions being larger at the Pt interface layer and the
latter larger in the Co or Ni layers. Our calculations show that the
electrically-induced transverse orbital polarization is exceedingly larger than
the induced spin polarization and present even without spin-orbit coupling, in
contrast to the spin polarization.
","[{""version"":""v1"",""created"":""Fri, 24 Apr 2020 18:47:53 GMT""},{""version"":""v2"",""created"":""Mon, 14 Dec 2020 09:23:00 GMT""},{""version"":""v3"",""created"":""Mon, 18 Jan 2021 12:44:21 GMT""},{""version"":""v4"",""created"":""Wed, 20 Jan 2021 15:48:25 GMT""},{""version"":""v5"",""created"":""Mon, 14 Jun 2021 13:53:50 GMT""}]","2021-07-21"
"2004.11943","Maria-Alexandra Barina","Maria-Alexandra Barina and Gabriel Barina","From elusive to ubiquitous: understanding smart cities",,,,,"cs.CY","http://arxiv.org/licenses/nonexclusive-distrib/1.0/","  Converting the city into a ""smart"" one is the emerging strategy of
alleviating the problems generated by the rapid population growth in most urban
areas, i.e., urbanisation. However, as the rate in which the different concepts
of the smart city architecture are implemented is very high, academic research
pertaining these advancements simply can not keep up. To improve the existing
knowledge-base regarding the concept of smart cities, this paper reviews the
existing definitions, as well as its architectures, based on an in-depth
literature review of relevant studies and research fields alike. Additionally,
we also provide our own definition of the smart city concept.
","[{""version"":""v1"",""created"":""Fri, 24 Apr 2020 18:48:55 GMT""}]","2020-04-28"
"2004.11944","Stefan Forcey","Stefan Forcey, Drew Scalzo","Galois connections for phylogenetic networks and their polytopes",,,,,"math.CO","http://arxiv.org/licenses/nonexclusive-distrib/1.0/","  We describe Galois connections which arise between two kinds of combinatorial
structures, both of which generalize trees with labelled leaves, and then apply
those connections to a family of polytopes.
  The graphs we study can be imbued with metric properties or associated to
vectors. Famous examples are the Billera-Holmes-Vogtmann metric space of
phylogenetic trees, and the Balanced Minimal Evolution polytopes of
phylogenetic trees described by Eickmeyer, Huggins, Pachter and Yoshida.
Recently the space of trees has been expanded to split networks by Devadoss and
Petti, while the definition of phylogenetic polytopes has been generalized to
encompass 1-nested phylogenetic networks, by Durell and Forcey. The first
Galois connection we describe is a reflection between the (unweighted) circular
split networks and the 1-nested phylogenetic networks. Another Galois
connection exists between certain metric versions of these structures.
Reflection between the purely combinatorial posets becomes a coreflection in
the geometric case.
  Our chief contributions here, beyond the discovery of the Galois connections,
are: a translation between approaches using PC-trees and networks, a new way to
look at weightings on networks, and a fuller characterization of faces of the
phylogenetic polytopes.
","[{""version"":""v1"",""created"":""Fri, 24 Apr 2020 18:51:30 GMT""},{""version"":""v2"",""created"":""Fri, 24 Jul 2020 00:19:55 GMT""}]","2020-07-27"
"2004.11945","Norma Canosa","N. Canosa, R. Rossignoli, Javier Garcia, Swapan Mandal, and Kartick
  Chandra Saha","Nonlinear effects on the dynamics of quantum harmonic modes coupled
  through angular momentum","17 pages, 5 figures, final version","Journal of Physics B: At. Mol. Opt. Phys. 53 215402 (2020)","10.1088/1361-6455/abb3ad",,"quant-ph","http://arxiv.org/licenses/nonexclusive-distrib/1.0/","  We investigate nonlinear effects on the dynamics of entanglement and other
quantum observables in a system of two harmonic modes coupled through angular
momentum. The nonlinearity arises from a quartic anharmonic term in each mode.
The emergence and evolution of entanglement, non-gaussianity, photon number,
photon antibunching and squeezing are examined for different initial product
coherent states and couplings, through exact diagonalization in a truncated
basis. It is shown that the anharmonic terms, even if weak, can lead to very
significant effects for such initial states, considerably enhancing and
stabilizing entanglement and leading to a non negligible non-gaussianity of the
evolved states. They also affect other observables, stabilizing the dynamics
after an initial transient regime, for not too small initial average
populations of each mode. Analytic short-time approximate expressions are also
provided.
","[{""version"":""v1"",""created"":""Fri, 24 Apr 2020 19:12:38 GMT""},{""version"":""v2"",""created"":""Sat, 10 Oct 2020 17:20:10 GMT""}]","2020-10-13"
"2004.11946","Fei Sun","Fei Sun, Minghai Qin, Tianyun Zhang, Liu Liu, Yen-Kuang Chen, Yuan Xie","Computation on Sparse Neural Networks: an Inspiration for Future
  Hardware","9 pages, 3 figures",,,,"cs.LG cs.NE stat.ML","http://arxiv.org/licenses/nonexclusive-distrib/1.0/","  Neural network models are widely used in solving many challenging problems,
such as computer vision, personalized recommendation, and natural language
processing. Those models are very computationally intensive and reach the
hardware limit of the existing server and IoT devices. Thus, finding better
model architectures with much less amount of computation while maximally
preserving the accuracy is a popular research topic. Among various mechanisms
that aim to reduce the computation complexity, identifying the zero values in
the model weights and in the activations to avoid computing them is a promising
direction.
  In this paper, we summarize the current status of the research on the
computation of sparse neural networks, from the perspective of the sparse
algorithms, the software frameworks, and the hardware accelerations. We observe
that the search for the sparse structure can be a general methodology for
high-quality model explorations, in addition to a strategy for high-efficiency
model execution. We discuss the model accuracy influenced by the number of
weight parameters and the structure of the model. The corresponding models are
called to be located in the weight dominated and structure dominated regions,
respectively. We show that for practically complicated problems, it is more
beneficial to search large and sparse models in the weight dominated region. In
order to achieve the goal, new approaches are required to search for proper
sparse structures, and new sparse training hardware needs to be developed to
facilitate fast iterations of sparse models.
","[{""version"":""v1"",""created"":""Fri, 24 Apr 2020 19:13:50 GMT""}]","2020-04-28"
"2004.11947","Jiri Kubalik","J. Kubal\'ik, E. Derner, R. Babu\v{s}ka","Symbolic Regression Driven by Training Data and Prior Knowledge","9 pages, 4 figures, 3 tables",,"10.1145/3377930.3390152",,"cs.LG cs.AI cs.NE cs.RO stat.ML","http://arxiv.org/licenses/nonexclusive-distrib/1.0/","  In symbolic regression, the search for analytic models is typically driven
purely by the prediction error observed on the training data samples. However,
when the data samples do not sufficiently cover the input space, the prediction
error does not provide sufficient guidance toward desired models. Standard
symbolic regression techniques then yield models that are partially incorrect,
for instance, in terms of their steady-state characteristics or local behavior.
If these properties were considered already during the search process, more
accurate and relevant models could be produced. We propose a multi-objective
symbolic regression approach that is driven by both the training data and the
prior knowledge of the properties the desired model should manifest. The
properties given in the form of formal constraints are internally represented
by a set of discrete data samples on which candidate models are exactly
checked. The proposed approach was experimentally evaluated on three test
problems with results clearly demonstrating its capability to evolve realistic
models that fit the training data well while complying with the prior knowledge
of the desired model characteristics at the same time. It outperforms standard
symbolic regression by several orders of magnitude in terms of the mean squared
deviation from a reference model.
","[{""version"":""v1"",""created"":""Fri, 24 Apr 2020 19:15:06 GMT""}]","2020-04-28"
"2004.11948","Anh Tran","Anh Tran, John A. Mitchell, Laura P. Swiler, Tim Wildey","An active learning high-throughput microstructure calibration framework
  for solving inverse structure-process problems in materials informatics","Acta Materialia",,,,"cs.CE","http://arxiv.org/licenses/nonexclusive-distrib/1.0/","  Determining a process-structure-property relationship is the holy grail of
materials science, where both computational prediction in the forward direction
and materials design in the inverse direction are essential. Problems in
materials design are often considered in the context of process-property
linkage by bypassing the materials structure, or in the context of
structure-property linkage as in microstructure-sensitive design problems.
However, there is a lack of research effort in studying materials design
problems in the context of process-structure linkage, which has a great
implication in reverse engineering. In this work, given a target
microstructure, we propose an active learning high-throughput microstructure
calibration framework to derive a set of processing parameters, which can
produce an optimal microstructure that is statistically equivalent to the
target microstructure. The proposed framework is formulated as a noisy
multi-objective optimization problem, where each objective function measures a
deterministic or statistical difference of the same microstructure descriptor
between a candidate microstructure and a target microstructure. Furthermore, to
significantly reduce the physical waiting wall-time, we enable the
high-throughput feature of the microstructure calibration framework by adopting
an asynchronously parallel Bayesian optimization by exploiting high-performance
computing resources. Case studies in additive manufacturing and grain growth
are used to demonstrate the applicability of the proposed framework, where
kinetic Monte Carlo (kMC) simulation is used as a forward predictive model,
such that for a given target microstructure, the target processing parameters
that produced this microstructure are successfully recovered.
","[{""version"":""v1"",""created"":""Fri, 24 Apr 2020 19:16:22 GMT""}]","2020-04-28"
"2004.11949","Marina Edelson-Averbukh","Taran Driver, Vitali Averbukh, Leszek J. Frasinski, Jon P. Marangos
  and Marina Edelson-Averbukh","Two-dimensional partial covariance mass spectrometry for the top-down
  analysis of intact proteins",,,,,"physics.chem-ph q-bio.BM","http://arxiv.org/licenses/nonexclusive-distrib/1.0/","  Two-dimensional partial covariance mass spectrometry (2D-PC-MS) exploits the
inherent fluctuations of fragment ion abundances across a series of tandem mass
spectra, to identify correlated pairs of fragment ions produced along the same
fragmentation pathway of the same parent (e.g. peptide) ion. Here, we apply
2D-PC-MS to the analysis of intact protein ions in a standard linear ion trap
mass analyzer, using the fact that the fragment-fragment correlation signals
are much more specific to bio-molecular sequence than 1D MS/MS signals at the
same mass accuracy and resolution. We show that from the distribution of
signals on a 2D-PC-MS map it is possible to extract the charge state of both
parent and fragment ions without resolving the isotopic envelope. Furthermore,
the 2D map of fragment-fragment correlations naturally reveals the secondary
decomposition pathways of the fragment ions. We access this spectral
information using an adapted version of the Hough transform. We demonstrate the
successful identification of highly charged, intact protein molecules without
the need for high mass resolution. Using this technique we also perform the in
silico deconvolution of the overlapping fragment ion signals from two
co-isolated and co-fragmented intact protein molecules, demonstrating a viable
new method for the concurrent mass spectrometric identification of a mixture of
intact protein ions from the same fragment ion spectrum.
","[{""version"":""v1"",""created"":""Fri, 24 Apr 2020 19:18:54 GMT""},{""version"":""v2"",""created"":""Wed, 2 Dec 2020 21:55:19 GMT""}]","2020-12-04"
"2004.11950","Leon Takhtajan","Leon A Takhtajan","Etudes of the resolvent","35 pages","Uspekhi Mat. Nauk, 75:1(451) (2020), 155-194 (in Russian); English
  translation: Russian Math. Surveys, 75:1 (2020), 147-186","10.1070/RM9917",,"math.SP hep-th","http://arxiv.org/licenses/nonexclusive-distrib/1.0/","  Based on the notion of the resolvent and on the Hilbert identities, this
paper presents a number of classical results in the theory of differential
operators and some of their applications to the theory of automorphic functions
and number theory from a unified point of view. For instance, for the
Sturm-Liouville operator there is a derivation of the Gelfand-Levitan trace
formula, and for the one-dimensional Schroedinger operator a derivation of
Faddeev's formula for the characteristic determinant and the Zakharov-Faddeev
trace identities. Recent results on the spectral theory of a certain
functional-difference operator arising in conformal field theory are then
presented. The last section of the survey is devoted to the Laplace operator on
a fundamental domain of a Fuchsian group of the first kind on the Lobachevsky
plane. An algebraic scheme is given for proving analytic continuation of the
integral kernel of the resolvent of the Laplace operator and the
Eisenstein-Maass series. In conclusion, there is a discussion of the relation
between the values of the Eisenstein-Maass series at Heegner points and
Dedekind zeta-functions of imaginary quadratic fields, and it is explained why
pseudo-cuspforms for the case of the modular group do not provide any
information about the zeros of the Riemann zeta-function.
","[{""version"":""v1"",""created"":""Fri, 24 Apr 2020 19:20:47 GMT""}]","2020-06-24"
"2004.11951","Chris Gartland","Chris Gartland","Lipschitz Free Spaces over Locally Compact Metric Spaces","27 pages. Changes to names of some objects and addition of informal
  discussion of semi-embedding theorem. Implemented referee's corrections",,,,"math.FA math.MG","http://arxiv.org/licenses/nonexclusive-distrib/1.0/","  We prove that the Lipschitz free space over a certain type of discrete metric
space has the Radon-Nikod\'ym property. We also show that the Lipschitz free
space over a complete, locally compact metric space has the Schur or
approximation property whenever the Lipschitz free space over each compact
subset also has this property.
","[{""version"":""v1"",""created"":""Fri, 24 Apr 2020 19:25:08 GMT""},{""version"":""v2"",""created"":""Mon, 11 May 2020 18:49:13 GMT""},{""version"":""v3"",""created"":""Thu, 11 Feb 2021 02:05:24 GMT""}]","2021-02-12"
"2004.11952","Freek Witteveen","Freek Witteveen and Michael Walter","Bosonic entanglement renormalization circuits from wavelet theory","22 pages, 7 figures","SciPost Phys. 10, 143 (2021)","10.21468/SciPostPhys.10.6.143",,"quant-ph cond-mat.stat-mech hep-th math-ph math.MP","http://arxiv.org/licenses/nonexclusive-distrib/1.0/","  Entanglement renormalization is a unitary real-space renormalization scheme.
The corresponding quantum circuits or tensor networks are known as MERA, and
they are particularly well-suited to describing quantum systems at criticality.
In this work we show how to construct Gaussian bosonic quantum circuits that
implement entanglement renormalization for ground states of arbitrary free
bosonic chains. The construction is based on wavelet theory, and the dispersion
relation of the Hamiltonian is translated into a filter design problem. We give
a general algorithm that approximately solves this design problem and provide
an approximation theory that relates the properties of the filters to the
accuracy of the corresponding quantum circuits. Finally, we explain how the
continuum limit (a free bosonic quantum field) emerges naturally from the
wavelet construction.
","[{""version"":""v1"",""created"":""Fri, 24 Apr 2020 19:27:29 GMT""},{""version"":""v2"",""created"":""Fri, 23 Oct 2020 14:44:40 GMT""},{""version"":""v3"",""created"":""Thu, 24 Jun 2021 20:27:28 GMT""}]","2021-06-28"
"2004.11953","Johannes Bleher","Johannes Bleher, Michael Bleher and Thomas Dimpfl","From orders to prices: A stochastic description of the limit order book
  to forecast intraday returns","82 pages, 18 figures",,,,"q-fin.TR econ.EM q-fin.MF q-fin.ST stat.AP","http://arxiv.org/licenses/nonexclusive-distrib/1.0/","  We propose a microscopic model to describe the dynamics of the fundamental
events in the limit order book (LOB): order arrivals and cancellations. It is
based on an operator algebra for individual orders and describes their effect
on the LOB. The model inputs are arrival and cancellation rate distributions
that emerge from individual behavior of traders, and we show how prices and
liquidity arise from the LOB dynamics. In a simulation study we illustrate how
the model works and highlight its sensitivity with respect to assumptions
regarding the collective behavior of market participants. Empirically, we test
the model on a LOB snapshot of XETRA, estimate several linearized model
specifications, and conduct in- and out-of-sample forecasts.The in-sample
results based on contemporaneous information suggest that our model describes
returns very well, resulting in an adjusted $R^2$ of roughly 80%. In the more
realistic setting where only past information enters the model, we observe an
adjusted $R^2$ around 15%. The direction of the next return can be predicted
(out-of-sample) with an accuracy above 75% for time horizons below 10 minutes.
On average, we obtain an RMSPE that is 10 times lower than values documented in
the literature.
","[{""version"":""v1"",""created"":""Fri, 24 Apr 2020 19:28:54 GMT""},{""version"":""v2"",""created"":""Tue, 4 May 2021 22:33:22 GMT""}]","2021-05-06"
"2004.11954","Aman Madaan","Aman Madaan, Shruti Rijhwani, Antonios Anastasopoulos, Yiming Yang,
  Graham Neubig","Practical Comparable Data Collection for Low-Resource Languages via
  Images","Accepted for poster presentation at the Practical Machine Learning
  for Developing Countries (PML4DC) workshop, ICLR 2020",,,,"cs.CL","http://creativecommons.org/licenses/by/4.0/","  We propose a method of curating high-quality comparable training data for
low-resource languages with monolingual annotators. Our method involves using a
carefully selected set of images as a pivot between the source and target
languages by getting captions for such images in both languages independently.
Human evaluations on the English-Hindi comparable corpora created with our
method show that 81.1% of the pairs are acceptable translations, and only 2.47%
of the pairs are not translations at all. We further establish the potential of
the dataset collected through our approach by experimenting on two downstream
tasks - machine translation and dictionary extraction. All code and data are
available at https://github.com/madaan/PML4DC-Comparable-Data-Collection.
","[{""version"":""v1"",""created"":""Fri, 24 Apr 2020 19:30:38 GMT""},{""version"":""v2"",""created"":""Tue, 28 Apr 2020 19:51:43 GMT""}]","2020-04-30"
"2004.11955","Mohammed Barkatou","Mohammed Barkatou","Quelques propri\'et\'es qualitatives pour le probl\`eme de surfaces de
  quadrature dans le plan","12 pages, in French",,,,"math.OC","http://arxiv.org/licenses/nonexclusive-distrib/1.0/","  In this paper, we begin by giving a necessary and sufficient condition of
existence for the quadrature surfaces problem in the case where the term source
is a uniform density supported by a segment. Then, we use the Steiner
continuous symmetrization to prove that the obtained solution is symmetric with
respect the x-coordinate axis and that its boundary is analytic.
  -----------
  Dans ce papier, nous commen\c{c}ons par donner une condition n\'ecessaire et
suffisante d'existence de solutions pour le probl\`eme de surfaces de
quadrature dans le cas o\`u le terme source est une densit\'e support\'ee par
un segment. Ensuite, en utilisant la sym\'etrisation de Steiner continue, nous
montrons que la solution obtenue est sym\'etrique par rapport \`a l'axe des
abscisses et que son bord est analytique.
","[{""version"":""v1"",""created"":""Fri, 24 Apr 2020 19:32:50 GMT""}]","2020-04-28"
"2004.11956","Ryan Corey","Ryan M. Corey and Andrew C. Singer","Binaural Audio Source Remixing with Microphone Array Listening Devices","To appear at ICASSP 2020",,,,"eess.AS cs.SD","http://arxiv.org/licenses/nonexclusive-distrib/1.0/","  Augmented listening devices, such as hearing aids and augmented reality
headsets, enhance human perception by changing the sounds that we hear.
Microphone arrays can improve the performance of listening systems in noisy
environments, but most array-based listening systems are designed to isolate a
single sound source from a mixture. This work considers a source-remixing
filter that alters the relative level of each source independently. Remixing
rather than separating sounds can help to improve perceptual transparency: it
causes less distortion to the signal spectrum and especially to the interaural
cues that humans use to localize sounds in space.
","[{""version"":""v1"",""created"":""Fri, 24 Apr 2020 19:34:38 GMT""}]","2020-04-28"
"2004.11957","Yohei Fuji","Yohei Fuji and Yuto Ashida","Measurement-induced quantum criticality under continuous monitoring","15 pages, 14 figures, v3: This version includes corrections to the
  results obtained by an erroneous numerical algorithm in the previous
  versions, which caused quantitative changes to the numerical results","Phys. Rev. B 102, 054302 (2020)","10.1103/PhysRevB.102.054302",,"cond-mat.stat-mech cond-mat.dis-nn cond-mat.quant-gas cond-mat.str-el quant-ph","http://arxiv.org/licenses/nonexclusive-distrib/1.0/","  We investigate entanglement phase transitions from volume-law to area-law
entanglement in a quantum many-body state under continuous position measurement
on the basis of the quantum trajectory approach. We find the signatures of the
transitions as peak structures in the mutual information as a function of
measurement strength, as previously reported for random unitary circuits with
projective measurements. At the transition points, the entanglement entropy
scales logarithmically and various physical quantities scale algebraically,
implying emergent conformal criticality, for both integrable and nonintegrable
one-dimensional interacting Hamiltonians; however, such transitions have been
argued to be absent in noninteracting regimes in some previous studies. With
the aid of $U(1)$ symmetry in our model, the measurement-induced criticality
exhibits a spectral signature resembling a Tomonaga-Luttinger liquid theory
from symmetry-resolved entanglement. These intriguing critical phenomena are
unique to steady-state regimes of the conditional dynamics at the
single-trajectory level, and are absent in the unconditional dynamics obeying
the Lindblad master equation, in which the system ends up with the featureless,
infinite-temperature mixed state. We also propose a possible experimental setup
to test the predicted entanglement transition based on the subsystem
particle-number fluctuations. This quantity should readily be measured by the
current techniques of quantum gas microscopy and is in practice easier to
obtain than the entanglement entropy itself.
","[{""version"":""v1"",""created"":""Fri, 24 Apr 2020 19:35:28 GMT""},{""version"":""v2"",""created"":""Wed, 12 Aug 2020 10:13:11 GMT""},{""version"":""v3"",""created"":""Fri, 12 Feb 2021 03:43:47 GMT""}]","2021-02-15"
