"2004.12659","Jiajun Zhang","Jiajun Zhang, Bikash R. Dinda, Md. Wali Hossain, Anjan A. Sen and
  Wentao Luo","A study on Cubic Galileon Gravity Using N-body Simulations","22 pages, 13 figures, accepted by PRD","Phys. Rev. D 102, 043510 (2020)","10.1103/PhysRevD.102.043510","CTPU-PTC-20-09","astro-ph.CO gr-qc","http://arxiv.org/licenses/nonexclusive-distrib/1.0/","  We use N-body simulation to study the structure formation in the Cubic
Galileon Gravity model where along with the usual kinetic and potential term we
also have a higher derivative self-interaction term. We find that the large
scale structure provides a unique constraining power for this model. The matter
power spectrum, halo mass function, galaxy-galaxy weak lensing signal, marked
density power spectrum as well as count in cell are measured. The simulations
show that there are less massive halos in the Cubic Galileon Gravity model than
corresponding $\Lambda$CDM model and the marked density power spectrum in these
two models are different by more than $10\%$. Furthermore, the Cubic Galileon
model shows significant differences in voids compared to $\Lambda$CDM. The
number of low density cells is far higher in the Cubic Galileon model than that
in the $\Lambda$CDM model. Therefore, it would be interesting to put
constraints on this model using future large scale structure observations,
especially in void regions.
","[{""version"":""v1"",""created"":""Mon, 27 Apr 2020 09:10:38 GMT""},{""version"":""v2"",""created"":""Thu, 23 Jul 2020 05:56:38 GMT""}]","2020-08-12"
"2004.12660","Xiaoliang Li","Tangyu Jiang, Haigang Li, Xiaoliang Li","On the exterior Dirichlet problem for a class of fully nonlinear
  elliptic equations","23 pages",,,,"math.AP","http://arxiv.org/licenses/nonexclusive-distrib/1.0/","  In this paper, we mainly establish the existence and uniqueness theorem for
solutions of the exterior Dirichlet problem for a class of fully nonlinear
second-order elliptic equations related to the eigenvalues of the Hessian, with
prescribed generalized symmetric asymptotic behavior at infinity. Moreover, we
give some new results for the Hessian equations, Hessian quotient equations and
the special Lagrangian equations, which have been studied previously.
","[{""version"":""v1"",""created"":""Mon, 27 Apr 2020 09:16:36 GMT""},{""version"":""v2"",""created"":""Fri, 1 May 2020 13:35:18 GMT""},{""version"":""v3"",""created"":""Thu, 7 May 2020 09:17:01 GMT""}]","2020-05-08"
"2004.12661","Mark Burgess","Mark Burgess","Information and Causality in Promise Theory",,,,,"cs.MA cs.DC","http://arxiv.org/licenses/nonexclusive-distrib/1.0/","  The explicit link between Promise Theory and Information Theory, while
perhaps obvious, is laid out explicitly here. It's shown how causally related
observations of promised behaviours relate to the probabilistic formulation of
causal information in Shannon's theory, and thus clarify the meaning of
autonomy or causal independence, and further the connection between information
and causal sets. Promise Theory helps to make clear a number of assumptions
which are commonly taken for granted in causal descriptions. The concept of a
promise is hard to escape. It serves as proxy for intent, whether a priori or
by inference, and it is intrinsic to the interpretations of observations in the
latter.
","[{""version"":""v1"",""created"":""Mon, 27 Apr 2020 09:18:42 GMT""}]","2020-04-28"
"2004.12662","CaiChang Li","Gui-Jun Ding, Stephen F. King, Cai-Chang Li, Ye-Ling Zhou","Modular Invariant Models of Leptons at Level 7","45 pages, 3 figures",,,"USTC-ICTS/PCFT-20-11","hep-ph","http://arxiv.org/licenses/nonexclusive-distrib/1.0/","  We consider for the first time level 7 modular invariant flavour models where
the lepton mixing originates from the breaking of modular symmetry and
couplings responsible for lepton masses are modular forms. The latter are
decomposed into irreducible multiplets of the finite modular group $\Gamma_7$,
which is isomorphic to $PSL(2,Z_{7})$, the projective special linear group of
two dimensional matrices over the finite Galois field of seven elements,
containing 168 elements, sometimes written as $PSL_2(7)$ or $\Sigma(168)$. At
weight 2, there are 26 linearly independent modular forms, organised into a
triplet, a septet and two octets of $\Gamma_7$. A full list of modular forms up
to weight 8 are provided. Assuming the absence of flavons, the simplest
modular-invariant models based on $\Gamma_7$ are constructed, in which
neutrinos gain masses via either the Weinberg operator or the type-I seesaw
mechanism, and their predictions compared to experiment.
","[{""version"":""v1"",""created"":""Mon, 27 Apr 2020 09:22:01 GMT""}]","2020-04-28"
"2004.12663","Yang Gao","Yang Gao (SYSU), Lei Qian (NAOC), Di Li (NAOC)","Observational features of exoplanetary synchrotron radio bursts","Accepted for publication in ApJ, 3 figures",,"10.3847/1538-4357/ab881b",,"astro-ph.EP astro-ph.SR","http://arxiv.org/licenses/nonexclusive-distrib/1.0/","  Magnetic fields of exoplanets are important in shielding the planets from
cosmic rays and interplanetary plasma. Due to the interaction with the
electrons from their host stars, the exoplanetary magnetospheres are predicted
to have both cyclotron and synchrotron radio emissions, of which neither has
been definitely identified in observations yet. As the coherent cyclotron
emission has been extensively studied in literatures, here we focus on the
planetary synchrotron radiation with bursty behaviors (i.e., radio flares)
caused by the outbreaks of energetic electron ejections from the host star. Two
key parameters of the bursty synchrotron emissions, namely the flux density and
burst rate, and two key features namely the burst light curve and frequency
shift, are predicted for star - hot Jupiter systems. The planetary orbital
phase - burst rate relation is also considered as the signature of star-planet
interactions (SPI). As examples, previous X-ray and radio observations of two
well studied candidate systems, HD 189733 and V830 \tau, are adopted to predict
their specific burst rates and fluxes of bursty synchrotron emissions for
further observational confirmations. The detectability of such emissions by
current and upcoming radio telescopes shows that we are at the dawn of
discoveries.
","[{""version"":""v1"",""created"":""Mon, 27 Apr 2020 09:24:48 GMT""}]","2020-05-27"
"2004.12664","Oleksandr Sobol Dr.","O.O. Sobol, E.V. Gorbar, A.I. Momot, and S.I. Vilchinskii","Schwinger production of scalar particles during and after inflation from
  the first principles","22 pages, 4 figures","Phys. Rev. D 102, 023506 (2020)","10.1103/PhysRevD.102.023506",,"gr-qc astro-ph.CO hep-ph hep-th","http://arxiv.org/licenses/nonexclusive-distrib/1.0/","  By using the first-principles approach, we derive a system of three quantum
kinetic equations governing the production and evolution of charged scalar
particles by an electric field in an expanding universe. Analyzing the
ultraviolet asymptotic behavior of the kinetic functions, we found the
divergent parts of the electric current and the energy-momentum tensor of the
produced particles and determined the corresponding counterterms. The
renormalized system of equations is used to study the generation of
electromagnetic fields during and after inflation in the kinetic coupling model
$\mathcal{L}_{\rm EM}=-(1/4)f^{2}(\phi)F_{\mu\nu}F^{\mu\nu}$ with the Ratra
coupling function $f=\exp(\beta\phi/M_{p})$. It is found that the electric
current of created particles is retarded with respect to the electric field.
This leads to an oscillatory behavior of both quantities in agreement with the
results obtained previously in phenomenological kinetic and hydrodynamical
approaches.
","[{""version"":""v1"",""created"":""Mon, 27 Apr 2020 09:24:56 GMT""},{""version"":""v2"",""created"":""Thu, 30 Apr 2020 21:02:56 GMT""},{""version"":""v3"",""created"":""Sat, 1 Aug 2020 23:35:10 GMT""}]","2020-08-04"
"2004.12665","Jae Woo Lee","Seo Yoon Chae, Kyoung-Eun Lee, Hyun Min Lee, Nam Jun, Quang Ahn Le,
  Biseko Juma Mafwele, Tae Ho Lee, Doo Hwan Kim, and Jae Woo Lee","Estimation of Infection Rate and Prediction of Initial Infected
  Individuals of COVID-19","12 pages, 2 figures",,,,"q-bio.PE nlin.AO physics.soc-ph","http://arxiv.org/licenses/nonexclusive-distrib/1.0/","  We consider the pandemic spreading of COVID-19 for some selected countries
after the outbreak of the coronavirus in Wuhan City, China. We estimated the
infection rate and the initial infected individuals of COVID-19 by using the
officially reported data at the early stage of the epidemic for the susceptible
(S), infectable (I), quarantined (Q), and the cofirmed recovered (Rk)
population model, so called SIQRk model. In the reported data we know the
quarantined cases and the recovered cases. We can not know the recovered cases
from the asymptomatic cases. In the SIQRk model we can estimated the model
parameters and the initial infecting cases (confirmed ans asymtomatic cases)
from the data fits. We obtained the infection rate in the range between 0.233
and 0.462, the basic reproduction number Ro in the range between 1.8 and 3.5,
and the initial number of infected individuals in the range betwee 10 and 8409
for some selected countries. By using fitting parameters we estimated the
maximum time of the infection for Germany when the government are performing
the quarantine policy. The disease is undergoing to the calm state about six
months after first patients were identified.
","[{""version"":""v1"",""created"":""Mon, 27 Apr 2020 09:27:09 GMT""}]","2020-04-28"
"2004.12666","Guillaume Guiglion Dr","G. Guiglion, G. Matijevic, A. B. A. Queiroz, M. Valentini, M.
  Steinmetz, C. Chiappini, E. K. Grebel, P. J. McMillan, G. Kordopatis, A.
  Kunder, T. Zwitter, A. Khalatyan, F. Anders, H. Enke, I. Minchev, G. Monari,
  R. F. G. Wyse, O. Bienayme, J. Bland-Hawthorn, B. K. Gibson, J. F. Navarro,
  Q. Parker, W. Reid, G. M. Seabroke, A. Siebert","The RAdial Velocity Experiment (RAVE): Parameterisation of RAVE spectra
  based on convolutional neural networks","31 pages, 30 figures, accepted for publication in A&A, in Press","A&A 644, A168 (2020)","10.1051/0004-6361/202038271",,"astro-ph.GA astro-ph.IM astro-ph.SR","http://arxiv.org/licenses/nonexclusive-distrib/1.0/","  In the context of large spectroscopic surveys of stars, data-driven methods
are key in deducing physical parameters for millions of spectra in a short
time. Convolutional neural networks (CNNs) enable us to connect observables
(e.g. spectra, stellar magnitudes) to physical properties (atmospheric
parameters, chemical abundances, or labels in general). We trained a CNN,
adopting stellar atmospheric parameters and chemical abundances from APOGEE
DR16 (resolution R=22500) data as training set labels. As input, we used parts
of the intermediate-resolution RAVE DR6 spectra (R~7500) overlapping with the
APOGEE DR16 data as well as broad-band ALL_WISE and 2MASS photometry, together
with Gaia DR2 photometry and parallaxes. We derived precise atmospheric
parameters Teff, log(g), and [M/H] along with the chemical abundances of
[Fe/H], [alpha/M], [Mg/Fe], [Si/Fe], [Al/Fe], and [Ni/Fe] for 420165 RAVE
spectra. The precision typically amounts to 60K in Teff, 0.06 in log(g) and
0.02-0.04 dex for individual chemical abundances. Incorporating photometry and
astrometry as additional constraints substantially improves the results in
terms of the accuracy and precision of the derived labels. We provide a
catalogue of CNN-trained atmospheric parameters and abundances along with their
uncertainties for 420165 stars in the RAVE survey. CNN-based methods provide a
powerful way to combine spectroscopic, photometric, and astrometric data
without the need to apply any priors in the form of stellar evolutionary
models. The developed procedure can extend the scientific output of RAVE
spectra beyond DR6 to ongoing and planned surveys such as Gaia RVS, 4MOST, and
WEAVE. We call on the community to place a particular collective emphasis and
on efforts to create unbiased training samples for such future spectroscopic
surveys.
","[{""version"":""v1"",""created"":""Mon, 27 Apr 2020 09:27:48 GMT""},{""version"":""v2"",""created"":""Thu, 30 Apr 2020 17:50:03 GMT""},{""version"":""v3"",""created"":""Mon, 2 Nov 2020 08:50:18 GMT""}]","2021-01-04"
"2004.12667","Paritosh Garg","Paritosh Garg, Sagar Kale, Lars Rohwedder, Ola Svensson","Robust Algorithms under Adversarial Injections",,,,,"cs.DS","http://arxiv.org/licenses/nonexclusive-distrib/1.0/","  In this paper, we study streaming and online algorithms in the context of
randomness in the input. For several problems, a random order of the input
sequence---as opposed to the worst-case order---appears to be a necessary evil
in order to prove satisfying guarantees. However, algorithmic techniques that
work under this assumption tend to be vulnerable to even small changes in the
distribution. For this reason, we propose a new \emph{adversarial injections}
model, in which the input is ordered randomly, but an adversary may inject
misleading elements at arbitrary positions. We believe that studying algorithms
under this much weaker assumption can lead to new insights and, in particular,
more robust algorithms. We investigate two classical combinatorial-optimization
problems in this model: Maximum matching and cardinality constrained monotone
submodular function maximization. Our main technical contribution is a novel
streaming algorithm for the latter that computes a $0.55$-approximation. While
the algorithm itself is clean and simple, an involved analysis shows that it
emulates a subdivision of the input stream which can be used to greatly limit
the power of the adversary.
","[{""version"":""v1"",""created"":""Mon, 27 Apr 2020 09:28:33 GMT""}]","2020-04-28"
"2004.12668","Fabian Isensee","Fabian Isensee and Klaus H. Maier-Hein","OR-UNet: an Optimized Robust Residual U-Net for Instrument Segmentation
  in Endoscopic Images",,,,,"eess.IV cs.CV","http://arxiv.org/licenses/nonexclusive-distrib/1.0/","  Segmentation of endoscopic images is an essential processing step for
computer and robotics-assisted interventions. The Robust-MIS challenge provides
the largest dataset of annotated endoscopic images to date, with 5983 manually
annotated images. Here we describe OR-UNet, our optimized robust residual 2D
U-Net for endoscopic image segmentation. As the name implies, the network makes
use of residual connections in the encoder. It is trained with the sum of Dice
and cross-entropy loss and deep supervision. During training, extensive data
augmentation is used to increase the robustness. In an 8-fold cross-validation
on the training images, our model achieved a mean (median) Dice score of 87.41
(94.35). We use the eight models from the cross-validation as an ensemble on
the test set.
","[{""version"":""v1"",""created"":""Mon, 27 Apr 2020 09:34:05 GMT""}]","2020-04-28"
"2004.12669","Andrei Khrennikov Yu","Andrei Khrennikov","Social laser model for the Bandwagon effect: generation of coherent
  information waves",,"Entropy 2020, 22(5), 559","10.3390/e22050559",,"physics.soc-ph q-bio.NC quant-ph","http://arxiv.org/licenses/nonexclusive-distrib/1.0/","  During the last years our society was often exposed to the coherent
information waves of high amplitudes. These are waves of huge social energy.
Often they are of the destructive character, a kind of information tsunami.
But, they can carry as well positive improvements in the human society, as
waves of decision making matching rational recommendations of societal
institutes. The main distinguishing features of these waves are their high
amplitude, coherence (homogeneous character of social actions generated by
them), and short time needed for their generation and relaxation. Such waves
can be treated as large scale exhibition of the Bandwagon effect. We show that
this socio-psychic phenomenon can be modeled on the basis of the recently
developed {\it social laser theory}. This theory can be used to model {\it
stimulated amplification of coherent social actions}. ""Actions"" are treated
very generally, from mass protests to votes and other collective decisions, as,
e.g., acceptance (often unconscious) of some societal recommendations. In this
paper, we concentrate on theory of laser resonators, physical vs. social. For
the latter, we analyze in very detail functioning of the internet based
Echo-Chambers. Their main purpose is increasing of the power of the quantum
information field as well as its coherence. Of course, the Bandwagon effect is
well known and well studied in social psychology. However, the social laser
theory gives the possibility to model it by using the general formalism of
quantum field theory. The paper contains minimum of mathematics and it can be
readable by researchers working in psychology, cognitive, social, and political
sciences; it might also be interesting for experts in information theory and
artificial intelligence.
","[{""version"":""v1"",""created"":""Mon, 27 Apr 2020 09:36:23 GMT""}]","2020-12-18"
"2004.12670","Gabriele Santin","Bernard Haasdonk and Tizian Wenzel and Gabriele Santin and Syn Schmitt","Biomechanical surrogate modelling using stabilized vectorial greedy
  kernel methods",,"Numerical Mathematics and Advanced Applications ENUMATH 2019","10.1007/978-3-030-55874-1_49",,"math.NA cs.LG cs.NA","http://arxiv.org/licenses/nonexclusive-distrib/1.0/","  Greedy kernel approximation algorithms are successful techniques for sparse
and accurate data-based modelling and function approximation. Based on a recent
idea of stabilization of such algorithms in the scalar output case, we here
consider the vectorial extension built on VKOGA. We introduce the so called
$\gamma$-restricted VKOGA, comment on analytical properties and present
numerical evaluation on data from a clinically relevant application, the
modelling of the human spine. The experiments show that the new stabilized
algorithms result in improved accuracy and stability over the non-stabilized
algorithms.
","[{""version"":""v1"",""created"":""Mon, 27 Apr 2020 09:38:12 GMT""},{""version"":""v2"",""created"":""Tue, 28 Apr 2020 07:25:55 GMT""}]","2021-05-20"
"2004.12671","Antti Per\""al\""a","Santeri Miihkinen, Jordi Pau, Antti Per\""al\""a, Maofa Wang","Rigidity of Volterra-type integral operators on Hardy spaces of the unit
  ball","18 pages",,,,"math.CV math.FA","http://arxiv.org/licenses/nonexclusive-distrib/1.0/","  We establish that the Volterra-type integral operator $J_b$ on the Hardy
spaces $H^p$ of the unit ball $\mathbb{B}_n$ exhibits a rather strong rigid
behavior. More precisely, we show that the compactness, strict singularity and
$\ell^p$-singularity of $J_b$ are equivalent on $H^p$ for any $1 \le p <
\infty$. Moreover, we show that the operator $J_b$ acting on $H^p$ cannot fix
an isomorphic copy of $\ell^2$ when $p \ne 2.$
","[{""version"":""v1"",""created"":""Mon, 27 Apr 2020 09:39:38 GMT""}]","2020-04-28"
"2004.12672","Takashi Kuroda","Takashi Kuroda, Siti Chalimah, Yuanzhao Yao, Naoki Ikeda, Yoshimasa
  Sugimoto, Kazuaki Sakoda","Apparatus for high-precision angle-resolved reflection spectroscopy in
  the mid-infrared region",,"Appl. Specrosc. 75, 259 (2021); open access","10.1177/0003702820931520",,"physics.app-ph physics.ins-det physics.optics","http://arxiv.org/licenses/nonexclusive-distrib/1.0/","  Fourier transform (FT) spectroscopy is a versatile technique for studying the
infrared (IR) optical response of solid-, liquid-, and gas-phase samples. In
standard FT-IR spectrometers, a light beam passing through a Michelson
interferometer is focused onto a sample with condenser optics. This design
enables us to examine relatively small samples, but the large solid angle of
the focused infrared beam makes it difficult to analyze angle-dependent
characteristics. Here we design and construct a high-precision angle-resolved
reflection setup compatible with a commercial FT-IR spectrometer. Our setup
converts the focused beam into an achromatically collimated beam with an angle
dispersion as high as 0.25$^\circ$. The setup also permits us to scan the
incident angle over ~8$^\circ$ across zero (normal incidence). The beam
diameter can be reduced to ~1 mm, which is limited by the sensitivity of an
HgCdTe detector. The small-footprint apparatus is easily installed in an FT-IR
sample chamber. As a demonstration of the capability of our reflection setup we
measure the angle-dependent mid-infrared reflectance of two-dimensional
photonic crystal slabs and determine the in-plane dispersion relation in the
vicinity of the $\Gamma$ point in momentum space. We observe the formation of
photonic Dirac cones, i.e., linear dispersions with an accidental degeneracy at
$\Gamma$, in an ideally designed sample. Our apparatus is useful for
characterizing various systems that have a strong in-plane anisotropy,
including photonic crystal waveguides, plasmonic metasurfaces, and molecular
crystalline films.
","[{""version"":""v1"",""created"":""Mon, 27 Apr 2020 09:40:51 GMT""}]","2021-03-12"
"2004.12673","ALICE Publications","ALICE Collaboration","J/$\psi$ production as a function of charged-particle multiplicity in
  p-Pb collisions at $\sqrt{\textit{s}_{\rm NN}}~=~8.16$ TeV","27 pages, 8 captioned figures, 3 tables, authors from page 22,
  published version, figures at http://alice-publications.web.cern.ch/node/6207","JHEP 2009 (2020) 162","10.1007/JHEP09(2020)162","CERN-EP-2020-058","nucl-ex hep-ex","http://creativecommons.org/licenses/by/4.0/","  Inclusive J/$\psi$ yields and average transverse momenta in p-Pb collisions
at a center-of-mass energy per nucleon pair $\sqrt{s_{\rm NN}}$ = 8.16 TeV are
measured as a function of the charged-particle pseudorapidity density with
ALICE. The J/$\psi$ mesons are reconstructed at forward $(2.03 < y_{\rm cms} <
3.53)$ and backward ($-4.46 < y_{\rm cms} < -2.96$) center-of-mass rapidity in
their dimuon decay channel while the charged-particle pseudorapidity density is
measured around midrapidity. The J/$\psi$ yields at forward and backward
rapidity normalized to their respective average values increase with the
normalized charged-particle pseudorapidity density, the former showing a weaker
increase than the latter. The normalized average transverse momenta at forward
and backward rapidity manifest a steady increase from low to high
charged-particle pseudorapidity density with a saturation beyond the average
value.
","[{""version"":""v1"",""created"":""Mon, 27 Apr 2020 09:41:27 GMT""},{""version"":""v2"",""created"":""Tue, 24 Aug 2021 15:07:44 GMT""}]","2021-08-25"
"2004.12674","Chaohong Lee","Chengyin Han, Jiahao Huang, Xunda Jiang, Ruihuan Fang, Yuxiang Qiu, Bo
  Lu, Chaohong Lee","Adaptive Bayesian algorithm for achieving desired quantum transition","11 pages, 6 figures","Optics Express 29, 21031 (2021)","10.1364/OE.431334",,"quant-ph cond-mat.quant-gas","http://arxiv.org/licenses/nonexclusive-distrib/1.0/","  Bayesian methods which utilize Bayes' theorem to update the knowledge of
desired parameters after each measurement, are used in a wide range of quantum
science. For various applications in quantum science, efficiently and
accurately determining a quantum transition frequency is essential. However,
the exact relation between a desired transition frequency and the controllable
experimental parameters is usually absent. Here, we propose an efficient scheme
to search the suitable conditions for a desired quantum transition via an
adaptive Bayesian algorithm, and experimentally demonstrate it by using
coherent population trapping in an ensemble of laser-cooled $^{87}$Rb atoms.
The transition frequency is controlled by an external magnetic field, which can
be tuned in realtime by applying a d.c. voltage. Through an adaptive Bayesian
algorithm, the voltage can automatically converge to the desired one from a
random initial value only after few iterations. In particular, when the
relation between the target frequency and the applied voltage is nonlinear, our
algorithm shows significant advantages over traditional methods. This work
provides a simple and efficient way to determine a transition frequency, which
can be widely applied in the fields of precision spectroscopy, such as atomic
clocks, magnetometers, and nuclear magnetic resonance.
","[{""version"":""v1"",""created"":""Mon, 27 Apr 2020 09:41:38 GMT""},{""version"":""v2"",""created"":""Fri, 1 May 2020 23:28:53 GMT""},{""version"":""v3"",""created"":""Sat, 15 Aug 2020 11:34:42 GMT""},{""version"":""v4"",""created"":""Thu, 11 Feb 2021 02:21:43 GMT""},{""version"":""v5"",""created"":""Sat, 24 Apr 2021 11:52:38 GMT""}]","2021-07-02"
"2004.12675","Toshihiko Hiraiwa","Toshihiko Hiraiwa, Kouichi Soutome and Hitoshi Tanaka","A Forced Harmonic Oscillator, Interpreted as Diffraction of Light","4 pages, 3 figures","Phys. Rev. E 102, 032211 (2020)","10.1103/PhysRevE.102.032211",,"physics.class-ph physics.optics","http://arxiv.org/licenses/nonexclusive-distrib/1.0/","  We investigate a simple forced harmonic oscillator with a natural frequency
varying with time. It is shown that the time evolution of such a system can be
written in a simplified form with Fresnel integrals, as long as the variation
of the natural frequency is sufficiently slow compared to the time period of
oscillation. Thanks to such a simple formulation, we found, for the first time,
that a forced harmonic oscillator with a slowly-varying natural frequency is
essentially equivalent to diffraction of light.
","[{""version"":""v1"",""created"":""Mon, 27 Apr 2020 09:43:16 GMT""},{""version"":""v2"",""created"":""Tue, 14 Jul 2020 09:56:06 GMT""}]","2020-09-16"
