"2004.12541","YangQuan Chen Prof.","Conghui Xu, Yongguang Yu, QuanChen Yang, and Zhenzhen Lu","Forecast analysis of the epidemics trend of COVID-19 in the United
  States by a generalized fractional-order SEIR model",,,,,"q-bio.PE math.DS","http://creativecommons.org/licenses/by/4.0/","  In this paper, a generalized fractional-order SEIR model is proposed, denoted
by SEIQRP model, which has a basic guiding significance for the prediction of
the possible outbreak of infectious diseases like COVID-19 and other insect
diseases in the future. Firstly, some qualitative properties of the model are
analyzed. The basic reproduction number $R_{0}$ is derived. When $R_{0}<1$, the
disease-free equilibrium point is unique and locally asymptotically stable.
When $R_{0}>1$, the endemic equilibrium point is also unique. Furthermore, some
conditions are established to ensure the local asymptotic stability of
disease-free and endemic equilibrium points. The trend of COVID-19 spread in
the United States is predicted. Considering the influence of the individual
behavior and government mitigation measurement, a modified SEIQRP model is
proposed, defined as SEIQRPD model. According to the real data of the United
States, it is found that our improved model has a better prediction ability for
the epidemic trend in the next two weeks. Hence, the epidemic trend of the
United States in the next two weeks is investigated, and the peak of isolated
cases are predicted. The modified SEIQRP model successfully capture the
development process of COVID-19, which provides an important reference for
understanding the trend of the outbreak.
","[{""version"":""v1"",""created"":""Mon, 27 Apr 2020 01:56:57 GMT""},{""version"":""v2"",""created"":""Wed, 29 Apr 2020 06:37:47 GMT""}]","2020-04-30"
"2004.12542","Danying Yu","Danying Yu, Luqi Yuan, Xianfeng Chen","Isolated Photonic Flatband with the Effective Magnetic Flux in A
  Synthetic Space including the Frequency Dimension",,"Laser & Photonics Reviews 14, 2000041 (2020)","10.1002/lpor.202000041",,"physics.optics","http://arxiv.org/licenses/nonexclusive-distrib/1.0/","  The exploration of flatband in photonics is fundamentally important, aiming
to control the localization of light for potential applications in optical
communications. We study the flatband physics in a synthetic space including
the frequency axis of light. A ring-resonator array is used to construct a
synthetic Lieb-type lattice, where the modulation phase distribution supports a
locally non-zero effective magnetic flux pointing into the synthetic space. We
find that the flatband is isolated from other dispersive bands and the light
can still be localized even with the perturbation from the group velocity
dispersion of the waveguide. Our work points out a route towards manipulating
the localization performance of a wavepacket of light along both the spatial
dimension and the frequency dimension, which holds the potential implication
for controlling the storage of optical information in dispersive materials.
","[{""version"":""v1"",""created"":""Mon, 27 Apr 2020 02:00:19 GMT""},{""version"":""v2"",""created"":""Mon, 27 Jul 2020 07:52:47 GMT""}]","2020-11-16"
"2004.12543","Byung Gyu Chae","Byung Gyu Chae","Wide viewing-angle holographic display based on enhanced-NA Fresnel
  hologram","29 pages, 10 figures",,"10.1364/OE.435424",,"physics.optics eess.IV","http://arxiv.org/licenses/nonexclusive-distrib/1.0/","  The viewing-angle enlargement of a holographic image is a crucial factor for
realizing the holographic display. The numerical aperture (NA) of digital
hologram other than a pixel specification has been known to determine the
angular field extent of image. Here, we provide a valid foundation for the
dependence of viewing angle on the hologram numerical aperture by investigating
mathematically the internal structure of the sampled point spread function
showing a self-similarity of its modulating curves. The enhanced-NA Fresnel
hologram reconstructs the images at a viewing angle larger than a diffraction
angle by a hologram pixel pitch where its angle value is expressed in terms of
the NA of whole hologram aperture, which is systematically observed by optical
hologram imaging. Finally, we found that the aliased replica noises generated
in the enhanced-NA Fresnel diffraction regime are effectively suppressed within
the diffraction scope by a digitized pixel. This characteristic enables us to
overcome the image reduction and to remove the interference of high-order
images, which leads to the wide viewing-angle holographic display. Optical
experiments are shown to be consistent with the results of numerical
simulation.
","[{""version"":""v1"",""created"":""Mon, 27 Apr 2020 02:01:15 GMT""},{""version"":""v2"",""created"":""Wed, 4 Nov 2020 06:15:36 GMT""},{""version"":""v3"",""created"":""Tue, 30 Mar 2021 23:16:51 GMT""},{""version"":""v4"",""created"":""Thu, 24 Jun 2021 04:52:30 GMT""},{""version"":""v5"",""created"":""Mon, 6 Dec 2021 00:05:37 GMT""}]","2021-12-07"
"2004.12544","Nathalie de Leon","Zi-Huai Zhang, Paul Stevenson, Gergo Thiering, Brendon C. Rose, Ding
  Huang, Andrew M. Edmonds, Matthew L. Markham, Stephen A. Lyon, Adam Gali, and
  Nathalie P. de Leon","Optically detected magnetic resonance in neutral silicon vacancy centers
  in diamond via bound exciton states",,"Physical Review Letters 125, 237402 (2020)","10.1103/PhysRevLett.125.237402",,"cond-mat.mes-hall quant-ph","http://arxiv.org/licenses/nonexclusive-distrib/1.0/","  Neutral silicon vacancy (SiV0) centers in diamond are promising candidates
for quantum networks because of their excellent optical properties and long
spin coherence times. However, spin-dependent fluorescence in such defects has
been elusive due to poor understanding of the excited state fine structure and
limited off-resonant spin polarization. Here we report the realization of
optically detected magnetic resonance and coherent control of SiV0 centers at
cryogenic temperatures, enabled by efficient optical spin polarization via
previously unreported higher-lying excited states. We assign these states as
bound exciton states using group theory and density functional theory. These
bound exciton states enable new control schemes for SiV0 as well as other
emerging defect systems.
","[{""version"":""v1"",""created"":""Mon, 27 Apr 2020 02:11:08 GMT""},{""version"":""v2"",""created"":""Wed, 30 Dec 2020 03:20:34 GMT""}]","2021-01-01"
"2004.12545","Tae Hun Jung","Tae Hun Jung, Hanju Yoo, Yuna Jin, Chae Eun Rhee, Chan-Byoung Chae","Wireless VR/Haptic Open Platform for Multimodal Teleoperation",,,"10.1109/WCNCW48565.2020.9124746",,"cs.NI eess.SP","http://arxiv.org/licenses/nonexclusive-distrib/1.0/","  With emerging trends in the fifth generation and robotics, the Internet of
Skills will enable us to deliver skills or expertise anywhere over the
Internet. In this paper, we propose a wireless connected virtual reality and
haptic communication open platform to show the proof of concept for multimodal
teleoperation systems in real-time. We focus on a practical implementation with
commercial products to facilitate the access and modification of the system.
The performance of the system is measured in terms of system latency and
user-centric metrics.
","[{""version"":""v1"",""created"":""Mon, 27 Apr 2020 02:12:57 GMT""}]","2020-08-07"
"2004.12546","Soo-Min Kim","Soo-Min Kim, Han Cha, Seong-Lyun Kim, and Chan-Byoung Chae","Demo: A Reinforcement Learning-based Flexible Duplex System for B5G with
  Sub-6 GHz","2 pages, and 3 figures",,,,"cs.NI eess.SP","http://arxiv.org/licenses/nonexclusive-distrib/1.0/","  In this paper, we propose a reinforcement learning-based flexible duplex
system for B5G with Sub-6 GHz. This system combines full-duplex radios and
dynamic spectrum access to maximize the spectral efficiency. We verify this
method's feasibility by implementing an FPGA-based real-time testbed. In
addition, we compare the proposed algorithm with the result derived from the
numerical analysis through system-level evaluations.
","[{""version"":""v1"",""created"":""Mon, 27 Apr 2020 02:15:04 GMT""}]","2020-04-28"
"2004.12547","Xiang-Dong Li","Qin Han and Xiang-Dong Li (NJU)","On the Formation of SS433","13 pages, 7 figures, accepted for publication in ApJ",,"10.3847/1538-4357/ab8d3d",,"astro-ph.HE","http://arxiv.org/licenses/nonexclusive-distrib/1.0/","  SS433 is an extraordinary X-ray binary which is ejecting bipolar jets with
$26\%$ of the speed of light. Associated with the supernova-like shell W50,
SS433 is also probably one of the youngest X-ray binaries with an age of
$\lesssim 10^5$ yr. However, the masses of the two components in SS433 and even
the nature of the compact object are still under debate. In this work, assuming
that the compact object is a black hole, we employ a binary population
synthesis method to study the formation of SS433. We use previous estimates of
the age of W50 and the duration of the jet activity to constrain the
evolutionary history. Our calculations suggest that SS433 likely harboured a
Hertzsprung gap star at the beginning of the current Roche-lobe overflow phase.
The masses of the black hole and the optical/donor star in SS433 suggested by
the simulations are around $8\ M_{\odot}$ and $24\ M_{\odot}$, respectively.
Future measurement of the donor mass and radius can help infer not only the
orgin of the binary but also the nature of the nebula W50.
","[{""version"":""v1"",""created"":""Mon, 27 Apr 2020 02:25:22 GMT""}]","2020-06-17"
"2004.12548","Ken'ichi Tatematsu","Ken'ichi Tatematsu, Tie Liu, Gwanjeong Kim, Hee-Weon Yi, Jeong-Eun
  Lee, Naomi Hirano, Sheng-Yuan Liu, Satoshi Ohashi, Patricio Sanhueza, James
  Di Francesco, Neal J. Evans II, Gary A. Fuller, Ryo Kandori, Minho Choi, Miju
  Kang, Siyi Feng, Tomoya Hirota, Takeshi Sakai, Xing Lu, Quang Nguyen Lu'o'ng,
  Mark A. Thompson, Yuefang Wu, Di Li, Kee-Tae Kim, Ke Wang, Isabelle
  Ristorcelli, Mika Juvela, and L. Viktor T'oth","ALMA ACA and Nobeyama observations of two Orion cores in deuterated
  molecular lines","31 pages, 17 figures, 9 tables, to appear in ApJ (accepted April 23,
  2020)","Astrophys.J. 895 (2020) 119","10.3847/1538-4357/ab8d3e",,"astro-ph.GA","http://arxiv.org/licenses/nonexclusive-distrib/1.0/","  We mapped two molecular cloud cores in the Orion A cloud with the ALMA ACA
7-m Array and with the Nobeyama 45-m radio telescope. These cores have bright
N$_2$D$^+$ emission in single-pointing observations with the Nobeyama 45-m
radio telescope, have relatively high deuterium fraction, and are thought to be
close to the onset of star formation. One is a star-forming core, and the other
is starless. These cores are located along filaments observed in N$_2$H$^+$,
and show narrow linewidths of 0.41 km s$^{-1}$ and 0.45 km s$^{-1}$ in
N$_2$D$^+$, respectively, with the Nobeyama 45-m telescope. Both cores were
detected with the ALMA ACA 7m Array in the continuum and molecular lines at
Band 6. The starless core G211 shows clumpy structure with several sub-cores,
which in turn show chemical differences. Also, the sub-cores in G211 have
internal motions that are almost purely thermal. The starless sub-core G211D,
in particular, shows a hint of the inverse P Cygni profile, suggesting infall
motion. The star-forming core G210 shows an interesting spatial feature of two
N$_2$D$^+$ peaks of similar intensity and radial velocity located symmetrically
with respect to the single dust continuum peak. One interpretation is that the
two N$_2$D$^+$ peaks represent an edge-on pseudo-disk. The CO outflow lobes,
however, are not directed perpendicular to the line connecting both N$_2$D$^+$
peaks.
","[{""version"":""v1"",""created"":""Mon, 27 Apr 2020 02:26:12 GMT""}]","2020-06-09"
"2004.12549","Andreas Doll","Antonio De Felice, Andreas Doll, Shinji Mukohyama","A theory of type-II minimally modified gravity","18 pages","JCAP09(2020)034","10.1088/1475-7516/2020/09/034","YITP-20-55, IPMU20-0040","gr-qc astro-ph.CO hep-th","http://arxiv.org/licenses/nonexclusive-distrib/1.0/","  We propose a modified gravity theory that propagates only two local
gravitational degrees of freedom and that does not have an Einstein frame.
According to the classification in JCAP 01 (2019) 017 [arXiv:1810.01047
[gr-qc]], this is a type-II minimally modified gravity theory. The theory is
characterized by the gravitational constant $G_{\rm N}$ and a function
$V(\phi)$ of a non-dynamical auxiliary field $\phi$ that plays the role of dark
energy. Once one fixes a homogeneous and isotropic cosmological background, the
form of $V(\phi)$ is determined and the theory no longer possesses a free
parameter or a free function, besides $G_{\rm N}$. For $V'(\phi) = 0$ the
theory reduces to general relativity (GR) with $G_N$ being the Newton's
constant and $V=const.$ being the cosmological constant. For $V'(\phi) \ne 0$,
it is shown that gravity behaves differently from GR but that GR with $G_{\rm
N}$ being the Newton's constant is recovered for weak gravity at distance and
time scales sufficiently shorter than the scale associated with $V(\phi)$.
Therefore this theory provides the simplest framework of cosmology in which
deviations from GR can be tested by observational data.
","[{""version"":""v1"",""created"":""Mon, 27 Apr 2020 02:27:05 GMT""},{""version"":""v2"",""created"":""Wed, 16 Sep 2020 16:13:19 GMT""}]","2020-09-17"
"2004.12550","Charles Margossian","Charles C. Margossian, Aki Vehtari, Daniel Simpson and Raj Agrawal","Hamiltonian Monte Carlo using an adjoint-differentiated Laplace
  approximation: Bayesian inference for latent Gaussian models and beyond","18 pages, 5 figures","NeurIPS 2020",,,"stat.CO","http://arxiv.org/licenses/nonexclusive-distrib/1.0/","  Gaussian latent variable models are a key class of Bayesian hierarchical
models with applications in many fields. Performing Bayesian inference on such
models can be challenging as Markov chain Monte Carlo algorithms struggle with
the geometry of the resulting posterior distribution and can be prohibitively
slow. An alternative is to use a Laplace approximation to marginalize out the
latent Gaussian variables and then integrate out the remaining hyperparameters
using dynamic Hamiltonian Monte Carlo, a gradient-based Markov chain Monte
Carlo sampler. To implement this scheme efficiently, we derive a novel adjoint
method that propagates the minimal information needed to construct the gradient
of the approximate marginal likelihood. This strategy yields a scalable
differentiation method that is orders of magnitude faster than state of the art
differentiation techniques when the hyperparameters are high dimensional. We
prototype the method in the probabilistic programming framework Stan and test
the utility of the embedded Laplace approximation on several models, including
one where the dimension of the hyperparameter is $\sim$6,000. Depending on the
cases, the benefits can include an alleviation of the geometric pathologies
that frustrate Hamiltonian Monte Carlo and a dramatic speed-up.
","[{""version"":""v1"",""created"":""Mon, 27 Apr 2020 02:31:19 GMT""},{""version"":""v2"",""created"":""Fri, 8 May 2020 19:26:20 GMT""},{""version"":""v3"",""created"":""Mon, 8 Jun 2020 17:22:50 GMT""},{""version"":""v4"",""created"":""Sun, 25 Oct 2020 22:30:00 GMT""}]","2020-11-09"
"2004.12551","Benjamin Shickel","Benjamin Shickel, Tyler J. Loftus, Matthew Ruppert, Gilbert R.
  Upchurch, Tezcan Ozrazgat-Baslanti, Parisa Rashidi, Azra Bihorac","Dynamic Predictions of Postoperative Complications from Explainable,
  Uncertainty-Aware, and Multi-Task Deep Neural Networks",,,,,"cs.LG stat.ML","http://arxiv.org/licenses/nonexclusive-distrib/1.0/","  Accurate prediction of postoperative complications can inform shared
decisions regarding prognosis, preoperative risk-reduction, and postoperative
resource use. We hypothesized that multi-task deep learning models would
outperform random forest models in predicting postoperative complications, and
that integrating high-resolution intraoperative physiological time series would
result in more granular and personalized health representations that would
improve prognostication compared to preoperative predictions. In a longitudinal
cohort study of 56,242 patients undergoing 67,481 inpatient surgical procedures
at a university medical center, we compared deep learning models with random
forests for predicting nine common postoperative complications using
preoperative, intraoperative, and perioperative patient data. Our study
indicated several significant results across experimental settings that suggest
the utility of deep learning for capturing more precise representations of
patient health for augmented surgical decision support. Multi-task learning
improved efficiency by reducing computational resources without compromising
predictive performance. Integrated gradients interpretability mechanisms
identified potentially modifiable risk factors for each complication. Monte
Carlo dropout methods provided a quantitative measure of prediction uncertainty
that has the potential to enhance clinical trust. Multi-task learning,
interpretability mechanisms, and uncertainty metrics demonstrated potential to
facilitate effective clinical implementation.
","[{""version"":""v1"",""created"":""Mon, 27 Apr 2020 02:32:32 GMT""},{""version"":""v2"",""created"":""Tue, 17 May 2022 22:41:25 GMT""}]","2022-05-19"
"2004.12552","Tailin Niu","Tailin Niu, Kangquan Li, Longjiang Qu and Qiang Wang","Finding compositional inverses of permutations from the AGW criterion","24 pages. Revision submitted",,"10.1109/TIT.2021.3089145",,"cs.IT math.IT math.NT","http://creativecommons.org/licenses/by-sa/4.0/","  Permutation polynomials and their compositional inverses have wide
applications in cryptography, coding theory, and combinatorial designs.
Motivated by several previous results on finding compositional inverses of
permutation polynomials of different forms, we propose a general method for
finding these inverses of permutation polynomials constructed by the AGW
criterion. As a result, we have reduced the problem of finding the
compositional inverse of such a permutation polynomial over a finite field to
that of finding the inverse of a bijection over a smaller set. We demonstrate
our method by interpreting several recent known results, as well as by
providing new explicit results on more classes of permutation polynomials in
different types. In addition, we give new criteria for these permutation
polynomials being involutions. Explicit constructions are also provided for all
involutory criteria.
","[{""version"":""v1"",""created"":""Mon, 27 Apr 2020 02:35:15 GMT""},{""version"":""v2"",""created"":""Thu, 1 Apr 2021 04:57:41 GMT""}]","2021-06-18"
"2004.12553","Akshay Agrawal","Akshay Agrawal and Stephen Boyd","Differentiating through Log-Log Convex Programs","Fix some typos",,,,"math.OC","http://arxiv.org/licenses/nonexclusive-distrib/1.0/","  We show how to efficiently compute the derivative (when it exists) of the
solution map of log-log convex programs (LLCPs). These are nonconvex, nonsmooth
optimization problems with positive variables that become convex when the
variables, objective functions, and constraint functions are replaced with
their logs. We focus specifically on LLCPs generated by disciplined geometric
programming, a grammar consisting of a set of atomic functions with known
log-log curvature and a composition rule for combining them. We represent a
parametrized LLCP as the composition of a smooth transformation of parameters,
a convex optimization problem, and an exponential transformation of the convex
optimization problem's solution. The derivative of this composition can be
computed efficiently, using recently developed methods for differentiating
through convex optimization problems. We implement our method in CVXPY, a
Python-embedded modeling language and rewriting system for convex optimization.
In just a few lines of code, a user can specify a parametrized LLCP, solve it,
and evaluate the derivative or its adjoint at a vector. This makes it possible
to conduct sensitivity analyses of solutions, given perturbations to the
parameters, and to compute the gradient of a function of the solution with
respect to the parameters. We use the adjoint of the derivative to implement
differentiable log-log convex optimization layers in PyTorch and TensorFlow.
Finally, we present applications to designing queuing systems and fitting
structured prediction models.
","[{""version"":""v1"",""created"":""Mon, 27 Apr 2020 02:35:20 GMT""},{""version"":""v2"",""created"":""Thu, 7 May 2020 00:59:28 GMT""},{""version"":""v3"",""created"":""Sun, 31 May 2020 22:33:24 GMT""}]","2020-06-02"
"2004.12554","Frederico Gadelha Guimaraes","Petr\^onio C\^andido de Lima e Silva, Carlos Alberto Severiano Junior,
  Marcos Antonio Alves, Rodrigo Silva, Miri Weiss Cohen, Frederico Gadelha
  Guimar\~aes","Forecasting in Non-stationary Environments with Fuzzy Time Series","21 pages, 7 figures, submitted to Applied Soft Computing",,,,"cs.LG cs.AI cs.CE stat.ML","http://arxiv.org/licenses/nonexclusive-distrib/1.0/","  In this paper we introduce a Non-Stationary Fuzzy Time Series (NSFTS) method
with time varying parameters adapted from the distribution of the data. In this
approach, we employ Non-Stationary Fuzzy Sets, in which perturbation functions
are used to adapt the membership function parameters in the knowledge base in
response to statistical changes in the time series. The proposed method is
capable of dynamically adapting its fuzzy sets to reflect the changes in the
stochastic process based on the residual errors, without the need to retraining
the model. This method can handle non-stationary and heteroskedastic data as
well as scenarios with concept-drift. The proposed approach allows the model to
be trained only once and remain useful long after while keeping reasonable
accuracy. The flexibility of the method by means of computational experiments
was tested with eight synthetic non-stationary time series data with several
kinds of concept drifts, four real market indices (Dow Jones, NASDAQ, SP500 and
TAIEX), three real FOREX pairs (EUR-USD, EUR-GBP, GBP-USD), and two real
cryptocoins exchange rates (Bitcoin-USD and Ethereum-USD). As competitor models
the Time Variant fuzzy time series and the Incremental Ensemble were used,
these are two of the major approaches for handling non-stationary data sets.
Non-parametric tests are employed to check the significance of the results. The
proposed method shows resilience to concept drift, by adapting parameters of
the model, while preserving the symbolic structure of the knowledge base.
","[{""version"":""v1"",""created"":""Mon, 27 Apr 2020 02:35:46 GMT""}]","2020-04-28"
"2004.12555","Nozhan Hosseini","M. Cenk Erturk, Nozhan Hosseini, Hosseinali Jamal, Alphan Sahin, David
  Matolak and Jamal Haque","Requirements and Technologies Towards UAM: Communication, Navigation,
  and Surveillance","Keywords: 5G, CNS, DAA, NASA, requirement analysis, radio technical
  commission for aeronautics (RTCA), satellite systems, UAM. Citation: M. C.
  Erturk, N. Hosseini, H. Jamal, A. Sahin, D. Matolak and J. Haque,
  ""Requirements and Technologies Towards UAM: Communication, Navigation,
  andSurveillance,"" 2020 Integrated Communications, Navigation, Surveillance
  Conference (ICNS), Herndon, VA, 2020",,,,"eess.SP","http://arxiv.org/licenses/nonexclusive-distrib/1.0/","  Urban air mobility (UAM) is a concept for creating an airborne transportation
system that operates in urban settings with an on-board pilot and/or remote
pilot in command (RPIC), or with a fully autonomous architecture. Although the
passenger traffic will be mostly in and near urban environments, UAM is also
being considered for air cargo, perhaps between cities. Such capability is
pushing the current communication, navigation and surveillance (CNS) / air
traffic management (ATM) systems that were not designed to support these types
of aviation scenarios. The UAM aircraft will be operating in a congested
environment, where CNS and ATM systems need to provide integrity, robustness,
security, and very high availability for safety of UAM operations while
evolving. As UAM is under research by academia and government agencies, the
industry is driving technology towards aircraft prototypes. Critical UAM
requirements are derived from command and control (C2) (particularly for RPIC
scenario), data connectivity for passengers and flight systems, unmanned
aircraft systems (UAS) to UAS communication to avoid collision, and data
exchange for positioning and surveillance. In this paper, we study connectivity
challenges and present requirements towards a robust UAM architecture through
its concept of operations. In addition, we review the existing/potential CNS
technologies towards UAM, i.e., 3rd generation partnership project (3GPP) fifth
generation (5G) new radio (NR), navigation detect & avoid (DAA), and satellite
systems and present conclusions on a future road-map for UAM CNS architecture.
","[{""version"":""v1"",""created"":""Mon, 27 Apr 2020 02:39:18 GMT""}]","2020-04-28"
