"2004.12810","Boyan Torosov","Boyan T. Torosov and Nikolay V. Vitanov","High-fidelity composite quantum gates for Raman qubits","6 pages, 5 figures","Phys. Rev. Research 2, 043194 (2020)","10.1103/PhysRevResearch.2.043194",,"quant-ph","http://arxiv.org/licenses/nonexclusive-distrib/1.0/","  We present a general systematic approach to design robust and high-fidelity
quantum logic gates with Raman qubits using the technique of composite pulses.
We use two mathematical tools -- the Morris-Shore and Majorana decompositions
-- to reduce the three-state Raman system to an equivalent two-state system.
They allow us to exploit the numerous composite pulses designed for two-state
systems by extending them to Raman qubits. We construct the NOT, Hadamard, and
rotation gates by means of the Morris-Shore transformation with the same
uniform approach: sequences of pulses with the same phases for each gate but
different ratios of Raman couplings. The phase gate is constructed by using the
Majorana decomposition. All composite Raman gates feature very high fidelity,
beyond the quantum computation benchmark values, and significant robustness to
experimental errors. All composite phases and pulse areas are given by
analytical formulas, which makes the method scalable to any desired accuracy
and robustness to errors.
","[{""version"":""v1"",""created"":""Mon, 27 Apr 2020 13:49:22 GMT""},{""version"":""v2"",""created"":""Sun, 3 May 2020 14:03:57 GMT""}]","2020-11-11"
"2004.12811","Zhi-Song Liu","Zhi-Song Liu, Wan-Chi Siu, Li-Wen Wang, Chu-Tak Li, Marie-Paule Cani,
  Yui-Lam Chan","Unsupervised Real Image Super-Resolution via Generative Variational
  AutoEncoder","9 pages, 7 figures, CVPR2020 NTIRE2020 Real Image Super-Resolution
  Challenge","2020 IEEE conference on Computer Vision and Pattern Recognition
  Workshop",,,"cs.CV cs.MM eess.IV","http://arxiv.org/licenses/nonexclusive-distrib/1.0/","  Benefited from the deep learning, image Super-Resolution has been one of the
most developing research fields in computer vision. Depending upon whether
using a discriminator or not, a deep convolutional neural network can provide
an image with high fidelity or better perceptual quality. Due to the lack of
ground truth images in real life, people prefer a photo-realistic image with
low fidelity to a blurry image with high fidelity. In this paper, we revisit
the classic example based image super-resolution approaches and come up with a
novel generative model for perceptual image super-resolution. Given that real
images contain various noise and artifacts, we propose a joint image denoising
and super-resolution model via Variational AutoEncoder. We come up with a
conditional variational autoencoder to encode the reference for dense feature
vector which can then be transferred to the decoder for target image denoising.
With the aid of the discriminator, an additional overhead of super-resolution
subnetwork is attached to super-resolve the denoised image with photo-realistic
visual quality. We participated the NTIRE2020 Real Image Super-Resolution
Challenge. Experimental results show that by using the proposed approach, we
can obtain enlarged images with clean and pleasant features compared to other
supervised methods. We also compared our approach with state-of-the-art methods
on various datasets to demonstrate the efficiency of our proposed unsupervised
super-resolution model.
","[{""version"":""v1"",""created"":""Mon, 27 Apr 2020 13:49:36 GMT""}]","2020-04-28"
"2004.12812","Enric Palle","E. Palle, L. Nortmann, N. Casasayas-Barris, M. Lamp\'on, M.
  L\'opez-Puertas, J. A. Caballero, J. Sanz-Forcada, L. M. Lara, E. Nagel, F.
  Yan, F. J. Alonso-Floriano, P. J. Amado, G. Chen, C. Cifuentes, M.
  Cort\'es-Contreras, S. Czesla, K. Molaverdikhani, D. Montes, V. M. Passegger,
  A. Quirrenbach, A. Reiners, I. Ribas, A. S\'anchez-L\'opez, A. Schweitzer, M.
  Stangret, M. R. Zapatero Osorio, and M. Zechmeister","A He I upper atmosphere around the warm Neptune GJ 3470b","Accepted for publication in A&A",,"10.1051/0004-6361/202037719",,"astro-ph.EP astro-ph.SR","http://arxiv.org/licenses/nonexclusive-distrib/1.0/","  High resolution transit spectroscopy has proven to be a reliable technique
for the characterization of the chemical composition of exoplanet atmospheres.
Taking advantage of the broad spectral coverage of the CARMENES spectrograph,
we initiated a survey aimed at characterizing a broad range of planetary
systems. Here, we report our observations of three transits of \tplanet with
CARMENES in search of \het\ absorption. On one of the nights, the He~{\sc i}
region was heavily contaminated by OH$^-$ telluric emission and, thus, it was
not useful for our purposes. The remaining two nights had a very different
signal-to-noise ratio (S/N) due to weather. They both indicate the presence of
\het\ absorption in the transmission spectrum of \tplanet, although a
statistically valid detection can only be claimed for the night with higher
S/N. For that night, we retrieved a 1.5$\pm$0.3\% absorption depth, translating
into a $R_p(\lambda)/R_p = 1.15\pm 0.14$ at this wavelength.
Spectro-photometric light curves for this same night also indicate the presence
of extra absorption during the planetary transit with a consistent absorption
depth. The \het\ absorption is modeled in detail using a radiative transfer
code, and the results of our modeling efforts are compared to the observations.
We find that the mass-loss rate, \mlr, is confined to a range of
3\,$\times\,10^{10}$\,\gs\ for $T$ = 6000\,K to 10\,$\times\,10^{10}$\,\gs\ for
$T$ = 9000\,K. We discuss the physical mechanisms and implications of the
He~{\sc i} detection in \tplanet and put it in context as compared to similar
detections and non-detections in other Neptune-size planets. We also present
improved stellar and planetary parameter determinations based on our visible
and near-infrared observations.
","[{""version"":""v1"",""created"":""Mon, 27 Apr 2020 13:50:42 GMT""}]","2020-06-17"
"2004.12813","Mihajlo Novakovic","Or Szekely (1), Gregory Lars Olsen (1), Mihajlo Novakovic (1), Rina
  Rosenzweig (2), Lucio Frydman (1) ((1) Department of Chemical and Biological
  Physics, (2) Department of Structural Biology, Weizmann Institute of Science)","Assessing site-specific enhancements imparted by hyperpolarized water in
  folded and unfolded proteins by 2D HMQC NMR",,,,,"physics.chem-ph physics.bio-ph","http://arxiv.org/licenses/nonexclusive-distrib/1.0/","  Hyperpolarized water can be a valuable aid in protein NMR, leading to amide
group 1H polarizations that are orders of magnitude larger than their thermal
counterparts. Suitable procedures can exploit this to deliver 2D 1H-15N
correlations with good resolution and enhanced sensitivity. These enhancements
depend on the exchange rates between the amides and the water, thereby yielding
diagnostic information about solvent accessibility. This study applied this
HyperW method to four proteins exhibiting a gamut of exchange behaviors: PhoA4,
an unfolded 122-residue fragment; barstar, a fully folded ribonuclease
inhibitor; R17, a 13.3 kDa system possessing folded and unfolded forms under
slow interconversion; and drkN SH3, a protein domain whose folded and unfolded
forms interchange rapidly and with temperature-dependent population ratios. For
PhoA4 HyperW sensitivity enhancements were larger than 300-fold, as expected
for an unfolded protein sequence. Though fully folded barstar also exhibited
substantial enhancements; these, however, were not uniform, and according to
CLEANEX experiments reflected the solvent-exposed residues. R17 showed the
expected superposition of 100-fold enhancements for its unfolded form,
coexisting with more modest folded counterparts. Unexpected, however, was the
behavior of drkN SH3, for which HyperW enhanced the unfolded but even more
certain folded protein sites. These preferential enhancements were repeatedly
and reproducibly observed; a number of explanations including three-site
exchange magnetization transfers between water, unfolded and folded states;
cross-correlated relaxation processes from hyperpolarized structural waters and
labile sidechain protons; and the possibility that faster solvent exchange
rates characterize certain folded sites over their unfolded counterparts are
considered to account for them.
","[{""version"":""v1"",""created"":""Mon, 27 Apr 2020 13:50:59 GMT""}]","2020-04-28"
"2004.12814","Simone Scardapane","Simone Scardapane, Michele Scarpiniti, Enzo Baccarelli, Aurelio Uncini","Why should we add early exits to neural networks?","Published in Cognitive Computation","Cognitive Computation, 2020","10.1007/s12559-020-09734-4",,"cs.NE cs.LG stat.ML","http://arxiv.org/licenses/nonexclusive-distrib/1.0/","  Deep neural networks are generally designed as a stack of differentiable
layers, in which a prediction is obtained only after running the full stack.
Recently, some contributions have proposed techniques to endow the networks
with early exits, allowing to obtain predictions at intermediate points of the
stack. These multi-output networks have a number of advantages, including: (i)
significant reductions of the inference time, (ii) reduced tendency to
overfitting and vanishing gradients, and (iii) capability of being distributed
over multi-tier computation platforms. In addition, they connect to the wider
themes of biological plausibility and layered cognitive reasoning. In this
paper, we provide a comprehensive introduction to this family of neural
networks, by describing in a unified fashion the way these architectures can be
designed, trained, and actually deployed in time-constrained scenarios. We also
describe in-depth their application scenarios in 5G and Fog computing
environments, as long as some of the open research questions connected to them.
","[{""version"":""v1"",""created"":""Mon, 27 Apr 2020 13:53:16 GMT""},{""version"":""v2"",""created"":""Tue, 23 Jun 2020 07:42:10 GMT""}]","2020-06-24"
"2004.12815","Martin Hairer","Michele Coti Zelati and Martin Hairer","A noise-induced transition in the Lorenz system","Final draft",,"10.1007/s00220-021-04000-6",,"math.PR math.CA math.DS","http://arxiv.org/licenses/nonexclusive-distrib/1.0/","  We consider a stochastic perturbation of the classical Lorenz system in the
range of parameters for which the origin is the global attractor. We show that
adding noise in the last component causes a transition from a unique to exactly
two ergodic invariant measures. The bifurcation threshold depends on the
strength of the noise: if the noise is weak, the only invariant measure is
Gaussian, while strong enough noise causes the appearance of a second ergodic
invariant measure.
","[{""version"":""v1"",""created"":""Mon, 27 Apr 2020 13:53:51 GMT""},{""version"":""v2"",""created"":""Mon, 21 Dec 2020 15:13:15 GMT""}]","2021-03-17"
"2004.12817","Kaitao Song","Kaitao Song, Hao Sun, Xu Tan, Tao Qin, Jianfeng Lu, Hongzhi Liu and
  Tie-Yan Liu","LightPAFF: A Two-Stage Distillation Framework for Pre-training and
  Fine-tuning",,,,,"cs.CL cs.LG","http://arxiv.org/licenses/nonexclusive-distrib/1.0/","  While pre-training and fine-tuning, e.g., BERT~\citep{devlin2018bert},
GPT-2~\citep{radford2019language}, have achieved great success in language
understanding and generation tasks, the pre-trained models are usually too big
for online deployment in terms of both memory cost and inference speed, which
hinders them from practical online usage. In this paper, we propose LightPAFF,
a Lightweight Pre-training And Fine-tuning Framework that leverages two-stage
knowledge distillation to transfer knowledge from a big teacher model to a
lightweight student model in both pre-training and fine-tuning stages. In this
way the lightweight model can achieve similar accuracy as the big teacher
model, but with much fewer parameters and thus faster online inference speed.
LightPAFF can support different pre-training methods (such as BERT, GPT-2 and
MASS~\citep{song2019mass}) and be applied to many downstream tasks. Experiments
on three language understanding tasks, three language modeling tasks and three
sequence to sequence generation tasks demonstrate that while achieving similar
accuracy with the big BERT, GPT-2 and MASS models, LightPAFF reduces the model
size by nearly 5x and improves online inference speed by 5x-7x.
","[{""version"":""v1"",""created"":""Mon, 27 Apr 2020 14:00:09 GMT""}]","2020-04-28"
"2004.12818","Laurent Truffet","Laurent Truffet","Some Ideas to Test if a Polyhedron is Empty",,,,,"math.OC","http://arxiv.org/licenses/nonexclusive-distrib/1.0/","  In this paper we develop a pure algebraic method which provides an algorithm
for testing emptyness of a polyhedron.
","[{""version"":""v1"",""created"":""Mon, 27 Apr 2020 13:55:41 GMT""}]","2020-04-28"
"2004.12821","Romain Rouvoy","Sacha Brisset and Romain Rouvoy and Renaud Pawlak and Lionel
  Seinturier","SFTM: Fast Comparison of Web Documents using Similarity-based Flexible
  Tree Matching","9 pages",,,,"cs.DB cs.SE","http://arxiv.org/licenses/nonexclusive-distrib/1.0/","  Tree matching techniques have been investigated in many fields, including web
data mining and extraction, as a key component to analyze the content of web
documents, existing tree matching approaches, like Tree-Edit Distance (TED) or
Flexible Tree Matching (FTM), fail to scale beyond a few hundreds of nodes,
which is far below the average complexity of existing web online documents and
applications. In this paper, we therefore propose a novel Similarity-based
Flexible Tree Matching algorithm (SFTM), which is the first algorithm to enable
tree matching on real-life web documents with practical computation times. In
particular, we approach tree matching as an optimisation problem and we
leverage node labels and local topology similarity in order to avoid any
combinatorial explosion. Our practical evaluation demonstrates that our
approach compares to the reference implementation of TED qualitatively, while
improving the computation times by two orders of magnitude.
","[{""version"":""v1"",""created"":""Mon, 27 Apr 2020 14:02:09 GMT""}]","2020-04-28"
"2004.12822","Hippolyte Signargout","Sylvain Gravier (IF), Hippolyte Signargout (ENS Lyon), Souad Slimani","Optimal Adjacent Vertex-Distinguishing Edge-Colorings of Circulant
  Graphs","Editor-neutral version",,,,"cs.DM math.CO","http://arxiv.org/licenses/nonexclusive-distrib/1.0/","  A $k$-proper edge-coloring of a graph G is called adjacent
vertex-distinguishing if any two adjacent vertices are distinguished by the set
of colors appearing in the edges incident to each vertex. The smallest value
$k$ for which $G$ admits such coloring is denoted by $\chi'_a(G)$. We prove
that $\chi'_a(G) = 2R + 1$ for most circulant graphs $C_n([1, R])$.
","[{""version"":""v1"",""created"":""Mon, 27 Apr 2020 14:03:45 GMT""},{""version"":""v2"",""created"":""Thu, 7 May 2020 16:29:15 GMT""},{""version"":""v3"",""created"":""Fri, 12 Jun 2020 12:25:39 GMT""},{""version"":""v4"",""created"":""Tue, 4 Jan 2022 09:00:16 GMT""}]","2022-01-05"
"2004.12823","Gianluca Maguolo","Gianluca Maguolo, Loris Nanni","A Critic Evaluation of Methods for COVID-19 Automatic Detection from
  X-Ray Images",,,,,"eess.IV cs.CV cs.LG","http://arxiv.org/licenses/nonexclusive-distrib/1.0/","  In this paper, we compare and evaluate different testing protocols used for
automatic COVID-19 diagnosis from X-Ray images in the recent literature. We
show that similar results can be obtained using X-Ray images that do not
contain most of the lungs. We are able to remove the lungs from the images by
turning to black the center of the X-Ray scan and training our classifiers only
on the outer part of the images. Hence, we deduce that several testing
protocols for the recognition are not fair and that the neural networks are
learning patterns in the dataset that are not correlated to the presence of
COVID-19. Finally, we show that creating a fair testing protocol is a
challenging task, and we provide a method to measure how fair a specific
testing protocol is. In the future research we suggest to check the fairness of
a testing protocol using our tools and we encourage researchers to look for
better techniques than the ones that we propose.
","[{""version"":""v1"",""created"":""Mon, 27 Apr 2020 14:05:36 GMT""},{""version"":""v2"",""created"":""Sun, 17 May 2020 02:17:02 GMT""},{""version"":""v3"",""created"":""Tue, 19 May 2020 01:49:41 GMT""},{""version"":""v4"",""created"":""Sun, 20 Sep 2020 00:36:28 GMT""}]","2020-09-22"
"2004.12824","Matej Pivoluska","Mirdit Doda, Marcus Huber, Gl\'aucia Murta, Matej Pivoluska, Martin
  Plesch, Chrysoula Vlachou","Quantum key distribution overcoming extreme noise: simultaneous subspace
  coding using high-dimensional entanglement",,"Phys. Rev. Applied 15, 034003 (2021)","10.1103/PhysRevApplied.15.034003",,"quant-ph","http://arxiv.org/licenses/nonexclusive-distrib/1.0/","  High-dimensional entanglement promises to increase the information capacity
of photons and is now routinely generated exploiting spatio-temporal degrees of
freedom of single photons. A curious feature of these systems is the
possibility to certify entanglement despite strong noise in the data. We show
that it is also possible to exploit this noisy high-dimensional entanglement
for quantum key distribution by introducing a protocol that uses mutliple
subspaces of the high-dimensional system simultaneously. Our protocol can be
used to establish a secret key even in extremely noisy experimental conditions,
where qubit protocols fail. To show that, we analyze the performance of our
protocol for noise models that apply to the two most commonly used sources of
high-dimensional entanglement: time bins and spatial modes.
","[{""version"":""v1"",""created"":""Mon, 27 Apr 2020 14:07:02 GMT""},{""version"":""v2"",""created"":""Wed, 10 Mar 2021 09:26:07 GMT""}]","2021-03-17"
"2004.12825","Weiyi Zhang","Haojie Chen, Weiyi Zhang","Kodaira dimensions of almost complex manifolds II","27+5 pages, 1 appendix. The second part of arXiv:1808.00885",,,,"math.DG math.AG math.CV math.SG","http://arxiv.org/licenses/nonexclusive-distrib/1.0/","  This is the second of a series of papers where we study the plurigenera, the
Kodaira dimension and the Iitaka dimension on compact almost complex manifolds.
By using the pseudoholomorphic pluricanonical map, we define the second version
of Kodaira dimension as well as Iitaka dimension on compact almost complex
manifolds. We show the almost complex structures with the top Kodaira dimension
are integrable. For compact almost complex 4-manifolds with Kodaira dimension
one, we obtain elliptic fibration like structural description. Some vanishing
theorems in complex geometry are generalized to the almost complex setting.
  For tamed symplectic $4$-manifolds, we show that the almost Kodaira dimension
is bounded above by the symplectic Kodaira dimension, by using a probabilistic
combinatorics style argument. The appendix also contains a few results
including answering a question of the second author that there is a unique
subvariety in exceptional curve classes for irrational symplectic
$4$-manifolds, as well as extending Evans-Smith's constraint on symplectic
embeddings of certain rational homology balls by removing the assumption on the
intersection form.
","[{""version"":""v1"",""created"":""Mon, 27 Apr 2020 14:07:22 GMT""}]","2020-04-28"
"2004.12826","Armand Bernou","Armand Bernou","On Subexponential Convergence to Equilibrium of Markov Processes","22 pages. Slightly strengthened the main result, added some
  comparisons with previous results and added some examples",,,,"math.PR","http://arxiv.org/licenses/nonexclusive-distrib/1.0/","  Studying the subexponential convergence towards equilibrium of a strong
Markov process, we exhibit an intermediate Lyapunov condition equivalent to the
control of some moment of a hitting time. This provides a link, similar
(although more intricate) to the one existing in the exponential case, between
the coupling method and the approach based on the existence of a Lyapunov
function for the generator, in the context of the subexponential rates found by
Fort-Roberts (2005), Douc-Fort-Guillin (2009) and Hairer (2016).
","[{""version"":""v1"",""created"":""Mon, 27 Apr 2020 14:10:16 GMT""},{""version"":""v2"",""created"":""Mon, 2 Aug 2021 09:29:21 GMT""}]","2021-08-03"
"2004.12827","Mark Sutton","Mark Sutton, J.R.M. Lhermitte, F. Livet, F. Ehrburger-Dolle","High resolution strain measurements in highly disordered materials",,"Phys. Rev. Research 3, 013119 (2021)","10.1103/PhysRevResearch.3.013119",,"cond-mat.mtrl-sci","http://arxiv.org/licenses/nonexclusive-distrib/1.0/","  The ability to measure small deformations or strains is useful for
understanding many aspects of materials. Here, a new analysis of speckle
diffraction peaks is presented in which the systematic shifts of the speckles
are analyzed allowing for strain (or flow) patterns to be inferred. This
speckle tracking technique measures strain patterns with a accuracy similar to
x-ray single crystal measurements but in amorphous or highly disordered
materials.
","[{""version"":""v1"",""created"":""Mon, 27 Apr 2020 14:12:43 GMT""},{""version"":""v2"",""created"":""Mon, 1 Jun 2020 16:15:14 GMT""},{""version"":""v3"",""created"":""Mon, 28 Dec 2020 21:05:10 GMT""}]","2021-02-17"
"2004.12828","Liming Zhang","Liming Zhang, Andreas Z\""ufle, Dieter Pfoser","Station-to-User Transfer Learning: Towards Explainable User Clustering
  Through Latent Trip Signatures Using Tidal-Regularized Non-Negative Matrix
  Factorization",,,,,"cs.LG cs.SI","http://arxiv.org/licenses/nonexclusive-distrib/1.0/","  Urban areas provide us with a treasure trove of available data capturing
almost every aspect of a population's life. This work focuses on mobility data
and how it will help improve our understanding of urban mobility patterns.
Readily available and sizable farecard data captures trips in a public
transportation network. However, such data typically lacks temporal modalities
and as such the task of inferring trip semantic, station function, and user
profile is quite challenging. As existing approaches either focus on
station-level or user-level signals, they are prone to overfitting and generate
less credible and insightful results. To properly learn such characteristics
from trip data, we propose a Collective Learning Framework through Latent
Representation, which augments user-level learning with collective patterns
learned from station-level signals. This framework uses a novel, so-called
Tidal-Regularized Non-negative Matrix Factorization method, which incorporates
domain knowledge in the form of temporal passenger flow patterns in generic
Non-negative Matrix Factorization. To evaluate our model performance, a user
stability test based on the classical Rand Index is introduced as a metric to
benchmark different unsupervised learning models. We provide a qualitative
analysis of the station functions and user profiles for the Washington D.C.
metro and show how our method supports spatiotemporal intra-city mobility
exploration.
","[{""version"":""v1"",""created"":""Mon, 27 Apr 2020 14:13:56 GMT""}]","2020-04-28"
"2004.12829","Daniella Bardalez Gagliuffi PhD","Daniella C. Bardalez Gagliuffi, Jacqueline K. Faherty, Adam C.
  Schneider, Aaron Meisner, Dan Caselden, Guilluame Colin, Sam Goodman, J. Davy
  Kirkpatrick, Marc J. Kuchner, Jonathan Gagn\'e, Sarah E. Logsdon, Adam J.
  Burgasser, Katelyn Allers, John Debes, John Wisniewski, Austin Rothermich,
  Nikolaj S. Andersen, Melina Th\'evenot, Jim Walla","WISEA J083011.95+283716.0: A Missing Link Planetary-Mass Object","13 pages, 6 figures, 5 tables",,"10.3847/1538-4357/ab8d25",,"astro-ph.SR astro-ph.EP astro-ph.GA","http://arxiv.org/licenses/nonexclusive-distrib/1.0/","  We present the discovery of WISEA J083011.95+283716.0, the first Y dwarf
candidate identified through the Backyard Worlds: Planet 9 citizen science
project. We identified this object as a red, fast-moving source with a faint
$W2$ detection in multi-epoch \textit{AllWISE} and unWISE images. We have
characterized this object with Spitzer Space Telescope and \textit{Hubble Space
Telescope} follow-up imaging. With mid-infrared detections in
\textit{Spitzer}'s \emph{ch1} and \emph{ch2} bands and flux upper limits in
Hubble Space Telescope $F105W$ and $F125W$ filters, we find that this object is
both very faint and has extremely red colors ($ch1-ch2 = 3.25\pm0.23$ mag,
$F125W-ch2 \geq 9.36$ mag), consistent with a T$_{eff}\sim300$ K source, as
estimated from the known Y dwarf population. A preliminary parallax provides a
distance of $11.1^{+2.0}_{-1.5}$ pc, leading to a slightly warmer temperature
of $\sim350$ K. The extreme faintness and red Hubble Space Telescope and
Spitzer Space Telescope colors of this object suggest it may be a link between
the broader Y dwarf population and the coldest known brown dwarf WISE
J0855$-$0714, and highlight our limited knowledge of the true spread of Y dwarf
colors. We also present four additional Backyard Worlds: Planet 9 late-T brown
dwarf discoveries within 30 pc.
","[{""version"":""v1"",""created"":""Mon, 27 Apr 2020 14:16:28 GMT""},{""version"":""v2"",""created"":""Tue, 28 Apr 2020 00:37:42 GMT""}]","2020-06-17"
