"2003.00921","Teus Kappen","Teus H. Kappen, Mirko Noordegraaf, Wilton A. van Klei, Karel G.M.
  Moons and Cor J. Kalkman","Decision Support in the Context of a Complex Decision Situation",,,,,"cs.HC","http://arxiv.org/licenses/nonexclusive-distrib/1.0/","  The aim of a clinical decision support tool is to reduce the complexity of
clinical decisions. However, when decision support tools are poorly implemented
they may actually confuse physicians and complicate clinical care. This paper
argues that information from decision support tools is often removed from the
clinical context of the targeted decisions. Physicians largely depend on
clinical context to handle the complexity of their day-to-day decisions.
Clinical context enables them to take into account all ambiguous information
and patient preferences. Decision support tools that provide analytic
information to physicians, without its context, may then complicate the
decision process of physicians. It is likely that the joint forces of
physicians and technology will produce better decisions than either of them
exclusively: after all, they do have different ways of dealing with the
complexity of a decision and are thus complementary. Therefore, the future
challenges of decision support do not only reside in the optimization of the
predictive value of the underlying models and algorithms, but equally in the
effective communication of information and its context to doctors.
","[{""version"":""v1"",""created"":""Mon, 2 Mar 2020 13:59:53 GMT""}]","2020-03-03"
"2003.00922","Okan Karaca Orhan Dr","Okan K. Orhan and David D. O'Regan","First-principles Hubbard U and Hund's J corrected approximate
  density-functional theory predicts an accurate fundamental gap in rutile and
  anatase TiO2","13 pages, 3 figures, 5 tables + Supporting Information","Phys. Rev. B 101, 245137 (2020)","10.1103/PhysRevB.101.245137",,"cond-mat.mtrl-sci cond-mat.str-el physics.chem-ph physics.comp-ph","http://arxiv.org/licenses/nonexclusive-distrib/1.0/","  Titanium dioxide (TiO$_2$) presents a long-standing challenge for approximate
Kohn-Sham density-functional theory (KS-DFT), as well as to its
Hubbard-corrected extension, DFT+$U$. We find that a previously proposed
extension of first-principles DFT+$U$ to incorporate a Hund's $J$ correction,
termed DFT+$U$+$J$, in combination with parameters calculated using a recently
proposed linear-response theory, predicts fundamental band-gaps accurate to
well within the experimental uncertainty in rutile and anatase TiO$_2$. Our
approach builds upon established findings that Hubbard correction to both
titanium $3d$ and oxygen $2p$ subspaces in TiO$_2$, symbolically giving
DFT+$U^{d,p}$, is necessary to achieve acceptable band-gaps using DFT+$U$. This
requirement remains when the first-principles Hund's $J$ is included. We also
find that the calculated gap depends on the correlated subspace definition even
when using subspace-specific first-principles $U$ and $J$ parameters. Using the
simplest reasonable correlated subspace definition and underlying functional,
the local density approximation, we show that high accuracy results from using
a relatively uncomplicated form of the DFT+$U$+$J$ functional. For closed-shell
systems such as TiO$_2$, we describe how various DFT+$U$+$J$ functionals reduce
to DFT+$U$ with suitably modified parameters, so that reliable band gaps can be
calculated for rutile and anatase with no modifications to a conventional
DFT+$U$ code.
","[{""version"":""v1"",""created"":""Mon, 2 Mar 2020 14:06:27 GMT""},{""version"":""v2"",""created"":""Thu, 18 Jun 2020 16:46:09 GMT""}]","2020-06-23"
"2003.00923","Yelena Mejova","Yelena Mejova and Kyriaki Kalimeri","Advertisers Jump on Coronavirus Bandwagon: Politics, News, and Business","Preprint. Under Review",,,,"cs.SI cs.CY","http://arxiv.org/licenses/nonexclusive-distrib/1.0/","  In the age of social media, disasters and epidemics usher not only a
devastation and affliction in the physical world, but also prompt a deluge of
information, opinions, prognoses and advice to billions of internet users. The
coronavirus epidemic of 2019-2020, or COVID-19, is no exception, with the World
Health Organization warning of a possible ""infodemic"" of fake news. In this
study, we examine the alternative narratives around the coronavirus outbreak
through advertisements promoted on Facebook, the largest social media platform
in the US. Using the new Facebook Ads Library, we discover advertisers from
public health and non-profit sectors, alongside those from news media,
politics, and business, incorporating coronavirus into their messaging and
agenda. We find the virus used in political attacks, donation solicitations,
business promotion, stock market advice, and animal rights campaigning. Among
these, we find several instances of possible misinformation, ranging from
bioweapons conspiracy theories to unverifiable claims by politicians. As we
make the dataset available to the community, we hope the advertising domain
will become an important part of quality control for public health
communication and public discourse in general.
","[{""version"":""v1"",""created"":""Mon, 2 Mar 2020 14:07:56 GMT""}]","2020-03-03"
"2003.00924","Lukas Schaupp","Lukas Schaupp, Patrick Pfreundschuh, Mathias Buerki, Cesar Cadena,
  Roland Siegwart, Juan Nieto","MOZARD: Multi-Modal Localization for Autonomous Vehicles in Urban
  Outdoor Environments",,,,,"cs.RO","http://creativecommons.org/licenses/by/4.0/","  Visually poor scenarios are one of the main sources of failure in visual
localization systems in outdoor environments. To address this challenge, we
present MOZARD, a multi-modal localization system for urban outdoor
environments using vision and LiDAR. By extending our preexisting key-point
based visual multi-session local localization approach with the use of semantic
data, an improved localization recall can be achieved across vastly different
appearance conditions. In particular we focus on the use of curbstone
information because of their broad distribution and reliability within urban
environments. We present thorough experimental evaluations on several driving
kilometers in challenging urban outdoor environments, analyze the recall and
accuracy of our localization system and demonstrate in a case study possible
failure cases of each subsystem. We demonstrate that MOZARD is able to bridge
scenarios where our previous work VIZARD fails, hence yielding an increased
recall performance, while a similar localization accuracy of 0.2m is achieved
","[{""version"":""v1"",""created"":""Mon, 2 Mar 2020 14:10:53 GMT""},{""version"":""v2"",""created"":""Tue, 3 Mar 2020 02:03:15 GMT""}]","2020-03-04"
"2003.00927","Dmitry Khangulyan","Dmitry Khangulyan, Felix Aharonian, Carlo Romoli and Andrew Taylor","Extension of the synchrotron radiation of electrons to very high
  energies in clumpy environments","14 pages, 6 figures, accepted for publication in ApJ","ApJ 914:76 (2021)","10.3847/1538-4357/abfcbf",,"astro-ph.HE","http://arxiv.org/licenses/nonexclusive-distrib/1.0/","  The synchrotron cooling of relativistic electrons is one of the most
effective radiation mechanisms in astrophysics. It not only accompanies the
process of particle acceleration but also has feedback on the formation of the
energy distribution of the parent electrons. The radiative cooling time of
electrons decreases with energy as $t_{\rm syn} \propto 1/E$; correspondingly
the overall radiation efficiency increases with energy. On the other hand, this
effect strictly limits the maximum energy of individual photons. Even in the
so-called extreme accelerators, where the acceleration proceeds at the highest
possible rate, $t_{\rm acc}^{-1} = eBc/E$, allowed in an ideal
magnetohydrodynamic plasma, the synchrotron radiation cannot extend well beyond
the characteristic energy determined by the electron mass and the
fine-structure constant: $h \nu^{\rm max} \sim m_e c^2/\alpha \sim 70
\rm\,MeV$.
  In this paper, we propose a model in which the formation of synchrotron
radiation takes place in compact magnetic blobs located inside the particle
accelerator and develop a formalism for calculations of synchrotron radiation
emerging from such systems. We demonstrate that for certain combinations of
parameters characterizing the accelerator and the magnetic blobs, the
synchrotron radiation can extend beyond this limit by a several orders of
magnitude. This scenario requires a weak magnetization of the particle
accelerator, and an efficient conversion of gas internal energy into magnetic
energy in sufficiently small blobs. The required size of the blobs is
constrained by the magnetic mirroring effect, that can prevent particle
penetration into the regions of strong magnetic field under certain conditions.
","[{""version"":""v1"",""created"":""Mon, 2 Mar 2020 14:19:49 GMT""},{""version"":""v2"",""created"":""Tue, 11 May 2021 06:48:52 GMT""}]","2021-06-21"
"2003.00928","Alexander Stewart","Alexander J. Stewart and Joshua B. Plotkin","The natural selection of good science",,,,,"physics.soc-ph q-bio.PE","http://arxiv.org/licenses/nonexclusive-distrib/1.0/","  Scientists in some fields are concerned that many, or even most, published
results are false. A high rate of false positives might arise accidentally,
from shoddy research practices. Or it might be the inevitable result of
institutional incentives that reward publication irrespective of veracity.
Recent models and discussion of scientific culture predict selection for
false-positive publications, as research labs that publish more positive
findings out-compete more diligent labs. There is widespread debate about how
scientific practices should be modified to avoid this degeneration. Some
analyses suggest that ""bad science"" will persist even when labs are
incentivized to undertake replication studies, and penalized for publications
that later fail to replicate. Here we develop a framework for modelling the
cultural evolution of research practices that allows labs to expend effort on
theory - enabling them, at a cost, to focus on hypotheses that are more likely
to be true on theoretical grounds. Theory restores the evolution of high effort
in laboratory practice, and it suppresses false-positive publications to a
technical minimum, even in the absence of replication. In fact, the mere
ability choose between two sets of hypotheses - one with greater chance of
being correct than the other - promotes better science than can be achieved by
having effortless access to the better set of hypotheses. Combining theory and
replication can have a synergistic effect in promoting good scientific
methodology and reducing the rate of false-positive publications. Based on our
analysis we propose four simple rules to promote good science in the face of
pressure to publish.
","[{""version"":""v1"",""created"":""Mon, 2 Mar 2020 14:19:50 GMT""}]","2020-03-03"
"2003.00929","Anna Giordano Bruno","Ilaria Castellano, Dikran Dikranjan, Domenico Freni, Anna Giordano
  Bruno, Daniele Toller","Intrinsic entropy for generalized quasimetric semilattices",,"JOURNAL OF ALGEBRA AND ITS APPLICATIONS (2021)",,,"math.GR math.CT math.DS","http://arxiv.org/licenses/nonexclusive-distrib/1.0/","  We introduce the notion of intrinsic semilattice entropy $\widetilde h$ in
the category $\mathcal L_{qm}$ of generalized quasimetric semilattices and
contractive homomorphisms. By using appropriate categories $\mathfrak X$ and
functors $F:\mathfrak X\to\mathcal L_{qm}$ we find specific known entropies
$\widetilde h_\mathfrak X$ on $\mathfrak X$ as intrinsic functorial entropies,
that is, as $\widetilde h_\mathfrak X=\widetilde h\circ F$. These entropies are
the intrinsic algebraic entropy, the algebraic and the topological entropies
for locally linearly compact vector spaces, the topological entropy for locally
compact totally disconnected groups and the algebraic entropy for locally
compact compactly covered abelian groups.
","[{""version"":""v1"",""created"":""Mon, 2 Mar 2020 14:20:02 GMT""},{""version"":""v2"",""created"":""Sun, 15 Mar 2020 16:54:49 GMT""},{""version"":""v3"",""created"":""Sun, 23 Aug 2020 14:23:09 GMT""}]","2021-01-22"
"2003.00930","Enrico Scalas","Bertram D\""uring, Nicos Georgiou, Sara Merino-Aceituno, Enrico Scalas","Continuum and thermodynamic limits for a simple random-exchange model","33 pages, 2 figures, to be submitted",,,,"math.PR econ.GN q-fin.EC","http://arxiv.org/licenses/nonexclusive-distrib/1.0/","  We discuss various limits of a simple random exchange model that can be used
for the distribution of wealth. We start from a discrete state space - discrete
time version of this model and, under suitable scaling, we show its functional
convergence to a continuous space - discrete time model. Then, we show a
thermodynamic limit of the empirical distribution to the solution of a kinetic
equation of Boltzmann type. We solve this equation and we show that the
solutions coincide with the appropriate limits of the invariant measure for the
Markov chain. In this way we complete Boltzmann's program of deriving kinetic
equations from random dynamics for this simple model. Three families of
invariant measures for the mean field limit are discovered and we show that
only two of those families can be obtained as limits of the discrete system and
the third is extraneous. Finally, we cast our results in the framework of
integer partitions and strengthen some results already available in the
literature.
","[{""version"":""v1"",""created"":""Mon, 2 Mar 2020 14:22:46 GMT""}]","2020-03-03"
"2003.00931","Lourdes Cruz Gonz\'alez","Lourdes Cruz, Yuriko Pitones, Enrique Reyes","Unmixedness of some weighted oriented graphs",,,,,"math.CO math.AC","http://creativecommons.org/licenses/by/4.0/","  Let $D=(G,\mathcal{O},w)$ be a weighted oriented graph whose edge ideal is
$I(D)$. In this paper, we characterize the unmixed property of $I(D)$ for each
one of the following cases: $G$ is an $SCQ$ graph; $G$ is a chordal graph; $G$
is a simplicial graph; $G$ is a perfect graph; $G$ has no $4$- or $5$-cycles;
$G$ is a graph without $3$- and $5$-cycles; and ${\rm girth}(G)\geqslant 5$.
","[{""version"":""v1"",""created"":""Mon, 2 Mar 2020 14:25:12 GMT""},{""version"":""v2"",""created"":""Mon, 11 Oct 2021 12:46:08 GMT""}]","2021-10-12"
"2003.00932","Lorenzo Taggi Dr","Lorenzo Taggi","Essential enhancements in Abelian networks: continuity and uniform
  strict monotonicity","21 pages,1 Figure. The paper has been entirely revised and
  significantly shortened",,,,"math.PR math-ph math.MP","http://arxiv.org/licenses/nonexclusive-distrib/1.0/","  We prove that in wide generality the critical curve of the activated random
walk model is a continuous function of the deactivation rate, and we provide a
bound on its slope which is uniform with respect to the choice of the graph.
Moreover, we derive strict monotonicity properties for the probability of a
wide class of `increasing' events,extending previous results of Rolla and
Sidoravicius (2012). Our proof method is of independent interest and can be
viewed as a reformulation of the `essential enhancements' technique -- which
was introduced for percolation -- in the framework of Abelian networks.
","[{""version"":""v1"",""created"":""Mon, 2 Mar 2020 14:28:09 GMT""},{""version"":""v2"",""created"":""Sat, 28 Mar 2020 18:15:38 GMT""},{""version"":""v3"",""created"":""Sun, 26 Apr 2020 10:16:17 GMT""},{""version"":""v4"",""created"":""Thu, 27 May 2021 19:26:11 GMT""},{""version"":""v5"",""created"":""Thu, 29 Sep 2022 12:42:11 GMT""}]","2022-09-30"
"2003.00933","Biye Xie","Biye Xie, Guangxu Su, Hong-Fei Wang, Feng Liu, Lumang Hu, Si-Yuan Yu,
  Peng Zhan, Ming-Hui Lu, Zhenlin Wang and Yan-Feng Chen","Higher-order Quantum Spin Hall Effect of Light","24 pages, 4 figures",,,,"cond-mat.mtrl-sci physics.optics","http://arxiv.org/licenses/nonexclusive-distrib/1.0/","  Band topology and related spin (or pseudo-spin) physics of photons provide us
with a new dimension for manipulating light, which is potentially useful for
information communication and data storage. Especially, the quantum spin Hall
effect of light, where electromagnetic waves propagate along surfaces of
samples with strong spin-momentum locking, paves the way for achieving
topologically protected photonic spin transport. Recently, the conventional
bulk-edge correspondence of the band topology has been extended to higher-order
cases that enables the explorations of topological states with codimensions
larger than 1 such as hinge and corner states. Here, for the first time, we
demonstrate a higherorder quantum spin Hall effect of light by utilizing an
all-dielectric C6v-symmetric photonic crystal. We observe corner states with
opposite pseudospin polarizations at different corners owing to nontrivial
higher-order topology and finite spin-spin coupling. By applying the
spin-polarized excitation sources, we can selectively excite the corner states
at different spatial positions through spin-momentum-locked decaying edge
states, resembling the quantum spin Hall effect in a higher-order manner. Our
work which breaks the barriers between the spin photonics and higher-order
topology opens the frontiers for studying lower-dimensional spinful classical
surface waves and supports explorations in robust communications.
","[{""version"":""v1"",""created"":""Mon, 2 Mar 2020 14:29:10 GMT""}]","2020-03-03"
"2003.00934","David Fern\'andez Rivas","Loreto Oyarte Galvez, Arjan Fraters, Herman L. Offerhaus, Michel
  Versluis, Ian W. Hunter, and David Fernandez Rivas","Microuidics control the ballistic energy of thermocavitation liquid jets
  for needle-free injections",,,"10.1063/1.5140264",,"physics.flu-dyn physics.app-ph","http://arxiv.org/licenses/nonexclusive-distrib/1.0/","  Illuminating a water solution with a focused continuous wave laser produces a
strong local heating of the liquid that leads to the nucleation of bubbles,
also known as thermocavitation. During the growth of the bubble, the
surrounding liquid is expelled from the constraining microfluidic channel
through a nozzle, creating a jet. The characteristics of the resulting liquid
jet was imaged using ultra-fast imaging techniques. Here, we provide a
phenomenological description of the jet shapes and velocities, and compare them
with a Boundary Integral numerical model. We define the parameter regime,
varying jet speed, taper geometry and liquid volume, for optimal printing,
injection and spray applications. These results are important for the design of
energy-efficient needle-free jet injectors based on microfluidic
thermocavitation.
","[{""version"":""v1"",""created"":""Mon, 2 Mar 2020 14:31:52 GMT""}]","2020-03-03"
"2003.00935","C. Maria Keet","George Rautenbach and C. Maria Keet","Toward equipping Artificial Moral Agents with multiple ethical theories","technical report; 33 pages, 11 figures, 2 tables, 4 code listings",,,,"cs.CY cs.AI","http://arxiv.org/licenses/nonexclusive-distrib/1.0/","  Artificial Moral Agents (AMA's) is a field in computer science with the
purpose of creating autonomous machines that can make moral decisions akin to
how humans do. Researchers have proposed theoretical means of creating such
machines, while philosophers have made arguments as to how these machines ought
to behave, or whether they should even exist. Of the currently theorised AMA's,
all research and design has been done with either none or at most one specified
normative ethical theory as basis. This is problematic because it narrows down
the AMA's functional ability and versatility which in turn causes moral
outcomes that a limited number of people agree with (thereby undermining an
AMA's ability to be moral in a human sense). As solution we design a
three-layer model for general normative ethical theories that can be used to
serialise the ethical views of people and businesses for an AMA to use during
reasoning. Four specific ethical norms (Kantianism, divine command theory,
utilitarianism, and egoism) were modelled and evaluated as proof of concept for
normative modelling. Furthermore, all models were serialised to XML/XSD as
proof of support for computerisation.
","[{""version"":""v1"",""created"":""Mon, 2 Mar 2020 14:33:22 GMT""}]","2020-03-03"
"2003.00936","Zbigniew Palmowski","Onno Boxma, Andreas L\""opker, Michel Mandjes and Zbigniew Palmowski","A Multiplicative Version of the Lindley Recursion",,,,,"math.PR","http://arxiv.org/licenses/nonexclusive-distrib/1.0/","  This paper presents an analysis of the stochastic recursion $W_{i+1} =
[V_iW_i+Y_i]^+$ that can be interpreted as an autoregressive process of order
1, reflected at 0. We start our exposition by a discussion of the model's
stability condition. Writing $Y_i=B_i-A_i$, for independent sequences of
non-negative i.i.d.\ random variables $\{A_i\}_{i\in N_0}$ and $\{B_i\}_{i\in
N_0}$, and assuming $\{V_i\}_{i\in N_0}$ is an i.i.d. sequence as well
(independent of $\{A_i\}_{i\in N_0}$ and $\{B_i\}_{i\in N_0}$), we then
consider three special cases: (i) $V_i$ attains negative values only and $B_i$
has a rational LST, (ii) $V_i$ equals a positive value $a$ with certain
probability $p\in (0,1)$ and is negative otherwise, and both $A_i$ and $B_i$
have a rational LST, (iii) $V_i$ is uniformly distributed on $[0,1]$, and $A_i$
is exponentially distributed. In all three cases we derive transient and
stationary results, where the transient results are in terms of the transform
at a geometrically distributed epoch.
","[{""version"":""v1"",""created"":""Mon, 2 Mar 2020 14:33:28 GMT""}]","2020-03-03"
"2003.00937","Yi-Rui Yang","Yi-Rui Yang, Wu-Jun Li","Buffered Asynchronous SGD for Byzantine Learning",,,,,"cs.LG stat.ML","http://arxiv.org/licenses/nonexclusive-distrib/1.0/","  Distributed learning has become a hot research topic due to its wide
application in clusterbased large-scale learning, federated learning, edge
computing and so on. Most traditional distributed learning methods typically
assume no failure or attack. However, many unexpected cases, such as
communication failure and even malicious attack, may happen in real
applications. Hence, Byzantine learning (BL), which refers to distributed
learning with failure or attack, has recently attracted much attention. Most
existing BL methods are synchronous, which are impractical in some applications
due to heterogeneous or offline workers. In these cases, asynchronous BL (ABL)
is usually preferred. In this paper, we propose a novel method, called buffered
asynchronous stochastic gradient descent (BASGD), for ABL. To the best of our
knowledge, BASGD is the first ABL method that can resist non-omniscient attacks
without storing any instances on server. Furthermore, we also propose an
improved variant of BASGD, called BASGD with momentum (BASGDm), by introducing
momentum into BASGD. BASGDm can resist both non-omniscient and omniscient
attacks. Compared with those methods which need to store instances on server,
BASGD and BASGDm have a wider scope of application. Both BASGD and BASGDm are
compatible with various aggregation rules. Moreover, both BASGD and BASGDm are
proved to be convergent and be able to resist failure or attack. Empirical
results show that our methods significantly outperform existing ABL baselines
when there exists failure or attack on workers.
","[{""version"":""v1"",""created"":""Mon, 2 Mar 2020 14:34:28 GMT""},{""version"":""v2"",""created"":""Tue, 3 Mar 2020 09:06:33 GMT""},{""version"":""v3"",""created"":""Thu, 1 Jul 2021 09:06:17 GMT""},{""version"":""v4"",""created"":""Mon, 31 Jan 2022 13:14:01 GMT""}]","2022-02-01"
"2003.00938","Meirav Zehavi","Fedor V. Fomin, Daniel Lokshtanov, Fahad Panolan, Saket Saurabh,
  Meirav Zehavi","ETH-Tight Algorithms for Long Path and Cycle on Unit Disk Graphs","Extended version to appear in SoCG'20",,,,"cs.DS cs.CG","http://arxiv.org/licenses/nonexclusive-distrib/1.0/","  We present an algorithm for the extensively studied Long Path and Long Cycle
problems on unit disk graphs that runs in time $2^{O(\sqrt{k})}(n+m)$. Under
the Exponential Time Hypothesis, Long Path and Long Cycle on unit disk graphs
cannot be solved in time $2^{o(\sqrt{k})}(n+m)^{O(1)}$ [de Berg et al., STOC
2018], hence our algorithm is optimal. Besides the
$2^{O(\sqrt{k})}(n+m)^{O(1)}$-time algorithm for the (arguably) much simpler
Vertex Cover problem by de Berg et al. [STOC 2018] (which easily follows from
the existence of a $2k$-vertex kernel for the problem), this is the only known
ETH-optimal fixed-parameter tractable algorithm on UDGs. Previously, Long Path
and Long Cycle on unit disk graphs were only known to be solvable in time
$2^{O(\sqrt{k}\log k)}(n+m)$. This algorithm involved the introduction of a new
type of a tree decomposition, entailing the design of a very tedious dynamic
programming procedure. Our algorithm is substantially simpler: we completely
avoid the use of this new type of tree decomposition. Instead, we use a marking
procedure to reduce the problem to (a weighted version of) itself on a standard
tree decomposition of width $O(\sqrt{k})$.
","[{""version"":""v1"",""created"":""Mon, 2 Mar 2020 14:34:53 GMT""}]","2020-03-03"
