"2003.00708","Gaurav Verma","Gaurav Verma, Vishwa Vinay, Sahil Bansal, Shashank Oberoi, Makkunda
  Sharma, Prakhar Gupta","Using Image Captions and Multitask Learning for Recommending Query
  Reformulations","Accepted as a full paper at ECIR 2020",,,,"cs.IR cs.AI","http://arxiv.org/licenses/nonexclusive-distrib/1.0/","  Interactive search sessions often contain multiple queries, where the user
submits a reformulated version of the previous query in response to the
original results. We aim to enhance the query recommendation experience for a
commercial image search engine. Our proposed methodology incorporates current
state-of-the-art practices from relevant literature -- the use of
generation-based sequence-to-sequence models that capture session context, and
a multitask architecture that simultaneously optimizes the ranking of results.
We extend this setup by driving the learning of such a model with captions of
clicked images as the target, instead of using the subsequent query within the
session. Since these captions tend to be linguistically richer, the
reformulation mechanism can be seen as assistance to construct more descriptive
queries. In addition, via the use of a pairwise loss for the secondary ranking
task, we show that the generated reformulations are more diverse.
","[{""version"":""v1"",""created"":""Mon, 2 Mar 2020 08:22:46 GMT""}]","2020-03-03"
"2003.00709","Suhyun Shin","Suhyun Shin, Myungshin Im, Yongjung Kim, Minhee Hyun, Soojong Pak,
  Yiseul Jeon, Tae-Geun Ji, Hojae Ahn, Seoyeon Byeon, Jimin Han, Sungyong
  Hwang, Sophia Kim, Gu Lim, Insu Paek, Gregory S. H. Paek, Yoon Chan Taak,
  Changsu Choi, Jueun Hong, Hyunsung David Jun, Dohyeong Kim, Duho Kim, Minjin
  Kim, Jae-Woo Kim, Ji Hoon Kim, Hye-In Lee, Seong-Kook Lee, Won-Kee Park,
  Woojin Park, and Yongmin Yoon","The Infrared Medium-deep Survey. \Romannum{7}. Faint Quasars at $z \sim
  5$ in the ELAIS-N1 Field","16 pages, 9 figures, 4 tables. Accepted for publication in ApJ",,"10.3847/1538-4357/ab7bde",,"astro-ph.GA","http://arxiv.org/licenses/nonexclusive-distrib/1.0/","  The intergalactic medium (IGM) at $z\sim$ 5 to 6 is largely ionized, and yet
the main source for the IGM ionization in the early universe is uncertain. Of
the possible contributors are faint quasars with $-26 \lesssim M_{\rm 1450}
\lesssim -23$, but their number density is poorly constrained at $z\sim5$. In
this paper, we present our survey of faint quasars at $z\sim5$ in the European
Large-Area {\it ISO} Survey-North 1 (ELAIS-N1) field over a survey area of 6.51
deg$^2$ and examine if such quasars can be the dominant source of the IGM
ionization. We use the deep optical/near-infrared data of the ELAIS-N1 field as
well as the additional medium-band observations to find $z \sim 5$ quasars
through a two-step approach using the broadband color selection, and SED
fitting with the medium-band information included. Adopting Bayesian
information criterion, we identify ten promising quasar candidates. Spectra of
three of the candidates are obtained, confirming all of them to be quasars at
$z\sim5$ and supporting the reliability of the quasar selection. Using the
promising candidates, we derive the $z\sim5$ quasar luminosity function at $-26
\lesssim M_{\rm 1450} \lesssim -23$. The number density of faint $z\sim5$
quasars in the ELAIS-N1 field is consistent with several previous results that
quasars are not the main contributors to the IGM-ionizing photons at $z\sim5$
","[{""version"":""v1"",""created"":""Mon, 2 Mar 2020 08:27:07 GMT""}]","2020-04-22"
"2003.00710","Sascha Wirges","Sascha Wirges, Ye Yang, Sven Richter, Haohao Hu, Christoph Stiller","Learned Enrichment of Top-View Grid Maps Improves Object Detection","6 pages, 6 figures, 4 tables",,,,"cs.CV","http://arxiv.org/licenses/nonexclusive-distrib/1.0/","  We propose an object detector for top-view grid maps which is additionally
trained to generate an enriched version of its input. Our goal in the joint
model is to improve generalization by regularizing towards structural knowledge
in form of a map fused from multiple adjacent range sensor measurements. This
training data can be generated in an automatic fashion, thus does not require
manual annotations. We present an evidential framework to generate training
data, investigate different model architectures and show that predicting
enriched inputs as an additional task can improve object detection performance.
","[{""version"":""v1"",""created"":""Mon, 2 Mar 2020 08:27:54 GMT""},{""version"":""v2"",""created"":""Mon, 9 Mar 2020 11:57:30 GMT""}]","2020-03-10"
"2003.00711","Weibing Huang","Sizhang Dai, Weibing Huang","A-TVSNet: Aggregated Two-View Stereo Network for Multi-View Stereo Depth
  Estimation",,,,,"cs.CV","http://arxiv.org/licenses/nonexclusive-distrib/1.0/","  We propose a learning-based network for depth map estimation from multi-view
stereo (MVS) images. Our proposed network consists of three sub-networks: 1) a
base network for initial depth map estimation from an unstructured stereo image
pair, 2) a novel refinement network that leverages both photometric and
geometric information, and 3) an attentional multi-view aggregation framework
that enables efficient information exchange and integration among different
stereo image pairs. The proposed network, called A-TVSNet, is evaluated on
various MVS datasets and shows the ability to produce high quality depth map
that outperforms competing approaches. Our code is available at
https://github.com/daiszh/A-TVSNet.
","[{""version"":""v1"",""created"":""Mon, 2 Mar 2020 08:29:35 GMT""}]","2020-03-03"
"2003.00712","Abolfazl Lavaei","Abolfazl Lavaei, Fabio Somenzi, Sadegh Soudjani, Ashutosh Trivedi, and
  Majid Zamani","Formal Controller Synthesis for Continuous-Space MDPs via Model-Free
  Reinforcement Learning","This work is accepted at the 11th ACM/IEEE Conference on
  Cyber-Physical Systems (ICCPS)",,,,"eess.SY cs.LG cs.SY","http://arxiv.org/licenses/nonexclusive-distrib/1.0/","  A novel reinforcement learning scheme to synthesize policies for
continuous-space Markov decision processes (MDPs) is proposed. This scheme
enables one to apply model-free, off-the-shelf reinforcement learning
algorithms for finite MDPs to compute optimal strategies for the corresponding
continuous-space MDPs without explicitly constructing the finite-state
abstraction. The proposed approach is based on abstracting the system with a
finite MDP (without constructing it explicitly) with unknown transition
probabilities, synthesizing strategies over the abstract MDP, and then mapping
the results back over the concrete continuous-space MDP with approximate
optimality guarantees. The properties of interest for the system belong to a
fragment of linear temporal logic, known as syntactically co-safe linear
temporal logic (scLTL), and the synthesis requirement is to maximize the
probability of satisfaction within a given bounded time horizon. A key
contribution of the paper is to leverage the classical convergence results for
reinforcement learning on finite MDPs and provide control strategies maximizing
the probability of satisfaction over unknown, continuous-space MDPs while
providing probabilistic closeness guarantees. Automata-based reward functions
are often sparse; we present a novel potential-based reward shaping technique
to produce dense rewards to speed up learning. The effectiveness of the
proposed approach is demonstrated by applying it to three physical benchmarks
concerning the regulation of a room's temperature, control of a road traffic
cell, and of a 7-dimensional nonlinear model of a BMW 320i car.
","[{""version"":""v1"",""created"":""Mon, 2 Mar 2020 08:29:36 GMT""}]","2020-03-03"
"2003.00713","Osama Bushnaq","Osama M. Bushnaq, Mustafa A. Kishk, Abdulkadir \c{C}elik, Mohamed-Slim
  Alouini, Tareq Y. Al-Naffouri","Optimal Deployment of Tethered Drones for Maximum Cellular Coverage in
  User Clusters","Accepted at the IEEE Transaction on Wireless Communications",,,,"cs.NI","http://arxiv.org/licenses/nonexclusive-distrib/1.0/","  Unmanned aerial vehicle (UAV) assisted cellular communication is gaining
significant interest recently. Although it offers several advantages over
terrestrial communication, UAV communication suffers from two main
shortcomings. The typical untethered UAV (uUAV) has a limited battery power
supply and therefore limited flying time, and it needs an extra wireless
backhaul link to connect users to the core network. In this paper, we propose
the utilization of the tethered UAV (tUAV) to assist the cellular network,
where the tether provides power supply and connects the tUAV to the core
network through high capacity link. The tUAV however has a limited mobility due
to the limited tether length. A stochastic geometry-based analysis is provided
for the coverage probability of an UAV-assisted cellular network where the
mobile users located within a circular hot-spot. For that setup, we analyze and
compare two scenarios: (i) utilizing uUAV and (ii) utilizing tUAV, for
offloading the terrestrial base station (TBS). We capture the aforementioned
limitations of each of the uUAV and the tUAV in our analysis. A novel user
association analysis is provided given the TBS and the UAV locations. Next, we
study the optimal locations of the uUAV and the tUAV to maximize the coverage
probability. Multiple useful insights are revealed. For instance, numerical
results show that tUAVs outperform uUAVs when the tether length is above 75 m,
given that the uUAV is available for 80% of the time due to its battery
limitations.
","[{""version"":""v1"",""created"":""Mon, 2 Mar 2020 08:37:07 GMT""},{""version"":""v2"",""created"":""Sun, 29 Mar 2020 07:02:13 GMT""},{""version"":""v3"",""created"":""Sat, 27 Jun 2020 13:58:06 GMT""},{""version"":""v4"",""created"":""Mon, 16 Nov 2020 19:29:48 GMT""}]","2020-11-18"
"2003.00714","Wen Chen","Yang Yu, and Wen Chen","Design of Low Complexity Non-binary LDPC Codes with an Approximated
  Performance-Complexity Tradeoff",,,,,"eess.SP","http://arxiv.org/licenses/nonexclusive-distrib/1.0/","  By presenting an approximated performance-complexity tradeoff (PCT)
algorithm,a low-complexity non-binary low density parity check (LDPC) code over
q-ary-input symmetric-output channel is designed in this manuscript which
converges faster than the threshold-optimized non-binary LDPC codes in the low
error rate regime. We examine our algorithm by both hard and soft decision
decoders.Moreover, simulation shows that the approximated PCT algorithm has
accelerated the convergence process by 30% regarding the number of the decoding
iterations.
","[{""version"":""v1"",""created"":""Mon, 2 Mar 2020 08:41:33 GMT""}]","2020-03-03"
"2003.00715","Adeline Crepieux","M. Lavagna, V. Talbo, T.Q. Duong and A. Cr\'epieux","Level anticrossing effect in single-level or multilevel double quantum
  dots: Electrical conductance, zero-frequency charge susceptibility and
  Seebeck coefficient","18 pages, 13 figures","Phys. Rev. B 102, 115112 (2020)","10.1103/PhysRevB.102.115112",,"cond-mat.mes-hall","http://arxiv.org/licenses/nonexclusive-distrib/1.0/","  We study electrical and thermoelectrical properties for a double quantum dot
system. We consider the cases of both single-level and multilevel quantum dots
whatever the way they are coupled, either in a series or in a parallel
arrangement. The calculations are performed by using the nonequilibrium Green
function theory. In the case of a single-level double quantum dot, the problem
is exactly solvable whereas for a multilevel double quantum dot, an analytical
solution is obtained in the limit of energy-independent hopping integrals. { We
present a detailed discussion about} the dependences of electrical conductance,
zero-frequency charge susceptibility and Seebeck coefficient on the gate
voltages applied to the dots, allowing us to derive the charge stability
diagram. The findings are in agreement with the experimental observations
notably with the occurrence of successive sign changes of the Seebeck
coefficient when varying the gate voltages. We interpret the results in terms
of the bonding and antibonding states produced by the level anticrossing effect
which occurs in the presence of a finite interdot coupling. We show that at
equilibrium the boundary lines between the domains with different dot
occupancies in the charge stability diagram, take place when the bonding and
antibonding state levels are aligned with the chemical potentials in the leads.
Finally the total dot occupancy is found to be considerably reduced in the case
in parallel compared with the case in series, { whenever} the level energies in
each dot are equal. We interpret this dip as a direct manifestation of the
interference effects occurring in the presence of the two electronic
transmission paths provided by each dot.
","[{""version"":""v1"",""created"":""Mon, 2 Mar 2020 08:42:45 GMT""},{""version"":""v2"",""created"":""Fri, 25 Sep 2020 14:59:50 GMT""}]","2020-09-28"
"2003.00716","Klas Modin","Klas Modin and Milo Viviani","Integrability of point-vortex dynamics via symplectic reduction: a
  survey","26 pages, 4 figures, accepted in Arnold Math. J","Arnold Math. J., 7(3): 357-385, 2021","10.1007/s40598-020-00162-8",,"math-ph math.DS math.MP math.SG","http://arxiv.org/licenses/nonexclusive-distrib/1.0/","  Point-vortex dynamics describe idealized, non-smooth solutions to the
incompressible Euler equations on 2-dimensional manifolds. Integrability
results for few point-vortices on various domains is a vivid topic, with many
results and techniques scattered in the literature. Here we give a unified
framework for proving integrability results for $N=2$, $3$, or $4$
point-vortices (and also more general Hamiltonian systems), based on symplectic
reduction theory. The approach works on any 2-dimensional manifold; we
illustrate it on the sphere, the plane, the hyperbolic plane, and the flat
torus. A systematic study of integrability is prompted by advances in
2-dimensional turbulence, bridging the long-time behaviour of 2D Euler
equations with questions of point-vortex integrability. A gallery of solutions
is given in the appendix.
","[{""version"":""v1"",""created"":""Mon, 2 Mar 2020 08:42:49 GMT""},{""version"":""v2"",""created"":""Fri, 8 May 2020 13:39:56 GMT""},{""version"":""v3"",""created"":""Fri, 25 Sep 2020 15:15:51 GMT""}]","2023-03-20"
"2003.00717","Philipp Schmidt-Wellenburg","Klaus Kirch and Philipp Schmidt-Wellenburg","Search for electric dipole moments","6 pages, 4 figures, one table, confrence proceedings of FCCP2019 on
  Capri, Italy",,"10.1051/epjconf/202023401007",,"hep-ph hep-ex","http://arxiv.org/licenses/nonexclusive-distrib/1.0/","  Searches for permanent electric dipole moments of fundamental particles and
systems with spin are the experiments most sensitive to new CP violating
physics and a top priority of a growing international community. We briefly
review the current status of the field emphasizing on the charged leptons and
lightest baryons.
","[{""version"":""v1"",""created"":""Mon, 2 Mar 2020 08:43:03 GMT""}]","2020-05-20"
"2003.00718","Alessandro Monguzzi","Alessandro Monguzzi, Marco M. Peloso","(Ir-)regularity of canonical projection operators on some weakly
  pseudoconvex domains","19 pages, 2 figures",,,,"math.CV","http://arxiv.org/licenses/nonexclusive-distrib/1.0/","  In this paper we discuss some recent results concerning the regularity and
irregularity of the Bergman and Szeg\H{o} projections on some weakly
pseudoconvex domains that have the common feature to possess a nontrivial
Nebenh\""ulle.
","[{""version"":""v1"",""created"":""Mon, 2 Mar 2020 08:48:56 GMT""}]","2020-03-03"
"2003.00719","Nicolas Heist","Nicolas Heist, Sven Hertling, Daniel Ringler and Heiko Paulheim","Knowledge Graphs on the Web -- an Overview","Nicolas Heist, Sven Hertling, Daniel Ringler, Heiko Paulheim:
  Knowledge Graphs on the Web -- an Overview. In: Ilaria Tiddi, Freddy Lecue,
  Pascal Hitzler (eds.), Knowledge Graphs for eXplainable AI -- Foundations,
  Applications and Challenges. Studies on the Semantic Web, IOS Press,
  Amsterdam, 2020, to appear. [extended version]",,,,"cs.AI cs.DB","http://arxiv.org/licenses/nonexclusive-distrib/1.0/","  Knowledge Graphs are an emerging form of knowledge representation. While
Google coined the term Knowledge Graph first and promoted it as a means to
improve their search results, they are used in many applications today. In a
knowledge graph, entities in the real world and/or a business domain (e.g.,
people, places, or events) are represented as nodes, which are connected by
edges representing the relations between those entities. While companies such
as Google, Microsoft, and Facebook have their own, non-public knowledge graphs,
there is also a larger body of publicly available knowledge graphs, such as
DBpedia or Wikidata. In this chapter, we provide an overview and comparison of
those publicly available knowledge graphs, and give insights into their
contents, size, coverage, and overlap.
","[{""version"":""v1"",""created"":""Mon, 2 Mar 2020 08:58:21 GMT""},{""version"":""v2"",""created"":""Thu, 5 Mar 2020 07:36:55 GMT""},{""version"":""v3"",""created"":""Thu, 12 Mar 2020 10:31:25 GMT""}]","2020-03-13"
"2003.00720","Mark Kuiack","Mark J. Kuiack, Ralph A.M.J. Wijers, Antonia Rowlinson, Aleksandar
  Shulevski, Folkert Huizinga, Gijs Molenaar, Peeyush Prasad","Long-term study of extreme giant pulses from PSR B0950+08 with AARTFAAC","10 pages, 9 figures, 1 table. Submitted to MNRAS",,"10.1093/mnras/staa1996",,"astro-ph.HE","http://arxiv.org/licenses/nonexclusive-distrib/1.0/","  We report on the detection of extreme giant pulses (GPs) from one of the
oldest-known pulsars, the highly variable PSR B0950+08, with the
Amsterdam-ASTRON Radio Transient Facility And Analysis Centre (AARTFAAC), a
parallel transient detection instrument operating as a subsystem of the LOw
Frequency ARray (LOFAR). During processing of our Northern Hemisphere survey
for low-frequency radio transients, a sample of 275 pulses with fluences
ranging from 42 to 177 kJy ms were detected in one-second snapshot images. The
brightest pulses are an order of magnitude brighter than those previously
reported at 42 and 74 MHz, on par with the levels observed in a previous
long-term study at 103 MHz. Both their rate and fluence distribution differ
between and within the various studies done to date. The GP rate is highly
variable, from 0 to 30 per hour, with only two three-hour observations
accounting for nearly half of the pulses detected in the 96 h surveyed. It does
not vary significantly within a few-hour observation, but can vary strongly one
from day to the next. The spectra appear strongly and variably structured, with
emission sometimes confined to a single 195.3 kHz subband, and the pulse
spectra changing on a timescale of order 10 min.
","[{""version"":""v1"",""created"":""Mon, 2 Mar 2020 09:09:04 GMT""},{""version"":""v2"",""created"":""Mon, 6 Jul 2020 11:11:06 GMT""}]","2020-07-22"
"2003.00721","Peter Camps","Peter Camps and Maarten Baes","SKIRT 9: redesigning an advanced dust radiative transfer code to allow
  kinematics, line transfer and polarization by aligned dust grains","24 pages, 14 figures, accepted for publication in Astronomy and
  Computing",,,,"astro-ph.GA","http://arxiv.org/licenses/nonexclusive-distrib/1.0/","  The open source SKIRT Monte Carlo radiative transfer code has been used for
more than 15 years to model the interaction between radiation and dust in
various astrophysical systems. In this work, we present version 9 of the code,
which has been substantially redesigned to support long-term objectives. We
invite interested readers to participate in the development, testing and
application of new features such as including gas media types in addition to
dust, performing line transfer in addition to continuum radiation transfer, and
modeling polarization by non-spherical dust grains aligned by magnetic fields.
We describe the major challenges involved in preparing the code for these and
other extensions, as well as their resolution, including a completely new
treatment of wavelengths to support kinematics. SKIRT 9 properly runs over 400
handcrafted functional tests and successfully performs all relevant benchmarks.
The source code and all documentation is publicly available for use and ready
for further collaborative development.
","[{""version"":""v1"",""created"":""Mon, 2 Mar 2020 09:09:36 GMT""}]","2020-03-03"
"2003.00722","Junfeng Wen","Junfeng Wen, Bo Dai, Lihong Li, Dale Schuurmans","Batch Stationary Distribution Estimation",,,,,"cs.LG cs.AI stat.ML","http://arxiv.org/licenses/nonexclusive-distrib/1.0/","  We consider the problem of approximating the stationary distribution of an
ergodic Markov chain given a set of sampled transitions. Classical
simulation-based approaches assume access to the underlying process so that
trajectories of sufficient length can be gathered to approximate stationary
sampling. Instead, we consider an alternative setting where a fixed set of
transitions has been collected beforehand, by a separate, possibly unknown
procedure. The goal is still to estimate properties of the stationary
distribution, but without additional access to the underlying system. We
propose a consistent estimator that is based on recovering a correction ratio
function over the given data. In particular, we develop a variational power
method (VPM) that provides provably consistent estimates under general
conditions. In addition to unifying a number of existing approaches from
different subfields, we also find that VPM yields significantly better
estimates across a range of problems, including queueing, stochastic
differential equations, post-processing MCMC, and off-policy evaluation.
","[{""version"":""v1"",""created"":""Mon, 2 Mar 2020 09:10:01 GMT""}]","2020-03-03"
"2003.00723","E. Harikumar","E. Harikumar and Vishnu Rajagopal","Quantisation of $\kappa$-deformed Dirac equation","18 page, More discussions, calculations and references added","International Journal of Modern Physics A Vol. 35 (2020) 2050147","10.1142/S0217751X2050147X",,"hep-th","http://arxiv.org/licenses/nonexclusive-distrib/1.0/","  In this paper, we study the quantisation of Dirac field theory in the
$\kappa$-deformed space-time. We adopt a quantisation method that uses only
equations of motion for quantising the field. Starting from $\kappa$-deformed
Dirac equation, valid up to first order in the deformation parameter $a$, we
derive deformed unequal time anti-commutation relation between deformed field
and its adjoint, leading to undeformed oscillator algebra. Exploiting the
freedom of imposing a deformed unequal time anti-commutation relations between
$\kappa$-deformed spinor and its adjoint, we also derive a deformed oscillator
algebra. We show that deformed number operator is the conserved charge
corresponding to global phase transformation symmetry. We construct the
$\kappa$-deformed conserved currents, valid up to first order in $a$,
corresponding to parity and time-reversal symmetries of $\kappa$-deformed Dirac
equation also. We show that these conserved currents and charges have a
mass-dependent correction, valid up to first order in $a$. This novel feature
is expected to have experimental significance in particle physics. We also show
that it is not possible to construct a conserved current associated with charge
conjugation, showing that the Dirac particle and its anti-particle satisfy
different equations in $\kappa$-space-time.
","[{""version"":""v1"",""created"":""Mon, 2 Mar 2020 09:11:51 GMT""},{""version"":""v2"",""created"":""Wed, 3 Jun 2020 04:45:46 GMT""}]","2020-12-24"
"2003.00724","Adem Cicek","Abdulsamet Caglan, Adem Cicek, Enver Cavus, Ebrahim Bedeer, and Halim
  Yanikomeroglu","Polar Coded Faster-than-Nyquist (FTN) Signaling with Symbol-by-Symbol
  Detection",,,,,"eess.SP","http://arxiv.org/licenses/nonexclusive-distrib/1.0/","  Reduced complexity faster-than-Nyquist (FTN) signaling systems are gaining
increased attention as they provide improved bandwidth utilization for an
acceptable level of detection complexity. In order to have a better
understanding of the tradeoff between performance and complexity of the reduced
complexity FTN detection techniques, it is necessary to study these techniques
in the presence of channel coding. In this paper, we investigate the
performance a polar coded FTN system which uses a reduced complexity FTN
detection, namely, the recently proposed successive symbol-by-symbol with
go-backK sequence estimation (SSSgbKSE) technique. Simulations are performed
for various intersymbol-interference (ISI) levels and for various go-back-K
values. Bit error rate (BER) performance of Bahl-Cocke-Jelinek-Raviv (BCJR)
detection and SSSgbKSE detection techniques are studied for both uncoded and
polar coded systems. Simulation results reveal that polar codes can compensate
some of the performance loss incurred in the reduced complexity SSSgbKSE
technique and assist in closing the performance gap between BCJR and SSSgbKSE
detection algorithms.
","[{""version"":""v1"",""created"":""Mon, 2 Mar 2020 09:17:56 GMT""}]","2020-03-03"
