"2003.00615","Jia Peng","Peng Jia, Xuebo Wu, Yi Huang, Bojun Cai, Dongmei Cai","PSF--NET: A Non-parametric Point Spread Function Model for Ground Based
  Optical Telescopes","Accepted by AJ. The complete code can be downloaded at
  DOI:10.12149/101014",,"10.3847/1538-3881/ab7b79",,"astro-ph.IM astro-ph.SR cs.CV physics.optics","http://arxiv.org/licenses/nonexclusive-distrib/1.0/","  Ground based optical telescopes are seriously affected by atmospheric
turbulence induced aberrations. Understanding properties of these aberrations
is important both for instruments design and image restoration methods
development. Because the point spread function can reflect performance of the
whole optic system, it is appropriate to use the point spread function to
describe atmospheric turbulence induced aberrations. Assuming point spread
functions induced by the atmospheric turbulence with the same profile belong to
the same manifold space, we propose a non-parametric point spread function --
PSF-NET. The PSF-NET has a cycle convolutional neural network structure and is
a statistical representation of the manifold space of PSFs induced by the
atmospheric turbulence with the same profile. Testing the PSF-NET with
simulated and real observation data, we find that a well trained PSF--NET can
restore any short exposure images blurred by atmospheric turbulence with the
same profile. Besides, we further use the impulse response of the PSF-NET,
which can be viewed as the statistical mean PSF, to analyze interpretation
properties of the PSF-NET. We find that variations of statistical mean PSFs are
caused by variations of the atmospheric turbulence profile: as the difference
of the atmospheric turbulence profile increases, the difference between
statistical mean PSFs also increases. The PSF-NET proposed in this paper
provides a new way to analyze atmospheric turbulence induced aberrations, which
would be benefit to develop new observation methods for ground based optical
telescopes.
","[{""version"":""v1"",""created"":""Mon, 2 Mar 2020 00:17:25 GMT""}]","2020-04-08"
"2003.00616","Mojtaba Ghadimi","Moji Ghadimi, Elizabeth M. Bridge, Jordan Scarabel, Steven Connell,
  Kenji Shimizu, Erik Streed and Mirko Lobino","Multi-channel Opto-mechanical Switch and Locking System for Wavemeters",,,"10.1364/AO.390881",,"physics.optics physics.atom-ph","http://arxiv.org/licenses/nonexclusive-distrib/1.0/","  Here we present a cost effective multi-channel opto-mechanical switch and
software PID system for locking multiple lasers to a single channel commercial
wavemeter. The switch is based on a rotating cylinder that selectively
transmits one laser beam at a time to the wavemeter, the wavelength is read by
the computer and an error signal is output to the lasers to correct wavelength
drifts every millisecond. We use this system to stabilise 740 nm (subsequently
frequency doubled to 370 nm), 399 nm and 935 nm lasers for trapping and cooling
different isotopes of Yb+ ion. We characterize the frequency stability of the
three lasers by using a second, more precise, commercial wavemeter. We also
characterise the absolute frequency stability of the 740 nm laser using the
fluorescence drift rate of a trapped 174Yb+ ion. For the 740 nm laser we
demonstrate an Allan deviation, df/f, of 3 x 10^-10 (at 20 s integration time),
equivalent to sub-200 KHz stability.
","[{""version"":""v1"",""created"":""Mon, 2 Mar 2020 00:21:59 GMT""},{""version"":""v2"",""created"":""Tue, 24 Mar 2020 22:35:41 GMT""}]","2020-07-15"
"2003.00617","Lester Mackey","Ashia Wilson, Maximilian Kasy, Lester Mackey","Approximate Cross-validation: Guarantees for Model Assessment and
  Selection",,,,,"stat.ML cs.LG","http://arxiv.org/licenses/nonexclusive-distrib/1.0/","  Cross-validation (CV) is a popular approach for assessing and selecting
predictive models. However, when the number of folds is large, CV suffers from
a need to repeatedly refit a learning procedure on a large number of training
datasets. Recent work in empirical risk minimization (ERM) approximates the
expensive refitting with a single Newton step warm-started from the full
training set optimizer. While this can greatly reduce runtime, several open
questions remain including whether these approximations lead to faithful model
selection and whether they are suitable for non-smooth objectives. We address
these questions with three main contributions: (i) we provide uniform
non-asymptotic, deterministic model assessment guarantees for approximate CV;
(ii) we show that (roughly) the same conditions also guarantee model selection
performance comparable to CV; (iii) we provide a proximal Newton extension of
the approximate CV framework for non-smooth prediction problems and develop
improved assessment guarantees for problems such as l1-regularized ERM.
","[{""version"":""v1"",""created"":""Mon, 2 Mar 2020 00:30:00 GMT""},{""version"":""v2"",""created"":""Thu, 11 Jun 2020 02:03:47 GMT""}]","2020-06-12"
"2003.00618","Shota Ono","Shota Ono","Revisiting the low temperature electron-phonon relaxation of noble
  metals","5 pages, 6 figures","Phys. Rev. B 101, 201404 (2020)","10.1103/PhysRevB.101.201404",,"cond-mat.mtrl-sci cond-mat.mes-hall","http://arxiv.org/licenses/nonexclusive-distrib/1.0/","  The low temperature electron-phonon (e-ph) relaxation near the surface of
noble metals, Cu and Ag, is studied by using the density-functional theory
approach. The appearance of the surface phonon mode can give rise to a strong
enhancement of the Eliashberg function at low frequency $\omega$. Assuming the
Eliashberg function proportional to the square of $\omega$ in the low frequency
limit, the e-ph relaxation time obtained from the surface calculations is
shorter than that from the bulk calculation. The calculated e-ph relaxation
time for the former is in agreement with a recent experiment for thin films.
","[{""version"":""v1"",""created"":""Mon, 2 Mar 2020 00:31:03 GMT""}]","2020-05-20"
"2003.00619","Xingtong Liu","Xingtong Liu, Yiping Zheng, Benjamin Killeen, Masaru Ishii, Gregory D.
  Hager, Russell H. Taylor, Mathias Unberath","Extremely Dense Point Correspondences using a Learned Feature Descriptor","The work has been accepted for publication in CVPR 2020",,,,"cs.CV","http://creativecommons.org/licenses/by-nc-sa/4.0/","  High-quality 3D reconstructions from endoscopy video play an important role
in many clinical applications, including surgical navigation where they enable
direct video-CT registration. While many methods exist for general multi-view
3D reconstruction, these methods often fail to deliver satisfactory performance
on endoscopic video. Part of the reason is that local descriptors that
establish pair-wise point correspondences, and thus drive reconstruction,
struggle when confronted with the texture-scarce surface of anatomy.
Learning-based dense descriptors usually have larger receptive fields enabling
the encoding of global information, which can be used to disambiguate matches.
In this work, we present an effective self-supervised training scheme and novel
loss design for dense descriptor learning. In direct comparison to recent local
and dense descriptors on an in-house sinus endoscopy dataset, we demonstrate
that our proposed dense descriptor can generalize to unseen patients and
scopes, thereby largely improving the performance of Structure from Motion
(SfM) in terms of model density and completeness. We also evaluate our method
on a public dense optical flow dataset and a small-scale SfM public dataset to
further demonstrate the effectiveness and generality of our method. The source
code is available at
https://github.com/lppllppl920/DenseDescriptorLearning-Pytorch.
","[{""version"":""v1"",""created"":""Mon, 2 Mar 2020 00:44:04 GMT""},{""version"":""v2"",""created"":""Fri, 27 Mar 2020 17:52:40 GMT""}]","2020-03-30"
"2003.00620","Sebastian Zamorano Aliaga","R. Lecaros, J. L\'opez-R\'ios, J.H. Ortega, and S. Zamorano","The stability for an inverse problem of bottom recovering in water-waves","version 2",,"10.1088/1361-6420/abafee",,"math.AP","http://arxiv.org/licenses/nonexclusive-distrib/1.0/","  In this article we deal with a class of geometric inverse problem for bottom
detection by one single measurement on the free surface in water--waves. We
found upper and lower bounds for the size of the region enclosed between two
different bottoms, in terms of Neumann and/or Dirichlet data on the free
surface. Starting from the general water--waves system in bounded domains with
side walls, we manage to formulate the problem in terms of the Dirichlet to
Neumann operator and thus, as an elliptic problem in a bounded domain with
Neumann homogeneous condition on the rigid boundary. Then we study the
properties of the Dirichlet to Neumann map and analyze the called method of
size estimation.
","[{""version"":""v1"",""created"":""Mon, 2 Mar 2020 00:57:54 GMT""},{""version"":""v2"",""created"":""Fri, 14 Aug 2020 02:37:03 GMT""}]","2020-12-02"
"2003.00621","Kevin Schultz","Kevin Schultz, Marisel Villafane-Delgado","Graph Signal Processing of Indefinite and Complex Graphs using Directed
  Variation","Submitted to EUSIPCO 2020",,,,"eess.SP","http://arxiv.org/licenses/nonexclusive-distrib/1.0/","  In the field of graph signal processing (GSP), directed graphs present a
particular challenge for the ""standard approaches"" of GSP to due to their
asymmetric nature. The presence of negative- or complex-weight directed edges,
a graphical structure used in fields such as neuroscience, critical
infrastructure, and robot coordination, further complicates the issue. Recent
results generalized the total variation of a graph signal to that of directed
variation as a motivating principle for developing a graphical Fourier
transform (GFT). Here, we extend these techniques to concepts of signal
variation appropriate for indefinite and complex-valued graphs and use them to
define a GFT for these classes of graph. Simulation results on random graphs
are presented, as well as a case study of a portion of the fruit fly
connectome.
","[{""version"":""v1"",""created"":""Mon, 2 Mar 2020 01:02:12 GMT""}]","2020-03-03"
"2003.00622","Zolt\'an F\""uredi","Zolt\'an F\""uredi, Tao Jiang, Alexandr Kostochka, Dhruv Mubayi,
  Jacques Verstra\""ete","Extremal problems for hypergraph blowups of trees","17 pages, 6 figures",,,,"math.CO","http://arxiv.org/licenses/nonexclusive-distrib/1.0/","  In this paper we present a novel approach in extremal set theory which may be
viewed as an asymmetric version of Katona's permutation method. We use it to
find more Tur\'an numbers of hypergraphs in the Erd\H{o}s--Ko--Rado range.
  An $(a,b)$-path $P$ of length $2k-1$ consists of $2k-1$ sets of size $r=a+b$
as follows. Take $k$ pairwise disjoint $a$-element sets $A_0, A_2, \dots,
A_{2k-2}$ and other $k$ pairwise disjoint $b$-element sets $B_1, B_3, \dots,
B_{2k-1}$ and order them linearly as $A_0, B_1, A_2, B_3, A_4\dots$. Define the
(hyper)edges of $P_{2k-1}(a,b)$ as the sets of the form $A_i\cup B_{i+1}$ and
$B_j\cup A_{j+1}$. The members of $P$ can be represented as $r$-element
intervals of the $ak+bk$ element underlying set.
  Our main result is about hypergraphs that are blowups of trees, and implies
that for fixed $k,a,b$, as $n\to \infty$ \[ {\rm ex}_r(n,P_{2k-1}(a,b)) = (k -
1){n \choose r - 1} + o(n^{r - 1}).\]
  This generalizes the Erd\H{o}s--Gallai theorem for graphs which is the case
of $a=b=1$. We also determine the asymptotics when $a+b$ is even; the remaining
cases are still open.
","[{""version"":""v1"",""created"":""Mon, 2 Mar 2020 01:20:39 GMT""}]","2020-03-03"
"2003.00623","Anh Tran","Vu The Khoi, Masakazu Teragaito, Anh T. Tran","Left orderable surgeries of double twist knots II","14 pages, 1 figure",,"10.4153/S0008439520000703",,"math.GT","http://arxiv.org/licenses/nonexclusive-distrib/1.0/","  A slope $r$ is called a left orderable slope of a knot $K \subset S^3$ if the
3-manifold obtained by $r$-surgery along $K$ has left orderable fundamental
group. Consider two-bridge knots $C(2m, \pm 2n)$ and $C(2m+1, -2n)$ in the
Conway notation, where $m \ge 1$ and $n \ge 2$ are integers. By using
\textit{continuous} families of hyperbolic
$\mathrm{SL}_2(\mathbb{R})$-representations of knot groups, it was shown in
\cite{HT-genus1, Tr} that any slope in $(-4n, 4m)$ (resp. $[0, \max\{4m,
4n\})$) is a left orderable slope of $C(2m, 2n)$ (resp. $C(2m, - 2n)$) and in
\cite{Ga} that any slope in $(-4n,0]$ is a left orderable slope of
$C(2m+1,-2n)$. However, the proofs of these results are incomplete since the
\textit{continuity} of the families of representations was not proved. In this
paper, we complete these proofs and moreover we show that any slope in $(-4n,
4m)$ is a left orderable slope of $C(2m+1,-2n)$ detected by hyperbolic
$\mathrm{SL}_2(\mathbb{R})$-representations of the knot group.
","[{""version"":""v1"",""created"":""Mon, 2 Mar 2020 01:36:53 GMT""}]","2020-09-02"
"2003.00624","Chenghao Deng","Chenghao Deng, Jing Yang, Changyong Pan","Timely Synchronization with Sporadic Status Changes",,,,,"cs.IT math.IT","http://arxiv.org/licenses/nonexclusive-distrib/1.0/","  In this paper, we consider a status updating system where the transmitter
sends status updates of the signal it monitors to the destination through a
rate-limited link. We consider the scenario where the status of the monitored
signal only changes at discrete time points. The objective is to let the
destination be synchronized with the source in a timely manner once a status
change happens. What complicates the problem is that the transmission takes
multiple time slots due to the link-rate constraint. Thus, the transmitter has
to decide to switch or to skip a new update when the status of the monitored
signal changes and it has not completed the transmission of the previous one
yet. We adopt a metric called ""Age of Synchronization"" (AoS) to measure the
""dissatisfaction"" of the destination when it is desynchronized with the source.
Then, the objective of this paper is to minimize the time-average AoS by
designing optimal transmission policies for the transmitter. We formulate the
problem as a Markov decision process (MDP) and prove the multi-threshold
structure of the optimal policy. Based on that, we propose a low
computational-complexity algorithm for the MDP value iteration. We then
evaluate the performance of the multi-threshold policy through simulations and
compare it with two baseline policies and the AoI-optimal policy.
","[{""version"":""v1"",""created"":""Mon, 2 Mar 2020 01:48:23 GMT""}]","2020-03-03"
"2003.00625","Sherry H.F.  Yan","Fengming Dong and Sherry H.F. Yan","Proving identities on weight polynomials of tiered trees via Tutte
  polynomials",,,,,"math.CO","http://arxiv.org/licenses/nonexclusive-distrib/1.0/","  A {\it tiered graph} $G=(V,E)$ with $m $ tiers is a simple graph with
$V\subseteq \brk{n}$, where $\brk{n}=\{1,2,\cdots,n\}$, and with a surjective
map $t$ from $V$ to $\brk{m}$ such that if $v$ is a vertex adjacent to $v'$ in
$G$ with $v>v'$, then $t(v) >t(v')$. For any ordered partition
$p=(p_1,p_2,\cdots,p_m)$ of $n$, let $\sett_p$ denote the set of tiered trees
with vertex set $\brk{n}$ and with a map $t: \brk{n}\rightarrow \brk{m}$ such
that $|t^{-1}(i)|=p_i$ for all $i=1,2,\ldots,m$. For any $T\in \sett_p$, let
$K_T$ denote the complete tiered graph whose vertex set and tiering map are the
same as those of $T$. If the edges of $K_T$ are ordered lexicographically by
their endpoints, then the weight $w(T)$ of $T$ is the external activity of $T$
in $K_T$, i.e., the number of edges $e\in E(K_{T})\setminus E(T)$ such that $e$
is the least element in the unique cycle determined by $T\cup e$. Let
$P_p(q)=\sum_{T\in \sett_{p}}q^{w(T)}$. Dugan, Glennon, Gunnells and
Steingr\'imsson [J. Combin. Theory, Ser. A 164 (2019) pp. 24-49] asked for an
elementary proof of the identity $P_p(q)=P_{\pi(p)}(q)$ for any permutation
$\pi$ of $1,2,\cdots,m$, where
$\pi(p)=p_{\pi(1)},p_{\pi(2)},\cdots,p_{\pi(m)})$. In this article, we will
prove an extension of this identity by applying Tutte polynomials. Furthermore,
we also provide a proof of the identity
$P_{(1,p_1,p_2)}(q)=P_{(p_1+1,p_2+1)}(q)$ via Tutte polynomials.
","[{""version"":""v1"",""created"":""Mon, 2 Mar 2020 01:49:05 GMT""},{""version"":""v2"",""created"":""Fri, 19 Nov 2021 01:45:39 GMT""},{""version"":""v3"",""created"":""Tue, 27 Sep 2022 11:46:11 GMT""}]","2022-09-28"
"2003.00626","Nguyen D. Khanh","N. D. Khanh, T. Nakajima, X. Z. Yu, S. Gao, K. Shibata, M.
  Hirschberger, Y. Yamasaki, H. Sagayama, H. Nakao, L. C. Peng, K. Nakajima, R.
  Takagi, T. Arima, Y. Tokura and S. Seki","Nanometric square skyrmion lattice in a centrosymmetric tetragonal
  magnet","Accepted to be published in Nature Nanotechnology","Nature Nanotechnology (Advanced Online Publication) (2020)","10.1038/s41565-020-0684-7",,"cond-mat.mtrl-sci","http://arxiv.org/licenses/nonexclusive-distrib/1.0/","  Magnetic skyrmions are topologically stable spin swirls with particle-like
character and potentially suitable for the design of high-density information
bits. While most known skyrmion systems arise in noncentrosymmetric systems
with Dzyaloshinskii-Moriya interaction, also centrosymmetric magnets with a
triangular lattice can give rise to skyrmion formation, with
geometrically-frustrated lattice being considered essential in this case. Until
today, it remains an open question if skyrmions can also exist in the absence
of both geometrically-frustrated lattice and inversion symmetry breaking. Here,
we discover a square skyrmion lattice state with 1.9 nm diameter skyrmions in
the centrosymmetric tetragonal magnet GdRu2Si2 without geometrically-frustrated
lattice by means of resonant X-ray scattering and Lorentz transmission electron
microscopy experiments. A plausible origin of the observed skyrmion formation
is four-spin interactions mediated by itinerant electrons in the presence of
easy-axis anisotropy. Our results suggest that rare-earth intermetallics with
highly-symmetric crystal lattices may ubiquitously host nanometric skyrmions of
exotic origins.
","[{""version"":""v1"",""created"":""Mon, 2 Mar 2020 01:52:54 GMT""},{""version"":""v2"",""created"":""Tue, 3 Mar 2020 01:51:26 GMT""},{""version"":""v3"",""created"":""Fri, 17 Apr 2020 07:23:02 GMT""}]","2020-05-21"
"2003.00627","Mahak Goindani","Mahak Goindani, Jennifer Neville","Cluster-Based Social Reinforcement Learning",,,,,"cs.LG stat.ML","http://arxiv.org/licenses/nonexclusive-distrib/1.0/","  Social Reinforcement Learning methods, which model agents in large networks,
are useful for fake news mitigation, personalized teaching/healthcare, and
viral marketing, but it is challenging to incorporate inter-agent dependencies
into the models effectively due to network size and sparse interaction data.
Previous social RL approaches either ignore agents dependencies or model them
in a computationally intensive manner. In this work, we incorporate agent
dependencies efficiently in a compact model by clustering users (based on their
payoff and contribution to the goal) and combine this with a method to easily
derive personalized agent-level policies from cluster-level policies. We also
propose a dynamic clustering approach that captures changing user behavior.
Experiments on real-world datasets illustrate that our proposed approach learns
more accurate policy estimates and converges more quickly, compared to several
baselines that do not use agent correlations or only use static clusters.
","[{""version"":""v1"",""created"":""Mon, 2 Mar 2020 01:55:05 GMT""},{""version"":""v2"",""created"":""Mon, 23 Mar 2020 18:46:08 GMT""}]","2020-03-25"
"2003.00628","Cristian Camilo Beltran Hernandez","Cristian Camilo Beltran-Hernandez, Damien Petit, Ixchel G.
  Ramirez-Alpizar, Takayuki Nishi, Shinichi Kikuchi, Takamitsu Matsubara,
  Kensuke Harada","Learning Force Control for Contact-rich Manipulation Tasks with Rigid
  Position-controlled Robots","8 pages, 9 figures, version accepted for IROS RA-L 2020, for
  associated video file, see https://youtu.be/4wdIhQxD6cA",,"10.1109/LRA.2020.3010739",,"cs.LG cs.RO cs.SY eess.SY stat.ML","http://arxiv.org/licenses/nonexclusive-distrib/1.0/","  Reinforcement Learning (RL) methods have been proven successful in solving
manipulation tasks autonomously. However, RL is still not widely adopted on
real robotic systems because working with real hardware entails additional
challenges, especially when using rigid position-controlled manipulators. These
challenges include the need for a robust controller to avoid undesired
behavior, that risk damaging the robot and its environment, and constant
supervision from a human operator. The main contributions of this work are,
first, we proposed a learning-based force control framework combining RL
techniques with traditional force control. Within said control scheme, we
implemented two different conventional approaches to achieve force control with
position-controlled robots; one is a modified parallel position/force control,
and the other is an admittance control. Secondly, we empirically study both
control schemes when used as the action space of the RL agent. Thirdly, we
developed a fail-safe mechanism for safely training an RL agent on manipulation
tasks using a real rigid robot manipulator. The proposed methods are validated
on simulation and a real robot, an UR3 e-series robotic arm.
","[{""version"":""v1"",""created"":""Mon, 2 Mar 2020 01:58:03 GMT""},{""version"":""v2"",""created"":""Mon, 25 May 2020 02:53:33 GMT""},{""version"":""v3"",""created"":""Mon, 20 Jul 2020 02:39:28 GMT""}]","2020-07-21"
"2003.00629","Alexey Koshelev","Alexey S. Koshelev, K. Sravan Kumar, Anupam Mazumdar and Alexei A.
  Starobinsky","Non-Gaussianities and tensor-to-scalar ratio in non-local $R^{2}$-like
  inflation","40 pages, 6 figures; v2 matching the one published in JHEP, further
  discussion on the single field consistency relation is added","JHEP06(2020)152","10.1007/JHEP06(2020)152",,"hep-th astro-ph.CO gr-qc","http://arxiv.org/licenses/nonexclusive-distrib/1.0/","  In this paper we will study $R^2$-like inflation in a non-local modification
of gravity which contains quadratic in Ricci scalar and Weyl tensor terms with
analytic infinite derivative form-factors in the action. It is known that the
inflationary solution of the local $R+R^2$ gravity remains a particular exact
solution in this model. It was shown earlier that the power spectrum of scalar
perturbations generated during inflation in the non-local setup remains the
same as in the local $R+R^2$ inflation, whereas the power spectrum of tensor
perturbations gets modified due to the non-local Weyl tensor squared term. In
the present paper we go beyond 2-point correlators and compute the non-Gaussian
parameter $f_{NL}$ related to 3-point correlations generated during inflation,
which we found to be different from those in the original local inflationary
model and scenarios alike based on a local gravity. We evaluate non-local
corrections to the scalar bi-spectrum which give non-zero contributions to
squeezed, equilateral and orthogonal configurations. We show that $f_{NL}\sim
O(1)$ with an arbitrary sign is achievable in this model based on the choice of
form-factors and the scale of non-locality. We present the predictions for the
tensor-to-scalar ratio, $r$, and the tensor tilt, $n_t$. In contrast to
standard inflation in a local gravity, here the possibility $n_t$>0 is not
excluded. Thus, future CMB data can probe non-local behaviour of gravity at
high space-time curvatures.
","[{""version"":""v1"",""created"":""Mon, 2 Mar 2020 01:59:23 GMT""},{""version"":""v2"",""created"":""Tue, 7 Jul 2020 04:43:48 GMT""}]","2020-07-08"
