"2003.00001","Ricardo P\'erez-Marco","Cyril Grunspan, Ricardo P\'erez-Marco","The mathematics of Bitcoin","7 pages, 4 figures","EMS Newsletter [115 (2020)], [31-37]. \c{opyright} European
  Mathematical Society",,,"math.HO cs.CR","http://arxiv.org/licenses/nonexclusive-distrib/1.0/","  We survey recent results on the mathematical stability of Bitcoin protocol.
Profitability and probability of a double spend are estimated in closed form
with classical special functions. The stability of Bitcoin mining rules is
analyzed and several theorems are proved using martingale and combinatorics
techniques. In particular, the empirical observation of the stability of the
Bitcoin protocol is proved.
  This survey article on the mathematics of Bitcoin is published by the
Newsletter of the European Mathematical Society, vol.115, 2020, p.31-37.
Continuation of arXiv:1601.05254 (EMS Newsletter, 100, 2016 p.32).
","[{""version"":""v1"",""created"":""Mon, 2 Mar 2020 07:57:44 GMT""}]","2020-03-03"
"2003.00009","Carlo Vittorio Cannistraci","Yan Ge, Philipp Rosendahl, Claudio Dur\'an, Nicole T\""opfner, Sara
  Ciucci, Jochen Guck, and Carlo Vittorio Cannistraci","Cell Mechanics Based Computational Classification of Red Blood Cells Via
  Machine Intelligence Applied to Morpho-Rheological Markers","13 pages, 3 figures, 4 tables","IEEE/ACM Trans. Comput. Biol. Bioinform (2019)","10.1109/TCBB.2019.2945762",,"q-bio.QM cs.LG stat.ML","http://creativecommons.org/licenses/by-nc-sa/4.0/","  Despite fluorescent cell-labelling being widely employed in biomedical
studies, some of its drawbacks are inevitable, with unsuitable fluorescent
probes or probes inducing a functional change being the main limitations.
Consequently, the demand for and development of label-free methodologies to
classify cells is strong and its impact on precision medicine is relevant.
Towards this end, high-throughput techniques for cell mechanical phenotyping
have been proposed to get a multidimensional biophysical characterization of
single cells. With this motivation, our goal here is to investigate the extent
to which an unsupervised machine learning methodology, which is applied
exclusively on morpho-rheological markers obtained by real-time deformability
and fluorescence cytometry (RT-FDC), can address the difficult task of
providing label-free discrimination of reticulocytes from mature red blood
cells. We focused on this problem, since the characterization of reticulocytes
(their percentage and cellular features) in the blood is vital in multiple
human disease conditions, especially bone-marrow disorders such as anemia and
leukemia. Our approach reports promising label-free results in the
classification of reticulocytes from mature red blood cells, and it represents
a step forward in the development of high-throughput morpho-rheological-based
methodologies for the computational categorization of single cells. Besides,
our methodology can be an alternative but also a complementary method to
integrate with existing cell-labelling techniques.
","[{""version"":""v1"",""created"":""Mon, 2 Mar 2020 15:11:46 GMT""}]","2020-03-03"
"2003.00511","Taehyun Eom","Taehyun Eom","Computing the density of tautologies in propositional logic by solving
  system of quadratic equations of generating functions","34 pages",,,,"math.LO math.CO","http://arxiv.org/licenses/nonexclusive-distrib/1.0/","  In this paper, we will provide a method to compute the density of tautologies
among the set of well-formed formulae consisting of $m$ variables, a negation
symbol and an implication symbol, which has a possibility to be applied for
other logical systems. This paper contains computational numerical values of
the density of tautologies for two, three, and four variable cases. Also, for
certain quadratic systems, we will introduce the $s$-cut concept to make a
better approximation when we compute the ratio by brute-force counting, and
discover a fundamental relation between generating functions' values on the
singularity point and ratios of coefficients, which can be understood as
another intepretation of the Szeg\H{o} lemma for such quadratic systems. With
this relation, we will provide an asymptotic lower bound
$m^{-1}-(7/4)m^{-3/2}+O(m^{-2})$ of the density of tautologies as $m$ goes to
the infinity.
","[{""version"":""v1"",""created"":""Sun, 1 Mar 2020 16:11:06 GMT""}]","2020-03-03"
"2003.00512","Blake Winter","Blake K Winter","A geometric invariant of virtual n-links","Accepted for publication in Topology and its Applications, 6/19/20",,,,"math.GT math.AT","http://arxiv.org/licenses/nonexclusive-distrib/1.0/","  For a virtual $n$-link $K$, we define a new virtual link $VD(K)$, which is
invariant under virtual equivalence of $K$. The Dehn space of $VD(K)$, which we
denote $DD(K)$, therefore has a homotopy type which is an invariant of $K$. We
show that the quandle and even the fundamental group of this space are able to
detect the virtual trefoil. We also consider applications to higher-dimensional
virtual links.
","[{""version"":""v1"",""created"":""Sun, 1 Mar 2020 16:12:59 GMT""},{""version"":""v2"",""created"":""Fri, 19 Jun 2020 15:30:49 GMT""}]","2020-06-22"
"2003.00513","Andres Castellanos-Gomez","Qinghua Zhao, Riccardo Frisenda, Tao Wang and Andres Castellanos-Gomez","InSe: a two-dimensional semiconductor with superior flexibility","3 figures, 1 table","Nanoscale, 2019,11, 9845-9850","10.1039/C9NR02172H",,"physics.app-ph cond-mat.mtrl-sci","http://arxiv.org/licenses/nonexclusive-distrib/1.0/","  Two-dimensional Indium Selenide (InSe) has attracted extensive attention
recently due to its record-high charge carrier mobility and photoresponsivity
in the fields of electronics and optoelectronics. Nevertheless, the mechanical
properties of this material in the ultra-thin regime have not been investigated
yet. Here, we present our efforts to determine the Young's modulus of thin InSe
(~1-2 layers to ~40 layers) flakes experimentally by using buckling-based
methodology. We find that the Young's modulus has a value of 23.1 +- 5.2 GPa,
one of the lowest values reported up to date for crystalline two-dimensional
materials. This superior flexibility can be very attractive for different
applications, such as strain engineering and flexible electronics.
","[{""version"":""v1"",""created"":""Sun, 1 Mar 2020 16:15:02 GMT""}]","2020-03-03"
"2003.00514","Wentao Zhang","Tangwei Tang, Hongyuan Wang, Shafeng Duan, Yuanyuan Yang, Chaozhi
  Huang, Yanfeng Guo, Dong Qian, Wentao Zhang","Non-Coulomb strong electron-hole binding in $Ta_2NiSe_5$ revealed by
  time- and angle-resolved photoemission spectroscopy","18 pages, 10 figures","Phys. Rev. B 101, 235148 (2020)","10.1103/PhysRevB.101.235148",,"cond-mat.str-el cond-mat.mtrl-sci","http://arxiv.org/licenses/nonexclusive-distrib/1.0/","  We reveal an ultrafast purely electronic phase transition in \TNS, which is a
plausible excitonic insulator, after excited by an ultrafast infrared laser
pulse. Specifically, the order parameter of the strong electron-hole binding
shrinks with enhancing the pump pulse, and above a critical pump fluence, a
photo-excited semimetallic state is experimentally identified with the absence
of ultrafast structural transition. In addition, the bare valence and
conduction bands and also the effective exciton binding energy in \TNS~are
determined. These findings and detailed analysis suggest a bare nonequilibrium
semimetallic phase in $Ta_2NiSe_5$ and the strong electron-hole binding cannot
be exclusively driven by Coulomb interaction.
","[{""version"":""v1"",""created"":""Sun, 1 Mar 2020 16:17:53 GMT""},{""version"":""v2"",""created"":""Tue, 23 Jun 2020 10:28:23 GMT""}]","2020-07-01"
"2003.00515","Wentao Zhang","Yuanyuan Yang, Tianwei Tang, Shaofeng Duan, Chaocheng Zhou, Duxing
  Hao, Wentao Zhang","A time- and angle-resolved photoemission spectroscopy with probe photon
  energy up to 6.7 eV","8 pages, 5 figures","Rev. Sci. Instrum. 90, 063905 (2019)","10.1063/1.5090439",,"cond-mat.str-el cond-mat.supr-con","http://arxiv.org/licenses/nonexclusive-distrib/1.0/","  We present the development of a time- and angle-resolved photoemission
spectroscopy based on a Yb-based femtosecond laser and a hemispherical electron
analyzer. The energy of the pump photon is tunable between 1.4 and 1.9 eV, and
the pulse duration is around 30 fs. We use a KBe$_2$BO$_3$F$_2$ non-linear
optical crystal to generate probe pulses, of which the photon energy is up to
6.7 eV, and obtain an overall time resolution of 1 ps and energy resolution of
18 meV. In addition, $\beta$-BaB$_2$O$_4$ crystals are used to generate
alternative probe pulses at 6.05 eV, giving an overall time resolution of 130
fs and energy resolution of 19 meV. We illustrate the performance of the system
with representative data on several samples (Bi$_2$Se$_3$, YbCd$_2$Sb$_2$,
FeSe).
","[{""version"":""v1"",""created"":""Sun, 1 Mar 2020 16:18:01 GMT""}]","2020-03-03"
"2003.00516","Aniello Quaranta","Antonio Capolupo, Gaetano Lambiase, Aniello Quaranta","Neutrinos in curved spacetimes: particle mixing and flavor oscillations","13 pages, no figures","Phys. Rev. D 101, 095022 (2020)","10.1103/PhysRevD.101.095022",,"hep-th gr-qc","http://creativecommons.org/licenses/by/4.0/","  We present a quantum field theoretical approach to the vacuum neutrino
oscillations in curved space, we analyze the non--trivial interplay between
quantum field mixing and field quantization in curved space and derive new
oscillation formulae. We compute the formulae explicitly in the spatially flat
FLRW metrics for universes dominated by a cosmological constant and by
radiation. We evaluate the transition probabilities in the Schwarzschild black
hole metric, and we show that the Hawking radiation affects the oscillations of
neutrinos. We show that our results are consistent with those of previous
analyses when the quantum mechanical limit is considered.
","[{""version"":""v1"",""created"":""Sun, 1 Mar 2020 16:19:49 GMT""}]","2021-01-19"
"2003.00517","Yifan Chen","Yifan Chen, Han Wang, Xiaolu Sun, Bin Fan, Chu Tang","Deep Attention Aware Feature Learning for Person Re-Identification",,,"10.1016/j.patcog.2022.108567",,"cs.CV cs.LG","http://arxiv.org/licenses/nonexclusive-distrib/1.0/","  Visual attention has proven to be effective in improving the performance of
person re-identification. Most existing methods apply visual attention
heuristically by learning an additional attention map to re-weight the feature
maps for person re-identification. However, this kind of methods inevitably
increase the model complexity and inference time. In this paper, we propose to
incorporate the attention learning as additional objectives in a person ReID
network without changing the original structure, thus maintain the same
inference time and model size. Two kinds of attentions have been considered to
make the learned feature maps being aware of the person and related body parts
respectively. Globally, a holistic attention branch (HAB) makes the feature
maps obtained by backbone focus on persons so as to alleviate the influence of
background. Locally, a partial attention branch (PAB) makes the extracted
features be decoupled into several groups and be separately responsible for
different body parts (i.e., keypoints), thus increasing the robustness to pose
variation and partial occlusion. These two kinds of attentions are universal
and can be incorporated into existing ReID networks. We have tested its
performance on two typical networks (TriNet and Bag of Tricks) and observed
significant performance improvement on five widely used datasets.
","[{""version"":""v1"",""created"":""Sun, 1 Mar 2020 16:27:14 GMT""}]","2022-08-10"
"2003.00518","Sariel Har-Peled","Dan Halperin, Sariel Har-Peled, Kurt Mehlhorn, Eunjin Oh, Micha Sharir","The Maximum-Level Vertex in an Arrangement of Lines",,,,,"cs.CG","http://arxiv.org/licenses/nonexclusive-distrib/1.0/","  Let $L$ be a set of $n$ lines in the plane, not necessarily in general
position. We present an efficient algorithm for finding all the vertices of the
arrangement $A(L)$ of maximum level, where the level of a vertex $v$ is the
number of lines of $L$ that pass strictly below $v$. The problem, posed in
Exercise~8.13 in de Berg etal [BCKO08], appears to be much harder than it
seems, as this vertex might not be on the upper envelope of the lines.
  We first assume that all the lines of $L$ are distinct, and distinguish
between two cases, depending on whether or not the upper envelope of $L$
contains a bounded edge. In the former case, we show that the number of lines
of $L$ that pass above any maximum level vertex $v_0$ is only $O(\log n)$. In
the latter case, we establish a similar property that holds after we remove
some of the lines that are incident to the single vertex of the upper envelope.
We present algorithms that run, in both cases, in optimal $O(n\log n)$ time.
  We then consider the case where the lines of $L$ are not necessarily
distinct. This setup is more challenging, and the best we have is an algorithm
that computes all the maximum-level vertices in time $O(n^{4/3}\log^{3}n)$.
  Finally, we consider a related combinatorial question for degenerate
arrangements, where many lines may intersect in a single point, but all the
lines are distinct: We bound the complexity of the weighted $k$-level in such
an arrangement, where the weight of a vertex is the number of lines that pass
through the vertex. We show that the bound in this case is $O(n^{4/3})$, which
matches the corresponding bound for non-degenerate arrangements, and we use
this bound in the analysis of one of our algorithms.
","[{""version"":""v1"",""created"":""Sun, 1 Mar 2020 16:33:49 GMT""}]","2020-03-03"
"2003.00519","Duco van Straten","Duco van Straten","The Spectrum of Hypersurface Singularities","46 pages, 20 pictures, mainly expository",,,,"math.AG","http://arxiv.org/licenses/nonexclusive-distrib/1.0/","  This text is the write-up of a series of lectures on the asymptotic mixed
Hodge theory of isolated hypersurface singularities, held at the Third Latin
American school on Algebraic Geometry and its applications (ELGA 3) in
Guanajuato, Mexico, in august 2017. Its focus is on the classical application
of the semi-continuity of the spectrum due to Varchenko and Steenbrink to the
problem of bounding the possible singularities on a projective hypersurface.
","[{""version"":""v1"",""created"":""Sun, 1 Mar 2020 16:47:40 GMT""}]","2020-03-03"
"2003.00520","Credo Vovor Dassu","G.R. Ducharme, S. Kaci, C. Vovor-Dassu","Smooths Tests of Goodness-of-fit for the Newcomb-Benford distribution","in French",,,,"math.ST stat.TH","http://arxiv.org/licenses/nonexclusive-distrib/1.0/","  The Newcomb-Benford probability distribution is becoming very popular in many
areas using statistics, notably in fraud detection. In such contexts, it is
important to be able to determine if a data set arises from this distribution
while controlling the risk of a Type 1 error, i.e. falsely identifying a fraud,
and a Type 2 error, i.e. not detecting that a fraud occurred. The statistical
tool to do this work is a goodness-of-fit test. For the Newcomb-Benford
distribution, the most popular such test is Pearson's chi-square test whose
power, related to the Type 2 error, is known to be weak. Consequently, other
tests have been recently introduced. The goal of the present work is to build
new goodness-of-fit tests for this distribution, based on the smooth test
principle. These tests are then compared to some of their competitors. It turns
out that the proposals of the paper are globally preferable to existing tests
and should be seriously considered in fraud detection contexts, among others.
","[{""version"":""v1"",""created"":""Sun, 1 Mar 2020 16:51:34 GMT""}]","2020-03-03"
"2003.00521","Michele Correggi","Michele Correggi","Surface Effects in Superconductors with Corners","Proceeding for XXI Congresso UMI 2019, final version, Boll. Unione
  Mat. Ital. to appear, 17 pages, pdfLaTeX","Bull. Unione Mat. Ital. 14 (2021), 51-67","10.1007/s40574-020-00236-7",,"math-ph math.MP","http://arxiv.org/licenses/nonexclusive-distrib/1.0/","  We review some recent results on the phenomenon of surface superconductivity
in the framework of Ginzburg-Landau theory for extreme type-II materials. In
particular, we focus on the response of the superconductor to a strong
longitudinal magnetic field in the regime where superconductivity survives only
along the boundary of the wire. We derive the energy and density asymptotics
for samples with smooth cross section, up to curvature-dependent terms.
Furthermore, we discuss the corrections in presence of corners at the boundary
of the sample.
","[{""version"":""v1"",""created"":""Sun, 1 Mar 2020 16:53:54 GMT""},{""version"":""v2"",""created"":""Thu, 7 May 2020 15:04:32 GMT""}]","2021-06-30"
"2003.00522","Aniket Singha","Aniket Singha","Density matrix to quantum master equation (QME) model for arrays of
  Coulomb coupled quantum dots in the sequential tunneling regime","10 Pages, 3 Figures",,,,"physics.app-ph cond-mat.mes-hall","http://arxiv.org/licenses/nonexclusive-distrib/1.0/","  Coulomb coupled quantum dot arrays with staircase ground state configuration
have been proposed in literature for enhancing heat-harvesting and
refrigeration performance. However, due to their mutual Coulomb interaction, a
performance analysis of such systems remains complicated and necessitates
consideration of microscopic physics using density matrix formulation. However
the path of device analysis starting from the system Hamiltonian to density
matrix formulation is complicated and lacks the simplicity and intuitive aspect
of sequential electron transport conveyed by the quantum master equation (QME)
approach. In this paper, starting from the system Hamiltonian and employing the
density matrix formulation, I derive the QME of a system of three quantum dots,
two of which are electro-statically coupled. The framework formulated in this
paper can be further extended to derive QME of systems with higher number of
Coulomb coupled quantum dots.
","[{""version"":""v1"",""created"":""Sun, 1 Mar 2020 16:55:50 GMT""},{""version"":""v2"",""created"":""Thu, 5 Mar 2020 03:10:51 GMT""},{""version"":""v3"",""created"":""Mon, 30 Mar 2020 19:52:23 GMT""},{""version"":""v4"",""created"":""Tue, 4 Aug 2020 17:05:08 GMT""}]","2020-08-05"
"2003.00523","Wei Zheng","Wei Zheng","Spectral Signatures of Quasar Ages at z~3","22 pages, 10 figures, 3 tables","The Astrophysical Journal, 892, 139 (2020)","10.3847/1538-4357/ab7b6f",,"astro-ph.GA astro-ph.CO","http://arxiv.org/licenses/nonexclusive-distrib/1.0/","  Insight into quasar ages may be obtained from the proximity effect, but so
far only in a limited number of bright quasars. Based on ~2600 SDSS quasar
spectra at 2.5 <= z <= 3.5, a search for spectral voids between Ly-alpha forest
lines finds proximity zones over a wide range of radial distances. The majority
of zone sizes are less than 5 Mpc, with their numbers decreasing exponentialy
towards larger distances. After normalization by luminosities, the zone sizes
are distributed an e-folding scale of 0.64 as compared with the anticipated
values. A group of quasars are selected for their large proximity zones of >~
10 Mpc. Their composite spectrum displays strong narrow cores and large
equivalent widths in Ly-alpha and other major UV emission lines. If the
proximity zones along lines of sight are indicative of quasar ages, these
features may be the signatures of old quasars. Another group of quasars are
selected as they show no proximity zone and exhibit intrinsic absorption lines
at z_{ab} > z_{em}. They are likely young quasars and exhibit weaker narrow
emission-line components. The significant difference of spectral features
between the two groups may reflect an evolution pattern over quasars'
lifetimes.
","[{""version"":""v1"",""created"":""Sun, 1 Mar 2020 16:56:40 GMT""},{""version"":""v2"",""created"":""Tue, 7 Apr 2020 17:39:23 GMT""}]","2020-04-08"
"2003.00524","Guillermo Esteban","Guillermo Esteban, Clemens Huemer, Rodrigo I. Silveira","New production matrices for geometric graphs",,,,,"math.CO cs.CG","http://arxiv.org/licenses/nonexclusive-distrib/1.0/","  We use production matrices to count several classes of geometric graphs. We
present novel production matrices for non-crossing partitions, connected
geometric graphs, and k-angulations, which provide another way of counting the
number of such objects. Counting geometric graphs is then equivalent to
calculating the powers of a production matrix. Applying the technique of
Riordan Arrays to these production matrices, we establish new formulas for the
numbers of geometric graphs as well as combinatorial identities derived from
the production matrices. Further, we obtain the characteristic polynomial and
the eigenvectors of such production matrices.
","[{""version"":""v1"",""created"":""Sun, 1 Mar 2020 17:03:36 GMT""}]","2020-03-04"
"2003.00525","Nathen Nguyen","Nathen H. Nguyen, Paulina Lira, Benny Trakhtenbrot, Hagai Netzer,
  Claudia Cicone, Roberto Maiolino, Ohad Shemmer","ALMA Observations of Quasar Host Galaxies at $z\simeq4.8$","26 pages, 10 figures, 6 tables. Submitted after Referee acceptance",,"10.3847/1538-4357/ab8bd3",,"astro-ph.GA","http://arxiv.org/licenses/nonexclusive-distrib/1.0/","  We present ALMA band-7 data of the [CII] $\lambda157.74\,\mu{\rm m}$ emission
line and underlying far-infrared (FIR) continuum for twelve luminous quasars at
$z \simeq 4.8$, powered by fast-growing supermassive black holes (SMBHs). Our
total sample consists of eighteen quasars, twelve of which are presented here
for the first time. The new sources consists of six Herschel/SPIRE detected
systems, which we define as ""FIR-bright"" sources, and six Herschel/SPIRE
undetected systems, which we define as ""FIR-faint"" sources. We determine dust
masses for the quasars hosts of $M_{dust} \le 0.2-25.0\times 10^8 M_{\odot}$,
implying ISM gas masses comparable to the dynamical masses derived from the
[CII] kinematics. It is found that on average the MgII line is blueshifted by
$\sim 500\,{\rm km\,s}^{-1}$ with respect to the [CII] emission line, which is
also observed when complementing our observations with data from the
literature. We find that all of our ""FIR-bright"" subsample and most of the
""FIR-faint"" objects lie above the main sequence of star forming galaxies at $z
\sim 5$. We detect companion sub-millimeter galaxies (SMGs) for two sources,
both FIR-faint, with a range of projected distances of $\sim20-60$ kpc and with
typical velocity shifts of $\left|\Delta v\right| \lesssim200\,{\rm
km\,s}^{-1}$ from the quasar hosts. Of our total sample of eighteen quasars,
5/18 are found to have dust obscured starforming companions.
","[{""version"":""v1"",""created"":""Sun, 1 Mar 2020 17:04:50 GMT""},{""version"":""v2"",""created"":""Fri, 1 May 2020 06:56:59 GMT""}]","2020-06-03"
"2003.00526","Mohammad Taghi Dabiri","Mohammad Taghi Dabiri, Mohsen Rezaee, Behrouz Maham, Walid Saad, and
  Choong Seon Hong","3D Channel Characterization and Performance Analysis of UAV-Assisted
  Millimeter Wave Links",,,,,"eess.SP","http://arxiv.org/licenses/nonexclusive-distrib/1.0/","  Recently, the use of millimeter wave (mmW) frequencies has emerged as a
promising solution for wirelessly connecting unmanned aerial vehicles (UAVs) to
ground users. However, employing UAVassisted directional mmW links is
challenging due to the random fluctuations of hovering UAVs. In this paper, the
performance of UAV-based mmW links is investigated when UAVs are equipped with
square array antennas. The 3GPP antenna propagation patterns are used to model
the square array antenna. It is shown that the square array antenna is
sensitive to both horizontal and vertical angular vibrations of UAVs. In order
to explore the relationship between the vibrations of UAVs and their antenna
pattern, the UAV-based mmW channels are characterized by considering the large
scale path loss, small scale fading along with antenna patterns as well as the
random effect of UAVs' angular vibrations. To enable effective performance
analysis, tractable and closed-form statistical channel models are derived for
aerial-to-aerial (A2A), ground-to-aerial (G2A), and aerial-to-ground (A2G)
channels. The accuracy of analytical models is verified by employing Monte
Carlo simulations. Analytical results are then used to study the effect of
antenna pattern gain under different conditions for the UAVs' angular
vibrations for establishing reliable UAV-assisted mmW links in terms of
achieving minimum outage probability.
","[{""version"":""v1"",""created"":""Sun, 1 Mar 2020 17:05:23 GMT""}]","2020-03-03"
