"2003.13014","Li You","Li You, Jiayuan Xiong, Yufei Huang, Derrick Wing Kwan Ng, Cunhua Pan,
  Wenjin Wang, Xiqi Gao","Reconfigurable Intelligent Surfaces-Assisted Multiuser MIMO Uplink
  Transmission with Partial CSI","One of the major design concerns related to RISs or IRSs is how
  quickly their phases can be tuned in practice. Most of the existing works
  assume perfect CSI. This is the first work that exploits statistical CSI for
  resource allocation in RIS-assisted multiuser MIMO uplink networks involving
  several multi-antenna users","IEEE Transactions on Wireless Communications, vol. 20, no. 9, pp.
  5613-5627, Sep. 2021","10.1109/TWC.2021.3068754",,"cs.IT eess.SP math.IT","http://arxiv.org/licenses/nonexclusive-distrib/1.0/","  This paper considers the application of reconfigurable intelligent surfaces
(RISs) (a.k.a. intelligent reflecting surfaces (IRSs)) to assist multiuser
multiple-input multiple-output (MIMO) uplink transmission from several
multi-antenna user terminals (UTs) to a multi-antenna base station (BS). For
reducing the signaling overhead, only partial channel state information (CSI),
including the instantaneous CSI between the RIS and the BS as well as the
slowly varying statistical CSI between the UTs and the RIS, is exploited in our
investigation. In particular, an optimization framework is proposed for jointly
designing the transmit covariance matrices of the UTs and the RIS phase shift
matrix to maximize the system global energy efficiency (GEE) with partial CSI.
We first obtain closed-form solutions for the eigenvectors of the optimal
transmit covariance matrices of the UTs. Then, to facilitate the design of the
transmit power allocation matrices and the RIS phase shifts, we derive an
asymptotically deterministic equivalent of the objective function with the aid
of random matrix theory. We further propose a suboptimal algorithm to tackle
the GEE maximization problem with guaranteed convergence, capitalizing on the
approaches of alternating optimization, fractional programming, and sequential
optimization. Numerical results substantiate the effectiveness of the proposed
approach as well as the considerable GEE gains provided by the RIS-assisted
transmission scheme over the traditional baselines.
","[{""version"":""v1"",""created"":""Sun, 29 Mar 2020 12:47:42 GMT""}]","2021-09-14"
"2003.13015","Pramod Kumar Mishra Dr.","Pramod Kumar Mishra","Statistics of Quenched Defects Containing Semi-Flexible Polymer Chain:
  Exact Results (II)","05 Pages and 01 Figure","International Journal of Scientific Research in Physics and
  Applied Sciences, 7(6) 21-26 (2019)","10.26438/ijsrpas/v7i6.1923",,"cond-mat.soft","http://arxiv.org/licenses/nonexclusive-distrib/1.0/","  We describe method to discuss thermodynamics of a defected semi-flexible
homo-polymer chain in the two and three dimensions using fully directed
self-avoiding walk lattice model. The defects are located along a line and
these defects are not in the thermal equilibrium with the monomers of the
semi-flexible polymer chain; i. e. we consider the case of defected
semi-flexible polymer chain in the present manuscript for the case of quenched
defects. There are m defects on the conformations of the N monomers long
semi-flexible polymer chain and we exactly count the number of Q realizations
of the defected conformations of N-monomers long self-avoiding semi-flexible
polymer chain; and thus we derive the exact expression of the free energy of
the defected semi-flexible polymer chain for the finite length (i. e. using the
fixed particle ensemble method); and we also derive exact expression of the
partition function for the defected self-avoiding semi-flexible polymer chain
in the thermodynamic limit using the grand canonical ensemble theory. The
method described in this manuscript may be easily extended to another case of
the defected polymer chain for isotropic/directed walk lattice models.
","[{""version"":""v1"",""created"":""Sun, 29 Mar 2020 13:15:04 GMT""}]","2020-11-23"
"2003.13016","Georg Rehm","Elena Leitner and Georg Rehm and Juli\'an Moreno-Schneider","A Dataset of German Legal Documents for Named Entity Recognition","Proceedings of the 12th Language Resources and Evaluation Conference
  (LREC 2020). To appear",,,,"cs.CL cs.IR","http://arxiv.org/licenses/nonexclusive-distrib/1.0/","  We describe a dataset developed for Named Entity Recognition in German
federal court decisions. It consists of approx. 67,000 sentences with over 2
million tokens. The resource contains 54,000 manually annotated entities,
mapped to 19 fine-grained semantic classes: person, judge, lawyer, country,
city, street, landscape, organization, company, institution, court, brand, law,
ordinance, European legal norm, regulation, contract, court decision, and legal
literature. The legal documents were, furthermore, automatically annotated with
more than 35,000 TimeML-based time expressions. The dataset, which is available
under a CC-BY 4.0 license in the CoNNL-2002 format, was developed for training
an NER service for German legal documents in the EU project Lynx.
","[{""version"":""v1"",""created"":""Sun, 29 Mar 2020 13:20:43 GMT""}]","2020-03-31"
"2003.13017","Zehao Yu","Zehao Yu, Shenghua Gao","Fast-MVSNet: Sparse-to-Dense Multi-View Stereo With Learned Propagation
  and Gauss-Newton Refinement","Accepted by CVPR2020",,,,"cs.CV","http://arxiv.org/licenses/nonexclusive-distrib/1.0/","  Almost all previous deep learning-based multi-view stereo (MVS) approaches
focus on improving reconstruction quality. Besides quality, efficiency is also
a desirable feature for MVS in real scenarios. Towards this end, this paper
presents a Fast-MVSNet, a novel sparse-to-dense coarse-to-fine framework, for
fast and accurate depth estimation in MVS. Specifically, in our Fast-MVSNet, we
first construct a sparse cost volume for learning a sparse and high-resolution
depth map. Then we leverage a small-scale convolutional neural network to
encode the depth dependencies for pixels within a local region to densify the
sparse high-resolution depth map. At last, a simple but efficient Gauss-Newton
layer is proposed to further optimize the depth map. On one hand, the
high-resolution depth map, the data-adaptive propagation method and the
Gauss-Newton layer jointly guarantee the effectiveness of our method. On the
other hand, all modules in our Fast-MVSNet are lightweight and thus guarantee
the efficiency of our approach. Besides, our approach is also memory-friendly
because of the sparse depth representation. Extensive experimental results show
that our method is 5$\times$ and 14$\times$ faster than Point-MVSNet and
R-MVSNet, respectively, while achieving comparable or even better results on
the challenging Tanks and Temples dataset as well as the DTU dataset. Code is
available at https://github.com/svip-lab/FastMVSNet.
","[{""version"":""v1"",""created"":""Sun, 29 Mar 2020 13:31:00 GMT""}]","2020-03-31"
"2003.13018","Antonio Bueno","Antonio Bueno","Delaunay surfaces of prescribed mean curvature in $\mathrm{Nil}_3$ and
  $\widetilde{SL_2}(\mathbb{R})$","22 pages, 4 figures",,,,"math.DG","http://arxiv.org/licenses/nonexclusive-distrib/1.0/","  We obtain a classification result for rotational surfaces in the Heisenberg
space and the universal cover of the special linear group, whose mean curvature
is given as a prescribed $C^1$ function depending on their angle function. We
show that these surfaces behave like the Delaunay surfaces of constant mean
curvature, under some assumptions on the prescribed function. In contrast with
the constant mean curvature case, we exhibit the existence of rotational,
embedded tori, providing counterexamples of the Alexandrov problem for this
class of immersed surfaces.
","[{""version"":""v1"",""created"":""Sun, 29 Mar 2020 13:39:02 GMT""},{""version"":""v2"",""created"":""Fri, 9 Jul 2021 17:02:16 GMT""}]","2021-07-12"
"2003.13019","Zhengchun Zhou","Haode Yan and Sihem Mesnager and Zhengchun Zhou","Power Functions over Finite Fields with Low $c$-Differential Uniformity",,,,,"cs.IT math.IT","http://arxiv.org/licenses/nonexclusive-distrib/1.0/","  Very recently, a new concept called multiplicative differential (and the
corresponding $c$-differential uniformity) was introduced by Ellingsen
\textit{et al} in [C-differentials, multiplicative uniformity and (almost)
perfect c-nonlinearity, IEEE Trans. Inform. Theory, 2020] which is motivated
from practical differential cryptanalysis. Unlike classical perfect nonlinear
functions, there are perfect $c$-nonlinear functions even for characteristic
two. The objective of this paper is to study power function $F(x)=x^d$ over
finite fields with low $c$-differential uniformity. Some power functions are
shown to be perfect $c$-nonlinear or almost perfect $c$-nonlinear. Notably, we
completely determine the $c$-differential uniformity of almost perfect
nonlinear functions with the well-known Gold exponent. We also give an
affirmative solution to a recent conjecture proposed by Bartoli and Timpanella
in 2019 related to an exceptional quasi-planar power function.
","[{""version"":""v1"",""created"":""Sun, 29 Mar 2020 13:43:28 GMT""},{""version"":""v2"",""created"":""Mon, 13 Apr 2020 09:31:09 GMT""},{""version"":""v3"",""created"":""Fri, 24 Apr 2020 01:58:31 GMT""}]","2020-04-27"
"2003.13020","Changqing Guo","Changqing Guo, Guohua Dong, Ziyao Zhou, Ming Liu, Houbing Huang,
  Jiawang Hong, Xueyun Wang","Domain evolution in bended freestanding BaTiO3 ultrathin films: a
  phase-field simulation",,"Appl. Phys. Lett. 116, 152903 (2020)","10.1063/5.0002248",,"cond-mat.mtrl-sci","http://arxiv.org/licenses/nonexclusive-distrib/1.0/","  Perovskite ferroelectric oxides are usually considered to be brittle
materials, however, recent work [Dong et al., Science 366, 475 (2019)]
demonstrated the super-elasticity in the freestanding BaTiO3 thin films. This
property may originate from the ferroelectric domain evolution during the
bending, which is difficult to observe in experiments. Therefore, understanding
the relation among the bending deformation, thickness of the films, and the
domain dynamics is critical for their potential applications in flexible
ferroelectric devices. Here, we reported the dynamics of ferroelectric
polarization in the freestanding BaTiO3 ultrathin films in the presence of
large bending deformation up to 40{\deg} using phase-field simulation. The
ferroelectric domain evolution reveals the transition from the flux-closure to
a/c domains with ""vortex-like"" structures, which caused by the increase of
out-of-plane ferroelectric polarization. Additionally, by varying the film
thickness in the identical bending situation, we found the a/c phase with
""vortex-like"" structure emerges only as the film thickness reached 12 nm or
higher. Results from our investigations provide instructive information for the
microstructure evolution of bending ferroelectric perovskite oxide films, which
could serve as guide for the future application of ferroelectric films on
flexible electronic devices.
","[{""version"":""v1"",""created"":""Sun, 29 Mar 2020 13:46:14 GMT""}]","2020-04-15"
"2003.13021","Witold Dzwinel Prof. dr","Ludwik Bukowski, Witold Dzwinel","SuperNet -- An efficient method of neural networks ensembling","This is MSc thesis of Ludwik Bukowski, defended at AGH University of
  Science and Technology, WIET, Department of Computer Science, September 2019
  consists of 42 pages",,,,"cs.LG stat.ML","http://arxiv.org/licenses/nonexclusive-distrib/1.0/","  The main flaw of neural network ensembling is that it is exceptionally
demanding computationally, especially, if the individual sub-models are large
neural networks, which must be trained separately. Having in mind that modern
DNNs can be very accurate, they are already the huge ensembles of simple
classifiers, and that one can construct more thrifty compressed neural net of a
similar performance for any ensemble, the idea of designing the expensive
SuperNets can be questionable. The widespread belief that ensembling increases
the prediction time, makes it not attractive and can be the reason that the
main stream of ML research is directed towards developing better loss functions
and learning strategies for more advanced and efficient neural networks. On the
other hand, all these factors make the architectures more complex what may lead
to overfitting and high computational complexity, that is, to the same flaws
for which the highly parametrized SuperNets ensembles are blamed. The goal of
the master thesis is to speed up the execution time required for ensemble
generation. Instead of training K inaccurate sub-models, each of them can
represent various phases of training (representing various local minima of the
loss function) of a single DNN [Huang et al., 2017; Gripov et al., 2018]. Thus,
the computational performance of the SuperNet can be comparable to the maximum
CPU time spent on training its single sub-model, plus usually much shorter CPU
time required for training the SuperNet coupling factors.
","[{""version"":""v1"",""created"":""Sun, 29 Mar 2020 13:47:13 GMT""}]","2020-03-31"
"2003.13022","Zhenguo Liang","Z. Liang and Z. Wang","Reducibility of 1-d Schr\""odinger equation with unbounded oscillation
  perturbations","48 pages, 6 figures",,,,"math-ph math.MP","http://arxiv.org/licenses/nonexclusive-distrib/1.0/","  We build a new estimate for the normalized eigenfunctions of the operator
$-\partial_{xx}+\mathcal V(x)$ based on the oscillatory integrals and Langer's
turning point method, where $\mathcal V(x)\sim |x|^{2\ell}$ at infinity with
$\ell>1$. From it and an improved reducibility theorem we show that the
equation \[\textstyle
  {\rm i}\partial_t \psi =-\partial_x^2 \psi+\mathcal V(x) \psi+\epsilon
\langle x\rangle^{\mu} W(\nu x,\omega t)\psi,\quad \psi=\psi(t,x),~x\in\mathbb
R, ~\mu<\min\left\{\ell-\frac23,\frac{\sqrt{4\ell^2-2\ell+1}-1}2\right\},\] can
be reduced in $L^2(\mathbb R)$ to an autonomous system for most values of the
frequency vector $\omega$ and $\nu$, where $W(\varphi, \phi)$ is a smooth map
from $ \mathbb T^d\times \mathbb T^n$ to $\mathbb R$ and odd in $\varphi$.
","[{""version"":""v1"",""created"":""Sun, 29 Mar 2020 13:49:09 GMT""},{""version"":""v2"",""created"":""Wed, 20 May 2020 14:40:27 GMT""},{""version"":""v3"",""created"":""Wed, 17 Jun 2020 10:09:08 GMT""}]","2020-06-18"
"2003.13023","Sebastian Posur","Sebastian Posur","A constructive approach to Fourier-Mukai transforms for projective
  spaces via $A_{\infty}$-functors between pretriangulated dg categories",,,,,"math.AG math.CT","http://arxiv.org/licenses/nonexclusive-distrib/1.0/","  We discuss the following problem: how can an arbitrary Fourier-Mukai
transform $\phi: \mathrm{D}^{\mathrm{b}}( \mathbb{P}^a ) \rightarrow
\mathrm{D}^{\mathrm{b}}( \mathbb{P}^b )$ between the bounded derived categories
of two projective spaces of dimensions $a$ and $b$ be expressed in explicit
terms as an exact functor between the homotopy categories
$\mathrm{K}^{\mathrm{b}}( \mathbb{B}^a ) \rightarrow \mathrm{K}^{\mathrm{b}}(
\mathbb{B}^b )$ generated by the full strong exceptional sequences of the line
bundles $\mathbb{B}^a = \{\mathcal{O}(-a), \dots, \mathcal{O}\}$ and
$\mathbb{B}^b = \{\mathcal{O}(-b), \dots, \mathcal{O}\}$? We show that this
problem can be reduced to the following task which is independent of any
prescribed Fourier-Mukai kernel: finding an $A_{\infty}$-functor $P$ in
explicit terms whose induced functor on homotopy categories yields the
embedding of $\{ \mathcal{O}(i) \boxtimes \mathcal{O}(j) \mid i = -2a, \dots,
0, ~~j = -2b, \dots 0 \}$ into $\mathrm{D}^{\mathrm{b}}( \mathbb{P}^{a} \times
\mathbb{P}^{b})$.
  As our main technical tool we provide an explicit formula for the lift of an
$A_{\infty}$-functor $F: \mathbf{A} \rightarrow \mathbf{B}$ between a dg
category $\mathbf{A}$ and a pretriangulated dg category $\mathbf{B}$ to the
pretriangulated hull of $\mathbf{A}$ given by the universal property of
pretriangulated hulls. As a further application of this tool, we provide a
simple example of two non-isomorphic exact functors between triangulated
categories that coincide on the full subcategory generated by a full strong
exceptional sequence.
","[{""version"":""v1"",""created"":""Sun, 29 Mar 2020 13:53:28 GMT""}]","2020-03-31"
"2003.13024","Alexander Sakhnovich","Alexander Sakhnovich","Einstein, $\sigma$-model and Ernst-type equations and non-isospectral
  GBDT version of Darboux transformation","Section 4 of this paper is an important development of our work
  arXiv:math-ph/0703072. Some references and discussions are added in Section 4
  of the second version",,,,"math.AP gr-qc math-ph math.MP math.SP","http://arxiv.org/licenses/nonexclusive-distrib/1.0/","  We present a non-isospectral GBDT version of B\""acklund-Darboux
transformation for the gravitational and $\sigma$-model equations. New families
of explicit solutions correspond to the case of GBDT with non-diagonal
generalized matrix eigenvalues. An interesting integrable Ernst-type system,
the auxiliary linear systems of which are non-isospectral canonical systems, is
studied as well.
","[{""version"":""v1"",""created"":""Sun, 29 Mar 2020 13:56:34 GMT""},{""version"":""v2"",""created"":""Wed, 25 Nov 2020 11:03:01 GMT""}]","2020-11-26"
"2003.13025","Martin Lorenz","Martin Lorenz","Hopf algebra actions and rational ideals",,,,,"math.RA","http://arxiv.org/licenses/nonexclusive-distrib/1.0/","  This note discusses a framework for the investigation of the prime spectrum
of an associative algebra A that is equipped with an action of a Hopf algebra
H. In particular, we study a notion of H-rationality for ideals of A and
comment on a possible Dixmier-Moeglin equivalence for H-prime ideals of A.
","[{""version"":""v1"",""created"":""Sun, 29 Mar 2020 13:59:12 GMT""}]","2020-03-31"
"2003.13026","Pramod Kumar Mishra Dr.","Pramod Kumar Mishra","The Role of annealed defects on conformational statistics of a
  selfavoiding semi-flexible polymer chain: Exact Results (I)","08 Pages, 01 Table and 01 Figure","International Journal of Current Advanced Research 9 (2),
  21288-21291 (2020)","10.24327/ijcar.2020.21291.4179","2003.13026","cond-mat.soft","http://arxiv.org/licenses/nonexclusive-distrib/1.0/","  We study equilibrium statistics of single semi-flexible polymer chain in the
presence of defects. The defects are lying along a line in the two and three
dimensions and the monomers are interacting with the onsite potential of the
defects. A fully directed self-avoiding walk model is used in two and three
dimensions to describe thermo-dynamical behaviour of the chain in the presence
of m defects. We have found that the number of conformations of the
semiflexible polymer chain may be controlled by means of introduction of such
defects so that a particular fraction of the chain conformations may be either
suppressed or populated as per our requirements for synthesizing the
polymer-nanoaggregates. We discuss the role of annealed defects for its Q
realizations and m defects analytically, i. e. when the defects are in the
thermal equilibrium with the monomers of the semi-flexible chain.
","[{""version"":""v1"",""created"":""Sun, 29 Mar 2020 13:59:30 GMT""}]","2020-09-21"
"2003.13027","Georg Rehm","Dmitrii Aksenov and Juli\'an Moreno-Schneider and Peter Bourgonje and
  Robert Schwarzenberg and Leonhard Hennig and Georg Rehm","Abstractive Text Summarization based on Language Model Conditioning and
  Locality Modeling","Proceedings of the 12th Language Resources and Evaluation Conference
  (LREC 2020). To appear",,,,"cs.CL cs.LG","http://arxiv.org/licenses/nonexclusive-distrib/1.0/","  We explore to what extent knowledge about the pre-trained language model that
is used is beneficial for the task of abstractive summarization. To this end,
we experiment with conditioning the encoder and decoder of a Transformer-based
neural model on the BERT language model. In addition, we propose a new method
of BERT-windowing, which allows chunk-wise processing of texts longer than the
BERT window size. We also explore how locality modelling, i.e., the explicit
restriction of calculations to the local context, can affect the summarization
ability of the Transformer. This is done by introducing 2-dimensional
convolutional self-attention into the first layers of the encoder. The results
of our models are compared to a baseline and the state-of-the-art models on the
CNN/Daily Mail dataset. We additionally train our model on the SwissText
dataset to demonstrate usability on German. Both models outperform the baseline
in ROUGE scores on two datasets and show its superiority in a manual
qualitative analysis.
","[{""version"":""v1"",""created"":""Sun, 29 Mar 2020 14:00:17 GMT""}]","2020-03-31"
"2003.13028","Itsumi Saito","Itsumi Saito, Kyosuke Nishida, Kosuke Nishida, Junji Tomita","Abstractive Summarization with Combination of Pre-trained
  Sequence-to-Sequence and Saliency Models","Work in progress",,,,"cs.CL","http://arxiv.org/licenses/nonexclusive-distrib/1.0/","  Pre-trained sequence-to-sequence (seq-to-seq) models have significantly
improved the accuracy of several language generation tasks, including
abstractive summarization. Although the fluency of abstractive summarization
has been greatly improved by fine-tuning these models, it is not clear whether
they can also identify the important parts of the source text to be included in
the summary. In this study, we investigated the effectiveness of combining
saliency models that identify the important parts of the source text with the
pre-trained seq-to-seq models through extensive experiments. We also proposed a
new combination model consisting of a saliency model that extracts a token
sequence from a source text and a seq-to-seq model that takes the sequence as
an additional input text. Experimental results showed that most of the
combination models outperformed a simple fine-tuned seq-to-seq model on both
the CNN/DM and XSum datasets even if the seq-to-seq model is pre-trained on
large-scale corpora. Moreover, for the CNN/DM dataset, the proposed combination
model exceeded the previous best-performed model by 1.33 points on ROUGE-L.
","[{""version"":""v1"",""created"":""Sun, 29 Mar 2020 14:00:25 GMT""}]","2020-03-31"
"2003.13029","Pramod Kumar Mishra Dr.","Pramod Kumar Mishra","The response of a macromolecule near a tiled substrate","07 Pages and 03 Fiures","Journal of Engineering Sciences 11 (4), 43-48 (2020)",,"2003.13029","cond-mat.soft","http://arxiv.org/licenses/nonexclusive-distrib/1.0/","  We analyze response of a macromolecule near to a substrate; the substrate is
tiled in the sequential and specific manner so that repeat units of the
macromolecule may have different response on its adsorption in different
directions onto the substrate. The lattice model of random walk has been used
to analyze the adsorption-desorption behavior of an infinitely long
homo-polymer molecule on a sequentially tiled substrate in three dimensions.
The lattice model for the Gaussian chain and directed self-avoiding chain has
been solved analytically. It has been emphasized on the basis of analytical
estimates that a suitable coating may modify affinity of the macromolecule on
the living surfaces and on the non living substrates in the complex manner
which may be suitable means to control growth and also a route to restrict the
spread of the deadly microbes.
","[{""version"":""v1"",""created"":""Sun, 29 Mar 2020 14:02:06 GMT""}]","2020-09-21"
"2003.13030","Miguel Guevara","Paulina Hurtado-Arenas, Miguel R. Guevara","A bibliometric analysis of research based on the Roy Adaptation Model: a
  contribution to Nursing",,,,,"cs.SI cs.CY cs.DL","http://creativecommons.org/licenses/by-nc-sa/4.0/","  Objective. To perform a modern bibliometric analysis of the research based on
the Roy Adaptation Model, a founding nursing model proposed by Sor Callista Roy
in the1970s. Method. A descriptive and longitudinal study. We used information
from the two dominant scientific databases, Web Of Science and SCOPUS. We
obtained 137 publications from the Core Collection of WoS, and 338 publications
from SCOPUS. We conducted our analysis using the software Bibliometrix, an
R-package specialized in creating bibliometric analyses from a perspective of
descriptive statistics and network analysis, including co-citation, co-keyword
occurrence and collaboration networks. Results. Our quantitative results show
the main actors around the research based on the model and the founding
literature or references on which this research was based. We analyze the main
keywords and how they are linked. Furthermore, we present the most prolific
authors both in number of publications and in centrality in the network of
coauthors. We present the most central institutions in the global network of
collaboration. Conclusions. We highlight the relevance of this theoretical
model in nursing and detail its evolution. The United States is the dominant
country in production of documents on the topic, and the University of
Massachusetts Boston and Boston College are the most influential institutions.
The network of collaboration also describes clusters in Mexico, Turkey and
Spain. Our findings are useful to acquire a general vision of the field.
","[{""version"":""v1"",""created"":""Sun, 29 Mar 2020 14:02:16 GMT""}]","2020-03-31"
