"2003.12890","Vojtech Kejzlar","Vojtech Kejzlar and Tapabrata Maiti","Variational Inference with Vine Copulas: An efficient Approach for
  Bayesian Computer Model Calibration","Submitted to the Statistics and Computing Journal",,,,"stat.CO stat.AP stat.ML","http://arxiv.org/licenses/nonexclusive-distrib/1.0/","  With the advancements of computer architectures, the use of computational
models proliferates to solve complex problems in many scientific applications
such as nuclear physics and climate research. However, the potential of such
models is often hindered because they tend to be computationally expensive and
consequently ill-fitting for uncertainty quantification. Furthermore, they are
usually not calibrated with real-time observations. We develop a
computationally efficient algorithm based on variational Bayes inference (VBI)
for calibration of computer models with Gaussian processes. Unfortunately, the
speed and scalability of VBI diminishes when applied to the calibration
framework with dependent data. To preserve the efficiency of VBI, we adopt a
pairwise decomposition of the data likelihood using vine copulas that separate
the information on dependence structure in data from their marginal
distributions. We provide both theoretical and empirical evidence for the
computational scalability of our methodology and describe all the necessary
details for an efficient implementation of the proposed algorithm. We also
demonstrate the opportunities given by our method for practitioners on a real
data example through calibration of the Liquid Drop Model of nuclear binding
energies.
","[{""version"":""v1"",""created"":""Sat, 28 Mar 2020 21:05:16 GMT""},{""version"":""v2"",""created"":""Fri, 2 Jul 2021 02:49:21 GMT""}]","2021-07-05"
"2003.12891","Michael Palumbo Iii","Michael L. Palumbo III (1 and 2), Sheila J. Kannappan (1), Elaine M.
  Frazer (3), Kathleen D. Eckert (4), Dara J. Norman (5), Luciano Fraga (6),
  Bruno C. Quint (7), Philippe Amram (8), Claudia Mendes de Oliveira (9),
  Ashley S. Bittner (10), Amanda J. Moffett (11), David V. Stark (12), Mark A.
  Norris (13), Nathaniel T. Cleaves (1), Derrick S. Carr (1) ((1) University of
  North Carolina at Chapel Hill, (2) The Pennsylvania State University, (3)
  Space Telescope Science Institute, (4) University of Pennsylvania, (5)
  National Optical Astronomy Observatory, (6) Laborat\'orio Nacional de
  Astrof\'isica, (7) Southern Observatory for Astrophysical Research, (8) Aix
  Marseille University, (9) Instituto de Astronomia, Geof\'isica e Ci\^encias
  Atmosf\'ericas da U. de S\~ao Paulo, (10) North Carolina State University,
  (11) University of North Georgia, (12) Kavli IPMU, (13) University of Central
  Lancashire)","Linking Compact Dwarf Starburst Galaxies in the RESOLVE Survey to
  Downsized Blue Nuggets","22 pages, 13 figures. Accepted for publication in MNRAS",,"10.1093/mnras/staa899",,"astro-ph.GA","http://arxiv.org/licenses/nonexclusive-distrib/1.0/","  We identify and characterize compact dwarf starburst (CDS) galaxies in the
RESOLVE survey, a volume-limited census of galaxies in the local universe, to
probe whether this population contains any residual ``blue nuggets,'' a class
of intensely star-forming compact galaxies first identified at high redshift
$z$. Our 50 low-$z$ CDS galaxies are defined by dwarf masses (stellar mass $M_*
< 10^{9.5}$ M$_{\odot}$), compact bulged-disk or spheroid-dominated
morphologies (using a quantitative criterion, $\mu_\Delta > 8.6$), and specific
star formation rates above the defining threshold for high-$z$ blue nuggets
($\log$ SSFR [Gyr$^{-1}] > -0.5$). Across redshifts, blue nuggets exhibit three
defining properties: compactness relative to contemporaneous galaxies, abundant
cold gas, and formation via compaction in mergers or colliding streams. Those
with halo mass below $M_{\rm halo} \sim 10^{11.5}$ M$_{\odot}$ may in theory
evade permanent quenching and cyclically refuel until the present day. Selected
only for compactness and starburst activity, our CDS galaxies generally have
$M_{\rm halo} \lesssim 10^{11.5}$ M$_{\odot}$ and gas-to-stellar mass ratio
$\gtrsim$1. Moreover, analysis of archival DECaLS photometry and new 3D
spectroscopic observations for CDS galaxies reveals a high rate of photometric
and kinematic disturbances suggestive of dwarf mergers. The SSFRs, surface mass
densities, and number counts of CDS galaxies are compatible with theoretical
and observational expectations for redshift evolution in blue nuggets. We argue
that CDS galaxies represent a maximally-starbursting subset of traditional
compact dwarf classes such as blue compact dwarfs and blue E/S0s. We conclude
that CDS galaxies represent a low-$z$ tail of the blue nugget phenomenon formed
via a moderated compaction channel that leaves open the possibility of disk
regrowth and evolution into normal disk galaxies.
","[{""version"":""v1"",""created"":""Sat, 28 Mar 2020 21:23:38 GMT""}]","2020-04-10"
"2003.12892","Fabio Armando Tal","Guilherme Silva Salom\~ao and Fabio Armando Tal","Inexistence of sublinear diffusion for a class of torus homeomorphisms",,,,,"math.DS","http://arxiv.org/licenses/nonexclusive-distrib/1.0/","  We prove that, if $f$ is a homeomorphism of the two torus isotopic to the
identity whose rotation set is a non-degenerate segment and $f$ has a periodic
point, then it has uniformly bounded deviations in the direction perpendicular
to the segment.
","[{""version"":""v1"",""created"":""Sat, 28 Mar 2020 21:28:47 GMT""}]","2020-03-31"
"2003.12893","Jonathan Selinger","Michely P. Rosseto, Jonathan V. Selinger","Theory of the splay nematic phase: Single vs. double splay",,"Phys. Rev. E 101, 052707 (2020)","10.1103/PhysRevE.101.052707",,"cond-mat.soft","http://arxiv.org/licenses/nonexclusive-distrib/1.0/","  Recent experiments have reported a novel splay nematic phase, which has
alternating domains of positive and negative splay. To model this phase,
previous studies have considered a 1D splay modulation of the director field,
accompanied by a 1D modulation of polar order. When the flexoelectric coupling
between splay and polar order becomes sufficiently strong, the uniform nematic
state becomes unstable to the formation of a modulated phase. Here, we
re-examine this theory in terms of a new approach to liquid crystal elasticity,
which shows that pure splay deformation is double splay rather than planar
single splay. Following that reasoning, we propose a structure with a 2D splay
modulation of the director field, accompanied by a 2D modulation of polar
order, and show that the 2D structure generally has a lower free energy than
the 1D structure.
","[{""version"":""v1"",""created"":""Sat, 28 Mar 2020 21:30:05 GMT""}]","2020-07-21"
"2003.12894","Fritz Gesztesy","Fritz Gesztesy, Lance L. Littlejohn, Isaac Michael, Michael M. H. Pang","A Sequence of Weighted Birman-Hardy-Rellich Inequalities with
  Logarithmic Refinements","32 pages, typos removed",,,,"math.CA math-ph math.MP math.SP","http://arxiv.org/licenses/nonexclusive-distrib/1.0/","  The principal aim of this paper is to extend Birman's sequence of integral
inequalities originally obtained in 1961, and containing Hardy's and Rellich's
inequality as special cases, to a sequence of inequalities that incorporates
power weights on either side and logarithmic refinements on the right-hand side
of the inequality as well. Our new technique of proof for this sequence of
inequalities relies on a combination of transforms originally due to Hartman
and M\""uller-Pfeiffer. The results obtained considerably improve on prior
results in the literature.
","[{""version"":""v1"",""created"":""Sat, 28 Mar 2020 21:36:16 GMT""},{""version"":""v2"",""created"":""Tue, 31 Mar 2020 06:28:43 GMT""}]","2020-04-01"
"2003.12895","Amit Daniely","Amit Daniely","Memorizing Gaussians with no over-parameterizaion via gradient decent on
  neural networks",,,,,"cs.LG stat.ML","http://arxiv.org/licenses/nonexclusive-distrib/1.0/","  We prove that a single step of gradient decent over depth two network, with
$q$ hidden neurons, starting from orthogonal initialization, can memorize
$\Omega\left(\frac{dq}{\log^4(d)}\right)$ independent and randomly labeled
Gaussians in $\mathbb{R}^d$. The result is valid for a large class of
activation functions, which includes the absolute value.
","[{""version"":""v1"",""created"":""Sat, 28 Mar 2020 21:45:42 GMT""}]","2020-03-31"
"2003.12896","Paul Plucinsky","Fan Feng, Xiangxin Dang, Richard D. James, Paul Plucinsky","The designs and deformations of rigidly and flat-foldable quadrilateral
  mesh origami",,,"10.1016/j.jmps.2020.104018",,"cond-mat.soft","http://arxiv.org/licenses/nonexclusive-distrib/1.0/","  Rigidly and flat-foldable quadrilateral mesh origami is the class of
quadrilateral mesh crease patterns with one fundamental property: the patterns
can be folded from flat to fully-folded flat by a continuous one-parameter
family of piecewise affine deformations that do not stretch or bend the
mesh-panels. In this work, we explicitly characterize the designs and
deformations of all possible rigidly and flat-foldable quadrilateral mesh
origami. Our key idea is a rigidity theorem (Theorem 3.1) that characterizes
compatible crease patterns surrounding a single panel and enables us to march
from panel to panel to compute the pattern and its corresponding deformations
explicitly. The marching procedure is computationally efficient. So we use it
to formulate the inverse problem: to design a crease pattern to achieve a
targeted shape along the path of its rigidly and flat-foldable motion. The
initial results on the inverse problem are promising and suggest a broadly
useful engineering design strategy for shape-morphing with origami.
","[{""version"":""v1"",""created"":""Sat, 28 Mar 2020 21:49:19 GMT""},{""version"":""v2"",""created"":""Tue, 21 Apr 2020 16:52:44 GMT""}]","2020-07-15"
"2003.12897","Raghwinder Singh Grewal","Raghwinder Singh Grewal, Gour Pati, Renu Tripathi","Light ellipticity and polarization angle dependence of magnetic
  resonances in rubidium vapor using amplitude-modulated light: Theoretical and
  experimental investigations",,"Phys. Rev. A 102, 033102 (2020)","10.1103/PhysRevA.102.033102",,"physics.atom-ph","http://arxiv.org/licenses/nonexclusive-distrib/1.0/","  We report on experimental and theoretical investigations of the polarization
dependence of magnetic resonance generated by synchronous optical pumping.
Magnetic resonances with narrow linewidth are generated experimentally using a
rubidium vapor cell with octade-cyltrichlorosilane (OTS) antirelaxation coating
on inner walls. We studied the effect of light ellipticity on the amplitudes
and widths of magnetic resonances by matching the light modulation frequency
with 2 {\Omega}_L (alignment) and {\Omega}_L(orientation) in a Bell-Bloom
interaction geometry, where {\Omega}_L corresponds to the Larmor frequency.
Both 2 {\Omega}_L and \OmegaL resonance amplitudes showed a strong dependence
on the light ellipticity. In addition, we showed that the duty cycle of light
modulation changes the slope of amplitude variations in 2{\Omega}_L and
{\Omega}_L resonances with light ellipticity. As a potential application, we
showed that the difference between 2{\Omega}_Land {\Omega}_Lresonance
amplitudes can be used for in situ measurement of light ellipticity. We also
studied the dependence of 2{\Omega}_L and {\Omega}_L resonance amplitudes on
the polarization angle of linearly polarized light. These amplitudes oscillate
periodically with the polarization angle. We found this oscillatory behavior to
be sensitive to the tilt in magnetic field direction from the polarization
plane. Such a property could be used to realize a vector magnetometer. A
density matrix based theoretical model is developed to simulate the magnetic
resonance spectrum for different light polarizations. Our theoretical model
accurately reproduces the above mentioned experimental observations.
","[{""version"":""v1"",""created"":""Sat, 28 Mar 2020 22:03:12 GMT""},{""version"":""v2"",""created"":""Wed, 15 Jul 2020 20:13:38 GMT""}]","2020-09-09"
"2003.12898","Zaza Osmanov","Z. Osmanov, Z. Yoshida and V.I. Berezhiani","Synchrotron emission from the depths of pulsar magnetospheres","7 pages, 3 figures",,"10.1007/s10509-020-03777-7",,"astro-ph.HE","http://arxiv.org/licenses/nonexclusive-distrib/1.0/","  In this paper we study the generation of high energy emission from normal
pulsars. For this purpose we consider the particles accelerated in the outer
magnetosphere sliding along the closed magnetic field lines. It has been shown
that in due course of motion the initial small pitch angle increases and at a
certain distance from the neutron star the synchrotron emission becomes
significant. We found that a region covered from $150$ to $500$ stellar radii
the emission pattern is characterised by energies in the interval $(0.1-10)$
MeV.
","[{""version"":""v1"",""created"":""Sat, 28 Mar 2020 22:03:25 GMT""}]","2020-04-08"
"2003.12899","Nguyen Mau Nam","Dang Van Cuong, Boris Mordukhovich, Nguyen Mau Nam","Extremal Systems of Convex Sets with Applications to Convex Calculus in
  Vector Spaces",,,,,"math.OC","http://arxiv.org/licenses/nonexclusive-distrib/1.0/","  In this paper we introduce and study the concept of set extremality for
systems of convex sets in vector spaces without topological structures.
Characterizations of the extremal systems of sets are obtained in the form of
the convex extremal principle, which is shown to be equivalent to convex
separation under certain qualification conditions expressed via algebraic
cores. The obtained results are applied via a variational geometric approach to
deriving enhanced calculus rules for normals to convex sets, coderivatives of
convex set-valued mappings, and subgradients of extended-real-valued convex
functions including the optimal value ones. These rules of the equality type
are established under refined qualification conditions in terms of algebraic
cores in arbitrary vector spaces. Our new developments partially answer the
question on how far we can go with set-valued and convex analysis without any
topological structure on the underlying spaces.
","[{""version"":""v1"",""created"":""Sat, 28 Mar 2020 22:10:45 GMT""}]","2020-03-31"
"2003.12900","Georg Rehm","Juli\'an Moreno-Schneider and Georg Rehm and Elena Montiel-Ponsoda and
  V\'ictor Rodriguez-Doncel and Artem Revenko and Sotirios Karampatakis and
  Maria Khvalchik and Christian Sageder and Jorge Gracia and Filippo Maganza","Orchestrating NLP Services for the Legal Domain","Proceedings of the 12th Language Resources and Evaluation Conference
  (LREC 2020). To appear",,,,"cs.CL cs.AI","http://arxiv.org/licenses/nonexclusive-distrib/1.0/","  Legal technology is currently receiving a lot of attention from various
angles. In this contribution we describe the main technical components of a
system that is currently under development in the European innovation project
Lynx, which includes partners from industry and research. The key contribution
of this paper is a workflow manager that enables the flexible orchestration of
workflows based on a portfolio of Natural Language Processing and Content
Curation services as well as a Multilingual Legal Knowledge Graph that contains
semantic information and meaningful references to legal documents. We also
describe different use cases with which we experiment and develop prototypical
solutions.
","[{""version"":""v1"",""created"":""Sat, 28 Mar 2020 22:10:48 GMT""}]","2020-03-31"
"2003.12901","Julian Sch\""utte","Julian Sch\""utte and Dennis Titze","liOS: Lifting iOS apps for fun and profit",,,,,"cs.CR","http://arxiv.org/licenses/nonexclusive-distrib/1.0/","  Although iOS is the second most popular mobile operating system and is often
considered the more secure one, approaches to automatically analyze iOS
applications are scarce and generic app analysis frameworks do not exist. This
is on the one hand due to the closed ecosystem putting obstacles in the way of
reverse engineers and on the other hand due to the complexity of reverse
engineering and analyzing app binaries. Reliably lifting accurate call graphs,
control flows, and data dependence graphs from binary code, as well as
reconstructing object-oriented high-level concepts is a non-trivial task and
the choice of the lifted target representation determines the analysis
capabilities. None of the various existing intermediate representations is a
perfect fit for all types of analysis, while the detection of vulnerabilities
requires techniques ranging from simple pattern matching to complex
inter-procedural data flow analyses. We address this gap by introducing liOS, a
binary lifting and analysis framework for iOS applications that extracts lifted
information from several frontends and unifies them in a ""supergraph""
representation that tolerates missing parts and is further extended and
interlinked by liOS ""passes"". A static analysis of the binary is then realized
in the form of graph traversal queries, which can be considered as an
advancement of classic program query languages. We illustrate this approach by
means of a typical JavaScript/Objective-C bridge, which can lead to remote code
execution in iOS applications.
","[{""version"":""v1"",""created"":""Sat, 28 Mar 2020 22:30:12 GMT""}]","2020-03-31"
"2003.12902","Misak Sargsian","Christopher Leon, Misak M. Sargsian and Frank Vera","A Novel Feature of Valence Quark Distributions in Hadrons","6 pages and 7 figures",,,"NUPAR-03-2020-02","hep-ph hep-ex nucl-th","http://arxiv.org/licenses/nonexclusive-distrib/1.0/","  Examining the evolution of the maximum of valence quark distribution weighted
by Bjorken x, $h(x,t)\equiv xq_V(x,t)$, we observe that $h(x,t)$ at the peak
should become a one parameter function; $h(x_p,t)=\Phi(x_p(t))$, where $x_p$ is
the position of the peak and $t= \log{Q^2}$. This observation is used to derive
a new model independent relation which connects the partial derivative of the
valence parton distribution functions (PDFs) in $x_p$ to the QCD evolution
equation through the $x_p$-derivative of the logarithm of the function
$\Phi(x_p(t))$. A numerical analysis of this relation using empirical PDFs
results in a observation of the exponential form of the $\Phi(x_p(t)) =
h(x_p,t) = Ce^{D x_p(t)}$ for leading to next-to-next leading order
approximations of PDFs for the all $Q^2$ range covering four orders in
magnitude. The exponent, $D$, of the observed ""height-position"" correlation
function converges with the increase of the order of approximation. This result
holds for all PDF sets considered. A similar relation is observed also for pion
valence quark distribution, indicating that the obtained relation may be
universal for any non-singlet partonic distribution. The observed ""height -
position"" correlation is used also to indicate that no finite number exchanges
can describe the analytic behavior of the valence quark distribution at the
position of the peak at fixed $Q^2$.
","[{""version"":""v1"",""created"":""Sat, 28 Mar 2020 22:32:17 GMT""},{""version"":""v2"",""created"":""Fri, 20 Aug 2021 03:10:00 GMT""}]","2021-08-23"
"2003.12903","Jayasimha Atulasimha","Walid Al Misba, Md. Mahadi Rajib, Dhritiman Bhattacharya, Jayasimha
  Atulasimha","Acoustic Wave Induced FMR Assisted Spin-Torque Switching of
  Perpendicular MTJs with Anisotropy Variation",,"Phys. Rev. Applied 14, 014088 (2020)","10.1103/PhysRevApplied.14.014088",,"cond-mat.mes-hall cond-mat.mtrl-sci","http://arxiv.org/licenses/nonexclusive-distrib/1.0/","  We have investigated Surface Acoustic Wave (SAW) induced ferromagnetic
resonance (FMR) assisted Spin Transfer Torque (STT) switching of perpendicular
MTJ (p-MTJ) with inhomogeneities using micromagnetic simulations that include
the effect of thermal noise. With suitable frequency excitation, the SAW can
induce ferromagnetic resonance in magnetostrictive materials, and the
magnetization can precesses in a cone with high deflection from the
perpendicular direction. With incorporation of inhomogeneity via lateral
anisotropy variation as well as room temperature thermal noise, the
magnetization precession in different gains can be significantly incoherent.
Interestingly, the precession in different grains are found to be in phase,
even though the precession amplitude (angle of deflection from the
perpendicular direction) vary across grains of different anisotropy.
Nevertheless, the high mean deflection angle can complement the STT switching
by reducing the STT current significantly; even though the applied stress
induced change in anisotropy is much lower than the total anisotropy barrier.
This work indicates that SAW assisted switching can improve energy efficiency
while being scalable to very small dimensions, which is technologically
important for STT-RAM and elucidates the physical mechanism for the potential
robustness of this paradigm in realistic scenarios with thermal noise and
material inhomogeneity
","[{""version"":""v1"",""created"":""Sat, 28 Mar 2020 22:32:46 GMT""}]","2020-09-22"
"2003.12904","Jayasimha Atulasimha","Md Mahadi Rajib, Walid Al Misba, Dhritiman Bhattacharya, Felipe
  Garcia-Sanchez, Jayasimha Atulasimha","Dynamic Skyrmion-Mediated Switching of Perpendicular MTJs: Scaling to 20
  nm with Thermal Noise",,,"10.1109/TED.2020.3011659",,"cond-mat.mes-hall","http://arxiv.org/licenses/nonexclusive-distrib/1.0/","  One method of creating and annihilating skyrmions in confined geometries is
to use Voltage-Controlled Magnetic Anisotropy (VCMA) [1, 2, 3]. Previous study
shows that robust voltage controlled ferromagnetic reversal from up to down
state in the soft layer of a perpendicular Magnetic Tunnel Junction (p-MTJ) can
be achieved by creating and subsequently annihilating an intermediate skyrmion
state [4] in the presence of room temperature thermal noise and anisotropy
variation across grains [4]. However, when scaling to 20 nm, thermal noise can
annihilate the skyrmions, for example, by randomly moving the core towards the
boundary of the nanostructure. In this work, we study three p-MTJs of different
dimensions, particularly lateral dimensions of 100nm, 50nm and 20 nm and
investigate the change in switching behavior as the dimension is decreased.
Particularly, our focus is to investigate to what extent skyrmion mediated
switching scheme can be employed below ~50nm lateral dimensions in the presence
of thermal perturbation.
","[{""version"":""v1"",""created"":""Sat, 28 Mar 2020 22:40:33 GMT""}]","2020-09-22"
"2003.12905","Michael Soltys","Michael Soltys","Cybersecurity in the AWS Cloud",,,,,"cs.CR","http://arxiv.org/licenses/nonexclusive-distrib/1.0/","  This paper re-examines the content of a standard advanced course in
Cybersecurity from the perspective of Cloud Computing. More precisely, we
review the core concepts of Cybersecurity, as presented in a senior
undergraduate or graduate class, in light of the Amazon Web Services (AWS)
cloud.
","[{""version"":""v1"",""created"":""Sat, 28 Mar 2020 22:45:28 GMT""}]","2020-03-31"
"2003.12906","Sabine Frittella","Marta B\'ilkov\'a, Sabine Frittella, Ondrej Majer, Sajad Nazari","How to reason with inconsistent probabilistic information?",,,,,"cs.LO","http://arxiv.org/licenses/nonexclusive-distrib/1.0/","  A recent line of research has developed around logics of belief based on
evidence. The approach of B\'ilkov\'a et al understands belief as based on
information confirmed by a reliable source. We propose a finer analysis of how
belief can be based on information, where the confirmation comes from multiple
possibly conflicting sources and is of a probabilistic nature. We use
Belnap-Dunn logic and its probabilistic extensions to account for potentially
contradictory information on which belief is grounded. We combine it with an
extension of Lukasiewicz logic, or a bilattice logic, within a two-layer modal
logical framework to account for belief.
","[{""version"":""v1"",""created"":""Sat, 28 Mar 2020 22:53:49 GMT""},{""version"":""v2"",""created"":""Mon, 30 Nov 2020 08:36:36 GMT""}]","2020-12-01"
"2003.12907","Carlos Guillermo Gim\'enez de Castro","C.G. Gim\'enez de Castro, J.-P. Raulin, A. Valio, G. Alaia, V.
  Alvarenga, E.C. Bortolucci, S.H. Fernandes, C. Francile, T. Giorgetti, A.S.
  Kudaka, F.M. L\'opez, R. Marcon, A. Mar\'un, M. Zaquela","HATS: A Ground-Based Telescope to Explore the THz Domain","Accepted for publication in Solar Physics. 13 pages, 3 Figures and 2
  Tables",,"10.1007/s11207-020-01621-3",,"astro-ph.SR astro-ph.IM","http://arxiv.org/licenses/nonexclusive-distrib/1.0/","  The almost unexplored frequency window from submillimeter to mid-infrared
(mid-IR) may bring new clues about the particle acceleration and transport
processes and the atmospheric thermal response during solar flares. Because of
its technical complexity and the special atmospheric environment needed,
observations at these frequencies are very sparse. The High Altitude THz Solar
Photometer (HATS) is a full-Sun ground-based telescope designed to observe the
continuum from the submillimeter to the mid-IR. It has a 457-mm spherical
mirror with the sensor in its primary focus. The sensor is a Golay cell with
high sensitivity in a very wide frequency range. The telescope has a polar
mount, and a custom-built data acquisition system based on a 32 ksamples per
second, 24 bits (72 dB dynamic range), 8 channels analog-to-digital board.
Changing only the composition of the low- and band-pass filters in front of the
Golay cell, the telescope can be setup to detect very different frequency
bands; making the instrument very versatile. In this article we describe the
telescope characteristics and its development status. Moreover, we give
estimates of the expected fluxes during flares.
","[{""version"":""v1"",""created"":""Sat, 28 Mar 2020 22:55:25 GMT""}]","2020-04-29"
