"2003.12961","Dilip Singh Sisodia","Abinash Pujahari and Dilip Singh Sisodia","Clickbait Detection using Multiple Categorization Techniques","11 pages, 7 figures, 4 tables to be published in Journal of
  Information Science","2019","10.1177/0165551519871822",,"cs.SI cs.CL cs.LG","http://arxiv.org/licenses/nonexclusive-distrib/1.0/","  Clickbaits are online articles with deliberately designed misleading titles
for luring more and more readers to open the intended web page. Clickbaits are
used to tempted visitors to click on a particular link either to monetize the
landing page or to spread the false news for sensationalization. The presence
of clickbaits on any news aggregator portal may lead to unpleasant experience
to readers. Automatic detection of clickbait headlines from news headlines has
been a challenging issue for the machine learning community. A lot of methods
have been proposed for preventing clickbait articles in recent past. However,
the recent techniques available in detecting clickbaits are not much robust.
This paper proposes a hybrid categorization technique for separating clickbait
and non-clickbait articles by integrating different features, sentence
structure, and clustering. During preliminary categorization, the headlines are
separated using eleven features. After that, the headlines are recategorized
using sentence formality, syntactic similarity measures. In the last phase, the
headlines are again recategorized by applying clustering using word vector
similarity based on t-Stochastic Neighbourhood Embedding (t-SNE) approach.
After categorization of these headlines, machine learning models are applied to
the data set to evaluate machine learning algorithms. The obtained experimental
results indicate the proposed hybrid model is more robust, reliable and
efficient than any individual categorization techniques for the real-world
dataset we used.
","[{""version"":""v1"",""created"":""Sun, 29 Mar 2020 07:16:41 GMT""}]","2020-03-31"
"2003.12962","Changxing Ding","Xin Lin, Changxing Ding, Jinquan Zeng, Dacheng Tao","GPS-Net: Graph Property Sensing Network for Scene Graph Generation","Accepted by CVPR 2020 as Oral. Code is available",,,,"cs.CV","http://creativecommons.org/licenses/by-sa/4.0/","  Scene graph generation (SGG) aims to detect objects in an image along with
their pairwise relationships. There are three key properties of scene graph
that have been underexplored in recent works: namely, the edge direction
information, the difference in priority between nodes, and the long-tailed
distribution of relationships. Accordingly, in this paper, we propose a Graph
Property Sensing Network (GPS-Net) that fully explores these three properties
for SGG. First, we propose a novel message passing module that augments the
node feature with node-specific contextual information and encodes the edge
direction information via a tri-linear model. Second, we introduce a node
priority sensitive loss to reflect the difference in priority between nodes
during training. This is achieved by designing a mapping function that adjusts
the focusing parameter in the focal loss. Third, since the frequency of
relationships is affected by the long-tailed distribution problem, we mitigate
this issue by first softening the distribution and then enabling it to be
adjusted for each subject-object pair according to their visual appearance.
Systematic experiments demonstrate the effectiveness of the proposed
techniques. Moreover, GPS-Net achieves state-of-the-art performance on three
popular databases: VG, OI, and VRD by significant gains under various settings
and metrics. The code and models are available at
\url{https://github.com/taksau/GPS-Net}.
","[{""version"":""v1"",""created"":""Sun, 29 Mar 2020 07:22:31 GMT""}]","2020-03-31"
"2003.12963","Akhlesh Lakhtakia","Akhlesh Lakhtakia, Tom G. Mackay","Electromagnetic scattering by homogeneous, isotropic,
  dielectric-magnetic sphere with topologically insulating surface states",,"Journal of Optical Society of America B 33, 603-609 (2016)","10.1364/JOSAB.33.000603",,"physics.optics","http://arxiv.org/licenses/nonexclusive-distrib/1.0/","  The Lorenz--Mie formulation of electromagnetic scattering by a homogeneous,
isotropic, dielectric-magnetic sphere was extended to incorporate topologically
insulating surface states characterized by a surface admittance $\gamma$.
Closed-form expressions were derived for the expansion coefficients of the
scattered field phasors in terms of those of the incident field phasors. These
expansion coefficients were used to obtain analytical expressions for the total
scattering, extinction, forward scattering, and backscattering efficiencies of
the sphere. Resonances exist for relatively low values of $\gamma$, when the
sphere is either nondissipative or weakly dissipative. For large
  values of $\gamma$, the scattering characteristics are close to that of a
perfect electrically conducting sphere, regardless of whether the sphere is
composed of a dissipative or nondissipative material, and regardless of whether
that material supports planewave propagation with positive or negative phase
velocity.
","[{""version"":""v1"",""created"":""Sun, 29 Mar 2020 07:40:16 GMT""}]","2020-03-31"
"2003.12964","Atanu Mondal","A. Deb Ray and Atanu Mondal","On Structure space of the ring $B_1(X)$","11 Pages. arXiv admin note: substantial text overlap with
  arXiv:1906.08498","Filomat 35, No.9 (2021), 2911-2918","10.2298/FIL2109911D",,"math.GN","http://arxiv.org/licenses/nonexclusive-distrib/1.0/","  In this article, we continue our study of the ring of Baire one functions on
a topological space $(X,\tau)$, denoted by $B_1(X)$ and extend the well known
M. H. Stones's theorem from $C(X)$ to $B_1(X)$. Introducing the structure space
of $B_1(X)$, an analogue of Gelfand Kolmogoroff theorem is established. It is
observed that $(X,\tau)$ may not be embedded inside the structure space of
$B_1(X)$. This observation inspired us to introduce a weaker form of embedding
and show that in case $X$ is a $T_4$ space, $X$ is weakly embedded as a dense
subspace, in the structure space of $B_1(X)$. It is further established that
the ring $B_1^{*}(X)$ of all bounded Baire one functions is a C-type ring and
also, the structure space of $B_1^{*}(X)$ is homeomorphic to the structure
space of $B_1(X)$. Introducing a finer topology $\sigma$ than the original
$T_4$ topology $\tau$ on $X$, it is proved that $B_1(X)$ contains free
(maximal) ideals if $\sigma$ is strictly finer than $\tau$. It is also proved
that $\tau = \sigma$ if and only if $B_1(X) = C(X)$. Moreover, in the class of
all perfectly normal $T_1$ spaces, $B_1(X) = C(X)$ is equivalent to the
discreteness of the space $X$.
","[{""version"":""v1"",""created"":""Sun, 29 Mar 2020 07:51:21 GMT""},{""version"":""v2"",""created"":""Fri, 10 Jul 2020 18:54:07 GMT""}]","2022-01-31"
"2003.12965","Emmanuel Kowalski","Emmanuel Kowalski, Kannan Soundararajan","Equidistribution from the Chinese Remainder Theorem","v2, 30 pages; extended the main result to all moduli instead of
  working only with squarefree moduli",,,,"math.NT","http://arxiv.org/licenses/nonexclusive-distrib/1.0/","  We prove the equidistribution of subsets of $(\Rr/\Zz)^n$ defined by
fractional parts of subsets of~$(\Zz/q\Zz)^n$ that are constructed using the
Chinese Remainder Theorem.
","[{""version"":""v1"",""created"":""Sun, 29 Mar 2020 07:54:17 GMT""},{""version"":""v2"",""created"":""Mon, 8 Jun 2020 05:16:22 GMT""}]","2020-06-09"
"2003.12966","Guoxing Ji","Guoxing Ji","Maximality and finiteness of type 1 subdiagonal algebras",,,,,"math.OA math.FA","http://arxiv.org/licenses/nonexclusive-distrib/1.0/","  Let $\mathfrak A$ be a type 1 subdiagonal algebra in a $\sigma$-finite von
Neumann algebra $\mathcal M$ with respect to a faithful normal conditional
expectation $\Phi$. We give necessary and sufficient conditions for which
$\mathfrak A$ is maximal among the $\sigma$-weakly closed subalgebras of
$\mathcal M$. In addition, we show that a type 1 subdiagonal algebra in a
finite von Neumann algebra is automatically finite which gives a positive
answer of Arveson's finiteness problem in 1967 in type 1 case.
","[{""version"":""v1"",""created"":""Sun, 29 Mar 2020 07:56:37 GMT""}]","2020-03-31"
"2003.12967","Ali Wehbe","Mouhammad Ghader, Rayan Nasser, Ali Wehbe","Stability results for an elastic-viscoelastic waves interaction systems
  with localized Kelvin-Voigt damping and with an internal or boundary time
  delay",,,,,"math.AP math.OC","http://arxiv.org/licenses/nonexclusive-distrib/1.0/","  We investigate the stability of a one-dimensional wave equation with non
smooth localized internal viscoelastic damping of Kelvin-Voigt type and with
boundary or localized internal delay feedback. The main novelty in this paper
is that the Kelvin-Voigt and the delay damping are both localized via non
smooth coefficients. In the case that the Kelvin-Voigt damping is localized
faraway from the tip and the wave is subjected to a locally distributed
internal or boundary delay feedback, we prove that the energy of the system
decays polynomially of type t^{-4}. However, an exponential decay of the energy
of the system is established provided that the Kelvin-Voigt damping is
localized near a part of the boundary and a time delay damping acts on the
second boundary. While, when the Kelvin-Voigt and the internal delay damping
are both localized via non smooth coefficients near the tip, the energy of the
system decays polynomially of type t^{-4}. Frequency domain arguments combined
with piecewise multiplier techniques are employed.
","[{""version"":""v1"",""created"":""Sun, 29 Mar 2020 08:03:25 GMT""}]","2020-03-31"
"2003.12968","D. H. S. Maithripala","Pathmanathan Pankayaraj, D. H. S. Maithripala, and J. M. Berg","A Decentralized Policy with Logarithmic Regret for a Class of
  Multi-Agent Multi-Armed Bandit Problems with Option Unavailability
  Constraints and Stochastic Communication Protocols","Pre-print submitted for review to the 2020 CDC",,,,"cs.LG math.ST stat.ML stat.TH","http://arxiv.org/licenses/nonexclusive-distrib/1.0/","  This paper considers a multi-armed bandit (MAB) problem in which multiple
mobile agents receive rewards by sampling from a collection of spatially
dispersed stochastic processes, called bandits. The goal is to formulate a
decentralized policy for each agent, in order to maximize the total cumulative
reward over all agents, subject to option availability and inter-agent
communication constraints. The problem formulation is motivated by applications
in which a team of autonomous mobile robots cooperates to accomplish an
exploration and exploitation task in an uncertain environment. Bandit locations
are represented by vertices of the spatial graph. At any time, an agent's
option consist of sampling the bandit at its current location, or traveling
along an edge of the spatial graph to a new bandit location. Communication
constraints are described by a directed, non-stationary, stochastic
communication graph. At any time, agents may receive data only from their
communication graph in-neighbors. For the case of a single agent on a fully
connected spatial graph, it is known that the expected regret for any optimal
policy is necessarily bounded below by a function that grows as the logarithm
of time. A class of policies called upper confidence bound (UCB) algorithms
asymptotically achieve logarithmic regret for the classical MAB problem. In
this paper, we propose a UCB-based decentralized motion and option selection
policy and a non-stationary stochastic communication protocol that guarantee
logarithmic regret. To our knowledge, this is the first such decentralized
policy for non-fully connected spatial graphs with communication constraints.
When the spatial graph is fully connected and the communication graph is
stationary, our decentralized algorithm matches or exceeds the best reported
prior results from the literature.
","[{""version"":""v1"",""created"":""Sun, 29 Mar 2020 08:12:49 GMT""},{""version"":""v2"",""created"":""Tue, 31 Mar 2020 04:29:22 GMT""}]","2020-04-01"
"2003.12969","Andrea Lucchini","Andrea Lucchini","Finite groups with the same join graph as a finite nilpotent group",,,"10.1017/S0017089520000415",,"math.GR","http://arxiv.org/licenses/nonexclusive-distrib/1.0/","  Given a finite group $G,$ we denote by $\Delta(G)$ the graph whose vertices
are the proper subgroups of $G$ and in which two vertices $H$ and $K$ are
joined by an edge if and only if $G=\langle H,K\rangle.$ We prove that if there
exists a finite nilpotent group $X$ with $\Delta(G)\cong \Delta(X),$ then $G$
is supersoluble.
","[{""version"":""v1"",""created"":""Sun, 29 Mar 2020 08:20:08 GMT""}]","2020-08-19"
"2003.12970","Pengcheng Zeng","Pengcheng Zeng and Zhixiang Lin","Elastic Coupled Co-clustering for Single-Cell Genomic Data","18 pages, 3 figures, 2 tables",,,,"stat.ML cs.LG","http://creativecommons.org/licenses/by-nc-sa/4.0/","  The recent advances in single-cell technologies have enabled us to profile
genomic features at unprecedented resolution and datasets from multiple domains
are available, including datasets that profile different types of genomic
features and datasets that profile the same type of genomic features across
different species. These datasets typically have different powers in
identifying the unknown cell types through clustering, and data integration can
potentially lead to a better performance of clustering algorithms. In this
work, we formulate the problem in an unsupervised transfer learning framework,
which utilizes knowledge learned from auxiliary dataset to improve the
clustering performance of target dataset. The degree of shared information
among the target and auxiliary datasets can vary, and their distributions can
also be different. To address these challenges, we propose an elastic coupled
co-clustering based transfer learning algorithm, by elastically propagating
clustering knowledge obtained from the auxiliary dataset to the target dataset.
Implementation on single-cell genomic datasets shows that our algorithm greatly
improves clustering performance over the traditional learning algorithms. The
source code and data sets are available at
https://github.com/cuhklinlab/elasticC3.
","[{""version"":""v1"",""created"":""Sun, 29 Mar 2020 08:21:53 GMT""},{""version"":""v2"",""created"":""Sat, 6 Jun 2020 03:28:35 GMT""}]","2020-06-09"
"2003.12971","Yongming Rao","Yongming Rao, Jiwen Lu, Jie Zhou","Global-Local Bidirectional Reasoning for Unsupervised Representation
  Learning of 3D Point Clouds","Accepted to CVPR2020",,,,"cs.CV","http://arxiv.org/licenses/nonexclusive-distrib/1.0/","  Local and global patterns of an object are closely related. Although each
part of an object is incomplete, the underlying attributes about the object are
shared among all parts, which makes reasoning the whole object from a single
part possible. We hypothesize that a powerful representation of a 3D object
should model the attributes that are shared between parts and the whole object,
and distinguishable from other objects. Based on this hypothesis, we propose to
learn point cloud representation by bidirectional reasoning between the local
structures at different abstraction hierarchies and the global shape without
human supervision. Experimental results on various benchmark datasets
demonstrate the unsupervisedly learned representation is even better than
supervised representation in discriminative power, generalization ability, and
robustness. We show that unsupervisedly trained point cloud models can
outperform their supervised counterparts on downstream classification tasks.
Most notably, by simply increasing the channel width of an SSG PointNet++, our
unsupervised model surpasses the state-of-the-art supervised methods on both
synthetic and real-world 3D object classification datasets. We expect our
observations to offer a new perspective on learning better representation from
data structures instead of human annotations for point cloud understanding.
","[{""version"":""v1"",""created"":""Sun, 29 Mar 2020 08:26:08 GMT""}]","2020-03-31"
"2003.12972","Kammoun Abla","Abla Kammoun and Mohamed-Slim Alouini","On the Precise Error Analysis of Support Vector Machines",,,,,"cs.IT math.IT","http://arxiv.org/licenses/nonexclusive-distrib/1.0/","  This paper investigates the asymptotic behavior of the soft-margin and
hard-margin support vector machine (SVM) classifiers for simultaneously
high-dimensional and numerous data (large $n$ and large $p$ with
$n/p\to\delta$) drawn from a Gaussian mixture distribution. Sharp predictions
of the classification error rate of the hard-margin and soft-margin SVM are
provided, as well as asymptotic limits of as such important parameters as the
margin and the bias. As a further outcome, the analysis allow for the
identification of the maximum number of training samples that the hard-margin
SVM is able to separate. The precise nature of our results allow for an
accurate performance comparison of the hard-margin and soft-margin SVM as well
as a better understanding of the involved parameters (such as the number of
measurements and the margin parameter) on the classification performance. Our
analysis, confirmed by a set of numerical experiments, builds upon the convex
Gaussian min-max Theorem, and extends its scope to new problems never studied
before by this framework.
","[{""version"":""v1"",""created"":""Sun, 29 Mar 2020 08:27:34 GMT""}]","2020-03-31"
"2003.12973","Andong Li","Andong Li, Chengshi Zheng, Cunhang Fan, Renhua Peng, Xiaodong Li","A Recursive Network with Dynamic Attention for Monaural Speech
  Enhancement","5 pages, 3 figures",,,,"cs.SD eess.AS","http://arxiv.org/licenses/nonexclusive-distrib/1.0/","  A person tends to generate dynamic attention towards speech under complicated
environments. Based on this phenomenon, we propose a framework combining
dynamic attention and recursive learning together for monaural speech
enhancement. Apart from a major noise reduction network, we design a separated
sub-network, which adaptively generates the attention distribution to control
the information flow throughout the major network. To effectively decrease the
number of trainable parameters, recursive learning is introduced, which means
that the network is reused for multiple stages, where the intermediate output
in each stage is correlated with a memory mechanism. As a result, a more
flexible and better estimation can be obtained. We conduct experiments on TIMIT
corpus. Experimental results show that the proposed architecture obtains
consistently better performance than recent state-of-the-art models in terms of
both PESQ and STOI scores.
","[{""version"":""v1"",""created"":""Sun, 29 Mar 2020 08:44:02 GMT""},{""version"":""v2"",""created"":""Tue, 31 Mar 2020 10:27:32 GMT""},{""version"":""v3"",""created"":""Wed, 1 Apr 2020 03:59:01 GMT""}]","2020-04-02"
"2003.12974","Kazuki Kondo","Kazuki Kondo","Dynamics of the multicolor box-ball system with random initial
  conditions via Pitman's transformation",,,,,"math.PR math-ph math.MP","http://arxiv.org/licenses/nonexclusive-distrib/1.0/","  The Box-Ball System (BBS) is a cellular automaton introduced by Takahashi and
Satsuma in the 1990s. The system is a discrete counterpart of the KdV equation
and exhibits solitonic behavior. Recently, the BBS started from a random
two-sided infinite particle configuration has been studied, by encoding the
particle configuration to a certain discrete path on Z and defining the dynamic
of the BBS in terms of the path. In this paper, we extend some results of the
previous study in this direction to a generalization of the BBS with
\k{appa}-color balls (particles), called the multicolor BBS. We first introduce
an encoding of the \k{appa}-color particles configuration to a discrete path in
\k{appa}-dimensional Euclidean space. Then we show that the dynamics of the
multicolor BBS is expressed by the composition of the Pitman's transformation
and a permutation operator. Applying this expression, we characterize the set
of configurations for which the dynamics are well-defined and reversible for
all times. Then, we give a simple class of random initial conditions which are
invariant in distribution under the dynamics of the multicolor BBS. Finally, we
introduce a continuous version of the multicolor BBS, which is defined for
continuous paths on R in \k{appa}-dimensional Euclidean space, and show that
\k{appa}-dimensional Brownian motion with a proper drift is invariant under the
dynamics of the continuous version of the multicolor BBS.
","[{""version"":""v1"",""created"":""Sun, 29 Mar 2020 08:48:54 GMT""}]","2020-03-31"
"2003.12975","Xingkang He","Xingkang He, Ehsan Hashemi, Karl H. Johansson","Secure Platooning of Autonomous Vehicles Under Attacked GPS Data",,,,,"eess.SY cs.SY","http://arxiv.org/licenses/nonexclusive-distrib/1.0/","  In this paper, we study how to secure the platooning of autonomous vehicles
when an unknown vehicle is under attack and bounded system uncertainties exist.
For the attacked vehicle, its position and speed measurements from GPS can be
manipulated arbitrarily by a malicious attacker. First, to find out which
vehicle is under attack, two detectors are proposed by using the relative
measurements (by camera or radar) and the local innovation obtained through
measurements from neighboring vehicles. Then, based on the results of the
detectors, we design a local state observer for each vehicle by applying a
saturation method to the measurement innovation. Moreover, based on the
neighbor state estimates provided by the observer, a distributed controller is
proposed to achieve the consensus in vehicle speed and keep fixed desired
distance between two neighboring vehicles. The estimation error by the observer
and the platooning error by the controller are shown to be asymptotically upper
bounded under certain conditions. The effectiveness of the proposed methods is
also evaluated in numerical simulations.
","[{""version"":""v1"",""created"":""Sun, 29 Mar 2020 08:57:31 GMT""}]","2020-03-31"
"2003.12976","Jialiang Xu","Jialiang Xu","Nonuniqueness of Solutions of a Class of $\ell_{0}$-minimization
  Problems",,,,,"math.OC cs.IT math.IT","http://arxiv.org/licenses/nonexclusive-distrib/1.0/","  Recently, finding the sparsest solution of an underdetermined linear system
has become an important request in many areas such as compressed sensing, image
processing, statistical learning, and data sparse approximation. In this paper,
we study some theoretical properties of the solutions to a general class of
$\ell_{0}$-minimization problems, which can be used to deal with many practical
applications. We establish some necessary conditions for a point being the
sparsest solution to this class of problems, and we also characterize the
conditions for the multiplicity of the sparsest solutions to the problem.
Finally, we discuss certain conditions for the boundedness of the solution set
of this class of problems.
","[{""version"":""v1"",""created"":""Sun, 29 Mar 2020 08:58:57 GMT""}]","2020-03-31"
"2003.12977","Seiichi Kamada","Seiichi Kamada","Tensor products of quandles and 1-handles attached to surface-links",,,,,"math.GT","http://arxiv.org/licenses/nonexclusive-distrib/1.0/","  A quandle is an algebra with two binary operations satisfying three
conditions which are related to Reidemeister moves in knot theory. In this
paper we introduce the notion of the (canonical) tensor product of a quandle.
The tensor product of the knot quandle or the knot symmetric quandle of a
surface-link in $4$-space can be used to classify or construct invariants of
$1$-handles attaching to the surface-link.
","[{""version"":""v1"",""created"":""Sun, 29 Mar 2020 08:59:02 GMT""},{""version"":""v2"",""created"":""Tue, 22 Sep 2020 03:30:09 GMT""}]","2020-09-23"
"2003.12978","Lubin Chang","Lubin Chang","SE(3) based Extended Kalman Filter for Spacecraft Attitude Estimation",,,,,"eess.SY cs.RO cs.SY","http://arxiv.org/licenses/nonexclusive-distrib/1.0/","  In this paper, the spacecraft attitude estimation problem has been
investigated making use of the concept of matrix Lie group. Through formulation
of the attitude and gyroscope bias as elements of SE(3), the corresponding
extended Kalman filter, termed as SE(3)-EKF, has been derived. It is shown that
the resulting SE(3)-EKF is just the newly-derived geometric extended Kalman
filter (GEKF) for spacecraft attitude estimation. This provides a new
perspective on the GEKF besides the common frame errors definition. Moreover,
the SE(3)-EKF with reference frame attitude error is also derived and the
resulting algorithm bears much resemblance to the right invariant EKF.
","[{""version"":""v1"",""created"":""Sun, 29 Mar 2020 09:02:37 GMT""}]","2020-03-31"
