"2011.07832","Hiroaki Hayashi","Hiroaki Hayashi, Prashant Budania, Peng Wang, Chris Ackerson, Raj
  Neervannan, Graham Neubig","WikiAsp: A Dataset for Multi-domain Aspect-based Summarization","Transaction of the ACL",,,,"cs.CL","http://arxiv.org/licenses/nonexclusive-distrib/1.0/","  Aspect-based summarization is the task of generating focused summaries based
on specific points of interest. Such summaries aid efficient analysis of text,
such as quickly understanding reviews or opinions from different angles.
However, due to large differences in the type of aspects for different domains
(e.g., sentiment, product features), the development of previous models has
tended to be domain-specific. In this paper, we propose WikiAsp, a large-scale
dataset for multi-domain aspect-based summarization that attempts to spur
research in the direction of open-domain aspect-based summarization.
Specifically, we build the dataset using Wikipedia articles from 20 different
domains, using the section titles and boundaries of each article as a proxy for
aspect annotation. We propose several straightforward baseline models for this
task and conduct experiments on the dataset. Results highlight key challenges
that existing summarization models face in this setting, such as proper pronoun
handling of quoted sources and consistent explanation of time-sensitive events.
","[{""version"":""v1"",""created"":""Mon, 16 Nov 2020 10:02:52 GMT""}]","2020-11-17"
"2011.07833","Meichen Guo","Meichen Guo, Claudio De Persis, Pietro Tesi","Data-driven stabilization of nonlinear polynomial systems with noisy
  data",,,,,"math.OC cs.SY eess.SY","http://creativecommons.org/licenses/by/4.0/","  In a recent paper we have shown how to learn controllers for unknown linear
systems using finite-sized noisy data by solving linear matrix inequalities. In
this note we extend this approach to deal with unknown nonlinear polynomial
systems by formulating stability certificates in the form of data-dependent sum
of squares programs, whose solution directly provides a stabilizing controller
and a Lyapunov function. We then derive variations of this result that lead to
more advantageous controller designs. The results also reveal connections to
the problem of designing a controller starting from a least-square estimate of
the polynomial system.
","[{""version"":""v1"",""created"":""Mon, 16 Nov 2020 10:06:31 GMT""}]","2020-11-17"
"2011.07834","Andon Rangelov A","Elena Stoyanova, Svetoslav Ivanov, Andon Rangelov","Arbitrary polarization control by magnetic field variation",,"Applied Optics Vol. 59, Issue 33, pp. 10224-10227 (2020)","10.1364/AO.404150",,"physics.optics physics.app-ph","http://creativecommons.org/publicdomain/zero/1.0/","  We propose a universal scheme for the construction of a device for arbitrary
to arbitrary polarization transformation, which consists of two quarter-wave
plates and two Faraday rotators. Using this device, one can continuously change
the retardance and the rotation angle simply by changing the magnetic fields in
each Faraday rotator.
","[{""version"":""v1"",""created"":""Mon, 16 Nov 2020 10:06:54 GMT""}]","2020-11-17"
"2011.07835","Bhagyashree Puranik","Bhagyashree Puranik, Upamanyu Madhow, Ramtin Pedarsani","Adversarially Robust Classification based on GLRT","Submitted to the International Conference on Acoustics, Speech, and
  Signal Processing (ICASSP) 2021",,,,"stat.ML cs.CR cs.LG","http://arxiv.org/licenses/nonexclusive-distrib/1.0/","  Machine learning models are vulnerable to adversarial attacks that can often
cause misclassification by introducing small but well designed perturbations.
In this paper, we explore, in the setting of classical composite hypothesis
testing, a defense strategy based on the generalized likelihood ratio test
(GLRT), which jointly estimates the class of interest and the adversarial
perturbation. We evaluate the GLRT approach for the special case of binary
hypothesis testing in white Gaussian noise under $\ell_{\infty}$ norm-bounded
adversarial perturbations, a setting for which a minimax strategy optimizing
for the worst-case attack is known. We show that the GLRT approach yields
performance competitive with that of the minimax approach under the worst-case
attack, and observe that it yields a better robustness-accuracy trade-off under
weaker attacks, depending on the values of signal components relative to the
attack budget. We also observe that the GLRT defense generalizes naturally to
more complex models for which optimal minimax classifiers are not known.
","[{""version"":""v1"",""created"":""Mon, 16 Nov 2020 10:16:05 GMT""}]","2020-11-17"
"2011.07836","Emeric Bouin","Emeric Bouin (CEREMADE), Cl\'ement Mouhot (DPMMS)","Quantitative fluid approximation in transport theory: a unified approach",,"Prob. Math. Phys. 3 (2022) 491-542","10.2140/pmp.2022.3.491",,"math.AP math-ph math.MP","http://arxiv.org/licenses/nonexclusive-distrib/1.0/","  We propose a unified method for the large space-time scaling limit of
\emph{linear} collisional kinetic equations in the whole space. The limit is of
\emph{fractional} diffusion type for heavy tail equilibria with slow enough
decay, and of diffusive type otherwise. The proof is constructive and the
fractional/standard diffusion matrix is obtained. The method combines energy
estimates and quantitative spectral methods to construct a `fluid mode'. The
method is applied to scattering models (without assuming detailed balance
conditions), Fokker-Planck operators and L{\'e}vy-Fokker-Planck operators. It
proves a series of new results, including the fractional diffusive limit for
Fokker-Planck operators in any dimension, for which the formulas for the
diffusion coefficient were not known, for L{\'e}vy-Fokker-Planck operators with
general equilibria, and for scattering operators including some cases of
infinite mass equilibria. It also unifies and generalises the results of
previous papers with a quantitative method, and our estimates on the fluid
approximation error also seem novel.
","[{""version"":""v1"",""created"":""Mon, 16 Nov 2020 10:17:37 GMT""},{""version"":""v2"",""created"":""Tue, 8 Dec 2020 14:46:36 GMT""},{""version"":""v3"",""created"":""Thu, 3 Jun 2021 08:32:43 GMT""},{""version"":""v4"",""created"":""Fri, 4 Feb 2022 08:41:13 GMT""},{""version"":""v5"",""created"":""Tue, 5 Apr 2022 09:23:28 GMT""},{""version"":""v6"",""created"":""Wed, 25 May 2022 15:18:13 GMT""},{""version"":""v7"",""created"":""Tue, 22 Nov 2022 10:12:39 GMT""}]","2023-02-22"
"2011.07837","Sebastian Hornung","Sebastian Hornung (for the ALICE Collaboration)","Understanding the background in dark matter searches by studying
  antinucleosynthesis in the laboratory with ALICE","6 pages, 5 figures, proceeding of 40th International Conference on
  High Energy physics (ICHEP2020), July 28 - August 6, 2020, Prague, Czech
  Republic (virtual meeting)",,"10.22323/1.390.0634",,"nucl-ex hep-ex","http://creativecommons.org/licenses/by/4.0/","  Antinuclei are considered to be one of the most promising probes in the
indirect search for dark matter (DM) annihilation in space. However, in light
of recent results on the production of light antinuclei in pp collisions at the
LHC, an abundant production of light (anti)nuclei is also expected from
Standard Model (SM) collisions of primary cosmic rays with the interstellar
medium. Hence further precise measurements are required to constrain the
production models of antinuclei in SM collisions to be sensitive to additional
DM annihilation events. The most recent results of the ALICE collaboration on
the production of antideuterons ($\overline{\mathrm{d}}$) and antihelium-3
($^3\overline{\text{He}}$) in proton-proton (pp) and proton-lead (p--Pb)
collisions are shown. These results provide valuable input for state-of-the-art
calculations of the production models currently used to estimate the SM
background to DM searches.
","[{""version"":""v1"",""created"":""Mon, 16 Nov 2020 10:20:45 GMT""},{""version"":""v2"",""created"":""Mon, 25 Jan 2021 06:58:21 GMT""}]","2021-04-29"
"2011.07838","Gwenael Richomme","Gwena\""el Richomme (ESCAPE, UPVM)","On sets of indefinitely desubstitutable words",,,,,"cs.DM","http://arxiv.org/licenses/nonexclusive-distrib/1.0/","  The stable set associated to a given set S of nonerasing endomorphisms or
substitutions is the set of all right infinite words that can be indefinitely
desubstituted over S. This notion generalizes the notion of sets of fixed
points of morphisms. It is linked to S-adicity and to property preserving
morphisms. Two main questions are considered. Which known sets of infinite
words are stable sets? Which ones are stable sets of a finite set of
substitutions? While bringing answers to the previous questions, some new
characterizations of several well-known sets of words such as the set of binary
balanced words or the set of episturmian words are presented. A
characterization of the set of nonerasing endomorphisms that preserve
episturmian words is also provided.
","[{""version"":""v1"",""created"":""Mon, 16 Nov 2020 10:22:10 GMT""}]","2020-11-17"
"2011.07839","Alexey Glutsyuk","Yulia Bibilo and Alexey Glutsyuk","On families of constrictions in model of overdamped Josephson junction
  and Painlev\'e 3 equation","73 pages, 10 figures","Nonlinearity 35 (2022) 5427-5480","10.1088/1361-6544/ac8aee",,"math.DS math-ph math.MP","http://arxiv.org/licenses/nonexclusive-distrib/1.0/","  The tunneling effect predicted by B.Josephson (Nobel Prize, 1973) concerns
the Josephson junction: two superconductors separated by a narrow dielectric.
It states existence of a supercurrent through it and equations governing it.
The overdamped Josephson junction is modeled by a family of differential
equations on 2-torus depending on 3 parameters: $B$ (abscissa), $A$ (ordinate),
$\omega$ (frequency). We study its rotation number $\rho(B,A;\omega)$ as a
function of $(B,A)$ with fixed $\omega$. The phase-lock areas are the level
sets $L_r:=\{\rho=r\}$ with non-empty interiors; they exist for $r\in\mathbb Z$
(Buchstaber, Karpov, Tertychnyi). Each $L_r$ is an infinite chain of domains
going vertically to infinity and separated by points called constrictions
(expect for those with $A=0$). We show that: 1) all the constrictions in $L_r$
lie in its axis $\{ B=\omega r\}$ (confirming a conjecture of Tertychnyi,
Kleptsyn, Filimonov, Schurov); 2) each constriction is positive: some its
punctured neighborhood in the vertical line lies in $\operatorname{Int}(L_r)$
(confirming another conjecture). We first prove deformability of each
constriction to another one, with arbitrarily small $\omega$, of the same
$\rho$, $\ell:=\frac B\omega$ and type (positive or not), using equivalent
description of model by linear systems of differential equations on
$\bar{\mathbb C}$ (Buchstaber, Karpov, Tertychnyi) and studying their
isomonodromic deformations described by Painlev\'e 3 equations. Then
non-existence of ghost constrictions (i.e., constrictions either with
$\rho\neq\ell$, or of non-positive type) with a given $\ell$ for small $\omega$
is proved by slow-fast methods. In Section 6 we present applications of results
and elaborated methods and open problems.
","[{""version"":""v1"",""created"":""Mon, 16 Nov 2020 10:26:11 GMT""},{""version"":""v2"",""created"":""Tue, 17 Nov 2020 09:04:10 GMT""},{""version"":""v3"",""created"":""Tue, 22 Dec 2020 20:45:57 GMT""},{""version"":""v4"",""created"":""Sat, 2 Jan 2021 17:32:11 GMT""},{""version"":""v5"",""created"":""Wed, 5 Oct 2022 15:40:39 GMT""}]","2022-10-06"
"2011.07840","Ivan Gentil","Louis Dupaigne (ICJ), Ivan Gentil (ICJ), Simon Zugmeyer (MAP5 - UMR
  8145)","Sobolev's inequality under a curvature-dimension condition",,,,,"math.AP math.PR","http://arxiv.org/licenses/nonexclusive-distrib/1.0/","  In this note we present a new proof of Sobolev's inequality under a uniform
lower bound of the Ricci curvature. This result was initially obtained in 1983
by Ilias. Our goal is to present a very short proof, to give a review of the
famous inequality and to explain how our method, relying on a gradient-flow
interpretation, is simple and robust. In particular, we elucidate computations
used in numerous previous works, starting with Bidaut-V{\'e}ron and V{\'e}ron's
1991 classical work.
","[{""version"":""v1"",""created"":""Mon, 16 Nov 2020 10:26:25 GMT""},{""version"":""v2"",""created"":""Thu, 19 Nov 2020 09:24:56 GMT""},{""version"":""v3"",""created"":""Wed, 20 Jan 2021 11:09:18 GMT""}]","2021-01-21"
"2011.07841","Antoine Riaud","Antoine Riaud, Qing Wang, Zhixiong Gong, Michael Baudoin, Jia Zhou","Acoustic radiation force on small spheres due to transient acoustic
  fields",,"Phys. Rev. Applied 15, 044034 (2021)","10.1103/PhysRevApplied.15.044034",,"physics.flu-dyn","http://arxiv.org/licenses/nonexclusive-distrib/1.0/","  Acoustic radiation force is a net force experienced by an object under the
action of an acoustic wave. Most theoretical models require the acoustic wave
to be periodic, if not purely monofrequency, and are therefore irrelevant for
the study of acoustic radiation force due to acoustic pulses. Here, we
introduce the concept of finite-duration pulses, which is the most general
condition to derive the acoustic radiation force. In the case of small spheres,
we extend the Gor'kov to formula to unsteady acoustic fields such as traveling
pulses and interfering wave packets. In the latter case, our study suggests
that the concept of acoustic contrast is also relevant to express the acoustic
radiation force. For negative acoustic contrast particles, the acoustic
trapping region narrows with shorter pulses, whereas positive contrast
particles (such as biological cells) can fall in secondary traps when the pulse
width deviates from an optimal value. This theoretical insight may help to
improve the selectivity of pulsed acoustic tweezers.
","[{""version"":""v1"",""created"":""Mon, 16 Nov 2020 10:29:17 GMT""}]","2021-04-28"
"2011.07842","Mihail I Petrov","Anna Nikolaeva, Kristina Frizyuk, Nikita Olekhno, Alexander Solntsev,
  and Mihail Petrov","Directional emission of down-converted photons from a dielectric
  nano-resonator",,"Phys. Rev. A 103, 043703 (2021)","10.1103/PhysRevA.103.043703",,"physics.optics quant-ph","http://creativecommons.org/licenses/by/4.0/","  Creation of correlated photon pairs is one of the key topics in contemporary
quantum optics. Here, we theoretically describe the generation of photon pairs
in the process of spontaneous parametric down-conversion in a resonant
spherical nanoparticle made of a dielectric material with bulk $\chi^{(2)}$
nonlinearity. We pick the nanoparticle size that satisfies the condition of
resonant eigenmodes described by Mie theory. We reveal that highly directional
photon-pair generation can be observed utilising the nonlinear Kerker-type
effect, and that this regime provides useful polarisation correlations.
","[{""version"":""v1"",""created"":""Mon, 16 Nov 2020 10:30:04 GMT""}]","2021-04-14"
"2011.07843","Jacky Cresson","Jacky Cresson (LMAP), Laurent Nottale, Thierry Lehner","Stochastic modication of Newtonian dynamics and Induced potential
  -application to spiral galaxies and the dark potential",,,"10.1063/5.0037265",,"math.DS math-ph math.MP","http://arxiv.org/licenses/nonexclusive-distrib/1.0/","  Using the formalism of stochastic embedding developed by [J. Cresson, D.
Darses, J. Math. Phys. 48, 072703 (2007)], we study how the dynamics of the
classical Newton equation for a force deriving from a potential is deformed
under the assumption that this equation can admit stochastic processes as
solutions. We focus on two denitions of a stochastic Newton's equation called
dierential and variational. We rst prove a stochastic virial theorem which is a
natural generalization of the classical case. The stochasticity modies the
virial relation by adding a potential term called the induced potential which
corresponds in quantum mechanics to the Bohm potential. Moreover, the
dierential stochastic Newton equation naturally provides an action functional
which sat-ises a stochastic Hamilton-Jacobi equation. The real part of this
equation corresponds to the classical Hamilton-Jacobi equation with an extra
potential term corresponding to the induced potential already observed in the
stochastic virial theorem. The induced potential has an explicit form depending
on the density of the stochastic processes solutions of the stochastic Newton
equation. It is proved that this density satises a nonlinear Schr{\""o}dinger
equation. Applying this formalism for the Kepler potential, one proves that the
induced potential coincides with the ad-hoc ''dark potential'' used to recover
a at rotation curve of spiral galaxies. We then discuss the application of the
previous formalism in the context of spiral galaxies following the proposal and
computations given by [D. Da Rocha and L. Nottale, Chaos, Solitons and
Fractals, 16(4):565-595, 2003] where the emergence of the ''dark potential'' is
seen as a consequence of the fractality of space in the context of the Scale
relativity theory.
","[{""version"":""v1"",""created"":""Mon, 16 Nov 2020 10:30:31 GMT""}]","2021-07-21"
"2011.07844","Masao Ogata","Hidetoshi Fukuyama and Masao Ogata","Theory of Phason Drag Effect on Thermoelectricity","28 pages, 5 figures",,"10.1103/PhysRevB.102.205136",,"cond-mat.mtrl-sci cond-mat.str-el","http://creativecommons.org/licenses/by/4.0/","  Lee, Rice and Anderson, in their monumental paper, have proved the existence
of a collective mode describing the coupled motion of electron density and
phonons in one-dimensional incommensurate charge density wave (CDW) in the
Peierls state. This mode, which represents the coherent sliding motion of
electrons and lattice distortions and affects low energy transport properties,
is described by the phase of the complex order parameter of the Peierls
condensate, leading to Fr\""ohlich superconductivity in pure systems. Once
spatial disorder is present, however, phason is pinned and system is
transformed into an insulating ground state: a dramatic change. Since phason
can be considered as an ultimate of phonon drag effect, it is of interest to
see its effects on thermoelectricity, which has been studied in the present
paper based linear response theory of Kubo and Luttinger. The result indicates
that a large absolute value of Seebeck coefficient proportional to the square
root of resistivity is expected at low temperatures k_B T/\Delta <<1 (\Delta:
Peierls gap) with opposite sign to the electronic contributions in the absence
of Peierls gap.
","[{""version"":""v1"",""created"":""Mon, 16 Nov 2020 10:30:32 GMT""}]","2020-12-30"
"2011.07845","Atanu Betal","Atanu Betal, Jayanta Bera, Satyajit Sahu","Excellent Thermoelectric and Piezoelectric Properties of Differently
  Stacked Layers of Two-Dimensional Transition Metal Dinitride HfN2",,,,,"cond-mat.mtrl-sci","http://creativecommons.org/licenses/by/4.0/","  Two-dimensional (2D) transition metal dinitride (HfN2) has been studied for
their optoelectronic, piezoelectric, and thermoelectric properties. Both
monolayer and bilayer of HfN2 were studied using density functional theory
(DFT) and Boltzmann transport equation (BTE). The bilayer of HfN2 with
different stacking layers (AA and AB) showed different electronic properties.
The optical property of the material suggests that it is a very good absorber
in the ultraviolet (UV) region thus, can be used as a UV-photodetector and as
an absorber layer in photovoltaic devices. The piezoelectric properties of the
material also showed promising behavior as the piezoelectric stress and strain
tensors have highest value of 8.97*(10)^(-10) C/m and 12.59 pm/V respectively
for the bilayer. The piezoelectric tensors have highest value for AB stacked
bilayer. The ZT value of 0.8 at 900 K is also highest for bilayer AB stacked
HfN2. These high values of piezoelectric and thermoelectric parameters of the
material suggest that the material would be an excellent choice as
thermoelectric energy harvesting devices as well as mechanical stress sensor or
actuator.
","[{""version"":""v1"",""created"":""Mon, 16 Nov 2020 10:31:35 GMT""}]","2020-11-17"
"2011.07846","Na Young Ahn","N. Y. Ahn, D.H. Lee","Secure Vehicle Communications Using Proof-of-Nonce Blockchain","6 pages, 4 figures, IEEE Communication Magazine (Submitted on Nov.
  16, 2020)",,,,"cs.SE cs.AI cs.DC","http://creativecommons.org/licenses/by/4.0/","  This paper presents an autonomous driving that achieves physical layer
security. Proposed vehicle communication is implemented based on Proof-of-Nonce
(PoN) blockchain algorithm. PoN blockchain algorithm is a consensus algorithm
that can be implemented in light weight. We propose a more secure vehicle
communication scheme while achieving physical layer security by defecting PoN
algorithm and secrecy capacity. By generating a block only when secrecy
capacity is greater than or equal to the reference value, traffic information
can be provided only to vehicles with physical layer security. This vehicle
communication scheme can secure sufficient safety even from hackers based on
quantum computing.
","[{""version"":""v1"",""created"":""Mon, 16 Nov 2020 10:31:42 GMT""}]","2020-11-17"
"2011.07847","Bhagwati Duggal Prashad","B.P. Duggal, I.H. Kim","Expansive operators which are power bounded or algebraic","14 pages",,,,"math.FA","http://creativecommons.org/licenses/by/4.0/","  Given Hilbert space operators $P,T\in B(\H), P\geq 0$ invertible, $T$ is
$(m,P)-$ expansive (resp., $(m,P)-$ isometric) for some positive integer $m$ if
$\triangle_{T^*,T}^m(P)=\sum_{j=0}^m(-1)^j\left(\begin{array}{clcr}m\\j\end{array}\right){T^*}^jPT^j\leq
0$ (resp., $\triangle_{T^*,T}^m(P)=0$). An $(m,P)-$ expansive operator $T$ is
power bounded if and only if it is a $C_{1\cdot}-$ operator which is similar to
an isometry and satisfies $\triangle_{T^*,T}^n(Q)=0$ for some positive
invertible operator $Q\in B(\H)$ and all integers $n\geq 1$. If, instead, $T$
is an algebraic $(m,I)-$ expansive operator, then either the spectral radius
$r(T)$ of $T$ is greater than one or $T$ is the perturbation of a unitary by a
nilpotent such that $T$ is $(2n-1, I)-$ isometric for some positive integers
$m_0 \leq m$, $m_0$ odd, and $n \geq \frac{m_0 +1}{2}$.
","[{""version"":""v1"",""created"":""Mon, 16 Nov 2020 10:32:21 GMT""}]","2020-11-17"
"2011.07848","Zhan-Dong Mei","Zhan-Dong Mei","Stabilization for a Flexible Beam with Tip Mass and Control Matched
  Disturbance","35 pages",,,,"math.OC","http://creativecommons.org/licenses/by/4.0/","  This paper is concerned with the output feedback exponential stabilization
for a flexible beam with tip mass. When there is no disturbance, it is shown
that only one non-collocated measurement is enough to exponentially stabilize
the original system by constructing an infinite-dimensional Luenberger state
observer to track the state and designing an estimated state based output
feedback control law. This essentially improves the existence result in [F.
Conrad and O. M\""{o}rg\""{u}l, SIAM J. Control Optim., 36 (1998), 1962-1986]
where two collocated measurements including high order feedback were adopted.
In the case that boundary internal uncertainty and external disturbance are
considered, an infinite-dimensional disturbance estimator is constructed to
estimate the state and total disturbance in real time. By virtue of the
estimated state and estimated total disturbance, an output feedback control law
is designed to exponentially stabilize the original system while guaranteeing
the boundedness of the closed-loop system. Some illustration simulations are
presented.
","[{""version"":""v1"",""created"":""Mon, 16 Nov 2020 10:32:26 GMT""},{""version"":""v2"",""created"":""Tue, 17 Nov 2020 09:22:12 GMT""},{""version"":""v3"",""created"":""Mon, 11 Apr 2022 03:12:53 GMT""}]","2022-04-12"
"2011.07849","Hubert Klahr","Hubert Klahr and Andreas Schreiber","Testing the Jeans, Toomre and Bonnor-Ebert concepts for planetesimal
  formation: 3D streaming instability simulations of diffusion regulated
  formation of planetesimals","28 pages, 7 figures, ApJ in press (updated citation list and minus
  some typos)",,"10.3847/1538-4357/abca9b",,"astro-ph.EP","http://arxiv.org/licenses/nonexclusive-distrib/1.0/","  We perform streaming instability simulations at Hill density and beyond, to
demonstrate that Planetesimal formation is not completed when pebble
accumulations exceed the local Hill density. We find that Hill density is not a
sufficient criterion for further gravitational collapse of a pebble cloud into
a planetesimal, but that additionally the accumulated mass has to be large
enough to overcome turbulent diffusion. A Toomre analysis of the system
indicates that linear self-gravity modes play no role on the scale of our
numerical simulation. We nevertheless find that self-gravity, by vertically
contracting the pebble layer, increases the strength of turbulence, which is
either an indication of Kelvin Helmholtz Instability or a boost of the
streaming-instability. We furthermore determine the Bonnor-Ebert central
density to which a pebble cloud of given mass has to be compressed before it
would be able to continue contraction against internal diffusion. As the
equivalent ""solid body"" size of the pebble cloud scales with the central
density to the power of -1/6, it is much easier to have a pebble cloud of 100
km equivalent size to collapse than one of 10 km for the same level of
turbulent diffusion. This can explain the lack of small bodies in the solar
system and predicts to have small objects formed by gravitational collapse at
large pebble to gas ratios, in the outskirts of the solar nebula and at late
times of generally reduced gas mass.
","[{""version"":""v1"",""created"":""Mon, 16 Nov 2020 10:36:02 GMT""},{""version"":""v2"",""created"":""Thu, 19 Nov 2020 17:52:24 GMT""}]","2021-04-14"
