"2011.07696","Xuanzhong Dai","Xuanzhong Dai","Chiral de Rham complex on the upper half plane and modular forms",,,,,"math.QA","http://arxiv.org/licenses/nonexclusive-distrib/1.0/","  For any congruence subgroup $\Gamma$, we study the vertex operator algebra
$\Omega^{ch}(\mathbb H,\Gamma)$ constructed from the $\Gamma$-invariant global
sections of the chiral de Rham complex on the upper half plane, which are
holomorphic at all the cusps. We introduce an $SL(2,\mathbb R)$-invariant
filtration on the global sections and show that the $\Gamma$-invariants on the
graded algebra is isomorphic to certain copies of modular forms. We also give
an explicit formula for the lifting of modular forms to $\Omega^{ch}(\mathbb
H,\Gamma)$ and compute the character formula of $\Omega^{ch}(\mathbb
H,\Gamma)$. Furthermore, we show that the vertex algebra structure modifies the
Rankin-Cohen bracket, and the modified bracket becomes non-zero between
constant modular forms involving the Eisenstein series.
","[{""version"":""v1"",""created"":""Mon, 16 Nov 2020 02:43:32 GMT""}]","2020-11-17"
"2011.07697","MaungMaung AprilPyone","MaungMaung AprilPyone and Hitoshi Kiya","Ensemble of Models Trained by Key-based Transformed Images for
  Adversarially Robust Defense Against Black-box Attacks","Under review",,,,"cs.CV","http://arxiv.org/licenses/nonexclusive-distrib/1.0/","  We propose a voting ensemble of models trained by using block-wise
transformed images with secret keys for an adversarially robust defense.
Key-based adversarial defenses were demonstrated to outperform state-of-the-art
defenses against gradient-based (white-box) attacks. However, the key-based
defenses are not effective enough against gradient-free (black-box) attacks
without requiring any secret keys. Accordingly, we aim to enhance robustness
against black-box attacks by using a voting ensemble of models. In the proposed
ensemble, a number of models are trained by using images transformed with
different keys and block sizes, and then a voting ensemble is applied to the
models. In image classification experiments, the proposed defense is
demonstrated to defend state-of-the-art attacks. The proposed defense achieves
a clean accuracy of 95.56 % and an attack success rate of less than 9 % under
attacks with a noise distance of 8/255 on the CIFAR-10 dataset.
","[{""version"":""v1"",""created"":""Mon, 16 Nov 2020 02:48:37 GMT""}]","2020-11-17"
"2011.07698","Yadong Wu","Yadong Wu, Pengfei Zhang, and Hui Zhai","Scrambling Ability of Quantum Neural Networks Architectures",,"Phys. Rev. Research 3, 032057 (2021)","10.1103/PhysRevResearch.3.L032057",,"cond-mat.dis-nn quant-ph","http://creativecommons.org/licenses/by/4.0/","  In this letter we propose a general principle for how to build up a quantum
neural network with high learning efficiency. Our stratagem is based on the
equivalence between extracting information from input state to readout qubit
and scrambling information from the readout qubit to input qubits. We
characterize the quantum information scrambling by operator size growth, and by
Haar random averaging over operator sizes, we propose an averaged operator size
to describe the information scrambling ability for a given quantum neural
network architectures, and argue this quantity is positively correlated with
the learning efficiency of this architecture. As examples, we compute the
averaged operator size for several different architectures, and we also
consider two typical learning tasks, which are a regression task of a quantum
problem and a classification task on classical images, respectively. In both
cases, we find that, for the architecture with a larger averaged operator size,
the loss function decreases faster or the prediction accuracy in the testing
dataset increases faster as the training epoch increases, which means higher
learning efficiency. Our results can be generalized to more complicated quantum
versions of machine learning algorithms.
","[{""version"":""v1"",""created"":""Mon, 16 Nov 2020 02:50:37 GMT""}]","2021-09-08"
"2011.07699","Dhanoop Karunakaran","Dhanoop Karunakaran, Stewart Worrall, Eduardo Nebot","Efficient falsification approach for autonomous vehicle validation using
  a parameter optimisation technique based on reinforcement learning","Submitted to IEEE Transactions on Intelligent Transportation Systems",,,,"cs.RO cs.AI","http://creativecommons.org/licenses/by/4.0/","  The widescale deployment of Autonomous Vehicles (AV) appears to be imminent
despite many safety challenges that are yet to be resolved. It is well-known
that there are no universally agreed Verification and Validation (VV)
methodologies guarantee absolute safety, which is crucial for the acceptance of
this technology. The uncertainties in the behaviour of the traffic participants
and the dynamic world cause stochastic reactions in advanced autonomous
systems. The addition of ML algorithms and probabilistic techniques adds
significant complexity to the process for real-world testing when compared to
traditional methods. Most research in this area focuses on generating
challenging concrete scenarios or test cases to evaluate the system performance
by looking at the frequency distribution of extracted parameters as collected
from the real-world data. These approaches generally employ Monte-Carlo
simulation and importance sampling to generate critical cases. This paper
presents an efficient falsification method to evaluate the System Under Test.
The approach is based on a parameter optimisation problem to search for
challenging scenarios. The optimisation process aims at finding the challenging
case that has maximum return. The method applies policy-gradient reinforcement
learning algorithm to enable the learning. The riskiness of the scenario is
measured by the well established RSS safety metric, euclidean distance, and
instance of a collision. We demonstrate that by using the proposed method, we
can more efficiently search for challenging scenarios which could cause the
system to fail in order to satisfy the safety requirements.
","[{""version"":""v1"",""created"":""Mon, 16 Nov 2020 02:56:13 GMT""}]","2020-11-17"
"2011.07700","Brett McInnes","Brett McInnes","About Magnetic AdS Black Holes","21 pages, 7 figures; typos fixed, references added",,,,"gr-qc hep-th","http://arxiv.org/licenses/nonexclusive-distrib/1.0/","  There has recently been a strong revival of interest in quasi-extremal
magnetically charged black holes. In the asymptotically flat case, it is
possible to choose the magnetic charge of such an object in such a manner that
the black hole is surrounded by a corona in which electroweak symmetry is
restored on macroscopic scales, a result of very considerable interest. We
argue that holographic duality indicates that the asymptotically AdS analogues
of these black holes have several interesting properties: the dual theory is
only physical if the black hole is required to rotate; in the rotating case,
the magnetic field at the poles does not attain its maximum on the event
horizon, but rather somewhat outside it; the magnetic field at the equator is
not a monotonically decreasing function of the magnetic charge; the electric
fields induced by the rotation, while smaller than their magnetic counterparts,
are by no means negligible; the maximal electric field often occurs neither at
the poles nor at the equator; and so on. Most importantly, in the magnetically
charged case it is possible to avoid the superradiant instability to which
neutral AdS-Kerr black holes are subject; but the need to avoid this
instability imposes upper bounds on the magnetic and electric fields. In some
circumstances, therefore, the corona may not exist in the asymptotically AdS
case.
","[{""version"":""v1"",""created"":""Mon, 16 Nov 2020 02:57:12 GMT""},{""version"":""v2"",""created"":""Tue, 24 Nov 2020 03:37:33 GMT""}]","2020-12-09"
"2011.07701","Jiaxin Yin","J.-X. Yin, Y. Y. Zhao, Zheng Wu, X. X. Wu, A. Kreisel, B. M. Andersen,
  Gennevieve Macam, Sen Zhou, Rui Wu, Limin Liu, Hanbin Deng, Changjiang Zhu,
  Yuan Li, Yingkai Sun, Zhi-Quan Huang, Feng-Chuan Chuang, Hsin Lin, C. -S.
  Ting, J. -P. Hu, Z. Q. Wang, P. C. Dai, H. Ding, S. H. Pan","Role of anion in the pairing interaction of iron-based superconductivity",,,,,"cond-mat.supr-con cond-mat.mtrl-sci","http://creativecommons.org/licenses/by/4.0/","  High-temperature iron-based superconductivity develops in a structure with
unusual lattice-orbital geometry, based on a planar layer of Fe atoms with 3d
orbitals and tetrahedrally coordinated by anions. Here we elucidate the
electronic role of anions in the iron-based superconductors utilizing
state-of-the-art scanning tunneling microscopy. By measuring the local
electronic structure, we find that As anion in Ba0.4K0.6Fe2As2 has a striking
impact on the electron pairing. The superconducting electronic feature can be
switched off/on by removing/restoring As atoms on Fe layer at the atomic scale.
Our analysis shows that this remarkable atomic switch effect is related to the
geometrical cooperation between anion mediated hopping and unconventional
pairing interaction. Our results uncover that the local Fe-anion coupling is
fundamental for the pairing interaction of iron-based superconductivity, and
promise the potential of bottom-up engineering of electron pairing.
","[{""version"":""v1"",""created"":""Mon, 16 Nov 2020 03:09:52 GMT""}]","2020-11-17"
"2011.07702","Clio Andris","Joshua Baker, Clio Andris, Daniel DellaPosta","Spatial Social Network (SSN) Hot Spot Detection: Scan Methods for
  Non-Planar Networks",,,,,"cs.SI","http://creativecommons.org/licenses/by/4.0/","  Moving window and hot spot detection analyses are statistical methods used to
analyze point patterns within a given area. Such methods have been used to
successfully detect clusters of point events such as car thefts or incidences
of cancer. Yet, these methods do not account for the connections between
individual events, such as social ties within a neighborhood. This paper
presents two GIS methods, EdgeScan and NDScan, for capturing areas with high
and low levels of local social connections. Both methods are moving window
processes that count the number of edges and network density, respectively, in
a given focal area (window area). The focal window attaches resultant EdgeScan
and NDScan statistics to nodes at the center of the focal window area.
  We implement these methods on a case study of 1960s connections between
members of the Mafia in New York City. We use various definitions of a focal
neighborhood including Euclidean, Manhattan and K Nearest Neighbor (KNN)
definitions. We find that KNN tends to overstate the values of local networks,
and that there is more variation in outcome values for nodes on the periphery
of the study area. We find that, location-wise, EdgeScan and NDScan hot spots
differ from traditional spatial hot spots in the study area. These methods can
be extended to future studies that detect local triads and motifs, which can
capture the local network structure in more detail.
","[{""version"":""v1"",""created"":""Mon, 16 Nov 2020 03:19:31 GMT""}]","2020-11-17"
"2011.07703","Manil T Mohan","Manil T. Mohan","Wentzell-Freidlin Large Deviation Principle for the stochastic
  convective Brinkman-Forchheimer equations",,,"10.1007/s00021-021-00587-x",,"math.PR","http://arxiv.org/licenses/nonexclusive-distrib/1.0/","  This work addresses some asymptotic behavior of solutions to the stochastic
convective Brinkman-Forchheimer (SCBF) equations perturbed by multiplicative
Gaussian noise in bounded domains. Using a weak convergence approach of
Budhiraja and Dupuis, we establish the Laplace principle for the strong
solution to the SCBF equations in a suitable Polish space. Then, the
Wentzell-Freidlin large deviation principle is derived using the well known
results of Varadhan and Bryc. The large deviations for short time are also
considered in this work. Furthermore, we study the exponential estimates on
certain exit times associated with the solution trajectory of the SCBF
equations. Using contraction principle, we study these exponential estimates of
exit times from the frame of reference of Freidlin-Wentzell type large
deviations principle. This work also improves several LDP results available in
the literature for the tamed Navier-Stokes equations as well as Navier-Stokes
equations with damping in bounded domains.
","[{""version"":""v1"",""created"":""Mon, 16 Nov 2020 03:25:31 GMT""}]","2021-06-02"
"2011.07704","Peng Gao","Peng Gao, Rui Guo, Hongsheng Lu and Hao Zhang","Multi-view Sensor Fusion by Integrating Model-based Estimation and Graph
  Learning for Collaborative Object Localization","Revise several typos and change the Fig2 to be more illustrative",,,,"cs.CV cs.RO","http://arxiv.org/licenses/nonexclusive-distrib/1.0/","  Collaborative object localization aims to collaboratively estimate locations
of objects observed from multiple views or perspectives, which is a critical
ability for multi-agent systems such as connected vehicles. To enable
collaborative localization, several model-based state estimation and
learning-based localization methods have been developed. Given their
encouraging performance, model-based state estimation often lacks the ability
to model the complex relationships among multiple objects, while learning-based
methods are typically not able to fuse the observations from an arbitrary
number of views and cannot well model uncertainty. In this paper, we introduce
a novel spatiotemporal graph filter approach that integrates graph learning and
model-based estimation to perform multi-view sensor fusion for collaborative
object localization. Our approach models complex object relationships using a
new spatiotemporal graph representation and fuses multi-view observations in a
Bayesian fashion to improve location estimation under uncertainty. We evaluate
our approach in the applications of connected autonomous driving and multiple
pedestrian localization. Experimental results show that our approach
outperforms previous techniques and achieves the state-of-the-art performance
on collaboration localization.
","[{""version"":""v1"",""created"":""Mon, 16 Nov 2020 03:33:28 GMT""},{""version"":""v2"",""created"":""Sun, 7 Mar 2021 01:31:36 GMT""}]","2021-03-09"
"2011.07705","Kyungmin Lee","Kyungmin Lee, Jihoon Choi, Ricardo Tanaus\'u G\'enova-Santos, Makoto
  Hattori, Masashi Hazumi, Shunsuke Honda, Takuji Ikemitsu, Hidesato Ishida,
  Hikaru Ishitsuka, Yonggil Jo, Kenichi Karatsu, Kenji Kiuchi, Junta Komine,
  Ryo Koyano, Hiroki Kutsuma, Satoru Mima, Makoto Minowa, Joonhyeok Moon,
  Makoto Nagai, Taketo Nagasaki, Masato Naruse, Shugo Oguri, Chiko Otani,
  Michael Peel, Rafael Rebolo, Jos\'e Alberto Rubi\~no-Mart\'in, Yutaro
  Sekimoto, Junya Suzuki, Tohru Taino, Osamu Tajima, Nozomu Tomita, Tomohisa
  Uchida, Eunil Won, Mitsuhiro Yoshida","GroundBIRD : A CMB polarization experiment with MKID arrays","7 pages, 5 figures, LTD18 proceeding, Published in JLTP","J Low Temp Phys 200, 384 (2020)","10.1007/s10909-020-02511-5",,"astro-ph.IM astro-ph.CO","http://creativecommons.org/licenses/by/4.0/","  GroundBIRD is a ground-based experiment for the precise observation of the
polarization of the cosmic microwave background (CMB). To achieve high
sensitivity at large angular scale, we adopt three features in this experiment:
fast rotation scanning, microwave kinetic inductance detector (MKID) and cold
optics. The rotation scanning strategy has the advantage to suppress $1/f$
noise. It also provides a large sky coverage of 40\%, which corresponds to the
large angular scales of $l \sim 6$. This allows us to constrain the
tensor-to-scalar ratio by using low $l$ B-mode spectrum. The focal plane
consists of 7 MKID arrays for two target frequencies, 145 GHz and 220 GHz band.
There are 161 pixels in total, of which 138 are for 144 GHz and 23 are for 220
GHz. This array is currently under development and the prototype will soon be
evaluated in telescope. The GroundBIRD telescope will observe the CMB at the
Teide observatory. The telescope was moved from Japan to Tenerife and is now
under test. We present the status and plan of the GroundBIRD experiment.
","[{""version"":""v1"",""created"":""Mon, 16 Nov 2020 03:35:10 GMT""}]","2020-11-17"
"2011.07706","Seungkyu Lee","Gahye Lee and Seungkyu Lee","Mode Penalty Generative Adversarial Network with adapted Auto-encoder",,,,,"cs.LG cs.CV eess.IV","http://arxiv.org/licenses/nonexclusive-distrib/1.0/","  Generative Adversarial Networks (GAN) are trained to generate sample images
of interest distribution. To this end, generator network of GAN learns implicit
distribution of real data set from the classification with candidate generated
samples. Recently, various GANs have suggested novel ideas for stable
optimizing of its networks. However, in real implementation, sometimes they
still represent a only narrow part of true distribution or fail to converge. We
assume this ill posed problem comes from poor gradient from objective function
of discriminator, which easily trap the generator in a bad situation. To
address this problem, we propose a mode penalty GAN combined with pre-trained
auto encoder for explicit representation of generated and real data samples in
the encoded space. In this space, we make a generator manifold to follow a real
manifold by finding entire modes of target distribution. In addition, penalty
for uncovered modes of target distribution is given to the generator which
encourages it to find overall target distribution. We demonstrate that applying
the proposed method to GANs helps generator's optimization becoming more stable
and having faster convergence through experimental evaluations.
","[{""version"":""v1"",""created"":""Mon, 16 Nov 2020 03:39:53 GMT""}]","2020-11-17"
"2011.07707","Yue Hu","Yue Hu, Shouhang Li, Hua Bao","First-principles based analysis of thermal transport in metallic
  nanostructures: size effect and Wiedemann-Franz law","22 pages, 9 figures","Phys. Rev. B 103, 104301 (2021)","10.1103/PhysRevB.103.104301",,"cond-mat.mes-hall","http://creativecommons.org/licenses/by/4.0/","  Metallic nanostructures (the nanofilms and nanowires) are widely used in
electronic devices, and their thermal transport properties are crucial for heat
dissipation. However, there are still gaps in understanding thermal transport
in metallic nanostructures, especially regarding the size effect and validity
of the Wiedemann-Franz law. In this work, we perform mode-by-mode
first-principles calculations combining the Boltzmann transport equation to
understand thermal transport in metallic nanostructures. We take the gold (Au)
and tungsten (W) nanostructures as prototypes. It is found that when the size
of nanostructures is on the order of several tens of nanometers, the
electronic/phonon thermal conductivity is smaller than the bulk value and
decreases with size. The phonon contribution increases in nanostructures for
those metals with small bulk phonon thermal conductivity (like Au), while the
phonon contribution may increase or be suppressed in nanostructures for those
metals with large bulk phonon thermal conductivity (like W). By assuming that
the grain boundary does not induce inelastic electron-phonon scattering, the
Wiedemann-Franz law works well in both Au and W nanostructures if the Lorentz
ratio is estimated using electronic thermal conductivity. The Wiedemann-Franz
law also works well in Au nanostructures when the Lorentz ratio is estimated by
total thermal conductivity.
","[{""version"":""v1"",""created"":""Mon, 16 Nov 2020 03:54:05 GMT""}]","2021-03-17"
"2011.07708","Nha Xuan Truong","Nha Xuan Truong","An explicit computation of the Hecke operator and the ghost conjecture","24 pages",,"10.1007/s40993-023-00447-9",,"math.NT","http://creativecommons.org/licenses/by-sa/4.0/","  In this paper, we investigate the Hecke operator at p = 5 and show that the
upper minors of the matrix have non zero corank and, interestingly, follow the
same ghost pattern in the Ghost conjecture of Bergdall and Pollack. Due to this
facts, we conjecture that the slope of Hecke action in this case can be
computed using an appropriate variant of ghost series. Assume this result, we
achieve an upper bound for the slopes that is similar to the Gouvea's
(k-1)/(p+1) conjecture.
","[{""version"":""v1"",""created"":""Mon, 16 Nov 2020 03:57:43 GMT""},{""version"":""v2"",""created"":""Sun, 24 Oct 2021 01:37:14 GMT""},{""version"":""v3"",""created"":""Tue, 16 May 2023 23:47:24 GMT""}]","2023-05-18"
"2011.07709","Buyang Li","Buyang Li and Shu Ma","A high-order exponential integrator for nonlinear parabolic equations
  with nonsmooth initial data",,,,,"math.NA cs.NA","http://arxiv.org/licenses/nonexclusive-distrib/1.0/","  A variable stepsize exponential multistep integrator, with contour integral
approximation of the operator-valued exponential functions, is proposed for
solving semilinear parabolic equations with nonsmooth initial data. By this
approach, the exponential k-step method would have $k$th-order convergence in
approximating a mild solution, possibly nonsmooth at the initial time. In
consistency with the theoretical analysis, a numerical example shows that the
method can achieve high-order convergence in the maximum norm for semilinear
parabolic equations with discontinuous initial data.
","[{""version"":""v1"",""created"":""Mon, 16 Nov 2020 03:59:38 GMT""}]","2020-11-17"
"2011.07710","Anthony Torres","A. Torres-Hernandez, F. Brambila-Paz, C. A. Torres-Mart\'inez","Numerical solution using radial basis functions for multidimensional
  fractional partial differential equations of type Black-Scholes",,"Computational and Applied Mathematics, 40, 245, 2021","10.1007/s40314-021-01634-z",,"math.NA cs.NA math.AP math.FA physics.comp-ph","http://creativecommons.org/licenses/by-nc-nd/4.0/","  The aim of this paper is to solve numerically, using the meshless method via
radial basis functions, time-space-fractional partial differential equations of
type Black-Scholes. The time-fractional partial differential equation appears
in several diffusion problems used in physics and engineering applications, and
models subdiffusive and superdiffusive behavior of the prices at the stock
market. This work shows the flexibility of the radial basis function scheme to
solve multidimensional problems with several types of nodes and it also shows
how to reduce the condition number of the matrices involved.
","[{""version"":""v1"",""created"":""Mon, 16 Nov 2020 03:59:51 GMT""},{""version"":""v2"",""created"":""Sun, 22 Nov 2020 20:55:51 GMT""},{""version"":""v3"",""created"":""Sun, 13 Dec 2020 19:17:03 GMT""}]","2021-10-27"
"2011.07711","Yong-Hyun Lee","Yong-Hyun Lee, Bon-Chul Koo, Jae-Joon Lee","High-resolution Near-infrared Spectroscopic Study of Galactic Supernova
  Remnants. I. Kinematic Distances","50 pages, 15 figures, 2 tables; accepted in AJ on 2020 Oct. 9",,"10.3847/1538-3881/abc00e",,"astro-ph.GA","http://creativecommons.org/licenses/by/4.0/","  We have carried out high-resolution near-infrared spectroscopic observations
toward 16 Galactic supernova remnants (SNRs) showing strong H$_{2}$ emission
features. A dozen bright H$_{2}$ emission lines are clearly detected for
individual SNRs, and we have measured their central velocities, line widths,
and fluxes. For all SNRs except one (G9.9$-$0.8), the H$_{2}$ line ratios are
well consistent with that of thermal excitation at $T\sim2000$ K, indicating
that the H$_{2}$ emission lines are most likely from shock-excited gas and
therefore that they are physically associated with the remnants. The kinematic
distances to the 15 SNRs are derived from the central velocities of the H$_{2}$
lines using a Galactic rotation model. We derive for the first time the
kinematic distances to four SNRs: G13.5$+$0.2, G16.0$-$0.5, G32.1$-$0.9, and
G33.2$-$0.6. Among the remaining 11 SNRs, the central velocities of the H$_{2}$
emission lines for six SNRs are well consistent ($\pm5$ km s$^{-1}$) with those
obtained in previous radio observations, while for the other five SNRs
(G18.1$-$0.1, G18.9$-$1.1, Kes 69, 3C 396, W49B) they are significantly
different. We discuss the velocity discrepancies in these five SNRs. In
G9.9$-$0.8, the H$_{2}$ emission shows nonthermal line ratios and narrow line
width ($\sim 4$ km s$^{-1}$), and we discuss its origin.
","[{""version"":""v1"",""created"":""Mon, 16 Nov 2020 04:01:42 GMT""}]","2020-11-25"
