"2011.07942","Marco Calviani","Stefano Pianese, Antonio Perillo-Marcone, Fran\c{c}ois-Xavier Nuiry,
  Marco Calviani, Krzysztof Adam Szczurek, Gonzalo Arnau Izquierdo, Pietro
  Avigni, Simon Bonnin, Josep Busom Descarrega, Thierry Feniet, Keith Kershaw,
  Jerome Lendaro, Ana Teresa Perez Fontenla, Thomas Schubert, Thomas
  Weissg\""arber","Hot Isostatic Pressing (HIP) assisted diffusion bonding between CuCr1Zr
  and AISI 316L for application to the Super Proton Synchrotron (SPS) internal
  beam dump at CERN","11 pages, 21 figures, 5 tables","Phys. Rev. Accel. Beams 24, 043001 (2021)","10.1103/PhysRevAccelBeams.24.043001",,"physics.ins-det","http://creativecommons.org/licenses/by/4.0/","  The new generation internal beam dump of the Super Proton Synchrotron (SPS)
at CERN will have to dissipate approximately 270 kW of thermal power, deposited
by the primary proton beam. For this purpose, it is essential that the cooling
system features a very efficient heat evacuation. Diffusion bonding assisted by
Hot Isostatic Pressing (HIP) was identified as a promising method of joining
the cooling circuits and the materials of the dump's core in order to maximise
the heat transfer efficiency. This paper presents the investigation of HIP
assisted diffusion bonding between two CuCr1Zr blanks enclosing SS 316L tubes
and the realisation of a real size prototype of one of the dump's cooling
plate, as well as the assessments of its cooling performance under the dumps
most critical operational scenarios. Energy-dispersive X-ray (EDX)
spectroscopy, microstructural analyses, measurements of thermal conductivity
and mechanical strength were performed to characterize the HIP diffusion bonded
interfaces (CuCr1Zr-CuCr1Zr and CuCr1Zr-SS316L). A test bench allowed to assess
the cooling performance of the real size prototype. At the bonded interface,
the presence of typical diffusional phenomena was observed. Moreover, measured
tensile strength and thermal conductivity were at least equivalent to the
lowest ones of the materials assembled and comparable to its bulk properties,
meaning that a good bonding quality was achieved. Finally, the real size
prototype was successfully tested with an ad-hoc thermal test bench and with
the highest operational thermal power expected in the new generation SPS
internal beam dump.
","[{""version"":""v1"",""created"":""Mon, 16 Nov 2020 13:41:09 GMT""}]","2021-04-21"
"2011.07943","Thomas Secker","T. Secker, J.-L. Li, P. M. A. Mestrom and S. J. J. M. F. Kokkelmans","The multichannel nature of three-body recombination for ultracold
  $^{39}$K",,"Phys. Rev. A 103, 022825 (2021)","10.1103/PhysRevA.103.022825",,"cond-mat.quant-gas","http://arxiv.org/licenses/nonexclusive-distrib/1.0/","  We develop a full multichannel spin model in momentum space to investigate
three-body recombination of identical alkali-metal atoms colliding in a
magnetic field. The model combines the exact three-atom spin structure and
realistic pairwise atom-atom interactions. By neglecting the interaction
between two particles when the spectating particle is not in its initial spin
state we arrive at an approximate model. With this approximate model we achieve
excellent agreement with the recent precise measurement of the ground Efimov
resonance position in potassium-39 close to 33.58 G [Chapurin $et$ $al$., Phys.
Rev. Lett. 123, 233402 (2019)]. We analyze the limitations of our approximation
by comparing to the numerical results for the full system and find that it
breaks down for Feshbach resonances at larger magnetic fields in the same spin
channel. There the relevant three-body closed channel thresholds are much
closer to the open channel threshold, which enhances the corresponding
multichannel couplings. Therefore the neglected components of the interaction
should be included for those Feshbach resonances.
","[{""version"":""v1"",""created"":""Mon, 16 Nov 2020 13:41:27 GMT""}]","2021-02-24"
"2011.07944","Aninda Sinha","Anjishnu Bose, Aninda Sinha, Shaswat S Tiwari","Selection rules for the S-Matrix bootstrap","v2: 26 pages, 14 figures, added discussion on line of minimum
  averaged total cross section. Submission to SciPost","SciPost Phys. 10, 122 (2021)","10.21468/SciPostPhys.10.5.122",,"hep-th hep-ph","http://arxiv.org/licenses/nonexclusive-distrib/1.0/","  We examine the space of allowed S-matrices on the Adler zeros' plane using
the recently resurrected (numerical) S-matrix bootstrap program for pion
scattering. Two physical quantities, an averaged total scattering
cross-section, and an averaged entanglement power for the boundary S-matrices,
are studied. Emerging linearity in the leading Regge trajectory is correlated
with a reduction in both these quantities. We identify two potentially viable
regions where the S-matrices give decent agreement with low energy S- and
P-wave scattering lengths and have leading Regge trajectory compatible with
experiments. We also study the line of minimum averaged total cross section in
the Adler zeros' plane. The Lovelace-Shapiro model, which was a precursor to
modern string theory, is given by a straight line in the Adler zeros' plane
and, quite remarkably, we find that this line intersects the space of allowed
S-matrices near both these regions.
","[{""version"":""v1"",""created"":""Mon, 16 Nov 2020 13:41:49 GMT""},{""version"":""v2"",""created"":""Wed, 10 Mar 2021 07:26:26 GMT""}]","2021-06-02"
"2011.07951","Rebekka Garreis","Rebekka Garreis, Angelika Knothe, Chuyao Tong, Marius Eich, Carolin
  Gold, Kenji Watanabe, Takashi Taniguchi, Vladimir Fal'ko, Thomas Ihn, Klaus
  Ensslin, Annika Kurzmann","Shell Filling and Trigonal Warping in Graphene Quantum Dots","10 pages, 7 figures","Phys. Rev. Lett. 126, 147703 (2021)","10.1103/PhysRevLett.126.147703",,"cond-mat.mes-hall","http://arxiv.org/licenses/nonexclusive-distrib/1.0/","  Transport measurements through a few-electron circular quantum dot in bilayer
graphene display bunching of the conductance resonances in groups of four,
eight and twelve. This is in accordance with the spin and valley degeneracies
in bilayer graphene and an additional threefold 'minivalley degeneracy' caused
by trigonal warping. For small electron numbers, implying a small dot size and
a small displacement field, a two-dimensional s- and then a p-shell are
successively filled with four and eight electrons, respectively. For electron
numbers larger than twelve, as the dot size and the displacement field
increase, the single-particle ground state evolves into a three-fold degenerate
minivalley ground state. A transition between these regimes is observed in our
measurements and can be described by band-structure calculations. Measurements
in magnetic field confirm Hund's second rule for spin filling of the quantum
dot levels, emphasizing the importance of exchange interaction effects.
","[{""version"":""v1"",""created"":""Mon, 16 Nov 2020 13:46:00 GMT""},{""version"":""v2"",""created"":""Mon, 12 Apr 2021 15:11:46 GMT""}]","2021-04-13"
"2011.07955","Hieu Tran Dinh","Hieu Tran-Dinh, Sumit Gautam, Symeon Chatzinotas, Bjorn Ottersten","Throughput Maximization for Wireless Communication systems with
  Backscatter- and Cache-assisted UAV Technology","30 pages, 8 figures",,,,"cs.IT math.IT","http://creativecommons.org/licenses/by/4.0/","  Unmanned aerial vehicle (UAV) has been widely adopted in wireless systems due
to its flexibility, mobility, and agility. Nevertheless, a limited onboard
battery greatly hinders UAV to prolong the serving time from communication
tasks that need a high power consumption in active RF communications.
Fortunately, caching and backscatter communication (BackCom) are appealing
technology for energy efficient communication systems. This motivates us to
investigate a wireless communication network with backscatter- and
cache-assisted UAV technology. We assume a UAV with a cache memory is deployed
as a flying backscatter device (BD), term the UAV-enabled BD (UB), to relay the
source's signals to the destination. Besides, the UAV can harvest energy from
the source's RF signals and then utilizes it for backscattering information to
the destination. In this context, we aim to maximize the total throughput by
jointly optimizing the dynamic time splitting (DTS) ratio, backscatter
coefficient, and the UB's trajectory with caching capability at the UB
corresponding to linear energy harvesting (LEH) and non-linear energy
harvesting (NLEH) models. These formulations are troublesome to directly solve
since they are mixed-integer non-convex problems. To find solutions, we
decompose the original problem into three subproblems, whereas we first
optimize the DTS ratio for a given backscatter coefficient and UB's trajectory,
followed by the backscatter coefficient optimization for a given DTS ratio and
UB's trajectory, and the UB's trajectory is finally optimized for a given DTS
ratio and backscatter coefficient. Finally, the intensive numerical results
demonstrate that our proposed schemes achieve significant throughput gain in
comparison to the benchmark schemes.
","[{""version"":""v1"",""created"":""Mon, 16 Nov 2020 13:46:12 GMT""},{""version"":""v2"",""created"":""Tue, 17 Nov 2020 20:01:42 GMT""}]","2020-11-19"
"2011.07957","Markus Schr\""oder","Markus Schr\""oder, Michael Schulze, Christian Jilek, Andreas Dengel","Bridging the Technology Gap Between Industry and Semantic Web:
  Generating Databases and Server Code From RDF","9 pages, accepted at ICAART 2021","Proceedings of the 13th International Conference on Agents and
  Artificial Intelligence (ICAART 2021), Online Streaming, February 4-6, Vol.
  2, pp. 507-514, SciTePress, 2021","10.5220/0010186005070514",,"cs.DB","http://arxiv.org/licenses/nonexclusive-distrib/1.0/","  Despite great advances in the area of Semantic Web, industry rather seldom
adopts Semantic Web technologies and their storage and query concepts. Instead,
relational databases (RDB) are often deployed to store business-critical data,
which are accessed via REST interfaces. Yet, some enterprises would greatly
benefit from Semantic Web related datasets which are usually represented with
the Resource Description Framework (RDF). To bridge this technology gap, we
propose a fully automatic approach that generates suitable RDB models with REST
APIs to access them. In our evaluation, generated databases from different RDF
datasets are examined and compared. Our findings show that the databases
sufficiently reflect their counterparts while the API is able to reproduce
rather simple SPARQL queries. Potentials for improvements are identified, for
example, the reduction of data redundancies in generated databases.
","[{""version"":""v1"",""created"":""Mon, 16 Nov 2020 13:50:43 GMT""}]","2021-08-02"
"2011.07958","Beijia Zhou","Beijia Zhou","Iteration Formulae for Brake Orbit and Index Inequalities for Real
  Pseudoholomorphic Curves",,,,,"math.SG","http://creativecommons.org/licenses/by/4.0/","  I give precise iteration formulae for brake orbit in dimension 3 and use
these formulae to get some index inequalities for moduli spaces of Real
pseudoholomorphic Curves, which are important to establish Real embedded
contact homology and Real cylindrical contact homology in dimension 3.
","[{""version"":""v1"",""created"":""Mon, 16 Nov 2020 13:51:33 GMT""}]","2020-11-17"
"2011.07965","Jonathan Will","Jonathan Will, Jonathan Bader, Lauritz Thamsen","Towards Collaborative Optimization of Cluster Configurations for
  Distributed Dataflow Jobs","6 pages, 7 figures, 1 table; Associated experiment results:
  https://github.com/dos-group/c3o-experiments ; Appearence in the Proceedings
  of the 2020 IEEE International Conference on Big Data (Big Data);
  Presentation at the 4th International Workshop on Benchmarking, Performance
  Tuning and Optimization for Big Data Applications (BPOD). IEEE. 2020","IEEE BigData (2020) 2851-2856","10.1109/BigData50022.2020.9377994",,"cs.DC","http://arxiv.org/licenses/nonexclusive-distrib/1.0/","  Analyzing large datasets with distributed dataflow systems requires the use
of clusters. Public cloud providers offer a large variety and quantity of
resources that can be used for such clusters. However, picking the appropriate
resources in both type and number can often be challenging, as the selected
configuration needs to match a distributed dataflow job's resource demands and
access patterns. A good cluster configuration avoids hardware bottlenecks and
maximizes resource utilization, avoiding costly overprovisioning.
  We propose a collaborative approach for finding optimal cluster
configurations based on sharing and learning from historical runtime data of
distributed dataflow jobs. Collaboratively shared data can be utilized to
predict runtimes of future job executions through the use of specialized
regression models. However, training prediction models on historical runtime
data that were produced by different users and in diverse contexts requires the
models to take these contexts into account.
","[{""version"":""v1"",""created"":""Mon, 16 Nov 2020 13:56:09 GMT""},{""version"":""v2"",""created"":""Tue, 27 Apr 2021 15:27:56 GMT""}]","2021-04-28"
"2011.07966","Denis Merigoux","Denis Merigoux (PROSECCO), Rapha\""el Monat (APR), Jonathan Protzenko
  (MSR)","A Modern Compiler for the French Tax Code",,,,,"cs.PL","http://arxiv.org/licenses/nonexclusive-distrib/1.0/","  In France, income tax is computed from taxpayers' individual returns, using
an algorithm that is authored, designed and maintained by the French Public
Finances Directorate (DGFiP). This algorithm relies on a legacy custom language
and compiler originally designed in 1990, which unlike French wine, did not age
well with time. Owing to the shortcomings of the input language and the
technical limitations of the compiler, the algorithm is proving harder and
harder to maintain, relying on ad-hoc behaviors and workarounds to implement
the most recent changes in tax law. Competence loss and aging code also mean
that the system does not benefit from any modern compiler techniques that would
increase confidence in the implementation. We overhaul this infrastructure and
present Mlang, an open-source compiler toolchain whose goal is to replace the
existing infrastructure. Mlang is based on a reverse-engineered formalization
of the DGFiP's system, and has been thoroughly validated against the private
DGFiP test suite. As such, Mlang has a formal semantics; eliminates previous
handwritten workarounds in C; compiles to modern languages (Python); and
enables a variety of instrumentations, providing deep insights about the
essence of French income tax computation. The DGFiP is now officially
transitioning to Mlang for their production system.
","[{""version"":""v1"",""created"":""Mon, 16 Nov 2020 13:57:00 GMT""},{""version"":""v2"",""created"":""Thu, 26 Nov 2020 10:53:30 GMT""},{""version"":""v3"",""created"":""Mon, 25 Jan 2021 10:19:30 GMT""}]","2021-01-26"
"2011.07967","Michele Focchi","Abdelrahman Abdallah, Michele Focchi, Romeo Orsolino and Claudio
  Semini","An Efficient Paradigm for Feasibility Guarantees in Legged Locomotion","18 pages, 16 figures, journal","IEEE TRANSACTIONS ON ROBOTICS, 2023","10.1109/TRO.2023.3280431",,"cs.RO cs.AI","http://creativecommons.org/licenses/by/4.0/","  Developing feasible body trajectories for legged systems on arbitrary
terrains is a challenging task. In this paper, we present a paradigm that
allows to design feasible Center of Mass (CoM) and body trajectories in an
efficient manner. In our previous work [1], we introduced the notion of the 2D
feasible region, where static balance and the satisfaction of joint torque
limits were guaranteed, whenever the projection of the CoM lied inside the
proposed admissible region. In this work we propose a general formulation of
the improved feasible region that guarantees dynamic balance alongside the
satisfaction of both joint-torque and kinematic limits in an efficient manner.
To incorporate the feasibility of the kinematic limits, we introduce an
algorithm that computes the reachable region of the CoM. Furthermore, we
propose an efficient planning strategy that utilizes the improved feasible
region to design feasible CoM and body orientation trajectories. Finally, we
validate the capabilities of the improved feasible region and the effectiveness
of the proposed planning strategy, using simulations and experiments on the 90
kg Hydraulically actuated Quadruped (HyQ) and the 21 kg Aliengo robots.
","[{""version"":""v1"",""created"":""Mon, 16 Nov 2020 13:58:33 GMT""},{""version"":""v2"",""created"":""Tue, 30 May 2023 21:38:42 GMT""}]","2023-06-01"
"2011.07968","Ricardo Melo Czekster","Ricardo M. Czekster","Tools for modelling and simulating the Smart Grid","16 pages, 1 table, 1 figure",,,,"cs.PF","http://creativecommons.org/licenses/by-nc-sa/4.0/","  The Smart Grid (SG) is a Cyber-Physical System (CPS) considered a critical
infrastructure divided into cyber (software) and physical (hardware)
counterparts that complement each other. It is responsible for timely power
provision wrapped by Information and Communication Technologies (ICT) for
handling bi-directional energy flows in electric power grids. Enacting control
and performance over the massive infrastructure of the SG requires convenient
analysis methods. Modelling and simulation (M&S) is a performance evaluation
technique used to study virtually any system by testing designs and
artificially creating 'what-if' scenarios for system reasoning and advanced
analysis. M&S avoids stressing the actual physical infrastructure and systems
in production by addressing the problem in a purely computational perspective.
Present work compiles a non-exhaustive list of tools for M&S of interest when
tackling SG capabilities. Our contribution is to delineate available options
for modellers when considering power systems in combination with ICT. We also
show the auxiliary tools and details of most relevant solutions pointing out
major features and combinations over the years.
","[{""version"":""v1"",""created"":""Mon, 16 Nov 2020 14:00:12 GMT""},{""version"":""v2"",""created"":""Tue, 17 Nov 2020 06:17:04 GMT""},{""version"":""v3"",""created"":""Thu, 19 Nov 2020 06:35:46 GMT""}]","2020-11-20"
"2011.07969","Zheng Zhou","Songxiao Li, Bing Tan and Zheng Zhou","Self-adaptive-type CQ algorithms for split equality problems",,,,,"math.FA cs.NA math.NA","http://creativecommons.org/licenses/by/4.0/","  The purpose of this paper is concerned with the approximate solution of split
equality problems. We introduce two types of algorithms and a new self-adaptive
stepsize without prior knowledge of operator norms. The corresponding strong
convergence theorems are obtained under mild conditions. Finally, some
numerical experiments demonstrate the efficiency of our results and compare
them with the existing results.
","[{""version"":""v1"",""created"":""Mon, 16 Nov 2020 14:01:44 GMT""}]","2020-11-17"
"2011.07970","Shiroman Prakash","Akalank Jain, Amolak Ratan Kalra, and Shiroman Prakash","A Normal Form for Single-Qudit Clifford+$T$ Operators","20 pages",,,,"quant-ph","http://arxiv.org/licenses/nonexclusive-distrib/1.0/","  We propose a normal form for single-qudit gates composed of Clifford and
$T$-gates for qudits of odd prime dimension $p\geq 5$. We prove that any
single-qudit Clifford+$T$ operator can be re-expressed in this normal form in
polynomial time. We also provide strong numerical evidence that this normal
form is unique. Assuming uniqueness, we are able to use this normal form to
provide an algorithm for exact synthesis of any single-qudit Clifford+$T$
operator with minimal $T$-count.
","[{""version"":""v1"",""created"":""Mon, 16 Nov 2020 14:03:07 GMT""}]","2020-11-17"
"2011.07971","Yasser Elmahalawy","Alexander A. Andrianov, Artem Starodubtsev and Yasser Elmahalawy","Quantum Analysis of BTZ Black Hole Formation Due to the Collapse of a
  Dust Shell","19 pages, 3 figures","Universe 2020, 6(11), 201","10.3390/universe6110201",,"gr-qc","http://creativecommons.org/licenses/by/4.0/","  We perform Hamiltonian reduction of a model in which 2+1 dimensional gravity
with negative cosmological constant is coupled to a cylindrically symmetric
dust shell. The resulting action contains only a finite number of degrees of
freedom. The phase space consists of two copies of $ADS^2$ -- both coordinate
and momentum space are curved. Different regions in the Penrose diagram can be
identified with different patches of $ADS^2$ momentum space. Quantization in
the momentum representation becomes particularly simple in the vicinity of the
horizon, where one can neglect momentum non-commutativity. In this region, we
calculate the spectrum of the shell radius. This spectrum turns out to be
continuous outside the horizon and becomes discrete inside the horizon with
eigenvalue spacing proportional to the square root of the black hole mass. We
also calculate numerically quantum transition amplitudes between different
regions of the Penrose diagram in the vicinity of the horizon. This calculation
shows a possibility of quantum tunneling of the shell into classically
forbidden regions of the Penrose diagram, although with an exponentially damped
rate away from the horizon.
","[{""version"":""v1"",""created"":""Mon, 16 Nov 2020 14:04:50 GMT""},{""version"":""v2"",""created"":""Wed, 18 Nov 2020 15:15:47 GMT""}]","2020-11-19"
"2011.07972","Petr \v{S}tibinger","Petr Stibinger, George Broughton, Filip Majer, Zdenek Rozsypalek,
  Anthony Wang, Kshitij Jindal, Alex Zhou, Dinesh Thakur, Giuseppe Loianno,
  Tomas Krajnik, Martin Saska","Mobile Manipulator for Autonomous Localization, Grasping and Precise
  Placement of Construction Material in a Semi-structured Environment","8 pages, 11 figures, submitted to IEEE ICRA and RA-L 2021, under
  review",,,,"cs.RO","http://creativecommons.org/licenses/by/4.0/","  Mobile manipulators have the potential to revolutionize modern agriculture,
logistics and manufacturing. In this work, we present the design of a
ground-based mobile manipulator for automated structure assembly. The proposed
system is capable of autonomous localization, grasping, transportation and
deployment of construction material in a semi-structured environment. Special
effort was put into making the system invariant to lighting changes, and not
reliant on external positioning systems. Therefore, the presented system is
self-contained and capable of operating in outdoor and indoor conditions alike.
Finally, we present means to extend the perceptive radius of the vehicle by
using it in cooperation with an autonomous drone, which provides aerial
reconnaissance. Performance of the proposed system has been evaluated in a
series of experiments conducted in real-world conditions.
","[{""version"":""v1"",""created"":""Mon, 16 Nov 2020 14:07:10 GMT""}]","2020-11-17"
"2011.07973","Shin Sasaki","Muneto Nitta and Shin Sasaki","Higher Derivative Supersymmetric Nonlinear Sigma Models on Hermitian
  Symmetric Spaces, and BPS States Therein","32 pages, minor modifications, a reference added, version published
  in Phys. Rev. D","Phys. Rev. D 103, 025001 (2021)","10.1103/PhysRevD.103.025001",,"hep-th","http://creativecommons.org/licenses/by/4.0/","  We formulate four-dimensional $\mathcal{N} = 1$ supersymmetric nonlinear
sigma models on Hermitian symmetric spaces with higher derivative terms, free
from the auxiliary field problem and the Ostrogradski's ghosts, as gauged
linear sigma models. We then study Bogomol'nyi-Prasad-Sommerfield equations
preserving 1/2 or 1/4 supersymmetries. We find that there are distinct
branches, that we call canonical ($F=0$) and non-canonical ($F\neq 0$)
branches, associated with solutions to auxiliary fields $F$ in chiral
multiplets. For the ${\mathbb C}P^N$ model, we obtain a supersymmetric
${\mathbb C}P^N$ Skyrme-Faddeev model in the canonical branch while in the
non-canonical branch the Lagrangian consists of solely the ${\mathbb C}P^N$
Skyrme-Faddeev term without a canonical kinetic term. These structures can be
extended to the Grassmann manifold $G_{M,N} = SU(M)/[SU(M-N)\times SU(N) \times
U(1)]$. For other Hermitian symmetric spaces such as the quadric surface
$Q^{N-2}=SO(N)/[SO(N-2) \times U(1)])$, we impose F-term (holomorphic)
constraints for embedding them into ${\mathbb C}P^{N-1}$ or Grassmann manifold.
We find that these constraints are consistent in the canonical branch but yield
additional constraints on the dynamical fields thus reducing the target spaces
in the non-canonical branch.
","[{""version"":""v1"",""created"":""Mon, 16 Nov 2020 14:08:33 GMT""},{""version"":""v2"",""created"":""Tue, 5 Jan 2021 01:22:58 GMT""}]","2021-01-13"
