"2011.13729","Lei Han","Lei Han, Jiechao Xiong, Peng Sun, Xinghai Sun, Meng Fang, Qingwei Guo,
  Qiaobo Chen, Tengfei Shi, Hongsheng Yu, Xipeng Wu, Zhengyou Zhang","TStarBot-X: An Open-Sourced and Comprehensive Study for Efficient League
  Training in StarCraft II Full Game","29 pages",,,,"cs.AI cs.LG","http://creativecommons.org/licenses/by/4.0/","  StarCraft, one of the most difficult esport games with long-standing history
of professional tournaments, has attracted generations of players and fans, and
also, intense attentions in artificial intelligence research. Recently,
Google's DeepMind announced AlphaStar, a grandmaster level AI in StarCraft II
that can play with humans using comparable action space and operations. In this
paper, we introduce a new AI agent, named TStarBot-X, that is trained under
orders of less computations and can play competitively with expert human
players. TStarBot-X takes advantage of important techniques introduced in
AlphaStar, and also benefits from substantial innovations including new league
training methods, novel multi-agent roles, rule-guided policy search,
stabilized policy improvement, lightweight neural network architecture, and
importance sampling in imitation learning, etc. We show that with orders of
less computation scale, a faithful reimplementation of AlphaStar's methods can
not succeed and the proposed techniques are necessary to ensure TStarBot-X's
competitive performance. We reveal all technical details that are complementary
to those mentioned in AlphaStar, showing the most sensitive parts in league
training, reinforcement learning and imitation learning that affect the
performance of the agents. Most importantly, this is an open-sourced study that
all codes and resources (including the trained model parameters) are publicly
accessible via \url{https://github.com/tencent-ailab/tleague_projpage}. We
expect this study could be beneficial for both academic and industrial future
research in solving complex problems like StarCraft, and also, might provide a
sparring partner for all StarCraft II players and other AI agents.
","[{""version"":""v1"",""created"":""Fri, 27 Nov 2020 13:31:49 GMT""},{""version"":""v2"",""created"":""Fri, 30 Apr 2021 08:31:32 GMT""}]","2021-05-03"
"2011.13730","Chris van der Ploeg","Chris van der Ploeg, Mohsen Alirezaei, Nathan van de Wouw, Peyman
  Mohajerin Esfahani","Multiple Faults Estimation in Dynamical Systems: Tractable Design and
  Performance Bounds","25 pages, 8 figures",,,,"math.OC cs.SY eess.SY","http://arxiv.org/licenses/nonexclusive-distrib/1.0/","  In this article, we propose a tractable nonlinear fault isolation filter
along with explicit performance bounds for a class of nonlinear dynamical
systems. We consider the presence of additive and multiplicative faults,
occurring simultaneously and through an identical dynamical relationship, which
represents a relevant case in several application domains. The proposed filter
architecture combines tools from model-based approaches in the control
literature and regression techniques from machine learning. To this end, we
view the regression operator through a system-theoretic perspective to develop
operator bounds that are then utilized to derive performance bounds for the
proposed estimation filter. In the case of constant, simultaneously and
identically acting additive and multiplicative faults, it can be shown that the
estimation error converges to zero with an exponential rate. The performance of
the proposed estimation filter in the presence of incipient faults is validated
through an application on the lateral safety systems of SAE level 4 automated
vehicles. The numerical results show that the theoretical bounds of this study
are indeed close to the actual estimation error.
","[{""version"":""v1"",""created"":""Fri, 27 Nov 2020 13:38:30 GMT""},{""version"":""v2"",""created"":""Mon, 11 Oct 2021 11:09:27 GMT""},{""version"":""v3"",""created"":""Tue, 26 Apr 2022 12:08:39 GMT""}]","2022-04-27"
"2011.13731","Kristinn Torfason Ph.D.","Kristinn Torfason, Anna Sitek, Andrei Manolescu, \'Ag\'ust Valfells","Dynamics of a Field Emitted Beam from a Microscopic Inhomogeneous
  Cathode","8 pages, 8 figures",,"10.1109/TED.2021.3063210",,"physics.plasm-ph physics.comp-ph","http://arxiv.org/licenses/nonexclusive-distrib/1.0/","  We investigate by molecular dynamics simulations [arXiv:1412.4537
[physics.plasm-ph], arXiv:1608.06789 [physics.plasm-ph]] a beam of electrons
released via field emission from a planar cathode surface of 1 ${\rm \mu m}^2$
with an inhomogeneous two-level work function, $\phi_{\rm low}$ and $\phi_{\rm
high}$. A rectangular grid, where each cell can have one out of two values of
the work function, is used as a model. The number of cells in the grid ranges
from 6x6 to 96x96. We compare a periodic checkerboard arrangement with
disordered distributions of patches. We perform multiple simulations and
randomize the pattern each time. We study the beam behavior by calculating the
position and velocity of each electron, r.m.s. emittance, and the brightness of
the electron beam. The emittance increases while brightness decreases, with the
mean distance between patches with $\phi_{\rm low}$ when they are in minority,
and they switch the behavior vs. the mean distance between patches with
$\phi_{\rm high}$ when these patches are in minority, respectively. The Coulomb
interaction between all particles is fully included in our simulations.
","[{""version"":""v1"",""created"":""Fri, 27 Nov 2020 13:44:34 GMT""}]","2021-03-22"
"2011.13732","Akiko Yazawa","Akiko Yazawa","On Artinian Gorenstein algebras associated to the face posets of regular
  polyhedra","16 pages, 5 figures",,,,"math.AC math.CO","http://arxiv.org/licenses/nonexclusive-distrib/1.0/","  We introduce Artinian Gorenstein algebras defined by the face posets of
regular polyhedra. We consider the strong Lefschetz property and Hodge--Riemann
relation for the algebras. We show the strong Lefschetz property of the
algebras for all Platonic solids. On the other hand, for some Platonic solids,
we show that the algebras do not satisfy the Hodge--Riemann relation with
respect to some strong Lefschetz elements.
","[{""version"":""v1"",""created"":""Fri, 27 Nov 2020 13:48:22 GMT""}]","2020-11-30"
"2011.13733","Irene Di Palma Dr.","M. Lopez Portilla, I. Di Palma, M. Drago, P. Cerda-Duran, F. Ricci","Deep learning for multimessenger core-collapse supernova detection",,"Phys. Rev. D 103, 063011 (2021)","10.1103/PhysRevD.103.063011",,"astro-ph.IM","http://creativecommons.org/licenses/by-nc-sa/4.0/","  The detection of gravitational waves from core-collapse supernova (CCSN)
explosions is a challenging task, yet to be achieved, in which it is key the
connection between multiple messengers, including neutrinos and electromagnetic
signals. In this work, we present a method for detecting these kind of signals
based on machine learning techniques. We tested its robustness by injecting
signals in the real noise data taken by the Advanced LIGO-Virgo network during
the second observation run, O2. We trained a newly developed Mini-Inception
Resnet neural network using time-frequency images corresponding to injections
of simulated phenomenological signals, which mimic the waveforms obtained in 3D
numerical simulations of CCSNe. With this algorithm we were able to identify
signals from both our phenomenological template bank and from actual numerical
3D simulations of CCSNe. We computed the detection efficiency versus the source
distance, obtaining that, for signal to noise ratio higher than 15, the
detection efficiency is 70 % at a false alarm rate lower than 5%. We notice
also that, in the case of O2 run, it would have been possible to detect signals
emitted at 1 kpc of distance, whilst lowering down the efficiency to 60%, the
event distance reaches values up to 14 kpc.
","[{""version"":""v1"",""created"":""Fri, 27 Nov 2020 13:51:45 GMT""}]","2021-03-17"
"2011.13734","Pavel Gumenyuk","Pavel Gumenyuk and Oliver Roth","On the squeezing function for finitely connected planar domains","Version 2: (1) a statement on the history of the notion of squeezing
  function has been corrected; (2) a new reference [5] (F. Deng: Levi's
  problem, convexity, and squeezing functions on bounded domains) has been
  added; (3) a small technical issue with numbering of equations has been
  resolved",,,,"math.CV","http://creativecommons.org/licenses/by/4.0/","  In a recent paper, Ng, Tang and Tsai (Math. Ann. 2020) have found an explicit
formula for the squeezing function of an annulus via the Loewner differential
equation. Their result has led them to conjecture a corresponding formula for
planar domains of any finite connectivity stating that the extremum in the
squeezing function problem is achieved for a suitably chosen conformal mapping
onto a circularly slit disk. In this paper we disprove this conjecture. We also
give a conceptually simple potential-theoretic proof of the explicit formula
for the squeezing function of an annulus which has the added advantage of
identifying all extremal functions.
","[{""version"":""v1"",""created"":""Fri, 27 Nov 2020 13:53:30 GMT""},{""version"":""v2"",""created"":""Sun, 17 Jan 2021 20:20:38 GMT""}]","2021-01-19"
"2011.13735","Pearse Murphy","Pearse C. Murphy, Eoin P. Carley, Aoife Maria Ryan, Pietro Zucca,
  Peter T. Gallagher","LOFAR observations of radio burst source sizes and scattering in the
  solar corona","6 pages, 3 figures, accepted for publication in Astronomy &
  Astrophysics","A&A 645, A11 (2021)","10.1051/0004-6361/202038518",,"astro-ph.SR","http://creativecommons.org/licenses/by/4.0/","  Low frequency radio wave scattering and refraction can have a dramatic effect
on the observed size and position of radio sources in the solar corona. The
scattering and refraction is thought to be due to fluctuations in electron
density caused by turbulence. Hence, determining the true radio source size can
provide information on the turbulence in coronal plasma. However, the lack of
high spatial resolution radio interferometric observations at low frequencies,
such as with the LOw Frequency ARray (LOFAR), has made it difficult to
determine the true radio source size and level of radio wave scattering. Here
we directly fit the visibilities of a LOFAR observation of a Type IIIb radio
burst with an elliptical Gaussian to determine its source size and position.
This circumvents the need to image the source and then de-convolve LOFAR's
point spread function, which can introduce spurious effects to the source size
and shape. For a burst at 34.76 MHz, we find full width at half maximum (FWHM)
heights along the major and minor axes to be $18.8^\prime$ $\pm~0.1^\prime$ and
$10.2^\prime$ $\pm~0.1^\prime$, respectively, at a plane of sky heliocentric
distance of 1.75 R$_\odot$. Our results suggest that the level of density
fluctuations in the solar corona is the main cause of the scattering of radio
waves, resulting in large source sizes. However, the magnitude of $\varepsilon$
may be smaller than what has been previously derived in observations of radio
wave scattering in tied-array images.
","[{""version"":""v1"",""created"":""Fri, 27 Nov 2020 13:56:29 GMT""}]","2021-01-04"
"2011.13736","Tanya Urrutia","Florian Korinth, Elmar Schm\""alzlin, Clara Stiebing, Tanya Urrutia,
  Genoveva Micheva, Christer Sandin, Andr\'e M\""uller, Martin Maiwald, Bernd
  Sumpf, Christoph Krafft, G\""unther Tr\""ankle, Martin M. Roth, J\""urgen Popp","Wide Field Spectral Imaging with Shifted Excitation Raman Difference
  Spectroscopy Using the Nod and Shuffle Technique","Accepted and Published by ""Sensors"" Journal, 19 pages, 8 figures","Sensors 2020, 20(23), 6723","10.3390/s20236723",,"physics.ins-det astro-ph.IM physics.app-ph physics.bio-ph","http://creativecommons.org/licenses/by/4.0/","  Wide field Raman imaging using the integral field spectroscopy approach was
used as a fast, one shot imaging method for the simultaneous collection of all
spectra composing a Raman image. For the suppression of autofluorescence and
background signals such as room light, shifted excitation Raman difference
spectroscopy (SERDS) was applied to remove background artifacts in Raman
spectra. To reduce acquisition times in wide field SERDS imaging, we adapted
the nod and shuffle technique from astrophysics and implemented it into a wide
field SERDS imaging setup. In our adapted version, the nod corresponds to the
change in excitation wavelength, whereas the shuffle corresponds to the
shifting of charges up and down on a Charge-Coupled Device (CCD) chip
synchronous to the change in excitation wavelength. We coupled this improved
wide field SERDS imaging setup to diode lasers with 784.4/785.5 and 457.7/458.9
nm excitation and applied it to samples such as paracetamol and aspirin
tablets, polystyrene and polymethyl methacrylate beads, as well as pork meat
using multiple accumulations with acquisition times in the range of 50 to 200
ms. The results tackle two main challenges of SERDS imaging: gradual
photobleaching changes the autofluorescence background, and multiple readouts
of CCD detector prolong the acquisition time.
","[{""version"":""v1"",""created"":""Fri, 27 Nov 2020 13:57:42 GMT""}]","2020-11-30"
"2011.13737","Minshen Zhu","Elena Grigorescu, Madhu Sudan, Minshen Zhu","Limitations of Mean-Based Algorithms for Trace Reconstruction at Small
  Distance","In this version, we improve Theorem 7 due to a technical lemma by
  Sima and Bruck, whose proof we simplify further in Lemma 4. We explain the
  differences between the proofs in Section 1.2 after Theorem 7. We also
  strenghthen and simplify Theorem 1,3,5 and Lemma 6, and answer the open
  questions we raised in our previous version with the new Theorem 4. We
  suggest new open problems in Section 7",,,,"math.PR cs.IT math.CO math.IT","http://creativecommons.org/licenses/by/4.0/","  Trace reconstruction considers the task of recovering an unknown string $x
\in \{0,1\}^n$ given a number of independent ""traces"", i.e., subsequences of
$x$ obtained by randomly and independently deleting every symbol of $x$ with
some probability $p$. The information-theoretic limit of the number of traces
needed to recover a string of length $n$ is still unknown. This limit is
essentially the same as the number of traces needed to determine, given strings
$x$ and $y$ and traces of one of them, which string is the source. The
most-studied class of algorithms for the worst-case version of the problem are
""mean-based"" algorithms. These are a restricted class of distinguishers that
only use the mean value of each coordinate on the given samples. In this work
we study limitations of mean-based algorithms on strings at small Hamming or
edit distance. We show that, on the one hand, distinguishing strings that are
nearby in Hamming distance is ""easy"" for such distinguishers. On the other
hand, we show that distinguishing strings that are nearby in edit distance is
""hard"" for mean-based algorithms. Along the way, we also describe a connection
to the famous Prouhet-Tarry-Escott (PTE) problem, which shows a barrier to
finding explicit hard-to-distinguish strings: namely such strings would imply
explicit short solutions to the PTE problem, a well-known difficult problem in
number theory. Furthermore, we show that the converse is also true, thus,
finding explicit solutions to the PTE problem is equivalent to the problem of
finding explicit strings that are hard-to-distinguish by mean-based algorithms.
  Our techniques rely on complex analysis arguments that involve careful
trigonometric estimates, and algebraic techniques that include applications of
Descartes' rule of signs for polynomials over the reals.
","[{""version"":""v1"",""created"":""Fri, 27 Nov 2020 13:58:28 GMT""},{""version"":""v2"",""created"":""Tue, 15 Mar 2022 02:08:40 GMT""}]","2022-03-16"
