"2011.13480","Oleg Kotov","A. A. Sokolik, O. V. Kotov, Yu. E. Lozovik","Plasmonic modes at inclined edges of anisotropic 2D materials","15 pages, 10 figures","Phys. Rev. B 103, 155402 (2021)","10.1103/PhysRevB.103.155402",,"cond-mat.mes-hall physics.optics","http://arxiv.org/licenses/nonexclusive-distrib/1.0/","  Confined modes at the edge arbitrarily inclined with respect to optical axes
of nonmagnetic anisotropic 2D materials are considered. By developing the exact
Wiener-Hopf and approximated Fetter methods we studied edge modes dispersions,
field and charge density distributions. The 2D layer is described by the
Lorentz-type conductivities in one or both directions, which is realistic for
natural anisotropic 2D materials and resonant hyperbolic metasurfaces. We
demonstrate that, due to anisotropy, the edge mode exists only at wave vectors
exceeding the nonzero threshold value if the edge is tilted with respect to the
direction of the resonant conductivity. The dominating contribution to field
and charge density spatial profiles is provided by evanescent 2D waves, which
are confined both in space near the 2D layer and along the layer near its edge.
The degree of field confinement along the layer is determined by wave vector or
frequency mismatch between the edge mode and continuum of freely propagating 2D
modes. Our analysis is suitable for various types of polaritons (plasmon-,
phonon-, exciton-polaritons etc.) at large enough wave vectors. Thanks to
superior field confinement in all directions perpendicular to the edge these
modes look promising for modern plasmonics and sensorics.
","[{""version"":""v1"",""created"":""Thu, 26 Nov 2020 21:52:48 GMT""},{""version"":""v2"",""created"":""Sun, 14 Mar 2021 00:02:56 GMT""}]","2021-04-05"
"2011.13481","Yujia Yang","Yujia Yang, Ye Wang, Chris Manzie and Ye Pu","Real-time Distributed MPC for Multiple Underwater Vehicles with Limited
  Communication Data-rates","7 pages, 4 figures, submitted to ACC2021",,,,"eess.SY cs.SY","http://arxiv.org/licenses/nonexclusive-distrib/1.0/","  Controlling a fleet of autonomous underwater vehicles can be challenging due
to low bandwidth communication between agents. This paper proposes to address
this challenge by optimizing the quantization design of the communications
between agents for use in distributed algorithms. The proposed approach
considers two stages for the problem of multi-AUV control: an off-line stage
where the quantization design is optimized; and an on-line stage based on a
distributed model predictive control formulation and a distributed optimization
algorithm with quantization. The standard properties of recursive feasibility
and stability of the closed loop systems are analyzed, and simulations used to
demonstrate the overall behaviour of the proposed approach.
","[{""version"":""v1"",""created"":""Thu, 26 Nov 2020 22:00:01 GMT""}]","2020-11-30"
"2011.13482","Zhenlong Li Dr.","Yago Martin, Zhenlong Li, Yue Ge","Towards real-time population estimates: introducing Twitter daily
  estimates of residents and non-residents at the county level","25 pages, 5 figures",,,,"cs.SI cs.IR","http://creativecommons.org/licenses/by/4.0/","  The study of migrations and mobility has historically been severely limited
by the absence of reliable data or the temporal sparsity of the available data.
Using geospatial digital trace data, the study of population movements can be
much more precisely and dynamically measured. Our research seeks to develop a
near real-time (one-day lag) Twitter census that gives a more temporally
granular picture of local and non-local population at the county level.
Leveraging geotagged tweets to determine the home location of all active
Twitter users, we contribute to the field of digital and computational
demography by obtaining accurate daily Twitter population stocks (residents and
non-residents). Internal validation reveals over 80% of accuracy when compared
with users self-reported home location. External validation results suggest
these stocks correlate with available statistics of residents/non-residents at
the county level and can accurately reflect regular (seasonal tourism) and
non-regular events such as the Great American Solar Eclipse of 2017. The
findings demonstrate that Twitter holds potential to introduce the dynamic
component often lacking in population estimates.
","[{""version"":""v1"",""created"":""Thu, 26 Nov 2020 22:01:07 GMT""}]","2020-11-30"
"2011.13483","James Mulligan","James Mulligan","Overview of the latest jet physics results from ALICE",,,,,"nucl-ex hep-ex","http://creativecommons.org/licenses/by/4.0/","  We overview recent jet measurements in pp and Pb-Pb collisions with the ALICE
detector. ALICE reconstructs jets at midrapidity using the
anti-$k_{\mathrm{T}}$ algorithm, including both charged particle jets from the
ALICE tracking detectors, and full jets from the combination of the ALICE
electromagnetic calorimeter with the tracking system. We focus on inclusive and
semi-inclusive jet measurements as well as jet substructure measurements,
including a variety of groomed and ungroomed observables. In pp collisions,
these results test pQCD techniques at $p_{\mathrm{T,\;jet}}<140$ GeV$/c$ in a
low pileup environment, and can constrain models of non-perturbative effects.
In Pb-Pb collisions, these measurements test models of jet quenching in the
quark-gluon plasma, and can be used to constrain the properties of high
temperature QCD matter.
","[{""version"":""v1"",""created"":""Thu, 26 Nov 2020 22:13:25 GMT""}]","2020-11-30"
"2011.13484","Matthias Wilms","Matthias Wilms and Jordan J. Bannister and Pauline Mouches and M.
  Ethan MacDonald and Deepthi Rajashekar and S\""onke Langner and Nils D.
  Forkert","Bidirectional Modeling and Analysis of Brain Aging with Normalizing
  Flows","Presented at 3rd International Workshop on Machine Learning in
  Clinical Neuroimaging - in conjunction with MICCAI 2020",,,,"cs.CV","http://arxiv.org/licenses/nonexclusive-distrib/1.0/","  Brain aging is a widely studied longitudinal process throughout which the
brain undergoes considerable morphological changes and various machine learning
approaches have been proposed to analyze it. Within this context, brain age
prediction from structural MR images and age-specific brain morphology template
generation are two problems that have attracted much attention. While most
approaches tackle these tasks independently, we assume that they are inverse
directions of the same functional bidirectional relationship between a brain's
morphology and an age variable. In this paper, we propose to model this
relationship with a single conditional normalizing flow, which unifies brain
age prediction and age-conditioned generative modeling in a novel way. In an
initial evaluation of this idea, we show that our normalizing flow brain aging
model can accurately predict brain age while also being able to generate
age-specific brain morphology templates that realistically represent the
typical aging trend in a healthy population. This work is a step towards
unified modeling of functional relationships between 3D brain morphology and
clinical variables of interest with powerful normalizing flows.
","[{""version"":""v1"",""created"":""Thu, 26 Nov 2020 22:23:48 GMT""}]","2020-11-30"
"2011.13485","Zhiyang He","Zhiyang He, Jason Li, Magnus Wahlstr\""om","Near-linear-time, Optimal Vertex Cut Sparsifiers in Directed Acyclic
  Graphs",,,,,"cs.DS math.CO","http://creativecommons.org/licenses/by/4.0/","  Let $G$ be a graph and $S, T \subseteq V(G)$ be (possibly overlapping) sets
of terminals, $|S|=|T|=k$. We are interested in computing a vertex sparsifier
for terminal cuts in $G$, i.e., a graph $H$ on a smallest possible number of
vertices, where $S \cup T \subseteq V(H)$ and such that for every $A \subseteq
S$ and $B \subseteq T$ the size of a minimum $(A,B)$-vertex cut is the same in
$G$ as in $H$. We assume that our graphs are unweighted and that terminals may
be part of the min-cut. In previous work, Kratsch and Wahlstr\""om (FOCS
2012/JACM 2020) used connections to matroid theory to show that a vertex
sparsifier $H$ with $O(k^3)$ vertices can be computed in randomized polynomial
time, even for arbitrary digraphs $G$. However, since then, no improvements on
the size $O(k^3)$ have been shown.
  In this paper, we draw inspiration from the renowned Bollob\'as's
Two-Families Theorem in extremal combinatorics and introduce the use of total
orderings into Kratsch and Wahlstr\""om's methods. This new perspective allows
us to construct a sparsifier $H$ of $\Theta(k^2)$ vertices for the case that
$G$ is a DAG. We also show how to compute $H$ in time near-linear in the size
of $G$, improving on the previous $O(n^{\omega+1})$. Furthermore, $H$ recovers
the closest min-cut in $G$ for every partition $(A,B)$, which was not
previously known. Finally, we show that a sparsifier of size $\Omega(k^2)$ is
required, both for DAGs and for undirected edge cuts.
","[{""version"":""v1"",""created"":""Thu, 26 Nov 2020 22:39:34 GMT""},{""version"":""v2"",""created"":""Sat, 3 Jul 2021 05:19:57 GMT""}]","2021-07-06"
"2011.13486","James Bartusek","James Bartusek and Andrea Coladangelo and Dakshita Khurana and Fermi
  Ma","One-Way Functions Imply Secure Computation in a Quantum World",,,,,"quant-ph cs.CR","http://arxiv.org/licenses/nonexclusive-distrib/1.0/","  We prove that quantum-hard one-way functions imply simulation-secure quantum
oblivious transfer (QOT), which is known to suffice for secure computation of
arbitrary quantum functionalities. Furthermore, our construction only makes
black-box use of the quantum-hard one-way function.
  Our primary technical contribution is a construction of extractable and
equivocal quantum bit commitments based on the black-box use of quantum-hard
one-way functions in the standard model. Instantiating the Cr\'epeau-Kilian
(FOCS 1988) framework with these commitments yields simulation-secure QOT.
","[{""version"":""v1"",""created"":""Thu, 26 Nov 2020 22:42:13 GMT""},{""version"":""v2"",""created"":""Fri, 13 Aug 2021 23:18:59 GMT""}]","2021-08-17"
"2011.13487","Federico Visi","Federico Ghelli Visi and Atau Tanaka","Interactive Machine Learning of Musical Gesture","Author's accepted manuscript, to appear as a chapter in ""Handbook of
  Artificial Intelligence for Music: Foundations, Advanced Approaches, and
  Developments for Creativity"", edited by E. R. Miranda. Cham: Springer Nature,
  2021",,,,"cs.LG cs.HC","http://creativecommons.org/licenses/by-nc-nd/4.0/","  This chapter presents an overview of Interactive Machine Learning (IML)
techniques applied to the analysis and design of musical gestures. We go
through the main challenges and needs related to capturing, analysing, and
applying IML techniques to human bodily gestures with the purpose of performing
with sound synthesis systems. We discuss how different algorithms may be used
to accomplish different tasks, including interacting with complex synthesis
techniques and exploring interaction possibilities by means of Reinforcement
Learning (RL) in an interaction paradigm we developed called Assisted
Interactive Machine Learning (AIML). We conclude the chapter with a description
of how some of these techniques were employed by the authors for the
development of four musical pieces, thus outlining the implications that IML
have for musical practice.
","[{""version"":""v1"",""created"":""Thu, 26 Nov 2020 22:44:54 GMT""}]","2020-11-30"
"2011.13488","J. K. Jain","J. K. Jain","Thirty Years of Composite Fermions and Beyond","Review with 79 pages, 19 figures","Published in ""Fractional Quantum Hall Effects: New Developments,""
  eds. B. I. Halperin and J. K. Jain (World Scientific, 2020)","10.1142/11751",,"cond-mat.str-el","http://creativecommons.org/licenses/by-nc-nd/4.0/","  This chapter appears in ""Fractional Quantum Hall Effects: New Development,""
edited by B. I. Halperin and J. K. Jain (World Scientific, 2020). The chapter
begins with a primer on composite fermions, and then reviews three directions
that have recently been pursued. It reports on theoretical calculations making
detailed quantitative predictions for two sets of phenomena, namely spin
polarization transitions and the phase diagram of the crystal. This is followed
by the Kohn-Sham density functional theory of the fractional quantum Hall
effect. The chapter concludes with recent applications of the parton theory of
the fractional quantum Hall effect to certain delicate states.
","[{""version"":""v1"",""created"":""Thu, 26 Nov 2020 22:48:17 GMT""}]","2020-11-30"
"2011.13489","Plamen Stefanov","Plamen Stefanov and Samy Tindel","Sampling linear inverse problems with noise",,,,,"math.AP","http://arxiv.org/licenses/nonexclusive-distrib/1.0/","  We study the effect of additive noise to the inversion of FIOs associated to
a diffeomorphic canonical relation. We use the microlocal defect measures to
measure the power spectrum of the noise and analyze how that power spectrum is
transformed under the inversion. In particular, we compute the standard
deviation of the noise added to the inversion as a function of the standard
deviation of the noise added to the data. As an example, we study the Radon
transform in the plane in parallel and fan-beam coordinates, and present
numerical examples.
","[{""version"":""v1"",""created"":""Thu, 26 Nov 2020 22:54:13 GMT""},{""version"":""v2"",""created"":""Fri, 19 Nov 2021 00:42:41 GMT""}]","2021-11-22"
"2011.13490","George Hobbs","N. Yonemaru, S. Kuroyanagi, G. Hobbs, K. Takahashi, X.-J. Zhu, W. A.
  Coles, S. Dai, E. Howard, R. Manchester, D. Reardon, C. Russell, R. Shannon,
  N. Thyagarajan, R. Spiewak, J.-B. Wang","Searching for gravitational wave bursts from cosmic string cusps with
  the Parkes Pulsar Timing Array","Accepted for publication by MNRAS",,"10.1093/mnras/staa3721",,"gr-qc astro-ph.CO","http://creativecommons.org/licenses/by/4.0/","  Cosmic strings are potential gravitational wave (GW) sources that can be
probed by pulsar timing arrays (PTAs). In this work we develop a detection
algorithm for a GW burst from a cusp on a cosmic string, and apply it to Parkes
PTA data. We find four events with a false alarm probability less than 1%.
However further investigation shows that all of these are likely to be
spurious. As there are no convincing detections we place upper limits on the GW
amplitude for different event durations. From these bounds we place limits on
the cosmic string tension of G mu ~ 10^{-5}, and highlight that this bound is
independent from those obtained using other techniques. We discuss the physical
implications of our results and the prospect of probing cosmic strings in the
era of Square Kilometre Array (SKA).
","[{""version"":""v1"",""created"":""Thu, 26 Nov 2020 23:06:52 GMT""}]","2020-12-09"
"2011.13491","Zhiyao Xie","Zhiyao Xie, Hai Li, Xiaoqing Xu, Jiang Hu, Yiran Chen","Fast IR Drop Estimation with Machine Learning",,"2020 International Conference On Computer Aided Design (ICCAD
  2020)",,,"cs.LG eess.SP","http://creativecommons.org/licenses/by/4.0/","  IR drop constraint is a fundamental requirement enforced in almost all chip
designs. However, its evaluation takes a long time, and mitigation techniques
for fixing violations may require numerous iterations. As such, fast and
accurate IR drop prediction becomes critical for reducing design turnaround
time. Recently, machine learning (ML) techniques have been actively studied for
fast IR drop estimation due to their promise and success in many fields. These
studies target at various design stages with different emphasis, and
accordingly, different ML algorithms are adopted and customized. This paper
provides a review to the latest progress in ML-based IR drop estimation
techniques. It also serves as a vehicle for discussing some general challenges
faced by ML applications in electronics design automation (EDA), and
demonstrating how to integrate ML models with conventional techniques for the
better efficiency of EDA tools.
","[{""version"":""v1"",""created"":""Thu, 26 Nov 2020 23:12:37 GMT""}]","2020-11-30"
"2011.13492","Aaron Tuor","Jan Drgona, Soumya Vasisht, Aaron Tuor, Draguna Vrabie","Dissipative Deep Neural Dynamical Systems","Under review at IEEE Open Journal of Control Systems",,,,"cs.LG cs.NE","http://arxiv.org/licenses/nonexclusive-distrib/1.0/","  In this paper, we provide sufficient conditions for dissipativity and local
asymptotic stability of discrete-time dynamical systems parametrized by deep
neural networks. We leverage the representation of neural networks as pointwise
affine maps, thus exposing their local linear operators and making them
accessible to classical system analytic and design methods. This allows us to
""crack open the black box"" of the neural dynamical system's behavior by
evaluating their dissipativity, and estimating their stationary points and
state-space partitioning. We relate the norms of these local linear operators
to the energy stored in the dissipative system with supply rates represented by
their aggregate bias terms. Empirically, we analyze the variance in dynamical
behavior and eigenvalue spectra of these local linear operators with varying
weight factorizations, activation functions, bias terms, and depths.
","[{""version"":""v1"",""created"":""Thu, 26 Nov 2020 23:13:16 GMT""},{""version"":""v2"",""created"":""Thu, 27 Jan 2022 15:58:44 GMT""},{""version"":""v3"",""created"":""Wed, 8 Jun 2022 16:03:21 GMT""}]","2022-06-09"
"2011.13493","Zhiyao Xie","Zhiyao Xie, Guan-Qi Fang, Yu-Hung Huang, Haoxing Ren, Yanqing Zhang,
  Brucek Khailany, Shao-Yun Fang, Jiang Hu, Yiran Chen, Erick Carvajal Barboza","FIST: A Feature-Importance Sampling and Tree-Based Method for Automatic
  Design Flow Parameter Tuning",,"2020 Asia and South Pacific Design Automation Conference (ASP-DAC
  2020)","10.1109/ASP-DAC47756.2020.9045201",,"cs.LG cs.AR","http://creativecommons.org/licenses/by/4.0/","  Design flow parameters are of utmost importance to chip design quality and
require a painfully long time to evaluate their effects. In reality, flow
parameter tuning is usually performed manually based on designers' experience
in an ad hoc manner. In this work, we introduce a machine learning-based
automatic parameter tuning methodology that aims to find the best design
quality with a limited number of trials. Instead of merely plugging in machine
learning engines, we develop clustering and approximate sampling techniques for
improving tuning efficiency. The feature extraction in this method can reuse
knowledge from prior designs. Furthermore, we leverage a state-of-the-art
XGBoost model and propose a novel dynamic tree technique to overcome
overfitting. Experimental results on benchmark circuits show that our approach
achieves 25% improvement in design quality or 37% reduction in sampling cost
compared to random forest method, which is the kernel of a highly cited
previous work. Our approach is further validated on two industrial designs. By
sampling less than 0.02% of possible parameter sets, it reduces area by 1.83%
and 1.43% compared to the best solutions hand-tuned by experienced designers.
","[{""version"":""v1"",""created"":""Thu, 26 Nov 2020 23:13:42 GMT""}]","2020-11-30"
"2011.13494","Zhiyao Xie","Zhiyao Xie, Haoxing Ren, Brucek Khailany, Ye Sheng, Santosh Santosh,
  Jiang Hu, Yiran Chen","PowerNet: Transferable Dynamic IR Drop Estimation via Maximum
  Convolutional Neural Network",,"2020 Asia and South Pacific Design Automation Conference (ASP-DAC
  2020)","10.1109/ASP-DAC47756.2020.9045574",,"cs.LG cs.AR","http://creativecommons.org/licenses/by/4.0/","  IR drop is a fundamental constraint required by almost all chip designs.
However, its evaluation usually takes a long time that hinders mitigation
techniques for fixing its violations. In this work, we develop a fast dynamic
IR drop estimation technique, named PowerNet, based on a convolutional neural
network (CNN). It can handle both vector-based and vectorless IR analyses.
Moreover, the proposed CNN model is general and transferable to different
designs. This is in contrast to most existing machine learning (ML) approaches,
where a model is applicable only to a specific design. Experimental results
show that PowerNet outperforms the latest ML method by 9% in accuracy for the
challenging case of vectorless IR drop and achieves a 30 times speedup compared
to an accurate IR drop commercial tool. Further, a mitigation tool guided by
PowerNet reduces IR drop hotspots by 26% and 31% on two industrial designs,
respectively, with very limited modification on their power grids.
","[{""version"":""v1"",""created"":""Thu, 26 Nov 2020 23:14:17 GMT""}]","2020-11-30"
"2011.13495","Zhizhong Han","Baorui Ma and Zhizhong Han and Yu-Shen Liu and Matthias Zwicker","Neural-Pull: Learning Signed Distance Functions from Point Clouds by
  Learning to Pull Space onto Surfaces","To appear at ICML2021. Code and data are available at
  https://github.com/mabaorui/NeuralPull",,,,"cs.CV","http://arxiv.org/licenses/nonexclusive-distrib/1.0/","  Reconstructing continuous surfaces from 3D point clouds is a fundamental
operation in 3D geometry processing. Several recent state-of-the-art methods
address this problem using neural networks to learn signed distance functions
(SDFs). In this paper, we introduce \textit{Neural-Pull}, a new approach that
is simple and leads to high quality SDFs. Specifically, we train a neural
network to pull query 3D locations to their closest points on the surface using
the predicted signed distance values and the gradient at the query locations,
both of which are computed by the network itself. The pulling operation moves
each query location with a stride given by the distance predicted by the
network. Based on the sign of the distance, this may move the query location
along or against the direction of the gradient of the SDF. This is a
differentiable operation that allows us to update the signed distance value and
the gradient simultaneously during training. Our outperforming results under
widely used benchmarks demonstrate that we can learn SDFs more accurately and
flexibly for surface reconstruction and single image reconstruction than the
state-of-the-art methods.
","[{""version"":""v1"",""created"":""Thu, 26 Nov 2020 23:18:10 GMT""},{""version"":""v2"",""created"":""Sun, 23 May 2021 17:54:34 GMT""}]","2021-05-25"
"2011.13496","Rong Huang","Rong Huang","Detecting Sparse Heterogeneous Mixtures in a Two-Sample Problem",,,,,"math.ST stat.TH","http://arxiv.org/licenses/nonexclusive-distrib/1.0/","  We consider the problem of detecting sparse heterogeneous mixtures in a
two-sample setting from a nonparametric perspective, where the effect manifests
itself as a positive shift. We suggest a two-sample higher criticism test, and
show that it is first-order comparable to the likelihood ratio test for the
generalized Guassian mixture models in all sparsity regimes.
","[{""version"":""v1"",""created"":""Thu, 26 Nov 2020 23:20:12 GMT""}]","2020-11-30"
"2011.13497","Aaron Tuor","Elliott Skomski, Jan Drgona, Aaron Tuor","Physics-Informed Neural State Space Models via Learning and Evolution","Submitted to 3rd Annual Learning for Dynamics & Control Conference. 9
  pages. 4 figures",,,,"cs.NE","http://arxiv.org/licenses/nonexclusive-distrib/1.0/","  Recent works exploring deep learning application to dynamical systems
modeling have demonstrated that embedding physical priors into neural networks
can yield more effective, physically-realistic, and data-efficient models.
However, in the absence of complete prior knowledge of a dynamical system's
physical characteristics, determining the optimal structure and optimization
strategy for these models can be difficult. In this work, we explore methods
for discovering neural state space dynamics models for system identification.
Starting with a design space of block-oriented state space models and
structured linear maps with strong physical priors, we encode these components
into a model genome alongside network structure, penalty constraints, and
optimization hyperparameters. Demonstrating the overall utility of the design
space, we employ an asynchronous genetic search algorithm that alternates
between model selection and optimization and obtains accurate physically
consistent models of three physical systems: an aerodynamics body, a continuous
stirred tank reactor, and a two tank interacting system.
","[{""version"":""v1"",""created"":""Thu, 26 Nov 2020 23:35:08 GMT""}]","2020-11-30"
