"2011.13596","Ibtissem Chouba","Ibtissem Chouba (UTT), Lionel Amodeo (UTT), Farouk Yalaoui (UTT), Taha
  Arbaoui (UTT), David Laplanche","A Mixed Integer Linear Program For Human And Material Resources
  Optimization In Emergency Department",,"International Conference on Modeling, Optimization and Simulation
  (MOSIM 2020), Nov 2020, Agadir, Morocco",,,"cs.RO","http://arxiv.org/licenses/nonexclusive-distrib/1.0/","  The discrepancy between patient demand and the emergency departments (ED)
capacity, that mainly depends on human resources and on beds available for
patients, often lead to ED's overcrowding and to the increase in waiting time.
In this paper, we focus on the optimization of the human (medical and
paramedical staff) and material resources (beds) in the ED of the hospital
center of Troyes, France (CHT). We seek to minimize the total number of waiting
patients from their arrival to their discharge. We propose a mixed integer
linear program solved by a sample average approximation (SAA) approach. The
program has been tested on a set of real data gathered from the ED information
system. Numerical results show that the optimization of human and material
resources leads to a decrease of total number of waiting patients.
","[{""version"":""v1"",""created"":""Fri, 27 Nov 2020 07:59:44 GMT""}]","2020-11-30"
"2011.13597","Bohdan Slavko","Bohdan Slavko, Kirill Glavatskiy, Mikhail Prokopenko","Revealing configurational attractors in the evolution of modern
  Australian and US cities","18 pages, 7 figures, 1 table",,"10.1016/j.chaos.2021.111079",,"physics.soc-ph","http://arxiv.org/licenses/nonexclusive-distrib/1.0/","  The spatial structure of modern cities exhibits highly diverse patterns and
keeps evolving under numerous constraints. Two key dimensions have recently
achieved prominence in characterizing this diversity: heterogeneity and
spreading. However, modern settlements do not fill the entire
heterogeneity--spreading space. Yet, the dynamic mechanisms leading to
emergence of the observed layouts are unclear. Here, we assess the
heterogeneity and spreading of population density in 25 Australian and 175 US
cities. We observe that larger cities tend to form a cluster with a low degree
of spreading and a high degree of heterogeneity, and relate this observation to
the dynamic properties of intra-urban migration in these cities. In doing so,
we introduce a model consistent with the relocation data which predicts such
highly compact and heterogeneous structure for the majority of cities, in
concordance with the actual layout data. In addition, we analyze the stability
of the long-term dynamics of urban configurations with respect to changes in
the mobility characteristics, such as social disposition and relocation
impedance near their equilibrium states. As a result, we report three
qualitatively distinct feasible phases of urban structures: uniform,
monocentric, and polycentric. These phases are shown to be separated by either
smooth or sharp transitions, observed in the space of suitably chosen
configurational parameters. Finally, this analysis reveals that the set of all
possible equilibrium configurations (""configurational attractors"") form a
narrow region in the heterogeneity--spreading space, thus explaining the
emergence of clustering patterns.
","[{""version"":""v1"",""created"":""Fri, 27 Nov 2020 08:02:57 GMT""},{""version"":""v2"",""created"":""Fri, 4 Dec 2020 09:50:18 GMT""}]","2021-06-30"
"2011.13598","Jianyue Zhu","Shiwen He, Zhenyu An, Jianyue Zhu, Jian Zhang, Yongming Huang, and
  Yaoxue Zhang","Beamforming Design for Multiuser uRLLC with Finite Blocklength
  Transmission",,,,,"cs.IT math.IT","http://arxiv.org/licenses/nonexclusive-distrib/1.0/","  Driven by the explosive growth of Internet of Things (IoT) devices with
stringent requirements on latency and reliability, ultra-reliability and low
latency communication (uRLLC) has become one of the three key communication
scenarios for the fifth generation (5G) and beyond 5G communication systems. In
this paper, we focus on the beamforming design problem for the downlink
multiuser uRLLC systems. Since the strict demand on the reliability and
latency, in general, short packet transmission is a favorable form for uRLLC
systems, which indicates the literature Shannon's capacity formula is no longer
applicable. With the finite blocklength transmission, the achievable delivery
rate is greatly influenced by the reliability and latency. Using the developed
achievable delivery rate formula for finite blocklength transmission, we
respectively formulate the problems of interest as the weighted sum rate
maximization, energy efficiency maximization, and user fairness optimization by
considering the maximum allowable transmission power and minimum rate
requirement. It's worthy pointing out that this is the first work to design the
beamforming vectors for the downlink multiuser uRLLC systems. To address these
non-convex problems, some important insights have been discovered by analyzing
the function of achievable delivery rate. For example, the minimum rate
requirement can be realized by low bounded the
signal-to-interference-plus-noise ratio. Based on the discovered results, we
provide algorithms to optimize the beamforming vectors and power allocation,
which are guaranteed to converge to a local optimum solution of the formulated
problems with low computational complexity. Our simulation results reveal that
our proposed beamforming algorithms outperform the zero-forcing beamforming
algorithm with equal power allocation widely used in the existing literatures.
","[{""version"":""v1"",""created"":""Fri, 27 Nov 2020 08:03:41 GMT""}]","2020-11-30"
"2011.13599","Yang Xu","Yang Xu, Haibin Kan, Guangyue Han","A Galois Connection Approach to Wei-Type Duality Theorems","38 pages, with some revisions in the previous version; this work has
  been submitted to IEEE Transactions on Information Theory for possible
  publication",,,,"cs.IT math.IT","http://creativecommons.org/licenses/by/4.0/","  In $1991$, Wei proved a duality theorem that established an interesting
connection between the generalized Hamming weights of a linear code and those
of its dual code. Wei's duality theorem has since been extensively studied from
different perspectives and extended to other settings. In this paper, we
re-examine Wei's duality theorem and its various extensions, henceforth
referred to as Wei-type duality theorems, from a new Galois connection
perspective. Our approach is based on the observation that the generalized
Hamming weights and the dimension/length profiles of a linear code form a
Galois connection. The central result in this paper is a general Wei-type
duality theorem for two Galois connections between finite subsets of
$\mathbb{Z}$, from which all the known Wei-type duality theorems can be
recovered. As corollaries of our central result, we prove new Wei-type duality
theorems for $w$-demimatroids defined over finite sets and
$w$-demi-polymatroids defined over modules with a composition series, which
further allows us to unify and generalize all the known Wei-type duality
theorems established for codes endowed with various metrics.
","[{""version"":""v1"",""created"":""Fri, 27 Nov 2020 08:11:01 GMT""},{""version"":""v2"",""created"":""Fri, 23 Jul 2021 02:46:09 GMT""}]","2021-07-26"
"2011.13600","Junhao Hua","Junhao Hua, Chunguang Li","Distributed Variational Bayesian Algorithms Over Sensor Networks",,,"10.1109/TSP.2015.2493979",,"stat.ML cs.AI","http://arxiv.org/licenses/nonexclusive-distrib/1.0/","  Distributed inference/estimation in Bayesian framework in the context of
sensor networks has recently received much attention due to its broad
applicability. The variational Bayesian (VB) algorithm is a technique for
approximating intractable integrals arising in Bayesian inference. In this
paper, we propose two novel distributed VB algorithms for general Bayesian
inference problem, which can be applied to a very general class of
conjugate-exponential models. In the first approach, the global natural
parameters at each node are optimized using a stochastic natural gradient that
utilizes the Riemannian geometry of the approximation space, followed by an
information diffusion step for cooperation with the neighbors. In the second
method, a constrained optimization formulation for distributed estimation is
established in natural parameter space and solved by alternating direction
method of multipliers (ADMM). An application of the distributed
inference/estimation of a Bayesian Gaussian mixture model is then presented, to
evaluate the effectiveness of the proposed algorithms. Simulations on both
synthetic and real datasets demonstrate that the proposed algorithms have
excellent performance, which are almost as good as the corresponding
centralized VB algorithm relying on all data available in a fusion center.
","[{""version"":""v1"",""created"":""Fri, 27 Nov 2020 08:12:18 GMT""}]","2020-11-30"
"2011.13601","Akihiko Sekine","Akihiko Sekine and Kentaro Nomura","Axion Electrodynamics in Topological Materials","30 pages. Invited Tutorial in Journal of Applied Physics","J. Appl. Phys. 129, 141101 (2021)","10.1063/5.0038804",,"cond-mat.mes-hall cond-mat.mtrl-sci cond-mat.str-el hep-ph","http://arxiv.org/licenses/nonexclusive-distrib/1.0/","  One of the intriguing properties characteristic to three-dimensional
topological materials is the topological magnetoelectric phenomena arising from
a topological term called the $\theta$ term. Such magnetoelectric phenomena are
often termed the axion electrodynamics, since the $\theta$ term has exactly the
same form as the action describing the coupling between a hypothetical
elementary particle, axion, and a photon. The axion was proposed about forty
years ago to solve the so-called strong CP problem in quantum chromodynamics,
and is now considered as a candidate for dark matter. In this tutorial, we
overview theoretical and experimental studies on the axion electrodynamics in
three-dimensional topological materials. Starting from the topological
magnetoelectric effect in three-dimensional time-reversal invariant topological
insulators, we describe the basic properties of static and dynamical axion
insulators whose realizations require magnetic orderings. We also discuss the
electromagnetic responses of Weyl semimetals with a focus on the chiral
anomaly. We extend the concept of the axion electrodynamics in condensed matter
to topological superconductors, whose responses to external fields can be
described by a gravitational topological term analogous to the $\theta$ term.
","[{""version"":""v1"",""created"":""Fri, 27 Nov 2020 08:17:28 GMT""},{""version"":""v2"",""created"":""Fri, 9 Apr 2021 14:52:29 GMT""}]","2021-04-12"
"2011.13602","Sophie Langer Dr.","Michael Kohler and Sophie Langer","Statistical theory for image classification using deep convolutional
  neural networks with cross-entropy loss","arXiv admin note: text overlap with arXiv:2003.01526",,,,"math.ST stat.TH","http://arxiv.org/licenses/nonexclusive-distrib/1.0/","  Convolutional neural networks learned by minimizing the cross-entropy loss
are nowadays the standard for image classification. Till now, the statistical
theory behind those networks is lacking. We analyze the rate of convergence of
the misclassification risk of the estimates towards the optimal
misclassification risk. Under suitable assumptions on the smoothness and
structure of the aposteriori probability it is shown that these estimates
achieve a rate of convergence which is independent of the dimension of the
image. The study shed light on the good performance of CNNs learned by
cross-entropy loss and partly explains their success in practical applications.
","[{""version"":""v1"",""created"":""Fri, 27 Nov 2020 08:33:51 GMT""}]","2020-11-30"
"2011.13603","Ismagil Habibullin","Rustem N. Garifullin, Ismagil T. Habibullin","Generalized symmetries and integrability conditions for hyperbolic type
  semi-discrete equations","18 pages",,"10.1088/1751-8121/abf3ea",,"nlin.SI","http://arxiv.org/licenses/nonexclusive-distrib/1.0/","  In the article differential-difference (semi-discrete) lattices of hyperbolic
type are investigated from the integrability viewpoint. More precisely we
concentrate on a method for constructing generalized symmetries. This kind
integrable lattices admit two hierarchies of generalized symmetries
corresponding to the discrete and continuous independent variables $n$ and $x$.
Symmetries corresponding to the direction of $n$ are constructed in a more or
less standard way while when constructing symmetries of the other form we meet
a problem of solving a functional equation. We have shown that to handle with
this equation one can effectively use the concept of characteristic
Lie-Rinehart algebras of semi-discrete models. Based on this observation, we
have proposed a classification method for integrable semi-discrete lattices.
One of the interesting results of this work is a new example of an integrable
equation, which is a semi-discrete analogue of the Tzizeica equation. Such
examples were not previously known.
","[{""version"":""v1"",""created"":""Fri, 27 Nov 2020 08:34:08 GMT""}]","2021-05-26"
"2011.13604","Carole Adam","Elise Beck, Julie Dugdale, Carole Adam, Christelle Ga\""idatzis, Julius
  Ba\~ngate","A methodology for co-constructing an interdisciplinary model: from model
  to survey, from survey to model","19 pages",,,,"cs.CY cs.AI cs.MA","http://creativecommons.org/licenses/by/4.0/","  How should computer science and social science collaborate to build a common
model? How should they proceed to gather data that is really useful to the
modelling? How can they design a survey that is tailored to the target model?
This paper aims to answer those crucial questions in the framework of a
multidisciplinary research project. This research addresses the issue of
co-constructing a model when several disciplines are involved, and is applied
to modelling human behaviour immediately after an earthquake. The main
contribution of the work is to propose a tool dedicated to multidisciplinary
dialogue. It also proposes a reflexive analysis of the enriching intellectual
process carried out by the different disciplines involved. Finally, from
working with an anthropologist, a complementary view of the multidisciplinary
process is given.
","[{""version"":""v1"",""created"":""Fri, 27 Nov 2020 08:41:47 GMT""}]","2020-11-30"
"2011.13605","Jessca Thorne","Jessica E. Thorne, Aaron. S. G. Robotham, Luke J. M. Davies, Sabine
  Bellstedt, Simon P. Driver, Matias Bravo, Malcolm N. Bremer, Benne W.
  Holwerda, Andrew M. Hopkins, Claudia del P. Lagos, Steven Phillipps,
  Malgorzata Siudek, Edward N. Taylor, Angus H. Wright","Deep Extragalactic VIsible Legacy Survey (DEVILS): SED Fitting in the
  D10-COSMOS Field and the Evolution of the Stellar Mass Function and
  SFR-$M_\star$ relation","Accepted for publication in MNRAS. 28 pages, 20 figures",,"10.1093/mnras/stab1294",,"astro-ph.GA","http://arxiv.org/licenses/nonexclusive-distrib/1.0/","  We present catalogues of stellar masses, star formation rates, and ancillary
stellar population parameters for galaxies spanning $0<z<9$ from the Deep
Extragalactic VIsible Legacy Survey (DEVILS). DEVILS is a deep spectroscopic
redshift survey with very high completeness, covering several premier deep
fields including COSMOS (D10). Our stellar mass and star formation rate
estimates are self-consistently derived using the spectral energy distribution
(SED) modelling code ProSpect, using well-motivated parameterisations for dust
attenuation, star formation histories, and metallicity evolution. We show how
these improvements, and especially our physically motivated assumptions about
metallicity evolution, have an appreciable systematic effect on the inferred
stellar masses, at the level of $\sim$\,0.2 dex. To illustrate the scientific
value of these data, we map the evolving galaxy stellar mass function (SMF) and
the SFR-$M_\star$ relation for $0<z<4.25$. In agreement with past studies, we
find that most of the evolution in the SMF is driven by the characteristic
density parameter, with little evolution in the characteristic mass and
low-mass slopes. Where the SFR-$M_\star$ relation is indistinguishable from a
power-law at $z>2.6$, we see evidence of a bend in the relation at low
redshifts ($z<0.45$). This suggests evolution in both the normalisation and
shape of the SFR-$M_\star$ relation since cosmic noon. It is significant that
we only clearly see this bend when combining our new DEVILS measurements with
consistently derived values for lower redshift galaxies from the Galaxy And
Mass Assembly (GAMA) survey: this shows the power of having consistent
treatment for galaxies at all redshifts.
","[{""version"":""v1"",""created"":""Fri, 27 Nov 2020 08:43:06 GMT""},{""version"":""v2"",""created"":""Wed, 5 May 2021 00:43:36 GMT""}]","2021-05-26"
"2011.13606","Han Cai","Han Cai, Ying Miao, Moshe Schwartz, and Xiaohu Tang","A Construction of Maximally Recoverable Codes with Order-Optimal Field
  Size",,,,,"cs.IT math.IT","http://arxiv.org/licenses/nonexclusive-distrib/1.0/","  We construct maximally recoverable codes (corresponding to partial MDS codes)
which are based on linearized Reed-Solomon codes. The new codes have a smaller
field size requirement compared with known constructions. For certain
asymptotic regimes, the constructed codes have order-optimal alphabet size,
asymptotically matching the known lower bound.
","[{""version"":""v1"",""created"":""Fri, 27 Nov 2020 08:44:30 GMT""},{""version"":""v2"",""created"":""Thu, 14 Oct 2021 03:35:06 GMT""}]","2021-10-15"
"2011.13607","Frank Yu","Frank Yu, Mathieu Salzmann, Pascal Fua, Helge Rhodin","PCLs: Geometry-aware Neural Reconstruction of 3D Pose with Perspective
  Crop Layers","CVPR 2021",,,,"cs.CV","http://creativecommons.org/licenses/by/4.0/","  Local processing is an essential feature of CNNs and other neural network
architectures - it is one of the reasons why they work so well on images where
relevant information is, to a large extent, local. However, perspective effects
stemming from the projection in a conventional camera vary for different global
positions in the image. We introduce Perspective Crop Layers (PCLs) - a form of
perspective crop of the region of interest based on the camera geometry - and
show that accounting for the perspective consistently improves the accuracy of
state-of-the-art 3D pose reconstruction methods. PCLs are modular neural
network layers, which, when inserted into existing CNN and MLP architectures,
deterministically remove the location-dependent perspective effects while
leaving end-to-end training and the number of parameters of the underlying
neural network unchanged. We demonstrate that PCL leads to improved 3D human
pose reconstruction accuracy for CNN architectures that use cropping
operations, such as spatial transformer networks (STN), and, somewhat
surprisingly, MLPs used for 2D-to-3D keypoint lifting. Our conclusion is that
it is important to utilize camera calibration information when available, for
classical and deep-learning-based computer vision alike. PCL offers an easy way
to improve the accuracy of existing 3D reconstruction networks by making them
geometry aware. Our code is publicly available at
github.com/yu-frank/PerspectiveCropLayers.
","[{""version"":""v1"",""created"":""Fri, 27 Nov 2020 08:48:43 GMT""},{""version"":""v2"",""created"":""Thu, 15 Apr 2021 17:39:07 GMT""}]","2021-04-16"
"2011.13608","Junjie Huang","Junjie Huang, Huawei Shen, Qi Cao, Li Cai, Xueqi Cheng","How Medical Crowdfunding Helps People? A Large-scale Case Study on
  Waterdrop Fundraising","Accepted as a full paper at ICWSM 2021","Proc. AAAI Intl. Conference on Web and Social Media (ICWSM) 2021",,,"cs.SI","http://arxiv.org/licenses/nonexclusive-distrib/1.0/","  While online medical crowdfunding achieved tremendous success, quantitative
study about whether and how medical crowdfunding helps people remains little
explored. In this paper, we empirically study how online medical crowdfunding
helps people using more than 27, 000 fundraising cases in Waterdrop
Fundraising, one of the most popular online medical crowdfunding platforms in
China. We find that the amount of money obtained by fundraisers is broadly
distributed, i.e., a majority of lowly donated cases coexist with a handful of
very successful cases. We further investigate the factors that potentially
correlate with the success of medical fundraising cases. Profile information of
fundraising cases, e.g., geographic information of fundraisers, affects the
donated amounts, since detailed description may increase the credibility of a
fundraising case. One prominent finding lies in the effect of social network on
the success of fundraising cases: the spread of fundraising information along
social network is a key factor of fundraising success, and the social capital
of fundraisers play an important role in fundraising. Finally, we conduct
prediction of donations using machine learning models, verifying the effect of
potential factors to the success of medical crowdfunding. Altogether, this work
presents a data-driven view of medical fundraising on the web and opens a door
to understanding medical crowdfunding.
","[{""version"":""v1"",""created"":""Fri, 27 Nov 2020 08:51:27 GMT""},{""version"":""v2"",""created"":""Thu, 7 Jan 2021 06:25:06 GMT""}]","2021-01-08"
"2011.13609","Kaixin Gao","Kai-Xin Gao, Xiao-Lei Liu, Zheng-Hai Huang, Min Wang, Shuangling Wang,
  Zidong Wang, Dachuan Xu, Fan Yu","Eigenvalue-corrected Natural Gradient Based on a New Approximation",,,,,"cs.LG math.OC","http://creativecommons.org/licenses/by-nc-sa/4.0/","  Using second-order optimization methods for training deep neural networks
(DNNs) has attracted many researchers. A recently proposed method,
Eigenvalue-corrected Kronecker Factorization (EKFAC) (George et al., 2018),
proposes an interpretation of viewing natural gradient update as a diagonal
method, and corrects the inaccurate re-scaling factor in the Kronecker-factored
eigenbasis. Gao et al. (2020) considers a new approximation to the natural
gradient, which approximates the Fisher information matrix (FIM) to a constant
multiplied by the Kronecker product of two matrices and keeps the trace equal
before and after the approximation. In this work, we combine the ideas of these
two methods and propose Trace-restricted Eigenvalue-corrected Kronecker
Factorization (TEKFAC). The proposed method not only corrects the inexact
re-scaling factor under the Kronecker-factored eigenbasis, but also considers
the new approximation method and the effective damping technique proposed in
Gao et al. (2020). We also discuss the differences and relationships among the
Kronecker-factored approximations. Empirically, our method outperforms SGD with
momentum, Adam, EKFAC and TKFAC on several DNNs.
","[{""version"":""v1"",""created"":""Fri, 27 Nov 2020 08:57:29 GMT""}]","2020-11-30"
"2011.13610","Harry Crimmins","Harry Crimmins and Beno\^it Saussol","Quenched Poisson processes for random subshifts of finite type",,,,,"math.DS","http://arxiv.org/licenses/nonexclusive-distrib/1.0/","  In this paper we study the quenched distributions of hitting times for a
class of random dynamical systems. We prove that hitting times to dynamically
defined cylinders converge to a Poisson point process under the law of random
equivariant measures with super-polynomial decay of correlations. In
particular, we apply our results to uniformly aperiodic random subshifts of
finite type equipped with random invariant Gibbs measures. We emphasize that we
make no assumptions about the mixing property of the marginal measure.
","[{""version"":""v1"",""created"":""Fri, 27 Nov 2020 08:58:30 GMT""}]","2020-11-30"
"2011.13611","Mu Cai","Mu Cai, Hong Zhang, Huijuan Huang, Qichuan Geng, Yixuan Li, Gao Huang","Frequency Domain Image Translation: More Photo-realistic, Better
  Identity-preserving","15 pages",,,,"cs.CV","http://arxiv.org/licenses/nonexclusive-distrib/1.0/","  Image-to-image translation has been revolutionized with GAN-based methods.
However, existing methods lack the ability to preserve the identity of the
source domain. As a result, synthesized images can often over-adapt to the
reference domain, losing important structural characteristics and suffering
from suboptimal visual quality. To solve these challenges, we propose a novel
frequency domain image translation (FDIT) framework, exploiting frequency
information for enhancing the image generation process. Our key idea is to
decompose the image into low-frequency and high-frequency components, where the
high-frequency feature captures object structure akin to the identity. Our
training objective facilitates the preservation of frequency information in
both pixel space and Fourier spectral space. We broadly evaluate FDIT across
five large-scale datasets and multiple tasks including image translation and
GAN inversion. Extensive experiments and ablations show that FDIT effectively
preserves the identity of the source image, and produces photo-realistic
images. FDIT establishes state-of-the-art performance, reducing the average FID
score by 5.6% compared to the previous best method.
","[{""version"":""v1"",""created"":""Fri, 27 Nov 2020 08:58:56 GMT""},{""version"":""v2"",""created"":""Tue, 1 Dec 2020 04:19:17 GMT""},{""version"":""v3"",""created"":""Thu, 5 Aug 2021 03:33:15 GMT""}]","2021-08-06"
