"2009.02325","Timoteo Carletti","Timoteo Carletti and Duccio Fanelli and Alessio Guarino","How to fairly share a watermelon","corrected version",,"10.1088/1361-6552/abc4dc",,"physics.ed-ph physics.pop-ph","http://arxiv.org/licenses/nonexclusive-distrib/1.0/","  Geometry, calculus and in particular integrals, are too often seen by young
students as technical tools with no link to the reality. This fact generates
into the students a loss of interest with a consequent removal of motivation in
the study of such topics and more widely in pursuing scientific curricula. With
this note we put to the fore a simple example of practical interest where the
above concepts prove central; our aim is thus to motivate students and to
reverse the dropout trend by proposing an introduction to the theory starting
from practical applications. More precisely, we will show how using a mixture
of geometry, calculus and integrals one can easily share a watermelon into
regular slices with equal volume.
","[{""version"":""v1"",""created"":""Mon, 7 Sep 2020 09:56:16 GMT""},{""version"":""v2"",""created"":""Wed, 30 Sep 2020 21:46:01 GMT""}]","2020-12-30"
"2009.02762","Yue Yang","Yue Yang, Wencang Bao, Mohsen Ramezani, Zhe Xu","Real-time and Large-scale Fleet Allocation of Autonomous Taxis: A Case
  Study in New York Manhattan Island","Double-check the formulas",,,,"cs.LG cs.AI cs.MA","http://arxiv.org/licenses/nonexclusive-distrib/1.0/","  Nowadays, autonomous taxis become a highly promising transportation mode,
which helps relieve traffic congestion and avoid road accidents. However, it
hinders the wide implementation of this service that traditional models fail to
efficiently allocate the available fleet to deal with the imbalance of supply
(autonomous taxis) and demand (trips), the poor cooperation of taxis, hardly
satisfied resource constraints, and on-line platform's requirements. To figure
out such urgent problems from a global and more farsighted view, we employ a
Constrained Multi-agent Markov Decision Processes (CMMDP) to model fleet
allocation decisions, which can be easily split into sub-problems formulated as
a 'Dynamic assignment problem' combining both immediate rewards and future
gains. We also leverage a Column Generation algorithm to guarantee the
efficiency and optimality in a large scale. Through extensive experiments, the
proposed approach not only achieves remarkable improvements over the
state-of-the-art benchmarks in terms of the individual's efficiency (arriving
at 12.40%, 6.54% rise of income and utilization, respectively) and the
platform's profit (reaching 4.59% promotion) but also reveals a time-varying
fleet adjustment policy to minimize the operation cost of the platform.
","[{""version"":""v1"",""created"":""Sun, 6 Sep 2020 16:00:15 GMT""},{""version"":""v2"",""created"":""Tue, 20 Oct 2020 01:46:34 GMT""}]","2020-10-21"
"2009.02763","Hao Li","Chang Wang, Jian Liang, Mingkai Huang, Bing Bai, Kun Bai, Hao Li","Hybrid Differentially Private Federated Learning on Vertically
  Partitioned Data",,,,,"cs.LG cs.AI stat.ML","http://arxiv.org/licenses/nonexclusive-distrib/1.0/","  We present HDP-VFL, the first hybrid differentially private (DP) framework
for vertical federated learning (VFL) to demonstrate that it is possible to
jointly learn a generalized linear model (GLM) from vertically partitioned data
with only a negligible cost, w.r.t. training time, accuracy, etc., comparing to
idealized non-private VFL. Our work builds on the recent advances in VFL-based
collaborative training among different organizations which rely on protocols
like Homomorphic Encryption (HE) and Secure Multi-Party Computation (MPC) to
secure computation and training. In particular, we analyze how VFL's
intermediate result (IR) can leak private information of the training data
during communication and design a DP-based privacy-preserving algorithm to
ensure the data confidentiality of VFL participants. We mathematically prove
that our algorithm not only provides utility guarantees for VFL, but also
offers multi-level privacy, i.e. DP w.r.t. IR and joint differential privacy
(JDP) w.r.t. model weights. Experimental results demonstrate that our work,
under adequate privacy budgets, is quantitatively and qualitatively similar to
GLMs, learned in idealized non-private VFL setting, rather than the increased
cost in memory and processing time in most prior works based on HE or MPC. Our
codes will be released if this paper is accepted.
","[{""version"":""v1"",""created"":""Sun, 6 Sep 2020 16:06:04 GMT""}]","2020-09-08"
"2009.02764","Xiao Han","Xiao Han","Twisted Ehresmann Schauenburg bialgebroids",,,,,"math.QA","http://arxiv.org/licenses/nonexclusive-distrib/1.0/","  We construct an invertible normalised 2 cocycle on the Ehresmann Schauenburg
bialgebroid of a cleft Hopf Galois extension under the condition that the
corresponding Hopf algebra is cocommutative and the image of the unital cocycle
corresponding to this cleft Hopf Galois extension belongs to the centre of the
coinvariant subalgebra. Moreover, we show that any Ehresmann Schauenburg
bialgebroid of this kind is isomorphic to a 2-cocycle twist of the Ehresmann
Schauenburg bialgebroid corresponding to a Hopf Galois extension without
cocycle, where comodule algebra is an ordinary smash product of the coinvariant
subalgebra and the Hopf algebra (i.e. $\C(B/#_{\sigma}H, H)\simeq \C(B\#H,
H)^{\tilde{\sigma}}$). We also study the theory in the case of a Galois object
where the base is trivial but without requiring the Hopf algebra to be
cocommutative.
","[{""version"":""v1"",""created"":""Sun, 6 Sep 2020 16:07:37 GMT""}]","2020-09-08"
"2009.02765","Yi Mao","Meng Zhou (Tsinghua), Jianrong Tan (Tsinghua/UPenn), and Yi Mao
  (Tsinghua)","Robust Intensity Mapping Analysis against Foregrounds for the Epoch of
  Reionization","arXiv:2009.02765 (now withdrawn) and arXiv:2009.02766 are now merged
  into a long paper that has now been accepted for publication at the ApJ. This
  published version is updated in arXiv:2009.02766",,,,"astro-ph.CO astro-ph.GA astro-ph.IM","http://arxiv.org/licenses/nonexclusive-distrib/1.0/","  Intensity mapping of the HI 21 cm line and the CO 2.61 mm line from the epoch
of reionization has emerged as powerful, complementary, probes of the
high-redshift Universe. However, both maps and their cross-correlation are
dominated by foregrounds. We propose a new analysis by which the signal is
unbiased by foregrounds, i.e. it can be measured without foreground mitigation.
We construct the antisymmetric part of the HI-CO cross-correlation, arising
because the statistical fluctuations of two fields have different evolution in
time. We show that the sign of this new signal can distinguish
model-independently whether inside-out reionization happens during some
interval of time.
","[{""version"":""v1"",""created"":""Sun, 6 Sep 2020 16:12:29 GMT""},{""version"":""v2"",""created"":""Fri, 8 Jan 2021 11:45:40 GMT""}]","2021-01-11"
"2009.02766","Yi Mao","Meng Zhou (Tsinghua), Jianrong Tan (Tsinghua/UPenn), and Yi Mao
  (Tsinghua)","Antisymmetric Cross-correlation between H I and CO Line Intensity Maps
  as a New Probe of Cosmic Reionization","Updated to match the accepted version for publication at the ApJ. 12
  pages, 12 figures, 1 table. arXiv admin note: substantial text overlap with
  arXiv:2009.02765","ApJ, Vol. 909, id.51 (2021)","10.3847/1538-4357/abda45",,"astro-ph.CO astro-ph.GA astro-ph.IM","http://arxiv.org/licenses/nonexclusive-distrib/1.0/","  Intensity mapping of the H I 21 cm line and the CO 2.61 mm line from the
epoch of reionization has emerged as powerful, complementary, probes of the
high-redshift Universe. However, both maps and their cross-correlation are
dominated by foregrounds. We propose a new analysis by which the signal is
unbiased by foregrounds, i.e. it can be measured without foreground mitigation.
We construct the antisymmetric part of two-point cross-correlation between
intensity maps of the H I 21 cm line and the CO 2.61 mm line, arising because
the statistical fluctuations of two fields have different evolution in time. We
show that the sign of this new signal can distinguish model-independently
whether inside-out reionization happens during some interval of time. More
importantly, within the framework of the excursion set model of reionization,
we demonstrate that the slope of the dipole of H I-CO cross-power spectrum at
large scales is linear to the rate of change of global neutral fraction of
hydrogen in a manner independent of reionization parameters, until the slope
levels out near the end of reionization, but this trend might possibly depend
on the framework of reionization modelling. The H I-CO dipole may be a
smoking-gun probe for the speed of reionization, or ""standard speedometer"" for
cosmic reionization. Observations of this new signal will unveil the global
reionization history from the midpoint to near the completion of reionization.
","[{""version"":""v1"",""created"":""Sun, 6 Sep 2020 16:12:36 GMT""},{""version"":""v2"",""created"":""Fri, 8 Jan 2021 12:07:13 GMT""}]","2021-03-08"
"2009.02767","Vasily Bolbachan","Vasily Bolbachan","Periods of cubic surfaces with the automorphism group of order 54","The final version, as it will appear in Geometriae Dedicata",,"10.1007/s10711-021-00660-9",,"math.NT math.AG math.GR","http://arxiv.org/licenses/nonexclusive-distrib/1.0/","  To any cubic surface, one can associate a cubic threefold given by a triple
cover of $\mathbb P^3$ branched in this cubic surface. D. Allcock, J. Carlson,
and D. Toledo used this construction to define the period map for cubic
surfaces. It is interesting to calculate this map for some specific cubic
surfaces. In this paper, we have calculated it in the case when the cubic
surface is given by a triple covering of $\mathbb P^2$ branched in a smooth
elliptic curve. In this case, the periods can be expressed through periods of
the corresponding elliptic curve.
","[{""version"":""v1"",""created"":""Sun, 6 Sep 2020 16:13:03 GMT""},{""version"":""v2"",""created"":""Tue, 2 Nov 2021 17:08:24 GMT""}]","2021-11-03"
"2009.02768","Surena Hozoori","Surena Hozoori","Symplectic Geometry of Anosov Flows in Dimension 3 and Bi-Contact
  Topology","32 pages, 3 figures",,,,"math.SG math.DS math.GT","http://arxiv.org/licenses/nonexclusive-distrib/1.0/","  We give a purely contact and symplectic geometric characterization of Anosov
flows in dimension 3 and develop a framework to systematically use tools from
contact and symplectic geometry and topology in the study of Anosov dynamics.
We also discuss some uniqueness results regarding the underlying (bi)-contact
structures for an Anosov flow and give a characterization of Anosovity, based
on Reeb flows.
","[{""version"":""v1"",""created"":""Sun, 6 Sep 2020 16:13:06 GMT""},{""version"":""v2"",""created"":""Wed, 23 Sep 2020 16:46:47 GMT""},{""version"":""v3"",""created"":""Sat, 19 Dec 2020 02:02:43 GMT""},{""version"":""v4"",""created"":""Tue, 12 Oct 2021 19:21:37 GMT""},{""version"":""v5"",""created"":""Tue, 7 Jun 2022 18:51:28 GMT""}]","2022-06-09"
"2009.02769","Boris Kramer","Boris Kramer","Stability Domains for Quadratic-Bilinear Reduced-Order Models","16 pages, 6 figures",,,,"math.OC math.DS","http://creativecommons.org/licenses/by/4.0/","  We propose a computational approach to estimate the stability domain of
quadratic-bilinear reduced-order models (ROMs), which are low-dimensional
approximations of large-scale dynamical systems. For nonlinear ROMs, it is not
only important to show that the origin is locally asymptotically stable, but
also to quantify if the operative range of the ROM is included in the region of
convergence. While accuracy and structure preservation remain the main focus of
development for nonlinear ROMs, computational methods that go beyond the
existing highly conservative analytical results have been lacking thus far. In
this work, for a given quadratic Lyapunov function, we first derive an
analytical estimate of the stability domain, which is rather conservative but
can be evaluated efficiently. With the goal to enlarge this estimate, we
provide an optimal ellipsoidal estimate of the stability domain by solving a
convex optimization problem. This provides us with valuable information about
stability properties of the ROM, an important aspect of predictive simulation.
We do not assume a specific ROM method, so a particular appeal is that the
approach is applicable to quadratic-bilinear models obtained via data-driven
approaches, where ROM stability properties cannot - per definition - be derived
from the full-order model. Numerical results for a LQG-balanced ROM of Burgers'
equation, a proper orthogonal decomposition ROM of FitzHugh-Nagumo, and a
non-intrusive ROM of Burgers' equation demonstrate the scalability and
quantitative advantages of the proposed approach. The optimization-based
estimates of the stability domain are found to be up to four orders of
magnitude less conservative than analytical estimates.
","[{""version"":""v1"",""created"":""Sun, 6 Sep 2020 16:22:08 GMT""},{""version"":""v2"",""created"":""Sun, 21 Feb 2021 17:53:45 GMT""}]","2021-02-23"
"2009.02770","Rigoberto Florez","Hsin-Yun Ching, Rigoberto Fl\'orez, and Antara Mukherjee","Families of Integral Cographs within a Triangular Arrays","25 figures",,,,"math.CO","http://arxiv.org/licenses/nonexclusive-distrib/1.0/","  The \emph{determinant Hosoya triangle}, is a triangular array where the
entries are the determinants of two-by-two Fibonacci matrices. The determinant
Hosoya triangle $\bmod \,2$ gives rise to three infinite families of graphs,
that are formed by complete product (join) of (the union of) two complete
graphs with an empty graph. We give a necessary and sufficient condition for a
graph from these families to be integral.
  Some features of these graphs are: they are integral cographs, all graphs
have at most five distinct eigenvalues, all graphs are either $d$-regular
graphs with $d=2,4,6,\dots $ or almost-regular graphs, and some of them are
Laplacian integral. Finally we extend some of these results to the Hosoya
triangle.
","[{""version"":""v1"",""created"":""Sun, 6 Sep 2020 16:27:49 GMT""}]","2020-09-08"
"2009.02771","Tasneem Darwish Dr.","Tasneem Darwish, Gunes Karabulut Kurt, Halim Yanikomeroglu, Gamini
  Senarath, and Peiying Zhu","A Vision of Self-Evolving Network Management for Future Intelligent
  Vertical HetNet",,,,,"cs.NI cs.SY eess.SY","http://arxiv.org/licenses/nonexclusive-distrib/1.0/","  Future integrated terrestrial-aerial-satellite networks will have to exhibit
some unprecedented characteristics for the provision of both communications and
computation services, and security for a tremendous number of devices with very
broad and demanding requirements across multiple networks, operators, and
ecosystems. Although 3GPP introduced the concept of self-organization networks
(SONs) in 4G and 5G documents to automate network management, even this
progressive concept will face several challenges as it may not be sufficiently
agile in coping with the immense levels of complexity, heterogeneity, and
mobility in the envisioned beyond-5G integrated networks. In the presented
vision, we discuss how future integrated networks can be intelligently and
autonomously managed to efficiently utilize resources, reduce operational
costs, and achieve the targeted Quality of Experience (QoE). We introduce the
novel concept of ""self-evolving networks (SENs)"" framework, which utilizes
artificial intelligence, enabled by machine learning (ML) algorithms, to make
future integrated networks fully automated and intelligently evolve with
respect to the provision, adaptation, optimization, and management aspects of
networking, communications, computation, and infrastructure nodes' mobility. To
envisage the concept of SEN in future integrated networks, we use the
Intelligent Vertical Heterogeneous Network (I-VHetNet) architecture as our
reference. The paper discusses five prominent scenarios where SEN plays the
main role in providing automated network management. Numerical results provide
an insight on how the SEN framework improves the performance of future
integrated networks. The paper presents the leading enablers and examines the
challenges associated with the application of SEN concept in future integrated
networks.
","[{""version"":""v1"",""created"":""Sun, 6 Sep 2020 16:35:54 GMT""},{""version"":""v2"",""created"":""Wed, 10 Mar 2021 02:22:58 GMT""}]","2021-03-11"
"2009.02772","Tim A. Werthmann","Anna R\""orich and Tim A. Werthmann and Dominik G\""oddeke and Lars
  Grasedyck","Bayesian inversion for electromyography using low-rank tensor formats",,,"10.1088/1361-6420/abd85a",,"math.NA cs.NA","http://arxiv.org/licenses/nonexclusive-distrib/1.0/","  The reconstruction of the structure of biological tissue using
electromyographic data is a non-invasive imaging method with diverse medical
applications. Mathematically, this process is an inverse problem. Furthermore,
electromyographic data are highly sensitive to changes in the electrical
conductivity that describes the structure of the tissue. Modeling the
inevitable measurement error as a stochastic quantity leads to a Bayesian
approach. Solving the discretized Bayes-inverse problem means drawing samples
from the posterior distribution of parameters, e.g., the conductivity, given
measurement data. Using, e.g., a Metropolis-Hastings algorithm for this purpose
involves solving the forward problem for different parameter combinations which
requires a high computational effort. Low-rank tensor formats can reduce this
effort by providing a data-sparse representation of all occurring linear
systems of equations simultaneously and allow for their efficient solution. The
application of Bayes' theorem proves the well-posedness of the Bayes-inverse
problem. The derivation and proof of a low-rank representation of the forward
problem allow for the precomputation of all solutions of this problem under
certain assumptions, resulting in an efficient and theory-based sampling
algorithm. Numerical experiments support the theoretical results, but also
indicate that a high number of samples is needed to obtain reliable estimates
for the parameters. The Metropolis-Hastings sampling algorithm, using the
precomputed forward solution in a tensor format, draws this high number of
samples and therefore enables solving problems which are infeasible using
classical methods.
","[{""version"":""v1"",""created"":""Sun, 6 Sep 2020 16:45:25 GMT""},{""version"":""v2"",""created"":""Mon, 14 Dec 2020 14:34:13 GMT""}]","2021-05-26"
"2009.02773","Zinan Lin","Zinan Lin, Vyas Sekar, Giulia Fanti","Why Spectral Normalization Stabilizes GANs: Analysis and Improvements","54 pages, 74 figures",,,,"cs.LG cs.CV stat.ML","http://arxiv.org/licenses/nonexclusive-distrib/1.0/","  Spectral normalization (SN) is a widely-used technique for improving the
stability and sample quality of Generative Adversarial Networks (GANs).
However, there is currently limited understanding of why SN is effective. In
this work, we show that SN controls two important failure modes of GAN
training: exploding and vanishing gradients. Our proofs illustrate a (perhaps
unintentional) connection with the successful LeCun initialization. This
connection helps to explain why the most popular implementation of SN for GANs
requires no hyper-parameter tuning, whereas stricter implementations of SN have
poor empirical performance out-of-the-box. Unlike LeCun initialization which
only controls gradient vanishing at the beginning of training, SN preserves
this property throughout training. Building on this theoretical understanding,
we propose a new spectral normalization technique: Bidirectional Scaled
Spectral Normalization (BSSN), which incorporates insights from later
improvements to LeCun initialization: Xavier initialization and Kaiming
initialization. Theoretically, we show that BSSN gives better gradient control
than SN. Empirically, we demonstrate that it outperforms SN in sample quality
and training stability on several benchmark datasets.
","[{""version"":""v1"",""created"":""Sun, 6 Sep 2020 16:51:42 GMT""},{""version"":""v2"",""created"":""Thu, 8 Apr 2021 00:29:30 GMT""}]","2021-04-09"
"2009.02774","Enrique Arrondo","Enrique Arrondo","Representation theory of finite groups through (basic) algebraic
  geometry","Equations of subrepresentations improved and simplified in
  Proposition 3.6. As a consequence, the rest of the paper is also modified
  using this simplification",,,,"math.RT math.AG math.CO","http://arxiv.org/licenses/nonexclusive-distrib/1.0/","  We introduce a new approach to representation theory of finite groups that
uses some basic algebraic geometry and allows to do all the theory without
using characters. With this approach, to any finite group $G$ we associate a
finite number of points and show that any field containing the coordinates of
those points works fine as the ground field for the representations of $G$. We
apply this point of view to the symmetric group $S_d$, finding easy equations
for the different symmetries of functions in $d$ variables. As a byproduct, we
give an easy proof of a recent result by Tocino that states that the
hyperdeterminant of a $d$-dimensional matrix is zero for all but two types of
symmetry.
","[{""version"":""v1"",""created"":""Sun, 6 Sep 2020 17:01:12 GMT""},{""version"":""v2"",""created"":""Fri, 18 Sep 2020 17:43:09 GMT""},{""version"":""v3"",""created"":""Tue, 4 May 2021 17:43:46 GMT""}]","2021-05-05"
"2009.02775","Suvam Mukherjee","Suvam Mukherjee, Oded Padon, Sharon Shoham, Deepak D'Souza, Noam
  Rinetzky","A Thread-Local Semantics and Efficient Static Analyses for Race Free
  Programs",,,,,"cs.PL","http://arxiv.org/licenses/nonexclusive-distrib/1.0/","  Data race free (DRF) programs constitute an important class of concurrent
programs. In this paper we provide a framework for designing and proving the
correctness of data flow analyses that target this class of programs. These
analyses are in the same spirit as the ""sync-CFG"" analysis proposed in earlier
literature. To achieve this, we first propose a novel concrete semantics for
DRF programs, called L-DRF, that is thread-local in nature---each thread
operates on its own copy of the data state. We show that abstractions of our
semantics allow us to reduce the analysis of DRF programs to a sequential
analysis. This aids in rapidly porting existing sequential analyses to sound
and scalable analyses for DRF programs. Next, we parameterize L-DRF with a
partitioning of the program variables into ""regions"" which are accessed
atomically. Abstractions of the region-parameterized semantics yield more
precise analyses for ""region-race"" free concurrent programs. We instantiate
these abstractions to devise efficient relational analyses for race free
programs, which we have implemented in a prototype tool called RATCOP. On the
benchmarks, RATCOP was able to prove up to 65% of the assertions, in comparison
to 25% proved by our baseline. Moreover, in a comparative study with a recent
concurrent static analyzer, RATCOP was up to 5 orders of magnitude faster.
","[{""version"":""v1"",""created"":""Sun, 6 Sep 2020 17:01:51 GMT""}]","2020-09-08"
"2009.02776","Marco Morucci","Marco Morucci and Cynthia Rudin","Matching Bounds: How Choice of Matching Algorithm Impacts Treatment
  Effects Estimates and What to Do about It",,,,,"stat.AP stat.ME","http://creativecommons.org/licenses/by-sa/4.0/","  Many major works in social science employ matching to make causal
conclusions, but different matches on the same data may produce different
treatment effect estimates, even when they achieve similar balance or minimize
the same loss function. We discuss reasons and consequences of this problem. We
present evidence of this problem by replicating ten papers that use matching
and we find that different popular matching algorithms produce inconsistent
results. We introduce Matching Bounds: a finite-sample, nonstochastic method
that allows analysts to know whether a matched sample that produces different
results with the same levels of balance and overall match quality could be
obtained from their data. We apply Matching Bounds to a replication of two
studies and show that in one case results are robust to this issue and in
another they are not.
","[{""version"":""v1"",""created"":""Sun, 6 Sep 2020 17:03:30 GMT""},{""version"":""v2"",""created"":""Tue, 27 Oct 2020 23:35:26 GMT""},{""version"":""v3"",""created"":""Wed, 22 Mar 2023 15:17:05 GMT""}]","2023-03-23"
"2009.02777","Saulius Norvidas","Saulius Norvidas","A note on powers of the characteristic function","6 pages",,,,"math.PR","http://arxiv.org/licenses/nonexclusive-distrib/1.0/","  Let $CH(R)$ denote the family of characteristic functions of probability
measures (distributions) on the real line $R$. We study the following question:
given an integer $n>1$, do there exist two different $f, g\in CH(R)$ such that
$ f^n\equiv g^n$? For positive even $n$, well-known examples answer this
question in the affirmative. It turns out that the same is true also for any
odd $n>1$. For $f\in CH(R)$ and integer $n>1$, set $C_n(f)=\{g\in CH(R):
g^n\equiv f^n\}$. In this paper, we give an estimate for cardinality (or
cardinal number) of $C_n(f)$. In addition, we describe such $f$ for which our
estimate is sharp.
","[{""version"":""v1"",""created"":""Sun, 6 Sep 2020 17:04:02 GMT""}]","2020-09-08"
