"2009.02880","Xiancai Tian","Xiancai Tian, Chen Zhang, Baihua Zheng","Crowding Prediction of In-Situ Metro Passengers Using Smart Card Data","11 pages, preprint for IEEE transactions",,,,"cs.LG stat.ML","http://creativecommons.org/licenses/by/4.0/","  The metro system is playing an increasingly important role in the urban
public transit network, transferring a massive human flow across space everyday
in the city. In recent years, extensive research studies have been conducted to
improve the service quality of metro systems. Among them, crowd management has
been a critical issue for both public transport agencies and train operators.
In this paper, by utilizing accumulated smart card data, we propose a
statistical model to predict in-situ passenger density, i.e., number of
on-board passengers between any two neighbouring stations, inside a closed
metro system. The proposed model performs two main tasks: i) forecasting
time-dependent Origin-Destination (OD) matrix by applying mature statistical
models; and ii) estimating the travel time cost required by different parts of
the metro network via truncated normal mixture distributions with
Expectation-Maximization (EM) algorithm. Based on the prediction results, we
are able to provide accurate prediction of in-situ passenger density for a
future time point. A case study using real smart card data in Singapore Mass
Rapid Transit (MRT) system demonstrate the efficacy and efficiency of our
proposed method.
","[{""version"":""v1"",""created"":""Mon, 7 Sep 2020 04:07:37 GMT""}]","2020-09-08"
"2009.02881","Arindam Mallick","Arindam Mallick, Nana Chang, Wulayimu Maimaiti, Sergej Flach, and
  Alexei Andreanov","Wannier-Stark flatbands in Bravais lattices","11 pages, 3 figures. Similar to the published version. Comments are
  welcome","Phys. Rev. Research 3, 013174 (2021)","10.1103/PhysRevResearch.3.013174",,"cond-mat.quant-gas cond-mat.mtrl-sci quant-ph","http://creativecommons.org/licenses/by/4.0/","  We systematically construct flatbands (FB) for tight-binding models on simple
Bravais lattices in space dimension $d \geq 2$ in the presence of a static
uniform DC field. Commensurate DC field directions yield irreducible
Wannier-Stark (WS) bands in perpendicular dimension $d - 1$ with
$d$-dimensional eigenfunctions. The irreducible bands turn into dispersionless
flatbands in the absence of nearest neighbor hoppings between lattice sites in
any direction perpendicular to the DC field. The number of commensurate
directions which yield flatbands is of measure one. We arrive at a complete
halt of transport, with the DC field prohibiting transport along the field
direction, and the flatbands prohibiting transport in all perpendicular
directions as well. The anisotropic flatband eigenstates are localizing at
least factorially (faster than exponential).
","[{""version"":""v1"",""created"":""Mon, 7 Sep 2020 04:12:35 GMT""},{""version"":""v2"",""created"":""Thu, 5 Aug 2021 09:26:26 GMT""}]","2021-08-06"
"2009.02882","Su Ying Quek","Juefan Wang and Su Ying Quek","Isolated Flat Bands and Physics of Mixed Dimensions in a 2D Covalent
  Organic Framework","preprint version; published in Nanoscale",,"10.1039/D0NR04428H",,"cond-mat.mes-hall cond-mat.mtrl-sci","http://arxiv.org/licenses/nonexclusive-distrib/1.0/","  We demonstrate that it is possible to rationally incorporate both an isolated
flat band, and the physics of zero dimensions (0D), one dimension (1D), and two
dimensions (2D) in a single 2D material. Such unique electronic properties are
present in a recently synthesized 2D covalent organic framework (COF), where
""I""-shaped building blocks and ""T""-shaped connectors result in quasi-1D chains
that are linked by quasi-0D bridge units arranged in a stable 2D lattice. The
lowest unoccupied conduction band is an isolated flat band, and electron-doping
gives rise to novel quantum phenomena, such as magnetism and Mott insulating
phases. The highest occupied valence band arises from wave functions in the
quasi-1D chains. Examples of mixed dimensional physics are illustrated in this
system. The strong electron-hole asymmetry in this material results in a large
Seebeck coefficient, while the quasi-1D nature of the chains leads to linear
dichroism, in conjunction with strongly bound 2D excitons. We elucidate
strategies to design and optimize 2D COFs to host both isolated flat bands and
quantum-confined 1D subsystems. The properties of the 2D COF discussed here
provide a taste of the intriguing possibilities in this open research field.
","[{""version"":""v1"",""created"":""Mon, 7 Sep 2020 04:16:51 GMT""}]","2020-09-08"
"2009.02883","Chunhui Du","Eric Lee-Wong, Jinjun Ding, Xiaoche Wang, Chuanpu Liu, Nathan J.
  McLaughlin, Hailong Wang, Mingzhong Wu, Chunhui Rita Du","Quantum Sensing of Spin Fluctuations of Magnetic Insulator Films with
  Perpendicular Anisotropy",,"Phys. Rev. Applied 15, 034031 (2021)","10.1103/PhysRevApplied.15.034031",,"cond-mat.mes-hall cond-mat.mtrl-sci quant-ph","http://arxiv.org/licenses/nonexclusive-distrib/1.0/","  Nitrogen vacancy (NV) centers, optically active atomic defects in diamond,
have been widely applied to emerging quantum sensing, imaging, and network
efforts, showing unprecedented field sensitivity and nanoscale spatial
resolution. Many of these advantages derive from their excellent
quantum-coherence, controllable entanglement, and high fidelity of operations,
enabling opportunities to outperform the classical counterpart. Exploiting this
cutting-edge quantum metrology, we report noninvasive measurement of intrinsic
spin fluctuations of magnetic insulator thin films with a spontaneous
out-of-plane magnetization. The measured field dependence of NV relaxation
rates is well correlated to the variation of magnon density and band structure
of the magnetic samples, which are challenging to access by the conventional
magnetometry methods. Our results highlight the significant opportunities
offered by NV centers in diagnosing the noise environment of functional
magnetic elements, providing valuable information to design next-generation,
high-density, and scalable spintronic devices.
","[{""version"":""v1"",""created"":""Mon, 7 Sep 2020 04:24:44 GMT""}]","2021-04-06"
"2009.02884","Saul Freedman","Saul D. Freedman","The intersection graph of a finite simple group has diameter at most 5","8 pages. Corrected minor non-mathematical typos","Arch. Math. (Basel) 117(1) (2021), 1-7","10.1007/s00013-021-01583-3",,"math.GR","http://arxiv.org/licenses/nonexclusive-distrib/1.0/","  Let $G$ be a non-abelian finite simple group. In addition, let $\Delta_G$ be
the intersection graph of $G$, whose vertices are the proper nontrivial
subgroups of $G$, with distinct subgroups joined by an edge if and only if they
intersect nontrivially. We prove that the diameter of $\Delta_G$ has a tight
upper bound of 5, thereby resolving a question posed by Shen (2010).
Furthermore, a diameter of 5 is achieved only by the baby monster group and
certain unitary groups of odd prime dimension.
","[{""version"":""v1"",""created"":""Mon, 7 Sep 2020 04:26:32 GMT""},{""version"":""v2"",""created"":""Thu, 28 Jan 2021 03:42:29 GMT""}]","2021-07-05"
"2009.02885","Murray Elder","Murray Elder and Adam Piggott","Rewriting systems, plain groups, and geodetic graphs","11 pages, 10 figures, minor edits and corrections",,,,"math.GR","http://arxiv.org/licenses/nonexclusive-distrib/1.0/","  We prove that a group is presented by finite convergent length-reducing
rewriting systems where each rule has left-hand side of length 3 if and only if
the group is plain. Our proof goes via a new result concerning properties of
embedded circuits in geodetic graphs, which may be of independent interest in
graph theory.
","[{""version"":""v1"",""created"":""Mon, 7 Sep 2020 04:27:06 GMT""},{""version"":""v2"",""created"":""Wed, 15 Dec 2021 05:21:55 GMT""}]","2021-12-16"
"2009.02886","Chunhui Du","Nathan J. McLaughlin, Yoav Kalcheim, Albert Suceava, Hailong Wang,
  Ivan K. Schuller and Chunhui Rita Du","Quantum Sensing of Insulator-to-Metal Transitions in a Mott Insulator",,"Adv. Quantum Technol. 2000142 (2021)","10.1002/qute.202000142",,"cond-mat.mes-hall cond-mat.mtrl-sci quant-ph","http://arxiv.org/licenses/nonexclusive-distrib/1.0/","  Nitrogen vacancy (NV) centers, optically-active atomic defects in diamond,
have attracted tremendous interest for quantum sensing, network, and computing
applications due to their excellent quantum coherence and remarkable
versatility in a real, ambient environment. Taking advantage of these
strengths, we report on NV-based local sensing of the electrically driven
insulator-to-metal transition (IMT) in a proximal Mott insulator. We studied
the resistive switching properties of both pristine and ion-irradiated VO2 thin
film devices by performing optically detected NV electron spin resonance
measurements. These measurements probe the local temperature and magnetic field
in electrically biased VO2 devices, which are in agreement with the global
transport measurement results. In pristine devices, the electrically-driven IMT
proceeds through Joule heating up to the transition temperature while in
ion-irradiated devices, the transition occurs non-thermally, well below the
transition temperature. Our results provide the first direct evidence for
non-thermal electrically induced IMT in a Mott insulator, highlighting the
significant opportunities offered by NV quantum sensors in exploring nanoscale
thermal and electrical behaviors in Mott materials.
","[{""version"":""v1"",""created"":""Mon, 7 Sep 2020 04:38:27 GMT""}]","2021-04-06"
"2009.02887","Yohei Shiokawa","Yohei Shiokawa, Eiji Komura, Yugo Ishitani, Atsushi Tsumita, Keita
  Suda, Kosuke Hamanaka, Tomohiro Taniguchi, and Tomoyuki Sasaki","Dependency of high-speed write properties on external magnetic field in
  spin-orbit torque in-plane magnetoresistance devices","17 pages, 5 figures","Applied Physics Express 14, 013001 (2021)","10.35848/1882-0786/abd598",,"cond-mat.mes-hall","http://arxiv.org/licenses/nonexclusive-distrib/1.0/","  Spin-orbit torque (SOT) magnetoresistance (MR) devices have attracted
attention for use in next-generation MR devices. The SOT devices are known to
exhibit different write properties based on the relative angle between the
magnetization direction of the free layer and the write-current direction.
However, few studies that compare the write properties of each type have been
reported. In this study, we measured the external perpendicular-magnetic field
dependence of the threshold write current density and the write current
switching probability using two types of in-plane magnetization SOT-MR devices.
","[{""version"":""v1"",""created"":""Mon, 7 Sep 2020 04:54:48 GMT""},{""version"":""v2"",""created"":""Thu, 7 Jan 2021 23:50:20 GMT""}]","2021-01-11"
"2009.02888","Xuan Li","Cheuk-Ping Wong, Xuan Li, Melynda Brooks, Matthew J. Durham, Ming
  Xiong Liu, Astrid Morreale, Cesar da Silva, Walter E. Sondheim","A Proposed Forward Silicon Tracker for the Future Electron-Ion Collider
  and Associated Physics Studies","47 pages, 64 figures, technical note for a proposed forward silicon
  tracker detector and associated detector/physics simulation studies for the
  future Electron-Ion Collider by the Los Alamos National Laboratory team. This
  work is supported by the Los Alamos National Laboratory LDRD office
  20200022DR project",,,"LANL Report: LA-UR-20-26642","nucl-ex hep-ex","http://creativecommons.org/licenses/by/4.0/","  The future Electron-Ion Collider (EIC) will explore several fundamental
questions in a broad Bjorken-x ($x_{BJ}$) and $Q^{2}$ phase space. Heavy flavor
and jet products are ideal probes to precisely study the tomography of
nucleon/nuclei structure, help solve the proton spin puzzle and understand the
hadronizaton processes in vacuum or in the QCD medium. Due to the asymmetric
collisions at the EIC, most of the final state hadrons are produced in the
nucleon/nuclei beam going (forward) direction. A silicon vertex/tracking is
critical to precisely measure these forward hadrons at the EIC. Details of
different conceptual designs of the proposed Forward Silicon Tracker (FST) and
the relevant detector performance are presented in this technical note. The
associated heavy flavor and jet studies with the evaluated FST performance are
discussed as well.
","[{""version"":""v1"",""created"":""Mon, 7 Sep 2020 05:03:50 GMT""}]","2020-09-08"
"2009.02889","Murray Barrett","Zhiqiang Zhang and K. J. Arnold and R. Kaewuam and M. S. Safronova and
  M. D. Barrett","Hyperfine-mediated effects in a Lu$^+$ optical clock","9 pages 3 figures",,,,"physics.atom-ph quant-ph","http://arxiv.org/licenses/nonexclusive-distrib/1.0/","  We consider hyperfine-mediated effects for clock transitions in
$^{176}$Lu$^+$. Mixing of fine structure levels due to the hyperfine
interaction bring about modifications to Land\'e $g$-factors and the quadrupole
moment for a given state. Explicit expressions are derived for both $g$-factor
and quadrupole corrections, for which leading order terms arise from the
nuclear magnetic dipole coupling. High accuracy measurements of the $g$-factors
for the $^1S_0$ and $^3D_1$ hyperfine levels are carried out, which provide an
experimental determination of the leading order correction terms.
","[{""version"":""v1"",""created"":""Mon, 7 Sep 2020 05:05:10 GMT""}]","2020-09-08"
"2009.02890","Eytan Katzav","Ido Tishby, Ofer Biham and Eytan Katzav","Convergence towards an Erd{\H o}s-R\'enyi graph structure in network
  contraction processes","30 pages, 5 figures, supplemental material and movie. To view
  supplemental files, please download and extract the gzipped tar source file
  listed under ""Other formats""","{\it Phys. Rev. E} {\bf 100}, 032314 (2019)","10.1103/PhysRevE.100.032314",,"physics.soc-ph cond-mat.dis-nn cond-mat.stat-mech","http://arxiv.org/licenses/nonexclusive-distrib/1.0/","  In a highly influential paper twenty years ago, Barab\'asi and Albert
[Science 286, 509 (1999)] showed that networks undergoing generic growth
processes with preferential attachment evolve towards scale-free structures. In
any finite system, the growth eventually stalls and is likely to be followed by
a phase of network contraction due to node failures, attacks or epidemics.
Using the master equation formulation and computer simulations we analyze the
structural evolution of networks subjected to contraction processes via random,
preferential and propagating node deletions. We show that the contracting
networks converge towards an Erd{\H o}s-R\'enyi network structure whose mean
degree continues to decrease as the contraction proceeds. This is manifested by
the convergence of the degree distribution towards a Poisson distribution and
the loss of degree-degree correlations.
","[{""version"":""v1"",""created"":""Mon, 7 Sep 2020 05:09:51 GMT""}]","2020-09-08"
"2009.02891","Daniel Durham","Khalid M. Siddiqui, Daniel B. Durham, Frederick Cropp, Colin Ophus,
  Sangeeta Rajpurohit, Yanglin Zhu, Johan D. Carlstr\""om, Camille Stavrakas,
  Zhiqiang Mao, Archana Raja, Pietro Musumeci, Liang Z. Tan, Andrew M. Minor,
  Daniele Filippetto, Robert A. Kaindl","Ultrafast optical melting of trimer superstructure in layered 1T'-TaTe2","Main text and supplementary information: 30 pages, 4 main figures, 24
  supplementary figures","Communications Physics, Volume 4, Article number 152 (2021)","10.1038/s42005-021-00650-z",,"cond-mat.mtrl-sci cond-mat.mes-hall cond-mat.str-el","http://creativecommons.org/licenses/by/4.0/","  Quasi-two-dimensional transition-metal dichalcogenides are a key platform for
exploring emergent nanoscale phenomena arising from complex interactions.
Access to the underlying degrees-of-freedom on their natural time scales
motivates the use of advanced ultrafast probes sensitive to self-organised
atomic-scale patterns. Here, we report the first ultrafast investigation of
TaTe2, which exhibits unique charge and lattice trimer order characterised by a
transition upon cooling from stripe-like chains into a $(3 \times 3)$
superstructure of trimer clusters. Utilising MeV-scale ultrafast electron
diffraction, we capture the photo-induced TaTe2 structural dynamics -- exposing
a rapid $\approx\!1.4$ ps melting of its low-temperature ordered state followed
by recovery via thermalisation into a hot cluster superstructure.
Density-functional calculations indicate that the initial quench is triggered
by intra-trimer Ta charge transfer which destabilises the clusters, unlike
melting of charge density waves in other TaX2 compounds. Our work paves the way
for further exploration and ultimately rapid optical and electronic
manipulation of trimer superstructures.
","[{""version"":""v1"",""created"":""Mon, 7 Sep 2020 05:18:41 GMT""},{""version"":""v2"",""created"":""Tue, 9 Nov 2021 21:29:00 GMT""}]","2021-11-11"
"2009.02892","Alexander Jakob","Alexander M. Jakob, Simon G. Robson, Vivien Schmitt, Vincent Mourik,
  Matthias Posselt, Daniel Spemann, Brett C. Johnson, Hannes R. Firgau, Edwin
  Mayes, Jeffrey C. McCallum, Andrea Morello, David N. Jamieson","Deterministic Single Ion Implantation with 99.87% Confidence for
  Scalable Donor-Qubit Arrays in Silicon","12 pages, 4 figures",,,,"cond-mat.mes-hall physics.ins-det quant-ph","http://arxiv.org/licenses/nonexclusive-distrib/1.0/","  The attributes of group-V-donor spins implanted in an isotopically purified
$^{28}$Si crystal make them attractive qubits for large-scale quantum computer
devices. Important features include long nuclear and electron spin lifetimes of
$^{31}$P, hyperfine clock transitions in $^{209}$Bi and electrically
controllable $^{123}$Sb nuclear spins. However, architectures for scalable
quantum devices require the ability to fabricate deterministic arrays of
individual donor atoms, placed with sufficient precision to enable
high-fidelity quantum operations. Here we employ on-chip electrodes with
charge-sensitive electronics to demonstrate the implantation of single
low-energy (14 keV) P$^+$ ions with an unprecedented $99.87\pm0.02$%
confidence, while operating close to room-temperature. This permits integration
with an atomic force microscope equipped with a scanning-probe ion aperture to
address the critical issue of directing the implanted ions to precise
locations. These results show that deterministic single-ion implantation can be
a viable pathway for manufacturing large-scale donor arrays for quantum
computation and other applications.
","[{""version"":""v1"",""created"":""Mon, 7 Sep 2020 05:23:07 GMT""},{""version"":""v2"",""created"":""Wed, 9 Sep 2020 10:04:37 GMT""}]","2020-09-10"
"2009.02893","Yasha Neiman","Adrian David and Yasha Neiman","Bulk interactions and boundary dual of higher-spin-charged particles","48 pages, 2 figures; v2: JHEP version - expanded discussion and
  references; v3: amended incorrect statements about gauge dependence, in light
  of arXiv:2207.07507",,,,"hep-th","http://arxiv.org/licenses/nonexclusive-distrib/1.0/","  We consider higher-spin gravity in (Euclidean) AdS_4, dual to a free vector
model on the 3d boundary. In the bulk theory, we study the linearized version
of the Didenko-Vasiliev black hole solution: a particle that couples to the
gauge fields of all spins through a BPS-like pattern of charges. We study the
interaction between two such particles at leading order. The sum over spins
cancels the UV divergences that occur when the two particles are brought close
together, for (almost) any value of the relative velocity. This is a
higher-spin enhancement of supergravity's famous feature, the cancellation of
the electric and gravitational forces between two BPS particles at rest. In the
holographic context, we point out that these ""Didenko-Vasiliev particles"" are
just the bulk duals of bilocal operators in the boundary theory. For this
identification, we use the Penrose transform between bulk fields and twistor
functions, together with its holographic dual that relates twistor functions to
boundary sources. In the resulting picture, the interaction between two
Didenko-Vasiliev particles is just a geodesic Witten diagram that calculates
the correlator of two boundary bilocals. We speculate on implications for a
possible reformulation of the bulk theory, and for its non-locality issues.
","[{""version"":""v1"",""created"":""Mon, 7 Sep 2020 05:36:53 GMT""},{""version"":""v2"",""created"":""Wed, 24 Feb 2021 04:49:23 GMT""},{""version"":""v3"",""created"":""Mon, 25 Jul 2022 07:02:16 GMT""}]","2022-07-26"
"2009.02894","Furkan Ozturk","S. Furkan Ozturk, Enes Aybar, M. O. Oktel","Temperature Dependence of the Density and Excitations of Dipolar
  Droplets","11 pages, 6 figures to appear in PRA","Phys. Rev. A 102, 033329 (2020)","10.1103/PhysRevA.102.033329",,"cond-mat.quant-gas","http://arxiv.org/licenses/nonexclusive-distrib/1.0/","  Droplet states of ultracold gases which are stabilized by fluctuations have
recently been observed for dipolar and two component Bose gases. These systems
present a novel form of equilibrium where an instability at the mean field
level is arrested by higher order correlations making the droplet states
sensitive probes of fluctuations. In a recent paper, we argued that thermal
fluctuations can play an important role for droplets even at low temperatures
where the non-condensed density is much smaller than the condensate density. We
used the Hartree-Fock-Bogoliubov theory together with local density
approximation for fluctuations to obtain a generalized Gross Pitaevskii (GP)
equation and solved it with a Gaussian variational ansatz to show that the
transition between the low density and droplet states can be significantly
modified by the temperature. In this paper, we first solve the same GP equation
numerically with a time splitting spectral method to check the validity of the
Gaussian variational ansatz. Our numerical results are in good agreement with
the Gaussian ansatz for a large parameter regime and show that the density of
the gas is most strongly modified by temperature near the abrupt transition
between a pancake shaped cloud and the droplet. For cigar shaped condensates,
as in the recent Er experiments, the dependence of the density on temperature
remains quite small throughout the smooth transition. We then consider the
effect of temperature on the collective oscillation frequencies of the droplet
using both a time dependent Gaussian variational ansatz and real time numerical
evolution. We find that the oscillation frequencies depend significantly on the
temperature close to the transition for the experimentally relevant temperature
regime ($\simeq 100$nK).
","[{""version"":""v1"",""created"":""Mon, 7 Sep 2020 05:39:22 GMT""}]","2020-09-29"
"2009.02895","Maryam Abdirad","Maryam Abdirad, Jamal Shahrabi","Detecting Informal Organization Through Data Mining Techniques","18 pages, 2 figures, 2 Tables",,,,"cs.CY cs.LG","http://creativecommons.org/licenses/by/4.0/","  One of the main topics in human resources management is the subject of
informal organizations in the organization such that recognizing and managing
such informal organizations play an important role in the organizations. Some
managers are trying to recognize the relations between informal organizations
and being a member of them by which they could assist the formal organization
development. Methods of recognizing informal organizations are complicated and
occasionally even impossible. This study aims to provide a method for
recognizing such organizations using data mining techniques. This study
classifies indices of human resources influencing the creation of informal
organizations, including individual, social, and work characteristics of an
organizations employees. Then, a questionnaire was designed and distributed
among employees. A database was created from obtained data. Applied data mining
techniques in this study are factor analysis, clustering by K-means,
classification by decision trees, and finally association rule mining by GRI
algorithm. At the end, a model is presented that is applicable for recognizing
the similar characteristics between people for optimal recognition of informal
organizations and usage of this information.
","[{""version"":""v1"",""created"":""Mon, 7 Sep 2020 05:42:37 GMT""}]","2020-09-08"
"2009.02896","Ilya Kachkovskiy","Lingrui Ge, Ilya Kachkovskiy","Ballistic transport for one-dimensional quasiperiodic Schr\""odinger
  operators",,,,,"math-ph math.DS math.MP math.SP","http://arxiv.org/licenses/nonexclusive-distrib/1.0/","  In this paper, we show that one-dimensional discrete multi-frequency
quasiperiodic Schr\""odinger operators with smooth potentials demonstrate
ballistic motion on the set of energies on which the corresponding
Schr\""odinger cocycles are smoothly reducible to constant rotations. The proof
is performed by establishing a local version of strong ballistic transport on
an exhausting sequence of subsets on which reducibility can be achieved by a
conjugation uniformly bounded in the $\mathrm{C}^{\ell}$-norm. We also
establish global strong ballistic transport under an additional integral
condition on the norms of conjugation matrices. The latter condition is quite
mild and is satisfied in many known examples.
","[{""version"":""v1"",""created"":""Mon, 7 Sep 2020 05:42:59 GMT""}]","2020-09-08"
