"2009.02997","Filippo Bistaffa","Filippo Bistaffa, Juan A. Rodr\'iguez-Aguilar, Jes\'us Cerquides","Predicting Requests in Large-Scale Online P2P Ridesharing","Presented at the 1st International Workshop on Optimization and
  Learning in Multiagent Systems (OptLearnMAS 2020)",,,,"cs.AI cs.MA","http://arxiv.org/licenses/nonexclusive-distrib/1.0/","  Peer-to-peer ridesharing (P2P-RS) enables people to arrange one-time rides
with their own private cars, without the involvement of professional drivers.
It is a prominent collective intelligence application producing significant
benefits both for individuals (reduced costs) and for the entire community
(reduced pollution and traffic), as we showed in a recent publication where we
proposed an online approximate solution algorithm for large-scale P2P-RS. In
this paper we tackle the fundamental question of assessing the benefit of
predicting ridesharing requests in the context of P2P-RS optimisation. Results
on a public real-world show that, by employing a perfect predictor, the total
reward can be improved by 5.27% with a forecast horizon of 1 minute. On the
other hand, a vanilla long short-term memory neural network cannot improve upon
a baseline predictor that simply replicates the previous day's requests, whilst
achieving an almost-double accuracy.
","[{""version"":""v1"",""created"":""Mon, 7 Sep 2020 10:27:24 GMT""}]","2020-09-08"
"2009.02998","Marija Schufrin","Marija Schufrin, Steven Lamarr Reynolds, Arjan Kuijper and J\""orn
  Kohlhammer","A Visualization Interface to Improve the Transparency of Collected
  Personal Data on the Internet",,,,,"cs.HC","http://arxiv.org/licenses/nonexclusive-distrib/1.0/","  Online services are used for all kinds of activities, like news,
entertainment, publishing content or connecting with others. But information
technology enables new threats to privacy by means of global mass surveillance,
vast databases and fast distribution networks. Current news are full of misuses
and data leakages. In most cases, users are powerless in such situations and
develop an attitude of neglect for their online behaviour. On the other hand,
the GDPR (General Data Protection Regulation) gives users the right to request
a copy of all their personal data stored by a particular service, but the
received data is hard to understand or analyze by the common internet user.
This paper presents TransparencyVis - a web-based interface to support the
visual and interactive exploration of data exports from different online
services. With this approach, we aim at increasing the awareness of personal
data stored by such online services and the effects of online behaviour. This
design study provides an online accessible prototype and a best practice to
unify data exports from different sources.
","[{""version"":""v1"",""created"":""Mon, 7 Sep 2020 10:30:26 GMT""},{""version"":""v2"",""created"":""Thu, 8 Sep 2022 11:34:53 GMT""}]","2022-09-09"
"2009.02999","Henry Burridge Dr","Henry C. Burridge, Shiwei Fan, Roderic L. Jones, Catherine J. Noakes,
  and P. F. Linden","Predictive and retrospective modelling of airborne infection risk using
  monitored carbon dioxide","Submitted to Indoor Air for review: 43 pages, 6 figures",,,,"physics.soc-ph physics.flu-dyn","http://arxiv.org/licenses/nonexclusive-distrib/1.0/","  The risk of long range, herein `airborne', infection needs to be better
understood and is especially urgent during the current COVID-19 pandemic. We
present a method to determine the relative risk of airborne transmission that
can be readily deployed with either modelled or monitored CO$_2$ data and
occupancy levels within an indoor space. For spaces regularly, or consistently,
occupied by the same group of people, e.g. an open-plan office or a school
classroom, we establish protocols to assess the absolute risk of airborne
infection of this regular attendance at work or school. We present a
methodology to easily calculate the expected number of secondary infections
arising from a regular attendee becoming infectious and remaining
pre/asymptomatic within these spaces. We demonstrate our model by calculating
risks for both a modelled open-plan office and by using monitored data recorded
within a small naturally ventilated office. In addition, by inferring
ventilation rates from monitored CO$_2$ we show that estimates of airborne
infection can be accurately reconstructed; thereby offering scope for more
informed retrospective modelling should outbreaks occur in spaces where CO$_2$
is monitored. Our modelling suggests that regular attendance at an office for
work is unlikely to significantly contribute to the pandemic but only if
relatively quiet desk-based work is carried out in the presence of adequate
ventilation (i.e. at least 10\,l/s/p following UK guidance), appropriate
hygiene controls, distancing measures, and that all commuting presents minimal
infection risk. Crucially, modelling even moderate changes to the conditions
within the office, or basing estimates for the infectivity of the SARS-CoV-2
variant B1.1.7 current data, typically results in the prediction that for a
single infector within the office the airborne route alone gives rises to more
than one secondary infection.
","[{""version"":""v1"",""created"":""Mon, 7 Sep 2020 10:31:52 GMT""},{""version"":""v2"",""created"":""Mon, 22 Feb 2021 20:12:22 GMT""}]","2021-02-24"
"2009.03000","Yu-Chen Cheng","Yu-Chen Cheng and Hong Qian","Stochastic limit-cycle oscillations of a nonlinear system under random
  perturbations",,,"10.1007/s10955-021-02724-2",,"math-ph math.DS math.MP","http://arxiv.org/licenses/nonexclusive-distrib/1.0/","  Dynamical systems with $\epsilon$ small random perturbations appear in both
continuous mechanical motions and discrete stochastic chemical kinetics. The
present work provides a detailed analysis of the central limit theorem (CLT),
with a time-inhomogeneous Gaussian process, near a deterministic limit cycle in
$\mathbb{R}^n$. Based on the theory of random perturbations of dynamical
systems and the WKB approximation respectively, results are developed in
parallel from both standpoints of stochastic trajectories and transition
probability density and their relations are elucidated. We show rigorously the
correspondence between the local Gaussian fluctuations and the curvature of the
large deviation rate function near its infimum, connecting the CLT and the
large deviation principle of diffusion processes. We study uniform asymptotic
behavior of stochastic limit cycles through the interchange of limits of time
$t\to\infty$ and $\epsilon\to 0$. Three further characterizations of stochastic
limit cycle oscillators are obtained: (i) An approximation of the probability
flux near the cycle; (ii) Two special features of the vector field for the
cyclic motion; (iii) A local entropy balance equation along the cycle with
clear physical meanings. Lastly and different from the standard treatment, the
origin of the $\epsilon$ in the theory is justified by a novel scaling
hypothesis via constructing a sequence of stochastic differential equations.
","[{""version"":""v1"",""created"":""Mon, 7 Sep 2020 10:31:53 GMT""}]","2021-03-17"
"2009.03001","Alberto Gutierrez-Torre","Alberto Gutierrez-Torre, Josep Ll. Berral, David Buchaca, Marc
  Guevara, Albert Soret, David Carrera","Improving Maritime Traffic Emission Estimations on Missing Data with
  CRBMs","12 pages, 7 figures. Postprint accepted manuscript, find the full
  version at Engineering Applications of Artificial Intelligence
  (https://doi.org/10.1016/j.engappai.2020.103793)","Engineering Applications of Artificial Intelligence Volume 94,
  September 2020, 103793","10.1016/j.engappai.2020.103793",,"cs.CY cs.CE cs.LG cs.NE","http://arxiv.org/licenses/nonexclusive-distrib/1.0/","  Maritime traffic emissions are a major concern to governments as they heavily
impact the Air Quality in coastal cities. Ships use the Automatic
Identification System (AIS) to continuously report position and speed among
other features, and therefore this data is suitable to be used to estimate
emissions, if it is combined with engine data. However, important ship features
are often inaccurate or missing. State-of-the-art complex systems, like CALIOPE
at the Barcelona Supercomputing Center, are used to model Air Quality. These
systems can benefit from AIS based emission models as they are very precise in
positioning the pollution. Unfortunately, these models are sensitive to missing
or corrupted data, and therefore they need data curation techniques to
significantly improve the estimation accuracy. In this work, we propose a
methodology for treating ship data using Conditional Restricted Boltzmann
Machines (CRBMs) plus machine learning methods to improve the quality of data
passed to emission models. Results show that we can improve the default methods
proposed to cover missing data. In our results, we observed that using our
method the models boosted their accuracy to detect otherwise undetectable
emissions. In particular, we used a real data-set of AIS data, provided by the
Spanish Port Authority, to estimate that thanks to our method, the model was
able to detect 45% of additional emissions, of additional emissions,
representing 152 tonnes of pollutants per week in Barcelona and propose new
features that may enhance emission modeling.
","[{""version"":""v1"",""created"":""Mon, 7 Sep 2020 10:32:43 GMT""},{""version"":""v2"",""created"":""Thu, 10 Sep 2020 09:04:42 GMT""}]","2020-09-11"
"2009.03002","Mai Elshehaly","Mai Elshehaly, Rebecca Randell, Matthew Brehmer, Lynn McVey, Natasha
  Alvarado, Chris P. Gale, Roy A. Ruddle","QualDash: Adaptable Generation of Visualisation Dashboards for
  Healthcare Quality Improvement",,,,,"cs.HC","http://arxiv.org/licenses/nonexclusive-distrib/1.0/","  Adapting dashboard design to different contexts of use is an open question in
visualisation research. Dashboard designers often seek to strike a balance
between dashboard adaptability and ease-of-use, and in hospitals challenges
arise from the vast diversity of key metrics, data models and users involved at
different organizational levels. In this design study, we present QualDash, a
dashboard generation engine that allows for the dynamic configuration and
deployment of visualisation dashboards for healthcare quality improvement (QI).
We present a rigorous task analysis based on interviews with healthcare
professionals, a co-design workshop and a series of one-on-one meetings with
front line analysts. From these activities we define a metric card metaphor as
a unit of visual analysis in healthcare QI, using this concept as a building
block for generating highly adaptable dashboards, and leading to the design of
a Metric Specification Structure (MSS). Each MSS is a JSON structure which
enables dashboard authors to concisely configure unit-specific variants of a
metric card, while offloading common patterns that are shared across cards to
be preset by the engine. We reflect on deploying and iterating the design of
QualDash in cardiology wards and pediatric intensive care units of five NHS
hospitals. Finally, we report evaluation results that demonstrate the
adaptability, ease-of-use and usefulness of QualDash in a real-world scenario.
","[{""version"":""v1"",""created"":""Mon, 7 Sep 2020 10:33:43 GMT""}]","2020-09-08"
"2009.03003","Tobias Mistele","Tobias Mistele","Three problems of superfluid dark matter and their solution","34 pages, 5 figures, published version","JCAP 2101 (2021) 025","10.1088/1475-7516/2021/01/025",,"gr-qc hep-ph hep-th","http://arxiv.org/licenses/nonexclusive-distrib/1.0/","  In superfluid dark matter (SFDM), the phonon field plays a double role: It
carries the superfluid's energy density and it mediates the MOND-like phonon
force. We show that these two roles are in tension with each other on galactic
scales: A MOND-like phonon force is in tension with a superfluid in equilibrium
and with a significant superfluid energy density. To avoid these tensions, we
propose a model where the two roles are split between two different fields.
This also allows us to solve a stability problem in a more elegant way than
standard SFDM. We argue that the standard estimates for the size of a galaxy's
superfluid core need to be revisited.
","[{""version"":""v1"",""created"":""Mon, 7 Sep 2020 10:37:17 GMT""},{""version"":""v2"",""created"":""Tue, 17 Nov 2020 10:59:46 GMT""},{""version"":""v3"",""created"":""Fri, 15 Jan 2021 11:43:40 GMT""}]","2021-01-18"
"2009.03004","Stefan Wurster","Stefan Wurster, Martin Stueckler, Lukas Weissitsch, Timo Mueller,
  Andrea Bachmaier","Microstructural Changes Influencing the Magnetoresistive Behavior of
  Bulk Nanocrystalline Materials",,"Appl. Sci. 2020, 10, 5094","10.3390/app10155094",,"cond-mat.mtrl-sci","http://creativecommons.org/licenses/by/4.0/","  Bulk nanocrystalline materials of small and medium ferromagnetic content were
produced using severe plastic deformation by high-pressure torsion at
roomtemperature. Giant magnetoresistive behavior was found for as deformed
materials, which was further improved by adjusting the microstructure with
thermal treatments. The adequate range of annealing temperatures was assessed
with in-situ synchrotron diffraction measurements. Thermally treated CuCo
materials show larger giant magnetoresistance after annealing for 1 h at 300C,
while for CuFe this annealing temperature is too high and decreases the
magnetoresistive properties. The improvement of magnetoresistivity by thermal
treatments is discussed with respect to the microstructural evolution as
observed by electron microscopy and ex situ synchrotron diffraction
measurements.
","[{""version"":""v1"",""created"":""Mon, 7 Sep 2020 10:39:29 GMT""}]","2020-09-08"
"2009.03005","Mohammed Al-Rawi","Mohammed Al-Rawi and Joeran Beel","Towards an Interoperable Data Protocol Aimed at Linking the Fashion
  Industry with AI Companies",,,,,"cs.CY cs.AI","http://arxiv.org/licenses/nonexclusive-distrib/1.0/","  The fashion industry is looking forward to use artificial intelligence
technologies to enhance their processes, services, and applications. Although
the amount of fashion data currently in use is increasing, there is a large gap
in data exchange between the fashion industry and the related AI companies, not
to mention the different structure used for each fashion dataset. As a result,
AI companies are relying on manually annotated fashion data to build different
applications. Furthermore, as of this writing, the terminology, vocabulary and
methods of data representation used to denote fashion items are still ambiguous
and confusing. Hence, it is clear that the fashion industry and AI companies
will benefit from a protocol that allows them to exchange and organise fashion
information in a unified way. To achieve this goal we aim (1) to define a
protocol called DDOIF that will allow interoperability of fashion data; (2) for
DDOIF to contain diverse entities including extensive information on clothing
and accessories attributes in the form of text and various media formats; and
(3)To design and implement an API that includes, among other things, functions
for importing and exporting a file built according to the DDOIF protocol that
stores all information about a single item of clothing. To this end, we
identified over 1000 class and subclass names used to name fashion items and
use them to build the DDOIF dictionary. We make DDOIF publicly available to all
interested users and developers and look forward to engaging more collaborators
to improve and enrich it.
","[{""version"":""v1"",""created"":""Mon, 7 Sep 2020 10:40:09 GMT""}]","2020-09-10"
"2009.03006","Kenji Fukushima","Kenji Fukushima, Bedangadas Mohanty, Nu Xu","Little-Bang and Femto-Nova in Nucleus-Nucleus Collisions","14 pages, 7 pages, a review contributed to the AAPPS Bulletin","AAPPS Bull. 31 (2021) 1","10.1007/s43673-021-00002-7",,"hep-ph hep-ex nucl-th","http://arxiv.org/licenses/nonexclusive-distrib/1.0/","  We make a theoretical and experimental summary of the state-of-the-art status
of hot and dense QCD matter studies on selected topics. We review the Beam
Energy Scan program for the QCD phase diagram and present the current status of
search for QCD Critical Point, particle production in high baryon density
region, hypernuclei production, and global polarization effects in
nucleus-nucleus collisions. The available experimental data in the strangeness
sector suggests that a grand canonical approach in thermal model at high
collision energy makes a transition to the canonical ensemble behavior at low
energy. We further discuss future prospects of nuclear collisions to probe
properties of baryon-rich matter. Creation of a quark-gluon plasma at high
temperature and low baryon density has been called the ""Little-Bang"" and,
analogously, a femtometer-scale explosion of baryon-rich matter at lower
collision energy could be called the ""Femto-Nova"", which may possibly sustain
substantial vorticity and magnetic field for non-head-on collisions.
","[{""version"":""v1"",""created"":""Mon, 7 Sep 2020 10:45:54 GMT""}]","2021-04-16"
"2009.03007","Maarten Solleveld","Maarten Solleveld","Affine Hecke algebras and their representations","In the second version some typos were fixed and a paragraph about
  Hecke algebras of type B_n/C_n was added","Indagationes Mathematica (2021)","10.1016/j.indag.2021.01.005",,"math.RT","http://arxiv.org/licenses/nonexclusive-distrib/1.0/","  This is a survey paper about affine Hecke algebras. We start from scratch and
discuss some algebraic aspects of their representation theory, referring to the
literature for proofs. We aim in particular at the classification of
irreducible representations.
  Only at the end we establish a new result: a natural bijection between the
set of irreducible representations of an affine Hecke algebra with real
parameters $\geq 1$, and the set of irreducible representations of the affine
Weyl group underlying the algebra. This can be regarded as a generalized
Springer correspondence with affine Hecke algebras.
","[{""version"":""v1"",""created"":""Mon, 7 Sep 2020 10:46:03 GMT""},{""version"":""v2"",""created"":""Tue, 12 Jan 2021 08:36:15 GMT""}]","2021-06-08"
"2009.03008","Tomer Weiss","Tomer Weiss, Sanketh Vedula, Ortal Senouf, Oleg Michailovich, and
  AlexBronstein","Towards learned optimal q-space sampling in diffusion MRI","CDMRI 2020",,,,"eess.IV cs.CV cs.LG","http://creativecommons.org/licenses/by-nc-sa/4.0/","  Fiber tractography is an important tool of computational neuroscience that
enables reconstructing the spatial connectivity and organization of white
matter of the brain. Fiber tractography takes advantage of diffusion Magnetic
Resonance Imaging (dMRI) which allows measuring the apparent diffusivity of
cerebral water along different spatial directions. Unfortunately, collecting
such data comes at the price of reduced spatial resolution and substantially
elevated acquisition times, which limits the clinical applicability of dMRI.
This problem has been thus far addressed using two principal strategies. Most
of the efforts have been extended towards improving the quality of signal
estimation for any, yet fixed sampling scheme (defined through the choice of
diffusion-encoding gradients). On the other hand, optimization over the
sampling scheme has also proven to be effective. Inspired by the previous
results, the present work consolidates the above strategies into a unified
estimation framework, in which the optimization is carried out with respect to
both estimation model and sampling design {\it concurrently}. The proposed
solution offers substantial improvements in the quality of signal estimation as
well as the accuracy of ensuing analysis by means of fiber tractography. While
proving the optimality of the learned estimation models would probably need
more extensive evaluation, we nevertheless claim that the learned sampling
schemes can be of immediate use, offering a way to improve the dMRI analysis
without the necessity of deploying the neural network used for their
estimation. We present a comprehensive comparative analysis based on the Human
Connectome Project data. Code and learned sampling designs aviliable at
https://github.com/tomer196/Learned_dMRI.
","[{""version"":""v1"",""created"":""Mon, 7 Sep 2020 10:46:12 GMT""}]","2020-09-08"
"2009.03009","Matin Hashemi","Amir Amirinezhad, Saber Salehkaleybar, Matin Hashemi","Active Learning of Causal Structures with Deep Reinforcement Learning","submitted for peer review",,,,"cs.AI cs.LG","http://arxiv.org/licenses/nonexclusive-distrib/1.0/","  We study the problem of experiment design to learn causal structures from
interventional data. We consider an active learning setting in which the
experimenter decides to intervene on one of the variables in the system in each
step and uses the results of the intervention to recover further causal
relationships among the variables. The goal is to fully identify the causal
structures with minimum number of interventions. We present the first deep
reinforcement learning based solution for the problem of experiment design. In
the proposed method, we embed input graphs to vectors using a graph neural
network and feed them to another neural network which outputs a variable for
performing intervention in each step. Both networks are trained jointly via a
Q-iteration algorithm. Experimental results show that the proposed method
achieves competitive performance in recovering causal structures with respect
to previous works, while significantly reducing execution time in dense graphs.
","[{""version"":""v1"",""created"":""Mon, 7 Sep 2020 10:49:06 GMT""}]","2020-09-09"
"2009.03010","Slawomir Simbierowicz","Slawomir Simbierowicz, Visa Vesterinen, Joshua Milem, Aleksi Lintunen,
  Mika Oksanen, Leif Roschier, Leif Gr\""onberg, Juha Hassel, David Gunnarsson,
  and Russell E. Lake","Characterizing cryogenic amplifiers with a matched temperature-variable
  noise source","The following article has been accepted by Review of Scientific
  Instruments. After it is published, it will be found at
  https://doi.org/10.1063/5.0028951",,"10.1063/5.0028951",,"quant-ph cond-mat.mes-hall cond-mat.supr-con physics.app-ph","http://arxiv.org/licenses/nonexclusive-distrib/1.0/","  We present a cryogenic microwave noise source with a characteristic impedance
of 50 $\Omega$, which can be installed in a coaxial line of a cryostat. The
bath temperature of the noise source is continuously variable between 0.1 K and
5 K without causing significant back-action heating on the sample space. As a
proof-of-concept experiment, we perform Y-factor measurements of an amplifier
cascade that includes a traveling wave parametric amplifier and a commercial
high electron mobility transistor amplifier. We observe system noise
temperatures as low as $680^{+20}_{-200}$ mK at 5.7 GHz corresponding to
$1.5^{+0.1}_{-0.7}$ excess photons. The system we present has immediate
applications in the validation of solid-state qubit readout lines.
","[{""version"":""v1"",""created"":""Mon, 7 Sep 2020 10:52:09 GMT""},{""version"":""v2"",""created"":""Thu, 25 Feb 2021 15:53:45 GMT""}]","2021-02-26"
"2009.03011","Shaoshan Liu","Shaoshan Liu","Critical Business Decision Making for Technology Startups -- A PerceptIn
  Case Study","to appear in IEEE Engineering Management Review",,,,"cs.CY cs.AR cs.RO","http://arxiv.org/licenses/nonexclusive-distrib/1.0/","  Most business decisions are made with analysis, but some are judgment calls
not susceptible to analysis due to time or information constraints. In this
article, we present a real-life case study of critical business decision making
of PerceptIn, an autonomous driving technology startup. In early years of
PerceptIn, PerceptIn had to make a decision on the design of computing systems
for its autonomous vehicle products. By providing details on PerceptIn's
decision process and the results of the decision, we hope to provide some
insights that can be beneficial to entrepreneurs and engineering managers in
technology startups.
","[{""version"":""v1"",""created"":""Mon, 7 Sep 2020 10:52:20 GMT""}]","2020-09-08"
"2009.03012","Qinghua Lu","Yue Liu, Qinghua Lu, Chunsheng Zhu, Qiuyu Yu","A Blockchain-based Platform Architecture for Multimedia Data Management",,,,,"cs.CR cs.SE","http://arxiv.org/licenses/nonexclusive-distrib/1.0/","  Massive amounts of multimedia data (i.e., text, audio, video, graphics and
animation) are being generated everyday. Conventionally, multimedia data are
managed by the platforms maintained by multimedia service providers, which are
generally designed using centralised architecture. However, such centralised
architecture may lead to a single point of failure and disputes over royalties
or other rights. It is hard to ensure the data integrity and track fulfilment
of obligations listed on the copyright agreement. To tackle these issues, in
this paper, we present a blockchain-based platform architecture for multimedia
data management. We adopt self-sovereign identity for identity management and
design a multi-level capability-based mechanism for access control. We
implement a proof-of-concept prototype using the proposed approach and evaluate
it using a use case. The results show that the proposed approach is feasible
and has scalable performance.
","[{""version"":""v1"",""created"":""Mon, 7 Sep 2020 10:52:51 GMT""}]","2020-09-08"
