"2009.03106","Jaewoo Lee","Jaewoo Lee and Daniel Kifer","Scaling up Differentially Private Deep Learning with Fast Per-Example
  Gradient Clipping","To appear in PETS2021",,,,"cs.LG stat.ML","http://arxiv.org/licenses/nonexclusive-distrib/1.0/","  Recent work on Renyi Differential Privacy has shown the feasibility of
applying differential privacy to deep learning tasks. Despite their promise,
however, differentially private deep networks often lag far behind their
non-private counterparts in accuracy, showing the need for more research in
model architectures, optimizers, etc. One of the barriers to this expanded
research is the training time -- often orders of magnitude larger than training
non-private networks. The reason for this slowdown is a crucial privacy-related
step called ""per-example gradient clipping"" whose naive implementation undoes
the benefits of batch training with GPUs. By analyzing the back-propagation
equations we derive new methods for per-example gradient clipping that are
compatible with auto-differentiation (e.g., in PyTorch and TensorFlow) and
provide better GPU utilization. Our implementation in PyTorch showed
significant training speed-ups (by factors of 54x - 94x for training various
models with batch sizes of 128). These techniques work for a variety of
architectural choices including convolutional layers, recurrent networks,
attention, residual blocks, etc.
","[{""version"":""v1"",""created"":""Mon, 7 Sep 2020 13:51:26 GMT""}]","2020-09-08"
"2009.03107","Tong Liu","Tong Liu, Roberto Amadini, Jacopo Mauro, Maurizio Gabbrielli","sunny-as2: Enhancing SUNNY for Algorithm Selection",,"Journal of Artificial Intelligence Research. 72 (2021) 329-376","10.1613/jair.1.13116",,"cs.AI cs.LG","http://arxiv.org/licenses/nonexclusive-distrib/1.0/","  SUNNY is an Algorithm Selection (AS) technique originally tailored for
Constraint Programming (CP). SUNNY enables to schedule, from a portfolio of
solvers, a subset of solvers to be run on a given CP problem. This approach has
proved to be effective for CP problems, and its parallel version won many gold
medals in the Open category of the MiniZinc Challenge -- the yearly
international competition for CP solvers. In 2015, the ASlib benchmarks were
released for comparing AS systems coming from disparate fields (e.g., ASP, QBF,
and SAT) and SUNNY was extended to deal with generic AS problems. This led to
the development of sunny-as2, an algorithm selector based on SUNNY for ASlib
scenarios. A preliminary version of sunny-as2 was submitted to the Open
Algorithm Selection Challenge (OASC) in 2017, where it turned out to be the
best approach for the runtime minimization of decision problems. In this work,
we present the technical advancements of sunny-as2, including: (i)
wrapper-based feature selection; (ii) a training approach combining feature
selection and neighbourhood size configuration; (iii) the application of nested
cross-validation. We show how sunny-as2 performance varies depending on the
considered AS scenarios, and we discuss its strengths and weaknesses. Finally,
we also show how sunny-as2 improves on its preliminary version submitted to
OASC.
","[{""version"":""v1"",""created"":""Mon, 7 Sep 2020 13:55:45 GMT""},{""version"":""v2"",""created"":""Sun, 26 Sep 2021 08:53:15 GMT""},{""version"":""v3"",""created"":""Tue, 12 Oct 2021 09:49:31 GMT""}]","2023-03-21"
"2009.03108","Chao Zhu","Chao Zhu, Teng Miao, Tongyu Xu, Tao Yang, Na Li","Stem-leaf segmentation and phenotypic trait extraction of maize shoots
  from three-dimensional point cloud",,,,,"cs.CV","http://arxiv.org/licenses/nonexclusive-distrib/1.0/","  Nowadays, there are many approaches to acquire three-dimensional (3D) point
clouds of maize plants. However, automatic stem-leaf segmentation of maize
shoots from three-dimensional (3D) point clouds remains challenging, especially
for new emerging leaves that are very close and wrapped together during the
seedling stage. To address this issue, we propose an automatic segmentation
method consisting of three main steps: skeleton extraction, coarse segmentation
based on the skeleton, fine segmentation based on stem-leaf classification. The
segmentation method was tested on 30 maize seedlings and compared with manually
obtained ground truth. The mean precision, mean recall, mean micro F1 score and
mean over accuracy of our segmentation algorithm were 0.964, 0.966, 0.963 and
0.969. Using the segmentation results, two applications were also developed in
this paper, including phenotypic trait extraction and skeleton optimization.
Six phenotypic parameters can be accurately and automatically measured,
including plant height, crown diameter, stem height and diameter, leaf width
and length. Furthermore, the values of R2 for the six phenotypic traits were
all above 0.94. The results indicated that the proposed algorithm could
automatically and precisely segment not only the fully expanded leaves, but
also the new leaves wrapped together and close together. The proposed approach
may play an important role in further maize research and applications, such as
genotype-to-phenotype study, geometric reconstruction and dynamic growth
animation. We released the source code and test data at the web site
https://github.com/syau-miao/seg4maize.git
","[{""version"":""v1"",""created"":""Mon, 7 Sep 2020 13:58:09 GMT""}]","2020-09-08"
"2009.03109","Yevgeny Raitses","Yevgeny Raitses, Sebastian Engelmann, Shahid Rauf, Igor Kaganovich,
  Jonathan Menard and Steven Cowely","Atomic Precision Processing of New Materials for Frontier
  Microelectronic Applications in High Performance Computing and Artificial
  Intelligence","7 pages",,,,"physics.app-ph physics.plasm-ph","http://arxiv.org/licenses/nonexclusive-distrib/1.0/","  This document is a joint response by scientists from the Princeton Plasma
Physics Laboratory, IBM T. J. Watson Research Center and Applied Materials,
Inc. to the DOE Office of Science (DOE-SC) Request for Information: Basic
Research Initiative for Microelectronics
(https://www.federalregister.gov/documents/2019/07/12/2019-14869/request-for-information-basic-research-initiative-for-microelectronics).
Specifically, we propose DOE-SC to include the following topics in their
consideration for future solicitations on Microelectronics: 1) The development
of a real-time monitoring and in-situ diagnostic techniques that can provide
information on plasma, substrate surface, and interaction between both during
atomic precision processing of complex materials for the most advanced
microelectronic devices with applications to high performance computing and
artificial intelligence, and 2) The development of experimentally validated
modeling tools to predict processing dynamics including plasma, chemical and
material processes involved.
","[{""version"":""v1"",""created"":""Mon, 7 Sep 2020 13:58:29 GMT""}]","2020-09-08"
"2009.03110","Maciej Stankiewicz MSc","Edgar A. Aguilar, Hanna Wojew\'odka-\'Sci\k{a}\.zko, Maciej
  Stankiewicz, Christopher Perry, Piotr \'Cwikli\'nski, Andrzej Grudka, Karol
  Horodecki, Micha{\l} Horodecki","Thermal Operations in general are not memoryless","26 pages, 13 figures",,,,"quant-ph","http://arxiv.org/licenses/nonexclusive-distrib/1.0/","  So-called Thermal Operations seem to describe the most fundamental, and
reasonable, set of operations allowable for state transformations at an ambient
inverse temperature $\beta$. However, a priori, they require experimentalists
to manipulate very complex environments and have control over their internal
degrees of freedom. For this reason, the community has been working on creating
more experimentally-friendly operations. In [Perry et al., Phys. Rev. X 8,
041049] it was shown that for states diagonal in the energy basis, that Thermal
Operations can be performed by so-called Coarse Operations, which need just one
auxiliary qubit, but are otherwise Markovian and classical in spirit. In this
work, by providing an explicit counterexample, we show that this one qubit of
memory is necessary. We also fully characterize the possible transitions that
do not require memory for the system being a qubit. We do this by analyzing
arbitrary control sequences comprising level energy changes and partial
thermalizations in each step.
","[{""version"":""v1"",""created"":""Mon, 7 Sep 2020 13:59:47 GMT""}]","2020-09-08"
"2009.03111","Jos\'e Aliste-Prieto","Jos\'e Aliste-Prieto, Betseygail Rand, Lorenzo Sadun","Rotation numbers and rotation classes on one-dimensional tiling spaces",,,"10.1007/s00023-021-01019-2",,"math.DS","http://arxiv.org/licenses/nonexclusive-distrib/1.0/","  We extend rotation theory of circle maps to tiling spaces. Specifically, we
consider a 1-dimensional tiling space $\Omega$ with finite local complexity and
study
  self-maps $F$ that are homotopic to the identity and whose displacements are
strongly pattern equivariant (sPE). In place of the familiar rotation number we
define a cohomology class $[\mu]$. We prove existence and uniqueness results
for this class, develop a notion of irrationality, and prove an analogue of
Poncar\'{e}'s Theorem: If $[\mu]$ is irrational, then $F$ is semi-conjugate to
uniform translation on a space $\Omega_\mu$ of tilings that is homeomorphic to
$\Omega$. In such cases, $F$ is semi-conjugate to uniform translation on
$\Omega$ itself if and only if $[\mu]$ lies in a certain subspace of the first
cohomology group of $\Omega$.
","[{""version"":""v1"",""created"":""Mon, 7 Sep 2020 14:00:24 GMT""}]","2021-08-04"
"2009.03112","Jesper Gjerloev","L. Orr, S.C. Chapman and J.W. Gjerloev","Directed Network of Substorms Using SuperMAG Ground-Based Magnetometer
  Data",,,"10.1029/2019GL082824",,"physics.space-ph","http://arxiv.org/licenses/nonexclusive-distrib/1.0/","  We quantify the spatiotemporal evolution of the substorm ionospheric current
system utilizing the SuperMAG 100+ magnetometers.We construct dynamical
directed networks from this data for the first time. If the canonical
cross-correlation between vector magnetic field perturbations observed at two
magnetometer stations exceeds a threshold, they form a network connection. The
time lag at which canonical cross-correlation is maximal determines the
direction of propagation or expansion of the structure captured by the network
connection. If spatial correlation reflects ionospheric current patterns,
network properties can test different models for the evolving substorm current
system.We select 86 isolated substorms based on nightside ground station
coverage. We find, and obtain the timings for, a consistent picture in which
the classic substorm current wedge forms. A current system is seen premidnight
following the substorm current wedge westward expansion. Later, there is a
weaker signal of eastward expansion. Finally, there is evidence of
substorm-enhanced convection.
","[{""version"":""v1"",""created"":""Mon, 7 Sep 2020 14:01:02 GMT""}]","2020-09-08"
"2009.03113","Elias Karabelas","Jana Fuchsberger, Elias Karabelas, Philipp Aigner, Steven Niederer,
  Gernot Plank, Heinrich Schima, and Gundolf Haase","On the Incorporation of Obstacles in a Fluid Flow Problem Using a
  Navier-Stokes-Brinkman Penalization Approach",,,"10.1016/j.jocs.2021.101506",,"physics.flu-dyn","http://creativecommons.org/licenses/by-nc-nd/4.0/","  Simulating the interaction of fluids with immersed moving solids is playing
an important role for gaining a better quantitative understanding of how fluid
dynamics is altered by the presence of obstacles and which forces are exerted
on the solids by the moving fluid. Such problems appear in various contexts,
ranging from numerous technical applications such as turbines to medical
problems such as the regulation of hemodyamics by valves. Typically, the
numerical treatment of such problems is posed within a fluid structure
interaction (FSI) framework. General FSI models are able to capture
bidirectional interactions, but are challenging to solve and computationally
expensive. Simplified methods offer a possible remedy by achieving better
computational efficiency to broaden the scope to demanding application problems
with focus on understanding the effect of solids on altering fluid dynamics. In
this study we report on the development of a novel method for such
applications. In our method rigid moving obstacles are incorporated in a fluid
dynamics context using concepts from porous media theory. Based on the
Navier-Stokes-Brinkman equations which augments the Navier-Stokes equation with
a Darcy drag term our method represents solid obstacles as time-varying regions
containing a porous medium of vanishing permeability. Numerical stabilization
and turbulence modeling is dealt with by using a residual based variational
multiscale formulation. The key advantages of our approach -- computational
efficiency and ease of implementation -- are demonstrated by solving a standard
benchmark problem of a rotating blood pump posed by the Food and Drug
Administration Agency (FDA). Validity is demonstrated by conducting a mesh
convergence study and by comparison against the extensive set of experimental
data provided for this benchmark.
","[{""version"":""v1"",""created"":""Mon, 7 Sep 2020 14:01:09 GMT""},{""version"":""v2"",""created"":""Mon, 15 Mar 2021 13:48:33 GMT""},{""version"":""v3"",""created"":""Fri, 3 Sep 2021 09:16:48 GMT""}]","2021-12-15"
"2009.03114","Pei-Pei Zhang","Xiao-Qiu Qi, Pei-Pei Zhang, Zong-Chao Yan, G. W. F. Drake, Zhen-Xiang
  Zhong, Ting-Yun Shi, Shao-Long Chen, Yao Huang, Hua Guan, Ke-Lin Gao","Precision calculation of hyperfine structure and the Zemach radii of
  $^{6,7}$Li$^+$ ions",,"Phys. Rev. Lett. 125, 183002 (2020)","10.1103/PhysRevLett.125.183002",,"physics.atom-ph","http://arxiv.org/licenses/nonexclusive-distrib/1.0/","  The hyperfine structures of the $2\,^3\!S_1$ states of the $^6$Li$^+$ and
$^7$Li$^+$ ions are investigated theoretically to extract the Zemach radii of
the $^6$Li and $^7$Li nuclei by comparing with precision measurements. The
obtained Zemach radii are larger than the previous values of Puchalski and
Pachucki [\href{https://link.aps.org/doi/10.1103/PhysRevLett.111.243001}{Phys.
Rev. Lett. {\bf 111}, 243001 (2013)}] and disagree with them by about 1.5 and
2.2 standard deviations for $^6$Li and $^7$Li, respectively. Furthermore, our
Zemach radius of $^6$Li differs significantly from the nuclear physics value,
derived from the nuclear charge and magnetic radii
[\href{https://link.aps.org/doi/10.1103/PhysRevA.78.012513}{Phys. Rev. A {\bf
78}, 012513 (2008)}], by more than 6 sigma, indicating an anomalous nuclear
structure for $^6$Li. The conclusion that the Zemach radius of $^7$Li is about
40\% larger than that of $^6$Li is confirmed. The obtained Zemach radii are
used to calculate the hyperfine splittings of the $2\,^3\!P_J$ states of
$^{6,7}$Li$^+$, where an order of magnitude improvement over the previous
theory has been achieved for $^7$Li$^+$.
","[{""version"":""v1"",""created"":""Mon, 7 Sep 2020 14:02:37 GMT""}]","2020-11-04"
"2009.03115","Youngtaek Kim","Youngtaek Kim, Jaeyoung Kim, Hyeon Jeon, Young-Ho Kim, Hyunjoo Song,
  Bohyoung Kim, Jinwook Seo","Githru: Visual Analytics for Understanding Software Development History
  Through Git Metadata Analysis","IEEE VIS 2020 (VAST), ACM 2012 CCS - Human-centered computing,
  Visualization","IEEE Transactions on Visualization and Computer Graphics (TVCG)
  Feb. 2021, pp. 656-666, vol. 27","10.1109/TVCG.2020.3030414",,"cs.SE cs.HC","http://arxiv.org/licenses/nonexclusive-distrib/1.0/","  Git metadata contains rich information for developers to understand the
overall context of a large software development project. Thus it can help new
developers, managers, and testers understand the history of development without
needing to dig into a large pile of unfamiliar source code. However, the
current tools for Git visualization are not adequate to analyze and explore the
metadata: They focus mainly on improving the usability of Git commands instead
of on helping users understand the development history. Furthermore, they do
not scale for large and complex Git commit graphs, which can play an important
role in understanding the overall development history. In this paper, we
present Githru, an interactive visual analytics system that enables developers
to effectively understand the context of development history through the
interactive exploration of Git metadata. We design an interactive visual
encoding idiom to represent a large Git graph in a scalable manner while
preserving the topological structures in the Git graph. To enable scalable
exploration of a large Git commit graph, we propose novel techniques (graph
reconstruction, clustering, and Context-Preserving Squash Merge (CSM) methods)
to abstract a large-scale Git commit graph. Based on these Git commit graph
abstraction techniques, Githru provides an interactive summary view to help
users gain an overview of the development history and a comparison view in
which users can compare different clusters of commits. The efficacy of Githru
has been demonstrated by case studies with domain experts using real-world,
in-house datasets from a large software development team at a major
international IT company. A controlled user study with 12 developers comparing
Githru to previous tools also confirms the effectiveness of Githru in terms of
task completion time.
","[{""version"":""v1"",""created"":""Mon, 7 Sep 2020 14:06:59 GMT""},{""version"":""v2"",""created"":""Tue, 8 Sep 2020 04:15:19 GMT""}]","2021-04-29"
"2009.03116","Magnus Sahlgren","Tim Isbister and Magnus Sahlgren","Why Not Simply Translate? A First Swedish Evaluation Benchmark for
  Semantic Similarity","SLTC 2020",,,,"cs.CL","http://arxiv.org/licenses/nonexclusive-distrib/1.0/","  This paper presents the first Swedish evaluation benchmark for textual
semantic similarity. The benchmark is compiled by simply running the English
STS-B dataset through the Google machine translation API. This paper discusses
potential problems with using such a simple approach to compile a Swedish
evaluation benchmark, including translation errors, vocabulary variation, and
productive compounding. Despite some obvious problems with the resulting
dataset, we use the benchmark to compare the majority of the currently existing
Swedish text representations, demonstrating that native models outperform
multilingual ones, and that simple bag of words performs remarkably well.
","[{""version"":""v1"",""created"":""Mon, 7 Sep 2020 14:07:12 GMT""},{""version"":""v2"",""created"":""Sun, 29 Nov 2020 10:04:27 GMT""}]","2020-12-01"
"2009.03117","Ivo V. Stoepker","Ivo V. Stoepker, Rui M. Castro, Ery Arias-Castro, Edwin van den Heuvel","Anomaly Detection for a Large Number of Streams: A Permutation-Based
  Higher Criticism Approach",,,,,"stat.ME math.ST stat.TH","http://arxiv.org/licenses/nonexclusive-distrib/1.0/","  Anomaly detection when observing a large number of data streams is essential
in a variety of applications, ranging from epidemiological studies to
monitoring of complex systems. High-dimensional scenarios are usually tackled
with scan-statistics and related methods, requiring stringent modeling
assumptions for proper calibration. In this work we take a non-parametric
stance, and propose a permutation-based variant of the higher criticism
statistic not requiring knowledge of the null distribution. This results in an
exact test in finite samples which is asymptotically optimal in the wide class
of exponential models. We demonstrate the power loss in finite samples is
minimal with respect to the oracle test. Furthermore, since the proposed
statistic does not rely on asymptotic approximations it typically performs
better than popular variants of higher criticism that rely on such
approximations. We include recommendations such that the test can be readily
applied in practice, and demonstrate its applicability in monitoring the
content uniformity of an active ingredient for a batch-produced drug product.
","[{""version"":""v1"",""created"":""Mon, 7 Sep 2020 14:07:31 GMT""},{""version"":""v2"",""created"":""Thu, 22 Jul 2021 15:15:21 GMT""},{""version"":""v3"",""created"":""Thu, 6 Oct 2022 13:30:07 GMT""}]","2022-10-07"
"2009.03118","Iman Marivani","Iman Marivani, Evaggelia Tsiligianni, Bruno Cornelis, Nikos
  Deligiannis","Interpretable Deep Multimodal Image Super-Resolution","in Proceedings of iTWIST'20, Paper-ID: 41, Nantes, France, December,
  2-4, 2020",,,,"cs.CV","http://arxiv.org/licenses/nonexclusive-distrib/1.0/","  Multimodal image super-resolution (SR) is the reconstruction of a high
resolution image given a low-resolution observation with the aid of another
image modality. While existing deep multimodal models do not incorporate domain
knowledge about image SR, we present a multimodal deep network design that
integrates coupled sparse priors and allows the effective fusion of information
from another modality into the reconstruction process. Our method is inspired
by a novel iterative algorithm for coupled convolutional sparse coding,
resulting in an interpretable network by design. We apply our model to the
super-resolution of near-infrared image guided by RGB images. Experimental
results show that our model outperforms state-of-the-art methods.
","[{""version"":""v1"",""created"":""Mon, 7 Sep 2020 14:08:35 GMT""}]","2020-09-08"
"2009.03119","Shoham Letzter","Shoham Letzter","An improvement on {\L}uczak's connected matchings method","17 pages",,,,"math.CO","http://arxiv.org/licenses/nonexclusive-distrib/1.0/","  A connected matching in a graph $G$ is a matching contained in a connected
component of $G$. A well-known method due to {\L}uczak reduces problems about
monochromatic paths and cycles in complete graphs to problems about
monochromatic connected matchings in almost complete graphs. We show that these
can be further reduced to problems about monochromatic connected matchings in
complete graphs.
  We illustrate the potential of this new reduction by showing how it can be
used to determine the $3$-colour Ramsey number of long paths, using a simpler
argument than the original one by Gy\'arf\'as, Ruszink\'o, S\'ark\""ozy, and
Szemer\'edi (2007).
","[{""version"":""v1"",""created"":""Mon, 7 Sep 2020 14:09:01 GMT""},{""version"":""v2"",""created"":""Tue, 9 Feb 2021 18:45:46 GMT""},{""version"":""v3"",""created"":""Mon, 30 Aug 2021 15:40:47 GMT""},{""version"":""v4"",""created"":""Thu, 21 Apr 2022 11:40:00 GMT""}]","2022-04-22"
"2009.03120","Taro Wakamura Dr.","T. Wakamura, N. J. Wu, A. D. Chepelianskii, S. Gu\'eron, M. Och, M.
  Ferrier, T. Taniguchi, K. Watanabe, C. Mattevi, H. Bouchiat","Spin-orbit-enhanced robustness of supercurrent in graphene/WS$_2$
  Josephson junctions","6 pages, 3 figures","Phys. Rev. Lett. 125, 266801 (2020)","10.1103/PhysRevLett.125.266801",,"cond-mat.mes-hall cond-mat.supr-con","http://arxiv.org/licenses/nonexclusive-distrib/1.0/","  We demonstrate enhanced robustness of the supercurrent through graphene-based
Josephson junctions in which strong spin-orbit interactions (SOIs) are induced.
We compare the persistence of a supercurrent at high magnetic fields between
Josephson junctions with graphene on hexagonal boron-nitride and graphene on
WS$_2$, where strong SOIs are induced via the proximity effect. We find that in
the shortest junctions both systems display signatures of induced
superconductivity, characterized by a suppressed differential resistance at a
low current, in magnetic fields up to 1 T. In longer junctions however, only
graphene on WS$_2$ exhibits induced superconductivity features in such high
magnetic fields, and they even persist up to 7 T. We argue that these robust
superconducting signatures arise from quasi-ballistic edge states stabilized by
the strong SOIs induced in graphene by WS$_2$.
","[{""version"":""v1"",""created"":""Mon, 7 Sep 2020 14:12:11 GMT""},{""version"":""v2"",""created"":""Sat, 2 Jan 2021 02:20:17 GMT""}]","2021-01-06"
"2009.03121","Matthias Erbar","Matthias Erbar and Chiara Rigoni and Karl-Theodor Sturm and Luca
  Tamanini","Tamed spaces -- Dirichlet spaces with distribution-valued Ricci bounds","68 pages; comments welcome!",,,,"math.FA math.MG math.PR","http://arxiv.org/licenses/nonexclusive-distrib/1.0/","  We develop the theory of tamed spaces which are Dirichlet spaces with
distribution-valued lower bounds on the Ricci curvature and investigate these
from an Eulerian point of view. To this end we analyze in detail singular
perturbations of Dirichlet form by a broad class of distributions. The
distributional Ricci bound is then formulated in terms of an integrated version
of the Bochner inequality using the perturbed energy form and generalizing the
well-known Bakry-\'Emery curvature-dimension condition. Among other things we
show the equivalence of distributional Ricci bounds to gradient estimates for
the heat semigroup in terms of the Feynman-Kac semigroup induced by the taming
distribution as well as consequences in terms of functional inequalities. We
give many examples of tamed spaces including in particular Riemannian manifolds
with either interior singularities or singular boundary behavior.
","[{""version"":""v1"",""created"":""Mon, 7 Sep 2020 14:12:39 GMT""}]","2020-09-08"
