"2009.08907","Borzoo Bonakdarpour","Tzu-Han Hsu, Cesar Sanchez, and Borzoo Bonakdarpour","Bounded Model Checking for Hyperproperties",,,,,"cs.FL cs.CR","http://arxiv.org/licenses/nonexclusive-distrib/1.0/","  Hyperproperties are properties of systems that relate multiple computation
traces, including security and concurrency properties. This paper introduces a
bounded model checking (BMC) algorithm for hyperproperties expressed in
HyperLTL, which - to the best of our knowledge - is the first such algorithm.
Just as the classic BMC technique for LTL primarily aims at finding bugs, our
approach also targets identifying counterexamples. BMC for LTL is reduced to
SAT solving, because LTL describes a property via inspecting individual traces.
HyperLTL allows explicit and simultaneous quantification over traces and
describes properties that involves multiple traces and, hence, our BMC approach
naturally reduces to QBF solving. We report on successful and efficient model
checking, implemented in a tool called HyperQube, of a rich set of experiments
on a variety of case studies, including security, concurrent data structures,
path planning for robots, and testing.
","[{""version"":""v1"",""created"":""Fri, 18 Sep 2020 16:07:33 GMT""},{""version"":""v2"",""created"":""Thu, 15 Oct 2020 23:43:49 GMT""}]","2020-10-19"
"2009.08908","Leonid Pourovskii","Leonid V. Pourovskii and Sergii Khmelevskyi","Hidden order and multipolar exchange striction in a correlated
  f-electron system","Final version, 12 pages, 4 figures. For Supporting information etc.
  see the published version (Open Access)","PNAS 118, e2025317118 (2021)","10.1073/pnas.2025317118",,"cond-mat.str-el cond-mat.mtrl-sci","http://arxiv.org/licenses/nonexclusive-distrib/1.0/","  The nature of order in low-temperature phases of some materials is not
directly seen by experiment. Such ""hidden orders"" (HO) may inspire decades of
research to identify the mechanism underlying those exotic states of matter. In
insulators, HO phases originate in degenerate many-electron states on localized
f or d shells that may harbor high-rank multipole moments. Coupled by
inter-site exchange, those moments form a vast space of competing order
parameters. Here, we show how the ground state order and magnetic excitations
of a prototypical HO system, neptunium dioxide NpO$_2$, can be fully described
by a low-energy Hamiltonian derived by a many-body ab initio force-theorem
method. Superexchange interactions between the lowest crystal-field quadruplet
of Np$^{4+}$ ions induce a primary non-collinear order of time-odd rank-5
(triakontadipolar) moments with a secondary quadrupole order preserving the
cubic symmetry of NpO$_2$. Our study also reveals an unconventional multipolar
exchange-striction mechanism behind the anomalous volume contraction of the
NpO$_2$ HO phase.
","[{""version"":""v1"",""created"":""Fri, 18 Sep 2020 16:08:04 GMT""},{""version"":""v2"",""created"":""Fri, 2 Apr 2021 11:37:53 GMT""}]","2021-04-05"
"2009.08909","Hritam Basak","Soham Chattopadhyay, Arijit Dey, Hritam Basak","Optimizing Speech Emotion Recognition using Manta-Ray Based Feature
  Selection","10 pages, 8 figures",,,,"cs.SD cs.LG eess.AS","http://arxiv.org/licenses/nonexclusive-distrib/1.0/","  Emotion recognition from audio signals has been regarded as a challenging
task in signal processing as it can be considered as a collection of static and
dynamic classification tasks. Recognition of emotions from speech data has been
heavily relied upon end-to-end feature extraction and classification using
machine learning models, though the absence of feature selection and
optimization have restrained the performance of these methods. Recent studies
have shown that Mel Frequency Cepstral Coefficients (MFCC) have been emerged as
one of the most relied feature extraction methods, though it circumscribes the
accuracy of classification with a very small feature dimension. In this paper,
we propose that the concatenation of features, extracted by using different
existing feature extraction methods can not only boost the classification
accuracy but also expands the possibility of efficient feature selection. We
have used Linear Predictive Coding (LPC) apart from the MFCC feature extraction
method, before feature merging. Besides, we have performed a novel application
of Manta Ray optimization in speech emotion recognition tasks that resulted in
a state-of-the-art result in this field. We have evaluated the performance of
our model using SAVEE and Emo-DB, two publicly available datasets. Our proposed
method outperformed all the existing methods in speech emotion analysis and
resulted in a decent result in these two datasets with a classification
accuracy of 97.06% and 97.68% respectively.
","[{""version"":""v1"",""created"":""Fri, 18 Sep 2020 16:09:34 GMT""}]","2020-09-21"
"2009.08910","Jens Hertkorn","J. Hertkorn, J.-N. Schmidt, F. B\""ottcher, M. Guo, M. Schmidt, K.S.H.
  Ng, S.D. Graham, H.P. B\""uchler, T. Langen, M. Zwierlein, and T. Pfau","Density Fluctuations across the Superfluid-Supersolid Phase Transition
  in a Dipolar Quantum Gas","11 pages, 5 + 3 figures","Phys. Rev. X 11, 011037 (2021)","10.1103/PhysRevX.11.011037",,"cond-mat.quant-gas physics.atom-ph","http://arxiv.org/licenses/nonexclusive-distrib/1.0/","  Phase transitions share the universal feature of enhanced fluctuations near
the transition point. Here we show that density fluctuations reveal how a
Bose-Einstein condensate of dipolar atoms spontaneously breaks its translation
symmetry and enters the supersolid state of matter -- a phase that combines
superfluidity with crystalline order. We report on the first direct in situ
measurement of density fluctuations across the superfluid-supersolid phase
transition. This allows us to introduce a general and straightforward way to
extract the static structure factor, estimate the spectrum of elementary
excitations and image the dominant fluctuation patterns. We observe a strong
response in the static structure factor and infer a distinct roton minimum in
the dispersion relation. Furthermore, we show that the characteristic
fluctuations correspond to elementary excitations such as the roton modes,
which have been theoretically predicted to be dominant at the quantum critical
point, and that the supersolid state supports both superfluid as well as
crystal phonons.
","[{""version"":""v1"",""created"":""Fri, 18 Sep 2020 16:09:49 GMT""}]","2021-03-03"
"2009.08911","Arseniy Filin A","A. A. Filin, D. M\""oller, V. Baru, E. Epelbaum, H. Krebs, P. Reinert","High-accuracy calculation of the deuteron charge and quadrupole form
  factors in chiral effective field theory","39 pages, 9 figures","Phys. Rev. C 103, 024313 (2021)","10.1103/PhysRevC.103.024313",,"nucl-th hep-ph nucl-ex","http://arxiv.org/licenses/nonexclusive-distrib/1.0/","  We present a comprehensive analysis of the deuteron charge and quadrupole
form factors based on the latest two-nucleon potentials and charge density
operators derived in chiral effective field theory. The single- and two-nucleon
contributions to the charge density are expressed in terms of the proton and
neutron form factors, for which the most up-to-date empirical parametrizations
are employed. By adjusting the fifth-order short-range terms in the two-nucleon
charge density operator to reproduce the world data on the momentum-transfer
dependence of the deuteron charge and quadrupole form factors, we predict the
values of the structure radius and the quadrupole moment of the deuteron:
$r_{\rm str}=1.9729\substack{+0.0015\\ -0.0012}\ \text{fm},\
Q_d=0.2854\substack{+0.0038\\ -0.0017}\ \text{fm}^2. $ A comprehensive and
systematic analysis of various sources of uncertainty in our predictions is
performed. Following the strategy advocated in our recent publication Phys.
Rev. Lett. 124, 082501 (2020), we employ the extracted structure radius
together with the accurate atomic data for the deuteron-proton mean-square
charge radii difference to update the determination of the neutron charge
radius, for which we find: $r_n^2=-0.105\substack{+0.005\\ -0.006} \,
\text{fm}^2$. Given the observed rapid convergence of the deuteron form factors
in the momentum-transfer range of $Q \simeq 1-2.5$ fm$^{-1}$, we argue that
this intermediate-energy domain is particularly sensitive to the details of the
nucleon form factors and can be used to test different parametrizations.
","[{""version"":""v1"",""created"":""Fri, 18 Sep 2020 16:12:39 GMT""}]","2021-02-17"
"2009.08912","Akshay Dhumal","Akshay Dhumal (IIT Madras), Dharanipragada Janakiram (IIT Madras)","C-Balancer: A System for Container Profiling and Scheduling","10 Pages",,,,"cs.DC","http://arxiv.org/licenses/nonexclusive-distrib/1.0/","  Linux containers have gained high popularity in recent times. This popularity
is significantly due to various advantages of containers over Virtual Machines
(VM). The containers are lightweight, occupy lesser storage, have fast boot-up
time, easy to deploy and have faster auto-scaling. The key reason behind the
popularity of containers is that they leverage the mechanism of micro-service
style software development, where applications are designed as independently
deployable services. There are various container orchestration tools for
deploying and managing the containers in the cluster. The prominent among them
are Docker Swarm and Kubernetes. However, they do not address the effects of
resource contention when multiple containers are deployed on a node. Moreover,
they do not provide support for container migration in the event of an attack
or increased resource contention. To address such issues, we propose
C-Balancer, a scheduling framework for efficient placement of containers in the
cluster environment. C-Balancer works by periodically profiling the containers
and deciding the optimal container to node placement. Our proposed approach
improves the performance of containers in terms of resource utilization and
throughput. Experiments using a workload mix of Stress-NG and iPerf benchmark
shows that our proposed approach achieves a maximum performance improvement of
58% for the workload mix. Our approach also reduces the variance in resource
utilization across the cluster by 60% on average.
","[{""version"":""v1"",""created"":""Fri, 18 Sep 2020 16:17:10 GMT""}]","2020-09-21"
"2009.08913","Johannes Hoelck","Johannes Hoelck, Georg Wolschin","Baryon stopping as a relativistic Markov process in phase space","9 pages, 4 figures, 1 table","Phys. Rev. Research 2 (2020) 033409","10.1103/PhysRevResearch.2.033409",,"nucl-th hep-ph","http://creativecommons.org/licenses/by-nc-sa/4.0/","  We reconsider baryon stopping in relativistic heavy-ion collisions in a
nonequilibrium-statistical framework. The approach combines earlier
formulations based on quantum chromodynamics with a relativistic diffusion
model through a suitably derived fluctuation-dissipation relation, thus
allowing for a fully time-dependent theory that is consistent with QCD. We use
an existing framework for relativistic stochastic processes in spacetime that
are Markovian in phase space, and adapt it to derive a Fokker-Planck equation
in rapidity space, which is solved numerically. The time evolution of the
net-proton distribution function in rapidity space agrees with stopping data
from the CERN Super Proton Synchrotron and the BNL Relativistic Heavy Ion
Collider.
","[{""version"":""v1"",""created"":""Fri, 18 Sep 2020 16:21:01 GMT""}]","2020-09-21"
"2009.08914","Alexander Plavin","A.V. Plavin (ASC Lebedev, MIPT), Y.Y. Kovalev (ASC Lebedev, MIPT,
  MPIfR), Y.A. Kovalev (ASC Lebedev), S.V. Troitsky (INR)","Directional association of TeV to PeV astrophysical neutrinos with radio
  blazars","14 pages, 5 figures; accepted to ApJ; v2: extended and clarified
  discussion, added a diagram; v3: improved numerical estimates","ApJ 908 (2021) 157","10.3847/1538-4357/abceb8","INR-TH-2020-039","astro-ph.HE astro-ph.GA","http://arxiv.org/licenses/nonexclusive-distrib/1.0/","  Recently we have shown that high-energy neutrinos above 200 TeV detected by
IceCube are produced within several parsecs in the central regions of
radio-bright blazars, that is active galactic nuclei with jets pointing towards
us. To independently test this result and extend the analysis to a wider energy
range, we use public data for all neutrino energies from seven years of IceCube
observations. The IceCube point-source likelihood map is analyzed against the
positions of blazars from a statistically complete sample selected by their
compact radio flux density. The latter analysis delivers a 3.0 sigma
significance with the combined post-trial significance of both studies being
4.1 sigma. The correlation is driven by a large number of blazars. Together
with fainter but physically similar sources not included in the sample, they
may explain the entire IceCube astrophysical neutrino flux as derived from
muon-track analyses. The neutrinos can be produced in interactions of
relativistic protons with X-ray self-Compton photons in parsec-scale blazar
jets.
","[{""version"":""v1"",""created"":""Fri, 18 Sep 2020 16:21:10 GMT""},{""version"":""v2"",""created"":""Mon, 26 Oct 2020 07:42:42 GMT""},{""version"":""v3"",""created"":""Thu, 3 Dec 2020 13:55:37 GMT""}]","2021-02-22"
"2009.08915","Paula Saavedra-Nieves","Paula Saavedra-Nieves and Rosa Mar\'ia Crujeiras","Nonparametric estimation of directional highest density regions",,,,,"stat.ME","http://arxiv.org/licenses/nonexclusive-distrib/1.0/","  Reconstruction of sets from a random sample of points intimately related to
them is the goal of set estimation theory. Within this context, a particular
problem is the one related with the reconstruction of density level sets and
specifically, those ones with a high probability content, namely highest
density regions.
  We define highest density regions for directional data and provide a plug-in
estimator, based on kernel smoothing. A suitable bootstrap bandwidth selector
is provided for the practical implementation of the proposal. An extensive
simulation study shows the performance of the plug-in estimator proposed with
the bootstrap bandwidth selector and with other bandwidth selectors
specifically designed for circular and spherical kernel density estimation. The
methodology is applied to analyze two real data sets in animal orientation and
seismology.
","[{""version"":""v1"",""created"":""Fri, 18 Sep 2020 16:22:44 GMT""},{""version"":""v2"",""created"":""Thu, 5 Nov 2020 12:10:34 GMT""}]","2020-11-06"
"2009.08916","Lara Anisman","Lara O. Anisman, Billy Edwards, Quentin Changeat, Olivia Venot, Ahmed
  F. Al-Refaie, Angelos Tsiaras, Giovanna Tinetti","WASP-117 b: an eccentric hot-Saturn as a future complex chemistry
  laboratory","Accepted for publication in AJ",,"10.3847/1538-3881/abb9b0",,"astro-ph.EP","http://arxiv.org/licenses/nonexclusive-distrib/1.0/","  We present spectral analysis of the transiting Saturn-mass planet WASP-117b,
observed with the G141 grism of Wide Field Camera 3 (WFC3) on the Hubble Space
Telescope. We reduce and fit the extracted spectrum from the raw transmission
data using the open-source software Iraclis before performing a fully Bayesian
retrieval using the publicly available analysis suite TauREx 3.0. We detect
water vapour alongside a layer of fully opaque cloud, retrieving a terminator
temperature of 833 K. In order to quantify the statistical significance of this
detection, we employ the Atmospheric Detectability Index (ADI), deriving a
value of 2.30, which provides positive but not strong evidence against the
flatline model. Due to the eccentric orbit of WASP-117b, it is likely that
chemical and mixing timescales oscillate throughout orbit due to the changing
temperature, possibly allowing warmer chemistry to remain visible as the planet
begins transit, despite the proximity of its point of ingress to apastron. We
present simulated spectra of the planet as would be observed by the future
space missions Ariel and JWST and show that, despite not being able to probe
such chemistry with current HST data, these observatories should make it
possible in the not too distant future.
","[{""version"":""v1"",""created"":""Fri, 18 Sep 2020 16:27:02 GMT""},{""version"":""v2"",""created"":""Mon, 21 Sep 2020 13:06:29 GMT""}]","2020-11-04"
"2009.08917","Yinxi Wang","Yinxi Wang, Kimmo Kartasalo, Masi Valkonen, Christer Larsson, Pekka
  Ruusuvuori, Johan Hartman, Mattias Rantalainen","Predicting molecular phenotypes from histopathology images: a
  transcriptome-wide expression-morphology analysis in breast cancer","42 pages, 6 figures",,,,"eess.IV cs.CV q-bio.QM","http://arxiv.org/licenses/nonexclusive-distrib/1.0/","  Molecular phenotyping is central in cancer precision medicine, but remains
costly and standard methods only provide a tumour average profile. Microscopic
morphological patterns observable in histopathology sections from tumours are
determined by the underlying molecular phenotype and associated with clinical
factors. The relationship between morphology and molecular phenotype has a
potential to be exploited for prediction of the molecular phenotype from the
morphology visible in histopathology images.
  We report the first transcriptome-wide Expression-MOrphology (EMO) analysis
in breast cancer, where gene-specific models were optimised and validated for
prediction of mRNA expression both as a tumour average and in spatially
resolved manner. Individual deep convolutional neural networks (CNNs) were
optimised to predict the expression of 17,695 genes from hematoxylin and eosin
(HE) stained whole slide images (WSIs). Predictions for 9,334 (52.75%) genes
were significantly associated with RNA-sequencing estimates (FDR adjusted
p-value < 0.05). 1,011 of the genes were brought forward for validation, with
876 (87%) and 908 (90%) successfully replicated in internal and external test
data, respectively. Predicted spatial intra-tumour variabilities in expression
were validated in 76 genes, out of which 59 (77.6%) had a significant
association (FDR adjusted p-value < 0.05) with spatial transcriptomics
estimates. These results suggest that the proposed methodology can be applied
to predict both tumour average gene expression and intra-tumour spatial
expression directly from morphology, thus providing a scalable approach to
characterise intra-tumour heterogeneity.
","[{""version"":""v1"",""created"":""Fri, 18 Sep 2020 16:27:53 GMT""}]","2020-09-21"
"2009.08918","Florian Katsch","Florian Katsch, Dominik Christiansen, Robert Schmidt, Steffen
  Michaelis de Vasconcellos, Rudolf Bratschitsch, Andreas Knorr, Malte Selig","Theory of the Coherent Response of Magneto-Excitons and
  Magneto-Biexcitons in Monolayer Transition Metal Dichalcogenides",,"Phys. Rev. B 102, 115420 (2020)","10.1103/PhysRevB.102.115420",,"cond-mat.mes-hall","http://arxiv.org/licenses/nonexclusive-distrib/1.0/","  The recent accessibility of high quality, charge neutral monolayer transition
metal dichalcogenides with narrow exciton linewidths at the homogeneous limit
provides an ideal platform to study excitonic many-body interactions. In
particular, the possibility to manipulate coherent exciton-exciton
interactions, which govern the ultrafast nonlinear optical response, by
applying an external magnetic field has not been considered so far. We address
this discrepancy by presenting a nonlinear microscopic theory in the coherent
limit for optical excitations in the presence of out-of-plane, in-plane, and
tilted magnetic fields. Specifically, we explore the magnetic-field-induced
exciton and biexciton fine structure and calculate their oscillator strengths
based on a Heisenberg equations of motion formalism. Our microscopic
evaluations of pump-probe spectra allow to interpret and predict coherent
signatures in future wave-mixing experiments.
","[{""version"":""v1"",""created"":""Fri, 18 Sep 2020 16:29:55 GMT""}]","2020-09-21"
"2009.08919","Yu Jiao Zhu","Yu Jiao Zhu","Double soft current at one-loop in QCD","Typos in eq.(3.6), eq.(4.8) and eq.(4.9) are corrected",,,,"hep-ph","http://arxiv.org/licenses/nonexclusive-distrib/1.0/","  We study the soft behavior of QCD amplitudes with multiple hard legs and
present a compact expression for double soft gluons and double soft quarks at
one-loop. The color correlation of the current basically shows a dipole
structure which couples to two hard legs at one time, except for a simple
abelian contribution which factorizes as products of one-loop and tree-level
single soft current which couples up to three hard legs. The kinematic
dependence can be expressed in terms of polylogarithms (at least up to finite
terms in $\epsilon$) and the results were displayed with time-like kinematics.
Analytical continuation to other kinematic configurations is then discussed
where we found non-trivial crossing into ingoing states. The amplitude squared
is always crossing invariant, which leads to the fact that the fully
differential soft function (and the TMD soft function) is universal up to
three-loop.
","[{""version"":""v1"",""created"":""Fri, 18 Sep 2020 16:30:32 GMT""},{""version"":""v2"",""created"":""Mon, 13 Sep 2021 06:34:06 GMT""},{""version"":""v3"",""created"":""Tue, 31 Jan 2023 10:18:16 GMT""}]","2023-02-01"
"2009.08920","Haoming Lu","Haoming Lu, Humphrey Shi","Deep Learning for 3D Point Cloud Understanding: A Survey",,,,,"cs.CV cs.LG","http://arxiv.org/licenses/nonexclusive-distrib/1.0/","  The development of practical applications, such as autonomous driving and
robotics, has brought increasing attention to 3D point cloud understanding.
While deep learning has achieved remarkable success on image-based tasks, there
are many unique challenges faced by deep neural networks in processing massive,
unstructured and noisy 3D points. To demonstrate the latest progress of deep
learning for 3D point cloud understanding, this paper summarizes recent
remarkable research contributions in this area from several different
directions (classification, segmentation, detection, tracking, flow estimation,
registration, augmentation and completion), together with commonly used
datasets, metrics and state-of-the-art performances. More information regarding
this survey can be found at:
https://github.com/SHI-Labs/3D-Point-Cloud-Learning.
","[{""version"":""v1"",""created"":""Fri, 18 Sep 2020 16:34:12 GMT""},{""version"":""v2"",""created"":""Sun, 23 May 2021 15:04:30 GMT""}]","2021-05-25"
"2009.08921","Yexin Yan","Yexin Yan, Terrence C. Stewart, Xuan Choo, Bernhard Vogginger,
  Johannes Partzsch, Sebastian Hoeppner, Florian Kelber, Chris Eliasmith, Steve
  Furber, Christian Mayr","Low-Power Low-Latency Keyword Spotting and Adaptive Control with a
  SpiNNaker 2 Prototype and Comparison with Loihi",,,"10.1088/2634-4386/abf150",,"cs.NE","http://arxiv.org/licenses/nonexclusive-distrib/1.0/","  We implemented two neural network based benchmark tasks on a prototype chip
of the second-generation SpiNNaker (SpiNNaker 2) neuromorphic system: keyword
spotting and adaptive robotic control. Keyword spotting is commonly used in
smart speakers to listen for wake words, and adaptive control is used in
robotic applications to adapt to unknown dynamics in an online fashion. We
highlight the benefit of a multiply accumulate (MAC) array in the SpiNNaker 2
prototype which is ordinarily used in rate-based machine learning networks when
employed in a neuromorphic, spiking context. In addition, the same benchmark
tasks have been implemented on the Loihi neuromorphic chip, giving a
side-by-side comparison regarding power consumption and computation time. While
Loihi shows better efficiency when less complicated vector-matrix
multiplication is involved, with the MAC array, the SpiNNaker 2 prototype shows
better efficiency when high dimensional vector-matrix multiplication is
involved.
","[{""version"":""v1"",""created"":""Fri, 18 Sep 2020 16:38:55 GMT""}]","2021-06-25"
"2009.08922","James Goodman","James Goodman, Sebastian Risi, Simon Lucas","AI and Wargaming",,,,,"cs.AI","http://arxiv.org/licenses/nonexclusive-distrib/1.0/","  Recent progress in Game AI has demonstrated that given enough data from human
gameplay, or experience gained via simulations, machines can rival or surpass
the most skilled human players in classic games such as Go, or commercial
computer games such as Starcraft. We review the current state-of-the-art
through the lens of wargaming, and ask firstly what features of wargames
distinguish them from the usual AI testbeds, and secondly which recent AI
advances are best suited to address these wargame-specific features.
","[{""version"":""v1"",""created"":""Fri, 18 Sep 2020 16:39:54 GMT""},{""version"":""v2"",""created"":""Fri, 25 Sep 2020 08:40:57 GMT""}]","2020-09-28"
