"2009.09007","Max Nendel","Felix-Benedikt Liebrich and Max Nendel","Separability vs. robustness of Orlicz spaces: financial and economic
  perspectives",,,,,"math.PR q-fin.MF","http://arxiv.org/licenses/nonexclusive-distrib/1.0/","  We investigate robust Orlicz spaces as a generalisation of robust
$L^p$-spaces. Two constructions of such spaces are distinguished, a top-down
approach and a bottom-up approach. We show that separability of robust Orlicz
spaces or their subspaces has very strong implications in terms of the
dominatedness of the set of priors and the lack of order completeness. Our
results have subtle implications for the field of robust finance. For instance,
norm closures of bounded continuous functions with respect to the worst-case
$L^p$-norm, as considered in the $G$-framework, lead to spaces which are
lattice isomorphic to a sublattice of a classical $L^1$-space lacking, however,
any form of order completeness. We further show that the topological spanning
power of options is always limited under nondominated uncertainty.
","[{""version"":""v1"",""created"":""Fri, 18 Sep 2020 18:28:48 GMT""},{""version"":""v2"",""created"":""Sat, 8 May 2021 06:40:59 GMT""}]","2021-05-11"
"2009.09008","Rouhollah Jafari","Sara Zamani, R. Jafari, and A. Langari","Floquet dynamical quantum phase transition in the extended XY model:
  nonadiabatic to adiabatic topological transition","To appear in Phys. Rev. B","Phys. Rev. B 102, 144306 (2020)","10.1103/PhysRevB.102.144306",,"cond-mat.stat-mech cond-mat.supr-con quant-ph","http://arxiv.org/licenses/nonexclusive-distrib/1.0/","  We investigate both pure and mixed states Floquet dynamical quantum phase
transition (DQPT) in the periodically time-dependent extended XY model. We
exactly show that the proposed Floquet Hamiltonian of interacting spins can be
expressed as a sum of noninteracting quasi-spins imposed by an effective time
dependent magnetic field (Schwinger-Rabi model). The calculated Chern number
indicates that there is a topological transition from nonadiabatic to adiabatic
regime. In the adiabatic regime, the quasi-spins trace the time dependent
effective magnetic field and then oscillate between spin up and down states.
While in the nonadiabatic regime, the quasi-spins cannot follow the time
dependent effective magnetic field and feel an average magnetic field. We find
the range of driving frequency over which the quasi-spins experience adiabatic
cyclic processes. Moreover, we obtain the exact expression of the Loschmidt
amplitude and generalized Loschmidt amplitude of the proposed Floquet system.
The results represent that both pure and mixed states dynamical phase
transition occurs when the system evolves adiabatically. In other words, the
minimum required driving frequency for the appearance of Floquet DQPT is equal
to the threshold frequency needed for transition from nonadiabatic to adiabatic
regime.
","[{""version"":""v1"",""created"":""Fri, 18 Sep 2020 18:29:21 GMT""}]","2020-11-03"
"2009.09009","Vidya A. Chhabria","Vidya A. Chhabria, Vipul Ahuja, Ashwath Prabhu, Nikhil Patil, Palkesh
  Jain, and Sachin S. Sapatnekar","Thermal and IR Drop Analysis Using Convolutional Encoder-Decoder
  Networks","Accepted in ASP-DAC 2021 conference",,,,"cs.AR cs.AI cs.LG","http://arxiv.org/licenses/nonexclusive-distrib/1.0/","  Computationally expensive temperature and power grid analyses are required
during the design cycle to guide IC design. This paper employs encoder-decoder
based generative (EDGe) networks to map these analyses to fast and accurate
image-to-image and sequence-to-sequence translation tasks. The network takes a
power map as input and outputs the corresponding temperature or IR drop map. We
propose two networks: (i) ThermEDGe: a static and dynamic full-chip temperature
estimator and (ii) IREDGe: a full-chip static IR drop predictor based on input
power, power grid distribution, and power pad distribution patterns. The models
are design-independent and must be trained just once for a particular
technology and packaging solution. ThermEDGe and IREDGe are demonstrated to
rapidly predict the on-chip temperature and IR drop contours in milliseconds
(in contrast with commercial tools that require several hours or more) and
provide an average error of 0.6% and 0.008% respectively.
","[{""version"":""v1"",""created"":""Fri, 18 Sep 2020 18:29:24 GMT""}]","2020-09-22"
"2009.09010","Richard M. McLaughlin","R. Camassa, L. Ding, Z. Kilic, and R. M. McLaughlin","Persisting asymmetry in the probability distribution function for a
  random advection-diffusion equation in impermeable channels",,,"10.1016/j.physd.2021.132930",,"physics.flu-dyn math.AP math.PR","http://arxiv.org/licenses/nonexclusive-distrib/1.0/","  We study the effect of impermeable boundaries on the symmetry properties of a
random passive scalar field advected by random flows. We focus on a broad class
of nonlinear shear flows multiplied by a stationary, Ornstein-Uhlenbeck (OU)
time varying process, including some of their limiting cases, such as Gaussian
white noise or plug flows. For the former case with linear shear, recent
studies \cite{camassa2019symmetry} numerically demonstrated that the decaying
passive scalar's long time limiting probability distribution function (PDF)
could be negatively skewed in the presence of impermeable channel boundaries,
in contrast to rigorous results in free space which established the limiting
PDF is positively skewed \cite{mclaughlin1996explicit}. Here, the role of
boundaries in setting the long time limiting skewness of the PDF is established
rigorously for the above class using the long time asymptotic expansion of the
$N$-point correlator of the random field obtained from the ground state
eigenvalue perturbation approach proposed in \cite{bronski1997scalar}. Our
analytical result verifies the conclusion for the linear shear flow obtained
from numerical simulations in \cite{camassa2019symmetry}. Moreover, we
demonstrate that the limiting distribution is negatively skewed for any shear
flow at sufficiently low P\'eclet number. We show that the long time limit of
the first three moments depends explicitly on the value of $\gamma$, which is
in contrast to the conclusion in \cite{vanden2001non} for the limiting PDF in
free space. We derive the exact formula of the $N$-point correlator for a flow
with no spatial dependence and Gaussian temporal fluctuation, generalizing the
results of \cite{bronski2007explicit}. The long time analysis of this formula
is consistent with our theory for a general shear flow. All results are
verified by Monte-Carlo simulations.
","[{""version"":""v1"",""created"":""Fri, 18 Sep 2020 18:31:49 GMT""}]","2021-07-07"
"2009.09011","Mario Di Mauro","Mario Di Mauro, Giovanni Galatro, Antonio Liotta","Experimental Review of Neural-based approaches for Network Intrusion
  Management","Early Access on IEEE Transactions on Network and Service Management",,"10.1109/TNSM.2020.3024225",,"cs.NI cs.LG","http://arxiv.org/licenses/nonexclusive-distrib/1.0/","  The use of Machine Learning (ML) techniques in Intrusion Detection Systems
(IDS) has taken a prominent role in the network security management field, due
to the substantial number of sophisticated attacks that often pass undetected
through classic IDSs. These are typically aimed at recognising attacks based on
a specific signature, or at detecting anomalous events. However, deterministic,
rule-based methods often fail to differentiate particular (rarer) network
conditions (as in peak traffic during specific network situations) from actual
cyber attacks. In this paper we provide an experimental-based review of
neural-based methods applied to intrusion detection issues. Specifically, we i)
offer a complete view of the most prominent neural-based techniques relevant to
intrusion detection, including deep-based approaches or weightless neural
networks, which feature surprising outcomes; ii) evaluate novel datasets
(updated w.r.t. the obsolete KDD99 set) through a designed-from-scratch
Python-based routine; iii) perform experimental analyses including time
complexity and performance (accuracy and F-measure), considering both
single-class and multi-class problems, and identifying trade-offs between
resource consumption and performance. Our evaluation quantifies the value of
neural networks, particularly when state-of-the-art datasets are used to train
the models. This leads to interesting guidelines for security managers and
computer network practitioners who are looking at the incorporation of
neural-based ML into IDS.
","[{""version"":""v1"",""created"":""Fri, 18 Sep 2020 18:32:24 GMT""}]","2020-09-22"
"2009.09012","Guillermo Arregui Bravo","Guillermo Arregui, Martin Facundo Colombano, J\'er\'emie Maire,
  Alessandro Pitanti, Nestor Eduardo Capuj, Amadeu Griol, Alejandro Mart\'inez,
  Clivia Marfa Sotomayor Torres and Daniel Navarro Urrios","Injection locking in an optomechanical coherent phonon source",,,,,"physics.optics cond-mat.mes-hall nlin.AO physics.app-ph","http://arxiv.org/licenses/nonexclusive-distrib/1.0/","  Spontaneous locking of the phase of a coherent phonon source to an external
reference is demonstrated in an optomechanical oscillator based on a
self-triggered free-carrier/temperature limit cycle. Synchronization is
observed when the pump laser driving the mechanical oscillator to a
self-sustained state is modulated by a radiofrequency tone. We employ a
pump-probe phonon detection scheme based on an independent optical cavity to
observe only the mechanical oscillator dynamics. The lock range of the
oscillation frequency, i.e., the Arnold tongue, is experimentally determined
over a range of external reference strengths, evidencing the possibility to
tune the oscillator frequency for a range up to 350 kHz. The stability of the
coherent phonon source is evaluated via its phase noise, with a maximum
achieved suppression of 44 dBc/Hz at 1kHz offset for a 100 MHz mechanical
resonator. Introducing a weak modulation in the excitation laser reveals as a
further knob to trigger, control and stabilise the dynamical solutions of
self-pulsing based optomechanical oscillators, thus enhancing their potential
as acoustic wave sources in a single layer silicon platform.
","[{""version"":""v1"",""created"":""Fri, 18 Sep 2020 18:33:25 GMT""},{""version"":""v2"",""created"":""Thu, 24 Sep 2020 15:27:36 GMT""}]","2020-09-25"
"2009.09013","Jale Y. S\'ung\'u","J. Y. S\""ung\""u, A. T\""urkan, E. Sertbakan, E. Veli Veliev","Missing Member of the $J^{PC} = 2^{--}$ Nonet in Extreme Conditions","4 pages",,,,"hep-ph","http://arxiv.org/licenses/nonexclusive-distrib/1.0/","  The isoscalar member of the axial-tensor family that should take place in the
further states of the PDG is still absent. In this study, analyzes are made as
to whether one of the X states whose quantum numbers are unknown in this group,
is a candidate for the missing resonance under the assignment $ 2^3D_2 $.
Moreover, replacing the time evolution operator with the thermal average one,
we construct the modified correlator satisfying Thermal QCD sum rules approach.
We determine that the hadronic parameters of the considered nonet member are
sensitive to the increment of temperature. This knowledge can be helpful to
complete the $J^{PC} = 2^{--}$ light meson nonet and also explore the hot
medium behaviors at upcoming heavy-ion collision experiments.
","[{""version"":""v1"",""created"":""Fri, 18 Sep 2020 18:34:13 GMT""}]","2020-09-22"
"2009.09014","Chris Benson","Chris S. Benson (1) and L. D. Spencer (1) and I. Valtchanov (2) and J.
  Scott (1) and N. H{\l}adczuk (3 and 4) ((1) University of Lethbridge, (2)
  Telespazio Vega UK for ESA, (3) European Space Astronomy Centre, (4) Gran
  TeCan, S.A.)","The Herschel SPIRE Fourier Transform Spectrometer Spectral Feature
  Finder V. Rotational measurements of NGC 891",,,"10.1093/mnras/staa3448",,"astro-ph.GA astro-ph.IM","http://arxiv.org/licenses/nonexclusive-distrib/1.0/","  The ESA Herschel Spectral and Photometric Imaging Receiver (SPIRE) Fourier
Transform Spectrometer (FTS) Spectral Feature Finder (FF) project is an
automated spectral feature fitting routine developed within the SPIRE
instrument team to extract all prominent spectral features from all publicly
available SPIRE FTS observations. In this work, we demonstrate the use of the
FF information extracted from three observations of the edge-on spiral galaxy
NGC 891 to measure the rotation of NII and CI gas at Far-infrared frequencies
in complement to radio observations of the HI 21cm line and the CO(1-0)
transition as well as optical measurements of Halpha. We find that measurements
of both NII and CI gas follow a similar velocity profile to that of HI and
Halpha showing a correlation between neutral and ionized regions of the
interstellar medium (ISM) in the disk of NGC 891.
","[{""version"":""v1"",""created"":""Fri, 18 Sep 2020 18:34:54 GMT""},{""version"":""v2"",""created"":""Wed, 23 Sep 2020 18:27:00 GMT""},{""version"":""v3"",""created"":""Mon, 2 Nov 2020 17:56:51 GMT""}]","2020-11-18"
"2009.09015","Christian Degen","M. S. Wornle, P. Welter, M. Giraldo, T. Lottermoser, M. Fiebig, P.
  Gambardella, C. L. Degen","Co-existence of Bloch and Neel walls in a collinear antiferromagnet","9 pages, 5 figures. Includes 11 pages of supplemental material","Phys. Rev. B 103, 094426 (2021)","10.1103/PhysRevB.103.094426",,"cond-mat.mes-hall cond-mat.mtrl-sci quant-ph","http://arxiv.org/licenses/nonexclusive-distrib/1.0/","  We resolve the domain-wall structure of the model antiferromagnet
$\text{Cr}_2\text{O}_3$ using nanoscale scanning diamond magnetometry and
second-harmonic-generation microscopy. We find that the 180$^\circ$ domain
walls are predominantly Bloch-like, and can co-exist with N\'eel walls in
crystals with significant in-plane anisotropy. In the latter case, N\'eel walls
that run perpendicular to a magnetic easy axis acquire a well-defined
chirality. We further report quantitative measurement of the domain-wall width
and surface magnetization. Our results provide fundamental input and an
experimental methodology for the understanding of domain walls in pure,
intrinsic antiferromagnets, which is relevant to achieve electrical control of
domain-wall motion in antiferromagnetic compounds.
","[{""version"":""v1"",""created"":""Fri, 18 Sep 2020 18:35:17 GMT""},{""version"":""v2"",""created"":""Wed, 7 Apr 2021 06:58:41 GMT""}]","2021-04-08"
"2009.09016","Dominik Mach\'a\v{c}ek","Dominik Mach\'a\v{c}ek, Ond\v{r}ej Bojar","Presenting Simultaneous Translation in Limited Space",,"ITAT WAFNL 2020",,,"cs.CL","http://arxiv.org/licenses/nonexclusive-distrib/1.0/","  Some methods of automatic simultaneous translation of a long-form speech
allow revisions of outputs, trading accuracy for low latency. Deploying these
systems for users faces the problem of presenting subtitles in a limited space,
such as two lines on a television screen. The subtitles must be shown promptly,
incrementally, and with adequate time for reading. We provide an algorithm for
subtitling. Furthermore, we propose a way how to estimate the overall usability
of the combination of automatic translation and subtitling by measuring the
quality, latency, and stability on a test set, and propose an improved measure
for translation latency.
","[{""version"":""v1"",""created"":""Fri, 18 Sep 2020 18:37:03 GMT""}]","2020-09-22"
"2009.09017","Leandro Nascimento","Luis Fern\'andez, Reginaldo O. Corr\^ea Jr., Van S\'ergio Alves,
  Leandro O. Nascimento, Francisco Pe\~na","Dynamical Mass Generation in Pseudo Quantum Electrodynamics with
  Gross-Neveu Interaction at finite temperature",,"Phys. Rev. D 103, 025018 (2021)","10.1103/PhysRevD.103.025018",,"hep-th","http://arxiv.org/licenses/nonexclusive-distrib/1.0/","  We study the dynamical mass generation in Pseudo Quantum Electrodynamics
(PQED) coupled to the Gross-Neveu (GN) interaction, in (2+1) dimensions, at
both zero and finite temperatures. We start with a gapless model and show that,
under particular conditions, a dynamically generated mass emerges. In order to
do so, we use a truncated Schwinger-Dyson equation, at the large-N
approximation, in the imaginary-time formalism. In the instantaneous-exchange
approximation (the static regime), we obtain two critical parameters, namely,
the critical number of fermions $N_c(T)$ and the critical coupling constant
$\alpha_c(T)$ as a function of temperature and of the cutoff $\Lambda$, which
must be provided by experiments. In the dynamical regime, we find an analytical
solution for the mass function $\Sigma(p,T)$ as well as a zero-external
momentum solution for $p=0$. We compare our analytical results with numerical
tests and a good agreement is found.
","[{""version"":""v1"",""created"":""Fri, 18 Sep 2020 18:39:01 GMT""}]","2021-01-27"
"2009.09018","Nino Ba\v{s}i\'c","Nino Ba\v{s}i\'c and Patrick W. Fowler and Toma\v{z} Pisanski and
  Irene Sciriha","On singular signed graphs with nullspace spanned by a full vector:
  Signed nut graphs","43 pages, 4 figures, 2 appendices",,,,"math.CO","http://arxiv.org/licenses/nonexclusive-distrib/1.0/","  A signed graph has edge weights drawn from the set $\{+1,-1\}$, and is termed
sign-balanced if it is equivalent to an unsigned graph under the operation of
sign switching; otherwise it is called sign-unbalanced. A nut graph has a one
dimensional kernel with a corresponding eigenvector that is full. In this paper
we generalise the notion of nut graphs to signed graphs. Orders for which
unsigned regular nut graphs exist were determined recently for the degrees up
to $11$. By extending the definition to signed nut graphs, we find all pairs
$(\rho, n)$ for which a $\rho$-regular nut graph (sign-balanced or
sign-unbalanced) of order $n$ exists with $\rho \le 11$. We devise a
construction for signed nut graphs based on a smaller `seed' graph, giving
infinite series of both sign-balanced and sign-unbalanced $\rho$-regular nut
graphs. All orders for which a complete sign-unbalanced nut graph exists are
characterised; they have underlying graph $K_n$ with $n \equiv 1 \pmod 4$. All
orders for which a regular sign-unbalanced nut graph with $\rho = n - 2$ exists
are also characterised; they have an underlying cocktail-party graph
$\mathrm{CP}(n)$ with even $n \geq 8$.
","[{""version"":""v1"",""created"":""Fri, 18 Sep 2020 18:41:55 GMT""},{""version"":""v2"",""created"":""Wed, 30 Sep 2020 16:28:26 GMT""},{""version"":""v3"",""created"":""Mon, 12 Oct 2020 16:25:27 GMT""},{""version"":""v4"",""created"":""Tue, 29 Dec 2020 10:59:16 GMT""}]","2021-01-01"
"2009.09019","Mahmoud Alfadel","Mahmoud Alfadel, Diego Elias Costa, Mouafak Mokhallalati, Emad Shihab,
  and Bram Adams","On the Threat of npm Vulnerable Dependencies in Node.js Applications",,,,,"cs.SE","http://arxiv.org/licenses/nonexclusive-distrib/1.0/","  Software vulnerabilities have a large negative impact on the software systems
that we depend on daily. Reports on software vulnerabilities always paint a
grim picture, with some reports showing that 83% of organizations depend on
vulnerable software. However, our experience leads us to believe that, in the
grand scheme of things, these software vulnerabilities may have less impact
than what is reported. Therefore, we perform a study to better understand the
threat of npm vulnerable packages used in Node.js applications. We define three
threat levels for vulnerabilities in packages, based on their lifecycle, where
a package vulnerability is assigned a low threat level if it was hidden or
still unknown at the time it was used in the dependent application (t), medium
threat level if the vulnerability was reported but not yet published at t, and
high if it was publicly announced at t. Then, we perform an empirical study
involving 6,673 real-world, active, and mature open source Node.js
applications. Our findings show that although 67.93% of the examined
applications depend on at least one vulnerable package, 94.91% of the
vulnerable packages in those affected applications are classified as having low
threat. Moreover, we find that in the case of vulnerable packages classified as
having high threat, it is the application's lack of updating that makes them
vulnerable, i.e., it is not the existence of the vulnerability that is the real
problem. Furthermore, we verify our findings at different stages of the
application's lifetime and find that our findings still hold. Our study argues
that when it comes to software vulnerabilities, things may not be as bad as
they seem and that considering vulnerability threat is key.
","[{""version"":""v1"",""created"":""Fri, 18 Sep 2020 18:45:21 GMT""}]","2020-09-22"
"2009.09020","Naoki Saito","Alexander Cloninger, Haotian Li, Naoki Saito","Natural Graph Wavelet Packet Dictionaries",,"J. Fourier Anal. Appl. 27, 41 (2021)","10.1007/s00041-021-09832-3",,"eess.SP cs.NA math.CO math.NA math.SP","http://creativecommons.org/licenses/by/4.0/","  We introduce a set of novel multiscale basis transforms for signals on graphs
that utilize their ""dual"" domains by incorporating the ""natural"" distances
between graph Laplacian eigenvectors, rather than simply using the eigenvalue
ordering. These basis dictionaries can be seen as generalizations of the
classical Shannon wavelet packet dictionary to arbitrary graphs, and do not
rely on the frequency interpretation of Laplacian eigenvalues. We describe the
algorithms (involving either vector rotations or orthogonalizations) to
construct these basis dictionaries, use them to efficiently approximate graph
signals through the best basis search, and demonstrate the strengths of these
basis dictionaries for graph signals measured on sunflower graphs and street
networks.
","[{""version"":""v1"",""created"":""Fri, 18 Sep 2020 18:46:54 GMT""},{""version"":""v2"",""created"":""Wed, 10 Feb 2021 01:36:55 GMT""},{""version"":""v3"",""created"":""Fri, 12 Mar 2021 21:05:53 GMT""},{""version"":""v4"",""created"":""Tue, 20 Apr 2021 16:27:11 GMT""}]","2021-04-26"
"2009.09021","Alexey Belyanin","Maria Erukhimova, Yongrui Wang, Mikhail Tokman, Alexey Belyanin","Relaxation operator for quasiparticles in a solid","37 pages, 3 figures",,"10.1103/PhysRevB.102.235103",,"cond-mat.mes-hall cond-mat.other quant-ph","http://arxiv.org/licenses/nonexclusive-distrib/1.0/","  Popular models of the phenomenological relaxation operators that are widely
used in the master equation formalism for open condensed-matter systems have
significant flaws ranging from limited applicability to violation of
fundamental physical principles. We propose a relatively simple universal model
of the relaxation operator which is free from these flaws, has a correct static
limit, correct direct-current limit in a uniform electric field, includes both
interband and intraband transitions, and is valid for an arbitrary dispersion
of quasiparticles in a solid. We use the proposed operator to generalize the
Lindhard formula and derive explicit expressions for the relaxation operator
for Dirac materials with an unconventional energy spectrum of quasiparticles,
such as graphene and Weyl semimetals. We compare the linear susceptibility
spectra for graphene obtained with different relaxation models and show that
the proposed relaxation operator leads to physically meaningful behavior of the
susceptibility at low frequencies whereas the existing models become completely
invalid.
","[{""version"":""v1"",""created"":""Fri, 18 Sep 2020 18:47:29 GMT""}]","2020-12-30"
"2009.09022","Ding Lu","Zhaojun Bai and Ren-Cang Li and Ding Lu","Optimal Convergence Rate of Self-Consistent Field Iteration for Solving
  Eigenvector-dependent Nonlinear Eigenvalue Problems",,,,,"math.NA cs.NA","http://arxiv.org/licenses/nonexclusive-distrib/1.0/","  We present a comprehensive convergence analysis for Self-Consistent Field
(SCF) iteration to solve a class of nonlinear eigenvalue problems with
eigenvector-dependency (NEPv). Using a tangent-angle matrix as an intermediate
measure for approximation error, we establish new formulas for two fundamental
quantities that optimally characterize the local convergence of the plain SCF:
the local contraction factor and the local average contraction factor. In
comparison with previously established results, new convergence rate estimates
provide much sharper bounds on the convergence speed. As an application, we
extend the convergence analysis to a popular SCF variant -- the level-shifted
SCF. The effectiveness of the convergence rate estimates is demonstrated
numerically for NEPv arising from solving the Kohn-Sham equation in electronic
structure calculation and the Gross-Pitaevskii equation in the modeling of
Bose-Einstein condensation.
","[{""version"":""v1"",""created"":""Fri, 18 Sep 2020 18:49:39 GMT""}]","2020-09-22"
