"2009.09176","Yan Zeng","Yan Zeng, Shohei Shimizu, Ruichu Cai, Feng Xie, Michio Yamamoto,
  Zhifeng Hao","Causal Discovery with Multi-Domain LiNGAM for Latent Factors","16 pages, 11 figures",,,,"cs.LG stat.ML","http://arxiv.org/licenses/nonexclusive-distrib/1.0/","  Discovering causal structures among latent factors from observed data is a
particularly challenging problem. Despite some efforts for this problem,
existing methods focus on the single-domain data only. In this paper, we
propose Multi-Domain Linear Non-Gaussian Acyclic Models for Latent Factors
(MD-LiNA), where the causal structure among latent factors of interest is
shared for all domains, and we provide its identification results. The model
enriches the causal representation for multi-domain data. We propose an
integrated two-phase algorithm to estimate the model. In particular, we first
locate the latent factors and estimate the factor loading matrix. Then to
uncover the causal structure among shared latent factors of interest, we derive
a score function based on the characterization of independence relations
between external influences and the dependence relations between multi-domain
latent factors and latent factors of interest. We show that the proposed method
provides locally consistent estimators. Experimental results on both synthetic
and real-world data demonstrate the efficacy and robustness of our approach.
","[{""version"":""v1"",""created"":""Sat, 19 Sep 2020 06:44:03 GMT""},{""version"":""v2"",""created"":""Tue, 20 Jul 2021 13:36:41 GMT""},{""version"":""v3"",""created"":""Sat, 23 Apr 2022 03:49:35 GMT""}]","2022-04-26"
"2009.09177","Shengming Luo","Jiashun Jin and Zheng Tracy Ke and Shengming Luo and Minzhe Wang","Optimal Estimation of the Number of Communities",,,,,"stat.ME math.ST stat.TH","http://arxiv.org/licenses/nonexclusive-distrib/1.0/","  In network analysis, how to estimate the number of communities $K$ is a
fundamental problem. We consider a broad setting where we allow severe degree
heterogeneity and a wide range of sparsity levels, and propose Stepwise
Goodness-of-Fit (StGoF) as a new approach. This is a stepwise algorithm, where
for $m = 1, 2, \ldots$, we alternately use a community detection step and a
goodness-of-fit (GoF) step. We adapt SCORE \cite{SCORE} for community
detection, and propose a new GoF metric. We show that at step $m$, the GoF
metric diverges to $\infty$ in probability for all $m < K$ and converges to
$N(0,1)$ if $m = K$. This gives rise to a consistent estimate for $K$. Also, we
discover the right way to define the signal-to-noise ratio (SNR) for our
problem and show that consistent estimates for $K$ do not exist if
$\mathrm{SNR} \goto 0$, and StGoF is uniformly consistent for $K$ if
$\mathrm{SNR} \goto \infty$. Therefore, StGoF achieves the optimal phase
transition.
  Similar stepwise methods (e.g., \cite{wang2017likelihood, ma2018determining})
are known to face analytical challenges. We overcome the challenges by using a
different stepwise scheme in StGoF and by deriving sharp results that are not
available before. The key to our analysis is to show that SCORE has the {\it
Non-Splitting Property (NSP)}. Primarily due to a non-tractable rotation of
eigenvectors dictated by the Davis-Kahan $\sin(\theta)$ theorem, the NSP is
non-trivial to prove and requires new techniques we develop.
","[{""version"":""v1"",""created"":""Sat, 19 Sep 2020 06:44:14 GMT""},{""version"":""v2"",""created"":""Wed, 26 Jan 2022 03:18:09 GMT""}]","2022-01-27"
"2009.09178","Kalevi Kokko","K. Kokko, \'A. Nagy, J. Huhtala, T. Bj\""orkman and L. Vitos","Spherically symmetric density and potential of a hydrogen molecule","5 pages, 4 figures",,,,"physics.chem-ph physics.atm-clus","http://arxiv.org/licenses/nonexclusive-distrib/1.0/","  Using a hydrogen molecule as a test system we demonstrate how to compute the
effective potential according to the formalism of the new density functional
theory (DFT), in which the basic variable is the set of spherically averaged
densities instead of the total density, used in the traditional DFT. The
effective potential together the external potential, nuclear Coulomb potential,
can be substituted in the Schr\""odinger like differential equation to obtain
the spherically averaged electron density of the system. In the new method
instead of one three-dimensional low symmetry equation one has to solve as many
spherically symmetric equations as there are atoms in the system.
","[{""version"":""v1"",""created"":""Sat, 19 Sep 2020 06:51:17 GMT""}]","2020-09-22"
"2009.09179","Chongyang Wang","Min Peng, Chongyang Wang, Yuan Gao, Tao Bi, Tong Chen, Yu Shi,
  Xiang-Dong Zhou","Recognizing Micro-Expression in Video Clip with Adaptive Key-Frame
  Mining","Submitted for Review in IEEE Transactions on Multimedia",,,,"cs.CV","http://arxiv.org/licenses/nonexclusive-distrib/1.0/","  As a spontaneous expression of emotion on face, micro-expression reveals the
underlying emotion that cannot be controlled by human. In micro-expression,
facial movement is transient and sparsely localized through time. However, the
existing representation based on various deep learning techniques learned from
a full video clip is usually redundant. In addition, methods utilizing the
single apex frame of each video clip require expert annotations and sacrifice
the temporal dynamics. To simultaneously localize and recognize such fleeting
facial movements, we propose a novel end-to-end deep learning architecture,
referred to as adaptive key-frame mining network (AKMNet). Operating on the
video clip of micro-expression, AKMNet is able to learn discriminative
spatio-temporal representation by combining spatial features of self-learned
local key frames and their global-temporal dynamics. Theoretical analysis and
empirical evaluation show that the proposed approach improved recognition
accuracy in comparison with state-of-the-art methods on multiple benchmark
datasets.
","[{""version"":""v1"",""created"":""Sat, 19 Sep 2020 07:03:16 GMT""},{""version"":""v2"",""created"":""Wed, 3 Mar 2021 14:38:06 GMT""},{""version"":""v3"",""created"":""Mon, 15 Mar 2021 07:53:54 GMT""}]","2021-03-16"
"2009.09180","Tobias Dornheim","Zhandos Moldabekov and Tobias Dornheim and Michael Bonitz","Screening of a test charge in a free-electron gas at warm dense matter
  and dense non-ideal plasma conditions",,"Contributions to Plasma Physics 61, e202000176 (2021)","10.1002/ctpp.202000176",,"physics.plasm-ph","http://arxiv.org/licenses/nonexclusive-distrib/1.0/","  The screening of a test charge by partially degenerate non-ideal free
electrons at conditions related to warm dense matter and dense plasmas is
investigated using linear response theory and the local field correction based
on ab inito Quantum Monte-Carlo simulations data. The analysis of the obtained
results is performed by comparing to the random phase approximation and the
Singwi-Tosi-Land-Sj\""olander approximation. The applicability of the
long-wavelength approximation for the description of screening is investigated.
The impact of electronic exchange-correlations effects on structural properties
and the applicability of the screened potential from linear response theory for
the simulation of the dynamics of ions are discussed.
","[{""version"":""v1"",""created"":""Sat, 19 Sep 2020 07:13:21 GMT""}]","2021-03-09"
"2009.09181","Hiroshi Noguchi","Hiroshi Noguchi","Virtual bending method to calculate bending rigidity, saddle-splay
  modulus, and spontaneous curvature of thin fluid membrane","11 pages, 8 figures","Phys. Rev. E 102, 053315 (2020)","10.1103/PhysRevE.102.053315",,"cond-mat.soft physics.bio-ph","http://arxiv.org/licenses/nonexclusive-distrib/1.0/","  A method to calculate the bending rigidity $\kappa$, saddle-splay modulus
$\bar{\kappa}$, and spontaneous curvature $C_0$ of a fluid membrane is
proposed. Virtual work for the bending deformations into cylindrical and
spherical shapes is calculated for a flat membrane. This method does not
require a force decomposition, unlike the existing stress-profile method. The
first derivative of the deformation gives $\kappa C_0$ and is a discrete form
of the first moment of the stress profile. The second derivatives give $\kappa$
and $\bar{\kappa}$, and include the variance terms of the first derivatives,
which are not accounted for in the stress-profile method. This method is
examined for a solvent-free meshless membrane model and a
dissipative-particle-dynamics two-bead amphiphilic molecular model. It is
concluded that $\kappa$ and $\bar{\kappa}$ of a thin membrane can be accurately
calculated, whereas for a thick membrane or one with an explicit solvent, a
further extension to include the volume-fluctuation effects is required for an
accurate estimation. The amplitude of the volume-fluctuation effects can be
evaluated using the parameter dependence in the present method.
","[{""version"":""v1"",""created"":""Sat, 19 Sep 2020 07:29:33 GMT""},{""version"":""v2"",""created"":""Wed, 4 Nov 2020 04:46:39 GMT""}]","2020-11-30"
"2009.09182","Zhihang Yuan","Zhihang Yuan, Xin Liu, Bingzhe Wu, Guangyu Sun","ENAS4D: Efficient Multi-stage CNN Architecture Search for Dynamic
  Inference","6 figures",,,,"cs.CV","http://arxiv.org/licenses/nonexclusive-distrib/1.0/","  Dynamic inference is a feasible way to reduce the computational cost of
convolutional neural network(CNN), which can dynamically adjust the computation
for each input sample. One of the ways to achieve dynamic inference is to use
multi-stage neural network, which contains a sub-network with prediction layer
at each stage. The inference of a input sample can exit from early stage if the
prediction of the stage is confident enough. However, design a multi-stage CNN
architecture is a non-trivial task. In this paper, we introduce a general
framework, ENAS4D, which can efficiently search for optimal multi-stage CNN
architecture for dynamic inference in a well-designed search space. Firstly, we
propose a method to construct the search space with multi-stage convolution.
The search space include different numbers of layers, different kernel sizes
and different numbers of channels for each stage and the resolution of input
samples. Then, we train a once-for-all network that supports to sample diverse
multi-stage CNN architecture. A specialized multi-stage network can be obtained
from the once-for-all network without additional training. Finally, we devise a
method to efficiently search for the optimal multi-stage network that trades
the accuracy off the computational cost taking the advantage of once-for-all
network. The experiments on the ImageNet classification task demonstrate that
the multi-stage CNNs searched by ENAS4D consistently outperform the
state-of-the-art method for dyanmic inference. In particular, the network
achieves 74.4% ImageNet top-1 accuracy under 185M average MACs.
","[{""version"":""v1"",""created"":""Sat, 19 Sep 2020 08:08:26 GMT""}]","2020-09-22"
"2009.09183","Hengyu Zhou","Qiang Gao, Hengyu Zhou","The area minimizing problem in conformal cones, II","The is a sequel to arXiv:2001.06207. 12pt, Page 40","Science China Mathematics, 2020",,,"math.DG math.AP","http://arxiv.org/licenses/nonexclusive-distrib/1.0/","  In this paper we continue to study the connection among the area minimizing
problem, certain area functional and the Dirichlet problem of minimal surface
equations in a class of conformal cones with a similar motivation from
\cite{GZ20}. These cones are certain generalizations of hyperbolic spaces. We
describe the structure of area minimizing $n$-nteger multiplicity currents in
bounded $C^2$ conformal cones with prescribed $C^1$ graphical boundary via a
minimizing problem of these area functionals. As an application we solve the
corresponding Dirichlet problem of minimal surface equations under a mean
convex type assumption. We also extend the existence and uniqueness of a local
area minimizing integer multiplicity current with star-shaped infinity boundary
in hyperbolic spaces into a large class of complete conformal manifolds.
","[{""version"":""v1"",""created"":""Sat, 19 Sep 2020 08:17:47 GMT""}]","2020-10-13"
"2009.09184","Raffaele Barretta","Francesco Paolo Pinnola, Marzia Sara Vaccaro, Raffaele Barretta,
  Francesco Marotti de Sciarra","Random vibrations of stress-driven nonlocal beams with external damping","Meccanica (2020)",,"10.1007/s11012-020-01181-7",,"physics.app-ph","http://creativecommons.org/licenses/by/4.0/","  Stochastic flexural vibrations of small-scale Bernoulli-Euler beams with
external damping are investigated by stress-driven nonlocal mechanics. Damping
effects are simulated considering viscous interactions between beam and
surrounding environment. Loadings are modeled by accounting for their random
nature. Such a dynamic problem is characterized by a stochastic partial
differential equation in space and time governing time-evolution of the
relevant displacement field. Differential eigenanalyses are performed to
evaluate modal time coordinates and mode shapes, providing a complete
stochastic description of response solutions. Closed-form expressions of power
spectral density, correlation function, stationary and non-stationary variances
of displacement fields are analytically detected. Size-dependent dynamic
behaviour is assessed in terms of stiffness, variance and power spectral
density of displacements. The outcomes can be useful for design and
optimization of structural components of modern small-scale devices, such as
Micro- and Nano-Electro-Mechanical-Systems (MEMS and NEMS).
","[{""version"":""v1"",""created"":""Sat, 19 Sep 2020 08:19:38 GMT""}]","2020-09-22"
"2009.09185","Martin Genzel","Martin Genzel and Alexander Stollenwerk","A Unified Approach to Uniform Signal Recovery From Non-Linear
  Observations","to be published in Foundations of Computational Mathematics (accepted
  version)",,,,"cs.IT math.IT math.ST stat.TH","http://arxiv.org/licenses/nonexclusive-distrib/1.0/","  Recent advances in quantized compressed sensing and high-dimensional
estimation have shown that signal recovery is even feasible under strong
non-linear distortions in the observation process. An important characteristic
of associated guarantees is uniformity, i.e., recovery succeeds for an entire
class of structured signals with a fixed measurement ensemble. However, despite
significant results in various special cases, a general understanding of
uniform recovery from non-linear observations is still missing. This paper
develops a unified approach to this problem under the assumption of i.i.d.
sub-Gaussian measurement vectors. Our main result shows that a simple
least-squares estimator with any convex constraint can serve as a universal
recovery strategy, which is outlier robust and does not require explicit
knowledge of the underlying non-linearity. Based on empirical process theory, a
key technical novelty is an approximative increment condition that can be
implemented for all common types of non-linear models. This flexibility allows
us to apply our approach to a variety of problems in non-linear compressed
sensing and high-dimensional statistics, leading to several new and improved
guarantees. Each of these applications is accompanied by a conceptually simple
and systematic proof, which does not rely on any deeper properties of the
observation model. On the other hand, known local stability properties can be
incorporated into our framework in a plug-and-play manner, thereby implying
near-optimal error bounds.
","[{""version"":""v1"",""created"":""Sat, 19 Sep 2020 08:29:30 GMT""},{""version"":""v2"",""created"":""Thu, 6 Jan 2022 13:35:48 GMT""}]","2022-01-07"
"2009.09186","Hamid Reza Sepangi","Afsaneh Rahmani, Mohsen Khodadi, Matin Honardoost, Hamid Reza Sepangi","Instability and no-hair paradigm in d-dimensional charged-AdS black
  holes","13 pages, 5 figures, to appear in Nuclear Physics B","Nuclear Physics B 960 (2020) 115185","10.1016/j.nuclphysb.2020.115185",,"gr-qc hep-th","http://arxiv.org/licenses/nonexclusive-distrib/1.0/","  Is it possible the no-hair paradigm is violated when a black hole undergoes
an instability? Employing massless charged scalar perturbations, we address
this question within the context of conformally invariant Einstein-Maxwell
theory for some allowed $d$-dimensional ($d=4n+4$ with conformal parameter
$n=0,1,2,...$ ) topological small AdS black-holes. We provide numerical
analyses that show the non trivial scalar hairy black hole solutions to include
planar and spherical horizon topologies in higher dimensions with an even
conformal parameter $n$. It is also shown that the solutions presented here
cannot be considered as scalar hairs for a Reissner-Nordstrom background. As a
result, for $d$-dimensional small AdS black holes in the presence of a
conformally invariant Maxwell source, the no-scalar hair paradigm seems to be
supported.
","[{""version"":""v1"",""created"":""Sat, 19 Sep 2020 08:32:52 GMT""},{""version"":""v2"",""created"":""Tue, 22 Sep 2020 04:39:35 GMT""}]","2020-10-01"
"2009.09187","Matthias Karlbauer","Matthias Karlbauer, Sebastian Otte, Hendrik P.A. Lensch, Thomas
  Scholten, Volker Wulfmeyer, and Martin V. Butz","Inferring, Predicting, and Denoising Causal Wave Dynamics","As accepted by the 29th International Conference on Artificial Neural
  Networks (ICANN20)",,,,"cs.LG stat.ML","http://arxiv.org/licenses/nonexclusive-distrib/1.0/","  The novel DISTributed Artificial neural Network Architecture (DISTANA) is a
generative, recurrent graph convolution neural network. It implements a grid or
mesh of locally parameterizable laterally connected network modules. DISTANA is
specifically designed to identify the causality behind spatially distributed,
non-linear dynamical processes. We show that DISTANA is very well-suited to
denoise data streams, given that re-occurring patterns are observed,
significantly outperforming alternative approaches, such as temporal
convolution networks and ConvLSTMs, on a complex spatial wave propagation
benchmark. It produces stable and accurate closed-loop predictions even over
hundreds of time steps. Moreover, it is able to effectively filter noise -- an
ability that can be improved further by applying denoising autoencoder
principles or by actively tuning latent neural state activities
retrospectively. Results confirm that DISTANA is ready to model real-world
spatio-temporal dynamics such as brain imaging, supply networks, water flow, or
soil and weather data patterns.
","[{""version"":""v1"",""created"":""Sat, 19 Sep 2020 08:33:53 GMT""}]","2020-09-22"
"2009.09188","Raffaele Barretta","Raffaele Barretta, Francesco Marotti de Sciarra, Marzia Sara Vaccaro","On nonlocal mechanics of curved elastic beams",,"International Journal of Engineering Science 144, November 2019,
  103140","10.1016/j.ijengsci.2019.103140",,"physics.app-ph","http://creativecommons.org/licenses/by/4.0/","  Curved beams are basic structural components of
Nano-Electro-Mechanical-Sistems (NEMS) whose design requires appropriate
modelling of scale effects. In the present paper, the size-dependent static
behaviour of curved elastic nano-beams is investigated by stress-driven
nonlocal continuum mechanics. Axial strain and flexural curvature fields are
integral convolutions between equilibrated axial force and bending moment
fields and an averaging kernel. The nonlocal integral methodology formulated
here is the generalization to curved structures of the treatment in [Int. J.
Eng. Science 115 (2017) 14-27] confined to straight beams. The corresponding
nonlocal differential problem, supplemented with non-standard boundary
conditions, is highlighted and shown to lead to mathematically well-posed
problems of nano-engineering. The theoretical predictions, exhibiting
stiffening nonlocal behaviours, are therefore appropriate to significantly
model a wide range of small-scale devices of nanotechnological interest. The
nonlocal approach is exploited by analytically establishing size-dependent
responses of curved elastic nano-sensors and nano-actuators that are driven by
the small-scale characteristic parameter.
","[{""version"":""v1"",""created"":""Sat, 19 Sep 2020 08:41:09 GMT""}]","2020-09-22"
"2009.09189","Jiangbin Gong Prof.","Muhammad Umer, Raditya Weda Bomantara and Jiangbin Gong","Dynamical characterization of Weyl nodes in Floquet Weyl semimetal
  phases","15 pages, 7 figures, this version to appear in Phys. Rev. B","Phys. Rev. B 103, 094309 (2021)","10.1103/PhysRevB.103.094309",,"cond-mat.mes-hall quant-ph","http://arxiv.org/licenses/nonexclusive-distrib/1.0/","  Due to studies in nonequilibrium (periodically-driven) topological matter, it
is now understood that some topological invariants used to classify equilibrium
states of matter do not suffice to describe their nonequilibrium counterparts.
Indeed, in Floquet systems the additional gap arising from the periodicity of
the quasienergy Brillouin zone often leads to unique topological phenomena
without equilibrium analogues. In the context of Floquet Weyl semimetal, Weyl
points may be induced at both quasienergy zero and $\pi/T$ ($T$ being the
driving period) and these two types of Weyl points can be very close to each
other in the momentum space. Because of their momentum-space proximity, the
chirality of each individual Weyl point may become hard to characterize in both
theory and experiments, thus making it challenging to determine the system's
overall topology. In this work, inspired by the construction of dynamical
winding numbers in Floquet Chern insulators, we propose a dynamical invariant
capable of characterizing and distinguishing between Weyl points at different
quasienergy values, thus advancing one step further in the topological
characterization of Floquet Weyl semimetals. To demonstrate the usefulness of
such a dynamical topological invariant, we consider a variant of the
periodically kicked Harper model (the very first model in studies of Floquet
topological phases) that exhibits many Weyl points, with the number of Weyl
points rising unlimitedly with the strength of some system parameters.
Furthermore, we investigate the two-terminal transport signature associated
with the Weyl points. Theoretical findings of this work pave the way for
experimentally probing the rich topological band structures of some seemingly
simple Floquet semimetal systems.
","[{""version"":""v1"",""created"":""Sat, 19 Sep 2020 08:52:32 GMT""},{""version"":""v2"",""created"":""Tue, 16 Mar 2021 12:11:51 GMT""}]","2021-03-31"
"2009.09190","Fang Liu","Fang Liu, Kenneth W. Shum, Yijin Zhang, and Wing Shing Wong","Schedule Sequence Design for Broadcast in Multi-channel Ad Hoc Networks",,,,,"cs.IT math.IT","http://arxiv.org/licenses/nonexclusive-distrib/1.0/","  We consider a single-hop ad hoc network in which each node aims to broadcast
packets to its neighboring nodes by using multiple slotted, TDD collision
channels. There is no cooperation among the nodes. To ensure successful
broadcast, we propose to pre-assign each node a periodic sequence to schedule
transmissions and receptions at each time slot. These sequences are referred to
as schedule sequences. Since each node starts its transmission schedule
independently, there exist relative time offsets among the schedule sequences
they use. Our objective is to design schedule sequences such that each node can
transmit at least one packet to each of its neighbors successfully within a
common period, no matter what the time offsets are. The sequence period should
be designed as short as possible. In this paper, we analyze the lower bound on
sequence period, and propose a sequence construction method by which the period
can achieve the same order as the lower bound.
  We also consider the random scheme in which each node transmits or receives
on a channel at each time slot with a pre-determined probability. The frame
length and broadcast completion time under different schemes are compared by
numerical studies.
","[{""version"":""v1"",""created"":""Sat, 19 Sep 2020 09:02:06 GMT""}]","2020-09-22"
"2009.09191","Fanchao Qi","Guoyang Zeng, Fanchao Qi, Qianrui Zhou, Tingji Zhang, Zixian Ma, Bairu
  Hou, Yuan Zang, Zhiyuan Liu, Maosong Sun","OpenAttack: An Open-source Textual Adversarial Attack Toolkit","ACL-IJCNLP 2021 Demo. 9 pages, 3 figures",,"10.18653/v1/2021.acl-demo.43",,"cs.CL cs.AI cs.CR","http://creativecommons.org/licenses/by-nc-sa/4.0/","  Textual adversarial attacking has received wide and increasing attention in
recent years. Various attack models have been proposed, which are enormously
distinct and implemented with different programming frameworks and settings.
These facts hinder quick utilization and fair comparison of attack models. In
this paper, we present an open-source textual adversarial attack toolkit named
OpenAttack to solve these issues. Compared with existing other textual
adversarial attack toolkits, OpenAttack has its unique strengths in support for
all attack types, multilinguality, and parallel processing. Currently,
OpenAttack includes 15 typical attack models that cover all attack types. Its
highly inclusive modular design not only supports quick utilization of existing
attack models, but also enables great flexibility and extensibility. OpenAttack
has broad uses including comparing and evaluating attack models, measuring
robustness of a model, assisting in developing new attack models, and
adversarial training. Source code and documentation can be obtained at
https://github.com/thunlp/OpenAttack.
","[{""version"":""v1"",""created"":""Sat, 19 Sep 2020 09:02:56 GMT""},{""version"":""v2"",""created"":""Fri, 24 Sep 2021 08:29:26 GMT""}]","2021-09-27"
