"2009.09108","Shengwen Gan","Yuqiu Fu and Shengwen Gan","On Kakeya maps with regularity assumptions",,,,,"math.CA math.MG","http://arxiv.org/licenses/nonexclusive-distrib/1.0/","  For a $n-$dimensional Kakeya set $(n\geq 3)$ we may define a Kakeya map
associated to it which parametrizes the Kakeya set by $[0,1]\times S^{n-1},$
where $S^{n-1}$ is thought of as the space of unit directions. We show that if
the Kakeya map is either $\alpha-$H\""{o}lder continuous with
$\alpha>\frac{(n-2)n}{(n-1)^2},$ or continuous and in the Sobolev space $ H^{s}
$ for some $s>(n-1)/2,$ then the Kakeya set has positive Lebesgue measure.
","[{""version"":""v1"",""created"":""Fri, 18 Sep 2020 22:22:21 GMT""}]","2020-09-22"
"2009.09109","Ling Zhang","Ling Zhang, Yize Chen and Baosen Zhang","A Convex Neural Network Solver for DCOPF with Generalization Guarantees",,,,,"eess.SY cs.SY","http://arxiv.org/licenses/nonexclusive-distrib/1.0/","  The DC optimal power flow (DCOPF) problem is a fundamental problem in power
systems operations and planning. With high penetration of uncertain renewable
resources in power systems, DCOPF needs to be solved repeatedly for a large
amount of scenarios, which can be computationally challenging. As an
alternative to iterative solvers, neural networks are often trained and used to
solve DCOPF. These approaches can offer orders of magnitude reduction in
computational time, but they cannot guarantee generalization, and small
training error does not imply small testing errors. In this work, we propose a
novel algorithm for solving DCOPF that guarantees the generalization
performance. First, by utilizing the convexity of DCOPF problem, we train an
input convex neural network. Second, we construct the training loss based on
KKT optimality conditions. By combining these two techniques, the trained model
has provable generalization properties, where small training error implies
small testing errors. In experiments, our algorithm improves the optimality
ratio of the solutions by a factor of five in comparison to end-to-end models.
","[{""version"":""v1"",""created"":""Fri, 18 Sep 2020 22:31:08 GMT""}]","2020-09-22"
"2009.09110","Mucahit Cevik","Igor Ilic and Berk Gorgulu and Mucahit Cevik and Mustafa Gokce
  Baydogan","Explainable boosted linear regression for time series forecasting",,,,,"cs.LG stat.ML","http://arxiv.org/licenses/nonexclusive-distrib/1.0/","  Time series forecasting involves collecting and analyzing past observations
to develop a model to extrapolate such observations into the future.
Forecasting of future events is important in many fields to support decision
making as it contributes to reducing the future uncertainty. We propose
explainable boosted linear regression (EBLR) algorithm for time series
forecasting, which is an iterative method that starts with a base model, and
explains the model's errors through regression trees. At each iteration, the
path leading to highest error is added as a new variable to the base model. In
this regard, our approach can be considered as an improvement over general time
series models since it enables incorporating nonlinear features by residuals
explanation. More importantly, use of the single rule that contributes to the
error most allows for interpretable results. The proposed approach extends to
probabilistic forecasting through generating prediction intervals based on the
empirical error distribution. We conduct a detailed numerical study with EBLR
and compare against various other approaches. We observe that EBLR
substantially improves the base model performance through extracted features,
and provide a comparable performance to other well established approaches. The
interpretability of the model predictions and high predictive accuracy of EBLR
makes it a promising method for time series forecasting.
","[{""version"":""v1"",""created"":""Fri, 18 Sep 2020 22:31:42 GMT""}]","2020-09-22"
"2009.09111","Barinder Thind","Barinder Thind, Sidi Wu, Richard Groenewald, Jiguo Cao","FuncNN: An R Package to Fit Deep Neural Networks Using Generalized Input
  Spaces","23 pages, 5 figures, submitted to JSS",,,,"stat.ML cs.LG stat.CO","http://arxiv.org/licenses/nonexclusive-distrib/1.0/","  Neural networks have excelled at regression and classification problems when
the input space consists of scalar variables. As a result of this proficiency,
several popular packages have been developed that allow users to easily fit
these kinds of models. However, the methodology has excluded the use of
functional covariates and to date, there exists no software that allows users
to build deep learning models with this generalized input space. To the best of
our knowledge, the functional neural network (FuncNN) library is the first such
package in any programming language; the library has been developed for R and
is built on top of the keras architecture. Throughout this paper, several
functions are introduced that provide users an avenue to easily build models,
generate predictions, and run cross-validations. A summary of the underlying
methodology is also presented. The ultimate contribution is a package that
provides a set of general modelling and diagnostic tools for data problems in
which there exist both functional and scalar covariates.
","[{""version"":""v1"",""created"":""Fri, 18 Sep 2020 22:32:29 GMT""},{""version"":""v2"",""created"":""Tue, 22 Sep 2020 04:41:36 GMT""}]","2020-09-23"
"2009.09112","Tian Shi","Tian Shi and Ping Wang and Chandan K. Reddy","An Interpretable and Uncertainty Aware Multi-Task Framework for
  Multi-Aspect Sentiment Analysis",,,,,"cs.CL cs.IR","http://arxiv.org/licenses/nonexclusive-distrib/1.0/","  In recent years, several online platforms have seen a rapid increase in the
number of review systems that request users to provide aspect-level feedback.
Document-level Multi-aspect Sentiment Classification (DMSC), where the goal is
to predict the ratings/sentiment from a review at an individual aspect level,
has become a challenging and imminent problem. To tackle this challenge, we
propose a deliberate self-attention-based deep neural network model, namely
FEDAR, for the DMSC problem, which can achieve competitive performance while
also being able to interpret the predictions made. FEDAR is equipped with a
highway word embedding layer to transfer knowledge from pre-trained word
embeddings, an RNN encoder layer with output features enriched by pooling and
factorization techniques, and a deliberate self-attention layer. In addition,
we also propose an Attention-driven Keywords Ranking (AKR) method, which can
automatically discover aspect keywords and aspect-level opinion keywords from
the review corpus based on the attention weights. These keywords are
significant for rating predictions by FEDAR. Since crowdsourcing annotation can
be an alternate way to recover missing ratings of reviews, we propose a
LEcture-AuDience (LEAD) strategy to estimate model uncertainty in the context
of multi-task learning, so that valuable human resources can focus on the most
uncertain predictions. Our extensive set of experiments on five different
open-domain DMSC datasets demonstrate the superiority of the proposed FEDAR and
LEAD models. We further introduce two new DMSC datasets in the healthcare
domain and benchmark different baseline models and our models on them.
Attention weights visualization results and visualization of aspect and opinion
keywords demonstrate the interpretability of our model and the effectiveness of
our AKR method.
","[{""version"":""v1"",""created"":""Fri, 18 Sep 2020 22:32:39 GMT""},{""version"":""v2"",""created"":""Mon, 31 May 2021 03:44:49 GMT""}]","2021-06-01"
"2009.09113","Oleg Pikhurko","Oleg Pikhurko","Borel Combinatorics of Locally Finite Graphs","53 pages; formatted for the 2021 British Combinatorial Conference
  volume",,,,"math.CO math.LO","http://arxiv.org/licenses/nonexclusive-distrib/1.0/","  We provide a gentle introduction, aimed at non-experts, to Borel
combinatorics that studies definable graphs on topological spaces. This is an
emerging field on the borderline between combinatorics and descriptive set
theory with deep connections to many other areas.
  After giving some background material, we present in careful detail some
basic tools and results on the existence of Borel satisfying assignments: Borel
versions of greedy algorithms and augmenting procedures, local rules, Borel
transversals, etc. Also, we present the construction of Andrew Marks of acyclic
Borel graphs for which the greedy bound $\Delta+1$ on the Borel chromatic
number is best possible.
  In the remainder of the paper we briefly discuss various topics such as
relations to LOCAL algorithms, measurable versions of Hall's marriage theorem
and of Lov\'asz Local Lemma, applications to equidecomposability, etc.
","[{""version"":""v1"",""created"":""Fri, 18 Sep 2020 22:34:38 GMT""},{""version"":""v2"",""created"":""Wed, 9 Dec 2020 05:28:13 GMT""},{""version"":""v3"",""created"":""Sun, 17 Jan 2021 15:54:39 GMT""}]","2021-01-19"
"2009.09114","Ilaria Pascucci","I. Pascucci, A. Banzatti, U. Gorti, M. Fang, K. Pontoppidan, R.
  Alexander, G. Ballabio, S. Edwards, C. Salyk, G. Sacco, E. Flaccomio, G. A.
  Blake, A. Carmona, C. Hall, I. Kamp, H. U. Kaufl, G. Meeus, M. Meyer, T.
  Pauly, S. Steendam, M. Sterzik","The Evolution of Disk Winds from a Combined Study of Optical and
  Infrared Forbidden Lines","Accepted for publication in The Astrophysical Journal",,"10.3847/1538-4357/abba3c",,"astro-ph.SR astro-ph.EP astro-ph.GA","http://arxiv.org/licenses/nonexclusive-distrib/1.0/","  We analyze high-resolution (dv=<10km/s) optical and infrared spectra covering
the [OI] 6300 angstrom and [NeII] 12.81 micron lines from a sample of 31 disks
in different evolutionary stages. Following work at optical wavelengths, we use
Gaussian profiles to fit the [NeII] lines and classify them into HVC (LVC) if
the line centroid is more (less) blueshifted than 30 km/s with respect to the
stellar radial velocity. Unlike for the [OI] where a HVC is often accompanied
by a LVC, all 17 sources with a [NeII] detection have either a HVC or a LVC.
[NeII] HVCs are preferentially detected toward high accretors (Macc > 10$^{-8}$
Msun/yr) while LVCs are found in sources with low Macc, low [OI] luminosity,
and large infrared spectral index (n13-31). Interestingly, the [NeII] and [OI]
LVC luminosities display an opposite behaviour with n13-31: as the inner dust
disk depletes (higher n13-31) the [NeII] luminosity increases while the [OI]
weakens. The [NeII] and [OI] HVC profiles are generally similar with centroids
and FWHMs showing the expected behaviour from shocked gas in micro-jets. In
contrast, the [NeII] LVC profiles are typically more blueshifted and narrower
than the [OI] profiles. The FWHM and centroid vs. disk inclination suggest that
the [NeII] LVC predominantly traces unbound gas from a slow, wide-angle wind
that has not lost completely the Keplerian signature from its launching region.
We sketch an evolutionary scenario that could explain the combined [OI] and
[NeII] results and includes screening of hard (~1keV) X-rays in inner, mostly
molecular, MHD winds.
","[{""version"":""v1"",""created"":""Fri, 18 Sep 2020 22:56:46 GMT""}]","2020-11-11"
"2009.09115","Hussein Osman","Hussein Osman, Karim Zaghw, Mostafa Hazem, Seifeldin Elsehely","An Efficient Language-Independent Multi-Font OCR for Arabic Script","9 pages, 4 figures, 4 tables, 2 algorithms, accepted in the
  International Conference of Digital Image Processing and Pattern Recognition
  (DPPR), London, UK, November 2020",,,,"cs.CV cs.LG","http://arxiv.org/licenses/nonexclusive-distrib/1.0/","  Optical Character Recognition (OCR) is the process of extracting digitized
text from images of scanned documents. While OCR systems have already matured
in many languages, they still have shortcomings in cursive languages with
overlapping letters such as the Arabic language. This paper proposes a complete
Arabic OCR system that takes a scanned image of Arabic Naskh script as an input
and generates a corresponding digital document. Our Arabic OCR system consists
of the following modules: Pre-processing, Word-level Feature Extraction,
Character Segmentation, Character Recognition, and Post-processing. This paper
also proposes an improved font-independent character segmentation algorithm
that outperforms the state-of-the-art segmentation algorithms. Lastly, the
paper proposes a neural network model for the character recognition task. The
system has experimented on several open Arabic corpora datasets with an average
character segmentation accuracy 98.06%, character recognition accuracy 99.89%,
and overall system accuracy 97.94% achieving outstanding results compared to
the state-of-the-art Arabic OCR systems.
","[{""version"":""v1"",""created"":""Fri, 18 Sep 2020 22:57:03 GMT""}]","2020-09-22"
"2009.09116","Srihari Maruthachalam","Srihari Maruthachalam","Analysis of artifacts in EEG signals for building BCIs",,,,,"eess.SP cs.LG","http://arxiv.org/licenses/nonexclusive-distrib/1.0/","  Brain-Computer Interface (BCI) is an essential mechanism that interprets the
human brain signal. It provides an assistive technology that enables persons
with motor disabilities to communicate with the world and also empowers them to
lead independent lives. The common BCI devices use Electroencephalography (EEG)
electrical activity recorded from the scalp. EEG signals are noisy owing to the
presence of many artifacts, namely, eye blink, head movement, and jaw movement.
Such artifacts corrupt the EEG signal and make EEG analysis challenging. This
issue is addressed by locating the artifacts and excluding the EEG segment from
the analysis, which could lead to a loss of useful information. However, we
propose a practical BCI that uses the artifacts which has a low signal to noise
ratio.
  The objective of our work is to classify different types of artifacts, namely
eye blink, head nod, head turn, and jaw movements in the EEG signal. The
occurrence of the artifacts is first located in the EEG signal. The located
artifacts are then classified using linear time and dynamic time warping
techniques. The located artifacts can be used by a person with a motor
disability to control a smartphone. A speech synthesis application that uses
eyeblinks in a single channel EEG system and jaw clinches in four channels EEG
system are developed. Word prediction models are used for word completion, thus
reducing the number of artifacts required.
","[{""version"":""v1"",""created"":""Fri, 18 Sep 2020 23:03:40 GMT""}]","2020-09-22"
"2009.09117","Vineeth Kashyap","Roger Scott, Joseph Ranieri, Lucja Kot, Vineeth Kashyap","Out of Sight, Out of Place: Detecting and Assessing Swapped Arguments",,,,,"cs.PL cs.SE","http://arxiv.org/licenses/nonexclusive-distrib/1.0/","  Programmers often add meaningful information about program semantics when
naming program entities such as variables, functions, and macros. However,
static analysis tools typically discount this information when they look for
bugs in a program. In this work, we describe the design and implementation of a
static analysis checker called SwapD, which uses the natural language
information in programs to warn about mistakenly-swapped arguments at call
sites. SwapD combines two independent detection strategies to improve the
effectiveness of the overall checker. We present the results of a comprehensive
evaluation of SwapD over a large corpus of C and C++ programs totaling 417
million lines of code. In this evaluation, SwapD found 154 manually-vetted
real-world cases of mistakenly-swapped arguments, suggesting that such errors,
while not pervasive in released code, are a real problem and a worthwhile
target for static analysis.
","[{""version"":""v1"",""created"":""Fri, 18 Sep 2020 23:07:39 GMT""}]","2020-09-22"
"2009.09118","Devon Richtsmeier","Devon Richtsmeier, Chelsea A. S. Dunning, Kris Iniewski, Magdalena
  Bazalova-Carter","Multi-contrast K-edge imaging on a bench-top photon-counting CT system:
  Acquisition parameter study","16 pages, 8 figures, 1 table, accepted to the Journal of
  Instrumentation",,"10.1088/1748-0221/15/10/P10029",,"physics.med-ph","http://arxiv.org/licenses/nonexclusive-distrib/1.0/","  Purpose: Photon-counting computed tomography (PCCT) shows promise for medical
imaging in regards to material separation and imaging of multiple contrast
agents. However, many PCCT setups are under development and are not optimized
for specific contrast agents or use cases. Here, we demonstrate how
experimental system parameters may be varied in order to enhance performance
and we propose a set of recommendations to achieve this based on contrast
agent.
  Approach: A table-top PCCT system with a cadmium zinc telluride (CZT)
detector capable of separating six energy bins was used to image multiple
contrast agents in a small phantom. The contrast agents were separated and the
concentration was quantified using K-edge subtraction. To increase system
performance, we investigated three parameters: beam filter type and thickness,
projection acquisition time, and energy bin width. The results from the
parameters were compared based on PCCT signal and contrast to noise ratio (CNR)
or noise in K-edge images. The concentrations of the contrast agents were
quantified in K-edge images and compared to known concentrations.
  Results: The bench-top PCCT system was able to successfully quantify the
contrast agents through K-edge subtraction. Decreasing projection acquisition
time showed a decrease in K-edge CNR. However, it did not scale as the square
root of time. Filter type and bin width demonstrated a dependence on the
specific contrast agent.
  Conclusions: The presented bench-top system demonstrated the ability to
separate contrast agents using K-edge subtraction and accurately determine
contrast concentration in K-edge images. Specific parameters for future use
will be chosen based on contrast agent.
","[{""version"":""v1"",""created"":""Fri, 18 Sep 2020 23:26:32 GMT""}]","2020-12-30"
"2009.09119","Martin Fernandez","M.A. Fernandez, Simeon Bird, and Phoebe Upton Sanderbeck","Effect of Separate Initial Conditions on the Lyman-$\alpha$ Forest in
  Simulations","12 pages, 13 figures",,"10.1093/mnras/stab555",,"astro-ph.CO","http://arxiv.org/licenses/nonexclusive-distrib/1.0/","  Using a set of high resolution simulations, we quantify the effect of species
specific initial transfer functions on probes of the IGM via the Lyman-$\alpha$
forest. We focus on redshifts $2-6$, after H~{\sc i} reionization. We explore
the effect of these initial conditions on measures of the thermal state of the
low density IGM: the curvature, Doppler width cutoff, and Doppler width
distribution. We also examine the matter and flux power spectrum, and potential
consequences for constraints on warm dark matter models. We find that the
curvature statistic is at most affected at the $\approx2\%$ level at $z=6$. The
Doppler width cutoff parameters are affected by $\approx5\%$ for the intercept,
and $\approx8\%$ for the fit slope, though this is subdominant to sample
variation. The Doppler width distribution shows a $\approx30\%$ effect at
$z=3$, however the distribution is not fully converged with simulation box size
and resolution. The flux power spectrum is at most affected by $\approx5\%$ at
high redshift and small scales. We discuss numerical convergence with
simulation parameters.
","[{""version"":""v1"",""created"":""Fri, 18 Sep 2020 23:27:08 GMT""},{""version"":""v2"",""created"":""Fri, 12 Mar 2021 22:20:26 GMT""}]","2021-03-16"
"2009.09120","Shih-Ting Lin","Shih-Ting Lin and Greg Durrett","Tradeoffs in Sentence Selection Techniques for Open-Domain Question
  Answering",,,,,"cs.CL","http://arxiv.org/licenses/nonexclusive-distrib/1.0/","  Current methods in open-domain question answering (QA) usually employ a
pipeline of first retrieving relevant documents, then applying strong reading
comprehension (RC) models to that retrieved text. However, modern RC models are
complex and expensive to run, so techniques to prune the space of retrieved
text are critical to allow this approach to scale. In this paper, we focus on
approaches which apply an intermediate sentence selection step to address this
issue, and investigate the best practices for this approach. We describe two
groups of models for sentence selection: QA-based approaches, which run a
full-fledged QA system to identify answer candidates, and retrieval-based
models, which find parts of each passage specifically related to each question.
We examine trade-offs between processing speed and task performance in these
two approaches, and demonstrate an ensemble module that represents a hybrid of
the two. From experiments on Open-SQuAD and TriviaQA, we show that very
lightweight QA models can do well at this task, but retrieval-based models are
faster still. An ensemble module we describe balances between the two and
generalizes well cross-domain.
","[{""version"":""v1"",""created"":""Fri, 18 Sep 2020 23:39:15 GMT""}]","2020-09-22"
"2009.09121","Ishika Palit","Ishika Palit, Agnieszka Janiuk, Bozena Czerny","Clumpy wind accretion in Cygnus X-1","16 pages, 10 figures, 2 tables, accepted for publication in ApJ",,"10.3847/1538-4357/abba1b","The Astrophysical Journal, Volume 904, Number 1","astro-ph.HE","http://arxiv.org/licenses/nonexclusive-distrib/1.0/","  Cygnus X-1 is one of the brightest X-ray sources observed and shows the X-ray
intensity variations on time scales from milliseconds to months in both the
soft and hard X-rays. The accretion onto the black hole is believed to be wind
fed due to focused stellar wind from the binary companion HDE-226868. We aim to
understand the physical mechanism responsible for the short timescale X-ray
variability ($<$100 s) of the source in its Hard/Low state. We compute the 2D
relativistic hydrodynamic simulation of the low angular momentum accretion flow
with a time dependent outer boundary condition that reflects the focused,
clumpy wind from the super-giant in this X-ray binary system. We follow the
dynamical evolution of our model for about 100 s and present the results
showing an oscillatory shock, being a potential explanation of variability
observed in hard X-rays. The simulated model with shock solutions is in good
agreement with the observed power density spectra of the source.
","[{""version"":""v1"",""created"":""Fri, 18 Sep 2020 23:56:16 GMT""}]","2020-11-20"
"2009.09122","Juan Carlos Seck Tuoh Mora","Juan Carlos Seck-Tuoh-Mora, Genaro J. Martinez, Norberto
  Hernandez-Romero, Joselito Medina-Marin, Irving Barragan-Vite","On complex dynamics from reversible cellular automata","26 pages, 14 figures, Submitted to: Comm Nonlinear Sci Numer Simulat",,,,"nlin.CG cs.FL","http://arxiv.org/licenses/nonexclusive-distrib/1.0/","  Complexity has been a recurrent research topic in cellular automata because
they represent systems where complex behaviors emerge from simple local
interactions. A significant amount of previous research has been conducted
proposing instances of complex cellular automata; however, most of the proposed
methods are based on a careful search or a meticulous construction of evolution
rules.
  This paper presents the emergence of complex behaviors based on reversible
cellular automata. In particular, this paper shows that reversible cellular
automata represent an adequate framework to obtain complex behaviors adding
only new random states.
  Experimental results show that complexity can be obtained from reversible
cellular automata appending a proportion of about two times more states at
random than the original number of states in the reversible automaton. Thus, it
is possible to obtain complex cellular automata with dozens of states.
Complexity appears to be commonly obtained from reversible cellular automata,
and using other operations such as permutations of states or row and column
permutations in the evolution rule. The relevance of this paper is to present
that reversibility can be a useful structure to implement complex behaviors in
cellular automata.
","[{""version"":""v1"",""created"":""Fri, 18 Sep 2020 23:56:34 GMT""}]","2020-09-22"
"2009.09123","Yuval Pinter","Yuval Pinter, Cassandra L. Jacobs, Jacob Eisenstein","Will it Unblend?","Findings of EMNLP 2020",,,,"cs.CL cs.AI","http://arxiv.org/licenses/nonexclusive-distrib/1.0/","  Natural language processing systems often struggle with out-of-vocabulary
(OOV) terms, which do not appear in training data. Blends, such as
""innoventor"", are one particularly challenging class of OOV, as they are formed
by fusing together two or more bases that relate to the intended meaning in
unpredictable manners and degrees. In this work, we run experiments on a novel
dataset of English OOV blends to quantify the difficulty of interpreting the
meanings of blends by large-scale contextual language models such as BERT. We
first show that BERT's processing of these blends does not fully access the
component meanings, leaving their contextual representations semantically
impoverished. We find this is mostly due to the loss of characters resulting
from blend formation. Then, we assess how easily different models can recognize
the structure and recover the origin of blends, and find that context-aware
embedding systems outperform character-level and context-free embeddings,
although their results are still far from satisfactory.
","[{""version"":""v1"",""created"":""Fri, 18 Sep 2020 23:59:15 GMT""}]","2020-09-22"
