"2009.09698","Nguyen Tuan Duy","N.T.Duy, Takeo Inami and D.T.Huong","Physical constraints derived from FCNC in the 3-3-1-1 model","29 pages, 7 figures","EUROPEAN PHYSICAL JOURNAL C 81, 813 (2021)","10.1140/epjc/s10052-021-09583-x",,"hep-ph","http://arxiv.org/licenses/nonexclusive-distrib/1.0/","  We investigate several phenomena related to FCNCs in the $\text{3-3-1-1}$
model. The sources of FCNCs at the tree-level from both the gauge and Higgs
sectors are clarified. Experiments on the oscillation of mesons most
stringently constrain the tree-level FCNCs. The lower bound on the new physics
scale is imposed more tightly than in the previous, $\text{M}_{\text{new}}>12 $
\text{TeV}. Under this bound, the tree-level FCNCs make a negligible
contribution to the $\text{Br}(B_s \rightarrow \mu^+ \mu^-)$, $\text{Br}(B
\rightarrow K^{*} \mu^+ \mu^-)$ and $\text{Br}(B^{+}\rightarrow
K^{+}\mu^{+}\mu^{-})$. The branching ratio of radiative decay $b \rightarrow s
\gamma$ is enhanced by the ratio $\frac{v}{u}$ via diagrams with the charged
Higgs mediation. In contrast, the charged currents of new gauge bosons
significantly contribute to the decay process $\mu \rightarrow e \gamma$.
","[{""version"":""v1"",""created"":""Mon, 21 Sep 2020 09:14:35 GMT""},{""version"":""v2"",""created"":""Tue, 2 Feb 2021 16:40:16 GMT""},{""version"":""v3"",""created"":""Tue, 23 Nov 2021 14:25:08 GMT""}]","2021-11-24"
"2009.09699","Annika Dochhan","Annika Dochhan, Helmut Grie{\ss}er, Brian Teipen, Michael Eiselt","A 3-Dimensional Simplex Modulation Format with Improved OSNR Performance
  Compared to DP-BPSK",,"14. ITG Symposium Photonic Networks, 2013",,,"eess.SP","http://arxiv.org/licenses/nonexclusive-distrib/1.0/","  The novel 3-dimensional modulation format 3D-Simplex offers potentially 1.2
dB higher OSNR tolerance than DP-DPSK while exhibiting the same spectral
occupancy, modulating two bits per symbol. We verify this benefit
experimen-tally and evaluate the transmission performance in a non-linear
environment. All experimental results are confirmed by simulations. The benefit
of 3D-Simplex is not maintained in the highly non-linear regime, but the
performance is still comparable to that of DP-DPSK.
","[{""version"":""v1"",""created"":""Mon, 21 Sep 2020 09:14:45 GMT""}]","2020-09-22"
"2009.09700","Carlo Marinelli","Carlo Marinelli, Luca Scarpa, Ulisse Stefanelli","An alternative proof of well-posedness of stochastic evolution equations
  in the variational setting","11 pages","Rev. Roumaine Math. Pures Appl. 66 (2021), no. 1, 209-221",,,"math.AP math.PR","http://arxiv.org/licenses/nonexclusive-distrib/1.0/","  We present a new proof of well-posedness of stochastic evolution equations in
variational form, relying solely on a (nonlinear) infinite-dimensional
approximation procedure rather than on classical finite-dimensional projection
arguments of Galerkin type.
","[{""version"":""v1"",""created"":""Mon, 21 Sep 2020 09:15:01 GMT""}]","2021-09-15"
"2009.09701","JiaRui Fei","Jiarui Fei","Mahler Measure of 3D Landau-Ginzburg Potentials","36 pages, many tables, comments are welcome; v2 corrected a few
  typos, and incorporated non-squarefree cases in Conjecture 4.4","Forum Math. 33 (2021), no. 5, 1369-1401",,,"math.NT","http://arxiv.org/licenses/nonexclusive-distrib/1.0/","  We express the Mahler measures of $23$ families of Laurent polynomials in
terms of Eisenstein-Kronecker series. These Laurent polynomials arise as
Landau-Ginzburg potentials on Fano $3$-folds, $16$ of which define $K3$
hypersurfaces of generic Picard rank $19$, and the rest are of generic Picard
rank $< 19$. We relate the Mahler measure at each rational singular moduli to
the value at $3$ of the $L$-function of some weight-$3$ newform. Moreover, we
find $10$ exotic relations among the Mahler measures of these families.
","[{""version"":""v1"",""created"":""Mon, 21 Sep 2020 09:15:14 GMT""},{""version"":""v2"",""created"":""Thu, 8 Oct 2020 07:23:18 GMT""}]","2021-12-01"
"2009.09702","Andrij Rovenchak","Mykola Husev and Andrij Rovenchak","On the verge of life: Distribution of nucleotide sequences in viral RNAs",,"Biosemiotics 14, No. 2, 253-269 (2021)","10.1007/s12304-021-09403-5",,"q-bio.OT","http://arxiv.org/licenses/nonexclusive-distrib/1.0/","  The aim of the study is to analyze viruses using parameters obtained from
distributions of nucleotide sequences in the viral RNA. Seeking for the input
data homogeneity, we analyze single-stranded RNA viruses only. Two approaches
are used to obtain the nucleotide sequences; In the first one, chunks of equal
length (four nucleotides) are considered. In the second approach, the whole RNA
genome is divided into parts by adenine or the most frequent nucleotide as a
""space"". Rank--frequency distributions are studied in both cases. Within the
first approach, the P\'olya and the negative hypergeometric distribution yield
the best fit. For the distributions obtained within the second approach, we
have calculated a set of parameters, including entropy, mean sequence length,
and its dispersion. The calculated parameters became the basis for the
classification of viruses. We observed that proximity of viruses on planes
spanned on various pairs of parameters corresponds to related species. In
certain cases, such a proximity is observed for unrelated species as well
calling thus for the expansion of the set of parameters used in the
classification. We also observed that the fourth most frequent nucleotide
sequences obtained within the second approach are of different nature in case
of human coronaviruses (different nucleotides for MERS, SARS-CoV, and
SARS-CoV-2 versus identical nucleotides for four other coronaviruses). We
expect that our findings will be useful as a supplementary tool in the
classification of diseases caused by RNA viruses with respect to severity and
contagiousness.
","[{""version"":""v1"",""created"":""Mon, 21 Sep 2020 09:17:23 GMT""}]","2022-04-25"
"2009.09703","Anjith George","Zohreh Mostaani and Anjith George and Guillaume Heusch and David
  Geissbuhler and Sebastien Marcel","The High-Quality Wide Multi-Channel Attack (HQ-WMCA) database",,,,,"cs.CV","http://arxiv.org/licenses/nonexclusive-distrib/1.0/","  The High-Quality Wide Multi-Channel Attack database (HQ-WMCA) database
extends the previous Wide Multi-Channel Attack database(WMCA), with more
channels including color, depth, thermal, infrared (spectra), and short-wave
infrared (spectra), and also a wide variety of attacks.
","[{""version"":""v1"",""created"":""Mon, 21 Sep 2020 09:18:19 GMT""}]","2020-09-22"
"2009.09704","Qianqian Dong","Qianqian Dong, Rong Ye, Mingxuan Wang, Hao Zhou, Shuang Xu, Bo Xu, Lei
  Li","""Listen, Understand and Translate"": Triple Supervision Decouples
  End-to-end Speech-to-text Translation","Accepted by AAAI 2021",,,,"cs.CL eess.AS","http://arxiv.org/licenses/nonexclusive-distrib/1.0/","  An end-to-end speech-to-text translation (ST) takes audio in a source
language and outputs the text in a target language. Existing methods are
limited by the amount of parallel corpus. Can we build a system to fully
utilize signals in a parallel ST corpus? We are inspired by human understanding
system which is composed of auditory perception and cognitive processing. In
this paper, we propose Listen-Understand-Translate, (LUT), a unified framework
with triple supervision signals to decouple the end-to-end speech-to-text
translation task. LUT is able to guide the acoustic encoder to extract as much
information from the auditory input. In addition, LUT utilizes a pre-trained
BERT model to enforce the upper encoder to produce as much semantic information
as possible, without extra data. We perform experiments on a diverse set of
speech translation benchmarks, including Librispeech English-French, IWSLT
English-German and TED English-Chinese. Our results demonstrate LUT achieves
the state-of-the-art performance, outperforming previous methods. The code is
available at https://github.com/dqqcasia/st.
","[{""version"":""v1"",""created"":""Mon, 21 Sep 2020 09:19:07 GMT""},{""version"":""v2"",""created"":""Mon, 28 Dec 2020 07:28:44 GMT""},{""version"":""v3"",""created"":""Mon, 5 Apr 2021 12:36:42 GMT""}]","2021-04-06"
"2009.09705","Thomas Dahm","Mirko Daumann, Robin Steinigeweg, Thomas Dahm","Many-Body Localization in Translational Invariant Diamond Ladders with
  Flat Bands","8 pages, 8 figures, extended version",,,,"cond-mat.stat-mech cond-mat.quant-gas cond-mat.str-el","http://arxiv.org/licenses/nonexclusive-distrib/1.0/","  The presence of flat bands is a source of localization in lattice systems.
While flat bands are often unstable with respect to interactions between the
particles, they can persist in certain cases. We consider a diamond ladder with
transverse hopping that possesses such stable flat bands and show that
many-body localization appears in the presence of interactions without quenched
disorder. We numerically demonstrate that the eigenstate thermalization
hypothesis is violated. We show that the influence of degenerate flat band
states spreads across the full energy spectrum and grows extensively in the
thermodynamic limit. Furthermore, we verify localization in terms of time
evolution of some local observable, revival probability, participation ratio
and entanglement entropy.
","[{""version"":""v1"",""created"":""Mon, 21 Sep 2020 09:20:08 GMT""},{""version"":""v2"",""created"":""Mon, 15 May 2023 11:41:46 GMT""}]","2023-05-16"
"2009.09706","Johannes Dornheim","Johannes Dornheim, Lukas Morand, Samuel Zeitvogel, Tarek Iraki,
  Norbert Link, Dirk Helm","Deep Reinforcement Learning Methods for Structure-Guided Processing Path
  Optimization",,"Journal of Intelligent Manufacturing (2021)","10.1007/s10845-021-01805-z",,"cs.LG cs.AI cs.SY eess.SY stat.ML","http://creativecommons.org/licenses/by/4.0/","  A major goal of materials design is to find material structures with desired
properties and in a second step to find a processing path to reach one of these
structures. In this paper, we propose and investigate a deep reinforcement
learning approach for the optimization of processing paths. The goal is to find
optimal processing paths in the material structure space that lead to
target-structures, which have been identified beforehand to result in desired
material properties. There exists a target set containing one or multiple
different structures. Our proposed methods can find an optimal path from a
start structure to a single target structure, or optimize the processing paths
to one of the equivalent target-structures in the set. In the latter case, the
algorithm learns during processing to simultaneously identify the best
reachable target structure and the optimal path to it. The proposed methods
belong to the family of model-free deep reinforcement learning algorithms. They
are guided by structure representations as features of the process state and by
a reward signal, which is formulated based on a distance function in the
structure space. Model-free reinforcement learning algorithms learn through
trial and error while interacting with the process. Thereby, they are not
restricted to information from a priori sampled processing data and are able to
adapt to the specific process. The optimization itself is model-free and does
not require any prior knowledge about the process itself. We instantiate and
evaluate the proposed methods by optimizing paths of a generic metal forming
process. We show the ability of both methods to find processing paths leading
close to target structures and the ability of the extended method to identify
target-structures that can be reached effectively and efficiently and to focus
on these targets for sample efficient processing path optimization.
","[{""version"":""v1"",""created"":""Mon, 21 Sep 2020 09:20:24 GMT""},{""version"":""v2"",""created"":""Mon, 2 Nov 2020 10:47:15 GMT""},{""version"":""v3"",""created"":""Wed, 26 May 2021 12:55:49 GMT""},{""version"":""v4"",""created"":""Wed, 7 Jul 2021 23:00:33 GMT""}]","2021-07-09"
"2009.09707","Volodymyr Nosenko","V. Nosenko, M. Pustylnik, M. Rubin-Zuzic, A. M. Lipaev, A. V. Zobnin,
  A. D. Usachev, H. M. Thomas, M. H. Thoma, V. E. Fortov, O. Kononenko, A.
  Ovchinin","Shear flow in a three-dimensional complex plasma in microgravity
  conditions","5 pages, 4 figures","Phys. Rev. Research 2, 033404 (2020)","10.1103/PhysRevResearch.2.033404",,"physics.plasm-ph","http://arxiv.org/licenses/nonexclusive-distrib/1.0/","  Shear flow in a three-dimensional complex plasma was experimentally studied
in microgravity conditions using Plasmakristall-4 (PK-4) instrument on board
the International Space Station (ISS). The shear flow was created in an
extended suspension of microparticles by applying the radiation pressure force
of the manipulation-laser beam. Individual particle trajectories in the flow
were analyzed and from these, using the Navier-Stokes equation, an upper
estimate of the complex plasma's kinematic viscosity was calculated in the
range of $0.2$--$6.7~{\rm mm^2/s}$. This estimate is much lower than previously
reported in ground-based experiments with 3D complex plasmas. Possible reasons
of this difference are discussed.
","[{""version"":""v1"",""created"":""Mon, 21 Sep 2020 09:21:22 GMT""}]","2020-09-22"
"2009.09708","Qintong Li","Qintong Li, Piji Li, Zhaochun Ren, Pengjie Ren, Zhumin Chen","Knowledge Bridging for Empathetic Dialogue Generation","Accepted by AAAI 2022. Code at https://github.com/qtli/KEMP",,,,"cs.CL","http://arxiv.org/licenses/nonexclusive-distrib/1.0/","  Lack of external knowledge makes empathetic dialogue systems difficult to
perceive implicit emotions and learn emotional interactions from limited
dialogue history. To address the above problems, we propose to leverage
external knowledge, including commonsense knowledge and emotional lexical
knowledge, to explicitly understand and express emotions in empathetic dialogue
generation. We first enrich the dialogue history by jointly interacting with
external knowledge and construct an emotional context graph. Then we learn
emotional context representations from the knowledge-enriched emotional context
graph and distill emotional signals, which are the prerequisites to predicate
emotions expressed in responses. Finally, to generate the empathetic response,
we propose an emotional cross-attention mechanism to learn the emotional
dependencies from the emotional context graph. Extensive experiments conducted
on a benchmark dataset verify the effectiveness of the proposed method. In
addition, we find the performance of our method can be further improved by
integrating with a pre-trained model that works orthogonally.
","[{""version"":""v1"",""created"":""Mon, 21 Sep 2020 09:21:52 GMT""},{""version"":""v2"",""created"":""Tue, 24 Nov 2020 04:27:38 GMT""},{""version"":""v3"",""created"":""Wed, 29 Dec 2021 10:57:24 GMT""}]","2021-12-30"
"2009.09709","Annika Dochhan","Annika Dochhan, Helmut Grie{\ss}er, Michael Eiselt, J\""org-Peter
  Elbers","Flexible bandwidth 448 Gb/s DMT Transmission for Next Generation Data
  Center Inter-Connects","This work was funded by the German ministry of education and research
  (BMBF) within the SASER ADVAntage-NET project under contract 16BP12400","European Conference on Optical Communication (ECOC) 2014","10.1109/ECOC.2014.6964048",,"eess.SP","http://arxiv.org/licenses/nonexclusive-distrib/1.0/","  We experimentally evaluate a flexible DMT system using 4 to 8 50-GHz-grid
C-band channels to transmit 448 Gb/s over up to 240 km SSMF. VSB filtering
enabled by detuned lasers significantly reduces the impact of chromatic
dispersion.
","[{""version"":""v1"",""created"":""Mon, 21 Sep 2020 09:23:36 GMT""}]","2020-09-22"
"2009.09710","Yavar Kian","Oleg Yu. Imanuvilov, Yavar Kian and Masahiro Yamamoto","Inverse parabolic problems of determining functions with one
  spatial-component independence by Carleman estimate",,,,,"math.AP","http://arxiv.org/licenses/nonexclusive-distrib/1.0/","  For an initial-boundary value problem for a parabolic equation in the spatial
variable $x=(x_1,.., x_n)$ and time $t$, we consider an inverse problem of
determining a coefficient which is independent of one spatial component $x_n$
by extra lateral boundary data. We apply a Carleman estimate to prove a
conditional stability estimate for the inverse problem. Also we prove similar
results for the corresponding inverse source problem.
","[{""version"":""v1"",""created"":""Mon, 21 Sep 2020 09:24:41 GMT""}]","2020-09-22"
"2009.09711","Ryszard Szwarc","Ryszard Szwarc","Positivity of Tur\'an determinants for orthogonal polynomials II",,,,,"math.CA","http://arxiv.org/licenses/nonexclusive-distrib/1.0/","  The polynomials $p_n$ orthogonal on the interval $[-1,1],$ normalized by
$p_n(1)=1,$ satisfy Tur\'an's inequality if $p_n^2(x)-p_{n-1}(x)p_{n+1}(x)\ge
0$ for $n\ge 1$ and for all $x$ in the interval of orthogonality. We give a
general criterion for orthogonal polynomials to satisfy Tur\'an's inequality.
This extends essentially the results of \cite{szw}. In particular the results
can be applied to many classes of orthogonal polynomials, by inspecting their
recurrence relation.
","[{""version"":""v1"",""created"":""Mon, 21 Sep 2020 09:25:38 GMT""},{""version"":""v2"",""created"":""Thu, 27 May 2021 13:39:48 GMT""},{""version"":""v3"",""created"":""Mon, 28 Jun 2021 16:51:37 GMT""}]","2021-06-29"
"2009.09712","Alexandre Kisselev","S.C. \.Inan and A.V. Kisselev","Probing anomalous quartic $\gamma\gamma\gamma\gamma$ couplings in
  light-by-light collisions at the CLIC","20 pages, 8 figures. Figures 2-11 are combined as 2-7, tables 2-6 are
  combined as tables 2-3. Equation (16) is corrected, equations (17), (18), and
  one reference are added. Abstract is corrected. Version accepted for
  publication in EPJ C",,"10.1140/epjc/s10052-021-09466-1",,"hep-ph hep-ex","http://arxiv.org/licenses/nonexclusive-distrib/1.0/","  The anomalous quartic neutral couplings of the $\gamma\gamma\gamma\gamma$
vertex in a polarized light-by-light scattering of the Compton backscattered
photons at the CLIC are examined. Both differential and total cross sections
are calculated for $e^+e^-$ collision energies 1500 GeV and 3000 GeV. The
helicity of the initial electron beams is taken to be $\pm\,0.8$. The
unpolarized and SM cross sections for the same values of helicities are also
estimated. The 95\% C.L. exclusion limits on two anomalous photon couplings
$\zeta_1$ and $\zeta_2$ are calculated. The best bounds on these couplings are
found to be $6.85 \times 10^{-16} \mathrm{\ GeV}^{-4}$ and $1.43 \times
10^{-15} \mathrm{\ GeV}^{-4}$, respectively. The results are compared with the
exclusion bounds obtained previously for the LHC and HL-LHC. It is shown that
the light-by-light scattering at the CLIC, especially the polarized, has a
greater potential to search for the anomalous quartic neutral couplings of the
$\gamma\gamma\gamma\gamma$ vertex.
","[{""version"":""v1"",""created"":""Mon, 21 Sep 2020 09:26:19 GMT""},{""version"":""v2"",""created"":""Tue, 27 Oct 2020 16:23:26 GMT""},{""version"":""v3"",""created"":""Mon, 11 Jan 2021 08:41:48 GMT""},{""version"":""v4"",""created"":""Thu, 29 Jul 2021 06:40:37 GMT""}]","2021-08-18"
"2009.09713","Wolfgang Karl H\""ardle","Sergey Nasekin, Wolfgang Karl H\""ardle","Model-driven statistical arbitrage on LETF option markets",,"Quantitative Finance Quantitative Finance, Volume 19, 2019 - Issue
  11","10.1080/14697688.2019.1605186",,"q-fin.ST","http://creativecommons.org/licenses/by/4.0/","  In this paper, we study the statistical properties of the moneyness scaling
transformation by Leung and Sircar (2015). This transformation adjusts the
moneyness coordinate of the implied volatility smile in an attempt to remove
the discrepancy between the IV smiles for levered and unlevered ETF options. We
construct bootstrap uniform confidence bands which indicate that the implied
volatility smiles are statistically different after moneyness scaling has been
performed. An empirical application shows that there are trading opportunities
possible on the LETF market. A statistical arbitrage type strategy based on a
dynamic semiparametric factor model is presented. This strategy presents a
statistical decision algorithm which generates trade recommendations based on
comparison of model and observed LETF implied volatility surface. It is shown
to generate positive returns with a high probability. Extensive econometric
analysis of LETF implied volatility process is performed including
out-of-sample forecasting based on a semiparametric factor model and uniform
confidence bands' study. It provides new insights into the latent dynamics of
the implied volatility surface. We also incorporate Heston stochastic
volatility into the moneyness scaling method for better tractability of the
model.
","[{""version"":""v1"",""created"":""Mon, 21 Sep 2020 09:27:05 GMT""}]","2020-09-22"
"2009.09714","Antonios Nathanail","Antonios Nathanail, Ramandeep Gill, Oliver Porth, Christian M. Fromm,
  Luciano Rezzolla","3D magnetised jet break-out from neutron-star binary merger ejecta:
  afterglow emission from the jet and the ejecta","MNRAS accepted, updated version",,"10.1093/mnras/stab115",,"astro-ph.HE gr-qc","http://arxiv.org/licenses/nonexclusive-distrib/1.0/","  We perform three-dimensional (3D) general-relativistic magnetohydrodynamic
simulations to model the jet break-out from the ejecta expected to be produced
in a binary neutron-star merger. The structure of the relativistic outflow from
the 3D simulation confirms our previous results from 2D simulations, namely,
that a relativistic magnetized outflow breaking out from the merger ejecta
exhibits a hollow core of $\theta_{\rm core}\approx4^{\circ}$, an opening angle
of $\theta_{\rm jet}\gtrsim10^{\circ}$, and is accompanied by a wind of ejected
matter that will contribute to the kilonova emission. We also compute the
non-thermal afterglow emission of the relativistic outflow and fit it to the
panchromatic afterglow from GRB170817A, together with the superluminal motion
reported from VLBI observations. In this way, we deduce an observer angle of
$\theta_{\rm obs}= 35.7^{\circ
  \,\,+1.8}_{\phantom{\circ \,\,}-2.2}$. We further compute the afterglow
emission from the ejected matter and constrain the parameter space for a
scenario in which the matter responsible for the thermal kilonova emission will
also lead to a non-thermal emission yet to be observed.
","[{""version"":""v1"",""created"":""Mon, 21 Sep 2020 09:31:29 GMT""},{""version"":""v2"",""created"":""Fri, 29 Jan 2021 08:35:03 GMT""}]","2021-02-01"
"2009.09715","Lingchao Guo","Lingchao Guo, Zhaoming Lu, Shuang Zhou, Xiangming Wen, Zhihong He","When Healthcare Meets Off-the-Shelf WiFi: A Non-Wearable and Low-Costs
  Approach for In-Home Monitoring","41 pages, 14 figures",,,,"eess.SP cs.CV cs.LG","http://arxiv.org/licenses/nonexclusive-distrib/1.0/","  As elderly population grows, social and health care begin to face validation
challenges, in-home monitoring is becoming a focus for professionals in the
field. Governments urgently need to improve the quality of healthcare services
at lower costs while ensuring the comfort and independence of the elderly. This
work presents an in-home monitoring approach based on off-the-shelf WiFi, which
is low-costs, non-wearable and makes all-round daily healthcare information
available to caregivers. The proposed approach can capture fine-grained human
pose figures even through a wall and track detailed respiration status
simultaneously by off-the-shelf WiFi devices. Based on them, behavioral data,
physiological data and the derived information (e.g., abnormal events and
underlying diseases), of the elderly could be seen by caregivers directly. We
design a series of signal processing methods and a neural network to capture
human pose figures and extract respiration status curves from WiFi Channel
State Information (CSI). Extensive experiments are conducted and according to
the results, off-the-shelf WiFi devices are capable of capturing fine-grained
human pose figures, similar to cameras, even through a wall and track accurate
respiration status, thus demonstrating the effectiveness and feasibility of our
approach for in-home monitoring.
","[{""version"":""v1"",""created"":""Mon, 21 Sep 2020 09:35:13 GMT""}]","2020-09-22"
