"2009.09847","Yongchao Huang Dr.","Yongchao Huang, Hugh Miles, Pengfei Zhang","A Sequential Modelling Approach for Indoor Temperature Prediction and
  Heating Control in Smart Buildings",,,,,"eess.SP cs.AI cs.SY eess.SY","http://arxiv.org/licenses/nonexclusive-distrib/1.0/","  The rising availability of large volume data, along with increasing computing
power, has enabled a wide application of statistical Machine Learning (ML)
algorithms in the domains of Cyber-Physical Systems (CPS), Internet of Things
(IoT) and Smart Building Networks (SBN). This paper proposes a learning-based
framework for sequentially applying the data-driven statistical methods to
predict indoor temperature and yields an algorithm for controlling building
heating system accordingly. This framework consists of a two-stage modelling
effort: in the first stage, an univariate time series model (AR) was employed
to predict ambient conditions; together with other control variables, they
served as the input features for a second stage modelling where an multivariate
ML model (XGBoost) was deployed. The models were trained with real world data
from building sensor network measurements, and used to predict future
temperature trajectories. Experimental results demonstrate the effectiveness of
the modelling approach and control algorithm, and reveal the promising
potential of the mixed data-driven approach in smart building applications. By
making wise use of IoT sensory data and ML algorithms, this work contributes to
efficient energy management and sustainability in smart buildings.
","[{""version"":""v1"",""created"":""Mon, 21 Sep 2020 13:20:27 GMT""},{""version"":""v2"",""created"":""Thu, 26 Nov 2020 18:43:39 GMT""}]","2020-11-30"
"2009.09850","Benjamin Goddard","Mildred Aduamoah, Benjamin D. Goddard, John W. Pearson, Jonna C. Roden","PDE-Constrained Optimization Models and Pseudospectral Methods for
  Multiscale Particle Dynamics",,,,,"math.NA cs.NA","http://arxiv.org/licenses/nonexclusive-distrib/1.0/","  We derive novel algorithms for optimization problems constrained by partial
differential equations describing multiscale particle dynamics, including
non-local integral terms representing interactions between particles. In
particular, we investigate problems where the control acts as an advection
'flow' vector or a source term of the partial differential equation, and the
constraint is equipped with boundary conditions of Dirichlet or no-flux type.
After deriving continuous first-order optimality conditions for such problems,
we solve the resulting systems by developing a link with computational methods
for statistical mechanics, deriving pseudospectral methods in both space and
time variables, and utilizing variants of existing fixed point methods.
Numerical experiments indicate the effectiveness of our approach for a range of
problem set-ups, boundary conditions, as well as regularization and model
parameters.
","[{""version"":""v1"",""created"":""Mon, 21 Sep 2020 13:24:36 GMT""},{""version"":""v2"",""created"":""Wed, 8 Sep 2021 09:44:19 GMT""}]","2021-09-09"
"2009.09851","Cesim K. Dumlu","Cesim K. Dumlu","Stokes phenomenon and Hawking Radiation","21 pages, 5 figures Published in PRD",,"10.1103/PhysRevD.102.125006",,"hep-th","http://arxiv.org/licenses/nonexclusive-distrib/1.0/","  We compute the semiclassical decay rate for Kerr black hole by deriving a
one-way connection formula, relating the near horizon solution to the outgoing
solution at infinity. In particular, we discuss the relevance of the Stokes
phenomenon and show how it leads to a Boltzmann-like thermal weight factor by
making use of the Stokes diagrams. We also give the exact result for the
semiclassical greybody factor $e^{-2S}, $ where $S$ is the leading order WKB
action. We contrast our results with Maldacena and Strominger's work [Phys.
Rev. D 56, 4975 (1997)], where the emission spectrum for a rotating black hole
was computed locally via asymptotic matching. We find that the relative error
of semiclassical decay rate with respect to asymptotic matching formula
diminishes in the limit of large angular momentum, $l$, as expected. In this
limit, the action assumes a compact form: $2S \sim (2 l+1) (\text{Log} \left(
\frac{16 }{z_0}\right)-1)$, where $z_0$ is the cross ratio formed by the
critical points (zeroes) of the scattering potential.
","[{""version"":""v1"",""created"":""Mon, 21 Sep 2020 13:25:22 GMT""},{""version"":""v2"",""created"":""Mon, 25 Jan 2021 06:54:03 GMT""}]","2021-01-26"
"2009.09852","Karl-Ludwig Besser","Eduard A. Jorswieck, Karl-Ludwig Besser","Copula-Based Bounds for Multi-User Communications -- Part I: Average
  Performance","5 pages, 2 figures","IEEE Communications Letters, vol. 25, no. 1, pp. 3-7, Jan. 2021","10.1109/LCOMM.2020.3023056",,"cs.IT math.IT","http://arxiv.org/licenses/nonexclusive-distrib/1.0/","  Statistically independent or positively correlated fading models are usually
applied to compute the average performance of wireless communications. However,
there exist scenarios with negative dependency and it is therefore of interest
how different performance metrics behave for different general dependency
structures of the channels. Especially best-case and worst-case bounds are
practically relevant as a system design guideline. In this two-part letter, we
present methods and tools from dependency modeling which can be applied to
analyze and design multi-user communications systems exploiting and creating
dependencies of the effective fading channels. The first part focuses on fast
fading with average performance metrics, while the second part considers slow
fading with outage performance metrics.
","[{""version"":""v1"",""created"":""Mon, 21 Sep 2020 13:30:09 GMT""}]","2021-01-12"
"2009.09853","Matthew Crabb","Matthew Crabb, Nail Akhmediev","Two-breather solutions for the class I infinitely extended nonlinear
  Schrodinger equation and their special cases","10 pages, 10 figures. Published in Nonlinear Dynamics","Nonlinear Dynamics 98, 1(2019) 245-255","10.1007/s11071-019-05186-0",,"nlin.SI nlin.PS","http://arxiv.org/licenses/nonexclusive-distrib/1.0/","  We derive the two-breather solution of the class I infinitely extended
nonlinear Schrodinger equation (NLSE). We present a general form of this
multi-parameter solution that includes infinitely many free parameters of the
equation and free parameters of the two breather components. Particular cases
of this solution include rogue wave triplets, and special cases of
breather-to-soliton and rogue wave-to-soliton transformations. The presence of
many parameters in the solution allows one to describe wave propagation
problems with higher accuracy than with the use of the basic NLSE.
","[{""version"":""v1"",""created"":""Mon, 21 Sep 2020 13:30:36 GMT""}]","2020-09-22"
"2009.09854","Peter H. van der Kamp","Peter H. van der Kamp","New Class of Integrable Maps of the Plane: Manin Transformations with
  Involution Curves",,"SIGMA 17 (2021), 067, 14 pages","10.3842/SIGMA.2021.067",,"nlin.SI math.AG","http://creativecommons.org/licenses/by-sa/4.0/","  For cubic pencils we define the notion of an involution curve. This is a
curve which intersects each curve of the pencil in exactly one non-base point
of the pencil. Involution curves can be used to construct integrable maps of
the plane which leave invariant a cubic pencil.
","[{""version"":""v1"",""created"":""Mon, 21 Sep 2020 13:32:23 GMT""},{""version"":""v2"",""created"":""Fri, 15 Jan 2021 00:00:00 GMT""},{""version"":""v3"",""created"":""Tue, 13 Jul 2021 05:37:42 GMT""}]","2021-07-14"
"2009.09856","Peter Neu","Peter S. Neu (1), Dani\""el Geelen (1), Aniket Thete (1), Rudolf M.
  Tromp (1 and 2), Sense Jan van der Molen (1) ((1) Leiden Institute of
  Physics, (2) IBM T.J. Watson Research Center)","Complementary LEEM and eV-TEM for imaging and spectroscopy",,,,,"cond-mat.mtrl-sci","http://arxiv.org/licenses/nonexclusive-distrib/1.0/","  Transmission electron microscopy at very low energy is a promising way to
avoid damaging delicate biological samples with the incident electrons, a known
problem in conventional transmission electron microscopy. For imaging in the
0-30 eV range, we added a second electron source to a low energy electron
microscopy (LEEM) setup, enabling imaging in both transmission and reflection
mode at nanometer (nm) resolution. The latter is experimentally demonstrated
for free-standing graphene. Exemplary eV-TEM micrographs of gold nanoparticles
suspended on graphene and of DNA origami rectangles on graphene oxide further
establish the capabilities of the technique. The long and short axes of the DNA
origami rectangles are discernable even after an hour of illumination with low
energy electrons. In combination with recent developments in 2D membranes,
allowing for versatile sample preparation, eV-TEM is paving the way to
damage-free imaging of biological samples at nm resolution.
","[{""version"":""v1"",""created"":""Mon, 21 Sep 2020 13:33:13 GMT""}]","2020-09-22"
"2009.09861","Attila Szolnoki","A. Szolnoki, B.F. de Oliveira, D. Bazeia","Pattern formations driven by cyclic interactions: a brief review of
  recent developments","7 two-column pages, 3 figures, Perspective article for EPL","EPL, 131 (2020) 68001","10.1209/0295-5075/131/68001",,"physics.soc-ph cond-mat.stat-mech nlin.PS q-bio.PE","http://arxiv.org/licenses/nonexclusive-distrib/1.0/","  Lotka's seminal work (A.J. Lotka A., Proc. Natl. Acad. Sci. U.S.A. 6 (1920)
410) ""on certain rhythmic relations'' is already one hundred years old, but the
research activity about pattern formations due to cyclical dominance is more
vibrant than ever. It is because non-transitive interactions have paramount
role on maintaining biodiversity and adequate human intervention into
ecological systems requires deeper understanding of related dynamical
processes. In this perspective article we overview different aspects of
biodiversity, with focus on how it can be maintained based on mathematical
modeling of last years. We also briefly discuss the potential links to
evolutionary game models of social systems, and finally, give an overview about
potential prospects for future research.
","[{""version"":""v1"",""created"":""Mon, 21 Sep 2020 13:36:02 GMT""}]","2020-10-15"
"2009.09865","Christian Klein","C Klein, N. Stoilov","Multidomain spectral approach with Sommerfeld condition for the Maxwell
  equations","Examples added",,"10.1016/j.jcp.2021.110149",,"math.NA cs.NA","http://arxiv.org/licenses/nonexclusive-distrib/1.0/","  We present a multidomain spectral approach with an exterior compactified
domain for the Maxwell equations for monochromatic fields. The Sommerfeld
radiation condition is imposed exactly at infinity being a finite point on the
numerical grid. As an example, axisymmetric situations in spherical and prolate
spheroidal coordinates are discussed.
","[{""version"":""v1"",""created"":""Mon, 21 Sep 2020 13:37:38 GMT""},{""version"":""v2"",""created"":""Tue, 19 Jan 2021 15:18:46 GMT""}]","2021-04-07"
"2009.09866","Nicolas Wittler","Nicolas Wittler, Federico Roy, Kevin Pack, Max Werninghaus, Anurag
  Saha Roy, Daniel J. Egger, Stefan Filipp, Frank K. Wilhelm, Shai Machnes","Integrated tool-set for Control, Calibration and Characterization of
  quantum devices applied to superconducting qubits","Source code available at http://q-optimize.org; added references;
  updated with journal version; updated references","Phys. Rev. Applied 15, 034080 (2021)","10.1103/PhysRevApplied.15.034080",,"quant-ph","http://creativecommons.org/licenses/by/4.0/","  Efforts to scale-up quantum computation have reached a point where the
principal limiting factor is not the number of qubits, but the entangling gate
infidelity. However, the highly detailed system characterization required to
understand the underlying error sources is an arduous process and impractical
with increasing chip size. Open-loop optimal control techniques allow for the
improvement of gates but are limited by the models they are based on. To
rectify the situation, we provide an integrated open-source tool-set for
Control, Calibration and Characterization, capable of open-loop pulse
optimization, model-free calibration, model fitting and refinement. We present
a methodology to combine these tools to find a quantitatively accurate system
model, high-fidelity gates and an approximate error budget, all based on a
high-performance, feature-rich simulator. We illustrate our methods using
simulated fixed-frequency superconducting qubits for which we learn model
parameters with less than 1% error and derive a coherence limited
cross-resonance (CR) gate that achieves 99.6% fidelity without need for
calibration.
","[{""version"":""v1"",""created"":""Mon, 21 Sep 2020 13:38:45 GMT""},{""version"":""v2"",""created"":""Wed, 7 Oct 2020 10:04:23 GMT""},{""version"":""v3"",""created"":""Tue, 27 Apr 2021 14:05:00 GMT""},{""version"":""v4"",""created"":""Fri, 2 Dec 2022 10:56:11 GMT""}]","2022-12-05"
"2009.09867","Maxim Perelstein","Maxim Perelstein, Yik Chuen San","Dark Matter as a Solution to Muonic Puzzles","7 pages, 7 figures. Version 2: updated constraints, new benchmark
  point, conclusions unchanged","Phys. Rev. D 103, 035032 (2021)","10.1103/PhysRevD.103.035032",,"hep-ph","http://arxiv.org/licenses/nonexclusive-distrib/1.0/","  We propose a simple model in which dark matter particle exchanges mediate a
new quantum force between muons and nucleons, resolving the proton charge
radius puzzle. At the same time, the discrepancy between the measured anomalous
magnetic moment of the muon and the Standard Model prediction can be
accommodated, and thermal relic abundance of the dark matter candidate is
consistent with observations. The dark matter particle mass is in the MeV
range. We show that the model is consistent with a variety of experimental and
observational constraints.
","[{""version"":""v1"",""created"":""Mon, 21 Sep 2020 13:39:19 GMT""},{""version"":""v2"",""created"":""Mon, 16 Nov 2020 14:28:47 GMT""}]","2021-03-03"
"2009.09868","Qu\^oc Anh Ng\^o","Qu\^oc Anh Ng\^o, Quoc-Hung Nguyen, Van Hoang Nguyen","An optimal Hardy-Littlewood-Sobolev inequality on $\mathbf R^{n-k}
  \times \mathbf R^n$ and its consequences","26 pages, 0 figure",,,,"math.FA math.AP math.CA","http://arxiv.org/licenses/nonexclusive-distrib/1.0/","  For $n > k \geq 0$, $\lambda >0$, and $p, r>1$, we establish the following
optimal Hardy-Littlewood-Sobolev inequality \[ \Big| \iint_{\mathbf R^n \times
\mathbf R^{n-k}} \frac{f(x) g(y)}{ |x-y|^\lambda |y''|^\beta} dx dy \Big|
\lesssim \| f \| _{L^p(\mathbf R^{n-k})} \| g\| _{L^r(\mathbf R^n)} \] with $y
= (y', y'') \in \mathbf R^{n-k} \times \mathbf R^k$ under the two conditions \[
\beta < \left\{ \begin{aligned} & k - k/r & & \text{if } \; 0 < \lambda \leq
n-k,\\ & n - \lambda - k/r & & \text{if } \; n-k < \lambda, \end{aligned}
\right. \] and \[ \frac{n-k}n \frac 1p + \frac 1r + \frac { \beta + \lambda} n
= 2 -\frac kn. \] Remarkably, there is no upper bound for $\lambda$, which is
quite different from the case with the weight $|y|^{-\beta}$, commonly known as
Stein-Weiss inequalities. We also show that the above condition for $\beta$ is
sharp. Apparently, the above inequality includes the classical
Hardy-Littlewood-Sobolev inequality when $k=0$ and the HLS inequality on the
upper half space $\mathbf R_+^n$ when $k=1$. In the unweighted case, namely
$\beta=0$, our finding immediately leads to the sharp HLS inequality on
$\mathbf R^{n-k} \times \mathbf R^n$ with the \textit{optimal} range
$$0<\lambda<n-k/r,$$ which has not been observed before, even for the case
$k=1$. Improvement to the Stein-Weiss inequality in the context of $\mathbf
R^{n-k} \times \mathbf R^n$ is also considered. The existence of an optimal
pair for this new inequality is also studied.
","[{""version"":""v1"",""created"":""Mon, 21 Sep 2020 13:39:44 GMT""}]","2020-09-22"
"2009.09869","Run Wang","Run Wang, Felix Juefei-Xu, Meng Luo, Yang Liu, Lina Wang","FakeTagger: Robust Safeguards against DeepFake Dissemination via
  Provenance Tracking","Accepted to ACM Multimedia 2021",,,,"cs.CR","http://arxiv.org/licenses/nonexclusive-distrib/1.0/","  In recent years, DeepFake is becoming a common threat to our society, due to
the remarkable progress of generative adversarial networks (GAN) in image
synthesis. Unfortunately, existing studies that propose various approaches, in
fighting against DeepFake and determining if the facial image is real or fake,
is still at an early stage. Obviously, the current DeepFake detection method
struggles to catch the rapid progress of GANs, especially in the adversarial
scenarios where attackers can evade the detection intentionally, such as adding
perturbations to fool the DNN-based detectors. While passive detection simply
tells whether the image is fake or real, DeepFake provenance, on the other
hand, provides clues for tracking the sources in DeepFake forensics. Thus, the
tracked fake images could be blocked immediately by administrators and avoid
further spread in social networks.
  In this paper, we investigate the potentials of image tagging in serving the
DeepFake provenance tracking. Specifically, we devise a deep learning-based
approach, named FakeTagger, with a simple yet effective encoder and decoder
design along with channel coding to embed message to the facial image, which is
to recover the embedded message after various drastic GAN-based DeepFake
transformation with high confidence. The embedded message could be employed to
represent the identity of facial images, which further contributed to DeepFake
detection and provenance. Experimental results demonstrate that our proposed
approach could recover the embedded message with an average accuracy of more
than 95% over the four common types of DeepFakes. Our research finding confirms
effective privacy-preserving techniques for protecting personal photos from
being DeepFaked.
","[{""version"":""v1"",""created"":""Mon, 21 Sep 2020 13:41:24 GMT""},{""version"":""v2"",""created"":""Sun, 11 Jul 2021 12:13:29 GMT""},{""version"":""v3"",""created"":""Sun, 26 Sep 2021 11:45:47 GMT""}]","2021-09-28"
"2009.09870","Seraphina Goldfarb-Tarrant","Seraphina Goldfarb-Tarrant, Tuhin Chakrabarty, Ralph Weischedel,
  Nanyun Peng","Content Planning for Neural Story Generation with Aristotelian Rescoring","EMNLP 2020, 9 pages",,,,"cs.CL cs.AI","http://creativecommons.org/licenses/by/4.0/","  Long-form narrative text generated from large language models manages a
fluent impersonation of human writing, but only at the local sentence level,
and lacks structure or global cohesion. We posit that many of the problems of
story generation can be addressed via high-quality content planning, and
present a system that focuses on how to learn good plot structures to guide
story generation. We utilize a plot-generation language model along with an
ensemble of rescoring models that each implement an aspect of good
story-writing as detailed in Aristotle's Poetics. We find that stories written
with our more principled plot-structure are both more relevant to a given
prompt and higher quality than baselines that do not content plan, or that plan
in an unprincipled way.
","[{""version"":""v1"",""created"":""Mon, 21 Sep 2020 13:41:32 GMT""},{""version"":""v2"",""created"":""Fri, 9 Oct 2020 16:28:23 GMT""}]","2020-10-12"
"2009.09871","Ling Zhou","Chengsong Zhao (1), Xun Li (1and 2), Shilei Chao (1), Rui Peng (1),
  Chong Li (1), and Ling Zhou (1) ((1) School of Physics, Dalian University of
  Technology, Dalian, China, (2) National Key Laboratory of Shock Wave and
  Detonation Physics, Institute of Fluid Physics, China Academy of Engineering
  Physics, Mianyang, China)","Simultaneous blockade of a photon phonon, and magnon induced by a
  two-level atom","10 pages, 7 figures","Physical Review A 101, 063838 (2020)","10.1103/PhysRevA.101.063838",,"quant-ph","http://arxiv.org/licenses/nonexclusive-distrib/1.0/","  The hybrid microwave optomechanical-magnetic system has recently emerged as a
promising candidate for coherent information processing because of the
ultrastrong microwave photon-magnon coupling and the longlife of the magnon and
phonon. As a quantum information processing device, the realization of a single
excitation holds special meaning for the hybrid system. In this paper, we
introduce a single two-level atom into the optomechanical-magnetic system and
show that an unconventional blockade due to destructive interference cannot
offer a blockade of both the photon and magnon. Meanwhile, under the condition
of single excitation resonance, the blockade of the photon, phonon, and magnon
can be achieved simultaneously even in a weak optomechanical region, but the
phonon blockade still requires the cryogenic temperature condition.
","[{""version"":""v1"",""created"":""Mon, 21 Sep 2020 13:42:32 GMT""}]","2020-09-22"
"2009.09872","Radu Cimpeanu","Michael J. Negus, Matthew R. Moore, James M. Oliver, Radu Cimpeanu","Droplet impact onto a spring-supported plate: analysis and simulations","28 pages, 6 figures","Journal of Engineering Mathematics 128 (3), 2021","10.1007/s10665-021-10107-5",,"physics.flu-dyn math.AP","http://arxiv.org/licenses/nonexclusive-distrib/1.0/","  The high-speed impact of a droplet onto a flexible substrate is a highly
nonlinear process of practical importance which poses formidable modelling
challenges in the context of fluid-structure interaction. We present two
approaches aimed at investigating the canonical system of a droplet impacting
onto a rigid plate supported by a spring and a dashpot: matched asymptotic
expansions and direct numerical simulation (DNS). In the former, we derive a
generalisation of inviscid Wagner theory to approximate the flow behaviour
during the early stages of the impact. In the latter, we perform detailed DNS
designed to validate the analytical framework, as well as provide insight into
later times beyond the reach of the proposed mathematical model. Drawing from
both methods, we observe the strong influence that the mass of the plate,
resistance of the dashpot and stiffness of the spring have on the motion of the
solid, which undergoes forced damped oscillations. Furthermore, we examine how
the plate motion affects the dynamics of the droplet, predominantly through
altering its internal hydrodynamic pressure distribution. We build on the
interplay between these techniques, demonstrating that a hybrid approach leads
to improved model and computational development, as well as result
interpretation, across multiple length- and time-scales.
","[{""version"":""v1"",""created"":""Mon, 21 Sep 2020 13:44:19 GMT""}]","2021-05-17"
"2009.09873","Margarida Cunha S.","Margarida S. Cunha, Pedro P. Avelino, William J. Chaplin","From Solar-like to Mira stars: a unifying description of stellar
  pulsators in the presence of stochastic noise","11 pages, 8 figures, accepted for publication in MNRAS",,"10.1093/mnras/staa2932",,"astro-ph.SR astro-ph.GA","http://arxiv.org/licenses/nonexclusive-distrib/1.0/","  We discuss and characterise the power spectral density properties of a model
aimed at describing pulsations in stars from the main-sequence to the
asymptotic giant branch. We show that the predicted limit of the power spectral
density for a pulsation mode in the presence of stochastic noise is always well
approximated by a Lorentzian function. While in stars predominantly
stochastically driven the width of the Lorentzian is defined by the mode
lifetime, in stars where the driving is predominately coherent the width is
defined by the amplitude of the stochastic perturbations. In stars where both
drivings are comparable, the width is defined by both these parameters and is
smaller than that expected from pure stochastic driving. We illustrate our
model through numerical simulations and propose a well defined classification
of stars into predominantly stochastic (solar-like) and predominately coherent
(classic) pulsators. We apply the model to the study of the Mira variable U
Per, and the semiregular variable L2 Pup and, following our classification,
conclude that they are both classical pulsators. Our model provides a natural
explanation for the change in behaviour of the pulsation amplitude-period
relation noted in several earlier works. Moreover, our study of L2 Pup enables
us to test the scaling relation between the mode line width and effective
temperature, confirming that an exponential scaling reproduces well the data
all the way from the main sequence to the asymptotic giant branch, down to
temperatures about 1000 K below what has been tested in previous studies.
","[{""version"":""v1"",""created"":""Mon, 21 Sep 2020 13:47:41 GMT""}]","2020-09-30"
"2009.09874","Ezechiel Kahn","Ezechiel Kahn","Wishart processes : mean-field limit, long time behavior, and free
  probability",,,,,"math.PR","http://arxiv.org/licenses/nonexclusive-distrib/1.0/","  This paper is devoted to the study of the eigenvalues of the Wishart process
which are the analogof the Dyson Brownian Motion for covariance matrices. Such
processes were in particular studied byBru. The mean field convergence of the
empirical measure of these eigenvalues was proved Malecki andPerez. In this
paper, we provide a new approach to the mean field convergence problem using
toolsfrom the free rectangular convolution theory developed by Benaych-Georges,
which in particular allowsto compute explicitly the limit measure valued flow.
We highlight the link with the integro-differentialequation related to the mean
field limit and its translation into a complex Burgers partial
differentialequation.
","[{""version"":""v1"",""created"":""Mon, 21 Sep 2020 13:47:54 GMT""},{""version"":""v2"",""created"":""Mon, 10 May 2021 08:01:56 GMT""}]","2021-05-11"
