"2009.09082","Barbora Kozlikova","Krist\'ina Z\'akop\v{c}anov\'a, Marko \v{R}eh\'a\v{c}ek, Jozef
  B\'atrna, Daniel Plakinger, Sergej Stoppel, Barbora Kozl\'ikov\'a","Visilant: Visual Support for the Exploration and Analytical Process
  Tracking in Criminal Investigations","Accepted for the IEEE VIS 2020 conference",,,,"cs.CY","http://arxiv.org/licenses/nonexclusive-distrib/1.0/","  The daily routine of criminal investigators consists of a thorough analysis
of highly complex and heterogeneous data of crime cases. Such data can consist
of case descriptions, testimonies, criminal networks, spatial and temporal
information, and virtually any other data that is relevant for the case.
Criminal investigators work under heavy time pressure to analyze the data for
relationships, propose and verify several hypotheses, and derive conclusions,
while the data can be incomplete or inconsistent and is changed and updated
throughout the investigation, as new findings are added to the case. Based on a
four-year intense collaboration with criminalists, we present a conceptual
design for a visual tool supporting the investigation workflow and Visilant, a
web-based tool for the exploration and analysis of criminal data guided by the
proposed design. Visilant aims to support namely the exploratory part of the
investigation pipeline, from case overview, through exploration and hypothesis
generation, to the case presentation. Visilant tracks the reasoning process and
as the data is changing, it informs investigators which hypotheses are affected
by the data change and should be revised. The tool was evaluated by senior
criminology experts within two sessions and their feedback is summarized in the
paper. Additional supplementary material contains the technical details and
exemplary case study.
","[{""version"":""v1"",""created"":""Mon, 21 Sep 2020 09:24:20 GMT""}]","2020-09-22"
"2009.09462","Ke Zhu","Ke Zhu and Hanzhong Liu","Confidence intervals for parameters in high-dimensional sparse vector
  autoregression",,,,,"stat.ME","http://arxiv.org/licenses/nonexclusive-distrib/1.0/","  Vector autoregression (VAR) models are widely used to analyze the
interrelationship between multiple variables over time. Estimation and
inference for the transition matrices of VAR models are crucial for
practitioners to make decisions in fields such as economics and finance.
However, when the number of variables is larger than the sample size, it
remains a challenge to perform statistical inference of the model parameters.
In this article, we propose the de-biased Lasso and two bootstrap de-biased
Lasso methods to construct confidence intervals for the elements of the
transition matrices of high-dimensional VAR models. We show that the proposed
methods are asymptotically valid under appropriate sparsity and other
regularity conditions. To implement our methods, we develop feasible and
parallelizable algorithms, which save a large amount of computation required by
the nodewise Lasso and bootstrap. A simulation study illustrates that our
methods perform well in finite samples. Finally, we apply our methods to
analyze the price data of stocks in the S&P 500 index in 2019. We find that
some stocks, such as the largest producer of gold in the world, Newmont
Corporation, have significant predictive power over the most stocks.
","[{""version"":""v1"",""created"":""Sun, 20 Sep 2020 16:05:08 GMT""}]","2020-09-22"
"2009.09463","Yue Zhao","Zheng Li, Yue Zhao, Nicola Botta, Cezar Ionescu, Xiyang Hu","COPOD: Copula-Based Outlier Detection","Proceedings of the 2020 International Conference on Data Mining
  (ICDM)","2020 IEEE International Conference on Data Mining (ICDM)","10.1109/ICDM50108.2020.00135",,"stat.ML cs.IR cs.LG","http://arxiv.org/licenses/nonexclusive-distrib/1.0/","  Outlier detection refers to the identification of rare items that are deviant
from the general data distribution. Existing approaches suffer from high
computational complexity, low predictive capability, and limited
interpretability. As a remedy, we present a novel outlier detection algorithm
called COPOD, which is inspired by copulas for modeling multivariate data
distribution. COPOD first constructs an empirical copula, and then uses it to
predict tail probabilities of each given data point to determine its level of
""extremeness"". Intuitively, we think of this as calculating an anomalous
p-value. This makes COPOD both parameter-free, highly interpretable, and
computationally efficient. In this work, we make three key contributions, 1)
propose a novel, parameter-free outlier detection algorithm with both great
performance and interpretability, 2) perform extensive experiments on 30
benchmark datasets to show that COPOD outperforms in most cases and is also one
of the fastest algorithms, and 3) release an easy-to-use Python implementation
for reproducibility.
","[{""version"":""v1"",""created"":""Sun, 20 Sep 2020 16:06:39 GMT""}]","2022-01-04"
"2009.09464","Xiangying Huang","Xiangying Huang and Rick Durrett","A stochastic spatial model for the sterile insect control strategy",,,,,"math.PR","http://arxiv.org/licenses/nonexclusive-distrib/1.0/","  In the system we study, 1's and 0's represent occupied and vacant sites in
the contact process with births at rate $\lambda$ and deaths at rate 1. $-1$'s
are sterile individuals that do not reproduce but appear spontaneously on
vacant sites at rate $\alpha$ and die at rate $\theta\alpha$. We show that the
system (which is attractive but has no dual) dies out at the critical value and
has a nontrivial stationary distribution when it is supercritical. Our most
interesting results concern the asymptotics when $\alpha\to 0$. In this regime
the process resembles the contact process in a random environment.
","[{""version"":""v1"",""created"":""Sun, 20 Sep 2020 16:10:14 GMT""},{""version"":""v2"",""created"":""Thu, 12 Aug 2021 03:37:28 GMT""}]","2021-08-13"
"2009.09465","Junfu Chen","Junfu Chen, Yue Pan, Yang Chen","Remote sensing image fusion based on Bayesian GAN",,,,,"cs.CV","http://arxiv.org/licenses/nonexclusive-distrib/1.0/","  Remote sensing image fusion technology (pan-sharpening) is an important means
to improve the information capacity of remote sensing images. Inspired by the
efficient arameter space posteriori sampling of Bayesian neural networks, in
this paper we propose a Bayesian Generative Adversarial Network based on
Preconditioned Stochastic Gradient Langevin Dynamics (PGSLD-BGAN) to improve
pan-sharpening tasks. Unlike many traditional generative models that consider
only one optimal solution (might be locally optimal), the proposed PGSLD-BGAN
performs Bayesian inference on the network parameters, and explore the
generator posteriori distribution, which assists selecting the appropriate
generator parameters. First, we build a two-stream generator network with PAN
and MS images as input, which consists of three parts: feature extraction,
feature fusion and image reconstruction. Then, we leverage Markov discriminator
to enhance the ability of generator to reconstruct the fusion image, so that
the result image can retain more details. Finally, introducing Preconditioned
Stochastic Gradient Langevin Dynamics policy, we perform Bayesian inference on
the generator network. Experiments on QuickBird and WorldView datasets show
that the model proposed in this paper can effectively fuse PAN and MS images,
and be competitive with even superior to state of the arts in terms of
subjective and objective metrics.
","[{""version"":""v1"",""created"":""Sun, 20 Sep 2020 16:15:51 GMT""}]","2020-09-22"
"2009.09466","Christian Voigt","Mike Brannan, Kari Eifler, Christian Voigt, Moritz Weber","Quantum Cuntz-Krieger algebras","40 pages",,,,"math.OA math.QA","http://arxiv.org/licenses/nonexclusive-distrib/1.0/","  Motivated by the theory of Cuntz-Krieger algebras we define and study $
C^\ast $-algebras associated to directed quantum graphs. For classical graphs
the $ C^\ast $-algebras obtained this way can be viewed as free analogues of
Cuntz-Krieger algebras, and need not be nuclear.
  We study two particular classes of quantum graphs in detail, namely the
trivial and the complete quantum graphs. For the trivial quantum graph on a
single matrix block, we show that the associated quantum Cuntz-Krieger algebra
is neither unital, nuclear nor simple, and does not depend on the size of the
matrix block up to $ KK $-equivalence. In the case of the complete quantum
graphs we use quantum symmetries to show that, in certain cases, the
corresponding quantum Cuntz-Krieger algebras are isomorphic to Cuntz algebras.
These isomorphisms, which seem far from obvious from the definitions, imply in
particular that these $ C^\ast $-algebras are all pairwise non-isomorphic for
complete quantum graphs of different dimensions, even on the level of $ KK
$-theory. We explain how the notion of unitary error basis from quantum
information theory can help to elucidate the situation.
  We also discuss quantum symmetries of quantum Cuntz-Krieger algebras in
general.
","[{""version"":""v1"",""created"":""Sun, 20 Sep 2020 16:19:18 GMT""}]","2020-09-22"
"2009.09467","Rohit Jena","Rohit Jena, Siddharth Agrawal, Katia Sycara","Addressing reward bias in Adversarial Imitation Learning with neutral
  reward functions",,,,,"cs.LG cs.RO stat.ML","http://arxiv.org/licenses/nonexclusive-distrib/1.0/","  Generative Adversarial Imitation Learning suffers from the fundamental
problem of reward bias stemming from the choice of reward functions used in the
algorithm. Different types of biases also affect different types of
environments - which are broadly divided into survival and task-based
environments. We provide a theoretical sketch of why existing reward functions
would fail in imitation learning scenarios in task based environments with
multiple terminal states. We also propose a new reward function for GAIL which
outperforms existing GAIL methods on task based environments with single and
multiple terminal states and effectively overcomes both survival and
termination bias.
","[{""version"":""v1"",""created"":""Sun, 20 Sep 2020 16:24:10 GMT""}]","2020-09-22"
"2009.09468","Mason Del Rosario","Zhenyu Liu, Mason del Rosario, and Zhi Ding","A Markovian Model-Driven Deep Learning Framework for Massive MIMO CSI
  Feedback","14 pages, 14 figures, 4 tables. Submitted to IEEE Transactions on
  Wireless Communications",,,,"eess.SP cs.IT cs.LG math.IT","http://arxiv.org/licenses/nonexclusive-distrib/1.0/","  Forward channel state information (CSI) often plays a vital role in
scheduling and capacity-approaching transmission optimization for massive
multiple-input multiple-output (MIMO) communication systems. In frequency
division duplex (FDD) massive MIMO systems, forwardlink CSI reconstruction at
the transmitter relies critically on CSI feedback from receiving nodes and must
carefully weigh the tradeoff between reconstruction accuracy and feedback
bandwidth. Recent studies on the use of recurrent neural networks (RNNs) have
demonstrated strong promises, though the cost of computation and memory remains
high, for massive MIMO deployment. In this work, we exploit channel coherence
in time to substantially improve the feedback efficiency. Using a Markovian
model, we develop a deep convolutional neural network (CNN)-based framework
MarkovNet to differentially encode forward CSI in time to effectively improve
reconstruction accuracy. Furthermore, we explore important physical insights,
including spherical normalization of input data and convolutional layers for
feedback compression. We demonstrate substantial performance improvement and
complexity reduction over the RNN-based work by our proposed MarkovNet to
recover forward CSI estimates accurately. We explore additional practical
consideration in feedback quantization, and show that MarkovNet outperforms
RNN-based CSI estimation networks at a fraction of the computational cost.
","[{""version"":""v1"",""created"":""Sun, 20 Sep 2020 16:26:12 GMT""}]","2020-09-22"
"2009.09469","Alexey V. Lebedev","Alexey V. Lebedev","Extremal Indices in the Series Scheme and their Applications",,,,,"math.PR math.ST stat.TH","http://arxiv.org/licenses/nonexclusive-distrib/1.0/","  We generalize the concept of extremal index of a stationary random sequence
to the series scheme of identically distributed random variables with random
series sizes tending to infinity in probability. We introduce new extremal
indices through two definitions generalizing the basic properties of the
classical extremal index. We prove some useful properties of the new extremal
indices. We show how the behavior of aggregate activity maxima on random graphs
(in information network models) and the behavior of maxima of random particle
scores in branching processes (in biological population models) can be
described in terms of the new extremal indices. We also obtain new results on
models with copulas and threshold models. We show that the new indices can take
different values for the same system, as well as values greater than one.
","[{""version"":""v1"",""created"":""Sun, 20 Sep 2020 16:28:43 GMT""}]","2020-09-22"
"2009.09470","Myeong Soo Kang","Chang Kyun Ha, Kee Hwan Nam, Myeong Soo Kang","Multimode optically adiabatic silica glass submicron taper","22 pages, 6 figures",,,,"physics.optics","http://arxiv.org/licenses/nonexclusive-distrib/1.0/","  Silica nanofibers fabricated by tapering optical fibers have attracted
considerable interest as an ultimate platform for high-efficiency light-matter
interactions. While previously demonstrated applications relied exclusively on
the low-loss transmission of only the fundamental mode, the implementation of
multimode tapers that adiabatically transmit several modes has remained very
challenging, hindering their use in various emerging applications in multimode
nonlinear optics and quantum optics. Here, we report the first realization of
multimode submicron tapers that permit the simultaneous adiabatic transmission
of multiple higher-order modes including the LP02 mode, through introducing
deep wet-etching of conventional fiber before fiber tapering. Furthermore, as a
critical application, we demonstrate 'fundamental-to-fundamental' all-fiber
third-harmonic generation with high conversion efficiencies. Our work paves the
way for ultrahigh-efficiency multimode nonlinear and quantum optics,
facilitating nonclassical light generation in the multimode regime, multimode
soliton interactions and photonic quantum gates, and manipulation of the
evanescent-field-induced optical trapping potentials of atoms and
nanoparticles.
","[{""version"":""v1"",""created"":""Sun, 20 Sep 2020 16:33:32 GMT""}]","2020-09-22"
"2009.09471","Yue Zhao","Zheng Li, Yue Zhao, Jialin Fu","SYNC: A Copula based Framework for Generating Synthetic Data from
  Aggregated Sources","Proceedings of the 2020 IEEE International Conference on Data Mining
  Workshops (ICDMW)",,,,"stat.AP cs.DB cs.LG stat.ML","http://arxiv.org/licenses/nonexclusive-distrib/1.0/","  A synthetic dataset is a data object that is generated programmatically, and
it may be valuable to creating a single dataset from multiple sources when
direct collection is difficult or costly. Although it is a fundamental step for
many data science tasks, an efficient and standard framework is absent. In this
paper, we study a specific synthetic data generation task called downscaling, a
procedure to infer high-resolution, harder-to-collect information (e.g.,
individual level records) from many low-resolution, easy-to-collect sources,
and propose a multi-stage framework called SYNC (Synthetic Data Generation via
Gaussian Copula). For given low-resolution datasets, the central idea of SYNC
is to fit Gaussian copula models to each of the low-resolution datasets in
order to correctly capture dependencies and marginal distributions, and then
sample from the fitted models to obtain the desired high-resolution subsets.
Predictive models are then used to merge sampled subsets into one, and finally,
sampled datasets are scaled according to low-resolution marginal constraints.
We make four key contributions in this work: 1) propose a novel framework for
generating individual level data from aggregated data sources by combining
state-of-the-art machine learning and statistical techniques, 2) perform
simulation studies to validate SYNC's performance as a synthetic data
generation algorithm, 3) demonstrate its value as a feature engineering tool,
as well as an alternative to data collection in situations where gathering is
difficult through two real-world datasets, 4) release an easy-to-use framework
implementation for reproducibility and scalability at the production level that
easily incorporates new data.
","[{""version"":""v1"",""created"":""Sun, 20 Sep 2020 16:36:25 GMT""}]","2020-09-22"
"2009.09472","Sadegh Bolouki","Seyed-Mohammad Razavi, Hamid-Reza Momeni, Mahmoud-Reza Haghifam,
  Sadegh Bolouki","Multi-Objective Optimization of Distribution Networks via Daily
  Reconfiguration",,,,,"eess.SY cs.SY math.DS math.OC","http://arxiv.org/licenses/nonexclusive-distrib/1.0/","  This paper presents a comprehensive approach to improve the daily performance
of an active distribution network (ADN), which includes renewable resources and
responsive load (RL), using distributed network reconfiguration (DNR).
Optimization objectives in this work can be described as (i) reducing active
losses, (ii) improving the voltage profile, (iii) improving the network
reliability, and (iv) minimizing distribution network operation costs. The
suggested approach takes into account the probability of renewable resource
failure, given the information collected from their initial state at the
beginning of every day, in solving the optimization problem. Furthermore, solar
radiation variations are estimated based on past historical data and the impact
of the performance of renewable sources such as photovoltaic (PV) is determined
hourly based on the Markov model. Since the number of reconfiguration scenarios
is very high, stochastic DNR (SDNR) based on the probability distance method is
employed to shrink the scenarios set. At the final stage, an improved crow
search algorithm (ICSA) is introduced to find the optimal scenario. The
effectiveness of the suggested method is verified for the IEEE 33-bus radial
distribution system as a case study.
","[{""version"":""v1"",""created"":""Sun, 20 Sep 2020 16:44:33 GMT""}]","2020-09-22"
"2009.09473","Robert J. Perry","William Detmold and Anthony V. Grebe and Issaku Kanamori and C.-J.
  David Lin and Santanu Mondal and Robert J. Perry and Yong Zhao","A Preliminary Determination of the Second Mellin Moment of the Pion's
  Distribution Amplitude Using the Heavy Quark Operator Product Expansion","9 pages, 8 figures. Contribution to the proceedings of the 2020
  Asia-Pacific Symposium on Lattice Field Theory (APLAT 2020). Several
  citations and additional affiliation added",,,"MIT-CTP/5236","hep-lat hep-ph","http://arxiv.org/licenses/nonexclusive-distrib/1.0/","  We explore the feasibility of determining Mellin moments of the pion's light
cone distribution amplitude using the heavy quark operator product expansion
(HOPE) method. As the first step of a proof of principle study we pursue a
determination of the second Mellin moment. We discuss our choice of kinematics
which allows us to successfully extract the moment at low pion momentum. We
describe the numerical simulation, and describe the data analysis, which leads
us to a preliminary determination of the second Mellin moment in the continuum
limit in the quenched approximation as $\langle\xi^2\rangle=0.19(7)$ in the
$\bar{\text{MS}}$ scheme at 2 GeV.
","[{""version"":""v1"",""created"":""Sun, 20 Sep 2020 16:50:25 GMT""},{""version"":""v2"",""created"":""Fri, 2 Oct 2020 05:53:44 GMT""}]","2020-10-05"
"2009.09474","Ehsan Doostmohammadi","Ehsan Doostmohammadi, Minoo Nassajian, Adel Rahimi","Persian Ezafe Recognition Using Transformers and Its Role in
  Part-Of-Speech Tagging",,,,,"cs.CL cs.LG","http://arxiv.org/licenses/nonexclusive-distrib/1.0/","  Ezafe is a grammatical particle in some Iranian languages that links two
words together. Regardless of the important information it conveys, it is
almost always not indicated in Persian script, resulting in mistakes in reading
complex sentences and errors in natural language processing tasks. In this
paper, we experiment with different machine learning methods to achieve
state-of-the-art results in the task of ezafe recognition. Transformer-based
methods, BERT and XLMRoBERTa, achieve the best results, the latter achieving
2.68% F1-score more than the previous state-of-the-art. We, moreover, use ezafe
information to improve Persian part-of-speech tagging results and show that
such information will not be useful to transformer-based methods and explain
why that might be the case.
","[{""version"":""v1"",""created"":""Sun, 20 Sep 2020 17:01:43 GMT""},{""version"":""v2"",""created"":""Sun, 4 Oct 2020 19:52:11 GMT""}]","2020-10-06"
"2009.09475","Ciro Ciliberto","Ciro Ciliberto","On the infinitesimal Terracini lemma","12 pages",,,,"math.AG","http://arxiv.org/licenses/nonexclusive-distrib/1.0/","  In this paper we prove an infinitesimal version of the classical Terracini
Lemma for 3--secant planes to a variety. Precisely we prove that if
  $X\subseteq \PP^r$ is an irreducible, non--degenerate, projective complex
variety of dimension $n$ with $r\geq 3n+2$, such that the variety of osculating
planes to curves in $X$ has the expected dimension $3n$ and for every
$0$--dimensional, curvilinear scheme $\gamma$ of length 3 contained in $X$ the
family of hyperplanes sections of $X$ which are singular along $\gamma$ has
dimension larger that $r-3(n+1)$, then $X$ is $2$--secant defective.
","[{""version"":""v1"",""created"":""Sun, 20 Sep 2020 17:09:51 GMT""}]","2020-09-22"
"2009.09476","Juan Ruiz-Alvarez","Sergio Amat, Juan Ruiz, Chi-Wang Shu, Dionisio F. Ya\~nez","Cell-average WENO with progressive order of accuracy close to
  discontinuities with applications to signal processing","23 pages, 4 figures",,,,"math.NA cs.NA","http://arxiv.org/licenses/nonexclusive-distrib/1.0/","  In this paper we translate to the cell-average setting the algorithm for the
point-value discretization presented in S. Amat, J. Ruiz, C.-W. Shu, D. F.
Y\'a\~nez, A new WENO-2r algorithm with progressive order of accuracy close to
discontinuities, submitted to SIAM J. Numer. Anal.. This new strategy tries to
improve the results of WENO-($2r-1$) algorithm close to the singularities,
resulting in an optimal order of accuracy at these zones. The main idea is to
modify the optimal weights so that they have a nonlinear expression that
depends on the position of the discontinuities. In this paper we study the
application of the new algorithm to signal processing using Harten's
multiresolution. Several numerical experiments are performed in order to
confirm the theoretical results obtained.
","[{""version"":""v1"",""created"":""Sun, 20 Sep 2020 17:11:20 GMT""}]","2020-09-22"
"2009.09477","Nesrine Cherif Mrs","Nesrine Cherif, Wael Jaafar, Halim Yanikomeroglu, and Abbas Yongacoglu","3D Aerial Highway: The Key Enabler of the Retail Industry Transformation","Accepted for publication in IEEE Communications Magazine: Mobile
  Communications and Networks Series",,,,"eess.SP cs.SY eess.SY","http://creativecommons.org/licenses/by/4.0/","  The retail industry is already facing an inevitable transformation worldwide,
and with the current pandemic situation, it is even accelerating. Indeed,
consumer habits are shifting from brick-and-mortar stores to online shopping.
The bottleneck in the end-to-end online shopping experience remains the
efficient and quick delivery of goods to consumers. In this context, unmanned
aerial vehicle (UAV) technology is seen as a potential solution to address
cargo delivery issues. Hence, the number of cargo-UAVs is expected to skyrocket
in the next few decades and the airspace to become densely crowded. To
successfully deploy UAVs for mass cargo delivery, seamless and reliable
cellular connectivity for highly mobile UAVs is required. There is an urgent
need for organized and connected routes in the sky. Like highways for cargo
trucks, 3D routes in the airspace should be designed for cargo-UAVs to fulfill
their operations safely and efficiently. We refer to these routes as 3D aerial
highway. In this paper, we thoroughly investigate the feasibility of the aerial
highways paradigm. First, we discuss the motivations and concerns of the aerial
highway paradigm. Then, we present our vision of the 3D aerial highway
framework. Finally, we present related connectivity issues and their potential
solutions.
","[{""version"":""v1"",""created"":""Sun, 20 Sep 2020 17:19:06 GMT""},{""version"":""v2"",""created"":""Thu, 21 Jan 2021 12:52:56 GMT""},{""version"":""v3"",""created"":""Tue, 16 Feb 2021 13:28:04 GMT""},{""version"":""v4"",""created"":""Wed, 21 Apr 2021 16:02:43 GMT""},{""version"":""v5"",""created"":""Thu, 24 Jun 2021 13:37:52 GMT""}]","2021-06-25"
