"2009.09576","Ricardo Gutierrez-Jauregui","R. Gutierrez-Jauregui and R. Jauregui","Spontaneous transition rates near the focus of a parabolic mirror with
  identification of the vectorial modes involved",,,,,"quant-ph physics.optics","http://arxiv.org/licenses/nonexclusive-distrib/1.0/","  Each natural mode of the electromagnetic field within a parabolic mirror
exhibits spatial localization and polarization properties that can be exploited
for the quantum control of its interaction with atomic systems. The region of
localization is not restricted to the focus of the mirror leading to a
selective response of atomic systems trapped on its vicinity. We report
calculations of the spontaneous emission rates for an atom trapped inside the
mirror accounting for all atomic polarizations and diverse trapping regions. It
is shown that electric dipole transitions can be enhanced near the focus of a
deep parabolic mirror with a clear identification of the few vectorial modes
involved. Out of the focus the enhancement vanishes gradually, but the number
of relevant modes remains small. Ultimately this represents a quantum
electrodynamic system where internal and external degrees of freedom cooperate
to maximize a selective exchange and detection of single excitations.
","[{""version"":""v1"",""created"":""Mon, 21 Sep 2020 02:14:49 GMT""}]","2020-09-22"
"2009.09577","Yongcan Cao","Feng Tao and Yongcan Cao","Learn to Exceed: Stereo Inverse Reinforcement Learning with Concurrent
  Policy Optimization","12 pages, 5 figures",,,,"cs.LG cs.RO stat.ML","http://arxiv.org/licenses/nonexclusive-distrib/1.0/","  In this paper, we study the problem of obtaining a control policy that can
mimic and then outperform expert demonstrations in Markov decision processes
where the reward function is unknown to the learning agent. One main relevant
approach is the inverse reinforcement learning (IRL), which mainly focuses on
inferring a reward function from expert demonstrations. The obtained control
policy by IRL and the associated algorithms, however, can hardly outperform
expert demonstrations. To overcome this limitation, we propose a novel method
that enables the learning agent to outperform the demonstrator via a new
concurrent reward and action policy learning approach. In particular, we first
propose a new stereo utility definition that aims to address the bias in the
interpretation of expert demonstrations. We then propose a loss function for
the learning agent to learn reward and action policies concurrently such that
the learning agent can outperform expert demonstrations. The performance of the
proposed method is first demonstrated in OpenAI environments. Further efforts
are conducted to experimentally validate the proposed method via an indoor
drone flight scenario.
","[{""version"":""v1"",""created"":""Mon, 21 Sep 2020 02:16:21 GMT""},{""version"":""v2"",""created"":""Tue, 22 Sep 2020 23:04:09 GMT""}]","2020-09-24"
"2009.09578","Chol Jun Kim","Kim Chol-jun","Stability of cycle in samplogram and spurious cycles in solar activity",,,,,"astro-ph.SR","http://arxiv.org/licenses/nonexclusive-distrib/1.0/","  The spectral analysis with stochastic significance cannot distinguish the
spurious cycles effectively, because a non-stationary signal can make a
significant peak in spectrum. I show that the random separation between the
grand extremes such as grand maxima and minima in solar activity can make a
spurious but significant peak in spectrum. And it is possible to pick even the
weak stable cycle by applying an averaging down-sampling and the differencing
to a random signal. This is because both operations variously change the height
of peak in spectrum and the spurious cycle is in turn unstable in both
operations. I introduce a samplogram showing these operations and stability
intuitively.
","[{""version"":""v1"",""created"":""Mon, 21 Sep 2020 02:18:19 GMT""}]","2020-09-22"
"2009.09579","JaeSung Yoo","Jaesung Yoo, Jeman Park, An Wang, David Mohaisen, and Joongheon Kim","On the Performance of Generative Adversarial Network (GAN) Variants: A
  Clinical Data Study",,,,,"cs.NE cs.AI cs.LG","http://arxiv.org/licenses/nonexclusive-distrib/1.0/","  Generative Adversarial Network (GAN) is a useful type of Neural Networks in
various types of applications including generative models and feature
extraction. Various types of GANs are being researched with different insights,
resulting in a diverse family of GANs with a better performance in each
generation. This review focuses on various GANs categorized by their common
traits.
","[{""version"":""v1"",""created"":""Mon, 21 Sep 2020 02:18:58 GMT""}]","2020-09-22"
"2009.09580","Kazutoshi Ohta","Kazutoshi Ohta, Norisuke Sakai","The Volume of the Quiver Vortex Moduli Space","67 pages, 13 figures, references and appendix added, typos corrected","Prog Theor Exp Phys (2021)","10.1093/ptep/ptab012",,"hep-th","http://arxiv.org/licenses/nonexclusive-distrib/1.0/","  We study the moduli space volume of BPS vortices in quiver gauge theories on
compact Riemann surfaces. The existence of BPS vortices imposes constraints on
the quiver gauge theories. We show that the moduli space volume is given by a
vev of a suitable cohomological operator (volume operator) in a supersymmetric
quiver gauge theory, where BPS equations of the vortices are embedded. In the
supersymmetric gauge theory, the moduli space volume is exactly evaluated as a
contour integral by using the localization. Graph theory is useful to construct
the supersymmetric quiver gauge theory and to derive the volume formula. The
contour integral formula of the volume (generalization of the Jeffrey-Kirwan
residue formula) leads to the Bradlow bounds (upper bounds on the vorticity by
the area of the Riemann surface divided by the intrinsic size of the vortex).
We give some examples of various quiver gauge theories and discuss properties
of the moduli space volume in these theories. Our formula are applied to the
volume of the vortex moduli space in the gauged non-linear sigma model with
$CP^N$ target space, which is obtained by a strong coupling limit of a parent
quiver gauge theory. We also discuss a non-Abelian generalization of the quiver
gauge theory and ""Abelianization"" of the volume formula.
","[{""version"":""v1"",""created"":""Mon, 21 Sep 2020 02:20:34 GMT""},{""version"":""v2"",""created"":""Thu, 1 Oct 2020 09:26:28 GMT""},{""version"":""v3"",""created"":""Fri, 25 Dec 2020 02:46:32 GMT""}]","2021-03-17"
"2009.09581","Tanmoy Paul","Soumitra Daptari, Tanmoy Paul and T.S.S.R.K. Rao","Uniqueness of Hahn-Banach extension and related norm-$1$ projections in
  dual spaces",,"Linear and Multilinear Algebra 2021","10.1080/03081087.2021.1945526","00","math.FA","http://arxiv.org/licenses/nonexclusive-distrib/1.0/","  In this paper we study two properties viz. property-$U$ and property-$SU$ of
a subspace $Y$ of a Banach space which correspond to the uniqueness of the
Hahn-Banach extension of each linear functional in $Y^*$ and in addition to
that this association forms a linear operator of norm-1 from $Y^*$ to $X^*$. It
is proved that, under certain geometric assumptions on $X, Y, Z$ these
properties are stable with respect to the injective tensor product; $Y$ has
property-$U$ ($SU$) in $Z$ if and only if $X\otimes_\e^\vee Y$ has property-$U$
($SU$) in $X\otimes_\e^\vee Z$. We prove that when $X^*$ has the
Radon-Nikod$\acute{y}$m Property for $1<p< \infty$, $L_p(\mu, Y)$ has
property-$U$ (property-$SU$) in $L_p(\mu, X)$ if and only if $Y$ is so in $X$.
We show that if $Z\subseteq Y\subseteq X$, where $Y$ has property-$U$ ($SU$) in
$X$ then $Y/Z$ has property-$U$ ($SU$) in $X/Z$. On the other hand $Y$ has
property-$SU$ in $X$ if $Y/Z$ has property-$SU$ in $X/Z$ and $Z (\subseteq Y)$
is an M-ideal in $X$. It is observed that a smooth Banach space of dimension
$>3$ is a Hilbert space if and only if for any two subspaces $Y, Z$ with
property-$SU$ in $X$, $Y+Z$ has property-$SU$ in $X$ whenever $Y+Z$ is closed.
We characterize all hyperplanes in $c_0$ which have property-$SU$.
","[{""version"":""v1"",""created"":""Mon, 21 Sep 2020 02:31:39 GMT""}]","2021-08-03"
"2009.09582","Javier Fernandez","Javier Fernandez, Cora Tori and Marcela Zuccalli","Lagrangian reduction of nonholonomic discrete mechanical systems by
  stages",,"J. Geom. Mech., 12 (2020), 607-639","10.3934/jgm.2020029",,"math.DG math.DS","http://arxiv.org/licenses/nonexclusive-distrib/1.0/","  In this work we introduce a category $LDP_d$ of discrete-time dynamical
systems, that we call discrete Lagrange--D'Alembert--Poincar\'e systems, and
study some of its elementary properties. Examples of objects of $LDP_d$ are
nonholonomic discrete mechanical systems as well as their lagrangian reductions
and, also, discrete Lagrange-Poincar\'e systems. We also introduce a notion of
symmetry group for objects of $LDP_d$ and a process of reduction when
symmetries are present. This reduction process extends the reduction process of
discrete Lagrange--Poincar\'e systems as well as the one defined for
nonholonomic discrete mechanical systems. In addition, we prove that, under
some conditions, the two-stage reduction process (first by a closed and normal
subgroup of the symmetry group and, then, by the residual symmetry group)
produces a system that is isomorphic in $LDP_d$ to the system obtained by a
one-stage reduction by the full symmetry group.
","[{""version"":""v1"",""created"":""Mon, 21 Sep 2020 02:37:28 GMT""}]","2020-12-11"
"2009.09583","Mel McCurrie","Mel McCurrie, Hamish Nicholson, Walter J. Scheirer, Samuel Anthony","Modeling Score Distributions and Continuous Covariates: A Bayesian
  Approach",,,,,"cs.LG cs.CV stat.ML","http://arxiv.org/licenses/nonexclusive-distrib/1.0/","  Computer Vision practitioners must thoroughly understand their model's
performance, but conditional evaluation is complex and error-prone. In
biometric verification, model performance over continuous
covariates---real-number attributes of images that affect performance---is
particularly challenging to study. We develop a generative model of the match
and non-match score distributions over continuous covariates and perform
inference with modern Bayesian methods. We use mixture models to capture
arbitrary distributions and local basis functions to capture non-linear,
multivariate trends. Three experiments demonstrate the accuracy and
effectiveness of our approach. First, we study the relationship between age and
face verification performance and find previous methods may overstate
performance and confidence. Second, we study preprocessing for CNNs and find a
highly non-linear, multivariate surface of model performance. Our method is
accurate and data efficient when evaluated against previous synthetic methods.
Third, we demonstrate the novel application of our method to pedestrian
tracking and calculate variable thresholds and expected performance while
controlling for multiple covariates.
","[{""version"":""v1"",""created"":""Mon, 21 Sep 2020 02:41:20 GMT""}]","2020-09-22"
"2009.09584","Sishu Shankar Muni","I.A. Shepelev, S.S. Muni, T.E. Vadivasova","Dynamics of a 2D lattice of van der Pol oscillators with nonlinear
  repulsive coupling","22 pages, 9 figures",,,,"nlin.AO nlin.PS","http://arxiv.org/licenses/nonexclusive-distrib/1.0/","  We describe spatiotemporal patterns in a network of identical van der Pol
oscillators coupled in a two-dimensional geometry. In this study, we show that
the system under study demonstrates a plethora of different spatiotemporal
structures including chimera states when the coupling parameters are varied.
Spiral wave chimeras are formed in the network when the coupling strength is
rather large and the coupling range is short enough. Another type of chimeras
is a target wave chimera. It is shown that solitary states play a crucial role
in forming an incoherence cluster of this chimera state. They can also spread
within the coherence cluster. Furthermore, when the coupling range increases,
the target wave chimera evolves to the regime of solitary states which are
randomly distributed in space. Growing the coupling strength leads to the
attraction of solitary states to a certain spatial region, while the
synchronous regime is set in the other part of the system. This spatiotemporal
pattern represents a solitary state chimera, which is firstly found in the
system of continuous-time oscillators. We offer the explanation of these
phenomena and describe the evolution of the regimes in detail.
","[{""version"":""v1"",""created"":""Mon, 21 Sep 2020 02:42:28 GMT""}]","2020-09-22"
"2009.09585","Yang Li","Yang Li, Boxun Fu, Fu Li, Guangming Shi, Wenming Zheng","A Novel Transferability Attention Neural Network Model for EEG Emotion
  Recognition",,,,,"cs.CV cs.HC","http://arxiv.org/licenses/nonexclusive-distrib/1.0/","  The existed methods for electroencephalograph (EEG) emotion recognition
always train the models based on all the EEG samples indistinguishably.
However, some of the source (training) samples may lead to a negative influence
because they are significant dissimilar with the target (test) samples. So it
is necessary to give more attention to the EEG samples with strong
transferability rather than forcefully training a classification model by all
the samples. Furthermore, for an EEG sample, from the aspect of neuroscience,
not all the brain regions of an EEG sample contains emotional information that
can transferred to the test data effectively. Even some brain region data will
make strong negative effect for learning the emotional classification model.
Considering these two issues, in this paper, we propose a transferable
attention neural network (TANN) for EEG emotion recognition, which learns the
emotional discriminative information by highlighting the transferable EEG brain
regions data and samples adaptively through local and global attention
mechanism. This can be implemented by measuring the outputs of multiple
brain-region-level discriminators and one single sample-level discriminator. We
conduct the extensive experiments on three public EEG emotional datasets. The
results validate that the proposed model achieves the state-of-the-art
performance.
","[{""version"":""v1"",""created"":""Mon, 21 Sep 2020 02:42:30 GMT""}]","2020-09-22"
"2009.09586","Rajeev S. Bhalerao Prof.","Rajeev S Bhalerao","Collectivity in large and small systems formed in ultrarelativistic
  collisions","Invited review article for EPJ ST, pedagogical review article, 34
  pages, 14 Figs, 14 Exercises, comments welcome","The European Physical Journal Special Topics, 230(2021)3, 635-654","10.1140/epjs/s11734-021-00019-x",,"nucl-th hep-ph nucl-ex","http://arxiv.org/licenses/nonexclusive-distrib/1.0/","  Collective flow of the final-state hadrons observed in ultrarelativistic
heavy-ion collisions or even in smaller systems formed in high-multiplicity pp
and p/d/$^3$He-nucleus collisions is one of the most important diagnostic tools
to probe the initial state of the system and to shed light on the properties of
the short-lived, strongly-interacting many-body state formed in these
collisions. Limited, in the initial years, to the study of mainly the directed
and elliptic flows -- the first two Fourier harmonics of the single-particle
azimuthal distribution -- this field has evolved in recent years into a much
richer area of activity. This includes not only higher Fourier harmonics and
multiparticle cumulants, but also a variety of other related observables, such
as the ridge seen in two-particle correlations, flow decorrelation, symmetric
cumulants and event-plane correlators which measure correlations between the
magnitudes or phases of the complex flows in different harmonics, coefficients
that measure the nonlinear hydrodynamic response, statistical properties, such
as the non-Gaussianity of the flow fluctuations, etc. We present a Tutorial
Review of the modern flow picture and the various aspects of the collectivity
-- an emergent phenomenon in quantum chromodynamics.
","[{""version"":""v1"",""created"":""Mon, 21 Sep 2020 02:46:54 GMT""},{""version"":""v2"",""created"":""Fri, 30 Oct 2020 16:05:41 GMT""}]","2021-06-29"
"2009.09587","Jiwei Li","Jiawei Wu, Xiaoya Li, Xiang Ao, Yuxian Meng, Fei Wu and Jiwei Li","Improving Robustness and Generality of NLP Models Using Disentangled
  Representations",,,,,"cs.CL","http://arxiv.org/licenses/nonexclusive-distrib/1.0/","  Supervised neural networks, which first map an input $x$ to a single
representation $z$, and then map $z$ to the output label $y$, have achieved
remarkable success in a wide range of natural language processing (NLP) tasks.
Despite their success, neural models lack for both robustness and generality:
small perturbations to inputs can result in absolutely different outputs; the
performance of a model trained on one domain drops drastically when tested on
another domain.
  In this paper, we present methods to improve robustness and generality of NLP
models from the standpoint of disentangled representation learning. Instead of
mapping $x$ to a single representation $z$, the proposed strategy maps $x$ to a
set of representations $\{z_1,z_2,...,z_K\}$ while forcing them to be
disentangled. These representations are then mapped to different logits $l$s,
the ensemble of which is used to make the final prediction $y$. We propose
different methods to incorporate this idea into currently widely-used models,
including adding an $L$2 regularizer on $z$s or adding Total Correlation (TC)
under the framework of variational information bottleneck (VIB). We show that
models trained with the proposed criteria provide better robustness and domain
adaptation ability in a wide range of supervised learning tasks.
","[{""version"":""v1"",""created"":""Mon, 21 Sep 2020 02:48:46 GMT""}]","2020-09-22"
"2009.09588","Jisu Jeong","Jisu Jeong, Jeong-Min Yun, Hongi Keam, Young-Jin Park, Zimin Park,
  Junki Cho","div2vec: Diversity-Emphasized Node Embedding","To appear in the ImpactRS Workshop at ACM RecSys 2020",,,,"cs.LG cs.IR cs.SI","http://creativecommons.org/licenses/by/4.0/","  Recently, the interest of graph representation learning has been rapidly
increasing in recommender systems. However, most existing studies have focused
on improving accuracy, but in real-world systems, the recommendation diversity
should be considered as well to improve user experiences. In this paper, we
propose the diversity-emphasized node embedding div2vec, which is a random
walk-based unsupervised learning method like DeepWalk and node2vec. When
generating random walks, DeepWalk and node2vec sample nodes of higher degree
more and nodes of lower degree less. On the other hand, div2vec samples nodes
with the probability inversely proportional to its degree so that every node
can evenly belong to the collection of random walks. This strategy improves the
diversity of recommendation models. Offline experiments on the MovieLens
dataset showed that our new method improves the recommendation performance in
terms of both accuracy and diversity. Moreover, we evaluated the proposed model
on two real-world services, WATCHA and LINE Wallet Coupon, and observed the
div2vec improves the recommendation quality by diversifying the system.
","[{""version"":""v1"",""created"":""Mon, 21 Sep 2020 02:50:50 GMT""}]","2020-09-22"
"2009.09589","Petr Sulc","Jonah Procyk, Erik Poppleton, Petr \v{S}ulc","Coarse-Grained Nucleic Acid-Protein Model for Hybrid Nanotechnology","8 pages, 6 figures",,,,"q-bio.BM cond-mat.soft physics.bio-ph","http://arxiv.org/licenses/nonexclusive-distrib/1.0/","  The emerging field of hybrid DNA - protein nanotechnology brings with it the
potential for many novel materials which combine the addressability of DNA
nanotechnology with versatility of protein interactions. However, the design
and computational study of these hybrid structures is difficult due to the
system sizes involved. To aid in the design and in silico analysis process, we
introduce here a coarse-grained DNA/RNA-protein model that extends the
oxDNA/oxRNA models of DNA/RNA with a coarse-grained model of proteins based on
an anisotropic network model representation. Fully equipped with analysis
scripts and visualization, our model aims to facilitate hybrid nanomaterial
design towards eventual experimental realization, as well as enabling study of
biological complexes. We further demonstrate its usage by simulating
DNA-protein nanocage, DNA wrapped around histones, and a nascent RNA in
polymerase.
","[{""version"":""v1"",""created"":""Mon, 21 Sep 2020 03:02:11 GMT""}]","2020-09-22"
"2009.09590","Lirong Wu","Lirong Wu, Zicheng Liu, Zelin Zang, Jun Xia, Siyuan Li, Stan. Z Li","Generalized Clustering and Multi-Manifold Learning with Geometric
  Structure Preservation",,,,,"cs.LG cs.AI stat.ML","http://arxiv.org/licenses/nonexclusive-distrib/1.0/","  Though manifold-based clustering has become a popular research topic, we
observe that one important factor has been omitted by these works, namely that
the defined clustering loss may corrupt the local and global structure of the
latent space. In this paper, we propose a novel Generalized Clustering and
Multi-manifold Learning (GCML) framework with geometric structure preservation
for generalized data, i.e., not limited to 2-D image data and has a wide range
of applications in speech, text, and biology domains. In the proposed
framework, manifold clustering is done in the latent space guided by a
clustering loss. To overcome the problem that the clustering-oriented loss may
deteriorate the geometric structure of the latent space, an isometric loss is
proposed for preserving intra-manifold structure locally and a ranking loss for
inter-manifold structure globally. Extensive experimental results have shown
that GCML exhibits superior performance to counterparts in terms of qualitative
visualizations and quantitative metrics, which demonstrates the effectiveness
of preserving geometric structure.
","[{""version"":""v1"",""created"":""Mon, 21 Sep 2020 03:04:57 GMT""},{""version"":""v2"",""created"":""Tue, 29 Sep 2020 00:56:18 GMT""},{""version"":""v3"",""created"":""Fri, 21 May 2021 14:59:56 GMT""},{""version"":""v4"",""created"":""Sat, 9 Oct 2021 02:53:38 GMT""}]","2021-10-12"
"2009.09591","Orlando Alvarez-LLamoza","M.G. Cosenza, O. Alvarez-Llamoza, C. Echeverr\'ia and K. Tucci","Leaders and obstacles raise cultural boundaries","6 pages, 7 figures, sent to Chaos, Solitons & Fractals",,"10.1016/j.chaos.2020.110565",,"physics.soc-ph nlin.CD","http://arxiv.org/licenses/nonexclusive-distrib/1.0/","  We employ an agent-based model for cultural dynamics to investigate the
effects of spatial heterogeneities on the collective behavior of a social
system. We introduce heterogeneity as a random distribution of defects or
imperfections in a two-dimensional lattice. Two types of defects are considered
separately: obstacles that represent geographic features, and opinion leaders,
described as agents exerting unidirectional influence on other agents. In both
cases, we characterize two collective phases on the space of parameters of the
system, given by the density of defects and a quantity expressing the number of
available states: one ordered phase, consisting of a large homogeneous group;
and a disordered phase, where many small cultural groups coexist. In the case
of leaders, the homogeneous state corresponds to their state. We find that a
high enough density of obstacles contributes to cultural diversity in the
system. On the other hand, we find a nontrivial effect when opinion leaders are
distributed in the system: if their density is greater than some threshold
value, leaders are no longer efficient in imposing their state to the
population, but they actually promote multiculturality. In this situation, we
uncover that leaders, as well as obstacles, serve as locations for the
formation of boundaries and segregation between different cultural groups.
Moreover, a lower density of leaders than obstacles is needed to induce
multiculturality in the system.
","[{""version"":""v1"",""created"":""Mon, 21 Sep 2020 03:06:52 GMT""}]","2021-02-03"
"2009.09592","David Frazier","Gael M. Martin, Rub\'en Loaiza-Maya, David T. Frazier, Worapree
  Maneesoonthorn, Andr\'es Ram\'irez Hassan","Optimal probabilistic forecasts: When do they work?",,,,,"econ.EM stat.ME","http://arxiv.org/licenses/nonexclusive-distrib/1.0/","  Proper scoring rules are used to assess the out-of-sample accuracy of
probabilistic forecasts, with different scoring rules rewarding distinct
aspects of forecast performance. Herein, we re-investigate the practice of
using proper scoring rules to produce probabilistic forecasts that are
`optimal' according to a given score, and assess when their out-of-sample
accuracy is superior to alternative forecasts, according to that score.
Particular attention is paid to relative predictive performance under
misspecification of the predictive model. Using numerical illustrations, we
document several novel findings within this paradigm that highlight the
important interplay between the true data generating process, the assumed
predictive model and the scoring rule. Notably, we show that only when a
predictive model is sufficiently compatible with the true process to allow a
particular score criterion to reward what it is designed to reward, will this
approach to forecasting reap benefits. Subject to this compatibility however,
the superiority of the optimal forecast will be greater, the greater is the
degree of misspecification. We explore these issues under a range of different
scenarios, and using both artificially simulated and empirical data.
","[{""version"":""v1"",""created"":""Mon, 21 Sep 2020 03:07:12 GMT""}]","2020-09-22"
