"2006.04322","Nicole Vassh","Nicole Vassh, Gail C. McLaughlin, Matthew R. Mumpower, and Rebecca
  Surman","Markov Chain Monte Carlo Predictions of Neutron-rich Lanthanide
  Properties as a Probe of $r$-process Dynamics",,"ApJ 907:98 (2021)","10.3847/1538-4357/abd035","LA-UR-20-24194","nucl-th astro-ph.HE","http://arxiv.org/licenses/nonexclusive-distrib/1.0/","  Lanthanide element signatures are key to understanding many astrophysical
observables, from merger kilonova light curves to stellar and solar abundances.
To learn about the lanthanide element synthesis that enriched our solar system,
we apply the statistical method of Markov Chain Monte Carlo to examine the
nuclear masses capable of forming the $r$-process rare-earth abundance peak. We
describe the physical constraints we implement with this statistical approach
and demonstrate the use of the parallel chains method to explore the
multidimensional parameter space. We apply our procedure to three moderately
neutron-rich astrophysical outflows with distinct types of $r$-process
dynamics. We show that the mass solutions found are dependent on outflow
conditions and are related to the $r$-process path. We describe in detail the
mechanism behind peak formation in each case. We then compare our mass
predictions for neutron-rich neodymium and samarium isotopes to the latest
experimental data from the CPT at CARIBU. We find our mass predictions given
outflows that undergo an extended (n,$\gamma$)$\rightleftarrows$($\gamma$,n)
equilibrium to be those most compatible with both observational solar
abundances and neutron-rich mass measurements.
","[{""version"":""v1"",""created"":""Mon, 8 Jun 2020 02:20:23 GMT""},{""version"":""v2"",""created"":""Thu, 11 Feb 2021 03:42:13 GMT""}]","2021-02-12"
"2006.04323","Yuhong Guo","Zhen Zhao, Bingyu Liu, Yuhong Guo, Jieping Ye","Ensemble Model with Batch Spectral Regularization and Data Blending for
  Cross-Domain Few-Shot Learning with Unlabeled Data",,,,,"cs.CV","http://arxiv.org/licenses/nonexclusive-distrib/1.0/","  In this paper, we present our proposed ensemble model with batch spectral
regularization and data blending mechanisms for the Track 2 problem of the
cross-domain few-shot learning (CD-FSL) challenge. We build a multi-branch
ensemble framework by using diverse feature transformation matrices, while
deploying batch spectral feature regularization on each branch to improve the
model's transferability. Moreover, we propose a data blending method to exploit
the unlabeled data and augment the sparse support set in the target domain. Our
proposed model demonstrates effective performance on the CD-FSL benchmark
tasks.
","[{""version"":""v1"",""created"":""Mon, 8 Jun 2020 02:27:34 GMT""},{""version"":""v2"",""created"":""Tue, 9 Jun 2020 07:52:51 GMT""}]","2020-06-11"
"2006.04324","Morgan Chopin","Amal Benhamiche and Morgan Chopin","Toward Scalable Algorithms for the Unsplittable Shortest Path Routing
  Problem",,,,,"cs.DS cs.CC cs.DM","http://arxiv.org/licenses/nonexclusive-distrib/1.0/","  In this paper, we consider the Delay Constrained Unsplittable Shortest Path
Routing problem which arises in the field of traffic engineering for IP
networks. This problem consists, given a directed graph and a set of
commodities, to compute a set of routing paths and the associated
administrative weights such that each commodity is routed along the unique
shortest path between its origin and its destination, according to these
weights. We present a compact MILP formulation for the problem, extending the
work in (A. Bley, 2010) along with some valid inequalities to strengthen its
linear relaxation. This formulation is used as the bulding block of an
iterative approach that we develop to tackle large scale instances. We further
propose a dynamic programming algorithm based on a tree decomposition of the
graph. To the best of our knowledge, this is the first exact combinatorial
algorithm for the problem. Finally, we assess the efficiency of our approaches
through a set of experiments on state-of-the-art instances.
","[{""version"":""v1"",""created"":""Mon, 8 Jun 2020 02:29:40 GMT""}]","2020-06-09"
"2006.04325","Yi Zhou","Yi Zhou, Chenglei Wu, Zimo Li, Chen Cao, Yuting Ye, Jason Saragih, Hao
  Li, Yaser Sheikh","Fully Convolutional Mesh Autoencoder using Efficient Spatially Varying
  Kernels","12 pages",,,,"cs.CV","http://arxiv.org/licenses/nonexclusive-distrib/1.0/","  Learning latent representations of registered meshes is useful for many 3D
tasks. Techniques have recently shifted to neural mesh autoencoders. Although
they demonstrate higher precision than traditional methods, they remain unable
to capture fine-grained deformations. Furthermore, these methods can only be
applied to a template-specific surface mesh, and is not applicable to more
general meshes, like tetrahedrons and non-manifold meshes. While more general
graph convolution methods can be employed, they lack performance in
reconstruction precision and require higher memory usage. In this paper, we
propose a non-template-specific fully convolutional mesh autoencoder for
arbitrary registered mesh data. It is enabled by our novel convolution and
(un)pooling operators learned with globally shared weights and locally varying
coefficients which can efficiently capture the spatially varying contents
presented by irregular mesh connections. Our model outperforms state-of-the-art
methods on reconstruction accuracy. In addition, the latent codes of our
network are fully localized thanks to the fully convolutional structure, and
thus have much higher interpolation capability than many traditional 3D mesh
generation models.
","[{""version"":""v1"",""created"":""Mon, 8 Jun 2020 02:30:13 GMT""},{""version"":""v2"",""created"":""Wed, 21 Oct 2020 06:16:23 GMT""}]","2020-10-22"
"2006.04326","Nakamasa Inoue","Nakamasa Inoue, Keita Goto","Semi-Supervised Contrastive Learning with Generalized Contrastive Loss
  and Its Application to Speaker Recognition",,,,,"eess.AS cs.SD","http://arxiv.org/licenses/nonexclusive-distrib/1.0/","  This paper introduces a semi-supervised contrastive learning framework and
its application to text-independent speaker verification. The proposed
framework employs generalized contrastive loss (GCL). GCL unifies losses from
two different learning frameworks, supervised metric learning and unsupervised
contrastive learning, and thus it naturally determines the loss for
semi-supervised learning. In experiments, we applied the proposed framework to
text-independent speaker verification on the VoxCeleb dataset. We demonstrate
that GCL enables the learning of speaker embeddings in three manners,
supervised learning, semi-supervised learning, and unsupervised learning,
without any changes in the definition of the loss function.
","[{""version"":""v1"",""created"":""Mon, 8 Jun 2020 02:33:25 GMT""}]","2020-06-09"
"2006.04327","Steve Raj Prabu","Steve Prabu, Paul J Hancock, Zhang Xiang, Steven J Tingay","A Low Frequency Blind Survey of the Low Earth Orbit Environment using
  Non-Coherent Passive Radar with the Murchison Widefield Array","Submitted to PASA",,"10.1017/pasa.2020.40",,"astro-ph.IM","http://arxiv.org/licenses/nonexclusive-distrib/1.0/","  We have extended our previous work to use the Murchison Widefield Array (MWA)
as a non-coherent passive radar system in the FM frequency band, using
terrestrial FM transmitters to illuminate objects in Low Earth Orbit LEO) and
the MWA as the sensitive receiving element for the radar return. We have
implemented a blind detection algorithm that searches for these reflected
signals in difference images constructed using standard interferometric imaging
techniques. From 20 hours of archived MWA observations, we conduct a survey of
LEO, detecting 74 unique objects over multiple passes and demonstrating the MWA
to be a valuable addition to the global Space Domain Awareness network. We
detected objects with ranges up to 977 km and as small as 0.03 m^2 radar cross
section. We found that 30 objects were either non-operational satellites or
upper-stage rocket body debris. Additionally, we also detected FM reflections
from Geminid meteors and aircraft flying over the MWA. Most of the detections
of objects in LEO were found to lie within the parameter space predicted by
previous feasibility studies, verifying the performance of the MWA for this
application.
","[{""version"":""v1"",""created"":""Mon, 8 Jun 2020 02:33:36 GMT""}]","2020-12-16"
"2006.04328","Steven Sam","Steven V Sam, Andrew Snowden","The representation theory of Brauer categories I: triangular categories","53 pages",,,,"math.RT","http://arxiv.org/licenses/nonexclusive-distrib/1.0/","  This is the first in a series of papers in which we study representations of
the Brauer category and its allies. We define a general notion of triangular
category that abstracts key properties of the triangular decomposition of a
semisimple complex Lie algebra, and develop a highest weight theory for them.
We show that the Brauer category, the partition category, and a number of
related diagram categories admit this structure.
","[{""version"":""v1"",""created"":""Mon, 8 Jun 2020 02:33:44 GMT""},{""version"":""v2"",""created"":""Fri, 10 Jun 2022 21:59:33 GMT""}]","2022-06-14"
"2006.04329","Ser-Peow Tan","Pradthana Jaipong, Mong Lung Lang, Ser Peow Tan and Ming Hong Tee","Dilogarithm identities after Bridgeman","24 pages, 3 figures",,,,"math.GT math.NT","http://arxiv.org/licenses/nonexclusive-distrib/1.0/","  Following Bridgeman, we demonstrate several families of infinite dilogarithm
identities associated with Fibonacci numbers, Lucas numbers, convergents of
continued fractions of even periods, and terms arising from various recurrence
relations.
","[{""version"":""v1"",""created"":""Mon, 8 Jun 2020 02:37:49 GMT""}]","2020-06-09"
"2006.04330","Ziwei Zhang","Ziwei Zhang, Peng Cui, Jian Pei, Xin Wang, Wenwu Zhu","Eigen-GNN: A Graph Structure Preserving Plug-in for GNNs","11 pages plus 8 pages for appendices, 4 figures",,,,"cs.LG stat.ML","http://arxiv.org/licenses/nonexclusive-distrib/1.0/","  Graph Neural Networks (GNNs) are emerging machine learning models on graphs.
Although sufficiently deep GNNs are shown theoretically capable of fully
preserving graph structures, most existing GNN models in practice are shallow
and essentially feature-centric. We show empirically and analytically that the
existing shallow GNNs cannot preserve graph structures well. To overcome this
fundamental challenge, we propose Eigen-GNN, a simple yet effective and general
plug-in module to boost GNNs ability in preserving graph structures.
Specifically, we integrate the eigenspace of graph structures with GNNs by
treating GNNs as a type of dimensionality reduction and expanding the initial
dimensionality reduction bases. Without needing to increase depths, Eigen-GNN
possesses more flexibilities in handling both feature-driven and
structure-driven tasks since the initial bases contain both node features and
graph structures. We present extensive experimental results to demonstrate the
effectiveness of Eigen-GNN for tasks including node classification, link
prediction, and graph isomorphism tests.
","[{""version"":""v1"",""created"":""Mon, 8 Jun 2020 02:47:38 GMT""}]","2020-06-09"
"2006.04331","Hiteshi Sharma","Hiteshi Sharma and Rahul Jain","Randomized Policy Learning for Continuous State and Action MDPs",,,,,"cs.LG cs.AI stat.ML","http://arxiv.org/licenses/nonexclusive-distrib/1.0/","  Deep reinforcement learning methods have achieved state-of-the-art results in
a variety of challenging, high-dimensional domains ranging from video games to
locomotion. The key to success has been the use of deep neural networks used to
approximate the policy and value function. Yet, substantial tuning of weights
is required for good results. We instead use randomized function approximation.
Such networks are not only cheaper than training fully connected networks but
also improve the numerical performance. We present \texttt{RANDPOL}, a
generalized policy iteration algorithm for MDPs with continuous state and
action spaces. Both the policy and value functions are represented with
randomized networks. We also give finite time guarantees on the performance of
the algorithm. Then we show the numerical performance on challenging
environments and compare them with deep neural network based algorithms.
","[{""version"":""v1"",""created"":""Mon, 8 Jun 2020 02:49:47 GMT""},{""version"":""v2"",""created"":""Mon, 16 Nov 2020 01:55:12 GMT""}]","2020-11-17"
"2006.04332","Yunfeng Shi","Hongzi Cong, Yunfeng Shi, Zhifei Zhang","Long-time Anderson Localization for the Nonlinear Schrodinger Equation
  Revisited","A revised version, to appear in J. Stat. Phys",,"10.1007/s10955-020-02677-y",,"math.DS math-ph math.MP math.SP","http://arxiv.org/licenses/nonexclusive-distrib/1.0/","  In this paper, we confirm the conjecture of Wang and Zhang (J. Stat. Phys.
134 (5-6): 953--968, 2009) in a long time scale, i.e., the displacement of the
wavefront for $1D$ nonlinear random Schroedinger equation is of logarithmic
order in time $|t|$.
","[{""version"":""v1"",""created"":""Mon, 8 Jun 2020 02:59:19 GMT""},{""version"":""v2"",""created"":""Thu, 19 Nov 2020 08:14:08 GMT""}]","2021-02-03"
"2006.04333","Bruce Margon","Bruce Margon, Philip Massey, Kathryn F. Neugent, and Nidia Morrell","A Survey for C II Emission-Line Stars in the Large Magellanic Cloud","Accepted for publication in the Astrophysical Journal, 2020",,"10.3847/1538-4357/ab9abe",,"astro-ph.SR astro-ph.GA","http://arxiv.org/licenses/nonexclusive-distrib/1.0/","  We present a narrow-band imaging survey of the Large Magellanic Cloud,
designed to isolate the C II $\lambda\lambda$7231, 7236 emission lines in
objects as faint as $m_{\lambda7400}\sim18$. The work is motivated by the
recent serendipitous discovery in the LMC of the first confirmed extragalactic
[WC11] star, whose spectrum is dominated by C II emission, and the realization
that the number of such objects is currently largely unconstrained. The survey,
which imaged $\sim$50$~$deg$^2$ using on-band and off-band filters, will
significantly increase the total census of these rare stars. In addition, each
new LMC [WC] star has a known luminosity, a quantity quite uncertain in the
Galactic sample. Multiple known C II emitters were easily recovered, validating
the survey design. We find 38 new C II emission candidates; spectroscopy of the
complete sample will be needed to ascertain their nature. In a preliminary
spectroscopic reconnaissance, we observed three candidates, finding C II
emission in each. One is a new [WC11]. Another shows both the narrow C II
emission lines characteristic of a [WC11], but also broad emission of C IV, O
V, and He II characteristic of a much hotter [WC4] star; we speculate that this
is a binary [WC]. The third object shows weak C II emission, but the spectrum
is dominated by a dense thicket of strong absorption lines, including numerous
O II transitions. We conclude it is likely an unusual hot, hydrogen-poor
post-AGB star, possibly in transition from [WC] to white dwarf. Even lacking a
complete spectroscopic program, we can infer that late [WC] stars do not
dominate the central stars of LMC planetary nebulae, and that the detected C II
emitters are largely of an old population.
","[{""version"":""v1"",""created"":""Mon, 8 Jun 2020 03:00:43 GMT""}]","2020-08-05"
"2006.04334","Shahan Ali Memon","Shahan Ali Memon, Aman Tyagi, David R. Mortensen, Kathleen M. Carley","Characterizing Sociolinguistic Variation in the Competing Vaccination
  Communities","11 pages, 4 tables, 1 figure, 1 algorithm, accepted to SBP-BRiMS 2020
  -- International Conference on Social Computing, Behavioral-Cultural Modeling
  & Prediction and Behavior Representation in Modeling and Simulation",,,,"cs.SI cs.CL","http://arxiv.org/licenses/nonexclusive-distrib/1.0/","  Public health practitioners and policy makers grapple with the challenge of
devising effective message-based interventions for debunking public health
misinformation in cyber communities. ""Framing"" and ""personalization"" of the
message is one of the key features for devising a persuasive messaging
strategy. For an effective health communication, it is imperative to focus on
""preference-based framing"" where the preferences of the target sub-community
are taken into consideration. To achieve that, it is important to understand
and hence characterize the target sub-communities in terms of their social
interactions. In the context of health-related misinformation, vaccination
remains to be the most prevalent topic of discord. Hence, in this paper, we
conduct a sociolinguistic analysis of the two competing vaccination communities
on Twitter: ""pro-vaxxers"" or individuals who believe in the effectiveness of
vaccinations, and ""anti-vaxxers"" or individuals who are opposed to
vaccinations. Our data analysis show significant linguistic variation between
the two communities in terms of their usage of linguistic intensifiers,
pronouns, and uncertainty words. Our network-level analysis show significant
differences between the two communities in terms of their network density,
echo-chamberness, and the EI index. We hypothesize that these sociolinguistic
differences can be used as proxies to characterize and understand these
communities to devise better message interventions.
","[{""version"":""v1"",""created"":""Mon, 8 Jun 2020 03:05:28 GMT""},{""version"":""v2"",""created"":""Wed, 1 Jul 2020 09:39:51 GMT""},{""version"":""v3"",""created"":""Sun, 4 Oct 2020 13:28:50 GMT""}]","2020-10-06"
"2006.04335","Xingxing Zuo","Xingxing Zuo, Mingming Zhang, Mengmeng Wang, Yiming Chen, Guoquan
  Huang, Yong Liu, and Mingyang Li","Visual-based Kinematics and Pose Estimation for Skid-Steering Robots","19 pages in total",,,,"cs.RO","http://arxiv.org/licenses/nonexclusive-distrib/1.0/","  To build commercial robots, skid-steering mechanical design is of increased
popularity due to its manufacturing simplicity and unique mechanism. However,
these also cause significant challenges on software and algorithm design,
especially for the pose estimation (i.e., determining the robot's rotation and
position) of skid-steering robots, since they change their orientation with an
inevitable skid. To tackle this problem, we propose a probabilistic
sliding-window estimator dedicated to skid-steering robots, using measurements
from a monocular camera, the wheel encoders, and optionally an inertial
measurement unit (IMU). Specifically, we explicitly model the kinematics of
skid-steering robots by both track instantaneous centers of rotation (ICRs) and
correction factors, which are capable of compensating for the complexity of
track-to-terrain interaction, the imperfectness of mechanical design, terrain
conditions and smoothness, etc. To prevent performance reduction in robots'
long-term missions, the time- and location- varying kinematic parameters are
estimated online along with pose estimation states in a tightly-coupled manner.
More importantly, we conduct in-depth observability analysis for different
sensors and design configurations in this paper, which provides us with
theoretical tools in making the correct choice when building real commercial
robots. In our experiments, we validate the proposed method by both simulation
tests and real-world experiments, which demonstrate that our method outperforms
competing methods by wide margins.
","[{""version"":""v1"",""created"":""Mon, 8 Jun 2020 03:05:31 GMT""},{""version"":""v2"",""created"":""Wed, 5 Aug 2020 11:16:42 GMT""},{""version"":""v3"",""created"":""Thu, 6 Aug 2020 08:31:20 GMT""},{""version"":""v4"",""created"":""Fri, 18 Dec 2020 08:59:57 GMT""},{""version"":""v5"",""created"":""Tue, 3 May 2022 20:33:17 GMT""},{""version"":""v6"",""created"":""Tue, 25 Oct 2022 19:40:54 GMT""}]","2022-10-27"
"2006.04336","Pardyumn Kumar Sahoo","Snehasish Bhattacharjee, J.R.L. Santos, P.H.R.S. Moraes, P.K. Sahoo","Inflation in $f(R,T)$ Gravity","EPJ Plus accepted version","Eur. Phys. J. Plus 135, 576 (2020)","10.1140/epjp/s13360-020-00583-6",,"gr-qc astro-ph.CO hep-th","http://arxiv.org/licenses/nonexclusive-distrib/1.0/","  The article presents modeling of inflationary scenarios for the first time in
the $f(R,T)$ theory of gravity. We assume the $f(R,T)$ functional from to be $R
+ \eta T$, where $R$ denotes the Ricci scalar, $T$ the trace of the
energy-momentum tensor and $\eta$ the model parameter (constant). We first
investigated an inflationary scenario where the inflation is driven purely due
to geometric effects outside of GR. We found the inflation observables to be
independent of the number of e-foldings in this setup. The computed value of
the spectral index is consistent with latest Planck 2018 dataset while the
scalar to tensor ratio is a bit higher. We then proceeded to analyze the
behavior of an inflation driven by $f(R,T)$ gravity coupled with a real scalar
field. By taking the slow-roll approximation, we generated interesting
scenarios where a Klein Gordon potential leads to observationally consistent
inflation observables. Our results makes it clear-cut that in addition to the
Ricci scalar and scalar fields, the trace of energy momentum tensor also play a
major role in driving inflationary scenarios.
","[{""version"":""v1"",""created"":""Mon, 8 Jun 2020 03:17:16 GMT""},{""version"":""v2"",""created"":""Tue, 30 Jun 2020 09:59:08 GMT""}]","2020-08-03"
"2006.04337","Jayson Lynch","Joshua Ani, Sualeh Asif, Erik D. Demaine, Yevhenii Diomidov, Dylan
  Hendrickson, Jayson Lynch, Sarah Scheffler, Adam Suhl","PSPACE-completeness of Pulling Blocks to Reach a Goal","Full version of JCDCGGG2019 paper and now published in Journal of
  Information Processing 28 (2020), 22 pages, 25 figures; corrections made to
  Figures 10 and 15","Journal of Information Processing 28 (2020): 929-941","10.2197/ipsjjip.28.929",,"cs.CC","http://arxiv.org/licenses/nonexclusive-distrib/1.0/","  We prove PSPACE-completeness of all but one problem in a large space of
pulling-block problems where the goal is for the agent to reach a target
destination. The problems are parameterized by whether pulling is optional, the
number of blocks which can be pulled simultaneously, whether there are fixed
blocks or thin walls, and whether there is gravity. We show NP-hardness for the
remaining problem, Pull?-1FG (optional pulling, strength 1, fixed blocks, with
gravity).
","[{""version"":""v1"",""created"":""Mon, 8 Jun 2020 03:21:45 GMT""},{""version"":""v2"",""created"":""Fri, 25 Feb 2022 18:47:27 GMT""}]","2022-02-28"
"2006.04338","Sihan Zeng","Sihan Zeng, Aqeel Anwar, Thinh Doan, Arijit Raychowdhury, Justin
  Romberg","A Decentralized Policy Gradient Approach to Multi-task Reinforcement
  Learning",,,,,"cs.LG stat.ML","http://arxiv.org/licenses/nonexclusive-distrib/1.0/","  We develop a mathematical framework for solving multi-task reinforcement
learning (MTRL) problems based on a type of policy gradient method. The goal in
MTRL is to learn a common policy that operates effectively in different
environments; these environments have similar (or overlapping) state spaces,
but have different rewards and dynamics. We highlight two fundamental
challenges in MTRL that are not present in its single task counterpart, and
illustrate them with simple examples. We then develop a decentralized
entropy-regularized policy gradient method for solving the MTRL problem, and
study its finite-time convergence rate. We demonstrate the effectiveness of the
proposed method using a series of numerical experiments. These experiments
range from small-scale ""GridWorld"" problems that readily demonstrate the
trade-offs involved in multi-task learning to large-scale problems, where
common policies are learned to navigate an airborne drone in multiple
(simulated) environments.
","[{""version"":""v1"",""created"":""Mon, 8 Jun 2020 03:28:19 GMT""},{""version"":""v2"",""created"":""Fri, 28 May 2021 01:32:18 GMT""}]","2021-05-31"
"2006.04339","Snehasish Bhattacharjee","Snehasish Bhattacharjee","Interacting Tsallis and R\'enyi Holographic Dark Energy with Hybrid
  Expansion Law","Revision submitted to Astrophysics and Space Science","Astrophysics and Space Science, 365 103 (2020)","10.1007/s10509-020-03820-7",,"gr-qc astro-ph.CO","http://creativecommons.org/licenses/by/4.0/","  The manuscript presents the dynamics of Tsallis holographic dark energy
(THDE) and R\'enyi holographic dark energy (RHDE) prescribed by a non-linear
interaction in the FRW spacetime and for a scale factor evolving with a
composite power law-exponential (hybrid) form. To construct the energy
densities of these holographic dark energy models, I assume the Hubble cutoff
to be the IR limit. I find that the deceleration parameter undergoes a
signature flipping at a redshift $z$ consistent with observations. The EoS
parameter $\omega_{de}$ for both the HDE models exhibit quite contrasting
dynamical behavior despite assuming values close to $-1$ at $z=0$ and therefore
consistent with current observations. Next, I find the squared sound speed
$c_{s}^{2}$ to be positive for the THDE model ensuring stability against
perturbations, whereas for the RHDE model, $c_{s}^{2}<0$ implying instability
against perturbations. Furthermore, I analyzed the evolutionary behavior of the
EoS parameter of the HDE models by constructing the
$\omega_{de}-\omega_{de}^{'}$ plane and find that the plane lies in the
freezing region for the THDE model and in the thawing region for the RHDE
model.
","[{""version"":""v1"",""created"":""Mon, 8 Jun 2020 03:30:10 GMT""}]","2020-06-22"
