"2006.04603","Alberto Signoroni","Alberto Signoroni, Mattia Savardi, Sergio Benini, Nicola Adami,
  Riccardo Leonardi, Paolo Gibellini, Filippo Vaccher, Marco Ravanelli, Andrea
  Borghesi, Roberto Maroldi, Davide Farina (University of Brescia)","BS-Net: learning COVID-19 pneumonia severity on a large Chest X-Ray
  dataset","28 pages, 11 figures, preprint of accepted paper to Medical Image
  Analysis, Project page with Code and Dataset Available at
  https://brixia.github.io/",,"10.1016/j.media.2021.102046",,"eess.IV cs.CV cs.LG","http://creativecommons.org/licenses/by-nc-nd/4.0/","  In this work we design an end-to-end deep learning architecture for
predicting, on Chest X-rays images (CXR), a multi-regional score conveying the
degree of lung compromise in COVID-19 patients. Such semi-quantitative scoring
system, namely Brixia~score, is applied in serial monitoring of such patients,
showing significant prognostic value, in one of the hospitals that experienced
one of the highest pandemic peaks in Italy. To solve such a challenging visual
task, we adopt a weakly supervised learning strategy structured to handle
different tasks (segmentation, spatial alignment, and score estimation) trained
with a ""from-the-part-to-the-whole"" procedure involving different datasets. In
particular, we exploit a clinical dataset of almost 5,000 CXR annotated images
collected in the same hospital. Our BS-Net demonstrates self-attentive behavior
and a high degree of accuracy in all processing stages. Through inter-rater
agreement tests and a gold standard comparison, we show that our solution
outperforms single human annotators in rating accuracy and consistency, thus
supporting the possibility of using this tool in contexts of computer-assisted
monitoring. Highly resolved (super-pixel level) explainability maps are also
generated, with an original technique, to visually help the understanding of
the network activity on the lung areas. We also consider other scores proposed
in literature and provide a comparison with a recently proposed non-specific
approach. We eventually test the performance robustness of our model on an
assorted public COVID-19 dataset, for which we also provide Brixia~score
annotations, observing good direct generalization and fine-tuning capabilities
that highlight the portability of BS-Net in other clinical settings. The CXR
dataset along with the source code and the trained model are publicly released
for research purposes.
","[{""version"":""v1"",""created"":""Mon, 8 Jun 2020 13:55:58 GMT""},{""version"":""v2"",""created"":""Thu, 6 Aug 2020 15:06:57 GMT""},{""version"":""v3"",""created"":""Sat, 3 Apr 2021 08:44:53 GMT""}]","2021-04-06"
"2006.04604","Hyeongju Kim","Hyeongju Kim, Hyeonseung Lee, Woo Hyun Kang, Joun Yeop Lee, Nam Soo
  Kim","SoftFlow: Probabilistic Framework for Normalizing Flow on Manifolds","17 pages, 15figures",,,,"cs.CV cs.LG","http://arxiv.org/licenses/nonexclusive-distrib/1.0/","  Flow-based generative models are composed of invertible transformations
between two random variables of the same dimension. Therefore, flow-based
models cannot be adequately trained if the dimension of the data distribution
does not match that of the underlying target distribution. In this paper, we
propose SoftFlow, a probabilistic framework for training normalizing flows on
manifolds. To sidestep the dimension mismatch problem, SoftFlow estimates a
conditional distribution of the perturbed input data instead of learning the
data distribution directly. We experimentally show that SoftFlow can capture
the innate structure of the manifold data and generate high-quality samples
unlike the conventional flow-based models. Furthermore, we apply the proposed
framework to 3D point clouds to alleviate the difficulty of forming thin
structures for flow-based models. The proposed model for 3D point clouds,
namely SoftPointFlow, can estimate the distribution of various shapes more
accurately and achieves state-of-the-art performance in point cloud generation.
","[{""version"":""v1"",""created"":""Mon, 8 Jun 2020 13:56:07 GMT""},{""version"":""v2"",""created"":""Tue, 9 Jun 2020 18:22:03 GMT""},{""version"":""v3"",""created"":""Mon, 31 Aug 2020 09:53:56 GMT""},{""version"":""v4"",""created"":""Sun, 15 Nov 2020 11:18:29 GMT""}]","2020-11-17"
"2006.04605","Daniel Horsley","Daniel Horsley and Bridget S. Webb","Countable homogeneous Steiner triple systems avoiding specified
  subsystems","15 pages, 1 figure",,"10.1016/j.jcta.2021.105434",,"math.CO","http://arxiv.org/licenses/nonexclusive-distrib/1.0/","  In this article we construct uncountably many new homogeneous locally finite
Steiner triple systems of countably infinite order as Fra\""{\i}ss\'{e} limits
of classes of finite Steiner triple systems avoiding certain subsystems. The
construction relies on a new embedding result: any finite partial Steiner
triple system has an embedding into a finite Steiner triple system that
contains no nontrivial proper subsystems that are not subsystems of the
original partial system. Fra\""{\i}ss\'e's construction and its variants are
rich sources of examples that are central to model-theoretic classification
theory, and recently infinite Steiner systems obtained via Fra\""{\i}ss\'e-type
constructions have received attention from the model theory community.
","[{""version"":""v1"",""created"":""Mon, 8 Jun 2020 13:57:46 GMT""},{""version"":""v2"",""created"":""Tue, 9 Mar 2021 12:18:58 GMT""}]","2021-03-10"
"2006.04606","Oliver M\""uller","Oliver M\""uller, Francine R. Marleau, Pierre-Alain Duc, Rebecca Habas,
  J\'er\'emy Fensch, Eric Emsellem, M\'elina Poulain, Sungsoon Lim, Adriano
  Agnello, Patrick Durrell, Sanjaya Paudel, Rub\'en S\'anchez-Janssen, Remco F.
  J.van der Burg","A spectroscopic study of MATLAS-2019 with MUSE: an ultra-diffuse galaxy
  with an excess of old globular clusters","10 pages, 9 figures, 2 tables, accepted for publication in A&A","A&A 640, A106 (2020)","10.1051/0004-6361/202038351",,"astro-ph.GA","http://arxiv.org/licenses/nonexclusive-distrib/1.0/","  The MATLAS deep imaging survey has uncovered a plethora of dwarf galaxies in
the low density environment it has mapped. A fraction of them are unusually
extended and have a low-surface brightness. Among these so-called ultra-diffuse
galaxies, a few seem to host an excess of globular clusters. With the
integral-field unit spectrograph MUSE we have observed one of these galaxies -
MATLAS J15052031+0148447 (MATLAS-2019) - located towards the nearby group NGC
5846 and measured its systemic velocity,age, and metallicity, and that of its
globular clusters candidates. For the stellar body of MATLAS-2019 we derive a
metallicity of -1.33+0.19-0.01 dex and an age of 11.2+1.8-0.8 Gyr. For some of
the individual GCs and the stacked GC population, we derive consistent ages and
metallicities. From the 11 confirmed globular clusters and using a Markov Chain
Monte Carlo approach we derived a dynamical mass-to-light ratio of
4.2+8.6-3.4M/L. This is at the lower end of the luminosity-mass scaling
relation defined by the Local Group dwarf galaxies. Furthermore, we couldn't
confirm nor reject the possibility of a rotational component of the GC system.
If present, this would further modify the inferred mass. Follow-up observations
of the globular cluster population and of the stellar body of the galaxy are
needed to assess whether this galaxy is lacking dark matter like it was
suggested for the pair of dwarf galaxies in the field of NGC 1052, or if this
is a miss-interpretation arising from systematic uncertainties of the method
commonly used for these systems and the large uncertainties of the individual
globular cluster velocities.
","[{""version"":""v1"",""created"":""Mon, 8 Jun 2020 13:59:31 GMT""}]","2020-08-26"
"2006.04607","Dominik Smith","Michael K\""orner, Kurt Langfeld, Dominik Smith, Lorenz von Smekal","A density of states approach to the hexagonal Hubbard model at finite
  density","revised version, accepted for publication in Phys. Rev. D","Phys. Rev. D 102, 054502 (2020)","10.1103/PhysRevD.102.054502",,"hep-lat cond-mat.str-el","http://arxiv.org/licenses/nonexclusive-distrib/1.0/","  We apply the Linear Logarithmic Relaxation (LLR) method, which generalizes
the Wang-Landau algorithm to quantum systems with continuous degrees of
freedom, to the fermionic Hubbard model with repulsive interactions on the
honeycomb lattice. We compute the generalized density of states of the average
Hubbard field and divise two reconstruction schemes to extract physical
observables from this result. By computing the particle density as a function
of chemical potential we assess the utility of LLR in dealing with the sign
problem of this model, which arises away from half filling. We show that the
relative advantage over brute-force reweighting grows as the interaction
strength is increased and discuss possible future improvements.
","[{""version"":""v1"",""created"":""Mon, 8 Jun 2020 13:59:54 GMT""},{""version"":""v2"",""created"":""Fri, 14 Aug 2020 20:10:29 GMT""}]","2020-09-16"
"2006.04608","Marina Vannucci","Jeong Hwan Kook, Kelly A. Vaughn, Dana M. DeMaster, Linda Ewing-Cobbs
  and Marina Vannucci","BVAR-Connect: A Variational Bayes Approach to Multi-Subject Vector
  Autoregressive Models for Inference on Brain Connectivity Networks","Neuroinformatics (2020), in press","Neuroinformatics,19, 39-56 (2021)","10.1007/s12021-020-09472-w",,"stat.AP","http://arxiv.org/licenses/nonexclusive-distrib/1.0/","  In this paper we propose BVAR-connect, a variational inference approach to a
Bayesian multi-subject vector autoregressive (VAR) model for inference on
effective brain connectivity based on resting-state functional MRI data. The
modeling framework uses a Bayesian variable selection approach that flexibly
integrates multi-modal data, in particular structural diffusion tensor imaging
(DTI) data, into the prior construction. The variational inference approach we
develop allows scalability of the methods and results in the ability to
estimate subject- and group-level brain connectivity networks over whole-brain
parcellations of the data. We provide a brief description of a user-friendly
MATLAB GUI released for public use. We assess performance on simulated data,
where we show that the proposed inference method can achieve comparable
accuracy to the sampling-based Markov Chain Monte Carlo approach but at a much
lower computational cost. We also address the case of subject groups with
imbalanced sample sizes. Finally, we illustrate the methods on resting-state
functional MRI and structural DTI data on children with a history of traumatic
injury.
","[{""version"":""v1"",""created"":""Mon, 8 Jun 2020 14:05:28 GMT""}]","2021-06-18"
"2006.04609","Ran He","Ming-Zhong Ai, Sai Li, Zhibo Hou, Ran He, Zhong-Hua Qian, Zheng-Yuan
  Xue, Jin-Ming Cui, Yun-Feng Huang, Chuan-Feng Li, Guang-Can Guo","Experimental Realization of Nonadiabatic Holonomic Single-Qubit Quantum
  Gates\\ with Optimal Control in a Trapped Ion",,"Phys. Rev. Appl. 14, 054062 (2020)","10.1103/PhysRevApplied.14.054062",,"quant-ph","http://arxiv.org/licenses/nonexclusive-distrib/1.0/","  Quantum computation with quantum gates induced by geometric phases is
regarded as a promising strategy in fault tolerant quantum computation, due to
its robustness against operational noises. However, because of the parametric
restriction of previous schemes, the main robust advantage of holonomic quantum
gates is smeared. Here, we experimentally demonstrate a solution scheme,
demonstrating nonadiabatic holonomic single qubit quantum gates with optimal
control in a trapped Yb ion based on three level systems with resonant drives,
which also hold the advantages of fast evolution and convenient implementation.
Compared with corresponding previous geometric gates and conventional dynamic
gates, the superiority of our scheme is that it is more robust against control
amplitude errors, which is confirmed by the measured gate infidelity through
both quantum process tomography and random benchmarking methods. In addition,
we also outline that nontrivial two qubit holonomic gates can also be realized
within current experimental technologies. Therefore, our experiment validates
the feasibility for this robust and fast holonomic quantum computation
strategy.
","[{""version"":""v1"",""created"":""Mon, 8 Jun 2020 14:06:06 GMT""},{""version"":""v2"",""created"":""Mon, 30 Nov 2020 07:27:56 GMT""}]","2020-12-04"
"2006.04610","Janusz Gluza Dr","Janusz Gluza, Magdalena Kordiaczynska, Tripurari Srivastava","Discriminating the HTM and MLRSM models in collider studies via doubly
  charged Higgs boson pair production and the subsequent leptonic decays","52 pages, 16 figs, version accepted for publication in Chinese
  Physics C",,"10.1088/1674-1137/abfe51",,"hep-ph hep-ex","http://creativecommons.org/licenses/by/4.0/","  We present a case study for the doubly charged Higgs bosons $H^{\pm\pm}$ pair
production in $e^+e^-$ and $pp$ colliders with their subsequent decays to four
charged leptons. We consider the Higgs Triplet Model (HTM) not restricted by
the custodial symmetry and the Minimal Left-Right Symmetric Model (MLRSM). The
models include scalar triplets with different complexity of scalar potentials
and, due to experimental restrictions, completely different scales of
non-standard triplet vacuum expectation values. In both models, a doubly
charged Higgs boson $H^{\pm\pm}$ can acquire a mass of hundreds of
gigaelectronvolts, which can be probed at HL-LHC, future $e^+e^-$, and hadron
colliders. We take into account a comprehensive set of constraints on the
parameters of both models coming from neutrino oscillations, LHC, $e^+e^-$ and
low-energy lepton flavour violating data and assume the same mass of
$H^{\pm\pm}$. Our finding is that the $H^{\pm\pm}$ pair production in lepton
and hadron colliders is comparable in both models, though more pronounced in
MLRSM. We show that the decay branching ratios can be different within both
models, leading to distinguishable four lepton signals and that the strongest
are $4\mu$ events yielded by MLRSM. Typically we find that MLRSM signals are
one order of magnitude larger that in HTM. For example, the $pp \to 4\mu$ MLRSM
signal for 1 TeV $H^{\pm \pm}$ mass results in a clearly detectable
significance of $S \simeq 11$ for HL-LHC and $S \simeq 290$ for FCC-hh. Finally
we provide quantitative predictions for the dilepton invariant mass
distributions and lepton separations which help to identify non-standard
signals.
","[{""version"":""v1"",""created"":""Mon, 8 Jun 2020 14:07:57 GMT""},{""version"":""v2"",""created"":""Sun, 20 Sep 2020 07:46:51 GMT""},{""version"":""v3"",""created"":""Tue, 27 Apr 2021 11:20:32 GMT""}]","2021-09-01"
"2006.04611","Kaustubh Yadav","Kaustubh Yadav","A Comprehensive Survey on Aspect Based Sentiment Analysis",,,,,"cs.CL cs.LG","http://arxiv.org/licenses/nonexclusive-distrib/1.0/","  Aspect Based Sentiment Analysis (ABSA) is the sub-field of Natural Language
Processing that deals with essentially splitting our data into aspects ad
finally extracting the sentiment information. ABSA is known to provide more
information about the context than general sentiment analysis. In this study,
our aim is to explore the various methodologies practiced while performing
ABSA, and providing a comparative study. This survey paper discusses various
solutions in-depth and gives a comparison between them. And is conveniently
divided into sections to get a holistic view on the process.
","[{""version"":""v1"",""created"":""Mon, 8 Jun 2020 14:07:58 GMT""}]","2020-06-09"
"2006.04612","Andrea Brugnoli","Andrea Brugnoli, Daniel Alazard, Val\'erie Pommier-Budinger, Denis
  Matignon","Structure-preserving discretization of port-Hamiltonian plate models",,,,,"math.NA cs.NA","http://creativecommons.org/licenses/by-nc-sa/4.0/","  Methods for discretizing port-Hamiltonian systems are of interest both for
simulation and control purposes. Despite the large literature on mixed finite
elements, no rigorous analysis of the connections between mixed elements and
port-Hamiltonian systems has been carried out. In this paper we demonstrate how
existing methods can be employed to discretize dynamical plate problems in a
structure-preserving way. Based on convergence results of existing schemes, new
error estimates are conjectured; numerical simulations confirm the expected
behaviors.
","[{""version"":""v1"",""created"":""Mon, 8 Jun 2020 14:09:53 GMT""}]","2020-06-09"
"2006.04613","Claude Renaux","Christoph Schultheiss, Claude Renaux, Peter B\""uhlmann","Multicarving for high-dimensional post-selection inference",,,,,"stat.ME","http://arxiv.org/licenses/nonexclusive-distrib/1.0/","  We consider post-selection inference for high-dimensional (generalized)
linear models. Data carving (Fithian et al., 2014) is a promising technique to
perform this task. However, it suffers from the instability of the model
selector and hence, may lead to poor replicability, especially in
high-dimensional settings. We propose the multicarve method inspired by
multisplitting to improve upon stability and replicability. Furthermore, we
extend existing concepts to group inference and illustrate the applicability of
the methodology also for generalized linear models.
","[{""version"":""v1"",""created"":""Mon, 8 Jun 2020 14:10:37 GMT""},{""version"":""v2"",""created"":""Mon, 15 Feb 2021 11:35:05 GMT""}]","2021-02-16"
"2006.04614","Steffen Pottel","Camilla Nobili and Steffen Pottel","Lower bounds on mixing norms for the advection diffusion equation in
  $\mathbb{R}^d$","35 pages; v3: Improvement of results due to introduction of decay
  character",,,,"math.AP math-ph math.MP","http://arxiv.org/licenses/nonexclusive-distrib/1.0/","  An algebraic lower bound on the energy decay for solutions of the
advection-diffusion equation in $\mathbb{R}^d$ with $d=2,3$ is derived using
the Fourier splitting method. Motivated by a conjecture on mixing of passive
scalars in fluids, a lower bound on the $L^2-$ norm of the inverse gradient of
the solution is obtained via gradient estimates and interpolation.
","[{""version"":""v1"",""created"":""Mon, 8 Jun 2020 14:10:52 GMT""},{""version"":""v2"",""created"":""Fri, 31 Jul 2020 17:00:52 GMT""},{""version"":""v3"",""created"":""Sun, 26 Dec 2021 15:40:48 GMT""}]","2021-12-28"
"2006.04615","Tyrone Crisp","Tyrone Crisp","Gluing Hilbert C*-modules over the primitive ideal space","26 pages. Comments gratefully received",,,,"math.OA","http://arxiv.org/licenses/nonexclusive-distrib/1.0/","  We show that the gluing construction for Hilbert modules introduced by
Raeburn in his computation of the Picard group of a continuous-trace C*-algebra
(Trans. Amer. Math. Soc., 1981) can be applied to arbitrary C*-algebras, via an
algebraic argument with the Haagerup tensor product. We put this result into
the context of descent theory by identifying categories of gluing data for
Hilbert modules over C*-algebras with categories of comodules over
C*-coalgebras, giving a Hilbert-module version of a standard construction from
algebraic geometry. As a consequence we show that if two C*-algebras have the
same primitive ideal space T, and are Morita equivalent up to a 2-cocycle on T,
then their Picard groups relative to T are isomorphic.
","[{""version"":""v1"",""created"":""Mon, 8 Jun 2020 14:12:24 GMT""}]","2020-06-09"
"2006.04616","Orestis Alpos","Orestis Alpos, Christian Cachin","Consensus Beyond Thresholds: Generalized Byzantine Quorums Made Live","To appear in the proceedings of SRDS 2020",,,,"cs.DC","http://arxiv.org/licenses/nonexclusive-distrib/1.0/","  Existing Byzantine fault-tolerant (BFT) consensus protocols address only
threshold failures, where the participating nodes fail independently of each
other, each one fails equally likely, and the protocol's guarantees follow from
a simple bound on the number of faulty nodes. With the widespread deployment of
Byzantine consensus in blockchains and distributed ledgers today, however, more
sophisticated trust assumptions are needed.
  This paper presents the first implementation of BFT consensus with
generalized quorums. It starts from a number of generalized trust structures
motivated by practice and explores methods to specify and implement them
efficiently. In particular, it expresses the trust assumption by a monotone
Boolean formula (MBF) with threshold operators and by a monotone span program
(MSP), a linear-algebraic model for computation.
  An implementation of HotStuff BFT consensus using these quorum systems is
described as well and compared to the existing threshold model. Benchmarks with
HotStuff running on up to 40 replicas demonstrate that the MBF specification
incurs no significant slowdown, whereas the MSP expression affects latency and
throughput noticeably due to the involved computations.
","[{""version"":""v1"",""created"":""Mon, 8 Jun 2020 14:12:35 GMT""},{""version"":""v2"",""created"":""Mon, 3 Aug 2020 15:16:08 GMT""}]","2020-08-04"
"2006.04620","Hamidreza Keshavarz","Hamidreza Keshavarz, Mohammad Saniee Abadeh, Reza Rawassizadeh","SEFR: A Fast Linear-Time Classifier for Ultra-Low Power Devices",,,,,"cs.LG stat.ML","http://creativecommons.org/licenses/by/4.0/","  A fundamental challenge for running machine learning algorithms on
battery-powered devices is the time and energy limitations, as these devices
have constraints on resources. There are resource-efficient classifier
algorithms that can run on these devices, but their accuracy is often
sacrificed for resource efficiency. Here, we propose an ultra-low power
classifier, SEFR, with linear time complexity, both in the training and the
testing phases. SEFR is comparable to state-of-the-art classifiers in terms of
classification accuracy, but it is 63 times faster and 70 times more energy
efficient than the average of state-of-the-art and baseline classifiers on
binary class datasets. The energy and memory consumption of SEFR is very
insignificant, and it can even perform both train and test phases on
microcontrollers. To our knowledge, this is the first multipurpose
classification algorithm specifically designed to perform both training and
testing on ultra-low power devices.
","[{""version"":""v1"",""created"":""Mon, 8 Jun 2020 14:13:54 GMT""},{""version"":""v2"",""created"":""Thu, 19 Nov 2020 17:11:38 GMT""}]","2020-11-20"
"2006.04621","Pouya Bashivan","Pouya Bashivan, Reza Bayat, Adam Ibrahim, Kartik Ahuja, Mojtaba
  Faramarzi, Touraj Laleh, Blake Aaron Richards, Irina Rish","Adversarial Feature Desensitization","Accepted at Neurips 2021",,,,"cs.LG stat.ML","http://arxiv.org/licenses/nonexclusive-distrib/1.0/","  Neural networks are known to be vulnerable to adversarial attacks -- slight
but carefully constructed perturbations of the inputs which can drastically
impair the network's performance. Many defense methods have been proposed for
improving robustness of deep networks by training them on adversarially
perturbed inputs. However, these models often remain vulnerable to new types of
attacks not seen during training, and even to slightly stronger versions of
previously seen attacks. In this work, we propose a novel approach to
adversarial robustness, which builds upon the insights from the domain
adaptation field. Our method, called Adversarial Feature Desensitization (AFD),
aims at learning features that are invariant towards adversarial perturbations
of the inputs. This is achieved through a game where we learn features that are
both predictive and robust (insensitive to adversarial attacks), i.e. cannot be
used to discriminate between natural and adversarial data. Empirical results on
several benchmarks demonstrate the effectiveness of the proposed approach
against a wide range of attack types and attack strengths. Our code is
available at https://github.com/BashivanLab/afd.
","[{""version"":""v1"",""created"":""Mon, 8 Jun 2020 14:20:02 GMT""},{""version"":""v2"",""created"":""Mon, 28 Jun 2021 17:54:06 GMT""},{""version"":""v3"",""created"":""Tue, 4 Jan 2022 21:32:37 GMT""}]","2022-01-06"
