"2006.04455","Bo Zhao","Bo Zhao, Shixiang Tang, Dapeng Chen, Hakan Bilen, Rui Zhao","Continual Representation Learning for Biometric Identification",,"Proceedings of the IEEE/CVF Winter Conference on Applications of
  Computer Vision (WACV), 2021, pp. 1198-1208",,,"cs.CV","http://arxiv.org/licenses/nonexclusive-distrib/1.0/","  With the explosion of digital data in recent years, continuously learning new
tasks from a stream of data without forgetting previously acquired knowledge
has become increasingly important. In this paper, we propose a new continual
learning (CL) setting, namely ``continual representation learning'', which
focuses on learning better representation in a continuous way. We also provide
two large-scale multi-step benchmarks for biometric identification, where the
visual appearance of different classes are highly relevant. In contrast to
requiring the model to recognize more learned classes, we aim to learn feature
representation that can be better generalized to not only previously unseen
images but also unseen classes/identities. For the new setting, we propose a
novel approach that performs the knowledge distillation over a large number of
identities by applying the neighbourhood selection and consistency relaxation
strategies to improve scalability and flexibility of the continual learning
model. We demonstrate that existing CL methods can improve the representation
in the new setting, and our method achieves better results than the
competitors.
","[{""version"":""v1"",""created"":""Mon, 8 Jun 2020 10:18:06 GMT""},{""version"":""v2"",""created"":""Sun, 28 Jun 2020 19:54:51 GMT""}]","2021-03-09"
"2006.04456","Fan Yang","Fan Yang, Richard J. Long, Su-Su Shan, Jun-Qiang Ge, Rui Guo, Bo
  Zhang, Ji-Hua Gao, Xiang Ji, Ji-Feng Liu","Galaxy Optical Variability of Virgo Cluster: New Tracer for
  Environmental Influences on Galaxies","5 pages, 4 figures, in Press (accepted by MNRAS Letters)",,"10.1093/mnrasl/slaa083",,"astro-ph.GA","http://arxiv.org/licenses/nonexclusive-distrib/1.0/","  We investigate the relationship between the optical variability of galaxies
and their distances from the centre of the Virgo Cluster using Palomar
Transient Factory data. We define the ratio between the standard deviation of
the galaxy brightness and the mean value of the standard deviation as a measure
of a galaxy's optical variability. A sample of 814 Virgo galaxies with 230263
observations shows a monotonically decreasing trend of optical variability with
increasing clustercentric distance. The variability level inside the cluster is
3.2$\sigma$ higher than the level outside. We fit the variability with a linear
function and find that the data reject a distance-independent model. We examine
217 background galaxies for comparison and find no significant trend in galaxy
variability. We assess the relation with Monte Carlo simulation by rebuilding
the brightness of each galaxy. The simulation shows a monotonically decreasing
relation for member galaxy variability and a distance-independent relation for
background galaxies. Our result is consistent with the theory that the cold gas
flowing inwards the cluster centre fuels AGN activity. This work is a new
implementation of the method using optical variability to investigate the
relation between galaxies evolution and their environment.
","[{""version"":""v1"",""created"":""Mon, 8 Jun 2020 10:18:30 GMT""}]","2020-06-17"
"2006.04457","Tatsuro Kawakami","Tatsuro Kawakami, Masaru Nagaoka","On singularity types of del Pezzo surfaces with rational double points
  in positive characteristic","This preprint has been withdrawn by the authors because all results
  have been contained in our new preprint",,,,"math.AG","http://arxiv.org/licenses/nonexclusive-distrib/1.0/","  In this paper, we prove that a pair of the minimal resolution of a del Pezzo
surface with rational double points whose general anti-canonical member is
smooth and its exceptional divisor lifts to the Witt ring. We also classify a
del Pezzo surface with rational double points whose anti-canonical members are
all singular. As a corollary, we determine all singularity types of del Pezzo
surfaces with rational double points which only appear in positive
characteristic.
","[{""version"":""v1"",""created"":""Mon, 8 Jun 2020 10:18:37 GMT""},{""version"":""v2"",""created"":""Mon, 17 Aug 2020 08:56:51 GMT""}]","2020-08-18"
"2006.04458","Rafael Leon Greenblatt","Giovanni Antinucci, Alessandro Giuliani and Rafael Leon Greenblatt","Energy correlations of non-integrable Ising models: The scaling limit in
  the cylinder","89 pages. Substantial revisions throughout the manuscript","Communications in Mathematical Physics 397, 393-483 (2023)","10.1007/s00220-022-04481-z",,"math-ph cond-mat.stat-mech math.MP","http://arxiv.org/licenses/nonexclusive-distrib/1.0/","  We consider a class of non-integrable 2D Ising models, whose Hamiltonian, in
addition to the nearest neighbor couplings, includes weak multi-spin
interactions, even under spin flip. We study the model in cylindrical domains
of arbitrary aspect ratio and prove that, in the scaling limit, the multipoint
energy correlations converge to the same limiting correlations as those of the
nearest-neighbor Ising model in the cylinder with renormalized couplings, up to
an overall multiplicative constant, independent of the shape and size of the
domain. The proof is based on a representation of the generating function of
correlations in terms of a non-Gaussian Grassmann integral, and a constructive
Renormalization Group (RG) analysis thereof.
  A key technical novelty compared with previous works is a systematic analysis
of the effect of the boundary corrections to the RG flow, in particular a proof
that the scaling dimension of boundary operators is better by one dimension
than their bulk counterparts. A cancellation mechanism based on an approximate
image rule for the fermionic Green's function is of crucial importance for
controlling the RG flow of the marginal boundary terms.
","[{""version"":""v1"",""created"":""Mon, 8 Jun 2020 10:19:26 GMT""},{""version"":""v2"",""created"":""Mon, 19 Apr 2021 14:02:14 GMT""},{""version"":""v3"",""created"":""Tue, 20 Apr 2021 08:32:19 GMT""},{""version"":""v4"",""created"":""Mon, 25 Jul 2022 10:19:10 GMT""}]","2023-02-24"
"2006.04459","Timoth\'ee B\'enard","Timoth\'ee B\'enard (ENS Paris, UP11)","Transience in law for symmetric random walks in infinite measure","12 pages, 1 figure",,,,"math.DS math.PR","http://arxiv.org/licenses/nonexclusive-distrib/1.0/","  We consider a random walk on a second countable locally compact topological
space endowed with an invariant Radon measure. We show that if the walk is
symmetric and if every subset which is invariant by the walk has zero or
infinite measure, then one has escape of mass for almost every starting point.
We then apply this result in the context of homogeneous random walks on
infinite volume spaces, and deduce a converse to Eskin-Margulis recurrence
theorem.
","[{""version"":""v1"",""created"":""Mon, 8 Jun 2020 10:24:56 GMT""},{""version"":""v2"",""created"":""Wed, 10 Jun 2020 14:51:45 GMT""},{""version"":""v3"",""created"":""Sat, 6 Feb 2021 07:58:08 GMT""},{""version"":""v4"",""created"":""Fri, 7 Jan 2022 16:42:57 GMT""},{""version"":""v5"",""created"":""Sat, 15 Oct 2022 08:03:32 GMT""}]","2022-10-18"
"2006.04460","Zolt\'an Balogh","Gr\'eta Mezei, Zolt\'an Balogh, Andr\'as Magyarkuti, Andr\'as
  Halbritter","Voltage-controlled binary conductance switching in
  gold-4,4'-bipyridine-gold single-molecule nanowires",,,"10.1021/acs.jpclett.0c02185",,"cond-mat.mes-hall","http://arxiv.org/licenses/nonexclusive-distrib/1.0/","  We investigate gold-4,4'-bipyridine-gold single-molecule junctions with the
mechanically controllable break junction technique at cryogenic temperature
($T=4.2\,\text{K}$). We observe bistable probabilistic conductance switching
between the two molecular binding configurations, influenced both by the
mechanical actuation, and the applied voltage. We demonstrate that the relative
dominance of the two conductance states is tunable by the electrode
displacement, whereas the voltage manipulation induces an exponential speedup
of both switching times. The detailed investigation of the voltage-tunable
switching rates provides an insight into the possible switching mechanisms.
","[{""version"":""v1"",""created"":""Mon, 8 Jun 2020 10:28:35 GMT""}]","2020-09-15"
"2006.04461","Diego Salmer\'on","Diego Salmer\'on","Bayesian beta nonlinear models with constrained parameters to describe
  ruminal degradation kinetics",,"Diego Salmer\'on (2021) Bayesian beta nonlinear models with
  constrained parameters to describe ruminal degradation kinetics. Journal of
  Applied Statistics","10.1080/02664763.2021.1913105",,"stat.AP","http://arxiv.org/licenses/nonexclusive-distrib/1.0/","  The models used to describe the kinetics of ruminal degradation are usually
nonlinear models where the dependent variable is the proportion of degraded
food. The method of least squares is the standard approach used to estimate the
unknown parameters but this method can lead to unacceptable predictions. To
solve this issue, a beta nonlinear model and the Bayesian perspective is
proposed in this article. The application of standard methodologies to obtain
prior distributions, such as the Jeffreys prior or the reference priors,
involves serious difficulties here because this model is a nonlinear non-normal
regression model, and the constrained parameters appear in the log-likelihood
function through the Gamma function. This paper proposes an objective method to
obtain the prior distribution, which can be applied to other models with
similar complexity, can be easily implemented in OpenBUGS, and solves the
problem of unacceptable predictions. The model is generalized to a larger class
of models. The methodology was applied to real data with three models that were
compared using the Deviance Information Criterion and the root mean square
prediction error. A simulation study was performed to evaluate the coverage of
the credible intervals.
","[{""version"":""v1"",""created"":""Mon, 8 Jun 2020 10:35:27 GMT""},{""version"":""v2"",""created"":""Tue, 20 Jul 2021 11:18:08 GMT""}]","2021-07-21"
"2006.04462","Jiashuo Shi","Jiashuo Shi","A Diffractive Neural Network with Weight-Noise-Injection Training",,,,,"eess.IV cs.LG cs.NE","http://arxiv.org/licenses/nonexclusive-distrib/1.0/","  We propose a diffractive neural network with strong robustness based on
Weight Noise Injection training, which achieves accurate and fast optical-based
classification while diffraction layers have a certain amount of surface shape
error. To the best of our knowledge, it is the first time that using injection
weight noise during training to reduce the impact of external interference on
deep learning inference results. In the proposed method, the diffractive neural
network learns the mapping between the input image and the label in Weight
Noise Injection mode, making the network's weight insensitive to modest
changes, which improve the network's noise resistance at a lower cost. By
comparing the accuracy of the network under different noise, it is verified
that the proposed network (SRNN) still maintains a higher accuracy under
serious noise.
","[{""version"":""v1"",""created"":""Mon, 8 Jun 2020 10:41:29 GMT""},{""version"":""v2"",""created"":""Wed, 10 Jun 2020 05:44:55 GMT""},{""version"":""v3"",""created"":""Sat, 20 Jun 2020 10:09:27 GMT""}]","2020-06-23"
"2006.04463","Teet Kuutma","Teet Kuutma, Anup Poudel, Maret Einasto, Pekka Hein\""am\""aki, Heidi
  Lietzen, Antti Tamm, and Elmo Tempel","Properties of brightest group galaxies in cosmic web filaments","11 pages, 9 figures, Accepted for publication in A&A","A&A 639, A71 (2020)","10.1051/0004-6361/201937282",,"astro-ph.GA","http://arxiv.org/licenses/nonexclusive-distrib/1.0/","  Context. The cosmic web, a complex network of galaxy groups and clusters
connected by filaments, is a dynamical environment in which galaxies form and
evolve. However, the impact of cosmic filaments on the properties of galaxies
is difficult to study because of the much more influential local (galaxy-group
scale) environment.
  Aims. The aim of this paper is to investigate the dependence of intrinsic
galaxy properties on distance to the nearest cosmic web filament, using a
sample of galaxies for which the local environment is easily assessable.}
  Methods. Our study is based on a volume-limited galaxy sample with
$M_\mathrm{r}$ $\leq -19$ mag, drawn from the SDSS DR12. We chose brightest
group galaxies (BGGs) in groups with two to six members as our probes of the
impact of filamentary environment because their local environment can be
determined more accurately. We use the Bisous marked point process method to
detect cosmic-web filaments with radii of $0.5-1.0$ Mpc and measure the
perpendicular filament spine distance ($D_{\mathrm{fil}}$) for the BGGs. We
limit our study to $D_{\mathrm{fil}}$ values up to 4 Mpc. We use the luminosity
density field as a tracer of the local environment. To achieve uniformity of
the sample and to reduce potential biases we only consider filaments longer
than 5 Mpc. Our final sample contains 1427 BGGs.
  Results. We note slight deviations between the galaxy populations inside and
outside the filament radius in terms of stellar mass, colour, the 4000AA break,
specific star formation rates, and morphologies. However, all these differences
remain below 95% confidence and are negligible compared to the effects arising
from local environment density.
  Conclusions. Within a 4 Mpc radius of the filament axes, the effect of
filaments on BGGs is marginal. The local environment is the main factor in
determining BGG properties.
","[{""version"":""v1"",""created"":""Mon, 8 Jun 2020 10:42:36 GMT""}]","2020-07-22"
"2006.04464","Vishwajeet Jha","Vishwajeet Jha","Forecasting the transmission of Covid-19 in India using a data driven
  SEIRD model",,,,,"q-bio.PE physics.soc-ph","http://arxiv.org/licenses/nonexclusive-distrib/1.0/","  The infections and fatalities due to SARS-CoV-2 virus for cases specific to
India have been studied using a deterministic
susceptible-exposed-infected-recovered-dead (SEIRD) compartmental model. One of
the most significant epidemiological parameter, namely the effective
reproduction number of the infection is extracted from the daily growth rate
data of reported infections and it is included in the model with a time
variation. We evaluate the effect of control interventions implemented till now
and estimate the case numbers for infections and deaths averted by these
restrictive measures. We further provide a forecast on the extent of the future
Covid-19 transmission in India and predict the probable numbers of infections
and fatalities under various potential scenarios.
","[{""version"":""v1"",""created"":""Mon, 8 Jun 2020 10:42:40 GMT""}]","2020-06-09"
"2006.04465","Karin Schaller","Victor Batyrev, Karin Schaller","Mirror symmetry for quasi-smooth Calabi-Yau hypersurfaces in weighted
  projective spaces","20 pages, 2 figures",,"10.1016/j.geomphys.2021.104198",,"math.AG math-ph math.CO math.MP math.NT","http://arxiv.org/licenses/nonexclusive-distrib/1.0/","  We consider a $d$-dimensional well-formed weighted projective space
$\mathbb{P}(\overline{w})$ as a toric variety associated with a fan
$\Sigma(\overline{w})$ in $N_{\overline{w}} \otimes \mathbb{N}$ whose
$1$-dimensional cones are spanned by primitive vectors $v_0, v_1, \ldots, v_d
\in N_{\overline{w}}$ generating a lattice $N_{\overline{w}}$ and satisfying
the linear relation $\sum_i w_i v_i =0$. For any fixed dimension $d$, there
exist only finitely many weight vectors $\overline{w} = (w_0, \ldots, w_d)$
such that $\mathbb{P}(\overline{w})$ contains a quasi-smooth Calabi-Yau
hypersurface $X_w$ defined by a transverse weighted homogeneous polynomial $W$
of degree $w = \sum_{i=0}^d w_i$. Using a formula of Vafa for the orbifold
Euler number $\chi_{\rm orb}(X_w)$, we show that for any quasi-smooth
Calabi-Yau hypersurface $X_w$ the number $(-1)^{d-1}\chi_{\rm orb}(X_w)$ equals
the stringy Euler number $\chi_{\rm str}(X_{\overline{w}}^*)$ of Calabi-Yau
compactifications $X_{\overline{w}}^*$ of affine toric hypersurfaces
$Z_{\overline{w}}$ defined by non-degenerate Laurent polynomials
$f_{\overline{w}} \in \mathbb{C}[N_{\overline{w}}]$ with Newton polytope
$\text{conv}(\{v_0, \ldots, v_d\})$. In the moduli space of Laurent polynomials
$f_{\overline{w}}$ there always exists a special point $f_{\overline{w}}^0$
defining a mirror $X_{\overline{w}}^*$ with a $\mathbb{Z}/w\mathbb{Z}$-symmetry
group such that $X_{\overline{w}}^*$ is birational to a quotient of a Fermat
hypersurface via a Shioda map.
","[{""version"":""v1"",""created"":""Mon, 8 Jun 2020 10:43:56 GMT""}]","2021-04-07"
"2006.04466","Weiyu Cheng","Weiyu Cheng, Yanyan Shen, Linpeng Huang","Differentiable Neural Input Search for Recommender Systems",,,,,"cs.LG cs.IR","http://arxiv.org/licenses/nonexclusive-distrib/1.0/","  Latent factor models are the driving forces of the state-of-the-art
recommender systems, with an important insight of vectorizing raw input
features into dense embeddings. The dimensions of different feature embeddings
are often set to a same value empirically, which limits the predictive
performance of latent factor models. Existing works have proposed heuristic or
reinforcement learning-based methods to search for mixed feature embedding
dimensions. For efficiency concern, these methods typically choose embedding
dimensions from a restricted set of candidate dimensions. However, this
restriction will hurt the flexibility of dimension selection, leading to
suboptimal performance of search results. In this paper, we propose
Differentiable Neural Input Search (DNIS), a method that searches for mixed
feature embedding dimensions in a more flexible space through continuous
relaxation and differentiable optimization. The key idea is to introduce a soft
selection layer that controls the significance of each embedding dimension, and
optimize this layer according to model's validation performance. DNIS is
model-agnostic and thus can be seamlessly incorporated with existing latent
factor models for recommendation. We conduct experiments with various
architectures of latent factor models on three public real-world datasets for
rating prediction, Click-Through-Rate (CTR) prediction, and top-k item
recommendation. The results demonstrate that our method achieves the best
predictive performance compared with existing neural input search approaches
with fewer embedding parameters and less time cost.
","[{""version"":""v1"",""created"":""Mon, 8 Jun 2020 10:43:59 GMT""},{""version"":""v2"",""created"":""Thu, 10 Sep 2020 11:23:13 GMT""}]","2020-09-11"
"2006.04467","JungYun Han","JungYun Han, Andrey A. Sukhorukov, and Daniel Leykam","Disorder-Protected Quantum State Transmission through Helical
  Coupled-Resonator Waveguides","9 pages, 5 figures","Photonics Research 8, B15-B24 (2020)","10.1364/PRJ.399919",,"quant-ph cond-mat.dis-nn physics.optics","http://arxiv.org/licenses/nonexclusive-distrib/1.0/","  We predict the preservation of temporal indistinguishability of photons
propagating through helical coupled-resonator optical waveguides (H-CROWs).
H-CROWs exhibit a pseudospin-momentum locked dispersion, which we show
suppresses onsite disorder-induced backscattering and group velocity
fluctuations. We simulate numerically the propagation of two-photon
wavepackets, demonstrating that they exhibit almost perfect Hong-Ou-Mandel dip
visibility and then can preserve their quantum coherence even in the presence
of moderate disorder, in contrast to regular CROWs which are highly sensitive
to disorder. As indistinguishability is the most fundamental resource of
quantum information processing, H-CROWs may find applications for the
implementation of robust optical links and delay lines in the emerging quantum
photonic communication and computational platforms.
","[{""version"":""v1"",""created"":""Mon, 8 Jun 2020 10:44:58 GMT""}]","2020-11-04"
"2006.04468","Dr John Stephen Kayode","John Stephen Kayode, Asha Embrandiri, and Adijat Olubukola Olateju","The Covid-19 pandemic's effects on poor rural dwellers in sub-Saharan
  Africa: A case study of access to basic clean water, sanitary systems and
  hand-washing facilities","The manuscript has 15 pages, 10 figures, 1 Table, 5705 Words, 628
  Lines, 178 Paragraphs, 31274 Characters without space, 36926 Characters
  including spaces",,,,"cs.CY","http://creativecommons.org/licenses/by/4.0/","  The fear of the invisible but prevalent Coronavirus (COVID-19), disease
cannot be overemphasized since there is the potential possibility of it wiping
out the entire world population within a few months if adequate and quick steps
are not taken to curb this menace, and the sub-Saharan African (SSAn) region is
no exception. It is evident that water, as an essential daily commodity, has
long been in a state of emergency in SSAn nations, which is largely attributed
to decades of neglect by the successive governments, because it has not been
possible to separate the existing bond between water, health, livelihood and
the economy. The laudable Millennium Development Goals (MDGs) proposed by the
United Nations had yet to achieve the stated objective of improving the
standards of living and health conditions of the rural communities in the SSAn
region before the COVID-19 pandemic outbreak. This failure has been masked by a
sort of delusion in which the people of this region are subjected to the
hardship of searching for clean and healthy water in their own ponds, rivers,
streams and shallow hand-dug local wells on a continuous basis. Less than 17%
of the rural population in all the SSAn communities can access basic
hand-washing facilities and sanitation systems. The total water productivity,
as measured by the Gross Domestic Product (GDP) per cubic meter of total
freshwater withdrawn, for the people was less than 5 GDP.
","[{""version"":""v1"",""created"":""Mon, 8 Jun 2020 10:46:39 GMT""}]","2020-06-09"
"2006.04469","Muhammed Shifas Pv","Muhammed PV Shifas, Nagaraj Adiga, Vassilis Tsiaras, Yannis Stylianou","A non-causal FFTNet architecture for speech enhancement","5 pages",,"10.21437/Interspeech.2019-2622",,"eess.AS cs.CL cs.SD","http://arxiv.org/licenses/nonexclusive-distrib/1.0/","  In this paper, we suggest a new parallel, non-causal and shallow waveform
domain architecture for speech enhancement based on FFTNet, a neural network
for generating high quality audio waveform. In contrast to other waveform based
approaches like WaveNet, FFTNet uses an initial wide dilation pattern. Such an
architecture better represents the long term correlated structure of speech in
the time domain, where noise is usually highly non-correlated, and therefore it
is suitable for waveform domain based speech enhancement. To further strengthen
this feature of FFTNet, we suggest a non-causal FFTNet architecture, where the
present sample in each layer is estimated from the past and future samples of
the previous layer. By suggesting a shallow network and applying non-causality
within certain limits, the suggested FFTNet for speech enhancement (SE-FFTNet)
uses much fewer parameters compared to other neural network based approaches
for speech enhancement like WaveNet and SEGAN. Specifically, the suggested
network has considerably reduced model parameters: 32% fewer compared to
WaveNet and 87% fewer compared to SEGAN. Finally, based on subjective and
objective metrics, SE-FFTNet outperforms WaveNet in terms of enhanced signal
quality, while it provides equally good performance as SEGAN. A Tensorflow
implementation of the architecture is provided at 1 .
","[{""version"":""v1"",""created"":""Mon, 8 Jun 2020 10:49:04 GMT""}]","2020-06-09"
"2006.04470","Basudeb Datta Prof.","Basudeb Datta","Constructions of $d$-spheres from $(d-1)$-spheres and $d$-balls with
  same set of vertices","Title is changed. Question 2, Theorem 8 and Section 4 are new. New
  references added",,,,"math.GT math.AT","http://arxiv.org/licenses/nonexclusive-distrib/1.0/","  Given a combinatorial $(d-1)$-sphere $S$, to construct a combinatorial
$d$-sphere $S^{\hspace{.2mm}\prime}$ containing $S$, one usually needs some
more vertices. Here we consider the question whether we can do one such
construction without the help of any additional vertices. We show that this
question has affirmative answer when $S$ is a flag sphere, a stacked sphere or
a join of spheres. We also consider the question whether we can construct an
$n$-vertex combinatorial $d$-sphere containing a given $n$-vertex combinatorial
$d$-ball.
","[{""version"":""v1"",""created"":""Mon, 8 Jun 2020 10:59:35 GMT""},{""version"":""v2"",""created"":""Tue, 30 Jun 2020 11:52:34 GMT""}]","2020-07-01"
