"2006.10133","John P. S. Peterson","John P. S. Peterson, Hemant Katiyar and Raymond Laflamme","Fast Simulation of Magnetic Field Gradients for Optimization of Pulse
  Sequences","12 pages, 10 figures",,,,"quant-ph","http://arxiv.org/licenses/nonexclusive-distrib/1.0/","  We study how to simulate, efficiently, pulse field gradients (PFG) used in
nuclear magnetic resonance (NMR). An efficient simulation requires
discretization in time and space. We study both discretizations and provide a
guideline to choose best discretization values depending on the precision
required experimentally. We provide a theoretical study and simulation showing
the minimum number of divisions we need in space for simulating, with high
precision, a sequence composed of several unitary evolution and PFG. We show
that the fast simulation of PFG allow us to optimize sequences composed of PFG,
radio-frequency pulses and free evolution, to implement non-unitary evolution
(quantum channels). As an evidence of the success of our work, we performed two
types of experiments. First, we implement two quantum channels and compare the
results with their theoretical predictions. In the second experiment, we used
the fast simulation of PFG to optimize and implement a sequence to prepare
pseudo pure state with better signal to noise ratio than any known procedure
till now.
","[{""version"":""v1"",""created"":""Wed, 17 Jun 2020 20:02:39 GMT""}]","2020-06-19"
"2006.10136","John P. S. Peterson","John P. S. Peterson, Roberto S. Sarthour and Raymond Laflamme","Implementation of a Quantum Engine Fuelled by Information","5 pages, 4 figures",,,,"quant-ph cond-mat.stat-mech","http://arxiv.org/licenses/nonexclusive-distrib/1.0/","  Here, we show the implementation of a complete cycle of a quantum engine
fuelled by information. This engine is a quantum version of the Szilard engine,
where information is used to extract heat from the environment and fully
convert it into work. In our experiment, this work is used to make a weight,
initially in the ground state, reach its excited state. We measure the energy
and the state of each component of the engine, after each step of the cycle,
and compare them with the theoretical prediction to show that the cycle is
implemented with high precision. We also perform experiments to show that the
engine is well isolated from the environment after the heat extraction, and we
measure the entropy of the weight to show the full conversion of heat into
work. Thus, we successfully demonstrate that information can be used as a fuel
for single-reservoir engines.
","[{""version"":""v1"",""created"":""Wed, 17 Jun 2020 20:08:41 GMT""}]","2020-06-19"
"2006.10137","Chengxi Zang","Chengxi Zang and Fei Wang","MoFlow: An Invertible Flow Model for Generating Molecular Graphs",,,"10.1145/3394486.3403104",,"stat.ML cs.LG physics.chem-ph","http://arxiv.org/licenses/nonexclusive-distrib/1.0/","  Generating molecular graphs with desired chemical properties driven by deep
graph generative models provides a very promising way to accelerate drug
discovery process. Such graph generative models usually consist of two steps:
learning latent representations and generation of molecular graphs. However, to
generate novel and chemically-valid molecular graphs from latent
representations is very challenging because of the chemical constraints and
combinatorial complexity of molecular graphs. In this paper, we propose MoFlow,
a flow-based graph generative model to learn invertible mappings between
molecular graphs and their latent representations. To generate molecular
graphs, our MoFlow first generates bonds (edges) through a Glow based model,
then generates atoms (nodes) given bonds by a novel graph conditional flow, and
finally assembles them into a chemically valid molecular graph with a posthoc
validity correction. Our MoFlow has merits including exact and tractable
likelihood training, efficient one-pass embedding and generation, chemical
validity guarantees, 100\% reconstruction of training data, and good
generalization ability. We validate our model by four tasks: molecular graph
generation and reconstruction, visualization of the continuous latent space,
property optimization, and constrained property optimization. Our MoFlow
achieves state-of-the-art performance, which implies its potential efficiency
and effectiveness to explore large chemical space for drug discovery.
","[{""version"":""v1"",""created"":""Wed, 17 Jun 2020 20:14:19 GMT""}]","2020-06-19"
"2006.10138","Qi Qi","Qi Qi, Zhishuai Guo, Yi Xu, Rong Jin, Tianbao Yang","An Online Method for A Class of Distributionally Robust Optimization
  with Non-Convex Objectives","25 pages, 9 figures",,,,"cs.LG cs.CV stat.ML","http://arxiv.org/licenses/nonexclusive-distrib/1.0/","  In this paper, we propose a practical online method for solving a class of
distributionally robust optimization (DRO) with non-convex objectives, which
has important applications in machine learning for improving the robustness of
neural networks. In the literature, most methods for solving DRO are based on
stochastic primal-dual methods. However, primal-dual methods for DRO suffer
from several drawbacks: (1) manipulating a high-dimensional dual variable
corresponding to the size of data is time expensive; (2) they are not friendly
to online learning where data is coming sequentially. To address these issues,
we consider a class of DRO with an KL divergence regularization on the dual
variables, transform the min-max problem into a compositional minimization
problem, and propose practical duality-free online stochastic methods without
requiring a large mini-batch size. We establish the state-of-the-art
complexities of the proposed methods with and without a Polyak-\L ojasiewicz
(PL) condition of the objective. Empirical studies on large-scale deep learning
tasks (i) demonstrate that our method can speed up the training by more than 2
times than baseline methods and save days of training time on a large-scale
dataset with $\sim$ 265K images, and (ii) verify the supreme performance of DRO
over Empirical Risk Minimization (ERM) on imbalanced datasets. Of independent
interest, the proposed method can be also used for solving a family of
stochastic compositional problems with state-of-the-art complexities.
","[{""version"":""v1"",""created"":""Wed, 17 Jun 2020 20:19:25 GMT""},{""version"":""v2"",""created"":""Mon, 12 Oct 2020 07:15:56 GMT""},{""version"":""v3"",""created"":""Fri, 20 Nov 2020 20:39:47 GMT""},{""version"":""v4"",""created"":""Tue, 24 Nov 2020 22:24:01 GMT""},{""version"":""v5"",""created"":""Fri, 12 Nov 2021 15:52:00 GMT""}]","2021-11-15"
"2006.10139","Christian Flores","Christian Flores, Bo Reipurth, and Michael S. Connelley","Is T Tauri North a 'Classical' T Tauri star?","18 pages, 9 figures, 3 tables",,"10.3847/1538-4357/ab9e67",,"astro-ph.SR","http://arxiv.org/licenses/nonexclusive-distrib/1.0/","  We present high-resolution $H$- and $K$-band spectroscopic observations of
the archetypal T Tauri star T Tau North. Synthetic spectral modeling is used to
derive the $K$-band temperature, surface gravity, magnetic field strength, and
rotational velocity for this star. The $K$-band spectroscopic temperature
measured is $\rm T_{K\text{-band}} = 3976 \pm 90 K$, which is $\sim 1000 \, \rm
K$ cooler than the temperature measured from optical observations. Our $K$-band
temperature measurement for T Tau N is confirmed using equivalent width line
ratio vs. temperature relations in the $H$-band, from which a $\rm
T_{H\text{-band}} = 4085 \pm 155 K$ is derived. This optical vs. IR temperature
difference is interpreted as cool or hot spots, or both, covering a significant
part of the surface of T Tau N. The gravity derived for T Tau N $\log{g}=3.45
\pm 0.14$ is lower than the gravity of nearly every other star in a sample of
24 classical T Tauri stars in Taurus. Combining these temperature and gravity
results with magnetic stellar evolutionary models, we find the age of T Tau N
to be less than 1 Myr old. These results suggest that T Tau N is in an earlier
evolutionary stage than most classical T Tauri stars in Taurus, arguing that it
is a protostar ejected from the embedded southern binary system shortly after
its formation.
","[{""version"":""v1"",""created"":""Wed, 17 Jun 2020 20:28:38 GMT""}]","2020-08-05"
"2006.10140","Greg Taylor","V. Dike, G.B. Taylor, J. Dowell, and K. Stovall","Detecting Pulsar Polarization below 100 MHz with the Long Wavelength
  Array","15 pages, accepted to MNRAS",,"10.1093/mnras/staa1788",,"astro-ph.HE astro-ph.IM","http://arxiv.org/licenses/nonexclusive-distrib/1.0/","  Using the first station of the Long Wavelength Array (LWA1), we examine
polarized pulsar emission between 25 and 88 MHz. Polarized light from pulsars
undergoes Faraday rotation as it passes through the magnetized interstellar
medium. Observations from low frequency telescopes are ideal for obtaining
precise rotation measures (RMs) because the effect of Faraday rotation is
proportional to the square of the observing wavelength. With these RMs, we
obtained polarized pulse profiles to see how polarization changes in the 25-88
MHz range. The RMs were also used to derive values for the electron density
weighted average Galactic magnetic field along the line of sight. We present
rotation measures and polarization profiles of 15 pulsars acquired using data
from LWA1. These results provide new insight into low-frequency polarization
characteristics and pulsar emission heights, and complement measurements at
higher frequencies.
","[{""version"":""v1"",""created"":""Wed, 17 Jun 2020 20:29:59 GMT""}]","2020-07-01"
"2006.10141","Wei Jin","Wei Jin, Tyler Derr, Haochen Liu, Yiqi Wang, Suhang Wang, Zitao Liu,
  Jiliang Tang","Self-supervised Learning on Graphs: Deep Insights and New Direction",,,,,"cs.LG stat.ML","http://arxiv.org/licenses/nonexclusive-distrib/1.0/","  The success of deep learning notoriously requires larger amounts of costly
annotated data. This has led to the development of self-supervised learning
(SSL) that aims to alleviate this limitation by creating domain specific
pretext tasks on unlabeled data. Simultaneously, there are increasing interests
in generalizing deep learning to the graph domain in the form of graph neural
networks (GNNs). GNNs can naturally utilize unlabeled nodes through the simple
neighborhood aggregation that is unable to thoroughly make use of unlabeled
nodes. Thus, we seek to harness SSL for GNNs to fully exploit the unlabeled
data. Different from data instances in the image and text domains, nodes in
graphs present unique structure information and they are inherently linked
indicating not independent and identically distributed (or i.i.d.). Such
complexity is a double-edged sword for SSL on graphs. On the one hand, it
determines that it is challenging to adopt solutions from the image and text
domains to graphs and dedicated efforts are desired. On the other hand, it
provides rich information that enables us to build SSL from a variety of
perspectives. Thus, in this paper, we first deepen our understandings on when,
why, and which strategies of SSL work with GNNs by empirically studying
numerous basic SSL pretext tasks on graphs. Inspired by deep insights from the
empirical studies, we propose a new direction SelfTask to build advanced
pretext tasks that are able to achieve state-of-the-art performance on various
real-world datasets. The specific experimental settings to reproduce our
results can be found in \url{https://github.com/ChandlerBang/SelfTask-GNN}.
","[{""version"":""v1"",""created"":""Wed, 17 Jun 2020 20:30:04 GMT""}]","2020-06-19"
"2006.10142","Niyaz Tokmagambetov","Arshyn Altybay, Michael Ruzhansky, Niyaz Tokmagambetov","A parallel hybrid implementation of the 2D acoustic wave equation","10 pages; 1 Chart; 1 Table; 1 Listing; 1 Algorithm",,,,"physics.comp-ph cs.NA math.AP math.NA","http://arxiv.org/licenses/nonexclusive-distrib/1.0/","  In this paper, we propose a hybrid parallel programming approach for a
numerical solution of a two-dimensional acoustic wave equation using an
implicit difference scheme for a single computer. The calculations are carried
out in an implicit finite difference scheme. First, we transform the
differential equation into an implicit finite-difference equation and then
using the ADI method, we split the equation into two sub-equations. Using the
cyclic reduction algorithm, we calculate an approximate solution. Finally, we
change this algorithm to parallelize on GPU, GPU+OpenMP, and Hybrid
(GPU+OpenMP+MPI) computing platforms.
  The special focus is on improving the performance of the parallel algorithms
to calculate the acceleration based on the execution time. We show that the
code that runs on the hybrid approach gives the expected results by comparing
our results to those obtained by running the same simulation on a classical
processor core, CUDA, and CUDA+OpenMP implementations.
","[{""version"":""v1"",""created"":""Wed, 17 Jun 2020 20:30:11 GMT""}]","2020-06-19"
"2006.10144","Carolin Gold","Carolin Gold (1), Annika Kurzmann (1), Kenji Watanabe (2), Takashi
  Taniguchi (2), Klaus Ensslin (1), Thomas Ihn (1) ((1) ETH Zurich, Switzerland
  (2) National Institute for Material Science, Tsukuba, Japan)","Scanning Gate Microscopy of Localized States in a gate-defined Bilayer
  Graphene Channel",,"Phys. Rev. Research 2, 043380 (2020)","10.1103/PhysRevResearch.2.043380",,"cond-mat.mes-hall","http://arxiv.org/licenses/nonexclusive-distrib/1.0/","  We use Scanning Gate Microscopy to demonstrate the presence of localized
states arising from potential inhomogeneities in a 50nm-wide, gate-defined
conducting channel in encapsulated bilayer graphene. When imaging the channel
conductance under the influence of a local tip-induced potential, we observe
ellipses of enhanced conductance as a function of the tip position. These
ellipses allow us to infer the location of the localized states and to study
their dependence on the displacement field. For large displacement fields, we
observe that localized states tend to occur halfway into the channel. All our
observations can be well explained within the framework of stochastic Coulomb
blockade.
","[{""version"":""v1"",""created"":""Wed, 17 Jun 2020 20:41:50 GMT""}]","2021-01-04"
"2006.10145","\'Eloi Brassard-Gourdeau","\'Eloi Brassard-Gourdeau, Richard Khoury","Using Sentiment Information for Preemptive Detection of Toxic Comments
  in Online Conversations",,,,,"cs.SI cs.CL","http://arxiv.org/licenses/nonexclusive-distrib/1.0/","  The challenge of automatic detection of toxic comments online has been the
subject of a lot of research recently, but the focus has been mostly on
detecting it in individual messages after they have been posted. Some authors
have tried to predict if a conversation will derail into toxicity using the
features of the first few messages. In this paper, we combine that approach
with previous work on toxicity detection using sentiment information, and show
how the sentiments expressed in the first messages of a conversation can help
predict upcoming toxicity. Our results show that adding sentiment features does
help improve the accuracy of toxicity prediction, and also allow us to make
important observations on the general task of preemptive toxicity detection.
","[{""version"":""v1"",""created"":""Wed, 17 Jun 2020 20:41:57 GMT""}]","2020-06-20"
"2006.10146","Daniel Gordon","Daniel Gordon and Bahman Hafizi","Special unitary particle pusher for extreme fields",,,"10.1016/j.cpc.2020.107628",,"physics.comp-ph physics.plasm-ph","http://arxiv.org/licenses/nonexclusive-distrib/1.0/","  An exact momentum update useful for particle codes was previously given. The
expressions involved were unwieldy. By treating the momentum as a
representation of SU(2)xSU(2) instead of SO(3,1), a more compact expression for
the exact momentum update is obtained. An expansion in powers of the timestep
can be formulated such that invariance properties are exactly preserved, and
push rates comparable to the standard Boris pusher are obtained.
","[{""version"":""v1"",""created"":""Wed, 17 Jun 2020 20:44:20 GMT""}]","2020-09-29"
"2006.10147","Radu Tudor Ionescu","Nicolae-C\u{a}t\u{a}lin Ristea, Radu Tudor Ionescu","Are you wearing a mask? Improving mask detection from speech using
  augmentation by cycle-consistent GANs","Accepted at INTERSPEECH 2020",,,,"eess.AS cs.CV cs.SD","http://arxiv.org/licenses/nonexclusive-distrib/1.0/","  The task of detecting whether a person wears a face mask from speech is
useful in modelling speech in forensic investigations, communication between
surgeons or people protecting themselves against infectious diseases such as
COVID-19. In this paper, we propose a novel data augmentation approach for mask
detection from speech. Our approach is based on (i) training Generative
Adversarial Networks (GANs) with cycle-consistency loss to translate unpaired
utterances between two classes (with mask and without mask), and on (ii)
generating new training utterances using the cycle-consistent GANs, assigning
opposite labels to each translated utterance. Original and translated
utterances are converted into spectrograms which are provided as input to a set
of ResNet neural networks with various depths. The networks are combined into
an ensemble through a Support Vector Machines (SVM) classifier. With this
system, we participated in the Mask Sub-Challenge (MSC) of the INTERSPEECH 2020
Computational Paralinguistics Challenge, surpassing the baseline proposed by
the organizers by 2.8%. Our data augmentation technique provided a performance
boost of 0.9% on the private test set. Furthermore, we show that our data
augmentation approach yields better results than other baseline and
state-of-the-art augmentation methods.
","[{""version"":""v1"",""created"":""Wed, 17 Jun 2020 20:46:50 GMT""},{""version"":""v2"",""created"":""Sat, 25 Jul 2020 21:52:21 GMT""}]","2020-07-28"
"2006.10148","Christopher Kenny","Benjamin Fifield, Kosuke Imai, Jun Kawahara, Christopher T. Kenny","The Essential Role of Empirical Validation in Legislative Redistricting
  Simulation","32 pages, 14 figures",,,,"stat.AP cs.CY","http://arxiv.org/licenses/nonexclusive-distrib/1.0/","  As granular data about elections and voters become available, redistricting
simulation methods are playing an increasingly important role when legislatures
adopt redistricting plans and courts determine their legality. These simulation
methods are designed to yield a representative sample of all redistricting
plans that satisfy statutory guidelines and requirements such as contiguity,
population parity, and compactness. A proposed redistricting plan can be
considered gerrymandered if it constitutes an outlier relative to this sample
according to partisan fairness metrics. Despite their growing use, an
insufficient effort has been made to empirically validate the accuracy of the
simulation methods. We apply a recently developed computational method that can
efficiently enumerate all possible redistricting plans and yield an independent
uniform sample from this population. We show that this algorithm scales to a
state with a couple of hundred geographical units. Finally, we empirically
examine how existing simulation methods perform on realistic validation data
sets.
","[{""version"":""v1"",""created"":""Wed, 17 Jun 2020 20:51:43 GMT""}]","2020-06-19"
"2006.10149","Arpon Paul","Arpon Paul, Sezen Sekmen and Gokhan Unel","Down type iso-singlet quarks at the HL-LHC and FCC-hh","13 pages, 10 figures",,"10.1140/epjc/s10052-021-08982-4",,"hep-ph","http://creativecommons.org/licenses/by/4.0/","  We study the discovery potential of down type iso-singlet quarks, $D$,
predicted by the $E_6$ GUT model in the ${pp\rightarrow D\bar{D}\rightarrow
ZZd\bar{d} \rightarrow \ell^+\ell^-\ell^+\ell^- d\bar{d}}$ channel at the
HL-LHC and FCC-hh colliders. The analysis is performed using a high level
analysis description language and its runtime interpreter. The study shows
that, using solely this channel, HL-LHC can discover $D$ quarks up to a mass of
710 GeV whereas FCC-hh up to 2430 GeV with data collected in their complete run
periods.
","[{""version"":""v1"",""created"":""Wed, 17 Jun 2020 20:52:42 GMT""},{""version"":""v2"",""created"":""Sat, 8 May 2021 20:12:52 GMT""}]","2021-05-11"
"2006.10150","Li Li","Li Li","Determining The Magnetic Potential In The Fractional Magnetic Calder\'on
  Problem","10 pages","Comm. Partial Differential Equations, 46 (2021), pp.1017-1026","10.1080/03605302.2020.1857406",,"math.AP","http://arxiv.org/licenses/nonexclusive-distrib/1.0/","  We determine both the magnetic potential and the electric potential from the
exterior partial measurements of the Dirichlet-to-Neumann map in the fractional
linear magnetic Calder\'on problem by using an integral identity. We also
determine both the magnetic potential and the nonlinearity in the fractional
semilinear magnetic Calder\'on problem by using a first order linearization.
","[{""version"":""v1"",""created"":""Wed, 17 Jun 2020 20:56:45 GMT""},{""version"":""v2"",""created"":""Thu, 3 Jun 2021 18:42:45 GMT""}]","2021-06-07"
"2006.10151","Moritz Braun","M. Braun, A.-S. Milakovi\'c, F. Renken, W. Fricke, S. Ehlers","Application of Local Approaches to the Assessment of Fatigue Test
  results obtained for Welded Joints at Sub-Zero Temperatures",,,"10.1016/j.ijfatigue.2020.105672",,"physics.app-ph","http://arxiv.org/licenses/nonexclusive-distrib/1.0/","  Several studies have found significant increase in the fatigue strength of
welded joints of structural steels at sub-zero temperatures. This study
addresses the research by investigating the applicability of local fatigue
assessment methods to welded joints exposed to sub-zero temperatures. For this
purpose, fatigue test results of two fillet weld details with weld toe and weld
root failure are evaluated at a range of temperatures using a variety of
structural hot-spot and notch stress approaches, then are compared to the
nominal stress approach. Large differences in prediction accuracy are found for
the analysed assessment methods and both failure locations.
","[{""version"":""v1"",""created"":""Wed, 17 Jun 2020 20:57:57 GMT""}]","2020-06-20"
"2006.10152","Lucas Mol","Lucas Mol, Narad Rampersad, and Jeffrey Shallit","Extremal overlap-free and extremal $\beta$-free binary words",,,,,"math.CO cs.DM cs.FL","http://arxiv.org/licenses/nonexclusive-distrib/1.0/","  An overlap-free (or $\beta$-free) word $w$ over a fixed alphabet $\Sigma$ is
extremal if every word obtained from $w$ by inserting a single letter from
$\Sigma$ at any position contains an overlap (or a factor of exponent at least
$\beta$, respectively). We find all lengths which admit an extremal
overlap-free binary word. For every extended real number $\beta$ such that
$2^+\leq\beta\leq 8/3$, we show that there are arbitrarily long extremal
$\beta$-free binary words.
","[{""version"":""v1"",""created"":""Wed, 17 Jun 2020 20:58:05 GMT""}]","2020-06-19"
"2006.10153","Andrzej Ptok","Andrzej Wi\k{e}ckowski, Andrzej Ptok, Marcin Mierzejewski, and
  Micha{\l} Kupczy\'nski","Identification of the Majorana edge modes in tight-binding systems based
  on the Krylov method","15 pages, 15 figures","Comput. Phys. Commun. 269, 108135 (2021)","10.1016/j.cpc.2021.108135",,"cond-mat.mes-hall cond-mat.str-el cond-mat.supr-con","http://arxiv.org/licenses/nonexclusive-distrib/1.0/","  Low dimensional structures in the non-trivial topological phase can host the
in-gap Majorana bound states, identified experimentally as zero-bias peaks in
differential conductance. Theoretical methods for studying Majorana modes are
mostly based on the bulk-boundary correspondence or exact diagonalization of
finite systems via, e.g., Bogoliubov-de Gennes formalism. In this paper, we
develop an efficient method for identifying the Majorana in-gap (edge) states
via looking for extreme eigenvalues of symmetric matrices. The presented
approach is based on the Krylov method and allows for study the spatial profile
of the modes as well as the spectrum of the system. The advantage of this
method is the calculation cost, which shows linear dependence on the number of
lattice sites. The latter problem may be solved for very large clusters of
arbitrary shape/geometry. In order to demonstrate the efficiency of our
approach, we study two- and three-dimensional clusters described by the Kitaev
and Rashba models for which we determine the number of Majorana modes and
calculate their spatial structures. Additionally, we discuss the impact of the
system size on the physical properties of the topological phase of the magnetic
nanoisland deposited on the superconducting surface. In this case, we have
shown that the eigenvalues of the in-gap states depend on the length of the
system edge.
","[{""version"":""v1"",""created"":""Wed, 17 Jun 2020 20:59:20 GMT""},{""version"":""v2"",""created"":""Sun, 25 Oct 2020 23:53:02 GMT""}]","2021-09-14"
