"2006.10304","Juan Pablo Zuluaga-Gomez","Juan Zuluaga-Gomez and Petr Motlicek and Qingran Zhan and Karel Vesely
  and Rudolf Braun","Automatic Speech Recognition Benchmark for Air-Traffic Communications","Accepted to: 21st INTERSPEECH conference (Shanghai, October 25-29)",,,,"cs.CL cs.CV cs.LG cs.SD eess.AS","http://arxiv.org/licenses/nonexclusive-distrib/1.0/","  Advances in Automatic Speech Recognition (ASR) over the last decade opened
new areas of speech-based automation such as in Air-Traffic Control (ATC)
environment. Currently, voice communication and data links communications are
the only way of contact between pilots and Air-Traffic Controllers (ATCo),
where the former is the most widely used and the latter is a non-spoken method
mandatory for oceanic messages and limited for some domestic issues. ASR
systems on ATCo environments inherit increasing complexity due to accents from
non-English speakers, cockpit noise, speaker-dependent biases, and small
in-domain ATC databases for training. Hereby, we introduce CleanSky EC-H2020
ATCO2, a project that aims to develop an ASR-based platform to collect,
organize and automatically pre-process ATCo speech-data from air space. This
paper conveys an exploratory benchmark of several state-of-the-art ASR models
trained on more than 170 hours of ATCo speech-data. We demonstrate that the
cross-accent flaws due to speakers' accents are minimized due to the amount of
data, making the system feasible for ATC environments. The developed ASR system
achieves an averaged word error rate (WER) of 7.75% across four databases. An
additional 35% relative improvement in WER is achieved on one test set when
training a TDNNF system with byte-pair encoding.
","[{""version"":""v1"",""created"":""Thu, 18 Jun 2020 06:49:22 GMT""},{""version"":""v2"",""created"":""Thu, 13 Aug 2020 06:46:34 GMT""}]","2020-08-14"
"2006.10305","Hao Chen","Hoseung Song and Hao Chen","Asymptotic distribution-free change-point detection for data with
  repeated observations",,,,,"stat.ME","http://arxiv.org/licenses/nonexclusive-distrib/1.0/","  In the regime of change-point detection, a nonparametric framework based on
scan statistics utilizing graphs representing similarities among observations
is gaining attention due to its flexibility and good performances for
high-dimensional and non-Euclidean data sequences, which are ubiquitous in this
big data era. However, this graph-based framework encounters problems when
there are repeated observations in the sequence, which often happens for
discrete data, such as network data. In this work, we extend the graph-based
framework to solve this problem by averaging or taking union of all possible
optimal graphs resulted from repeated observations. We consider both the single
change-point alternative and the changed-interval alternative, and derive
analytic formulas to control the type I error for the new methods, making them
fast applicable to large datasets. The extended methods are illustrated on an
application in detecting changes in a sequence of dynamic networks over time.
All proposed methods are implemented in an R package gSeg available on CRAN.
","[{""version"":""v1"",""created"":""Thu, 18 Jun 2020 06:51:33 GMT""},{""version"":""v2"",""created"":""Tue, 14 Sep 2021 18:04:06 GMT""}]","2021-09-16"
"2006.10306","Regio Michelin","Nadeem Ahmed, Regio A. Michelin, Wanli Xue, Sushmita Ruj, Robert
  Malaney, Salil S. Kanhere, Aruna Seneviratne, Wen Hu, Helge Janicke, Sanjay
  Jha","A Survey of COVID-19 Contact Tracing Apps","Paper has been accepted for publication in IEEE Access. Currently
  available on IEEE ACCESS early access (see DOI)",,"10.1109/ACCESS.2020.3010226",,"cs.CR","http://arxiv.org/licenses/nonexclusive-distrib/1.0/","  The recent outbreak of COVID-19 has taken the world by surprise, forcing
lockdowns and straining public health care systems. COVID-19 is known to be a
highly infectious virus, and infected individuals do not initially exhibit
symptoms, while some remain asymptomatic. Thus, a non-negligible fraction of
the population can, at any given time, be a hidden source of transmissions. In
response, many governments have shown great interest in smartphone contact
tracing apps that help automate the difficult task of tracing all recent
contacts of newly identified infected individuals. However, tracing apps have
generated much discussion around their key attributes, including system
architecture, data management, privacy, security, proximity estimation, and
attack vulnerability. In this article, we provide the first comprehensive
review of these much-discussed tracing app attributes. We also present an
overview of many proposed tracing app examples, some of which have been
deployed countrywide, and discuss the concerns users have reported regarding
their usage. We close by outlining potential research directions for
next-generation app design, which would facilitate improved tracing and
security performance, as well as wide adoption by the population at large.
","[{""version"":""v1"",""created"":""Thu, 18 Jun 2020 06:53:41 GMT""},{""version"":""v2"",""created"":""Sun, 5 Jul 2020 23:31:30 GMT""},{""version"":""v3"",""created"":""Mon, 27 Jul 2020 00:46:21 GMT""}]","2020-07-28"
"2006.10307","Stefano Frambati","H\'el\`ene Barucq (MAKUTU), Henri Calandra (CSTJF), Julien Diaz
  (MAKUTU), Stefano Frambati (CSTJF, MAKUTU)","Polynomial-reproducing spline spaces from fine zonotopal tilings","Revised version March 2021",,,,"math.NA cs.NA","http://arxiv.org/licenses/nonexclusive-distrib/1.0/","  Given a point configuration A, we uncover a connection between
polynomial-reproducing spline spaces over subsets of conv(A) and fine zonotopal
tilings of the zonotope Z(V) associated to the corresponding vector
configuration. This link directly generalizes a known result on Delaunay
configurations and naturally encompasses, due to its combinatorial character,
the case of repeated and affinely dependent points in A. We prove the existence
of a general iterative construction process for such spaces. Finally, we turn
our attention to regular fine zonotopal tilings, specializing our previous
results and exploiting the adjacency graph of the tiling to propose a set of
practical algorithms for the construction and evaluation of the associated
spline functions.
","[{""version"":""v1"",""created"":""Thu, 18 Jun 2020 06:56:46 GMT""},{""version"":""v2"",""created"":""Mon, 22 Jun 2020 15:53:40 GMT""},{""version"":""v3"",""created"":""Thu, 11 Mar 2021 15:48:23 GMT""}]","2021-03-12"
"2006.10308","Ranjiva Munasinghe Dr.","Ranjiva Munasinghe, Pathum Kossinna, Dovini Jayasinghe, Dilanka
  Wijeratne","Fast Tail Index Estimation for Power Law Distributions in R","54 pages, 14 figures, 26 tables, R-package ptsuite",,,,"stat.ME","http://arxiv.org/licenses/nonexclusive-distrib/1.0/","  Power law distributions, in particular Pareto distributions, describe data
across diverse areas of study. We have developed a package in R to estimate the
tail index for such datasets focusing on speed (in particular with large
datasets), keeping in mind ease of use, as well as accuracy. In this document,
we provide a user guide to our package along with the results obtained
highlighting the speed advantages of our package.
","[{""version"":""v1"",""created"":""Thu, 18 Jun 2020 06:57:32 GMT""}]","2020-06-19"
"2006.10309","Antoine Lejay","Antoine Lejay (IECL, PASTA)","Constructing general rough differential equations through flow
  approximations","version R0 (august 4, 2020): bibliography update",,,,"math.CA math.PR","http://arxiv.org/licenses/nonexclusive-distrib/1.0/","  The non-linear sewing lemma constructs flows of rough differential equations
from a braod class of approximations called almost flows. We consider a class
of almost flows that could be approximated by solutions of ordinary
differential equations, in the spirit of the backward error analysis. Mixing
algebra and analysis, a Taylor formula with remainder and a composition formula
are central in the expansion analysis. With a suitable algebraic structure on
the non-smooth vector fields to be integrated, we recover in a single framework
several results regarding high-order expansions for various kind of driving
paths. We also extend the notion of driving rough path. We also introduce as an
example a new family of branched rough paths, called aromatic rough paths
modeled after aromatic Butcher series.
","[{""version"":""v1"",""created"":""Thu, 18 Jun 2020 07:02:19 GMT""},{""version"":""v2"",""created"":""Thu, 16 Dec 2021 13:17:40 GMT""}]","2021-12-17"
"2006.10310","Jian Li","Jian Li, Yong Liu, Jiankun Liu, Weiping Wang","Neural Architecture Optimization with Graph VAE",,,,,"cs.LG stat.ML","http://arxiv.org/licenses/nonexclusive-distrib/1.0/","  Due to their high computational efficiency on a continuous space, gradient
optimization methods have shown great potential in the neural architecture
search (NAS) domain. The mapping of network representation from the discrete
space to a latent space is the key to discovering novel architectures, however,
existing gradient-based methods fail to fully characterize the networks. In
this paper, we propose an efficient NAS approach to optimize network
architectures in a continuous space, where the latent space is built upon
variational autoencoder (VAE) and graph neural networks (GNN). The framework
jointly learns four components: the encoder, the performance predictor, the
complexity predictor and the decoder in an end-to-end manner. The encoder and
the decoder belong to a graph VAE, mapping architectures between continuous
representations and network architectures. The predictors are two regression
models, fitting the performance and computational complexity, respectively.
Those predictors ensure the discovered architectures characterize both
excellent performance and high computational efficiency. Extensive experiments
demonstrate our framework not only generates appropriate continuous
representations but also discovers powerful neural architectures.
","[{""version"":""v1"",""created"":""Thu, 18 Jun 2020 07:05:48 GMT""}]","2020-06-20"
"2006.10311","Nicolas Loizou","Robert M. Gower, Othmane Sebbouh, Nicolas Loizou","SGD for Structured Nonconvex Functions: Learning Rates, Minibatching and
  Interpolation","Proceedings of the 24th International Conference on Artificial
  Intelligence and Statistics (AISTATS) 2021",,,,"math.OC cs.LG stat.ML","http://arxiv.org/licenses/nonexclusive-distrib/1.0/","  Stochastic Gradient Descent (SGD) is being used routinely for optimizing
non-convex functions. Yet, the standard convergence theory for SGD in the
smooth non-convex setting gives a slow sublinear convergence to a stationary
point. In this work, we provide several convergence theorems for SGD showing
convergence to a global minimum for non-convex problems satisfying some extra
structural assumptions. In particular, we focus on two large classes of
structured non-convex functions: (i) Quasar (Strongly) Convex functions (a
generalization of convex functions) and (ii) functions satisfying the
Polyak-Lojasiewicz condition (a generalization of strongly-convex functions).
Our analysis relies on an Expected Residual condition which we show is a
strictly weaker assumption than previously used growth conditions, expected
smoothness or bounded variance assumptions. We provide theoretical guarantees
for the convergence of SGD for different step-size selections including
constant, decreasing and the recently proposed stochastic Polyak step-size. In
addition, all of our analysis holds for the arbitrary sampling paradigm, and as
such, we give insights into the complexity of minibatching and determine an
optimal minibatch size. Finally, we show that for models that interpolate the
training data, we can dispense of our Expected Residual condition and give
state-of-the-art results in this setting.
","[{""version"":""v1"",""created"":""Thu, 18 Jun 2020 07:05:56 GMT""},{""version"":""v2"",""created"":""Fri, 19 Jun 2020 03:18:47 GMT""},{""version"":""v3"",""created"":""Mon, 22 Mar 2021 14:31:30 GMT""}]","2021-03-23"
"2006.10312","Masakazu Teragaito","Masakazu Teragaito","Generalized torsion elements and hyperbolic links","8 pages, 7 figures",,,,"math.GT","http://arxiv.org/licenses/nonexclusive-distrib/1.0/","  In a group, a generalized torsion element is a non-identity element whose
some non-empty finite product of its conjugates yields the identity. Such an
element is an obstruction for a group to be bi-orderable. We show that the
Weeks manifold, the figure-eight sister manifold, and the complement of
Whitehead sister link admit generalized torsion elements in their fundamental
groups. In particular, the Whitehead sister link, which is the pretzel link of
type (-2,3,8), can be generalized to hyperbolic pretzel links of type
(-2,3,2n), n>3. These give the first examples of hyperbolic links whose link
groups admit generalized torsion elements.
","[{""version"":""v1"",""created"":""Thu, 18 Jun 2020 07:11:16 GMT""}]","2020-06-19"
"2006.10313","Cheng Song","Yongjian Zhou, Chenyang Guo, Caihua Wan, Xianzhe Chen, Xiaofeng Zhou,
  Ruiqi Zhang, Youdi Gu, Ruyi Chen, Huaqiang Wu, Xiufeng Han, Feng Pan and
  Cheng Song","Current-induced in-plane magnetization switching in biaxial
  ferrimagnetic insulator","23 pages, 4 figures, accepted by Phys. Rev. Appl",,,,"cond-mat.mtrl-sci","http://creativecommons.org/licenses/by/4.0/","  Ferrimagnetic insulators (FiMI) have been intensively used in microwave and
magneto-optical devices as well as spin caloritronics, where their
magnetization direction plays a fundamental role on the device performance. The
magnetization is generally switched by applying external magnetic fields. Here
we investigate current-induced spin-orbit torque (SOT) switching of the
magnetization in Y3Fe5O12 (YIG)/Pt bilayers with in-plane magnetic anisotropy,
where the switching is detected by spin Hall magnetoresistance. Reversible
switching is found at room temperature for a threshold current density of 10^7
A cm^-2. The YIG sublattices with antiparallel and unequal magnetic moments are
aligned parallel or antiparallel to the direction of current pulses, which is
consistent to the Neel order switching in antiferromagnetic system. It is
proposed that such a switching behavior may be triggered by the
antidamping-torque acting on the two antiparallel sublattices of FiMI. Our
finding not only broadens the magnetization switching by electrical means and
promotes the understanding of magnetization switching, but also paves the way
for all-electrically modulated microwave devices and spin caloritronics with
low power consumption.
","[{""version"":""v1"",""created"":""Thu, 18 Jun 2020 07:12:48 GMT""}]","2020-06-19"
"2006.10314","Oksana Dobush","M.P. Kozlovskii and O.A. Dobush","Behavior of a binary asymmetric mixture of interacting particles in the
  supercritical region","14 pages, 3 figures",,,,"cond-mat.stat-mech","http://arxiv.org/licenses/nonexclusive-distrib/1.0/","  We propose a method for describing a phase behavior of a system consisting of
particles of two sorts. The interaction of each species is described by
interaction potentials containing the repulsive and attractive components.
Asymmetry is ensured by different values of the interaction potentials of each
sort. The grand partition function of a binary mixture is calculated in the
zero-mode approximation A line of critical points, which correspond to
different proportions of the components, is calculated for specific values of
parameters of the interaction potential. We have obtained an equation that
relates the introduced mixing parameter x with the concentration of the fluid.
An explicit expression of the pressure of the binary mixture is derived as a
function of relative temperature and mixing parameter x to plot the Widom line.
It is established that for boundary values of this parameter (x = 0 and x = 1),
the equation of state of a mixture turns into equations of state of its
separate species.
","[{""version"":""v1"",""created"":""Thu, 18 Jun 2020 07:14:45 GMT""}]","2020-06-19"
"2006.10315","Tanjin He","Tanjin He, Wenhao Sun, Haoyan Huo, Olga Kononova, Ziqin Rong, Vahe
  Tshitoyan, Tiago Botari, Gerbrand Ceder","Similarity of Precursors in Solid-state Synthesis as Text-Mined from
  Scientific Literature","Chemistry of Materials (2020)",,"10.1021/acs.chemmater.0c02553",,"cond-mat.mtrl-sci physics.data-an","http://arxiv.org/licenses/nonexclusive-distrib/1.0/","  Collecting and analyzing the vast amount of information available in the
solid-state chemistry literature may accelerate our understanding of materials
synthesis. However, one major problem is the difficulty of identifying which
materials from a synthesis paragraph are precursors or are target materials. In
this study, we developed a two-step Chemical Named Entity Recognition (CNER)
model to identify precursors and targets, based on information from the context
around material entities. Using the extracted data, we conducted a
meta-analysis to study the similarities and differences between precursors in
the context of solid-state synthesis. To quantify precursor similarity, we
built a substitution model to calculate the viability of substituting one
precursor with another while retaining the target. From a hierarchical
clustering of the precursors, we demonstrate that ""chemical similarity"" of
precursors can be extracted from text data. Quantifying the similarity of
precursors helps provide a foundation for suggesting candidate reactants in a
predictive synthesis model.
","[{""version"":""v1"",""created"":""Thu, 18 Jun 2020 07:16:31 GMT""},{""version"":""v2"",""created"":""Thu, 6 Aug 2020 01:40:41 GMT""},{""version"":""v3"",""created"":""Mon, 17 Aug 2020 23:53:26 GMT""},{""version"":""v4"",""created"":""Thu, 20 Aug 2020 05:10:13 GMT""},{""version"":""v5"",""created"":""Mon, 7 Sep 2020 07:12:19 GMT""}]","2020-09-08"
"2006.10316","Riddhi Bandyopadhyay","Riddhi Bandyopadhyay, Ramiz A. Qudsi, William H. Matthaeus, Tulasi N.
  Parashar, Bennett A. Maruca, S. Peter Gary, Vadim Roytershteyn, Alexandros
  Chasapis, Barbara L. Giles, Daniel J. Gershman, Craig J. Pollock, Christopher
  T. Russell, Robert J. Strangeway, Roy B. Torbert, Thomas E. Moore, James L.
  Burch","Interplay of Turbulence and Proton-Microinstability Growth in Space
  Plasmas","Accepted for publication in Physics of Plasmas",,,,"physics.space-ph astro-ph.SR physics.plasm-ph","http://arxiv.org/licenses/nonexclusive-distrib/1.0/","  Numerous prior studies have shown that as proton beta increases, a narrower
range of proton temperature anisotropy values is observed. This effect has
often been ascribed to the actions of kinetic microinstabilities because the
distribution of observational data aligns with contours of constant instability
growth rates in the beta-anisotropy plane. However, the linear Vlasov theory of
instabilities assumes a uniform background in which perturbations grow. The
established success of linear-microinstability theories suggests that the
conditions in regions of extreme temperature anisotropy may remain uniform for
a long enough time so that the instabilities have the chance to grow to
sufficient amplitude. Turbulence, on the other hand, is intrinsically
non-uniform and non-linear. Thin current sheets and other coherent structures
generated in a turbulent plasma, may destroy the uniformity fast enough. It is
therefore not a-priori obvious whether the presence of intermittency and
coherent structures favors or disfavors instabilities. To address this
question, we examined the statistical distribution of growth rates associated
with proton temperature-anisotropy driven microinstabilities and local
nonlinear time scales in turbulent plasmas. Linear growth rates are, on
average, substantially less than the local nonlinear rates. However, at the
regions of extreme values of temperature anisotropy, near the ""edges"" of the
populated part of the proton temperature anisotropy-parallel beta plane, the
instability growth rates are comparable or faster than the turbulence time
scales. These results provide a possible answer to the question as to why the
linear theory appears to work in limiting plasma excursions in anisotropy and
plasma beta.
","[{""version"":""v1"",""created"":""Thu, 18 Jun 2020 07:19:31 GMT""},{""version"":""v2"",""created"":""Wed, 21 Sep 2022 11:00:18 GMT""}]","2022-09-22"
"2006.10317","Jie Wu","Jie Wu, Jian Luan","Adversarially Trained Multi-Singer Sequence-To-Sequence Singing
  Synthesizer","Submitted to INTERSPEECH2020",,,,"eess.AS cs.LG cs.SD","http://arxiv.org/licenses/nonexclusive-distrib/1.0/","  This paper presents a high quality singing synthesizer that is able to model
a voice with limited available recordings. Based on the sequence-to-sequence
singing model, we design a multi-singer framework to leverage all the existing
singing data of different singers. To attenuate the issue of musical score
unbalance among singers, we incorporate an adversarial task of singer
classification to make encoder output less singer dependent. Furthermore, we
apply multiple random window discriminators (MRWDs) on the generated acoustic
features to make the network be a GAN. Both objective and subjective
evaluations indicate that the proposed synthesizer can generate higher quality
singing voice than baseline (4.12 vs 3.53 in MOS). Especially, the articulation
of high-pitched vowels is significantly enhanced.
","[{""version"":""v1"",""created"":""Thu, 18 Jun 2020 07:20:11 GMT""}]","2020-06-19"
"2006.10318","Junjie Shen","Junjie Shen, Jun Yeon Won, Zeyuan Chen, Qi Alfred Chen","Drift with Devil: Security of Multi-Sensor Fusion based Localization in
  High-Level Autonomous Driving under GPS Spoofing (Extended Version)","This is an extended version of our paper, which appears in USENIX
  Security 2020. For attack demos, see our project website:
  https://sites.google.com/view/cav-sec/fusionripper",,,,"cs.CR cs.RO","http://arxiv.org/licenses/nonexclusive-distrib/1.0/","  For high-level Autonomous Vehicles (AV), localization is highly security and
safety critical. One direct threat to it is GPS spoofing, but fortunately, AV
systems today predominantly use Multi-Sensor Fusion (MSF) algorithms that are
generally believed to have the potential to practically defeat GPS spoofing.
However, no prior work has studied whether today's MSF algorithms are indeed
sufficiently secure under GPS spoofing, especially in AV settings. In this
work, we perform the first study to fill this critical gap. As the first study,
we focus on a production-grade MSF with both design and implementation level
representativeness, and identify two AV-specific attack goals, off-road and
wrong-way attacks.
  To systematically understand the security property, we first analyze the
upper-bound attack effectiveness, and discover a take-over effect that can
fundamentally defeat the MSF design principle. We perform a cause analysis and
find that such vulnerability only appears dynamically and
non-deterministically. Leveraging this insight, we design FusionRipper, a novel
and general attack that opportunistically captures and exploits take-over
vulnerabilities. We evaluate it on 6 real-world sensor traces, and find that
FusionRipper can achieve at least 97% and 91.3% success rates in all traces for
off-road and wrong-way attacks respectively. We also find that it is highly
robust to practical factors such as spoofing inaccuracies. To improve the
practicality, we further design an offline method that can effectively identify
attack parameters with over 80% average success rates for both attack goals,
with the cost of at most half a day. We also discuss promising defense
directions.
","[{""version"":""v1"",""created"":""Thu, 18 Jun 2020 07:20:17 GMT""},{""version"":""v2"",""created"":""Tue, 23 Jun 2020 18:18:26 GMT""},{""version"":""v3"",""created"":""Wed, 12 Aug 2020 17:14:00 GMT""}]","2020-08-13"
"2006.10319","Cheng Song","R. Q. Zhang, L. Y. Liao, X. Z. Chen, T. Xu, L. Cai, M. H. Guo, Hao
  Bai, L. Sun, F. H. Xue, J. Su, X. Wang, C. H. Wan, Hua Bai, Y. X. Song, R. Y.
  Chen, N. Chen, W. J. Jiang, X. F. Kou, J. W. Cai, H. Q. Wu, F. Pan and C.
  Song","Current-induced magnetization switching in CoTb amorphous single layer","17 pages, 4 figures, Phys. Rev. B 101, 214418 (2020)",,"10.1103/PhysRevB.101.214418",,"cond-mat.mtrl-sci","http://creativecommons.org/licenses/by/4.0/","  We demonstrate spin-orbit torque (SOT) switching of amorphous CoTb single
layer films with perpendicular magnetic anisotropy (PMA). The switching
sustains even the film thickness is above 10 nm, where the critical switching
current density keeps almost constant. Without the need of overcoming the
strong interfacial Dzyaloshinskii-Moriya interaction caused by the heavy metal,
a quite low assistant field of ~20 Oe is sufficient to realize the fully
switching. The SOT effective field decreases and undergoes a sign change with
the decrease of the Tb-concentration, implying that a combination of the spin
Hall effect from both Co and Tb as well as an asymmetric spin current
absorption accounts for the SOT switching mechanism. Our findings would advance
the use of magnetic materials with bulk PMA for energy-efficient and
thermal-stable non-volatile memories, and add a different dimension for
understanding the ordering and asymmetry in amorphous thin films.
","[{""version"":""v1"",""created"":""Thu, 18 Jun 2020 07:22:14 GMT""}]","2020-06-19"
