"2006.10458","Tobias Alexander Kampmann","David M\""uller, Tobias A. Kampmann, Jan Kierfeld","Chaining of hard disks in nematic needles: particle-based simulation of
  colloidal interactions in liquid crystals",,"Sci. Rep. 10, 12718 (2020)","10.1038/s41598-020-69544-4",,"cond-mat.soft physics.comp-ph","http://arxiv.org/licenses/nonexclusive-distrib/1.0/","  Colloidal particles suspended in liquid crystals can exhibit various
effective anisotropic interactions that can be tuned and utilized in
self-assembly processes. We simulate a two-dimensional system of hard disks
suspended in a solution of dense hard needles as a model system for colloids
suspended in a nematic lyotropic liquid crystal. The novel event-chain Monte
Carlo technique enables us to directly measure colloidal interactions in a
microscopic simulation with explicit liquid crystal particles in the dense
nematic phase. We find a directional short-range attraction for disks along the
director, which triggers chaining parallel to the director and seemingly
contradicts the standard liquid crystal field theory result of a quadrupolar
attraction with a preferred ${45^{\circ}}$ angle. Our results can be explained
by a short-range density-dependent depletion interaction, which has been
neglected so far. Directionality and strength of the depletion interaction are
caused by the weak planar anchoring of hard rods. The depletion attraction
robustly dominates over the quadrupolar elastic attraction if disks come close.
Self-assembly of many disks proceeds via intermediate chaining, which
demonstrates that in lyotropic liquid crystal colloids depletion interactions
play an important role in structure formation processes.
","[{""version"":""v1"",""created"":""Thu, 18 Jun 2020 12:11:49 GMT""}]","2020-07-30"
"2006.10459","Anne Gael Manegueu Anne","Anne Gael Manegueu, Claire Vernade, Alexandra Carpentier, Michal Valko","Stochastic bandits with arm-dependent delays","19 Pages, 4 figures",,,,"stat.ML cs.LG","http://arxiv.org/licenses/nonexclusive-distrib/1.0/","  Significant work has been recently dedicated to the stochastic delayed bandit
setting because of its relevance in applications. The applicability of existing
algorithms is however restricted by the fact that strong assumptions are often
made on the delay distributions, such as full observability, restrictive shape
constraints, or uniformity over arms. In this work, we weaken them
significantly and only assume that there is a bound on the tail of the delay.
In particular, we cover the important case where the delay distributions vary
across arms, and the case where the delays are heavy-tailed. Addressing these
difficulties, we propose a simple but efficient UCB-based algorithm called the
PatientBandits. We provide both problems-dependent and problems-independent
bounds on the regret as well as performance lower bounds.
","[{""version"":""v1"",""created"":""Thu, 18 Jun 2020 12:13:58 GMT""}]","2020-06-19"
"2006.10460","Ilja Kuzborskij","Ilja Kuzborskij, Claire Vernade, Andr\'as Gy\""orgy, Csaba Szepesv\'ari","Confident Off-Policy Evaluation and Selection through Self-Normalized
  Importance Weighting",,,,,"cs.LG stat.ML","http://arxiv.org/licenses/nonexclusive-distrib/1.0/","  We consider off-policy evaluation in the contextual bandit setting for the
purpose of obtaining a robust off-policy selection strategy, where the
selection strategy is evaluated based on the value of the chosen policy in a
set of proposal (target) policies. We propose a new method to compute a lower
bound on the value of an arbitrary target policy given some logged data in
contextual bandits for a desired coverage. The lower bound is built around the
so-called Self-normalized Importance Weighting (SN) estimator. It combines the
use of a semi-empirical Efron-Stein tail inequality to control the
concentration and a new multiplicative (rather than additive) control of the
bias. The new approach is evaluated on a number of synthetic and real datasets
and is found to be superior to its main competitors, both in terms of tightness
of the confidence intervals and the quality of the policies chosen.
","[{""version"":""v1"",""created"":""Thu, 18 Jun 2020 12:15:37 GMT""},{""version"":""v2"",""created"":""Sun, 1 Nov 2020 15:27:20 GMT""},{""version"":""v3"",""created"":""Mon, 21 Mar 2022 11:32:53 GMT""}]","2022-03-22"
"2006.10461","Konstantin Klemmer","Konstantin Klemmer, Daniel B. Neill","Auxiliary-task learning for geographic data with autoregressive
  embeddings","SIGSPATIAL 2021",,,,"cs.LG cs.CV stat.ML","http://arxiv.org/licenses/nonexclusive-distrib/1.0/","  Machine learning is gaining popularity in a broad range of areas working with
geographic data, such as ecology or atmospheric sciences. Here, data often
exhibit spatial effects, which can be difficult to learn for neural networks.
In this study, we propose SXL, a method for embedding information on the
autoregressive nature of spatial data directly into the learning process using
auxiliary tasks. We utilize the local Moran's I, a popular measure of local
spatial autocorrelation, to ""nudge"" the model to learn the direction and
magnitude of local spatial effects, complementing the learning of the primary
task. We further introduce a novel expansion of Moran's I to multiple
resolutions, thus capturing spatial interactions over longer and shorter
distances simultaneously. The novel multi-resolution Moran's I can be
constructed easily and as a multi-dimensional tensor offers seamless
integration into existing machine learning frameworks. Throughout a range of
experiments using real-world data, we highlight how our method consistently
improves the training of neural networks in unsupervised and supervised
learning tasks. In generative spatial modeling experiments, we propose a novel
loss for auxiliary task GANs utilizing task uncertainty weights. Our proposed
method outperforms domain-specific spatial interpolation benchmarks,
highlighting its potential for downstream applications. This study bridges
expertise from geographic information science and machine learning, showing how
this integration of disciplines can help to address domain-specific challenges.
The code for our experiments is available on Github:
https://github.com/konstantinklemmer/sxl.
","[{""version"":""v1"",""created"":""Thu, 18 Jun 2020 12:16:08 GMT""},{""version"":""v2"",""created"":""Tue, 24 Nov 2020 10:29:32 GMT""},{""version"":""v3"",""created"":""Thu, 19 Aug 2021 10:22:48 GMT""}]","2021-08-20"
"2006.10462","Antonina Zinhailo","R. A. Konoplya, A. F. Zinhailo and Z. Stuchlik","Quasinormal modes and Hawking radiation of black holes in cubic gravity","10 pages, revtex, 11 figures, the version to match the published PRD
  version A typo in formula 27","Phys. Rev. D 102, 044023 (2020)","10.1103/PhysRevD.102.044023",,"gr-qc astro-ph.HE hep-th","http://arxiv.org/licenses/nonexclusive-distrib/1.0/","  We consider quasinormal modes and Hawking radiation of four-dimensional
asymptotically flat black holes in the most general up
to-cubic-order-in-curvature dimension-independent Einsteinian theory of gravity
that shares its graviton spectrum with the Einstein theory on constant
curvature backgrounds. We show that damping rate and real oscillation
frequencies of quasinormal modes for scalar, electromagnetic and Dirac fields
are suppressed once the coupling with the cubic term is on. The intensity of
Hawking radiation is suppressed as well, leading to, roughly, one order longer
lifetime at a sufficiently large coupling constant.
","[{""version"":""v1"",""created"":""Thu, 18 Jun 2020 12:16:09 GMT""},{""version"":""v2"",""created"":""Fri, 19 Jun 2020 00:44:24 GMT""},{""version"":""v3"",""created"":""Tue, 11 Aug 2020 14:20:50 GMT""},{""version"":""v4"",""created"":""Fri, 17 Sep 2021 08:46:56 GMT""}]","2021-09-20"
"2006.10463","Herbert De Gersem","H. De Gersem, I. Kulchytska-Ruchka and S. Sch\""ops","Finite-Element Simulation of an Accelerator Magnet: an Exercise","32 pages, contribution to the CAS - CERN Accelerator School:
  Numerical Methods for Analysis, Design and Modelling of Particle
  Accelerators, 11-23 November 2018, Thessaloniki, Greece",,,,"physics.acc-ph","http://arxiv.org/licenses/nonexclusive-distrib/1.0/","  This note describes an extended exercise on the finite-element (FE)
simulation of an accelerator magnet. The students construct and simulate a
magnet model using the FEMM freeware. They get the opportunity to exercise on
the theory of FEs, including Maxwell equations, magnetoquasistatic formulation,
weighted residual approach, choice of appropriate FE shape functions and
algebraic system of equations, thereby guided by fill-in sheets. They are
invited to implement the most crucial parts of a simple FE solver. Finally, the
own software is used to simulate the magnet once more and to develop some
problem-dedicated post-processing routines. The exercise educates students in
accelerator physics and electrical engineering on the construction and
simulation of accurate and manageable FE models, the algorithms behind a
standard FE solver and some ideas to extend a FE solver for own purposes. All
necessary files to carry out the exercise are freely available.
","[{""version"":""v1"",""created"":""Thu, 18 Jun 2020 12:17:24 GMT""}]","2020-06-19"
"2006.10464","Max Birch","M. T. Birch, S. H. Moody, M. N. Wilson, M. Crisanti, O. Bewley, A.
  \v{S}tefan\v{c}i\v{c}, G. Balakrishnan, R. Fan, P. Steadman, D. Alba Venero,
  R. Cubitt, P. D. Hatton","Pinning of Helimagnetic Phase Transitions in Zn-Substituted Skyrmion
  Host Cu$_2$OSeO$_3$",,"Phys. Rev. B 102, 104424 (2020)","10.1103/PhysRevB.102.104424",,"cond-mat.str-el","http://arxiv.org/licenses/nonexclusive-distrib/1.0/","  Magnetic skyrmions are nano-sized topological spin textures stabilized by a
delicate balance of magnetic energy terms. The chemical substitution of the
underlying crystal structure of skyrmion-hosting materials offers a route to
manipulate these energy contributions, but also introduces additional effects
such as disorder and pinning. While the effects of doping and disorder have
been well studied in B20 metallic materials such as Fe$_{1-x}$Co$_x$Si and
Mn$_{1-x}$Fe$_x$Si, the consequences of chemical substitution in the
magnetoelectric insulator Cu$_2$OSeO$_3$ have not been fully explored. In this
work, we utilize a combination of AC magnetometry and small angle neutron
scattering to investigate the magnetic phase transition dynamics in pristine
and Zn-substituted Cu$_2$OSeO$_3$. The results demonstrate that the first order
helical-conical phase transition exhibits two thermally separated behavioural
regimes: at high temperatures, the helimagnetic domains transform by
large-scale, continuous rotations, while at low temperatures, the two phases
coexist. Remarkably, the effects of pinning in the substituted sample are less
prevalent at low temperatures, compared to high temperatures, despite the
reduction of available thermal activation energy. We attribute this behaviour
to the large, temperature-dependent, cubic anisotropy unique to Cu$_2$OSeO$_3$,
which becomes strong enough to overcome the pinning energy at low temperatures.
Consideration and further exploration of these effects will be crucial when
engineering skyrmion materials towards future applications.
","[{""version"":""v1"",""created"":""Thu, 18 Jun 2020 12:18:31 GMT""}]","2020-09-23"
"2006.10465","Dung Le dr.","Dung Le","On the Positivity of Weak Solutions to a Class of Cross Diffusion
  Systems",,,,,"math.AP","http://arxiv.org/licenses/nonexclusive-distrib/1.0/","  We establish the positivity of weak (and very weak) solutions to a class of
cross diffusion systems which is inspired by models in mathematical
biology/ecology, in particular the Shigesada-Kawasaki-Teramoto (SKT) model in
population biology. Examples and counterexamples will be provided to show that
our contions are near optimal.
","[{""version"":""v1"",""created"":""Thu, 18 Jun 2020 12:18:46 GMT""}]","2020-06-19"
"2006.10466","Sven Burger","Theresa Hoehne, Peter Schnauber, Sven Rodt, Stephan Reitzenstein, Sven
  Burger","Numerical Investigation of Light Emission from Quantum Dots Embedded
  into On-Chip, Low Index Contrast Optical Waveguides",,"Phys. Status Solidi B 256, 1800437 (2019)","10.1002/pssb.201800437",,"physics.optics cond-mat.mes-hall physics.app-ph","http://arxiv.org/licenses/nonexclusive-distrib/1.0/","  Single-photon emitters integrated into quantum optical circuits will enable
new, miniaturized quantum optical devices. Here, we numerically investigate
semiconductor quantum dots embedded to low refractive index contrast
waveguides. We discuss a model to compute the coupling efficiency of the
emitted light field to the fundamental propagation mode of the waveguide, and
we optimize the waveguide dimensional parameters for maximum coupling
efficiency. Further, we show that for a laterally cropped waveguide the
interplay of Purcell-enhancement and optimized field profile can enhance the
coupling efficiency by a factor of about two.
","[{""version"":""v1"",""created"":""Thu, 18 Jun 2020 12:19:27 GMT""}]","2020-06-19"
"2006.10467","Emmanuel Trelat","Hugo Lhachemi (UCD), Christophe Prieur (GIPSA-SYSCO), Emmanuel
  Tr\'elat (CaGE, LJLL (UMR\_7598))","PI regulation control of a 1-D semilinear wave equation",,,,,"math.OC","http://arxiv.org/licenses/nonexclusive-distrib/1.0/","  This paper is concerned with the Proportional Integral (PI) regulation
control of the left Neu-mann trace of a one-dimensional semilinear wave
equation. The control input is selected as the right Neumann trace. The control
design goes as follows. First, a preliminary (classical) velocity feedback is
applied in order to shift all but a finite number of the eivenvalues of the
underlying unbounded operator into the open left half-plane. We then leverage
on the projection of the system trajectories into an adequate Riesz basis to
obtain a truncated model of the system capturing the remaining unstable modes.
Local stability of the resulting closed-loop infinite-dimensional system
composed of the semilinear wave equation, the preliminary velocity feedback,
and the PI controller, is obtained through the study of an adequate Lyapunov
function. Finally, an estimate assessing the set point tracking performance of
the left Neumann trace is derived.
","[{""version"":""v1"",""created"":""Thu, 18 Jun 2020 12:20:33 GMT""}]","2020-06-19"
"2006.10468","Mustefa Jibril Mr","Mustefa Jibril, Messay Tadese, Eliyas Alemayehu Tadese","Body Travel Performance Improvement of Space Vehicle Electromagnetic
  Suspension System using LQG and LQI Control Methods",,"Researcher 2020;12(5):70-75","10.7537/marsrsj120520.08",,"eess.SY cs.SY eess.SP","http://creativecommons.org/licenses/by/4.0/","  Electromagnetic suspension system (EMS) is mostly used in the field of
high-speed vehicle. In this paper, a space exploring vehicle quarter
electromagnetic suspension system is modelled, designed and simulated using
linear quadratic optimal control problem. Linear quadratic Gaussian and linear
quadratic integral controllers are designed to improve the body travel of the
vehicle using bump road profile. Comparison between the proposed controllers is
done and a promising simulation result have been analyzed.
","[{""version"":""v1"",""created"":""Thu, 18 Jun 2020 12:23:20 GMT""}]","2021-03-08"
"2006.10469","Guangle Du","Guangle Du, Fangfu Ye, Masao Doi and Fanlong Meng","Drying Pathways of an Evaporating Soft Matter Droplet","13 pages, 3 figures",,,,"cond-mat.soft","http://arxiv.org/licenses/nonexclusive-distrib/1.0/","  Micro-droplets of soft matter solutions have different morphologies upon
drying, and can finally become wrinkled, buckled or cavitated particles. We
investigate the morphology evolution of a drying soft matter droplet in this
work: at the early stage of drying, wrinkling or cavitation instability can
occur in the droplet, depending on the comparison between the critical
wrinkling and cavitation pressure; at a later stage of drying, no wrinkle will
appear if cavitation happens first, while there can still be cavitation if
wrinkling happens first. A three-dimensional phase diagram in the space of
elastic length, gel layer thickness and weight loss is provided for
illustrating these drying pathways of a soft matter droplet, which can guide
future fabrications of micro-particles with desired morphologies.
","[{""version"":""v1"",""created"":""Thu, 18 Jun 2020 12:31:46 GMT""}]","2020-06-19"
"2006.10470","Li Shang","Shang Li, Lu-Ming Sun, Neng-Hui Liao and Yi-Zhong Fan","Awakening of two $\gamma$-ray high redshift flat-spectrum radio quasars
  in the southern hemisphere","12 pages, 6 figures. Accepted for publication in ApJ",,"10.3847/1538-4357/abab03",,"astro-ph.HE","http://arxiv.org/licenses/nonexclusive-distrib/1.0/","  High-redshift blazars are valuable tools to study the early Universe. So far
only a handful of $\gamma$-ray blazars have been found at redshifts above 3.
$\gamma$-ray signals are detected in the direction of PMN J2219-2719 ($z=3.63$)
and PMN J2321-0827 ($z=3.16$) by analyzing the 10-year $Fermi$-LAT Pass 8 data.
PMN J2219-2719 is not distinguished from the background in the global analysis.
During the 5-month epoch, the TS value is 47.8 and the flux is more than 10
times of the 10-year averaged flux. In addition, the angular distance between
the $\gamma$-ray position and the radio position of PMN J2219-2719 is only
${0.04}^{\circ}$. Moreover, the $\gamma$-ray and infrared light curves of long
time scale are very similar, which support the association between the
$\gamma$-ray source and PMN J2219-2719. The global analysis of PMN J2321-0827
suggest a new $\gamma$-ray source, during the flare phase, the TS value is 61.4
and the $\gamma$-ray flux increased significantly. The association probability
suggests that PMN J2321-0827 may be the counterpart of the new $\gamma$-ray
source. In the future, the number of high-redshift $\gamma$-ray sources will
increase by combining $Fermi$-LAT and the upcoming Large Synoptic Survey
Telescope.
","[{""version"":""v1"",""created"":""Thu, 18 Jun 2020 12:34:39 GMT""},{""version"":""v2"",""created"":""Wed, 29 Jul 2020 03:08:36 GMT""}]","2020-09-09"
"2006.10471","Tomasz Kami\'nski Dr","T. Kaminski, K. M. Menten, R. Tylenda, K.T. Wong, A. Belloche, A.
  Mehner, M. R. Schmidt, N.A. Patel","Molecular remnant of Nova 1670 (CK Vulpeculae): I. Properties and
  enigmatic origin of the gas","submitted to A&A; comments welcome","A&A 644, A59 (2020)","10.1051/0004-6361/202038648",,"astro-ph.SR astro-ph.GA","http://arxiv.org/licenses/nonexclusive-distrib/1.0/","  CK Vul erupted in 1670 and is considered a stellar-merger candidate. Its
remnant contains a molecular component of surprisingly rich composition. We
present interferometric line surveys with subarcsec resolution with ALMA and
SMA. The observations provide interferometric maps of molecular line emission
at frequencies between 88 and 243 GHz that allow imaging spectroscopy of more
than 180 transitions of 26 species. We present, classify, and analyze the
different morphologies of the emission regions displayed by the molecules. We
also perform a non-LTE radiative-transfer analysis of emission of most of the
observed species, deriving temperatures and column densities in five parts of
the nebula. Non-LTE effects are clearly seen in complex species including
methanol absorption against the CMB. The temperatures are 17 K in the inner
remnant and 14 K in the extended lobes. We find total (hydrogen plus helium)
densities in the range of $10^4-10^6$ cm$^{-3}$. The column densities provide
relative abundance patterns in the remnant which currently are not understood.
Attempts to derive elemental abundances within the assumption of a chemical
equilibrium give only loose constraints on the CNO elements. That the formation
of many of the observed molecules requires a major involvement of circumstellar
shocks remains the preferred possibility. The molecular gas could have formed
350 yr ago or more recently. The molecules are well shielded from the
interstellar radiation field by the circumstellar dust. Their presence alone
indicates that the unobservable central star cannot be a hot object such as a
white dwarf. This excludes some of the proposed scenarios on the nature of CK
Vul. The general characteristics of the molecular environment of CK Vul derived
in this study resemble quite well those of some pre-planetary nebulae and AGB
stars, most notably that of OH231.8.
","[{""version"":""v1"",""created"":""Thu, 18 Jun 2020 12:35:35 GMT""}]","2021-01-04"
"2006.10472","Howon Kim","Howon Kim, Levente R\'ozsa, Dominik Schreyer, Eszter Simon, Roland
  Wiesendanger","Long-range focusing of magnetic bound states in superconducting
  lanthanum","20 pages, 4 figures",,"10.1038/s41467-020-18406-8",,"cond-mat.supr-con cond-mat.mes-hall","http://arxiv.org/licenses/nonexclusive-distrib/1.0/","  Quantum mechanical systems with long-range interactions between
quasiparticles provide a promising platform for coherent quantum information
technology. Superconductors are a natural choice for solid-state based quantum
devices, while magnetic impurities inside superconductors give rise to
quasiparticle excitations of broken Cooper pairs that provide characteristic
information about the host superconductor. Here, we reveal that magnetic
impurities embedded below a superconducting La(0001) surface interact via
quasiparticles extending to very large distances, up to several tens of
nanometers. Using low-temperature scanning probe techniques, we observe the
corresponding anisotropic and giant oscillations in the local density of
states. Theoretical calculations indicate that the quasi-two-dimensional
surface states with their strongly anisotropic Fermi surface play a crucial
role for the focusing and long-range extension of the magnetic bound states.
The quasiparticle focusing mechanism should facilitate the design of versatile
magnetic structures with tunable and directed magnetic interactions over large
distances, thereby paving the way toward the design of low-dimensional
magnet-superconductor hybrid systems exhibiting topologically non-trivial
quantum states as possible elements of quantum computation schemes based on
Majorana quasiparticles.
","[{""version"":""v1"",""created"":""Thu, 18 Jun 2020 12:41:37 GMT""}]","2020-10-28"
"2006.10473","Christoph Kuckein","C. Kuckein (1), S. J. Gonz\'alez Manrique (2, 3 and 4), L. Kleint (5),
  and A. Asensio Ramos (3 and 4) ((1) Leibniz-Institut f\""ur Astrophysik
  Potsdam AIP, (2) Astronomical Institute, Slovak Academy of Sciences (AISAS),
  (3) Instituto de Astrof\'isica de Canarias (IAC), (4) Departamento de
  Astrof\'isica, Universidad de La Laguna (ULL), (5) Leibniz-Institut f\""ur
  Sonnenphysik (KIS))","Determining the dynamics and magnetic fields in He I 10830 \r{A} during
  a solar filament eruption","Accepted for publication in Astronomy & Astrophysics, 12 pages, 13
  figures, 1 appendix, 2 online movies","A&A 640, A71 (2020)","10.1051/0004-6361/202038408",,"astro-ph.SR","http://arxiv.org/licenses/nonexclusive-distrib/1.0/","  We investigate the dynamics and magnetic properties of the plasma, such as
line-of-sight velocity (LOS), optical depth, vertical and horizontal magnetic
fields, belonging to an erupted solar filament. The filament eruption was
observed with the GREGOR Infrared Spectrograph (GRIS) at the 1.5-meter GREGOR
telescope on 2016 July 3. Three consecutive full-Stokes
slit-spectropolarimetric scans in the He I 10830 \r{A} spectral range were
acquired. The Stokes I profiles were classified using the machine learning
k-means algorithm and then inverted with different initial conditions using the
HAZEL code. The erupting-filament material presents the following physical
conditions: (1) ubiquitous upward motions with peak LOS velocities of ~73 km/s;
(2) predominant large horizontal components of the magnetic field, on average,
in the range of 173-254 G, whereas the vertical components of the fields are
much lower, on average between 39-58 G; (3) optical depths in the range of
0.7-1.1. The average azimuth orientation of the field lines between two
consecutive raster scans (<2.5 minutes) remained constant. The analyzed
filament eruption belonged to the fast rising phase, with total velocities of
about 124 km/s. The orientation of the magnetic field lines does not change
from one raster scan to the other, indicating that the untwisting phase has not
started yet. The untwisting seems to start about 15 min after the beginning of
the filament eruption.
","[{""version"":""v1"",""created"":""Thu, 18 Jun 2020 12:43:04 GMT""}]","2020-08-19"
