"2006.15524","Xi Li","Hanbin Zhao, Yongjian Fu, Mintong Kang, Qi Tian, Fei Wu, Xi Li","MgSvF: Multi-Grained Slow vs. Fast Framework for Few-Shot
  Class-Incremental Learning",,,,,"cs.CV cs.LG","http://arxiv.org/licenses/nonexclusive-distrib/1.0/","  As a challenging problem, few-shot class-incremental learning (FSCIL)
continually learns a sequence of tasks, confronting the dilemma between slow
forgetting of old knowledge and fast adaptation to new knowledge. In this
paper, we concentrate on this ""slow vs. fast"" (SvF) dilemma to determine which
knowledge components to be updated in a slow fashion or a fast fashion, and
thereby balance old-knowledge preservation and new-knowledge adaptation. We
propose a multi-grained SvF learning strategy to cope with the SvF dilemma from
two different grains: intra-space (within the same feature space) and
inter-space (between two different feature spaces). The proposed strategy
designs a novel frequency-aware regularization to boost the intra-space SvF
capability, and meanwhile develops a new feature space composition operation to
enhance the inter-space SvF learning performance. With the multi-grained SvF
learning strategy, our method outperforms the state-of-the-art approaches by a
large margin.
","[{""version"":""v1"",""created"":""Sun, 28 Jun 2020 06:12:49 GMT""},{""version"":""v2"",""created"":""Sun, 20 Dec 2020 11:55:55 GMT""},{""version"":""v3"",""created"":""Tue, 2 Mar 2021 16:47:28 GMT""}]","2021-03-03"
"2006.15525","Damia Mawad Dr","Lorenzo Travaglini, Adam Micolich, Claudio Cazorla, Erica Zeglio,
  Antonio Lauto, Damia Mawad","Flexible complementary logic circuit built from two identical organic
  electrochemical transistors","36 pages, 4 figures, 9 supplementary figures",,,,"physics.app-ph cond-mat.mtrl-sci","http://arxiv.org/licenses/nonexclusive-distrib/1.0/","  The organic electrochemical transistor (OECT) with a conjugated polymer as
the active material is the elementary unit of organic bioelectronic devices.
Increased functionalities, such as low power consumption, can be achieved by
building complementary circuits featuring two or more OECTs. Complementary
circuits commonly combine both p- and n-type transistors to reduce power draw.
While p-type OECTs are readily available, n-type OECTs are less common mainly
due to poor stability of the n-type active channel material in aqueous
electrolyte. Additionally, an OECT based complementary circuit requires well
matched transport properties in the p- and n-type materials. Here, a
complementary circuit is made using a pair of OECTs having polyaniline (PANI)
as the channel material in both transistors. PANI is chosen due to its unique
behaviour exhibiting a peak in current versus gate voltage when used as an
active channel in an OECT. The PANI based circuit is shown to have excellent
performance with gain of ~ 7 and could be transferred on a flexible
biocompatible chitosan substrate with demonstrated operation in aqueous
electrolyte. This study extends the capabilities of conjugated polymer based
OECTs.
","[{""version"":""v1"",""created"":""Sun, 28 Jun 2020 06:50:34 GMT""}]","2020-06-30"
"2006.15526","Man Chun Lee","Man-Chun Lee, Ka-Fai Li","Deformation of Hermitian metrics","10 pages; references added",,,,"math.DG","http://arxiv.org/licenses/nonexclusive-distrib/1.0/","  In this work, we study the deformation of Hermitian metrics with Chern
connection. By adapting the conformal perturbation method of Aubin and Ehrlich
to Hermitian setting, we prove that Hermitian metrics with quasi-positive
(resp. quasi-negative) second Chern-Ricci curvature can be deformed to one with
positive (resp. negative) curvature.
","[{""version"":""v1"",""created"":""Sun, 28 Jun 2020 06:51:15 GMT""},{""version"":""v2"",""created"":""Thu, 2 Jul 2020 02:07:13 GMT""}]","2020-07-03"
"2006.15527","Vetrivel Chelian T","Vetrivel Chelian Thirumavalavan, PGS Velmurugan and Thiruvengadam S J","BER Analysis of RIS Assisted Multicast Communications with Network
  Coding","5 pages, 5 figures",,,,"eess.SP","http://creativecommons.org/publicdomain/zero/1.0/","  In this paper, Recofigurable Intelligent Surface (RIS) assisted dual-hop
multicast wireless communication network is proposed with two source nodes and
two destination nodes. RIS boosts received signal strength through an
intelligent software-controlled array of discrete phase-shifting metamaterials.
The multicast communication from the source nodes is enabled using a Decode and
Forward (DF) relay node. In the relay node, the Physical Layer Network Coding
(PLNC) concept is applied and the PLNC symbol is transmitted to the destination
nodes. The joint RIS-Multicast channels between source nodes and the relay node
are modeled as the sum of two scaled non-central Chi-Square distributions.
Analytical expressions are derived for Bit Error Rate (BER) at relay node and
destination nodes using Moment Generating Function (MGF) approach and the
results are validated using Monte-Carlo simulations. It is observed that the
BER performance of the proposed RIS assisted network is a lot better than the
conventional non-RIS channels links.
","[{""version"":""v1"",""created"":""Sun, 28 Jun 2020 07:01:58 GMT""}]","2020-06-30"
"2006.15528","Li Xiao","Chunlong Luo, Tianqi Yu, Yufan Luo, Manqing Wang, Fuhai Yu, Yinhao Li,
  Chan Tian, Jie Qiao, Li Xiao","DeepACC:Automate Chromosome Classification based on Metaphase Images
  using Deep Learning Framework Fused with Prior Knowledge","This work is supported by a fund from another hospital. Only Li Xiao
  conceived the idea and supervised Chunlong Luo to complete the work, the data
  provider did not participate in the research process. Thus, the authorships
  and institutional information are not correct. After careful consideration, I
  decide to withdraw this preprint version",,,,"cs.CV","http://arxiv.org/licenses/nonexclusive-distrib/1.0/","  Chromosome classification is an important but difficult and tedious task in
karyotyping. Previous methods only classify manually segmented single
chromosome, which is far from clinical practice. In this work, we propose a
detection based method, DeepACC, to locate and fine classify chromosomes
simultaneously based on the whole metaphase image. We firstly introduce the
Additive Angular Margin Loss to enhance the discriminative power of model. To
alleviate batch effects, we transform decision boundary of each class
case-by-case through a siamese network which make full use of prior knowledges
that chromosomes usually appear in pairs. Furthermore, we take the clinically
seven group criterion as a prior knowledge and design an additional Group
Inner-Adjacency Loss to further reduce inter-class similarities. 3390 metaphase
images from clinical laboratory are collected and labelled to evaluate the
performance. Results show that the new design brings encouraging performance
gains comparing to the state-of-the-art baselines.
","[{""version"":""v1"",""created"":""Sun, 28 Jun 2020 07:04:41 GMT""},{""version"":""v2"",""created"":""Wed, 11 Aug 2021 10:58:52 GMT""}]","2021-08-18"
"2006.15529","Kazunori Shinohara","Kazunori Shinohara","Lemniscate of Leaf Function","17 pages, 7 figures","CMES Computer Modeling in Engineering & Sciences, Vol.126, No.1,
  2021, pp.275-292","10.32604/cmes.2021.012383",,"math.GM","http://arxiv.org/licenses/nonexclusive-distrib/1.0/","  A lemniscate is a curve defined by two foci, F1 and F2. If the distance
between the focal points of F1 - F2 is 2a (a: constant), then any point P on
the lemniscate curve satisfy the equation PF1 PF2 = a^2. Jacob Bernoulli first
described the lemniscate in 1694. The Fagnano discovered the double angle
formula of the lemniscate(1718). The Euler extended the Fagnano's formula to a
more general addition theorem(1751). The lemniscate function was subsequently
proposed by Gauss around the year 1800. These insights are summarized by Jacobi
as the theory of elliptic functions. A leaf function is an extended lemniscate
function. Some formulas of leaf functions have been presented in previous
papers; these included the addition theorem of this function and its
application to nonlinear equations. In this paper, the geometrical properties
of leaf functions at n = 2 and the geometric relation between the angle theta
and lemniscate arc length l are presented using the lemniscate curve. The
relationship between the leaf functions sleaf2(l) and cleaf2(l) is derived
using the geometrical properties of the lemniscate, similarity of triangles,
and the Pythagorean theorem. In the literature, the relation equation for
sleaf2(l) and cleaf2(l) (or the lemniscate functions, sl(l) and cl(l)) has been
derived analytically; however, it is not derived geometrically.
","[{""version"":""v1"",""created"":""Sun, 28 Jun 2020 07:04:50 GMT""},{""version"":""v2"",""created"":""Tue, 5 Jan 2021 02:45:32 GMT""}]","2021-01-06"
"2006.15530","Quoc Van Tran","Quoc Van Tran, Minh Hoang Trinh and Hyo-Sung Ahn","Discrete-Time Matrix-Weighted Consensus","10 pages. IEEE Transactions on Control of Network Systems, 2021",,"10.1109/TCNS.2021.3068367",,"math.OC","http://arxiv.org/licenses/nonexclusive-distrib/1.0/","  This article investigates discrete-time matrix-weighted consensus of
multi-agent networks over undirected and connected graphs. We first present
consensus protocols for the agents in common networks of symmetric matrix
weights with possibly different update rates and switching network topologies.
A special type of matrix-weighted consensus with non-symmetric matrix-weights
that can render several consensus control scenarios such as ones with
scaled/rotated updates and affine motion constraints is also considered. We
employ Lyapunov stability theory for discrete-time systems and occasionally
utilize Lipschitz continuity of the gradient of the Lyapunov function to show
the convergence to a consensus of the agents in the system. Finally, simulation
results are provided to illustrate the theoretical results.
","[{""version"":""v1"",""created"":""Sun, 28 Jun 2020 07:06:46 GMT""}]","2021-03-25"
"2006.15531","Julien Fausty","J. Fausty, B. Murgas, S. Florez, N. Bozzolo, and M. Bernacki","A new level set-finite element formulation for anisotropic grain
  boundary migration",,,,,"cs.CE cond-mat.mtrl-sci math.DG","http://arxiv.org/licenses/nonexclusive-distrib/1.0/","  Grain growth in polycrystals is one of the principal mechanisms that take
place during heat treatment of metallic components. This work treats an aspect
of the anisotropic grain growth problem. By applying the first principles of
thermodynamics and mechanics, an expression for the velocity field of a
migrating grain boundary with an inclination dependent energy density is
expressed. This result is used to generate the first, to the authors'
knowledge, analytical solution (for both the form and kinetics) to an
anisotropic boundary configuration. This new benchmark is simulated in order to
explore the convergence properties of the proposed level set finite element
numerical model in an anisotropic setting. Convergence of the method being
determined, another configuration, using a more general grain boundary energy
density, is investigated in order to show the added value of the new
formulation.
","[{""version"":""v1"",""created"":""Sun, 28 Jun 2020 07:51:07 GMT""}]","2020-06-30"
"2006.15532","Shaochuan Lu","Lu Shaochuan","Scalable Bayesian Multiple Changepoint Detection via Auxiliary
  Uniformization","31 pages, 7 figures",,,,"stat.CO stat.ME","http://arxiv.org/licenses/nonexclusive-distrib/1.0/","  By attaching auxiliary event times to the chronologically ordered
observations, we formulate the Bayesian multiple changepoint problem of
discrete-time observations into that of continuous-time ones. A version of
forward-filtering backward-sampling (FFBS) algorithm is proposed for the
simulation of changepoints within a collapsed Gibbs sampling scheme. Ideally,
both the computational cost and memory cost of the FFBS algorithm can be
quadratically scaled down to the number of changepoints, instead of the number
of observations, which is otherwise prohibitive for a long sequence of
observations. The new formulation allows the number of changepoints accrue
unboundedly upon the arrivals of new data. Also, a time-varying changepoint
recurrence rate across different segments is assumed to characterize diverse
scales of run lengths of changepoints. We then suggest a continuous-time
Viterbi algorithm for obtaining the Maximum A Posteriori (MAP) estimates of
changepoints. We demonstrate the methods through simulation studies and real
data analysis.
","[{""version"":""v1"",""created"":""Sun, 28 Jun 2020 07:52:35 GMT""}]","2020-06-30"
"2006.15533","Vasyl Tokar","V. I. Tokar","Self-consistent renormalization group approach to continuous phase
  transitions in alloys. Application to ordering in $\beta$-brass","Accepted version, 27 pages, 7 figures","Journal of Statistical Mechanics: Theory and Experiment (2021)
  013215","10.1088/1742-5468/abd941",,"cond-mat.stat-mech","http://arxiv.org/licenses/nonexclusive-distrib/1.0/","  A self-consistent (SC) renormalization group approach of the effective medium
kind has been developed and applied to the solution of the Ising model (IM). A
renormalization group equation in the local potential approximation (LPA)
derived previously for spatially homogeneous systems has been extended to the
lattice case and supplemented with a self-consistency condition on the pair
correlation function. To validate the approach it has been applied to the
simple cubic IM and good agreement of the spontaneous magnetization calculated
with the use of the SC-LPA equation with the available exact Monte Carlo
simulations data has been established. Next the approach has been applied to
the bcc IM corresponding to $\beta$-brass. With the use of the effective pair
interaction parameters from available {\em ab initio} calculations the critical
temperature, the correlation length and the long range order parameter in the
vicinity of the critical point have been calculated in excellent agreement with
experimental data. Qualitative and quantitative arguments have been given in
support of the suggestion that the experimentally observed decrease of the
effective critical exponent of the order parameter in comparison with the
universal value is enhanced by the positive value of the second neighbour pair
interaction found in the {\em ab initio} calculations.
","[{""version"":""v1"",""created"":""Sun, 28 Jun 2020 08:02:29 GMT""},{""version"":""v2"",""created"":""Tue, 23 Mar 2021 16:54:53 GMT""}]","2021-03-24"
"2006.15534","Codrut Grosu","Codru\c{t} Grosu and Corina Grosu","The Expansion of Wronskian Hermite Polynomials in the Hermite Basis",,"SIGMA 17 (2021), 003, 14 pages","10.3842/SIGMA.2021.003",,"math.CA","http://creativecommons.org/licenses/by-sa/4.0/","  We express Wronskian Hermite polynomials in the Hermite basis and obtain an
explicit formula for the coefficients. From this we deduce an upper bound for
the modulus of the roots in the case of partitions of length 2. We also derive
a general upper bound for the modulus of the real and purely imaginary roots.
These bounds are very useful in the study of irreducibility of Wronskian
Hermite polynomials. Additionally, we generalize some of our results to a
larger class of polynomials.
","[{""version"":""v1"",""created"":""Sun, 28 Jun 2020 08:07:00 GMT""},{""version"":""v2"",""created"":""Sat, 9 Jan 2021 08:01:48 GMT""}]","2021-01-12"
"2006.15535","Huan Ma","Huan Ma, Guofa Cai, Yi Fang, Pingping Chen, Guojun Han","Design and Performance Analysis of a New STBC-MIMO LoRa System",,,,,"eess.SP","http://arxiv.org/licenses/nonexclusive-distrib/1.0/","  LoRa is a modulation technology for low power wide area networks (LPWAN) with
enormous potential in 5G era. However, the performance of LoRa system
deteriorates seriously in fading-channel environments. To tackle this problem,
in this paper we introduce multiple-input-multiple-output (MIMO) configuration
employing space-time block coding (STBC) schemes into the LoRa system to
formulate an STBC-MIMO LoRa system. Then, we investigate the theoretical
performance of the proposed system over Rayleigh fading channels. To this end,
we derive the distribution of the decision metric for the demodulator in the
proposed system. Based on the above distribution, we propose the closed-form
approximated bit error rate (BER) expression of the proposed system when
perfect and imperfect channel information states (CSIs) are considered. In
addition, we analyze the diversity order of the proposed system. The result
demonstrates that the diversity order of the system in the imperfect CSI
scenario with fixed channel estimate error variance is zero. However, in the
imperfect CSI scenario with a decreasing channel estimate error variance and
the perfect CSI scenario, the system can achieve full diversity. Finally,
experimental results verify the accuracy of the theoretical analysis and the
excellent performance of the proposed system. Due to such superiority, the
proposed STBC-MIMO LoRa system can be considered as a good scheme for LPWAN.
","[{""version"":""v1"",""created"":""Sun, 28 Jun 2020 08:10:18 GMT""}]","2020-06-30"
"2006.15536","Mengyue Xu","Mengyue Xu, Mingbo He, Hongguang Zhang, Jian Jian, Ying Pan, Xiaoyue
  Liu, Lifeng Chen, Xiangyu Meng, Hui Chen, Zhaohui Li, Xi Xiao, Shaohua Yu,
  Siyuan Yu, Xinlun Cai","High-performance Coherent Optical Modulators based on Thin-film Lithium
  Niobate Platform",,"Nat Commun 11, 3911 (2020)","10.1038/s41467-020-17806-0",,"physics.app-ph","http://arxiv.org/licenses/nonexclusive-distrib/1.0/","  The coherent transmission technology using digital signal processing and
advanced modulation formats, is bringing networks closer to the theoretical
capacity limit of optical fibres, the Shannon limit. The in-phase quadrature
electro-optic modulator that encodes information on both the amplitude and the
phase of light, is one of the underpinning devices for the coherent
transmission technology. Ideally, such modulator should feature low loss, low
drive voltage, large bandwidth, low chirp and compact footprint. However, these
requirements have been only met on separate occasions. Here, we demonstrate
integrated thin-film lithium niobate in-phase/quadrature modulators that fulfil
these requirements simultaneously. The presented devices exhibit greatly
improved overall performance (half-wave voltage, bandwidth and optical loss)
over traditional lithium niobate counterparts, and support modulation data rate
up to 320 Gbit s-1. Our devices pave new routes for future high-speed,
energy-efficient, and cost-effective communication networks.
","[{""version"":""v1"",""created"":""Sun, 28 Jun 2020 08:10:27 GMT""}]","2020-08-11"
"2006.15537","Eric Lantz","Eric Lantz, Mehdi Mabed and Fabrice Devaux","Violation of Bell inequalities by stochastic simulations of Gaussian
  States based on their positive Wigner representation","10 pages, 5 figures",,,,"quant-ph","http://arxiv.org/licenses/nonexclusive-distrib/1.0/","  At first sight, the use of an everywhere positive Wigner function as a
probability density to perform stochastic simulations in quantum optics seems
equivalent to the introduction of local hidden variables, thus preventing any
violation of Bell inequalities. However, because of the difference between
symmetrically and normally ordered operators, some trajectories in stochastic
simulations can imply negative intensities, despite a positive mean. Hence,
Bell inequalities do not apply. Here, we retrieve for a weakly squeezed
Gaussian state the maximum violation on polarization states allowed by quantum
mechanics, for the Clauser-Horn-Shimony-Holt (CHSH), as well as for the
Clauser-Horn Bell inequalities. For the case of the Clauser-Horn Bell
inequality, the influence of the quantum efficiency of the detectors is
studied, and for both inequalities, the influence of the degree of squeezing is
assessed, as well as the uncertainty range versus the number of trajectories
used in the simulations.
","[{""version"":""v1"",""created"":""Sun, 28 Jun 2020 08:12:27 GMT""},{""version"":""v2"",""created"":""Wed, 13 Jan 2021 08:27:54 GMT""},{""version"":""v3"",""created"":""Sat, 30 Jan 2021 06:30:54 GMT""}]","2021-02-02"
"2006.15538","Adam Kortylewski","Adam Kortylewski and Qing Liu and Angtian Wang and Yihong Sun and Alan
  Yuille","Compositional Convolutional Neural Networks: A Robust and Interpretable
  Model for Object Recognition under Occlusion",,,,,"cs.CV","http://arxiv.org/licenses/nonexclusive-distrib/1.0/","  Computer vision systems in real-world applications need to be robust to
partial occlusion while also being explainable. In this work, we show that
black-box deep convolutional neural networks (DCNNs) have only limited
robustness to partial occlusion. We overcome these limitations by unifying
DCNNs with part-based models into Compositional Convolutional Neural Networks
(CompositionalNets) - an interpretable deep architecture with innate robustness
to partial occlusion. Specifically, we propose to replace the fully connected
classification head of DCNNs with a differentiable compositional model that can
be trained end-to-end. The structure of the compositional model enables
CompositionalNets to decompose images into objects and context, as well as to
further decompose object representations in terms of individual parts and the
objects' pose. The generative nature of our compositional model enables it to
localize occluders and to recognize objects based on their non-occluded parts.
We conduct extensive experiments in terms of image classification and object
detection on images of artificially occluded objects from the PASCAL3D+ and
ImageNet dataset, and real images of partially occluded vehicles from the
MS-COCO dataset. Our experiments show that CompositionalNets made from several
popular DCNN backbones (VGG-16, ResNet50, ResNext) improve by a large margin
over their non-compositional counterparts at classifying and detecting
partially occluded objects. Furthermore, they can localize occluders accurately
despite being trained with class-level supervision only. Finally, we
demonstrate that CompositionalNets provide human interpretable predictions as
their individual components can be understood as detecting parts and estimating
an objects' viewpoint.
","[{""version"":""v1"",""created"":""Sun, 28 Jun 2020 08:18:19 GMT""}]","2020-06-30"
"2006.15539","Alessandro Calamai","Pierluigi Benevieri, Alessandro Calamai, Massimo Furi, Maria Patrizia
  Pera","A degree associated to linear eigenvalue problems in Hilbert spaces and
  applications to nonlinear spectral theory",,,,,"math.SP","http://arxiv.org/licenses/nonexclusive-distrib/1.0/","  We extend to the infinite dimensional context the link between two completely
different topics recently highlighted by the authors: the classical eigenvalue
problem for real square matrices and the Brouwer degree for maps between
oriented finite dimensional real manifolds. Thanks to this extension, we solve
a conjecture regarding global continuation in nonlinear spectral theory that we
have formulated in a recent article. Our result (the ex conjecture) is applied
to prove a Rabinowitz type global continuation property of the solutions to a
perturbed motion equation containing an air resistance frictional force.
","[{""version"":""v1"",""created"":""Sun, 28 Jun 2020 08:20:57 GMT""},{""version"":""v2"",""created"":""Thu, 7 Jan 2021 09:21:39 GMT""}]","2021-01-08"
"2006.15540","Chang Chi Kwong","C. C. Kwong, T. Wellens, K. Pandey and D. Wilkowski","Resonant forward-scattered field in the high-saturation regime: Elastic
  and inelastic contributions","11 pages, 4 figures","Phys. Rev. A 102, 063722 (2020)","10.1103/PhysRevA.102.063722",,"physics.atom-ph","http://arxiv.org/licenses/nonexclusive-distrib/1.0/","  We measure the resonant forward scattering of light by a highly saturated
atomic medium through the flashes emitted immediately after an abrupt
extinction of the probe beam. The experiment is done in a dilute regime where
the phenomena are well captured using the independent scattering approximation.
Comparing our measurements to a model based on Maxwell-Bloch equations, our
experimental results are consistent with contributions from only the elastic
component, whereas the attenuation of the coherent transmission power is linked
to the elastic and inelastic scatterings. In the large saturation regime and at
the vicinity of the atomic resonance, we derive an asymptotic expression
relating the elastic scattering power to the forward-scattered power.
","[{""version"":""v1"",""created"":""Sun, 28 Jun 2020 08:22:22 GMT""},{""version"":""v2"",""created"":""Sat, 2 Jan 2021 12:58:36 GMT""}]","2021-01-05"
"2006.15541","Alexander Morosov","A.I. Morosov and A.S. Sigov","Defecton Contribution to the High-Temperature Superconductivity of
  Hydrides","10 pages, 1 figure, 1 table",,,,"cond-mat.supr-con cond-mat.dis-nn cond-mat.mtrl-sci","http://arxiv.org/licenses/nonexclusive-distrib/1.0/","  We introduce below the concept of defecton, and describe briefly the electron
polaron effect, the clustering of defectons, and also the defecton mechanism of
superconductivity. It is shown that in the case of high-temperature
superconducting metal hydrides, which acquire superconducting properties under
pressure of hundreds of gigapascals, this mechanism can make a significant
contribution to the Cooper pairing.
","[{""version"":""v1"",""created"":""Sun, 28 Jun 2020 08:28:40 GMT""}]","2020-06-30"
