"2006.15458","The ATLAS Collaboration","ATLAS Collaboration","Differential cross-section measurements for the electroweak production
  of dijets in association with a $Z$ boson in proton-proton collisions at
  ATLAS","55 pages in total, author list starting page 39, 12 figures, 8
  tables, published in EPJ C 81 (2021) 163. All figures including auxiliary
  figures are available at
  http://atlas.web.cern.ch/Atlas/GROUPS/PHYSICS/PAPERS/STDM-2017-27","Eur. Phys. J. C 81 (2021) 163","10.1140/epjc/s10052-020-08734-w","CERN-EP-2020-045","hep-ex","http://creativecommons.org/licenses/by/4.0/","  Differential cross-section measurements are presented for the electroweak
production of two jets in association with a $Z$ boson. These measurements are
sensitive to the vector-boson fusion production mechanism and provide a
fundamental test of the gauge structure of the Standard Model. The analysis is
performed using proton-proton collision data collected by ATLAS at
$\sqrt{s}$=13 TeV and with an integrated luminosity of 139 fb$^{-1}$. The
differential cross-sections are measured in the $Z\rightarrow \ell^+\ell^-$
decay channel ($\ell=e,\mu$) as a function of four observables: the dijet
invariant mass, the rapidity interval spanned by the two jets, the signed
azimuthal angle between the two jets, and the transverse momentum of the
dilepton pair. The data are corrected for the effects of detector inefficiency
and resolution and are sufficiently precise to distinguish between different
state-of-the-art theoretical predictions calculated using Powheg+Pythia8,
Herwig7+Vbfnlo and Sherpa 2.2. The differential cross-sections are used to
search for anomalous weak-boson self-interactions using a dimension-six
effective field theory. The differential cross-section as a function of the
signed azimuthal angle between the two jets is found to be particularly
sensitive to the interference between the Standard Model and dimension-six
scattering amplitudes and provides a direct test of charge-conjugation and
parity invariance in the weak-boson self-interactions.
","[{""version"":""v1"",""created"":""Sat, 27 Jun 2020 22:08:24 GMT""},{""version"":""v2"",""created"":""Wed, 7 Apr 2021 14:59:59 GMT""}]","2021-04-08"
"2006.15459","Stefano Sarao Mannelli","Stefano Sarao Mannelli, Eric Vanden-Eijnden, and Lenka Zdeborov\'a","Optimization and Generalization of Shallow Neural Networks with
  Quadratic Activation Functions","10 pages, 4 figures + appendix","Advances in Neural Information Processing Systems, v33, page
  13445--13455, 2020",,,"cs.LG stat.ML","http://arxiv.org/licenses/nonexclusive-distrib/1.0/","  We study the dynamics of optimization and the generalization properties of
one-hidden layer neural networks with quadratic activation function in the
over-parametrized regime where the layer width $m$ is larger than the input
dimension $d$.
  We consider a teacher-student scenario where the teacher has the same
structure as the student with a hidden layer of smaller width $m^*\le m$.
  We describe how the empirical loss landscape is affected by the number $n$ of
data samples and the width $m^*$ of the teacher network. In particular we
determine how the probability that there be no spurious minima on the empirical
loss depends on $n$, $d$, and $m^*$, thereby establishing conditions under
which the neural network can in principle recover the teacher.
  We also show that under the same conditions gradient descent dynamics on the
empirical loss converges and leads to small generalization error, i.e. it
enables recovery in practice.
  Finally we characterize the time-convergence rate of gradient descent in the
limit of a large number of samples.
  These results are confirmed by numerical experiments.
","[{""version"":""v1"",""created"":""Sat, 27 Jun 2020 22:13:20 GMT""},{""version"":""v2"",""created"":""Mon, 17 Aug 2020 13:00:52 GMT""},{""version"":""v3"",""created"":""Tue, 18 Aug 2020 18:54:51 GMT""}]","2021-03-22"
"2006.15460","Ritobrato Datta","Ritobrato Datta, Micky K. Bacchus, Dushyant Kumar, Mark A. Elliott,
  Aditya Rao, Sudipto Dolui, Ravinder Reddy, Brenda L Banwell, Manojkumar
  Saranathan","Fast automatic segmentation of thalamic nuclei from MP2RAGE acquisition
  at 7 Tesla","13 pages, 4 figures",,,,"eess.IV q-bio.QM","http://arxiv.org/licenses/nonexclusive-distrib/1.0/","  Purpose: Thalamic nuclei are largely invisible in conventional MRI due to
poor contrast. Thalamus Optimized Multi-Atlas Segmentation (THOMAS) provides
automatic segmentation of 12 thalamic nuclei using white-matter-nulled (WMn)
MPRAGE sequence at 7T. Application of THOMAS to Magnetization Prepared 2 Rapid
Gradient Echo (MP2RAGE) sequence acquired at 7T has been investigated in this
study.
  Methods: 8 healthy volunteers and 5 pediatric-onset multiple sclerosis
patients were recruited at the Children's Hospital of Philadelphia and scanned
at Siemens 7T with WMn-MPRAGE and multi-echo MP2RAGE (ME-MP2RAGE) sequences.
White-matter-nulled contrast was synthesized (MP2-SYN) from T1 maps from
ME-MP2RAGE sequence. Thalamic nuclei were segmented using THOMAS joint label
fusion algorithm from WMn-MPRAGE and MP2-SYN datasets. THOMAS pipeline was
modified to use majority voting to segment the bias corrected MP2-UNI images.
Thalamic nuclei from MP2-SYN and MP2-UNI images were evaluated against
corresponding nuclei obtained from WMn-MPRAGE images using dice coefficients,
volume similarity indices (VSI) and distance between centroids.
  Results: For MP2-SYN, dice > 0.85 and VSI > 0.95 was achieved for the 5
larger nuclei and dice > 0.6 and VSI > 0.7 was achieved for the 7 smaller
nuclei. The dice and VSI were slightly higher whilst the distance between
centroids were smaller for MP2-SYN compared to MP2-UNI, indicating improved
performance using the synthesized WMn image.
  Discussion: THOMAS algorithm can successfully segment thalamic nuclei in
routinely acquired bias-free MP2RAGE images with essentially equivalent quality
when evaluated against WMn-MPRAGE, hence has wider applicability in studies
focused on thalamic involvement in aging and disease.
","[{""version"":""v1"",""created"":""Sat, 27 Jun 2020 22:21:23 GMT""}]","2020-06-30"
"2006.15461","Ruohong Li","Ruohong Li and Maryam Mostamand and Jekabs Romans and Jens Lassen","Polarization-dependent laser resonance ionization of beryllium",,,"10.1016/j.sab.2020.105998",,"physics.atom-ph physics.acc-ph","http://arxiv.org/licenses/nonexclusive-distrib/1.0/","  Using TRIUMF's off-line laser ion source test stand with a system of tunable
titanium sapphire lasers, the polarization dependence of laser resonance
ionization has been investigated using beryllium. A significant polarization
dependence was observed for the excitation path
$^1$S$_0$$\rightarrow$$^1$P$^{\circ}_1$$\rightarrow$$^1$S$_0$, which are
typical transitions for alkaline and alkaline-like elements. This polarization
dependence was further verified on Be radioactive isotopes at TRIUMF's isotope
separator and accelerator facility (ISAC). Laser polarization was proven to be
an important parameter in operating resonance ionization laser ion sources
(RILIS).
  The polarization spectroscopy was preformed off-line both on the 2p$^2$
$^1$S$_0$ autoionizing (AI) state and high-$n$ Rydberg states of the $2sns$
$^1S_0$ and $2snd$ $^1D_2$ series. The energy of the 2p$^2$ $^1$S$_0$ AI state
and ionization potential (IP) of beryllium were extracted as 76167(6)~cm$^{-1}$
and 75192.59(3)~cm$^{-1}$. Polarization spectroscopy can be used to determine
the $J$ values of newly found states in in-source spectroscopy of the
complex/radioactive alkaline-like elements such as Ra, Sm, Yb, Pu and No.
","[{""version"":""v1"",""created"":""Sat, 27 Jun 2020 22:22:30 GMT""}]","2020-12-02"
"2006.15462","Terrence Adams","Terry Adams","Genericity and Rigidity for Slow Entropy Transformations","21 pages",,,,"math.DS cs.IT math.IT","http://arxiv.org/licenses/nonexclusive-distrib/1.0/","  The notion of slow entropy, both upper and lower slow entropy, was defined by
Katok and Thouvenot as a more refined measure of complexity for dynamical
systems, than the classical Kolmogorov-Sinai entropy. For any subexponential
rate function $a_n(t)$, we prove there exists a generic class of invertible
measure preserving systems such that the lower slow entropy is zero and the
upper slow entropy is infinite. Also, given any subexponential rate $a_n(t)$,
we show there exists a rigid, weak mixing, invertible system such that the
lower slow entropy is infinite with respect to $a_n(t)$. This gives a general
solution to a question on the existence of rigid transformations with positive
polynomial upper slow entropy, Finally, we connect slow entropy with the notion
of entropy covergence rate presented by Blume. In particular, we show slow
entropy is a strictly stronger notion of complexity and give examples which
have zero upper slow entropy, but also have an arbitrary sublinear positive
entropy convergence rate.
","[{""version"":""v1"",""created"":""Sat, 27 Jun 2020 22:44:23 GMT""},{""version"":""v2"",""created"":""Thu, 16 Jul 2020 02:38:14 GMT""}]","2020-07-17"
"2006.15463","Michael Mitzenmacher","Michael Mitzenmacher","Queues with Small Advice","16 pages, draft version, to be submitted, subject to cahnge",,,,"cs.PF cs.DS cs.LG","http://arxiv.org/licenses/nonexclusive-distrib/1.0/","  Motivated by recent work on scheduling with predicted job sizes, we consider
the performance of scheduling algorithms with minimal advice, namely a single
bit. Besides demonstrating the power of very limited advice, such schemes are
quite natural. In the prediction setting, one bit of advice can be used to
model a simple prediction as to whether a job is ""large"" or ""small""; that is,
whether a job is above or below a given threshold. Further, one-bit advice
schemes can correspond to mechanisms that tell whether to put a job at the
front or the back for the queue, a limitation which may be useful in many
implementation settings. Finally, queues with a single bit of advice have a
simple enough state that they can be analyzed in the limiting mean-field
analysis framework for the power of two choices. Our work follows in the path
of recent work by showing that even small amounts of even possibly inaccurate
information can greatly improve scheduling performance.
","[{""version"":""v1"",""created"":""Sat, 27 Jun 2020 22:44:52 GMT""}]","2020-06-30"
"2006.15464","Roberto Valandro","Andr\'es Collinucci and Roberto Valandro","The role of U(1)'s in 5d theories, Higgs branches, and geometry","41 pages, 7 figures; references added, some clarifications added",,,,"hep-th","http://arxiv.org/licenses/nonexclusive-distrib/1.0/","  We explore the Higgs branches of five-dimensional $\mathcal{N}=1$ quiver
gauge theories at finite coupling from the paradigm of M-theory on local
Calabi-Yau threefolds described as $\mathbb{C}^\ast$-fibrations over local
K3's. By properly counting local deformations of singularities, we find results
compatible with unitary as opposed to special unitary gauge groups. We
interpret these results by dualizing to both IIA on local K3's with D6-branes,
and to IIB with 5-branes. Finally, we find that, by compactifying the
$\mathbb{C}^\ast$-fibers to tori, a well-known St\""uckelberg mechanism
eliminates Abelian factors, and provides missing Higgs branch moduli in a very
interesting way. This is also explained from the dual IIA and IIB viewpoints.
","[{""version"":""v1"",""created"":""Sat, 27 Jun 2020 23:09:35 GMT""},{""version"":""v2"",""created"":""Wed, 2 Dec 2020 14:28:24 GMT""}]","2020-12-03"
"2006.15465","Maxime Dupont","Maxime Dupont, Nicolas Laflorencie, Gabriel Lemari\'e","Dirty bosons on the Cayley tree: Bose-Einstein condensation versus
  ergodicity breaking","21 pages, 16 figures","Phys. Rev. B 102, 174205 (2020)","10.1103/PhysRevB.102.174205",,"cond-mat.dis-nn cond-mat.str-el","http://arxiv.org/licenses/nonexclusive-distrib/1.0/","  Building on large-scale quantum Monte Carlo simulations, we investigate the
zero-temperature phase diagram of hard-core bosons in a random potential on
site-centered Cayley trees with branching number $K=2$. In order to follow how
the Bose-Einstein condensate (BEC) is affected by the disorder, we focus on
both the zero-momentum density, probing the quantum coherence, and the one-body
density matrix (1BDM) whose largest eigenvalue monitors the off-diagonal
long-range order. We further study its associated eigenstate which brings
useful information about the real-space properties of this leading eigenmode.
Upon increasing randomness, we find that the system undergoes a quantum phase
transition at finite disorder strength between a long-range ordered BEC state,
fully ergodic at large scale, and a new disordered Bose glass regime showing
conventional localization for the coherence fraction while the 1BDM displays a
non-trivial algebraic vanishing BEC density together with a non-ergodic
occupation in real-space. These peculiar properties can be analytically
captured by a simple phenomenological description on the Cayley tree which
provides a physical picture of the Bose glass regime.
","[{""version"":""v1"",""created"":""Sat, 27 Jun 2020 23:22:24 GMT""},{""version"":""v2"",""created"":""Thu, 19 Nov 2020 19:04:18 GMT""}]","2020-11-23"
"2006.15466","Rui Liu","Yijiang Pang, Rui Liu","Trust Aware Emergency Response for A Resilient Human-Swarm Cooperative
  System","6 pages",,,,"cs.RO","http://arxiv.org/licenses/nonexclusive-distrib/1.0/","  A human-swarm cooperative system, which mixes multiple robots and a human
supervisor to form a heterogeneous team, is widely used for emergent scenarios
such as criminal tracking in social security and victim assistance in a natural
disaster. These emergent scenarios require a cooperative team to quickly
terminate the current task and transit the system to a new task, bringing
difficulty in motion planning. Moreover, due to the immediate task transitions,
uncertainty from both physical systems and prior tasks is accumulated to
decrease swarm performance, causing robot failures and influencing the
cooperation effectiveness between the human and the robot swarm. Therefore,
given the quick-transition requirements and the introduced uncertainty, it is
challenging for a human-swarm system to respond to emergent tasks, compared
with executing normal tasks where a gradual transition between tasks is
allowed. Human trust reveals the behavior expectations of others and is used to
adjust unsatisfactory behaviors for better cooperation. Inspired by human
trust, in this paper, a trust-aware reflective control (Trust-R) is developed
to dynamically calibrate human-swarm cooperation. Trust-R, based on a weighted
mean subsequence reduced algorithm (WMSR) and human trust modeling, helps a
swarm to self-reflect its performance from the perspective of human trust; then
proactively correct its faulty behaviors in an early stage before a human
intervenes. One typical task scenario {emergency response} was designed in the
real-gravity simulation environment, and a human user study with 145 volunteers
was conducted. Trust-R's effectiveness in correcting faulty behaviors in
emergency response was validated by the improved swarm performance and
increased trust scores.
","[{""version"":""v1"",""created"":""Sat, 27 Jun 2020 23:32:53 GMT""},{""version"":""v2"",""created"":""Sat, 6 Mar 2021 17:03:06 GMT""}]","2021-03-09"
"2006.15467","Cesar Hernandez-Aguayo","C\'esar Hern\'andez-Aguayo, Christian Arnold, Baojiu Li and Carlton M.
  Baugh","Galaxy formation in the brane world I: overview and first results","18 pages, 9 figures, matches with published version","MNRAS, Volume 503, Issue 3, May 2021, Pages 3867-3885","10.1093/mnras/stab694",,"astro-ph.CO astro-ph.GA","http://arxiv.org/licenses/nonexclusive-distrib/1.0/","  We carry out ``full-physics'' hydrodynamical simulations of galaxy formation
in the normal-branch Dvali-Gabadadze-Porrati (nDGP) braneworld model using a
new modified version of the {\sc Arepo} code and the IllustrisTNG galaxy
formation model. We simulate two nDGP models (N5 and N1) which represent,
respectively, weak and moderate departures from GR, in boxes of sizes
$62\,h^{-1}{\rm Mpc}$ and $25\,h^{-1}{\rm Mpc}$ using $2\times512^3$ dark
matter particles and initial gas cells. This allows us to explore, for the
first time, the impact of baryonic physics on galactic scales in braneworld
models of modified gravity and to make predictions on the stellar content of
dark matter haloes and galaxy evolution through cosmic time in these models. We
find significant differences between the GR and nDGP models in the power
spectra and correlation functions of gas, stars and dark matter of up to $\sim
25$ per cent on large scales. Similar to their impact in the standard
cosmological model ($\Lambda$CDM), baryonic effects can have a significant
influence over the clustering of the overall matter distribution, with a sign
that depends on scale. Studying the degeneracy between modified gravity and
galactic feedback in these models, we find that these two physical effects on
matter clustering can be cleanly disentangled, allowing for a method to
accurately predict the matter power spectrum with baryonic effects included,
without having to run hydrodynamical simulations. Depending on the braneworld
model, we find differences compared with GR of up to $\sim15$ per cent in
galaxy properties such as the stellar-to-halo-mass ratio, galaxy stellar mass
function, gas fraction and star formation rate density. The amplitude of the
fifth force is reduced by the presence of baryons in the very inner part of
haloes, but this reduction quickly becomes negligible above $\sim0.1$ times the
halo radius.
","[{""version"":""v1"",""created"":""Sat, 27 Jun 2020 23:41:41 GMT""},{""version"":""v2"",""created"":""Sun, 13 Jun 2021 15:11:14 GMT""}]","2021-06-15"
"2006.15468","Alban Poth\'erat","Alban Poth\'erat, Jo\""el Sommeria and Ren\'e Moreau","An effective two-dimensional model for MHD flows with transverse
  magnetic field",,"J.Fluid Mech, 424, 75-100 (2000)","10.1017/S0022112000001944",,"physics.flu-dyn","http://arxiv.org/licenses/nonexclusive-distrib/1.0/","  This paper presents a model for quasi two-dimensional MHD flows between two
planes with small magnetic Reynolds number and constant transverse magnetic
field orthogonal to the planes. A method is presented that allows to take 3D
effects into account in a 2D equation of motion thanks to a model for the
transverse velocity profile. The latter is obtained by using a double
perturbation asymptotic development both in the core flow and in the Hartmann
layers arising along the planes. A new model is thus built that describes
inertial effects in these two regions. Two separate classes of phenomena are
thus pointed out : the one related to inertial effects in the Hartmann layer
gives a model for recirculating flows and the other introduces the possibility
of having a transverse dependence of the velocity profile in the core flow. The
''recirculating'' velocity profile is then introduced in the transversally
averaged equation of motion in order to provide an effective 2D equation of
motion. Analytical solutions of this model are obtained for two experimental
configurations : isolated vortices aroused by a point electrode and
axisymmetric parallel layers occurring in the MATUR (MAgneticTURbulence)
experiment. The theory is found to give a satisfactory agreement with the
experiment so that it can be concluded that recirculating flows are actually
responsible for both vortices core spreading and excessive dissipative behavior
of the axisymmetric side wall layers.
","[{""version"":""v1"",""created"":""Sun, 28 Jun 2020 00:04:25 GMT""}]","2020-06-30"
"2006.15469","Abdelkader Nasreddine Belkacem","Abdelkader Nasreddine Belkacem, Sofia Ouhbi, Abderrahmane Lakas,
  Elhadj Benkhelifa, Chao Chen","End-to-End AI-Based Point-of-Care Diagnosis System for Classifying
  Respiratory Illnesses and Early Detection of COVID-19",,,,,"eess.SP cs.AI cs.AR cs.SD eess.AS","http://arxiv.org/licenses/nonexclusive-distrib/1.0/","  Respiratory symptoms can be a caused by different underlying conditions, and
are often caused by viral infections, such as Influenza-like illnesses or other
emerging viruses like the Coronavirus. These respiratory viruses, often, have
common symptoms, including coughing, high temperature, congested nose, and
difficulty breathing. However, early diagnosis of the type of the virus, can be
crucial, especially in cases such as the recent COVID-19 pandemic. One of the
factors that contributed to the spread of the pandemic, was the late diagnosis
or confusing it with regular flu-like symptoms. Science has proved that one of
the possible differentiators of the underlying causes of these different
respiratory diseases is coughing, which comes in different types and forms.
Therefore, a reliable lab-free tool for early and more accurate diagnosis that
can differentiate between different respiratory diseases is very much needed.
This paper proposes an end-to-end portable system that can record data from
patients with symptom, including coughs (voluntary or involuntary) and
translate them into health data for diagnosis, and with the aid of machine
learning, classify them into different respiratory illnesses, including
COVID-19. With the ongoing efforts to stop the spread of the COVID-19 disease
everywhere today, and against similar diseases in the future, our proposed low
cost and user-friendly solution can play an important part in the early
diagnosis.
","[{""version"":""v1"",""created"":""Sun, 28 Jun 2020 00:06:48 GMT""}]","2020-07-02"
"2006.15470","Murat Kuscu Dr","Murat Kuscu, Hamideh Ramezani, Ergin Dinc, Shahab Akhavan, Ozgur B.
  Akan","Graphene-based Nanoscale Molecular Communication Receiver: Fabrication
  and Microfluidic Analysis","References fixed",,,,"cs.ET physics.app-ph","http://arxiv.org/licenses/nonexclusive-distrib/1.0/","  Bio-inspired molecular communications (MC), where molecules are used to
transfer information, is the most promising technique to realise the Internet
of Nano Things (IoNT), thanks to its inherent biocompatibility,
energy-efficiency, and reliability in physiologically-relevant environments.
Despite a substantial body of theoretical work concerning MC, the lack of
practical micro/nanoscale MC devices and MC testbeds has led researchers to
make overly simplifying assumptions about the implications of the channel
conditions and the physical architectures of the practical transceivers in
developing theoretical models and devising communication methods for MC. On the
other hand, MC imposes unique challenges resulting from the highly complex,
nonlinear, time-varying channel properties that cannot be always tackled by
conventional information and communication tools and technologies (ICT). As a
result, the reliability of the existing MC methods, which are mostly adopted
from electromagnetic communications and not validated with practical testbeds,
is highly questionable. As the first step to remove this discrepancy, in this
study, we report on the fabrication of a nanoscale MC receiver based on
graphene field-effect transistor biosensors. We perform its ICT
characterisation in a custom-designed microfluidic MC system with the
information encoded into the concentration of single-stranded DNA molecules.
This experimental platform is the first practical implementation of a
micro/nanoscale MC system with nanoscale MC receivers, and can serve as a
testbed for developing realistic MC methods and IoNT applications.
","[{""version"":""v1"",""created"":""Sun, 28 Jun 2020 00:10:58 GMT""},{""version"":""v2"",""created"":""Sat, 4 Jul 2020 22:58:08 GMT""}]","2020-07-07"
"2006.15471","Cunquan Qu","Zhaoyue Zhong, Xiangrong Wang, Cunquan Qu, and Guanghui Wang","Efficient algorithm based on non-backtracking matrix for community
  detection in signed networks","11 pages,9 figures",,,,"physics.soc-ph cs.SI","http://arxiv.org/licenses/nonexclusive-distrib/1.0/","  Community detection or clustering is a crucial task for understanding the
structure of complex systems. In some networks, nodes are permitted to be
linked by either ""positive"" or ""negative"" edges; such networks are called
signed networks. Discovering communities in signed networks is more challenging
than that in unsigned networks. In this study, we innovatively develop a
non-backtracking matrix of signed networks, theoretically derive a
detectability threshold for this matrix, and demonstrate the feasibility of
using the matrix for community detection. We further improve the developed
matrix by considering the balanced paths in the network (referred to as a
balanced non-backtracking matrix). Simulation results demonstrate that the
algorithm based on the balanced nonbacktracking matrix significantly
outperforms those based on the adjacency matrix and the signed non-backtracking
matrix. The proposed (improved) matrix shows great potential for detecting
communities with or without overlap.
","[{""version"":""v1"",""created"":""Sun, 28 Jun 2020 00:12:32 GMT""},{""version"":""v2"",""created"":""Mon, 10 Aug 2020 16:48:43 GMT""},{""version"":""v3"",""created"":""Sat, 10 Oct 2020 13:13:58 GMT""}]","2020-10-13"
