"2006.15594","Karim Sonbol","Karim Sonbol, \""Oznur \""Ozkasap, Ibrahim Al-Oqily, Moayad Aloqaily","EdgeKV: Decentralized, scalable, and consistent storage for the edge","13 pages, 13 figures",,,,"cs.DC","http://arxiv.org/licenses/nonexclusive-distrib/1.0/","  Edge computing moves the computation closer to the data and the data closer
to the user to overcome the high latency communication of cloud computing.
Storage at the edge allows data access with high speeds that enable
latency-sensitive applications in areas such as autonomous driving and smart
grid. However, several distributed services are typically designed for the
cloud and building an efficient edge-enabled storage system is challenging
because of the distributed and heterogeneous nature of the edge and its limited
resources. In this paper, we propose EdgeKV, a decentralized storage system
designed for the network edge. EdgeKV offers fast and reliable storage,
utilizing data replication with strong consistency guarantees. With a
location-transparent and interface-based design, EdgeKV can scale with a
heterogeneous system of edge nodes. We implement a prototype of the EdgeKV
modules in Golang and evaluate it in both the edge and cloud settings on the
Grid'5000 testbed. We utilize the Yahoo! Cloud Serving Benchmark (YCSB) to
analyze the system's performance under realistic workloads. Our evaluation
results show that EdgeKV outperforms the cloud storage setting with both local
and global data access with an average write response time and throughput
improvements of 26% and 19% respectively under the same settings. Our
evaluations also show that EdgeKV can scale with the number of clients, without
sacrificing performance. Finally, we discuss the energy efficiency improvement
when utilizing edge resources with EdgeKV instead of a centralized cloud.
","[{""version"":""v1"",""created"":""Sun, 28 Jun 2020 13:08:34 GMT""}]","2020-06-30"
"2006.15595","Guolin Ke","Guolin Ke, Di He, Tie-Yan Liu","Rethinking Positional Encoding in Language Pre-training","update to ICLR's version","International Conference on Learning Representations (ICLR) 2021,
  https://openreview.net/forum?id=09-528y2Fgf",,,"cs.CL cs.LG","http://arxiv.org/licenses/nonexclusive-distrib/1.0/","  In this work, we investigate the positional encoding methods used in language
pre-training (e.g., BERT) and identify several problems in the existing
formulations. First, we show that in the absolute positional encoding, the
addition operation applied on positional embeddings and word embeddings brings
mixed correlations between the two heterogeneous information resources. It may
bring unnecessary randomness in the attention and further limit the
expressiveness of the model. Second, we question whether treating the position
of the symbol \texttt{[CLS]} the same as other words is a reasonable design,
considering its special role (the representation of the entire sentence) in the
downstream tasks. Motivated from above analysis, we propose a new positional
encoding method called \textbf{T}ransformer with \textbf{U}ntied
\textbf{P}ositional \textbf{E}ncoding (TUPE). In the self-attention module,
TUPE computes the word contextual correlation and positional correlation
separately with different parameterizations and then adds them together. This
design removes the mixed and noisy correlations over heterogeneous embeddings
and offers more expressiveness by using different projection matrices.
Furthermore, TUPE unties the \texttt{[CLS]} symbol from other positions, making
it easier to capture information from all positions. Extensive experiments and
ablation studies on GLUE benchmark demonstrate the effectiveness of the
proposed method. Codes and models are released at
https://github.com/guolinke/TUPE.
","[{""version"":""v1"",""created"":""Sun, 28 Jun 2020 13:11:02 GMT""},{""version"":""v2"",""created"":""Tue, 30 Jun 2020 02:57:50 GMT""},{""version"":""v3"",""created"":""Thu, 9 Jul 2020 02:53:21 GMT""},{""version"":""v4"",""created"":""Mon, 15 Mar 2021 07:56:22 GMT""}]","2021-03-16"
"2006.15596","Leslaw Rachwal","Petr Jizba, Les{\l}aw Rachwa{\l}, Stefano G. Giaccari, Jaroslav
  K\v{n}ap","Dark side of Weyl gravity","48 pages","Universe 2020, 6(8), 123","10.3390/universe6080123",,"hep-th gr-qc hep-ph","http://arxiv.org/licenses/nonexclusive-distrib/1.0/","  With the help of a functional renormalization group, we study the dynamical
breakdown of scale invariance in quantum Weyl gravity by starting from the UV
fixed point that we assume to be Gaussian. To this end, we resort to two
classes of Bach-flat backgrounds, namely maximally symmetric spacetimes and
Ricci-flat backgrounds in the improved one-loop scheme. We show that apart from
a genuine IR fixed point that is reached at a zero value of the running scale,
the renormalization group flow also exhibits bouncing behavior. We demonstrate
that the IR fixed point found is IR-stable in the space of the considered
couplings. As a next step, we analyze physics in the broken phase. In
particular, we show that in the low-energy sector of the broken phase, the
theory looks like Starobinsky $f(R)$ gravity with a gravi-cosmological constant
that has a negative sign in comparison to the usual matter-induced cosmological
constant. We discuss implications for cosmic inflation and highlight a
non-trivial relation between Starobinsky's parameter and the gravi-cosmological
constant. Salient issues, including the scheme independence of the IR fixed
point and the role of trace anomaly, are also discussed.
","[{""version"":""v1"",""created"":""Sun, 28 Jun 2020 13:14:19 GMT""}]","2020-08-17"
"2006.15597","Mustafa Moumni Prof","Mourad Baazouzi, Mustafa Moumni and Mokhtar Falek","Exact Solutions for a Quantum Ring with a Dipolar Impurity","15 pages, 8 figures","Eur. Phys. J. Plus 135, 894 (2020)","10.1140/epjp/s13360-020-00922-7",,"quant-ph cond-mat.mes-hall","http://arxiv.org/licenses/nonexclusive-distrib/1.0/","  We study analytically a system made up of a quantum ring with a dipolar
impurity and under the effect of an Aharonov-Bohm field. We calculate the exact
values of the energies and we also get the exact expressions of the wave
functions.
","[{""version"":""v1"",""created"":""Sun, 28 Jun 2020 13:16:18 GMT""}]","2021-02-16"
"2006.15598","A. Nezih Kasim","A. Nezih Kasim","A Survey Mobility Management in 5G Networks","6 pages, 2 figures, pre-print, survey",,,,"cs.NI","http://arxiv.org/licenses/nonexclusive-distrib/1.0/","  For the next wireless communication systems, the major challenges are to
provide ubiquitous wireless access abilities and maintain the quality of
service and seamless mobility management for mobile communication devices in
heterogeneous networks. Due to the rapid growth of mobile users, this demand
becomes more challenging where the users always require seamless connectivity
while they move to other places at any time. As the number of users increases,
the network load also increases, the handover process needs to be performed in
an efficient way. However, in many situations, the handover blocking, and
unnecessary handover frequently happens, then affect the network and reduces
its performance. The problem arises with the movement of mobile users between
base stations while the link connectivity becomes weaker and the mobile node
tries to switch to another base station to have a better link quality during a
call for higher QoS (Quality of Service). In this survey, it is aimed to gather
together the studies that help to improve mobility management processes in 5G
(Fifth Generation) cellular networks.
","[{""version"":""v1"",""created"":""Sun, 28 Jun 2020 13:24:58 GMT""}]","2020-06-30"
"2006.15599","Wenxuan Zhang","Wenxuan Zhang, Yang Deng, Wai Lam","Answer Ranking for Product-Related Questions via Multiple Semantic
  Relations Modeling","Accepted by SIGIR 2020",,,,"cs.IR","http://creativecommons.org/licenses/by/4.0/","  Many E-commerce sites now offer product-specific question answering platforms
for users to communicate with each other by posting and answering questions
during online shopping. However, the multiple answers provided by ordinary
users usually vary diversely in their qualities and thus need to be
appropriately ranked for each question to improve user satisfaction. It can be
observed that product reviews usually provide useful information for a given
question, and thus can assist the ranking process. In this paper, we
investigate the answer ranking problem for product-related questions, with the
relevant reviews treated as auxiliary information that can be exploited for
facilitating the ranking. We propose an answer ranking model named MUSE which
carefully models multiple semantic relations among the question, answers, and
relevant reviews. Specifically, MUSE constructs a multi-semantic relation graph
with the question, each answer, and each review snippet as nodes. Then a
customized graph convolutional neural network is designed for explicitly
modeling the semantic relevance between the question and answers, the content
consistency among answers, and the textual entailment between answers and
reviews. Extensive experiments on real-world E-commerce datasets across three
product categories show that our proposed model achieves superior performance
on the concerned answer ranking task.
","[{""version"":""v1"",""created"":""Sun, 28 Jun 2020 13:26:17 GMT""}]","2020-06-30"
"2006.15600","Daniel D\""orfler","Daniel D\""orfler and Andreas L\""ohne and Christopher Schneider and
  Benjamin Wei{\ss}ing","A Benson-Type Algorithm for Bounded Convex Vector Optimization Problems
  with Vertex Selection","19 pages, 4 figures, 4 tables",,,,"math.OC","http://arxiv.org/licenses/nonexclusive-distrib/1.0/","  We present an algorithm for approximately solving bounded convex vector
optimization problems. The algorithm provides both an outer and an inner
polyhedral approximation of the upper image. It is a modification of the primal
algorithm presented by L\""ohne, Rudloff, and Ulus in 2014. There, vertices of
an already known outer approximation are successively cut off to improve the
approximation error. We propose a new and efficient selection rule for deciding
which vertex to cut off. Numerical examples are provided which illustrate that
this method may solve fewer scalar problems overall and therefore may be faster
while achieving the same approximation quality.
","[{""version"":""v1"",""created"":""Sun, 28 Jun 2020 13:32:14 GMT""}]","2020-06-30"
"2006.15601","Mustafa Moumni Prof","Zoubir Hemame, Mokhtar Falek and Mustafa Moumni","Exact Solutions of D-dimensional Klein-Gordon Oscillator with Snyder-de
  Sitter Algebra","16 pages, 5 figures","Journal of Mathematical Physics 61, 102301 (2020)","10.1063/5.0015150",,"quant-ph math-ph math.MP","http://arxiv.org/licenses/nonexclusive-distrib/1.0/","  We study the effects of Snyder-de Sitter commutation relations on
relativistic bosons by solving analytically in the momentum space
representation the Klein-Gordon oscillator in arbitrary dimensions. The exact
bound states spectrum and the corresponding momentum space wave functions are
obtained using Gegenbauer polynomials in one dimension space and Jacobi
polynomials in D dimensions case. Finally, we study the thermodynamic
properties of the system in the high temperature regime where we found that the
corrections increase the free energy but decrease the energy, the entropy and
the specific heat which is no longer constant. This work extends the part
concerning the Klein-Gordon oscillator for the Snyder-de Sitter case studied in
two-dimensional space in J. Math. Phys. 60, 013505 (2019).
","[{""version"":""v1"",""created"":""Sun, 28 Jun 2020 13:32:37 GMT""}]","2021-02-16"
"2006.15602","Alena Kopanicakova","Vanessa Braglia and Alena Kopani\v{c}\'akov\'a and Rolf Krause","A Multilevel Approach to Training",,,,,"cs.LG stat.ML","http://arxiv.org/licenses/nonexclusive-distrib/1.0/","  We propose a novel training method based on nonlinear multilevel minimization
techniques, commonly used for solving discretized large scale partial
differential equations. Our multilevel training method constructs a multilevel
hierarchy by reducing the number of samples. The training of the original model
is then enhanced by internally training surrogate models constructed with fewer
samples. We construct the surrogate models using first-order consistency
approach. This gives rise to surrogate models, whose gradients are stochastic
estimators of the full gradient, but with reduced variance compared to standard
stochastic gradient estimators. We illustrate the convergence behavior of the
proposed multilevel method to machine learning applications based on logistic
regression. A comparison with subsampled Newton's and variance reduction
methods demonstrate the efficiency of our multilevel method.
","[{""version"":""v1"",""created"":""Sun, 28 Jun 2020 13:34:48 GMT""}]","2020-06-30"
"2006.15603","Yu Ge","Yu Ge, Hyowon Kim, Fuxi Wen, Lennart Svensson, Sunwoo Kim, Henk
  Wymeersch","Exploiting Diffuse Multipath in 5G SLAM","6 pages, 9 figures",,,,"eess.SP","http://arxiv.org/licenses/nonexclusive-distrib/1.0/","  5G millimeter wave (mmWave) signals can be used to jointly localize the
receiver and map the propagation environment in vehicular networks, which is a
typical simultaneous localization and mapping (SLAM) problem. Mapping the
environment is challenging, due to measurements comprising both specular and
diffuse multipath components, and diffuse multipath is usually considered as a
perturbation. We here propose a novel method to utilize all available multipath
signals from each landmark for mapping and incorporate this into a Poisson
multi-Bernoulli mixture for the 5G SLAM problem. Simulation results demonstrate
the efficacy of the proposed scheme.
","[{""version"":""v1"",""created"":""Sun, 28 Jun 2020 13:41:55 GMT""}]","2021-06-01"
"2006.15604","Johannes Lederer","Mohamed Hebiri and Johannes Lederer","Layer Sparsity in Neural Networks",,,,,"cs.LG cs.NE stat.ML","http://arxiv.org/licenses/nonexclusive-distrib/1.0/","  Sparsity has become popular in machine learning, because it can save
computational resources, facilitate interpretations, and prevent overfitting.
In this paper, we discuss sparsity in the framework of neural networks. In
particular, we formulate a new notion of sparsity that concerns the networks'
layers and, therefore, aligns particularly well with the current trend toward
deep networks. We call this notion layer sparsity. We then introduce
corresponding regularization and refitting schemes that can complement standard
deep-learning pipelines to generate more compact and accurate networks.
","[{""version"":""v1"",""created"":""Sun, 28 Jun 2020 13:41:59 GMT""}]","2020-06-30"
"2006.15605","H\'eber H. Arcolezi","H\'eber H. Arcolezi, Willian R. B. M. Nunes, Rafael A. de Araujo,
  Selene Cerna, Marcelo A. A. Sanches, Marcelo C. M. Teixeira, Aparecido A. de
  Carvalho","RISE Controller Tuning and System Identification Through Machine
  Learning for Human Lower Limb Rehabilitation via Neuromuscular Electrical
  Stimulation","49 pages, 16 figures, 5 tables","Engineering Applications of Artificial Intelligence 102C (2021)
  104294","10.1016/j.engappai.2021.104294",,"eess.SY cs.SY eess.SP","http://arxiv.org/licenses/nonexclusive-distrib/1.0/","  Neuromuscular electrical stimulation (NMES) has been effectively applied in
many rehabilitation treatments of individuals with spinal cord injury (SCI). In
this context, we introduce a novel, robust, and intelligent control-based
methodology to closed-loop NMES systems. Our approach utilizes a robust control
law to guarantee system stability and machine learning tools to optimize both
the controller parameters and system identification. Regarding the latter, we
introduce the use of past rehabilitation data to build more realistic
data-driven identified models. Furthermore, we apply the proposed methodology
for the rehabilitation of lower limbs using a control technique named the
robust integral of the sign of the error (RISE), an offline improved genetic
algorithm optimizer, and neural network models. Although in the literature, the
RISE controller presented good results on healthy subjects, without any
fine-tuning method, a trial and error approach would quickly lead to muscle
fatigue for individuals with SCI. In this paper, for the first time, the RISE
controller is evaluated with two paraplegic subjects in one stimulation session
and with seven healthy individuals in at least two and at most five sessions.
The results showed that the proposed approach provided a better control
performance than empirical tuning, which can avoid premature fatigue on
NMES-based clinical procedures.
","[{""version"":""v1"",""created"":""Sun, 28 Jun 2020 13:42:35 GMT""},{""version"":""v2"",""created"":""Mon, 10 May 2021 19:39:29 GMT""}]","2021-05-12"
"2006.15606","Joel Merker (LM-Orsay)","Joel Merker (Orsay) and Pawel Nurowski (Warsaw)","Five-dimensional para-CR manifolds and contact projective geometry in
  dimension three","19 pages",,,,"math.DG math.AG","http://arxiv.org/licenses/nonexclusive-distrib/1.0/","  We study invariant properties of $5$-dimensional para-CR structures whose
Levi form is degenerate in precisely one direction and which are
$2$-nondegenerate. We realize that two, out of three, primary (basic) para-CR
invariants of such structures are the classical differential invariants known
to Monge (1810) and to Wuenschmann (1905) \[ M(G) :=
40G_{ppp}^3-45G_{pp}G_{ppp}G_{pppp}+9G_{pp}^2G_{ppppp}, \quad W(H) :=
9D^2H_r-27DH_p-18H_rDH_r+18H_pH_r+4H_r^3+54H_z. \] The vanishing $M(G) \equiv
0$ provides a local necessary and sufficient condition for the graph of a
function in the $(p,G)$-plane to be contained in a conic, while the vanishing
$W(H) \equiv 0$ gives an if-and-only-if condition for a 3rd order ODE to define
a natural Lorentzian geometry on the space of its solutions.
  Mainly, we give a geometric interpretation of the third basic invariant of
our class of para-CR structures, the simplest one, of lowest order, and of
mixed nature $N(G,H):=2G_{ppp}+G_{pp}H_{rr}$. We establish that the vanishing
$N(G,H) \equiv 0$ gives an if-and-only-if condition for the two $3$-dimensional
quotients of the para-CR manifold by its two canonical integrable rank-$2$
distributions, to be equipped with contact projective geometries. A curious
transformation between the Wuenschmann invariant and the Monge invariant, first
noted by us in arXiv:2003.08166, is also discussed, and its mysteries are
further revealed.
","[{""version"":""v1"",""created"":""Sun, 28 Jun 2020 13:43:03 GMT""}]","2021-08-24"
"2006.15607","Youngwan Lee","Youngwan Lee, Joong-won Hwang, Hyung-Il Kim, Kimin Yun, Yongjin Kwon,
  Yuseok Bae, Sung Ju Hwang","Localization Uncertainty Estimation for Anchor-Free Object Detection",,,,,"cs.CV","http://arxiv.org/licenses/nonexclusive-distrib/1.0/","  Since many safety-critical systems, such as surgical robots and autonomous
driving cars operate in unstable environments with sensor noise and incomplete
data, it is desirable for object detectors to take the localization uncertainty
into account. However, there are several limitations of the existing
uncertainty estimation methods for anchor-based object detection. 1) They model
the uncertainty of the heterogeneous object properties with different
characteristics and scales, such as location (center point) and scale (width,
height), which could be difficult to estimate. 2) They model box offsets as
Gaussian distributions, which is not compatible with the ground truth bounding
boxes that follow the Dirac delta distribution. 3) Since anchor-based methods
are sensitive to anchor hyper-parameters, their localization uncertainty could
also be highly sensitive to the choice of hyper-parameters. To tackle these
limitations, we propose a new localization uncertainty estimation method called
UAD for anchor-free object detection. Our method captures the uncertainty in
four directions of box offsets (left, right, top, bottom) that are homogeneous,
so that it can tell which direction is uncertain, and provide a quantitative
value of uncertainty in [0, 1]. To enable such uncertainty estimation, we
design a new uncertainty loss, negative power log-likelihood loss, to measure
the localization uncertainty by weighting the likelihood loss by its IoU, which
alleviates the model misspecification problem. Furthermore, we propose an
uncertainty-aware focal loss for reflecting the estimated uncertainty to the
classification score. Experimental results on COCO datasets demonstrate that
our method significantly improves FCOS, by up to 1.8 points, without
sacrificing computational efficiency.
","[{""version"":""v1"",""created"":""Sun, 28 Jun 2020 13:49:30 GMT""},{""version"":""v2"",""created"":""Mon, 20 Jul 2020 09:51:51 GMT""},{""version"":""v3"",""created"":""Tue, 24 Nov 2020 00:24:14 GMT""},{""version"":""v4"",""created"":""Mon, 30 Nov 2020 00:18:43 GMT""},{""version"":""v5"",""created"":""Thu, 9 Sep 2021 08:12:23 GMT""},{""version"":""v6"",""created"":""Wed, 6 Jul 2022 05:18:04 GMT""}]","2022-07-07"
"2006.15608","Mingpu Qin","Mingpu Qin","Combination of Tensor Network States and Green's function Monte Carlo","4+ pages, 4 figures, close to published version","Phys. Rev. B 102, 125143 (2020)","10.1103/PhysRevB.102.125143",,"cond-mat.str-el","http://arxiv.org/licenses/nonexclusive-distrib/1.0/","  We propose an approach to study the ground state of quantum many-body systems
in which Tensor Network States (TNS), specifically Projected Entangled Pair
States (PEPS), and Green's function Monte Carlo (GFMC) are combined. PEPS, by
design, encode the area law which governs the scaling of entanglement entropy
in quantum systems with short range interactions but are hindered by the high
computational complexity scaling with bond dimension (D). GFMC is a highly
efficient method, but it usually suffers from the infamous negative sign
problem which can be avoided by the fixed node approximation in which a guiding
wave function is utilized to modify the sampling process. The trade-off for the
absence of negative sign problem is the introduction of systematic error by
guiding wave function. In this work, we combine these two methods, PEPS and
GFMC, to take advantage of both of them. PEPS are very accurate variational
wave functions, while at the same time, only contractions of single-layer
tensor network are necessary in GFMC, which reduces the cost substantially.
Moreover, energy obtained in GFMC is guaranteed to be variational and lower
than the variational energy of the guiding PEPS wave function. Benchmark
results of $J_1$-$J_2$ Heisenberg model on square lattice are provided.
","[{""version"":""v1"",""created"":""Sun, 28 Jun 2020 13:50:47 GMT""},{""version"":""v2"",""created"":""Sat, 26 Sep 2020 10:07:36 GMT""}]","2020-09-29"
"2006.15609","Shankar Bhamidi","Sayan Banerjee and Shankar Bhamidi","Root finding algorithms and persistence of Jordan centrality in growing
  random trees","Final accepted version",,,,"math.PR","http://arxiv.org/licenses/nonexclusive-distrib/1.0/","  We consider models of growing random trees $\{\mathcal{T}_f(n):n\geq 1\}$
with model dynamics driven by an attachment function $f:\mathbb{Z}_+\to
\mathbb{R}_+$. At each stage a new vertex enters the system and connects to a
vertex $v$ in the current tree with probability proportional to
$f(\text{degree}(v))$. The main goal of this study is to understand the
performance of root finding algorithms. A large body of work (e.g. the work of
Bubeck, Devroye and Lugosi or Jog and Loh) has emerged in the last few years in
using techniques based on the Jordan centrality measure and its variants to
develop root finding algorithms. Given an unlabelled unrooted tree, one
computes the Jordan centrality for each vertex in the tree and for a fixed
budget $K$ outputs the optimal $K$ vertices (as measured by Jordan centrality).
Under general conditions on the attachment function $f$, we derive necessary
and sufficient bounds on the budget $K(\epsilon)$ in order to recover the root
with probability at least $1-\epsilon$. For canonical examples such as linear
preferential attachment and uniform attachment, these general results give
matching upper and lower bounds for the budget. We also prove persistence of
the optimal $K$ Jordan centers for any $K$, i.e. the existence of an almost
surely finite random time $n^*$ such that for $n \geq n^*$ the identity of the
$K$-optimal Jordan centers in $\{\mathcal{T}_f(n):n\geq n^*\}$ does not change,
thus describing robustness properties of this measure. Key technical
ingredients in the proofs of independent interest include sufficient conditions
for the existence of exponential moments for limits of (appropriately
normalized) continuous time branching processes within which the models
$\{\mathcal{T}_f(n):n\geq n^*\}$ can be embedded, as well as rates of
convergence results to these limits.
","[{""version"":""v1"",""created"":""Sun, 28 Jun 2020 13:55:54 GMT""},{""version"":""v2"",""created"":""Mon, 9 Aug 2021 18:16:05 GMT""}]","2021-08-11"
