"2006.15865","Aditi Shenvi","Aditi Shenvi and Jim Q. Smith","Propagation for Dynamic Continuous Time Chain Event Graphs",,,,,"cs.AI stat.ML","http://arxiv.org/licenses/nonexclusive-distrib/1.0/","  Chain Event Graphs (CEGs) are a family of event-based graphical models that
represent context-specific conditional independences typically exhibited by
asymmetric state space problems. The class of continuous time dynamic CEGs
(CT-DCEGs) provides a factored representation of longitudinally evolving
trajectories of a process in continuous time. Temporal evidence in a CT-DCEG
introduces dependence between its transition and holding time distributions. We
present a tractable exact inferential scheme analogous to the scheme in
Kj{\ae}rulff (1992) for discrete Dynamic Bayesian Networks (DBNs) which employs
standard junction tree inference by ""unrolling"" the DBN. To enable this scheme,
we present an extension of the standard CEG propagation algorithm (Thwaites et
al., 2008). Interestingly, the CT-DCEG benefits from simplification of its
graph on observing compatible evidence while preserving the still relevant
symmetries within the asymmetric network. Our results indicate that the CT-DCEG
is preferred to DBNs and continuous time BNs under contexts involving
significant asymmetry and a natural total ordering of the process evolution.
","[{""version"":""v1"",""created"":""Mon, 29 Jun 2020 08:24:57 GMT""}]","2020-06-30"
"2006.15866","C\'eline Torres","Stefan Sauter and C\'eline Torres","The Heterogeneous Helmholtz Problem with Spherical Symmetry: Green's
  Operator and Stability Estimates",,,,,"math.NA cs.NA","http://arxiv.org/licenses/nonexclusive-distrib/1.0/","  We study wave propagation phenomena modelled in the frequency domain by the
Helmholtz equation in heterogeneous media with focus on media with
discontinuous, highly oscillating wave speed. We restrict to problems with
spherical symmetry and will derive explicit representations of the Green's
operator and stability estimates which are explicit in the frequency and the
wave speed.
","[{""version"":""v1"",""created"":""Mon, 29 Jun 2020 08:25:23 GMT""}]","2020-06-30"
"2006.15867","Alexander Sakhnovich","Inna Roitberg and Alexander Sakhnovich","On the inversion of the block double-structured and of the
  triple-structured Toeplitz matrices and on the corresponding reflection
  coefficients","in this preprint, we further develop the approach presented in
  arXiv:1704.02267",,,,"math.CA math.FA math.RA","http://arxiv.org/licenses/nonexclusive-distrib/1.0/","  The results on the inversion of convolution operators as well as Toeplitz
(and block Toeplitz) matrices in the $1$-D (one-dimensional) case are classical
and have numerous applications. Last year, we considered the $2$-D case of
Toeplitz-block Toeplitz (TBT) matrices, described a minimal information, which
is necessary to recover the inverse matrices, and gave a complete
characterisation of the inverse matrices. Now, we develop our approach for the
more complicated cases of block TBT-matrices and $3$-D Toeplitz matrices.
","[{""version"":""v1"",""created"":""Mon, 29 Jun 2020 08:25:27 GMT""}]","2020-06-30"
"2006.15868","Andreas L\""auchli","Christian Romen, Andreas M. L\""auchli","Structure of Spin Correlations in High Temperature SU($N$) Quantum
  Magnets","14 pages, 8 figures","Phys. Rev. Research 2, 043009 (2020)","10.1103/PhysRevResearch.2.043009",,"cond-mat.quant-gas","http://arxiv.org/licenses/nonexclusive-distrib/1.0/","  Quantum magnets with a large SU($N$) symmetry are a promising playground for
the discovery of new forms of exotic quantum matter. Motivated by recent
experimental efforts to study SU($N$) quantum magnetism in samples of ultracold
fermionic alkaline-earth-like atoms in optical lattices, we study here the
temperature dependence of spin correlations in the SU($N$) Heisenberg spin
model in a wide range of temperatures. We uncover a sizeable regime in
temperature, starting at $T=\infty$ down to intermediate temperatures and for
all $N\ge2$, in which the correlations have a common spatial structure on a
broad range of lattices, with the sign of the correlations alternating from one
Manhattan shell to the next, while the amplitude of the correlations is rapidly
decreasing with distance. Focussing on the one-dimensional chain and the
two-dimensional square and triangular lattice for certain $N$, we discuss the
appearance of a disorder and a Lifshitz temperature, separating the
commensurate Manhattan high-$T$ regime from a low-$T$ incommensurate regime. We
observe that this temperature window is associated to an approximately
$N$-independent entropy reduction from the $\ln(N)$ entropy at infinite
temperature. Our results are based on high-temperature series arguments and as
well as large-scale numerical full diagonalization results of thermodynamic
quantities for SU($3$) and SU($4$) square lattice samples, corresponding to a
total Hilbert space of up to $4\times 10^9$ states.
","[{""version"":""v1"",""created"":""Mon, 29 Jun 2020 08:29:25 GMT""}]","2020-10-07"
"2006.15869","Fernando Casas","Ana Arnal, Fernando Casas, Cristina Chiralt","A note on the Baker--Campbell--Hausdorff series in terms of right-nested
  commutators","13 pages, no figures",,,,"math-ph math.MP","http://arxiv.org/licenses/nonexclusive-distrib/1.0/","  We get compact expressions for the Baker--Campbell--Hausdorff series $Z =
\log(\e^X \, \e^Y)$ in terms of right-nested commutators. The reduction in the
number of terms originates from two facts: (i) we use as a starting point an
explicit expression directly involving independent commutators and (ii) we
derive a complete set of identities arising among right-nested commutators. The
procedure allows us to obtain the series with fewer terms than when expressed
in the classical Hall basis at least up to terms of grade 10.
","[{""version"":""v1"",""created"":""Mon, 29 Jun 2020 08:29:37 GMT""}]","2020-06-30"
"2006.15870","Irina Ignatiouk","Irina Ignatiouk-Robert","Martin boundary of a killed non-centered random walk in a general cone",,,,,"math.PR","http://arxiv.org/licenses/nonexclusive-distrib/1.0/","  We investigate Martin boundary for a non-centered random walk on ${\mathbb
Z}^d$ killed up on the time $\tau_\vartheta$ of the first exit from a convex
cone with a vertex at $0$. The approach combines large deviation estimates, the
ratio limite theorem and the ladder height process. The results are applied to
identify the Martin boundary for a random walk killed upon the first exit from
a convex cone having $C^1$ boundary.
","[{""version"":""v1"",""created"":""Mon, 29 Jun 2020 08:30:22 GMT""}]","2020-06-30"
"2006.15871","Jannik Fischbach","Jannik Fischbach, Benedikt Hauptmann, Lukas Konwitschny, Dominik
  Spies, Andreas Vogelsang","Towards Causality Extraction from Requirements",,,,,"cs.SE cs.IR","http://arxiv.org/licenses/nonexclusive-distrib/1.0/","  System behavior is often based on causal relations between certain events
(e.g. If event1, then event2). Consequently, those causal relations are also
textually embedded in requirements. We want to extract this causal knowledge
and utilize it to derive test cases automatically and to reason about
dependencies between requirements. Existing NLP approaches fail to extract
causality from natural language (NL) with reasonable performance. In this
paper, we describe first steps towards building a new approach for causality
extraction and contribute: (1) an NLP architecture based on Tree Recursive
Neural Networks (TRNN) that we will train to identify causal relations in NL
requirements and (2) an annotation scheme and a dataset that is suitable for
training TRNNs. Our dataset contains 212,186 sentences from 463 publicly
available requirement documents and is a first step towards a gold standard
corpus for causality extraction. We encourage fellow researchers to contribute
to our dataset and help us in finalizing the causality annotation process.
Additionally, the dataset can also be annotated further to serve as a benchmark
for other RE-relevant NLP tasks such as requirements classification.
","[{""version"":""v1"",""created"":""Mon, 29 Jun 2020 08:35:25 GMT""}]","2020-06-30"
"2006.15872","Tao Xin","Tao Xin","Improved Quantum State Tomography for the Systems with XX+YY Couplings
  and Z Readouts","11 pages, 7 figures. To be published in PRA","Phys. Rev. A 102, 052410 (2020)","10.1103/PhysRevA.102.052410",,"quant-ph","http://arxiv.org/licenses/nonexclusive-distrib/1.0/","  Quantum device characterization via state tomography plays an important role
in both validating quantum hardware and processing quantum information, but it
needs the exponential number of the measurements. For the systems with
XX+YY-type couplings and Z readouts, such as superconducting quantum computing
(SQC) systems, traditional quantum state tomography (QST) using single-qubit
readout operations at least requires $3^n$ measurement settings in
reconstructing an $n$-qubit state. In this work, I proposed an improved QST by
adding 2-qubit evolutions as the readout operations and obtained an optimal
tomographic scheme using the integer programming optimization. I respectively
apply the new scheme on SQC systems with the Nearest-Neighbor, 2-Dimensional,
and All-to-All connectivities on qubits. It shows that this method can reduce
the number of measurements by over 60% compared with the traditional QST.
Besides, comparison with the traditional scheme in the experimental feasibility
and robustness against errors were made by numerical simulation. It is found
that, the new scheme has good implementability and it can achieve comparable or
even better accuracy than the traditional scheme. It is expected that the
experimentalist from the related fields can directly utilize the ready-made
results for reconstructing quantum states involved in their research.
","[{""version"":""v1"",""created"":""Mon, 29 Jun 2020 08:48:55 GMT""},{""version"":""v2"",""created"":""Tue, 20 Oct 2020 01:37:05 GMT""}]","2020-11-18"
"2006.15873","Hui Huang","Chunhua Jia, Wenhai Yi, Yu Wu, Hui Huang, Lei Zhang, Leilei Wu","Abnormal activity capture from passenger flow of elevator based on
  unsupervised learning and fine-grained multi-label recognition","9 pages, 8 figures, submitted to 34th Conference on Neural
  Information Processing System(NeurIPS 2020)",,,,"cs.CV cs.LG","http://arxiv.org/licenses/nonexclusive-distrib/1.0/","  We present a work-flow which aims at capturing residents' abnormal activities
through the passenger flow of elevator in multi-storey residence buildings.
Camera and sensors (hall sensor, photoelectric sensor, gyro, accelerometer,
barometer, and thermometer) with internet connection are mounted in elevator to
collect image and data. Computer vision algorithms such as instance
segmentation, multi-label recognition, embedding and clustering are applied to
generalize passenger flow of elevator, i.e. how many people and what kinds of
people get in and out of the elevator on each floor. More specifically in our
implementation we propose GraftNet, a solution for fine-grained multi-label
recognition task, to recognize human attributes, e.g. gender, age, appearance,
and occupation. Then anomaly detection of unsupervised learning is
hierarchically applied on the passenger flow data to capture abnormal or even
illegal activities of the residents which probably bring safety hazard, e.g.
drug dealing, pyramid sale gathering, prostitution, and over crowded residence.
Experiment shows effects are there, and the captured records will be directly
reported to our customer(property managers) for further confirmation.
","[{""version"":""v1"",""created"":""Mon, 29 Jun 2020 08:50:20 GMT""}]","2020-06-30"
"2006.15874","Shaohua Fan","Xiao Wang, Shaohua Fan, Kun Kuang, Chuan Shi, Jiawei Liu and Bai Wang","Decorrelated Clustering with Data Selection Bias","Accepted by main track of IJCAI2020;SOLE copyright holder is IJCAI
  (international Joint Conferences on Artificial Intelligence), all rights
  reserved",,,,"cs.LG stat.ML","http://arxiv.org/licenses/nonexclusive-distrib/1.0/","  Most of existing clustering algorithms are proposed without considering the
selection bias in data. In many real applications, however, one cannot
guarantee the data is unbiased. Selection bias might bring the unexpected
correlation between features and ignoring those unexpected correlations will
hurt the performance of clustering algorithms. Therefore, how to remove those
unexpected correlations induced by selection bias is extremely important yet
largely unexplored for clustering. In this paper, we propose a novel
Decorrelation regularized K-Means algorithm (DCKM) for clustering with data
selection bias. Specifically, the decorrelation regularizer aims to learn the
global sample weights which are capable of balancing the sample distribution,
so as to remove unexpected correlations among features. Meanwhile, the learned
weights are combined with k-means, which makes the reweighted k-means cluster
on the inherent data distribution without unexpected correlation influence.
Moreover, we derive the updating rules to effectively infer the parameters in
DCKM. Extensive experiments results on real world datasets well demonstrate
that our DCKM algorithm achieves significant performance gains, indicating the
necessity of removing unexpected feature correlations induced by selection bias
when clustering.
","[{""version"":""v1"",""created"":""Mon, 29 Jun 2020 08:55:50 GMT""},{""version"":""v2"",""created"":""Thu, 2 Jul 2020 15:04:28 GMT""}]","2020-07-03"
"2006.15875","Kai Xiong","Kai Xiong, Supeng Leng, Xiaosha Chen, Chongwen Huang, Chau Yuen, Yong
  Liang Guan","Communication and Computing Resource Optimization for Connected
  Autonomous Driving","12 pages, 7 figures",,,,"cs.IT cs.NI math.IT","http://arxiv.org/licenses/nonexclusive-distrib/1.0/","  Transportation system is facing a sharp disruption since the Connected
Autonomous Vehicles (CAVs) can free people from driving and provide good
driving experience with the aid of Vehicle-to-Vehicle (V2V) communications.
Although CAVs bring benefits in terms of driving safety, vehicle string
stability, and road traffic throughput, most existing work aims at improving
only one of these performance metrics. However, these metrics may be mutually
competitive, as they share the same communication and computing resource in a
road segment. From the perspective of joint optimizing driving safety, vehicle
string stability, and road traffic throughput, there is a big research gap to
be filled on the resource management for connected autonomous driving. In this
paper, we first explore the joint optimization on driving safety, vehicle
string stability, and road traffic throughput by leveraging on the consensus
Alternating Directions Method of Multipliers algorithm (ADMM). However, the
limited communication bandwidth and on-board processing capacity incur the
resource competition in CAVs. We next analyze the multiple tasks competition in
the contention based medium access to attain the upper bound delay of
V2V-related application offloading. An efficient sleeping multi-armed bandit
tree-based algorithm is proposed to address the resource assignment problem. A
series of simulation experiments are carried out to validate the performance of
the proposed algorithms.
","[{""version"":""v1"",""created"":""Mon, 29 Jun 2020 08:56:53 GMT""}]","2020-06-30"
"2006.15876","Weihua Deng Professor","Jing Sun, Daxin Nie, Weihua Deng","High-order BDF fully discrete scheme for backward fractional Feynman-Kac
  equation with nonsmooth data","23 pages","Applied Numerical Mathematics, 161, 82-100, 2021","10.1016/j.apnum.2020.10.027",,"math.NA cs.NA","http://arxiv.org/licenses/nonexclusive-distrib/1.0/","  The Feynman-Kac equation governs the distribution of the statistical
observable -- functional, having wide applications in almost all disciplines.
After overcoming challenges from the time-space coupled nonlocal operator and
the possible low regularity of functional, this paper develops the high-order
fully discrete scheme for the backward fractional Feynman-Kac equation by using
backward difference formulas (BDF) convolution quadrature in time, finite
element method in space, and some correction terms. With a systematic
correction, the high convergence order is achieved up to $6$ in time, without
deteriorating the optimal convergence in space and without the regularity
requirement on the solution. Finally, the extensive numerical experiments
validate the effectiveness of the high-order schemes.
","[{""version"":""v1"",""created"":""Mon, 29 Jun 2020 08:59:42 GMT""}]","2020-11-11"
"2006.15877","Abigail Goldsteen","Abigail Goldsteen, Gilad Ezov, Ariel Farkash","Reducing Risk of Model Inversion Using Privacy-Guided Training",,,,,"cs.LG cs.CR stat.ML","http://arxiv.org/licenses/nonexclusive-distrib/1.0/","  Machine learning models often pose a threat to the privacy of individuals
whose data is part of the training set. Several recent attacks have been able
to infer sensitive information from trained models, including model inversion
or attribute inference attacks. These attacks are able to reveal the values of
certain sensitive features of individuals who participated in training the
model. It has also been shown that several factors can contribute to an
increased risk of model inversion, including feature influence. We observe that
not all features necessarily share the same level of privacy or sensitivity. In
many cases, certain features used to train a model are considered especially
sensitive and therefore propitious candidates for inversion. We present a
solution for countering model inversion attacks in tree-based models, by
reducing the influence of sensitive features in these models. This is an avenue
that has not yet been thoroughly investigated, with only very nascent previous
attempts at using this as a countermeasure against attribute inference. Our
work shows that, in many cases, it is possible to train a model in different
ways, resulting in different influence levels of the various features, without
necessarily harming the model's accuracy. We are able to utilize this fact to
train models in a manner that reduces the model's reliance on the most
sensitive features, while increasing the importance of less sensitive features.
Our evaluation confirms that training models in this manner reduces the risk of
inference for those features, as demonstrated through several black-box and
white-box attacks.
","[{""version"":""v1"",""created"":""Mon, 29 Jun 2020 09:02:16 GMT""}]","2020-06-30"
"2006.15878","Alexander Borisenko","Alexander A. Borisenko","The estimation of the length of a convex curve in two-dimensional
  Alexandrov space","6 pages",,,,"math.DG","http://arxiv.org/licenses/nonexclusive-distrib/1.0/","  It is proved the generalization of Toponogov theorem about the length of the
curve in two-dimensional Riemannian manifolds in the case of two-dimensional
Alexandrov spaces.
","[{""version"":""v1"",""created"":""Mon, 29 Jun 2020 09:04:35 GMT""},{""version"":""v2"",""created"":""Fri, 3 Jul 2020 08:09:40 GMT""}]","2020-07-06"
"2006.15879","Philippe Laurencot","Philippe Lauren\c{c}ot (IMT)","Stationary solutions to Smoluchowski's coagulation equation with source",,,,,"math.AP","http://arxiv.org/licenses/nonexclusive-distrib/1.0/","  Existence and non-existence of integrable stationary solutions to
Smoluchowski's coagulation equation with source are investigated when the
source term is integrable with an arbitrary support in (0, $\infty$). Besides
algebraic upper and lower bounds, a monotonicity condition is required for the
coagulation kernel. Connections between integrability properties of the source
and the corresponding stationary solutions are also studied.
","[{""version"":""v1"",""created"":""Mon, 29 Jun 2020 09:11:29 GMT""}]","2020-06-30"
"2006.15880","Abdoul Karim Sane","Abdoul Karim Sane (IF)","Unicellular maps and filtrations of the mapping class group",,,,,"math.CO math.GT","http://arxiv.org/licenses/nonexclusive-distrib/1.0/","  This article first answers to questions about connectedness of a new family
of graphs on unicellular maps. Answering these questions goes through a
description of the mapping class group as surgeries on unicellular maps. We
also show how unicellular maps encode subgroups of the mapping group and
provide filtrations of the mapping class group. These facts add a layer on the
ubiquitous character of unicellular maps.
","[{""version"":""v1"",""created"":""Mon, 29 Jun 2020 09:13:59 GMT""}]","2020-06-30"
"2006.15881","Ernesto Ortega","Ernesto Ortega, David Machado, Alejandro Lage-Castellanos","Dynamics of epidemic models from cavity master equations",,,,,"physics.soc-ph q-bio.PE","http://arxiv.org/licenses/nonexclusive-distrib/1.0/","  We apply the cavity master equation (CME) approach to epidemics models. We
explore mostly the susceptible-infectious-susceptible (SIS) model, which can be
readily treated with the CME as a two-state. We show that this approach is more
accurate than individual based and pair based mean field methods, and a
previously published dynamic message passing scheme. We explore average case
predictions and extend the cavity master equation to SIR and SIRS models.
","[{""version"":""v1"",""created"":""Mon, 29 Jun 2020 09:16:46 GMT""},{""version"":""v2"",""created"":""Mon, 1 Mar 2021 09:25:59 GMT""}]","2021-03-02"
"2006.15882","Viktor K\""onye","Viktor K\""onye and Masao Ogata","Microscopic theory of magnetoconductivity at low magnetic fields in
  terms of Berry curvature and orbital magnetic moment",,"Phys. Rev. Research 3, 033076 (2021)","10.1103/PhysRevResearch.3.033076",,"cond-mat.mes-hall","http://arxiv.org/licenses/nonexclusive-distrib/1.0/","  Using a microscopic theory for the magnetoconductivity at low magnetic fields
we show how the Hall and longitudinal conductivity can be calculated in the low
scattering rate limit. In the lowest order of the scattering rate, we recover
the result of the semiclassical Boltzmann transport theory. At higher order, we
get corrections containing the Berry curvature and the orbital magnetic moment.
We use this formalism to study the linear longitudinal magnetoconductivity in
tilted Weyl semimetals. We discuss how our result is related to the
semiclassical Boltzmann approach and show the differences that arise compared
to previous studies related to the orbital magnetic moment.
","[{""version"":""v1"",""created"":""Mon, 29 Jun 2020 09:18:00 GMT""},{""version"":""v2"",""created"":""Mon, 28 Dec 2020 14:49:00 GMT""}]","2021-07-28"
"2006.15883","Said Hamadene","Said Hamad\`ene (LMM), Tingshu Mu (LMM)","Zero-sum Switching Game, Systems of Reflected Backward SDEs and
  Parabolic PDEs with bilateral interconnected obstacles",,,,,"math.PR","http://arxiv.org/licenses/nonexclusive-distrib/1.0/","  In this paper we study a zero-sum switching game and its verification
theorems expressed in terms of either a system of Reflected Backward Stochastic
Differential Equations (RBSDEs in short) with bilateral interconnected
obstacles or a system of parabolic partial differential equations (PDEs in
short) with bilateral interconnected obstacles as well. We show that each one
of the systems has a unique solution. Then we show that the game has a value.
","[{""version"":""v1"",""created"":""Mon, 29 Jun 2020 09:18:14 GMT""}]","2020-06-30"
"2006.15884","Maxim Gorkunov V","Maxim V. Gorkunov, Alexander A. Antonov, Yuri S. Kivshar","Metasurfaces with maximum chirality empowered by bound states in the
  continuum",,"Phys. Rev. Lett. 125, 093903 (2020)","10.1103/PhysRevLett.125.093903",,"physics.optics physics.app-ph","http://arxiv.org/licenses/nonexclusive-distrib/1.0/","  We demonstrate that rotationally symmetric chiral metasurfaces can support
arbitrarily sharp resonances with the maximum optical chirality determined by
precise shaping of bound states in the continuum (BICs). Being uncoupled from
one circular polarisation of light and resonantly coupled to its counterpart, a
metasurface hosting the chiral BIC resonance exhibits a narrow peak in the
circular dichroism spectrum. We propose a realization of such chiral BIC
metasurfaces based on pairs of dielectric bars and validate the concept of
maximum chirality by numerical simulations
","[{""version"":""v1"",""created"":""Mon, 29 Jun 2020 09:18:38 GMT""}]","2020-08-28"
"2006.15885","Francis Filbet","Francis Filbet (UT3)","A spectral collocation method for the Landau equation in plasma physics",,,,,"math.NA cs.CE cs.NA","http://arxiv.org/licenses/nonexclusive-distrib/1.0/","  In this paper we present a spectral collocation method for the fast
evaluation of the Landau collision operator for plasma physics, which allows us
to obtain spectrally accurate numerical solutions. The method is inspired by
the seminal work [36], but it is specifically designed for Coulombian
interactions, taking into account the particular structure of the operator. It
allows us to reduce the number of discrete convolutions to provide an
approximation of the Landau operator. Then, we show that the method preserves
the total mass whereas momentum and energy are approximated with spectral
accuracy. Numerical results for the Landau equation in three dimensions in
velocity space are presented to illustrate the efficiency of the present
approach.
","[{""version"":""v1"",""created"":""Mon, 29 Jun 2020 09:22:48 GMT""}]","2020-06-30"
