"2006.16034","Hidekazu Yoshioka","Hidekazu Yoshioka, Yuta Yaegashi","Stochastic impulse control of non-smooth dynamics with partial
  observation and execution delay: application to an environmental restoration
  problem","8 figures and 4 tables",,,,"math.OC cs.SY eess.SY","http://arxiv.org/licenses/nonexclusive-distrib/1.0/","  Non-smooth dynamics driven by stochastic disturbance arise in a wide variety
of engineering problems. Impulsive interventions are often employed to control
stochastic systems; however, the modeling and analysis subject to execution
delay have been less explored. In addition, continuously receiving information
of the dynamics is not always possible. In this paper, with an application to
an environmental restoration problem, a continuous-time stochastic impulse
control problem subject to execution delay under discrete and random
observations is newly formulated and analyzed. The dynamics have a non-smooth
coefficient modulated by a Markov chain, and eventually attain an undesirable
state like a depletion due to the non-smoothness. The goal of the control
problem is to find the most cost-efficient policy that can prevent the dynamics
from attaining the undesirable state. We demonstrate that finding the optimal
policy reduces to solving a non-standard system of degenerate elliptic
equations, the optimality equation, which is rigorously and analytically
verified in a simplified case. The associated Fokker-Planck equation for the
controlled dynamics is derived and solved explicitly as well. The model is
finally applied to numerical computation of a recent river environmental
restoration problem. The optimality and Fokker-Planck equations are
successfully computed, and the optimal policy and the probability density
functions are numerically obtained. The impacts of execution delay are
discussed to deeper analyze the model.
","[{""version"":""v1"",""created"":""Mon, 29 Jun 2020 13:25:47 GMT""},{""version"":""v2"",""created"":""Sun, 17 Jan 2021 08:53:18 GMT""}]","2021-01-19"
"2006.16035","Dalcimar Casanova","Kallil M. C. Zielinski and Marcelo Teixeira and Richardson Ribeiro and
  Dalcimar Casanova","Concept and the implementation of a tool to convert industry 4.0
  environments modeled as FSM to an OpenAI Gym wrapper",,,,,"cs.LG cs.AI cs.FL cs.SY eess.SY stat.ML","http://creativecommons.org/licenses/by-nc-sa/4.0/","  Industry 4.0 systems have a high demand for optimization in their tasks,
whether to minimize cost, maximize production, or even synchronize their
actuators to finish or speed up the manufacture of a product. Those challenges
make industrial environments a suitable scenario to apply all modern
reinforcement learning (RL) concepts. The main difficulty, however, is the lack
of that industrial environments. In this way, this work presents the concept
and the implementation of a tool that allows us to convert any dynamic system
modeled as an FSM to the open-source Gym wrapper. After that, it is possible to
employ any RL methods to optimize any desired task. In the first tests of the
proposed tool, we show traditional Q-learning and Deep Q-learning methods
running over two simple environments.
","[{""version"":""v1"",""created"":""Mon, 29 Jun 2020 13:28:41 GMT""}]","2020-06-30"
"2006.16036","Joao Magueijo","John D. Barrow and Joao Magueijo","A contextual Planck parameter and the classical limit in quantum
  cosmology",,,"10.1007/s10701-021-00433-0",,"gr-qc astro-ph.CO quant-ph","http://arxiv.org/licenses/nonexclusive-distrib/1.0/","  We propose that whatever quantity controls the Heisenberg uncertainty
relations (for a given complementary pair of observables) it should be
identified with an effective Planck parameter. With this definition it is not
difficult to find examples where the Planck parameter depends on the region
under study, varies in time, and even depends on which pair of observables one
focuses on. In quantum cosmology the effective Planck parameter depends on the
size of the comoving region under study, and so depends on that chosen region
and on time. With this criterion, the classical limit is expected, not for
regions larger than the Planck length, $l_{P}$, but for those larger than
$l_{Q}=(l_{P}^{2}H^{-1})^{1/3}$, where $H$ is the Hubble parameter. In theories
where the cosmological constant is dynamical, it is possible for the latter to
remain quantum even in contexts where everything else is deemed classical.
These results are derived from standard quantization methods, but we also
include more speculative cases where ad hoc Planck parameters scale differently
with the length scale under observation. Even more speculatively, we examine
the possibility that similar complementary concepts affect thermodynamical
variables, such as the temperature and the entropy of a black hole.
","[{""version"":""v1"",""created"":""Mon, 29 Jun 2020 13:29:29 GMT""},{""version"":""v2"",""created"":""Fri, 22 Jan 2021 18:45:27 GMT""}]","2021-03-17"
"2006.16037","Dieter Bauer","Christoph J\""ur{\ss}, Dieter Bauer","Helicity flip of high-harmonic photons in Haldane nanoribbons","9 pages, 10 Figures, RevTeX","Phys. Rev. A 102, 043105 (2020)","10.1103/PhysRevA.102.043105",,"cond-mat.mes-hall physics.atom-ph physics.optics quant-ph","http://arxiv.org/licenses/nonexclusive-distrib/1.0/","  Recent studies in high-harmonic spectroscopy of condensed matter mainly
focused on the bulk of the system under consideration. In this work, we
investigate the response of thin, hexagonal nanoribbons to an intense laser
pulse that is linearly polarized along the ribbon. Such nanoribbons are prime
examples of two-dimensional systems that are bulk-like in one direction and
finite in the other direction. Despite the atomically thin scale in the
direction perpendicular to the linearly polarized driving laser field, the
emitted harmonics are elliptically polarized if an alternating onsite potential
and Haldane hopping is taken into account. For given hoppings, we find a sudden
change of the helicity for a certain harmonic order. The origin of this flip is
traced back to phase differences between the components of Bloch states.
","[{""version"":""v1"",""created"":""Mon, 29 Jun 2020 13:31:02 GMT""}]","2020-10-21"
"2006.16038","Julian Eisenschlos","Sebastian Prillo and Julian Martin Eisenschlos","SoftSort: A Continuous Relaxation for the argsort Operator","9 pages, 6 figures. Accepted at ICML 2020",,,,"cs.LG stat.ML","http://arxiv.org/licenses/nonexclusive-distrib/1.0/","  While sorting is an important procedure in computer science, the argsort
operator - which takes as input a vector and returns its sorting permutation -
has a discrete image and thus zero gradients almost everywhere. This prohibits
end-to-end, gradient-based learning of models that rely on the argsort
operator. A natural way to overcome this problem is to replace the argsort
operator with a continuous relaxation. Recent work has shown a number of ways
to do this, but the relaxations proposed so far are computationally complex. In
this work we propose a simple continuous relaxation for the argsort operator
which has the following qualities: it can be implemented in three lines of
code, achieves state-of-the-art performance, is easy to reason about
mathematically - substantially simplifying proofs - and is faster than
competing approaches. We open source the code to reproduce all of the
experiments and results.
","[{""version"":""v1"",""created"":""Mon, 29 Jun 2020 13:33:01 GMT""}]","2020-06-30"
"2006.16039","Adam \'O Conghaile","Adam \'O Conghaile and Anuj Dawar","Game Comonads & Generalised Quantifiers",,,,,"cs.LO","http://arxiv.org/licenses/nonexclusive-distrib/1.0/","  Game comonads, introduced by Abramsky, Dawar and Wang and developed by
Abramsky and Shah, give an interesting categorical semantics to some
Spoiler-Duplicator games that are common in finite model theory. In particular
they expose connections between one-sided and two-sided games, and parameters
such as treewidth and treedepth and corresponding notions of decomposition. In
the present paper, we expand the realm of game comonads to logics with
generalised quantifiers. In particular, we introduce a comonad graded by two
parameter $n \leq k$ such that isomorphisms in the resulting Kleisli category
are exactly Duplicator winning strategies in Hella's $n$-bijection game with
$k$ pebbles. We define a one-sided version of this game which allows us to
provide a categorical semantics for a number of logics with generalised
quantifiers. We also give a novel notion of tree decomposition that emerges
from the construction.
","[{""version"":""v1"",""created"":""Mon, 29 Jun 2020 13:33:18 GMT""},{""version"":""v2"",""created"":""Mon, 13 Jul 2020 16:49:37 GMT""},{""version"":""v3"",""created"":""Thu, 1 Jul 2021 11:16:55 GMT""}]","2021-07-02"
"2006.16042","Nguyen Khanh quoc","Nguyen Van Men, Nguyen Quoc Khanh, and Dong Thi Kim Phuong","Collective excitations in spin-polarized bilayer graphene",,"J. Phys.: Condens. Matter 33, 105301 (2021)",,,"cond-mat.mes-hall","http://arxiv.org/licenses/nonexclusive-distrib/1.0/","  We calculate the plasmon frequency and damping rate of plasma oscillations in
a spin-polarized BLG system. Using the long wavelength approximation for
dynamical dielectric function, we obtain an analytical expression for plasmon
frequency showing that the degree of spin polarization P has negligible effect
on the long wavelength plasmon frequency. Numerical calculations demonstrate
that the degree of spin polarization affects slightly (strongly) plasmon
frequency at small (large) wave-vectors and the maximum value of damping rate
increases with increasing P. We also study the effects of carrier density and
substrate dielectric constant on plasmon properties for different value of spin
polarization. The numerically calculated critical wave-vector, at which the
plasmon dispersion curve hits the edge of electron-hole continuum, decreases
with P and can be used to determine experimentally the degree of spin
polarization.
","[{""version"":""v1"",""created"":""Mon, 29 Jun 2020 13:36:51 GMT""},{""version"":""v2"",""created"":""Wed, 21 Oct 2020 08:43:20 GMT""}]","2021-03-15"
"2006.16044","Austin Coffman","Austin R. Coffman, Matthew Hale, Prabir Barooah","Predictive resource allocation for flexible loads with local QoS","8 pages, 3 figures",,,,"eess.SY cs.SY","http://arxiv.org/licenses/nonexclusive-distrib/1.0/","  Loads that can vary their power consumption without violating their Quality
of service (QoS), that is flexible loads, are an invaluable resource for grid
operators. Utilizing flexible loads as a resource requires the grid operator to
incorporate them into a resource allocation problem. Since flexible loads are
often consumers, for concerns of privacy it is desirable for this problem to
have a distributed implementation. Technically, this distributed implementation
manifests itself as a time varying convex optimization problem constrained by
the QoS of each load. In the literature, a time invariant form of this problem
without all of the necessary QoS metrics for the flexible loads is often
considered. Moving to a more realistic setup introduces additional technical
challenges, due to the problems' time-varying nature. In this work, we develop
an algorithm to account for the challenges introduced when considering a time
varying setup with appropriate QoS metrics.
","[{""version"":""v1"",""created"":""Mon, 29 Jun 2020 13:38:22 GMT""}]","2020-06-30"
"2006.16045","Shiyan Li","Erjian Cheng, Wei Xia, Xianbiao Shi, Chengwei Wang, Chuanying Xi,
  Shaowen Xu, Darren C. Peets, Linshu Wang, Hao Su, Li Pi, Wei Ren, Xia Wang,
  Na Yu, Yulin Chen, Weiwei Zhao, Zhongkai Liu, Yanfeng Guo, Shiyan Li","Magnetism-induced topological transition in EuAs3","15 pages, with METHODS AND EXTENDED DATA","Nature Communications 12, 6970 (2021)","10.1038/s41467-021-26482-7",,"cond-mat.mtrl-sci cond-mat.str-el cond-mat.supr-con","http://arxiv.org/licenses/nonexclusive-distrib/1.0/","  The nature of the interaction between magnetism and topology in magnetic
topological semimetals remains mysterious, but may be expected to lead to a
variety of novel physics. We present $ab$ $initio$ band calculations,
electrical transport and angle-resolved photoemission spectroscopy (ARPES)
measurements on the magnetic semimetal EuAs$_3$, demonstrating a
magnetism-induced topological transition from a topological nodal-line
semimetal in the paramagnetic or the spin-polarized state to a topological
massive Dirac metal in the antiferromagnetic (AFM) ground state at low
temperature, featuring a pair of massive Dirac points, inverted bands and
topological surface states on the (010) surface. Shubnikov-de Haas (SdH)
oscillations in the AFM state identify nonzero Berry phase and a negative
longitudinal magnetoresistance ($n$-LMR) induced by the chiral anomaly,
confirming the topological nature predicted by band calculations. When magnetic
moments are fully polarized by an external magnetic field, an unsaturated and
extremely large magnetoresistance (XMR) of $\sim$ 2$\times10^5$ % at 1.8 K and
28.3 T is observed, likely arising from topological protection. Consistent with
band calculations for the spin-polarized state, four new bands in quantum
oscillations different from those in the AFM state are discerned, of which two
are topologically protected. Nodal-line structures at the $Y$ point in the
Brillouin zone (BZ) are proposed in both the spin-polarized and paramagnetic
states, and the latter is proven by ARPES. Moreover, a temperature-induced
Lifshitz transition accompanied by the emergence of a new band below 3 K is
revealed. These results indicate that magnetic EuAs$_3$ provides a rich
platform to explore exotic physics arising from the interaction of magnetism
with topology.
","[{""version"":""v1"",""created"":""Mon, 29 Jun 2020 13:38:40 GMT""}]","2022-03-29"
"2006.16048","Andreas R\""o{\ss}ler","Jan Pleis and Andreas R\""o{\ss}ler","A Note on Some Martingale Inequalities","5 pages. Added references",,,,"math.PR","http://arxiv.org/licenses/nonexclusive-distrib/1.0/","  We derive inequalities for time-discrete and time-continuous martingales that
are similar to the well-known Burkholder inequalities. For the time-discrete
case arbitrary martingales in $L^p(\Omega)$ are treated, whereas in the
time-continuous case martingales defined by It\^o integrals w.r.t. a
multi-dimensional Wiener process are considered. The estimates for the
time-discrete martingales are related to the more general results by I. Pinelis
(1994) and are proved to be sharp by a different and more elementary proof for
this special setting. Further, for time-continuous martingales the presented
inequalities are generalizations of similar estimates proved by M. Zakai (1967)
and E. Rio (2009) to the general multi-dimensional case. Especially, these
inequalities possess smaller constants compared to the ones that result if the
original Burkholder inequalities would be applied for such estimates.
Therefore, the presented inequalities are highly valuable in, e.g., stochastic
analysis and stochastic numerics.
","[{""version"":""v1"",""created"":""Mon, 29 Jun 2020 13:40:34 GMT""},{""version"":""v2"",""created"":""Thu, 21 Jan 2021 23:07:50 GMT""}]","2021-01-25"
"2006.16051","Antonio Calcagn\`i","Antonio Calcagn\`i and Luigi Lombardi","Modeling random and non-random decision uncertainty in ratings data: A
  fuzzy beta model","29 pages, 4 figures, 7 tables","AStA Advances in Statistical Analysis, Springer, 2021","10.1007/s10182-021-00407-7",,"stat.AP stat.OT","http://arxiv.org/licenses/nonexclusive-distrib/1.0/","  Modeling human ratings data subject to raters' decision uncertainty is an
attractive problem in applied statistics. In view of the complex interplay
between emotion and decision making in rating processes, final raters' choices
seldom reflect the true underlying raters' responses. Rather, they are
imprecisely observed in the sense that they are subject to a non-random
component of uncertainty, namely the decision uncertainty. The purpose of this
article is to illustrate a statistical approach to analyse ratings data which
integrates both random and non-random components of the rating process. In
particular, beta fuzzy numbers are used to model raters' non-random decision
uncertainty and a variable dispersion beta linear model is instead adopted to
model the random counterpart of rating responses. The main idea is to quantify
characteristics of latent and non-fuzzy rating responses by means of random
observations subject to fuzziness. To do so, a fuzzy version of the
Expectation-Maximization algorithm is adopted to both estimate model's
parameters and compute their standard errors. Finally, the characteristics of
the proposed fuzzy beta model are investigated by means of a simulation study
as well as two case studies from behavioral and social contexts.
","[{""version"":""v1"",""created"":""Mon, 29 Jun 2020 13:41:28 GMT""},{""version"":""v2"",""created"":""Mon, 8 Mar 2021 06:46:19 GMT""}]","2021-05-21"
"2006.16055","Walter Bennette","Walter Bennette, Karsten Maurer, Sean Sisti","Harnessing Adversarial Distances to Discover High-Confidence Errors","10 pages, 9 figures",,,,"cs.LG stat.ML","http://arxiv.org/licenses/nonexclusive-distrib/1.0/","  Given a deep neural network image classification model that we treat as a
black box, and an unlabeled evaluation dataset, we develop an efficient
strategy by which the classifier can be evaluated. Randomly sampling and
labeling instances from an unlabeled evaluation dataset allows traditional
performance measures like accuracy, precision, and recall to be estimated.
However, random sampling may miss rare errors for which the model is highly
confident in its prediction, but wrong. These high-confidence errors can
represent costly mistakes, and therefore should be explicitly searched for.
Past works have developed search techniques to find classification errors above
a specified confidence threshold, but ignore the fact that errors should be
expected at confidence levels anywhere below 100\%. In this work, we
investigate the problem of finding errors at rates greater than expected given
model confidence. Additionally, we propose a query-efficient and novel search
technique that is guided by adversarial perturbations to find these mistakes in
black box models. Through rigorous empirical experimentation, we demonstrate
that our Adversarial Distance search discovers high-confidence errors at a rate
greater than expected given model confidence.
","[{""version"":""v1"",""created"":""Mon, 29 Jun 2020 13:44:16 GMT""}]","2020-06-30"
"2006.16056","Elias Okon","R. Muci\~no and E. Okon","Wigner's convoluted friends","8 pages",,,,"quant-ph physics.hist-ph","http://arxiv.org/licenses/nonexclusive-distrib/1.0/","  Considering a complicated extension of a Wigner's friend scenario, Frauchiger
and Renner (FR) allegedly showed that ""quantum theory cannot consistently
describe the use of itself"". However, such a result has been under severe
criticism, as it has been convincingly argued to crucially depend on an
implicit, non-trivial assumption regarding details of the collapse mechanism.
In consequence, the result is not as robust or general as intended. On top of
all this, in this work we show that a much simpler arrangement--basically an
EPR setting--is sufficient to derive a result fully analogous to that of FR.
Moreover, we claim that all lessons learned from FR's result are essentially
contained within the original EPR paper. We conclude that FR's result does not
offer any novel insights into the conceptual problems of quantum theory.
","[{""version"":""v1"",""created"":""Mon, 29 Jun 2020 13:44:59 GMT""}]","2020-06-30"
"2006.16057","Rammal Aftab","Maria Yaseen, Rammal Aftab Ahmed, Rimsha Mahrukh","Forgery Detection in a Questioned Hyperspectral Document Image using
  K-means Clustering","5 pages,6 figures",,,,"cs.CV cs.CR","http://arxiv.org/licenses/nonexclusive-distrib/1.0/","  Hyperspectral imaging allows for analysis of images in several hundred of
spectral bands depending on the spectral resolution of the imaging sensor.
Hyperspectral document image is the one which has been captured by a
hyperspectral camera so that the document can be observed in the different
bands on the basis of their unique spectral signatures. To detect the forgery
in a document various Ink mismatch detection techniques based on hyperspectral
imaging have presented vast potential in differentiating visually similar inks.
Inks of different materials exhibit different spectral signature even if they
have the same color. Hyperspectral analysis of document images allows
identification and discrimination of visually similar inks. Based on this
analysis forensic experts can identify the authenticity of the document. In
this paper an extensive ink mismatch detection technique is presented which
uses KMean Clustering to identify different inks on the basis of their unique
spectral response and separates them into different clusters.
","[{""version"":""v1"",""created"":""Mon, 29 Jun 2020 13:51:24 GMT""}]","2020-06-30"
"2006.16058","Diogo Ars\'enio","Diogo Ars\'enio, Nicolas Lerner","An energy method for averaging lemmas",,"Pure Appl. Analysis 3 (2021) 319-362","10.2140/paa.2021.3.319",,"math.AP","http://arxiv.org/licenses/nonexclusive-distrib/1.0/","  This work introduces a new approach to velocity averaging lemmas in kinetic
theory. This approach -- based upon the classical energy method -- provides a
powerful duality principle in kinetic transport equations which allows for a
natural extension of classical averaging lemmas to previously unknown cases
where the density and the source term belong to dual spaces. More generally,
this kinetic duality principle produces regularity results where one can trade
a loss of regularity or integrability somewhere in the kinetic transport
equation for a suitable opposite gain elsewhere. Also, it looks simpler and
more robust to rely on proving inequalities instead of constructing exact
parametrices.
  The results in this article are introduced from a functional analytic point
of view. They are motivated by the abstract regularity theory of kinetic
transport equations. However, we may recall that velocity averaging lemmas have
profound implications in kinetic theory and its related physical models. In
particular, the precise formulation of such results has the potential to lead
to important applications to the regularity of renormalizations of
Boltzmann-type equations, as well as kinetic formulations of gas dynamics, for
instance.
","[{""version"":""v1"",""created"":""Mon, 29 Jun 2020 13:54:29 GMT""},{""version"":""v2"",""created"":""Tue, 25 Aug 2020 12:53:29 GMT""},{""version"":""v3"",""created"":""Wed, 24 Feb 2021 14:29:06 GMT""}]","2021-09-15"
"2006.16059","Ritabrata Dutta","Ritabrata Dutta and Susana Gomes and Dante Kalise and Lorenzo
  Pacchiardi","Using mobility data in the design of optimal lockdown strategies for the
  COVID-19 pandemic",,,"10.1371/journal.pcbi.1009236",,"stat.AP physics.soc-ph q-bio.PE","http://arxiv.org/licenses/nonexclusive-distrib/1.0/","  A mathematical model for the COVID-19 pandemic spread, which integrates
age-structured Susceptible-Exposed-Infected-Recovered-Deceased dynamics with
real mobile phone data accounting for the population mobility, is presented.
The dynamical model adjustment is performed via Approximate Bayesian
Computation. Optimal lockdown and exit strategies are determined based on
nonlinear model predictive control, constrained to public-health and
socio-economic factors. Through an extensive computational validation of the
methodology, it is shown that it is possible to compute robust exit strategies
with realistic reduced mobility values to inform public policy making, and we
exemplify the applicability of the methodology using datasets from England and
France. Code implementing the described experiments is available at
https://github.com/OptimalLockdown.
","[{""version"":""v1"",""created"":""Mon, 29 Jun 2020 13:58:19 GMT""},{""version"":""v2"",""created"":""Sun, 18 Oct 2020 12:40:16 GMT""}]","2021-08-24"
"2006.16060","Stavros Karagiannopoulos","Stavros Karagiannopoulos, Costas Mylonas, Petros Aristidou, and
  Gabriela Hug","Active Distribution Grids Providing Voltage Support: The Swiss Case","10 pages",,,,"math.OC","http://arxiv.org/licenses/nonexclusive-distrib/1.0/","  The increasing installation of controllable Distributed Energy Resources
(DERs) in Distribution Networks (DNs) opens up new opportunities for the
provision of ancillary services to the Transmission Network (TN) level. As the
penetration of smart meter devices and communication infrastructure in DNs
increases, they become more observable and controllable with centralized
optimization-based control schemes becoming efficient and practical. In this
paper, we propose a centralized tractable Optimal Power Flow (OPF)-based
control scheme that optimizes the real-time operation of active DNs, while also
considering the provision of voltage support as an ancillary service to the TN.
We embed in the form of various constraints the current voltage support
requirements of Switzerland and investigate the potential benefit of ancillary
services provision assuming different operational modes of the DER inverters.
We demonstrate the performance of the proposed scheme using a combined HV-MV-LV
test system.
","[{""version"":""v1"",""created"":""Mon, 29 Jun 2020 13:59:16 GMT""}]","2020-06-30"
