"2006.15749","Anders W. Sandvik","Wenshan Hong, Lu Liu, Chang Liu, Xiaoyan Ma, Akihiro Koda, Xin Li,
  Jianming Song, Wenyun Yang, Jinbo Yang, Peng Cheng, Hongxia Zhang, Wei Bao,
  Xiaobai Ma, Dongfeng Chen, Kai Sun, Wenan Guo, Huiqian Luo, Anders W.
  Sandvik, Shiliang Li","Extreme Suppression of Antiferromagnetic Order and Critical Scaling in a
  Two-Dimensional Random Quantum Magnet","6 pages + 6 pages supplemental material","Phys. Rev. Lett. 126, 037201 (2021)","10.1103/PhysRevLett.126.037201",,"cond-mat.str-el","http://arxiv.org/licenses/nonexclusive-distrib/1.0/","  Sr$_2$CuTeO$_6$ is a square-lattice N\'eel antiferromagnet with superexchange
between first-neighbor $S=1/2$ Cu spins mediated by plaquette centered Te ions.
Substituting Te by W, the affected impurity plaquettes have predominantly
second-neighbor interactions, thus causing local magnetic frustration. Here we
report a study of Sr$_2$CuTe$_{1-x}$W$_x$O$_6$ using neutron diffraction and
$\mu$SR techniques, showing that the N\'eel order vanishes already at $x =
0.025 \pm 0.005$. We explain this extreme order suppression using a
two-dimensional Heisenberg spin model, demonstrating that a W-type impurity
induces a deformation of the order parameter that decays with distance as
$1/r^2$ at temperature $T=0$. The associated logarithmic singularity leads to
loss of order for any $x>0$. Order for small $x>0$ and $T>0$ is induced by weak
interplane couplings. In the nonmagnetic phase of Sr$_2$CuTe$_{1-x}$W$_x$O$_6$,
the $\mu$SR relaxation rate exhibits quantum critical scaling with a large
dynamic exponent, $z \approx 3$, consistent with a random-singlet state.
","[{""version"":""v1"",""created"":""Sun, 28 Jun 2020 23:58:18 GMT""},{""version"":""v2"",""created"":""Wed, 20 Jan 2021 16:04:00 GMT""}]","2021-01-21"
"2006.15750","Steffen Lewitzka","Steffen Lewitzka","Access-based Intuitionistic Knowledge","28 pages","Journal of Logic and Computation, Oxford University Press, 2021","10.1093/logcom/exaa086",,"cs.LO","http://arxiv.org/licenses/nonexclusive-distrib/1.0/","  We introduce the concept of access-based intuitionistic knowledge which
relies on the intuition that agent $i$ knows $\varphi$ if $i$ has found access
to a proof of $\varphi$. Basic principles are distribution and factivity of
knowledge as well as $\square\varphi\rightarrow K_i\varphi$ and
$K_i(\varphi\vee\psi) \rightarrow (K_i\varphi\vee K_i\psi)$, where
$\square\varphi$ reads `$\varphi$ is proved'. The formalization extends a
family of classical modal logics designed in [Lewitzka 2015, 2017, 2019] as
combinations of $IPC$ and $CPC$ and as systems for the reasoning about proof,
i.e. intuitionistic truth. We adopt a formalization of common knowledge from
[Lewitzka 2011] and interpret it here as access-based common knowledge. We
compare our proposal with recent approaches to intuitionistic knowledge
[Artemov and Protopopescu 2016; Lewitzka 2017, 2019] and bring together these
different concepts in a unifying semantic framework based on Heyting algebra
expansions.
","[{""version"":""v1"",""created"":""Mon, 29 Jun 2020 00:01:44 GMT""}]","2021-02-25"
"2006.15751","Meng Zhang","Meng Zhang, Ahmed Arafa, Ermin Wei, and Randall A. Berry","Optimal and Quantized Mechanism Design for Fresh Data Acquisition","Under review by IEEE JSAC",,,,"cs.NI cs.IT math.IT","http://arxiv.org/licenses/nonexclusive-distrib/1.0/","  The proliferation of real-time applications has spurred much interest in data
freshness, captured by the {\it age-of-information} (AoI) metric. When
strategic data sources have private market information, a fundamental economic
challenge is how to incentivize them to acquire fresh data and optimize the
age-related performance. In this work, we consider an information update system
in which a destination acquires, and pays for, fresh data updates from multiple
sources. The destination incurs an age-related cost, modeled as a general
increasing function of the AoI. Each source is strategic and incurs a sampling
cost, which is its private information and may not be truthfully reported to
the destination. The destination decides on the price of updates, when to get
them, and who should generate them, based on the sources' reported sampling
costs. We show that a benchmark that naively trusts the sources' reports can
lead to an arbitrarily bad outcome compared to the case where sources
truthfully report. To tackle this issue, we design an optimal (economic)
mechanism for timely information acquisition following Myerson's seminal work.
To this end, our proposed optimal mechanism minimizes the sum of the
destination's age-related cost and its payment to the sources, while ensuring
that the sources truthfully report their private information and will
voluntarily participate in the mechanism. However, finding the optimal
mechanisms may suffer from \textit{prohibitively expensive computational
overheads} as it involves solving a nonlinear infinite-dimensional optimization
problem. We further propose a quantized version of the optimal mechanism that
achieves asymptotic optimality, maintains the other economic properties, and
enables one to tradeoff between optimality and computational overheads.
","[{""version"":""v1"",""created"":""Mon, 29 Jun 2020 00:05:39 GMT""},{""version"":""v2"",""created"":""Sat, 4 Jul 2020 16:34:45 GMT""},{""version"":""v3"",""created"":""Wed, 15 Jul 2020 22:25:07 GMT""},{""version"":""v4"",""created"":""Tue, 15 Dec 2020 22:36:40 GMT""}]","2020-12-17"
"2006.15752","Freid Tong","Tristan C. Collins, Bin Guo and Freid Tong","On the degeneration of asymptotically conical Calabi-Yau metrics","40 pages",,,,"math.DG","http://arxiv.org/licenses/nonexclusive-distrib/1.0/","  We study the degenerations of asymptotically conical Ricci-flat K\""ahler
metrics as the K\""ahler class degenerates to a semi-positive class. We show
that under appropriate assumptions, the Ricci-flat K\""ahler metrics converge to
a incomplete smooth Ricci-flat K\""ahler metric away from a compact subvariety.
As a consequence, we construct singular Calabi-Yau metrics with asymptotically
conical behaviour at infinity on certain quasi-projective varieties and we show
that the metric geometry of these singular metrics are homeomorphic to the
topology of the singular variety. Finally, we will apply our results to study
several classes of examples of geometric transitions between Calabi-Yau
manifolds.
","[{""version"":""v1"",""created"":""Mon, 29 Jun 2020 00:10:35 GMT""}]","2020-06-30"
"2006.15753","Keisuke Kawano","Keisuke Kawano, Takuro Kutsuna, Satoshi Koide","Neural Time Warping For Multiple Sequence Alignment","11 pages, 5figures, ICASSP 2020",,,,"cs.LG stat.ML","http://arxiv.org/licenses/nonexclusive-distrib/1.0/","  Multiple sequences alignment (MSA) is a traditional and challenging task for
time-series analyses. The MSA problem is formulated as a discrete optimization
problem and is typically solved by dynamic programming. However, the
computational complexity increases exponentially with respect to the number of
input sequences. In this paper, we propose neural time warping (NTW) that
relaxes the original MSA to a continuous optimization and obtains the
alignments using a neural network. The solution obtained by NTW is guaranteed
to be a feasible solution for the original discrete optimization problem under
mild conditions. Our experimental results show that NTW successfully aligns a
hundred time-series and significantly outperforms existing methods for solving
the MSA problem. In addition, we show a method for obtaining average
time-series data as one of applications of NTW. Compared to the existing
barycenters, the mean time series data retains the features of the input
time-series data.
","[{""version"":""v1"",""created"":""Mon, 29 Jun 2020 00:16:40 GMT""}]","2020-06-30"
"2006.15754","Eric Heiden","Ali-akbar Agha-mohammadi, Eric Heiden, Karol Hausman, Gaurav S.
  Sukhatme","Confidence-rich grid mapping","Published at International Journal of Robotics Research (IJRR) 2019
  (https://journals.sagepub.com/doi/10.1177/0278364919839762)","The International Journal of Robotics Research, 38(12-13),
  1352-1374 (2019)","10.1177/0278364919839762",,"cs.RO cs.CV","http://arxiv.org/licenses/nonexclusive-distrib/1.0/","  Representing the environment is a fundamental task in enabling robots to act
autonomously in unknown environments. In this work, we present confidence-rich
mapping (CRM), a new algorithm for spatial grid-based mapping of the 3D
environment. CRM augments the occupancy level at each voxel by its confidence
value. By explicitly storing and evolving confidence values using the CRM
filter, CRM extends traditional grid mapping in three ways: first, it partially
maintains the probabilistic dependence among voxels. Second, it relaxes the
need for hand-engineering an inverse sensor model and proposes the concept of
sensor cause model that can be derived in a principled manner from the forward
sensor model. Third, and most importantly, it provides consistent confidence
values over the occupancy estimation that can be reliably used in collision
risk evaluation and motion planning. CRM runs online and enables mapping
environments where voxels might be partially occupied. We demonstrate the
performance of the method on various datasets and environments in simulation
and on physical systems. We show in real-world experiments that, in addition to
achieving maps that are more accurate than traditional methods, the proposed
filtering scheme demonstrates a much higher level of consistency between its
error and the reported confidence, hence, enabling a more reliable collision
risk evaluation for motion planning.
","[{""version"":""v1"",""created"":""Mon, 29 Jun 2020 00:21:30 GMT""}]","2020-06-30"
"2006.15755","David S. Hall","Y. Xiao, M.O. Borgh, L.S. Weiss, A. Blinova, J. Ruostekoski, and D.S.
  Hall","Controlled Creation and Decay of Singly-Quantized Vortices in a Polar
  Magnetic Phase","10 pages, 7 figures","Comm. Phys. 4, 52 (2021)","10.1038/s42005-021-00554-y",,"cond-mat.quant-gas","http://arxiv.org/licenses/nonexclusive-distrib/1.0/","  We experimentally and theoretically explore the creation and time evolution
of vortex lines in the polar magnetic phase of a trapped spin-1 $^{87}$Rb
Bose-Einstein condensate. A process of phase-imprinting a nonsingular vortex,
its decay into a pair of singular spinor vortices, and a rapid exchange of
magnetic phases creates a pair of three-dimensional, singular singly-quantized
vortex lines with core regions that are filled with atoms in the ferromagnetic
phase. Atomic interactions guide the subsequent vortex dynamics, leading to
core structures that suggest the decay of the singly-quantized vortices into
half-quantum vortices.
","[{""version"":""v1"",""created"":""Mon, 29 Jun 2020 00:31:23 GMT""}]","2021-03-15"
"2006.15756","Bo Zhou","Bo Zhou, Walid Saad","Age of Information in Ultra-Dense IoT Systems: Performance and
  Mean-Field Game Analysis","Fixed typos in Equations (4) and (7). 30 pages, 9 figures",,,,"cs.IT cs.NI math.IT","http://arxiv.org/licenses/nonexclusive-distrib/1.0/","  In this paper, a dense Internet of Things (IoT) monitoring system is
considered in which a large number of IoT devices contend for channel access so
as to transmit timely status updates to the corresponding receivers using a
carrier sense multiple access (CSMA) scheme. Under two packet management
schemes with and without preemption in service, the closed-form expressions of
the average age of information (AoI) and the average peak AoI of each device is
characterized. It is shown that the scheme with preemption in service always
leads to a smaller average AoI and a smaller average peak AoI, compared to the
scheme without preemption in service. Then, a distributed noncooperative medium
access control game is formulated in which each device optimizes its waiting
rate so as to minimize its average AoI or average peak AoI under an average
energy cost constraint on channel sensing and packet transmitting. To overcome
the challenges of solving this game for an ultra-dense IoT, a mean-field game
(MFG) approach is proposed to study the asymptotic performance of each device
for the system in the large population regime. The accuracy of the MFG is
analyzed, and the existence, uniqueness, and convergence of the mean-field
equilibrium (MFE) are investigated. Simulation results show that the proposed
MFG is accurate even for a small number of devices; and the proposed CSMA-type
scheme under the MFG analysis outperforms two baseline schemes with fixed and
dynamic waiting rates, with the average AoI reductions reaching up to 22% and
34%, respectively. Moreover, it is observed that the average AoI and the
average peak AoI under the MFE do not necessarily decrease with the arrival
rate.
","[{""version"":""v1"",""created"":""Mon, 29 Jun 2020 00:37:18 GMT""},{""version"":""v2"",""created"":""Sun, 12 Jul 2020 02:30:16 GMT""},{""version"":""v3"",""created"":""Thu, 26 Nov 2020 04:07:06 GMT""}]","2020-11-30"
"2006.15757","Nikka Mofid","Rui Aguiar, Nikka Mofid, Hyunji Alex Nam","Exploring Optimal Control With Observations at a Cost","8 pages, 10 figures",,,,"cs.LG cs.AI","http://arxiv.org/licenses/nonexclusive-distrib/1.0/","  There has been a current trend in reinforcement learning for healthcare
literature, where in order to prepare clinical datasets, researchers will carry
forward the last results of the non-administered test known as the
last-observation-carried-forward (LOCF) value to fill in gaps, assuming that it
is still an accurate indicator of the patient's current state. These values are
carried forward without maintaining information about exactly how these values
were imputed, leading to ambiguity. Our approach models this problem using
OpenAI Gym's Mountain Car and aims to address when to observe the patient's
physiological state and partly how to intervene, as we have assumed we can only
act after following an observation. So far, we have found that for a
last-observation-carried-forward implementation of the state space, augmenting
the state with counters for each state variable tracking the time since last
observation was made, improves the predictive performance of an agent,
supporting the notion of ""informative missingness"", and using a neural network
based Dynamics Model to predict the most probable next state value of
non-observed state variables instead of carrying forward the last observed
value through LOCF further improves the agent's performance, leading to faster
convergence and reduced variance.
","[{""version"":""v1"",""created"":""Mon, 29 Jun 2020 00:42:05 GMT""}]","2020-06-30"
"2006.15758","Yusuke Nambu","Yusuke Nambu, Mechthild Enderle, Tobias Weber, Kazuhisa Kakurai","Neutron polarisation correction to triple-axis data with analytical
  derivations","8 pages, 2 figures","J. Phys.: Conf. Ser. 2481 012004 (2023)","10.1088/1742-6596/2481/1/012004",,"cond-mat.str-el cond-mat.mtrl-sci","http://arxiv.org/licenses/nonexclusive-distrib/1.0/","  Polarised neutron scattering is the method of choice to study magnetism in
condensed matter. Polarised neutrons are typically very low in flux, and
complex experimental configurations further reduce the count rate. Neutron
polarisation corrections would therefore be needed. Here we analytically derive
formulae of the corrected partial differential scattering cross-sections. The
analytical method is designed for the longitudinal polarisation analysis, and
the correction generally holds for time-independent polarised neutrons with a
triple-axis spectrometer. We then apply the correction to recent results of our
$P_x$ experiment on Y$_3$Fe$_5$O$_{12}$. Although there is a difficulty with
the experimental determination of inefficiency parameters of neutron spin
polarisers and flippers, the correction appears to work properly.
","[{""version"":""v1"",""created"":""Mon, 29 Jun 2020 00:43:26 GMT""},{""version"":""v2"",""created"":""Sun, 7 May 2023 00:07:32 GMT""}]","2023-05-09"
"2006.15759","Alexander Wong","James Ren Hou Lee, Linda Wang, and Alexander Wong","EmotionNet Nano: An Efficient Deep Convolutional Neural Network Design
  for Real-time Facial Expression Recognition","9 pages",,,,"cs.CV","http://arxiv.org/licenses/nonexclusive-distrib/1.0/","  While recent advances in deep learning have led to significant improvements
in facial expression classification (FEC), a major challenge that remains a
bottleneck for the widespread deployment of such systems is their high
architectural and computational complexities. This is especially challenging
given the operational requirements of various FEC applications, such as safety,
marketing, learning, and assistive living, where real-time requirements on
low-cost embedded devices is desired. Motivated by this need for a compact, low
latency, yet accurate system capable of performing FEC in real-time on low-cost
embedded devices, this study proposes EmotionNet Nano, an efficient deep
convolutional neural network created through a human-machine collaborative
design strategy, where human experience is combined with machine meticulousness
and speed in order to craft a deep neural network design catered towards
real-time embedded usage. Two different variants of EmotionNet Nano are
presented, each with a different trade-off between architectural and
computational complexity and accuracy. Experimental results using the CK+
facial expression benchmark dataset demonstrate that the proposed EmotionNet
Nano networks demonstrated accuracies comparable to state-of-the-art in FEC
networks, while requiring significantly fewer parameters (e.g., 23$\times$
fewer at a higher accuracy). Furthermore, we demonstrate that the proposed
EmotionNet Nano networks achieved real-time inference speeds (e.g. $>25$ FPS
and $>70$ FPS at 15W and 30W, respectively) and high energy efficiency (e.g.
$>1.7$ images/sec/watt at 15W) on an ARM embedded processor, thus further
illustrating the efficacy of EmotionNet Nano for deployment on embedded
devices.
","[{""version"":""v1"",""created"":""Mon, 29 Jun 2020 00:48:05 GMT""}]","2020-06-30"
"2006.15760","Yuze Wang","Yuze Wang, Charalampos Konstantinou, Kenichi Soga, Jason T. DeJong,
  Giovanna Biscontin, Alexandre J. Kabla","Enhancing strength of MICP-treated sandy soils: from micro to macro
  scale","23 pages, 13 figures",,,,"physics.geo-ph","http://arxiv.org/licenses/nonexclusive-distrib/1.0/","  Microbial-Induced Calcium carbonate (CaCO3) Precipitation (MICP) has been
extensively studied for soil improvement in geotechnical engineering. The
properties of calcium carbonate crystals such as size and quantity affect the
strength of MICP-treated soil. This study demonstrates how the data from
micro-scale microfluidic experiments that examine the effects of injection
intervals and concentration of cementation solution on the properties of
calcium carbonate crystals can be used to optimise the MICP treatment of
macro-scale sand soil column experiments for effective strength enhancement.
The micro-scale experiments reveal that, due to Ostwald ripening, longer
injection intervals allow smaller crystals to dissolve and reprecipitate into
larger crystals regardless of the concentration of cementation solution. By
applying this finding in the macro-scale experiments, a treatment duration of 6
days, where injection intervals were 12 h, 24 h, and 48 h for cementation
solution concentration of 0.25 M, 0.5 M and 1.0 M, respectively, was long
enough to precipitate crystals large enough for effective strength enhancement.
This was indicated by the fact that significantly higher soil strength and
larger crystals were produced when treatment duration increased from 3 days to
6 days, but not when it increased from 6 days to 12 days.
","[{""version"":""v1"",""created"":""Mon, 29 Jun 2020 00:56:36 GMT""}]","2020-06-30"
"2006.15761","Masahiro Takeda","Daisuke Kishimoto and Masahiro Takeda","Spaces of commuting elements in the classical groups",,,,,"math.AT","http://arxiv.org/licenses/nonexclusive-distrib/1.0/","  Let $G$ be the classical group, and let Hom$(\mathbb{Z}^m,G)$ denote the
space of commuting $m$-tuples in $G$. First, we refine the formula for the
Poincar\'e series of Hom$(\mathbb{Z}^m,G)$ due to Ramras and Stafa by assigning
(signed) integer partitions to (signed) permutations. Using the refined
formula, we determine the top term of the Poincar\'e series, and apply it to
prove the dependence of the topology of Hom$(\mathbb{Z}^m,G)$ on the parity of
$m$ and the rational hyperbolicity of Hom$(\mathbb{Z}^m,G)$ for $m\ge 2$. Next,
we give a minimal generating set of the cohomology of Hom$(\mathbb{Z}^m,G)$ and
determine the cohomology in low dimensions. We apply these results to prove
homological stability for Hom$(\mathbb{Z}^m,G)$ with the best possible stable
range. Baird proved that the cohomology of Hom$(\mathbb{Z}^m,G)$ is identified
with a certain ring of invariants of the Weyl group of $G$, and our approach is
a direct calculation of this ring of invariants.
","[{""version"":""v1"",""created"":""Mon, 29 Jun 2020 00:59:14 GMT""},{""version"":""v2"",""created"":""Mon, 20 Jul 2020 00:22:36 GMT""}]","2020-07-21"
"2006.15762","Kenneth Marino","Kenneth Marino, Rob Fergus, Arthur Szlam, Abhinav Gupta","Empirically Verifying Hypotheses Using Reinforcement Learning",,,,,"cs.AI cs.LG stat.ML","http://arxiv.org/licenses/nonexclusive-distrib/1.0/","  This paper formulates hypothesis verification as an RL problem. Specifically,
we aim to build an agent that, given a hypothesis about the dynamics of the
world, can take actions to generate observations which can help predict whether
the hypothesis is true or false. Existing RL algorithms fail to solve this
task, even for simple environments. In order to train the agents, we exploit
the underlying structure of many hypotheses, factorizing them as
{pre-condition, action sequence, post-condition} triplets. By leveraging this
structure we show that RL agents are able to succeed at the task. Furthermore,
subsequent fine-tuning of the policies allows the agent to correctly verify
hypotheses not amenable to the above factorization.
","[{""version"":""v1"",""created"":""Mon, 29 Jun 2020 01:01:10 GMT""}]","2020-06-30"
"2006.15763","Kai Zhang","Kai Zhang, Yaokang Zhu, Jun Wang, Jie Zhang, Hongyuan Zha","Structural Landmarking and Interaction Modelling: on Resolution Dilemmas
  in Graph Classification",,,,,"cs.LG stat.ML","http://arxiv.org/licenses/nonexclusive-distrib/1.0/","  Graph neural networks are promising architecture for learning and inference
with graph-structured data. Yet difficulties in modelling the ``parts'' and
their ``interactions'' still persist in terms of graph classification, where
graph-level representations are usually obtained by squeezing the whole graph
into a single vector through graph pooling. From complex systems point of view,
mixing all the parts of a system together can affect both model
interpretability and predictive performance, because properties of a complex
system arise largely from the interaction among its components. We analyze the
intrinsic difficulty in graph classification under the unified concept of
``resolution dilemmas'' with learning theoretic recovery guarantees, and
propose ``SLIM'', an inductive neural network model for Structural Landmarking
and Interaction Modelling. It turns out, that by solving the resolution
dilemmas, and leveraging explicit interacting relation between component parts
of a graph to explain its complexity, SLIM is more interpretable, accurate, and
offers new insight in graph representation learning.
","[{""version"":""v1"",""created"":""Mon, 29 Jun 2020 01:01:42 GMT""}]","2020-06-30"
"2006.15764","Gabriele Bozzola","Gabriele Bozzola and Vasileios Paschalidis","General relativistic simulations of the quasi-circular inspiral and
  merger of charged black holes: GW150914 and fundamental physics implications","10 pages (including Supplemental Material), 3 figures. Matches
  published version","Phys. Rev. Lett. 126, 041103 (2021)","10.1103/PhysRevLett.126.041103",,"gr-qc astro-ph.HE","http://arxiv.org/licenses/nonexclusive-distrib/1.0/","  We perform general-relativistic simulations of charged black holes targeting
GW150914. We show that the inspiral is most efficient for detecting black hole
charge through gravitational waves and that GW150914 is compatible with having
charge-to-mass ratio as high as 0.3. Our work applies to electric and magnetic
charge, and to theories with black holes endowed with U(1) (hidden or dark)
charges. Using our results we place an upper bound on the deviation from
general relativity in the dynamical, strong-field regime of the so-called
theory of MOdified Gravity (MOG).
","[{""version"":""v1"",""created"":""Mon, 29 Jun 2020 01:03:42 GMT""},{""version"":""v2"",""created"":""Wed, 27 Jan 2021 17:37:16 GMT""}]","2021-02-03"
"2006.15765","Artem Pulemotov","Romina M. Arroyo, Mark D. Gould, Artem Pulemotov","The prescribed Ricci curvature problem for naturally reductive metrics
  on non-compact simple Lie groups","24 pages, 1 figure",,,,"math.DG","http://arxiv.org/licenses/nonexclusive-distrib/1.0/","  We investigate the prescribed Ricci curvature problem in the class of
left-invariant naturally reductive Riemannian metrics on a non-compact simple
Lie group. We obtain a number of conditions for the solvability of the
underlying equations and discuss several examples.
","[{""version"":""v1"",""created"":""Mon, 29 Jun 2020 01:08:38 GMT""},{""version"":""v2"",""created"":""Tue, 18 Aug 2020 22:56:44 GMT""}]","2020-08-20"
