"2001.00980","M{\aa}ns Magnusson","M{\aa}ns Magnusson, Michael Riis Andersen, Johan Jonasson, and Aki
  Vehtari","Leave-One-Out Cross-Validation for Bayesian Model Comparison in Large
  Data",,"Proceedings of the 23rd International Conference on Artificial
  Intelligence and Statistics (AISTATS), PMLR 108:341-351, 2020",,,"stat.ME","http://arxiv.org/licenses/nonexclusive-distrib/1.0/","  Recently, new methods for model assessment, based on subsampling and
posterior approximations, have been proposed for scaling leave-one-out
cross-validation (LOO) to large datasets. Although these methods work well for
estimating predictive performance for individual models, they are less powerful
in model comparison. We propose an efficient method for estimating differences
in predictive performance by combining fast approximate LOO surrogates with
exact LOO subsampling using the difference estimator and supply proofs with
regards to scaling characteristics. The resulting approach can be orders of
magnitude more efficient than previous approaches, as well as being better
suited to model comparison.
","[{""version"":""v1"",""created"":""Fri, 3 Jan 2020 20:47:45 GMT""}]","2020-08-12"
"2001.00981","Douglas DiJulio","Douglas D. DiJulio, Isak Svensson, Xiao Xiao Cai, Joakim Cederkall and
  Phillip M. Bentley","Simulating neutron transport in long beamlines at a spallation neutron
  source using Geant4","ICANS-XXIII",,,,"physics.ins-det","http://arxiv.org/licenses/nonexclusive-distrib/1.0/","  The transport of neutrons in long beamlines at spallation neutron sources
presents a unique challenge for Monte-Carlo transport calculations. This is due
to the need to accurately model the deep-penetration of high-energy neutrons
through meters of thick dense shields close to the source and at the same time
to model the transport of low-energy neutrons across distances up to around 150
m in length. Typically, such types of calculations may be carried out with
MCNP-based codes or alternatively PHITS. However, in recent years there has
been an increased interest in the suitability of Geant4 for such types of
calculations. Therefore, we have implemented supermirror physics, a neutron
chopper module and the duct-source variance reduction technique for low-energy
neutron transport from the PHITS Monte-Carlo code into Geant4. In the current
work, we present a series of benchmarks of these extensions with the PHITS
software, which demonstrates the suitability of Geant4 for simulating long
neutron beamlines at a spallation neutron source, such as the European
Spallation Source, currently under construction in Lund, Sweden.
","[{""version"":""v1"",""created"":""Fri, 3 Jan 2020 20:50:25 GMT""}]","2020-01-07"
"2001.00982","Paolo Lipari","Paolo Lipari","The origin of the power-law form of the extragalactic gamma-ray flux","26 pages, 10 figures",,"10.1016/j.astropartphys.2020.102507",,"astro-ph.HE","http://arxiv.org/licenses/nonexclusive-distrib/1.0/","  The Fermi-LAT telescope has measured the extragalactic gamma-ray background
(EGB) generated by the ensemble of all extragalactic sources. The energy
distribution of the EGB is well described as a power-law with a spectral index
approximately equal to 2.3, and an exponential cutoff, that is consistent with
being the effect of absorption of high energy photons assuming an emission that
is an unbroken power-law spectrum. The observations of the Fermi telescope have
also resolved the EGB, determining that most of it is formed by the sum of the
contributions of Active Galactic Nuclei (AGN) of the blazar class. The spectra
of the individual AGN sources have a broad range of spectral shapes, and the
brightest and most precisely measured sources have curved spectra that can be
fitted with the ""log-parabola"" (or log-normal) form. It might appear surprising
that the sum of contributions with different spectral shapes generate a
spectrum that has a simple power-law form. We suggest that this fact reveals
some important properties for the ensemble of the extragalactic sources, and
indicates that the blazar high energy emission can be considered as a ""critical
phenomenon"". A curved log--parabola (log-normal) form is also required to fit
the spectra of many Galactic gamma-ray sources, including the emission from the
brightest supernova remnants (SNR), and an intriguing possibility is that also
the Galactic cosmic rays are injected in interstellar space by their sources
not with a single universal power-law spectrum, as predicted by the commonly
accepted models, but instead with a broad range of spectral shapes.
","[{""version"":""v1"",""created"":""Fri, 3 Jan 2020 20:51:59 GMT""}]","2020-09-09"
"2001.00983","Ben Adcock","Ben Adcock and Mohsen Seifi","Frame approximation with bounded coefficients",,,,,"math.NA cs.NA","http://arxiv.org/licenses/nonexclusive-distrib/1.0/","  Due to their flexibility, frames of Hilbert spaces are attractive
alternatives to bases in approximation schemes for problems where identifying a
basis is not straightforward or even feasible. Computing a best approximation
using frames, however, can be challenging since it requires solving an
ill-conditioned linear system. One consequence of this ill-conditioning is that
the coefficients of such a frame approximation can grow large. In this paper we
resolve this issue by introducing two methods for frame approximation that
possess bounded coefficients. As we show, these methods typically lead to
little or no deterioration in the approximation accuracy, but successfully
avoid the large coefficients inherent to previous approaches, thus making them
attractive in situations where large coefficients are undesirable. We also
present theoretical analysis to support these conclusions.
","[{""version"":""v1"",""created"":""Fri, 3 Jan 2020 20:54:53 GMT""},{""version"":""v2"",""created"":""Mon, 6 Jul 2020 21:12:22 GMT""}]","2020-07-08"
"2001.00985","Felipe Gonz\'alez-Cataldo","Felipe Gonz\'alez-Cataldo, Fran\c{c}ois Soubiran, Henry Peterson,
  Burkhard Militzer","Path Integral Monte Carlo and Density Functional Molecular Dynamics
  Simulations of Warm, Dense MgSiO$_3$","14 pages, 14 color figures, Physical Review B (accepted, Dec. 2019)","Physical Review B (2020)","10.1103/PhysRevB.101.024107",,"cond-mat.mtrl-sci","http://arxiv.org/licenses/nonexclusive-distrib/1.0/","  In order to provide a comprehensive theoretical description of MgSiO$_3$ at
extreme conditions, we combine results from path integral Monte Carlo (PIMC)
and density functional molecular dynamics simulations (DFT-MD) and generate a
consistent equation of state for this material. We consider a wide range of
temperature and density conditions from 10$^4$ to 10$^8$ K and from 0.321 to
64.2 g$\,$cm$^{-3}$ (0.1- to 20-fold the ambient density). We study how the L
and K shell electrons are ionized with increasing temperature and pressure. We
derive the shock Hugoniot curve and compare with experimental results. Our
Hugoniot curve is in good agreement with the experiments, and we predict a
broad compression maximum that is dominated by the K shell ionization of all
three nuclei while the peak compression ratio of 4.70 is obtained when the Si
and Mg nuclei are ionized. Finally we analyze the heat capacity and structural
properties of the liquid.
","[{""version"":""v1"",""created"":""Fri, 3 Jan 2020 21:01:11 GMT""}]","2020-02-19"
"2001.00990","Walter Carballosa","Walter Carballosa, Omar Rosario, Jos\'e M. Sigarreta, Yadira
  Torres-Nu\~nez","Distinguishing wheel graphs by the alliance polynomial","This work was presented in the 49th Southeastern International
  Conference on Combinatorics, Graph Theory & Computing (CEICCGTC 2018)",,,,"math.CO","http://arxiv.org/licenses/nonexclusive-distrib/1.0/","  Distinctive power of the alliance polynomial has been studied in previous
works, for instance, it has been proved that the empty, path, cycle, complete,
complete without one edge and star graphs are characterized by its alliance
polynomial. Moreover, it has been proved that the family of alliance polynomial
of regular graphs with small degree is a very special one, since it does not
contain alliance polynomial of graphs other than regular graph with the same
degree. In this work we prove that the alliance polynomial also determines the
wheel graphs.
","[{""version"":""v1"",""created"":""Fri, 3 Jan 2020 21:13:40 GMT""}]","2020-01-07"
"2001.00991","Marc Killpack","Erich Mielke, Eric Townsend, David Wingate, and Marc D. Killpack","Human-robot co-manipulation of extended objects: Data-driven models and
  control from analysis of human-human dyads","Paper has been in submission to IJRR since November 2018",,,,"cs.RO cs.AI cs.HC cs.LG cs.SY eess.SY","http://arxiv.org/licenses/nonexclusive-distrib/1.0/","  Human teams are able to easily perform collaborative manipulation tasks.
However, for a robot and human to simultaneously manipulate an extended object
is a difficult task using existing methods from the literature. Our approach in
this paper is to use data from human-human dyad experiments to determine motion
intent which we use for a physical human-robot co-manipulation task. We first
present and analyze data from human-human dyads performing co-manipulation
tasks. We show that our human-human dyad data has interesting trends including
that interaction forces are non-negligible compared to the force required to
accelerate an object and that the beginning of a lateral movement is
characterized by distinct torque triggers from the leader of the dyad. We also
examine different metrics to quantify performance of different dyads. We also
develop a deep neural network based on motion data from human-human trials to
predict human intent based on past motion. We then show how force and motion
data can be used as a basis for robot control in a human-robot dyad. Finally,
we compare the performance of two controllers for human-robot co-manipulation
to human-human dyad performance.
","[{""version"":""v1"",""created"":""Fri, 3 Jan 2020 21:23:12 GMT""}]","2020-01-07"
"2001.00992","Rao Li","Rao Li","The Matching Number and Hamiltonicity of Graphs",,,,,"math.CO","http://creativecommons.org/licenses/by-sa/4.0/","  The matching number of a graph G is the size of a maximum matching in the
graph. In this note, we present a sufficient condition involving the matching
number for the Hamiltonicity of graphs.
","[{""version"":""v1"",""created"":""Fri, 3 Jan 2020 21:24:13 GMT""}]","2020-01-07"
"2001.00993","Luc Nguyen","YanYan Li and Luc Nguyen","Existence and uniqueness of Green's functions to nonlinear Yamabe
  problems","To appear in Comm. Pure Appl. Math",,,,"math.AP math.DG","http://arxiv.org/licenses/nonexclusive-distrib/1.0/","  For a given finite subset $S$ of a compact Riemannian manifold $(M,g)$ whose
Schouten curvature tensor belongs to a given cone, we establish a necessary and
sufficient condition for the existence and uniqueness of a conformal metric on
$M \setminus S$ such that each point of $S$ corresponds to an asymptotically
flat end and that the Schouten tensor of the conformal metric belongs to the
boundary of the given cone. As a by-product, we define a purely local notion of
Ricci lower bounds for continuous metrics which are conformal to smooth metrics
and prove a corresponding volume comparison theorem.
","[{""version"":""v1"",""created"":""Fri, 3 Jan 2020 21:27:39 GMT""},{""version"":""v2"",""created"":""Wed, 17 Feb 2021 18:22:54 GMT""},{""version"":""v3"",""created"":""Wed, 21 Jul 2021 14:02:54 GMT""}]","2021-07-22"
"2001.00994","Guruprasad Nayak","Guruprasad Nayak, Rahul Ghosh, Xiaowei Jia, Varun Mithal, Vipin Kumar","Semi-supervised Classification using Attention-based Regularization on
  Coarse-resolution Data","To appear in the proceedings of the SIAM International Conference on
  Data Mining (SDM20)",,,,"cs.LG cs.CV cs.IR stat.ML","http://arxiv.org/licenses/nonexclusive-distrib/1.0/","  Many real-world phenomena are observed at multiple resolutions. Predictive
models designed to predict these phenomena typically consider different
resolutions separately. This approach might be limiting in applications where
predictions are desired at fine resolutions but available training data is
scarce. In this paper, we propose classification algorithms that leverage
supervision from coarser resolutions to help train models on finer resolutions.
The different resolutions are modeled as different views of the data in a
multi-view framework that exploits the complementarity of features across
different views to improve models on both views. Unlike traditional multi-view
learning problems, the key challenge in our case is that there is no one-to-one
correspondence between instances across different views in our case, which
requires explicit modeling of the correspondence of instances across
resolutions. We propose to use the features of instances at different
resolutions to learn the correspondence between instances across resolutions
using an attention mechanism.Experiments on the real-world application of
mapping urban areas using satellite observations and sentiment classification
on text data show the effectiveness of the proposed methods.
","[{""version"":""v1"",""created"":""Fri, 3 Jan 2020 21:29:26 GMT""}]","2020-01-07"
"2001.00995","Nicholas Moore","M. N. J. Moore, C. Tyler Bolles, Andrew J. Majda, Di Qi","Anomalous waves triggered by abrupt depth changes: laboratory
  experiments and truncated KdV statistical mechanics",,,,,"physics.flu-dyn nlin.CD","http://arxiv.org/licenses/nonexclusive-distrib/1.0/","  Recent laboratory experiments of Bolles et al. (2019) demonstrate that an
abrupt change in bottom topography can trigger anomalous statistics in
randomized surface waves. Motivated by these observations, Majda et al. (2019)
developed a theoretical framework, based on deterministic and statistical
analysis of the truncated Korteweg-de Vries (TKdV) system, that successfully
captures key qualitative features of the experiments, including the robust
emergence of anomalous statistics and heightened skewness in the outgoing
wavefield. Here, we extend these parallel experimental and modeling efforts
with several new findings that have resulted from a synergetic interaction
between the two. By precisely relating model parameters to physical ones, we
calibrate the model inverse temperature to the specific conditions present in
the experiments, thereby permitting a quantitative comparison. We find
theoretically predicted distributions of surface displacement to match the
experimental measurements with surprising detail. Prompted by the presence of
surface slope in the TKdV Hamiltonian, we present new experimental measurements
on surface slope statistics and compare them to model predictions. Analysis of
some deterministic trajectories of TKdV elucidates the experimental length and
time scales required for the statistical transition to a skewed state. Finally,
the theory predicts a peculiar relationship between the outgoing displacement
skewness and the change in slope variance, specifically how their ratio depends
on the wave amplitude and depth ratio. New experimental measurements confirm
this prediction in spectacular fashion.
","[{""version"":""v1"",""created"":""Fri, 3 Jan 2020 21:40:04 GMT""}]","2020-01-07"
"2001.00996","Athanasios Rakitzis","P. H. Tran and A. C. Rakitzis and H. D. Nguyen and Q. T. Nguyen and K.
  P. Tran and C. Heuchenne","Monitoring the Multivariate Coefficient of Variation using Run Rules
  Type Control Charts","27 pages, 4 figures, 12 tables",,,,"stat.AP stat.CO","http://creativecommons.org/licenses/by/4.0/","  In practice, there are processes where the in-control mean and standard
deviation of a quality characteristic is not stable. In such cases, the
coefficient of variation (CV) is a more appropriate measure for assessing
process stability. In this paper, we consider the statistical design of Run
Rules based control charts for monitoring the CV of multivariate data. A Markov
chain approach is used to evaluate the statistical performance of the proposed
charts. The computational results show that the Run Rules based charts
outperform significantly the standard Shewhart control chart. Moreover, by
choosing an appropriate scheme, the Run Rules based charts perform better than
the Rum Sum control chart for monitoring the multivariate CV. An example in a
spring manufacturing process is given to illustrate the implementation of the
proposed charts.
","[{""version"":""v1"",""created"":""Fri, 3 Jan 2020 21:51:43 GMT""},{""version"":""v2"",""created"":""Sun, 19 Jan 2020 13:25:58 GMT""}]","2020-01-22"
"2001.00998","Camila Fabre Sehnem","Camila F. Sehnem","Fell bundles over quasi-lattice ordered groups and
  $\mathrm{C}^*$-algebras of compactly aligned product systems","34 pages; to appear in M\""unster Journal of Mathematics; minor
  changes from previous version; author's address has been updated",,,,"math.OA","http://arxiv.org/licenses/nonexclusive-distrib/1.0/","  We define notions of semi-saturatedness and orthogonality for a Fell bundle
over a quasi-lattice ordered group. We show that a compactly aligned product
system of Hilbert bimodules can be naturally extended to a semi-saturated and
orthogonal Fell bundle whenever it is simplifiable. Conversely, a
semi-saturated and orthogonal Fell bundle is completely determined by the
positive fibres and its cross sectional $\mathrm{C}^*$-algebra is isomorphic to
a relative Cuntz--Pimsner algebra of a simplifiable product system of Hilbert
bimodules. We show that this correspondence is part of an equivalence between
bicategories and use this to generalise several results of Meyer and the author
in the context of single correspondences. We apply functoriality for relative
Cuntz--Pimsner algebras to study Morita equivalence between
$\mathrm{C}^*$-algebras attached to compactly aligned product systems over
Morita equivalent $\mathrm{C}^*$-algebras.
","[{""version"":""v1"",""created"":""Fri, 3 Jan 2020 22:01:17 GMT""},{""version"":""v2"",""created"":""Fri, 10 Jan 2020 20:17:56 GMT""},{""version"":""v3"",""created"":""Fri, 16 Oct 2020 15:33:40 GMT""}]","2020-10-19"
"2001.01001","Petr Kabath","Petr Kabath, Marek Skarka, Silvia Sabotta, Eike Guenther, David Jones,
  Tereza Klocova, Jan Subjak, Jiri Zak, Magdalena Spokova, Martin Blazek, Jana
  Dvorakova, Daniel Dupkala, Jan Fuchs, Artie Hatzes, Eva Kortusova, Radek
  Novotny, Eva Plavalova, Ludek Rezba, Jan Sloup, Petr Skoda, Miroslav Slechta","Ondr}ejov echelle spectrograph, ground based support facility for
  exoplanet missions","accepted for publication in PASP",,"10.1088/1538-3873/ab6752",,"astro-ph.IM","http://arxiv.org/licenses/nonexclusive-distrib/1.0/","  Fulfilling the goals of space-based exoplanetary transit surveys, like Kepler
and TESS, is impossible without ground-based spectroscopic follow-up. In
particular, the first-step vetting of candidates could easily necessitate
several hundreds of hours of telescope time -- an area where 2-m class
telescopes can play a crucial role. Here, we describe the results from the
science verification of the Ond\v{r}ejov Echelle Spectrograph (OES) installed
on the 2-m Perek telescope. We discuss the performance of the instrument as
well as its suitability for the study of exoplanetary candidates from
space-based transit surveys. In spite of being located at an average European
observing site, and originally being conceived for the study of variable stars,
OES can prove to be an important instrument for the exoplanetary community in
the TESS and PLATO era -- reaching accuracies of a few tens of m/s with
reasonable sampling and signal-to-noise for sources down to V$\sim$13. The
stability of OES is demonstrated via long-term monitoring of the standard star
HD~109358, while its validity for exoplanetary candidate verification is shown
using three K2 candidates EPIC~210925707, EPIC~206135267 and EPIC~211993818, to
reveal that they are false positive detections.
","[{""version"":""v1"",""created"":""Fri, 3 Jan 2020 22:13:42 GMT""}]","2020-02-05"
"2001.01002","Jordan Dworkin","Jordan D. Dworkin, Kristin A. Linn, Erin G. Teich, Perry Zurn, Russell
  T. Shinohara, Danielle S. Bassett","The extent and drivers of gender imbalance in neuroscience reference
  lists",,"Nature Neuroscience 23 (2020) 918-926","10.1038/s41593-020-0658-y",,"cs.SI cs.DL","http://arxiv.org/licenses/nonexclusive-distrib/1.0/","  Like many scientific disciplines, neuroscience has increasingly attempted to
confront pervasive gender imbalances within the field. While much of the
conversation has centered around publishing and conference participation,
recent research in other fields has called attention to the prevalence of
gender bias in citation practices. Because of the downstream effects that
citations can have on visibility and career advancement, understanding and
eliminating gender bias in citation practices is vital for addressing inequity
in a scientific community. In this study, we sought to determine whether there
is evidence of gender bias in the citation practices of neuroscientists. Using
data from five top neuroscience journals, we find that reference lists tend to
include more papers with men as first and last author than would be expected if
gender were not a factor in referencing. Importantly, we show that this
overcitation of men and undercitation of women is driven largely by the
citation practices of men, and is increasing over time as the field becomes
more diverse. We develop a co-authorship network to assess homophily in
researchers' social networks, and we find that men tend to overcite men even
when their social networks are representative. We discuss possible mechanisms
and consider how individual researchers might address these findings in their
own practices.
","[{""version"":""v1"",""created"":""Fri, 3 Jan 2020 22:15:46 GMT""},{""version"":""v2"",""created"":""Wed, 8 Apr 2020 20:24:41 GMT""}]","2020-08-28"
"2001.01003","Jeetain Mittal","Runfang Mao and Jeetain Mittal","The interplay between thermodynamics and kinetics in the self-assembly
  of DNA functionalized nanoparticles","19 pages, 5 main figures, 5 supplementary figures",,,,"cond-mat.soft cond-mat.stat-mech","http://arxiv.org/licenses/nonexclusive-distrib/1.0/","  We use a coarse-grained model of DNA-functionalized particles to understand
the role of DNA chain length on their self-assembly. We find that the
increasing chain length for a given particle size decreases the propensity to
form ordered crystalline assemblies, and instead, disordered structures start
to form when the chain length exceeds a certain threshold, which is consistent
with the previous experiments. Further analysis of the simulation data suggests
weakening interparticle interactions with increasing chain length, thereby
shifting the suitable assembly conditions to lower temperatures at which
assembly dynamics are unfavorable. This highlights a complex interplay between
thermodynamics and dynamics, which we suggest can be modulated by changing the
system parameters such as DNA grafting density, resulting in successful
crystallization of particles with longer DNA chain lengths. Our results
highlight the power of computational modeling in elucidating the fundamental
design principles and guiding the assembly of nanoparticles to form complex
nanostructures.
","[{""version"":""v1"",""created"":""Fri, 3 Jan 2020 22:22:11 GMT""}]","2020-01-07"
"2001.01004","Ali Ayub","Ali Ayub and Alan R. Wagner","Teach Me What You Want to Play: Learning Variants of Connect Four
  through Human-Robot Interaction","The final authenticated publication is available online at
  https://doi.org/10.1007/978-3-030-62056-1_42","International Conference on Social Robotics (ICSR), 2020","10.1007/978-3-030-62056-1_42",,"cs.RO cs.AI","http://creativecommons.org/licenses/by/4.0/","  This paper investigates the use of game theoretic representations to
represent and learn how to play interactive games such as Connect Four. We
combine aspects of learning by demonstration, active learning, and game theory
allowing a robot to leverage its developing representation of the game to
conduct question/answer sessions with a person, thus filling in gaps in its
knowledge. The paper demonstrates a method for teaching a robot the win
conditions of the game Connect Four and its variants using a single
demonstration and a few trial examples with a question and answer session led
by the robot. Our results show that the robot can learn arbitrary win
conditions for the game with little prior knowledge of the win conditions and
then play the game with a human utilizing the learned win conditions. Our
experiments also show that some questions are more important for learning the
game's win conditions. We believe that this method could be broadly applied to
a variety of interactive learning scenarios.
","[{""version"":""v1"",""created"":""Fri, 3 Jan 2020 22:28:24 GMT""},{""version"":""v2"",""created"":""Tue, 30 Jun 2020 05:43:32 GMT""},{""version"":""v3"",""created"":""Sun, 23 Aug 2020 02:20:53 GMT""},{""version"":""v4"",""created"":""Wed, 13 Jan 2021 06:51:10 GMT""}]","2021-01-14"
