"2001.01036","Abootaleb Shirvani","A. Alexandre Trindade, Abootaleb Shirvani, and Xiaohan Ma","A Socioeconomic Well-Being Index",,"Applied Economics and Finance, Vol. 7, No. 4; July 2020","10.11114/aef.v7i4.4855",,"econ.GN q-fin.EC","http://arxiv.org/licenses/nonexclusive-distrib/1.0/","  An annual well-being index constructed from thirteen socioeconomic factors is
proposed in order to dynamically measure the mood of the US citizenry.
Econometric models are fitted to the log-returns of the index in order to
quantify its tail risk and perform option pricing and risk budgeting. By
providing a statistically sound assessment of socioeconomic content, the index
is consistent with rational finance theory, enabling the construction and
valuation of insurance-type financial instruments to serve as contracts written
against it. Endogenously, the VXO volatility measure of the stock market
appears to be the greatest contributor to tail risk. Exogenously,
""stress-testing"" the index against the politically important factors of trade
imbalance and legal immigration, quantify the systemic risk. For probability
levels in the range of 5% to 10%, values of trade below these thresholds are
associated with larger downward movements of the index than for immigration at
the same level. The main intent of the index is to provide early-warning for
negative changes in the mood of citizens, thus alerting policy makers and
private agents to potential future market downturns.
","[{""version"":""v1"",""created"":""Sat, 4 Jan 2020 04:50:26 GMT""}]","2020-05-18"
"2001.01037","Jiamei Sun","Jiamei Sun, Sebastian Lapuschkin, Wojciech Samek, Alexander Binder","Explain and Improve: LRP-Inference Fine-Tuning for Image Captioning
  Models",,,,,"cs.CV cs.CL cs.LG","http://arxiv.org/licenses/nonexclusive-distrib/1.0/","  This paper analyzes the predictions of image captioning models with attention
mechanisms beyond visualizing the attention itself. We develop variants of
layer-wise relevance propagation (LRP) and gradient-based explanation methods,
tailored to image captioning models with attention mechanisms. We compare the
interpretability of attention heatmaps systematically against the explanations
provided by explanation methods such as LRP, Grad-CAM, and Guided Grad-CAM. We
show that explanation methods provide simultaneously pixel-wise image
explanations (supporting and opposing pixels of the input image) and linguistic
explanations (supporting and opposing words of the preceding sequence) for each
word in the predicted captions. We demonstrate with extensive experiments that
explanation methods 1) can reveal additional evidence used by the model to make
decisions compared to attention; 2) correlate to object locations with high
precision; 3) are helpful to ""debug"" the model, e.g. by analyzing the reasons
for hallucinated object words. With the observed properties of explanations, we
further design an LRP-inference fine-tuning strategy that reduces the issue of
object hallucination in image captioning models, and meanwhile, maintains the
sentence fluency. We conduct experiments with two widely used attention
mechanisms: the adaptive attention mechanism calculated with the additive
attention and the multi-head attention mechanism calculated with the scaled dot
product.
","[{""version"":""v1"",""created"":""Sat, 4 Jan 2020 05:15:11 GMT""},{""version"":""v2"",""created"":""Wed, 22 Jan 2020 02:09:36 GMT""},{""version"":""v3"",""created"":""Thu, 23 Apr 2020 02:41:41 GMT""},{""version"":""v4"",""created"":""Tue, 17 Nov 2020 01:41:04 GMT""},{""version"":""v5"",""created"":""Sun, 1 Aug 2021 06:27:04 GMT""}]","2021-08-03"
"2001.01038","Bhola Pal","Nitesh K. Chourasia, Anand Sharma, Nila Pal, Sajal Biring and Bhola N.
  Pal","Dielectric/semiconductor interfacial doping to develop solution
  processed high performance 1 V ambipolar oxide-transistor and its application
  as CMOS inverter",,,,,"physics.app-ph cond-mat.mtrl-sci","http://arxiv.org/licenses/nonexclusive-distrib/1.0/","  p-type doping from the dielectric/semiconductor interface of a SnO2 thin film
transistor (TFT) has been utilized to develop high carrier mobility balanced
ambipolar oxide-transistor. To introduce this interfacial-doping, bottom-gate
top-contact TFTs have been fabricated by using two different ion-conducting
oxide dielectrics which contain trivalent atoms. These ion-conducting
dielectrics are LilnO2 and LiGaO2 respectively, containing mobile Li+ ion.
During SnO2 thin film fabrication on top of the ionic dielectric, those
trivalent atoms allow p- doping to the interfacial SnO2 layer to introduce the
hole conduction in channel of TFT. To realize this interfacial doping
phenomena, a reference TFT has been fabricated with Li2ZnO2 dielectric under
the same condition that contains divalent zinc (Zn) atom. Our comparative
electrical data indicates that TFTs with LilnO2 and LiGaO2 dielectric are
ambipolar in nature whereas, TFT with Li2ZnO2 dielectric is a unipolar
n-channel transistor which reveals the interfacial doping of SnO2. Most
interestingly, by using LilnO2 dielectric, we are capable to fabricated 1.0 V
balanced ambipolar TFT with a high electron and hole mobility values of 7 cm2
V-1 s-1and 8 cm2 V-1 s-1 respectively with an on/off ratio >102 for both
operations which has been utilized for low-voltage CMOS inverter fabrication.
","[{""version"":""v1"",""created"":""Sat, 4 Jan 2020 05:22:52 GMT""}]","2020-01-07"
"2001.01039","Hiroshi Frusawa","Hiroshi Frusawa","Transverse density fluctuations around the ground state distribution of
  counterions near one charged plate: stochastic density functional view","Wrong layout different from the final proof has been published in the
  following URL. The replacement is being requested.
  https://www.mdpi.com/1099-4300/22/1/34/htm","Entropy 22 (2020) 34","10.3390/e22010034",,"cond-mat.stat-mech cond-mat.soft nlin.PS physics.chem-ph","http://arxiv.org/licenses/nonexclusive-distrib/1.0/","  We consider the Dean-Kawasaki (DK) equation of overdamped Brownian particles
that forms the basis of the stochastic density functional theory. Recently, the
linearized DK equation has successfully reproduced the full Onsager theory of
symmetric electrolyte conductivity. In this paper, the linear DK equation is
applied to investigate density fluctuations around the ground state
distribution of strongly coupled counterions near a charged plate, focusing
especially on the transverse dynamics along the plate surface. Consequently, we
find a crossover scale above which the transverse density dynamics appears
frozen and below which diffusive behavior of counterions can be observed on the
charged plate. The linear DK equation provides a characteristic length of the
dynamical crossover that is similar to the Wigner-Seitz radius used in
equilibrium theory for the 2D one-component plasma, which is our main result.
Incidentally, general representations of longitudinal dynamics vertical to the
plate further suggest the existence of advective and electrically reverse
flows; these effects remain to be quantitatively investigated.
","[{""version"":""v1"",""created"":""Sat, 4 Jan 2020 05:40:17 GMT""}]","2020-01-07"
"2001.01040","Sourish Das","Bharathi Manjula .K and Sourish Das and Jehadeesan .R","Causal Impact of Web Browsing and Other Factors on Research Publications",,,,,"stat.AP cs.DL","http://arxiv.org/licenses/nonexclusive-distrib/1.0/","  In this paper, we study the causal impact of the web-search activity on the
research publication. We considered observational prospective study design,
where research activity of 267 scientists is being studied. We considered the
Poisson and negative binomial regression model for our analysis. Based on the
Akaike's Model selection criterion, we found the negative binomial regression
performs better than the Poisson regression. Detailed analysis indicates that
the higher web-search activity of 2016 related to the sci-indexed website has a
positive significant impact on the research publication of 2017. We observed
that unique collaborations of 2016 and web-search activity of 2016 have a
non-linear but significant positive impact on the research publication of 2017.
What-if analysis indicates the high web browsing activity leads to more number
of the publication. However, interestingly we see a scientist with low web
activity can be as productive as others if her/his maximum hits are the
sci-indexed journal. That is if the scientist uses web browsing only for
research-related activity, then she/he can be equally productive even if
her/his web activity is lower than fellow scientists.
","[{""version"":""v1"",""created"":""Sat, 4 Jan 2020 05:43:44 GMT""}]","2020-01-07"
"2001.01041","Jiawang Hong","Lei Guo, Gao Xu, Gang Tang, Daining Fang and Jiawang Hong","Structural Stability and Optoelectronic Properties of Tetragonal MAPbI3
  under Strain",,"Nanotechnology 31, 225204 (2020)","10.1088/1361-6528/ab7679",,"cond-mat.mtrl-sci","http://arxiv.org/licenses/nonexclusive-distrib/1.0/","  In recent years, organic-inorganic hybrid perovskites have attracted wide
attention due to their excellent optoelectronic properties in the application
of optoelectronic devices. In the manufacturing process of perovskite solar
cells, perovskite films inevitably have residual stress caused by
non-stoichiometry components and the external load. However, their effects on
the structural stability and photovoltaic performance of perovskite solar cells
are still not clear. In this work, we investigated the effects of external
strain on the structural stability and optoelectronic properties of tetragonal
MAPbI3 by using the first-principles calculations. We found that the migration
barrier of I- ion increases in the presence of compressive strain and decreases
with tensile strain, indicating that the compressive strain can enhance the
structural stability of halide perovskites. In addition, the light absorption
and electronic properties of MAPbI3 under compressive strain are also improved.
The variations of the band gap under triaxial and biaxial strains are
consistent within a certain range of strain, resulting from the fact that the
band edge positions are mainly influenced by the Pb-I bond in the equatorial
plane. Our results provide useful guidance for realizing the commercial
applications of MAPbI3-based perovskite solar cells.
","[{""version"":""v1"",""created"":""Sat, 4 Jan 2020 05:50:55 GMT""}]","2020-04-01"
"2001.01042","Kenji Tanabe","Shun Fukuda, Hiroyuki Awano and Kenji Tanabe","Observation of spin-motive force in ferrimagnetic GdFeCo alloy films",,"Applied Physics Letters 116, 102402 (2020)","10.1063/5.0002802",,"cond-mat.mtrl-sci cond-mat.mes-hall","http://arxiv.org/licenses/nonexclusive-distrib/1.0/","  Non-uniform magnetic structures produce emergent electromagnetic phenomena
such as the topological Hall effect and the spin-motive force (SMF). The
experimental reports on the SMF, however, are very few and the relationship
between the SMF and material parameters is still unclear. In this study, we
investigated the SMF in ferrimagnetic GdFeCo alloy films using the
spin-torque-induced ferromagnetic resonance method and clarified the
relationship. The amplitude of the detected SMF becomes larger than that of the
transition metal alloy FeCo by the Gd doping and reaches the maximum near a Gd
composition of the boundary between in-plane and perpendicularly magnetized
films. According to the analytical calculation, the enhancement is related to
the trajectory of the magnetization precession. Moreover, we find that the SMF
induced by the magnetic resonance is inversely proportional to the square of
the damping constant.
","[{""version"":""v1"",""created"":""Sat, 4 Jan 2020 05:55:06 GMT""},{""version"":""v2"",""created"":""Thu, 12 Mar 2020 02:30:24 GMT""}]","2020-03-13"
"2001.01043","Shibo Wang","Shibo Wang, Shusen Yang, Cong Zhao","SurveilEdge: Real-time Video Query based on Collaborative Cloud-Edge
  Deep Learning","To appear at IEEE INFOCOM 2020",,,,"cs.DC","http://arxiv.org/licenses/nonexclusive-distrib/1.0/","  The real-time query of massive surveillance video data plays a fundamental
role in various smart urban applications such as public safety and intelligent
transportation. Traditional cloud-based approaches are not applicable because
of high transmission latency and prohibitive bandwidth cost, while edge devices
are often incapable of executing complex vision algorithms with low latency and
high accuracy due to restricted resources. Given the infeasibility of both
cloud-only and edge-only solutions, we present SurveilEdge, a collaborative
cloud-edge system for real-time queries of large-scale surveillance video
streams. Specifically, we design a convolutional neural network (CNN) training
scheme to reduce the training time with high accuracy, and an intelligent task
allocator to balance the load among different computing nodes and to achieve
the latency-accuracy tradeoff for real-time queries. We implement SurveilEdge
on a prototype with multiple edge devices and a public Cloud, and conduct
extensive experiments using realworld surveillance video datasets. Evaluation
results demonstrate that SurveilEdge manages to achieve up to 7x less bandwidth
cost and 5.4x faster query response time than the cloud-only solution; and can
improve query accuracy by up to 43.9% and achieve 15.8x speedup respectively,
in comparison with edge-only approaches.
","[{""version"":""v1"",""created"":""Sat, 4 Jan 2020 06:05:23 GMT""},{""version"":""v2"",""created"":""Mon, 6 Apr 2020 03:26:24 GMT""}]","2020-04-07"
"2001.01044","Hiroshi Frusawa","Hiroshi Frusawa","Coarse-Grained Counterions in the Strong Coupling Limit",,"J. Phys. Soc. Jpn. 73 (2004) 507","10.1143/JPSJ.73.507",,"cond-mat.soft cond-mat.stat-mech physics.chem-ph physics.plasm-ph","http://arxiv.org/licenses/nonexclusive-distrib/1.0/","  Recent Monte Carlo simulations (A. G. Moreira and R. R. Netz: Eur. Phys. J. E
{\bf 8} (2002) 33) in the strong Coulomb coupling regime suggest strange
counterion electrostatics unlike the Poisson-Boltzmann picture: when
counterion-counterion repulsive interactions are much larger than
counterion--macroion attraction, the coarse-grained counterion distribution
around a macroion is determined only by the latter, and the former is
irrelevant. Here, we offer an explanation for the apparently paradoxical
electrostatics by mathematically manipulating the strong coupling limit.
","[{""version"":""v1"",""created"":""Sat, 4 Jan 2020 06:05:48 GMT""}]","2020-01-07"
"2001.01045","Haifeng Feng","Haifeng Feng, Chen Liu, Si Zhou, Nan Gao, Qian Gao, Jincheng Zhuang,
  Xun Xu, Zhenpeng Hu, Jiaou Wang, Lan Chen, Jijun Zhao, Yi Du","Experimental Realization of Two-Dimensional Buckled Lieb lattice","14 pages, 4 figures",,"10.1021/acs.nanolett.9b05316",,"cond-mat.mtrl-sci quant-ph","http://arxiv.org/licenses/nonexclusive-distrib/1.0/","  Two-dimensional (2D) materials with a Lieb lattice can host exotic electronic
band structures. Such a system does not exist in nature, and it is also
difficult to obtain in the laboratory due to its structural instability. Here,
we experimentally realized a 2D system composed of a tin overlayer on an
aluminum substrate by molecular beam epitaxy. The specific arrangement of Sn
atoms on the Al(100) surface, which benefits from favorable interface
interactions, forms a stabilized buckled Lieb lattice. Our theoretical
calculations indicate a partially broken nodal line loop protected by its
mirror reflection symmetry and a topologically nontrivial insulating state with
a spin-orbital coupling (SOC) effect in the band structure of this Lieb
lattice. The electronic structure of this system has also been experimentally
characterized by scanning tunnelling spectroscopy and angle-resolved
photoemmision spectroscopy. Our work provides an appealing method for
constructing 2D quantum materials based on the Lieb lattice.
","[{""version"":""v1"",""created"":""Sat, 4 Jan 2020 06:06:37 GMT""}]","2020-04-22"
"2001.01046","Minghao Chen","Minghao Chen, Shuai Zhao, Haifeng Liu, Deng Cai","Adversarial-Learned Loss for Domain Adaptation","Published in 34th AAAI Conference on Artificial Intelligence, 2020",,,,"cs.CV cs.LG","http://creativecommons.org/licenses/by/4.0/","  Recently, remarkable progress has been made in learning transferable
representation across domains. Previous works in domain adaptation are majorly
based on two techniques: domain-adversarial learning and self-training.
However, domain-adversarial learning only aligns feature distributions between
domains but does not consider whether the target features are discriminative.
On the other hand, self-training utilizes the model predictions to enhance the
discrimination of target features, but it is unable to explicitly align domain
distributions. In order to combine the strengths of these two methods, we
propose a novel method called Adversarial-Learned Loss for Domain Adaptation
(ALDA). We first analyze the pseudo-label method, a typical self-training
method. Nevertheless, there is a gap between pseudo-labels and the ground
truth, which can cause incorrect training. Thus we introduce the confusion
matrix, which is learned through an adversarial manner in ALDA, to reduce the
gap and align the feature distributions. Finally, a new loss function is
auto-constructed from the learned confusion matrix, which serves as the loss
for unlabeled target samples. Our ALDA outperforms state-of-the-art approaches
in four standard domain adaptation datasets. Our code is available at
https://github.com/ZJULearning/ALDA.
","[{""version"":""v1"",""created"":""Sat, 4 Jan 2020 06:24:44 GMT""}]","2020-01-07"
"2001.01047","Muhammad Haroon Shakeel","Muhammad Haroon Shakeel, Asim Karim","Adapting Deep Learning for Sentiment Classification of Code-Switched
  Informal Short Text",,"The 35th ACM/SIGAPP Symposium on Applied Computing (SAC) 2020","10.1145/3341105.3374091",,"cs.CL","http://arxiv.org/licenses/nonexclusive-distrib/1.0/","  Nowadays, an abundance of short text is being generated that uses nonstandard
writing styles influenced by regional languages. Such informal and
code-switched content are under-resourced in terms of labeled datasets and
language models even for popular tasks like sentiment classification. In this
work, we (1) present a labeled dataset called MultiSenti for sentiment
classification of code-switched informal short text, (2) explore the
feasibility of adapting resources from a resource-rich language for an informal
one, and (3) propose a deep learning-based model for sentiment classification
of code-switched informal short text. We aim to achieve this without any
lexical normalization, language translation, or code-switching indication. The
performance of the proposed models is compared with three existing multilingual
sentiment classification models. The results show that the proposed model
performs better in general and adapting character-based embeddings yield
equivalent performance while being computationally more efficient than training
word-based domain-specific embeddings.
","[{""version"":""v1"",""created"":""Sat, 4 Jan 2020 06:31:15 GMT""}]","2020-04-07"
"2001.01048","Dan Silva","I. Moreno-Mej\'ia and D. Silva-L\'opez","The Verlinde traces for $\mathcal{SU}_{X}(2,\xi)$ and blow-ups","48 pages",,,,"math.AG","http://arxiv.org/licenses/nonexclusive-distrib/1.0/","  Given a compact Riemann surface $X$ of genus at least $2$ with automorphism
group $G$ we provide formulae that enable us to compute traces of automorphisms
of X on the space of global sections of $G$-linearized line bundles defined on
certain blow-ups of proyective spaces along the curve $X$. The method is an
adaptation of one used by Thaddeus to compute the dimensions of those spaces.
In particular we can compute the traces of automorphisms of $X$ on the Verlinde
spaces corresponding to the moduli space $SU_{X}(2,\xi)$ when $\xi$ is a line
bundle $G$-linearized of suitable degree.
","[{""version"":""v1"",""created"":""Sat, 4 Jan 2020 06:44:57 GMT""},{""version"":""v2"",""created"":""Wed, 11 Jan 2023 18:50:08 GMT""}]","2023-01-12"
"2001.01049","Ziling Heng","Ziling Heng, Cunsheng Ding, Weiqiong Wang","Optimal Binary Linear Codes from Maximal Arcs",,,,,"cs.IT math.IT","http://arxiv.org/licenses/nonexclusive-distrib/1.0/","  The binary Hamming codes with parameters $[2^m-1, 2^m-1-m, 3]$ are perfect.
Their extended codes have parameters $[2^m, 2^m-1-m, 4]$ and are
distance-optimal. The first objective of this paper is to construct a class of
binary linear codes with parameters $[2^{m+s}+2^s-2^m,2^{m+s}+2^s-2^m-2m-2,4]$,
which have better information rates than the class of extended binary Hamming
codes, and are also distance-optimal. The second objective is to construct a
class of distance-optimal binary codes with parameters $[2^m+2, 2^m-2m, 6]$.
Both classes of binary linear codes have new parameters.
","[{""version"":""v1"",""created"":""Sat, 4 Jan 2020 07:02:18 GMT""}]","2020-01-07"
"2001.01050","Mingkui Tan","Jing Liu, Bohan Zhuang, Zhuangwei Zhuang, Yong Guo, Junzhou Huang,
  Jinhui Zhu, Mingkui Tan","Discrimination-aware Network Pruning for Deep Model Compression","14 pages. Extended version of the NeurIPS paper arXiv:1810.11809",,"10.1109/TPAMI.2021.3066410",,"cs.CV","http://arxiv.org/licenses/nonexclusive-distrib/1.0/","  We study network pruning which aims to remove redundant channels/kernels and
hence speed up the inference of deep networks. Existing pruning methods either
train from scratch with sparsity constraints or minimize the reconstruction
error between the feature maps of the pre-trained models and the compressed
ones. Both strategies suffer from some limitations: the former kind is
computationally expensive and difficult to converge, while the latter kind
optimizes the reconstruction error but ignores the discriminative power of
channels. In this paper, we propose a simple-yet-effective method called
discrimination-aware channel pruning (DCP) to choose the channels that actually
contribute to the discriminative power. Note that a channel often consists of a
set of kernels. Besides the redundancy in channels, some kernels in a channel
may also be redundant and fail to contribute to the discriminative power of the
network, resulting in kernel level redundancy. To solve this, we propose a
discrimination-aware kernel pruning (DKP) method to further compress deep
networks by removing redundant kernels. To prevent DCP/DKP from selecting
redundant channels/kernels, we propose a new adaptive stopping condition, which
helps to automatically determine the number of selected channels/kernels and
often results in more compact models with better performance. Extensive
experiments on both image classification and face recognition demonstrate the
effectiveness of our methods. For example, on ILSVRC-12, the resultant
ResNet-50 model with 30% reduction of channels even outperforms the baseline
model by 0.36% in terms of Top-1 accuracy. The pruned MobileNetV1 and
MobileNetV2 achieve 1.93x and 1.42x inference acceleration on a mobile device,
respectively, with negligible performance degradation. The source code and the
pre-trained models are available at https://github.com/SCUT-AILab/DCP.
","[{""version"":""v1"",""created"":""Sat, 4 Jan 2020 07:07:41 GMT""},{""version"":""v2"",""created"":""Mon, 29 Mar 2021 15:52:18 GMT""}]","2021-03-30"
"2001.01051","Yuya Ong","Yuya Jeremy Ong, Mu Qiao and Divyesh Jadav","Temporal Tensor Transformation Network for Multivariate Time Series
  Prediction",,,,,"cs.LG stat.ML","http://arxiv.org/licenses/nonexclusive-distrib/1.0/","  Multivariate time series prediction has applications in a wide variety of
domains and is considered to be a very challenging task, especially when the
variables have correlations and exhibit complex temporal patterns, such as
seasonality and trend. Many existing methods suffer from strong statistical
assumptions, numerical issues with high dimensionality, manual feature
engineering efforts, and scalability. In this work, we present a novel deep
learning architecture, known as Temporal Tensor Transformation Network, which
transforms the original multivariate time series into a higher order of tensor
through the proposed Temporal-Slicing Stack Transformation. This yields a new
representation of the original multivariate time series, which enables the
convolution kernel to extract complex and non-linear features as well as
variable interactional signals from a relatively large temporal region.
Experimental results show that Temporal Tensor Transformation Network
outperforms several state-of-the-art methods on window-based predictions across
various tasks. The proposed architecture also demonstrates robust prediction
performance through an extensive sensitivity analysis.
","[{""version"":""v1"",""created"":""Sat, 4 Jan 2020 07:28:55 GMT""}]","2020-01-07"
