"2001.00928","Sarah Lambart","Ananya Mallik, Sarah Lambart, Emily J. Chin","Tracking the evolution of magmas from heterogeneous mantle sources to
  eruption","42 pages, 9 figures, Accepted chapter to appear in ""Mantle Convection
  and Surface Expressions"", H. Marquardt, M. Ballmer, S. Cottar, K. Jasper
  (eds.), AGU Monograph Series",,,,"physics.geo-ph physics.chem-ph","http://arxiv.org/licenses/nonexclusive-distrib/1.0/","  This contribution reviews the effects of source heterogeneities, melt-rock
reactions and intracrustal differentiation on magma chemistry across mid-ocean
ridges, intraplate settings and subduction zones using experimental studies and
natural data. We compare melting behaviors of pyroxenites and peridotites and
their relative contributions to magmas as functions of composition, mantle
potential temperatures and lithospheric thickness. We also discuss the fate of
chemically distinct melts derived from heterogeneities as they travel through a
peridotitic mantle. Using nearly 60,000 natural major element compositions of
volcanic rocks, melt inclusions, and crystalline cumulates, we assess broad
petrogenetic trends in as large of a global dataset as possible. Consistent
with previous studies, major element chemistry of mid-ocean ridge basalts
(MORBs) and their cumulates favor a first-order control of intracrustal
crystal-liquid segregation, while trace element studies emphasize the role of
melt-rock reactions, highlighting the decoupling between the two. Ocean island
basalts (OIB) show a larger compositional variability than MORB, partly
attributed to large variations of pyroxenite proportions in the mantle source.
However, the estimated proportions vary considerably with heterogeneity
composition, melting model and thermal structure of the mantle. For arcs, we
highlight current views on the role of the downgoing slab into the source of
primary arc magmas, and the role of the overriding lithosphere as a magmatic
chemical filter and as the repository of voluminous arc cumulates. Our approach
of simultaneously looking at a large database of volcanic + deep crustal rocks
across diverse tectonic settings underscores the challenge of deciphering the
source signal versus intracrustal/lithospheric processes.
","[{""version"":""v1"",""created"":""Fri, 3 Jan 2020 18:45:00 GMT""}]","2020-01-06"
"2001.00929","Marta Reboiro PhD","Romina Ramirez, Marta Reboiro and Diego Tielas","Excepional Points from Hamiltonians of hybrid physical systems:
  Squeezing and anti-Squeezing",,,"10.1140/epjd/e2020-10218-1",,"quant-ph","http://arxiv.org/licenses/nonexclusive-distrib/1.0/","  We study the appearance of Exceptional Points in a hybrid system composed of
a superconducting flux-qubit and an ensemble of nitrogen-vacancy colour centres
in diamond. We discuss the possibility of controlling the generation of
Exceptional Points, by the analysis of the model space parameters. One of the
characteristic features of the presence of Exceptional Points, it is the
departure from the exponential decay behaviour of the observables as a function
of time. We study the time evolution of different initial states, in the
presence of the hybrid system, by computing the reduced density matrix of each
subsystem. We present the results we have obtained for the steady behaviour of
different observables. We analyse the appearance of Squeezed Spin States and of
anti-Squeezed Spin States.
","[{""version"":""v1"",""created"":""Fri, 3 Jan 2020 18:50:11 GMT""}]","2020-10-28"
"2001.00930","Alexander Plavin","A.V. Plavin (ASC Lebedev, MIPT), Y.Y. Kovalev (ASC Lebedev, MIPT,
  MPIfR), Y.A. Kovalev (ASC Lebedev), S.V. Troitsky (INR)","Observational evidence for the origin of high-energy neutrinos in
  parsec-scale nuclei of radio-bright active galaxies","19 pages, 5 figures, 3 tables; accepted to ApJ; v2: extended
  discussion, added a figure and electronic table; v3: fixed typo in a source
  name","ApJ 894 (2020) 101","10.3847/1538-4357/ab86bd","INR-TH-2020-002","astro-ph.HE astro-ph.GA","http://arxiv.org/licenses/nonexclusive-distrib/1.0/","  Observational information on high-energy astrophysical neutrinos is being
continuously collected by the IceCube observatory. However, the sources of
neutrinos are still unknown. In this study, we use radio very-long-baseline
interferometry (VLBI) data for a complete VLBI-flux-density limited sample of
active galactic nuclei (AGN). We address the problem of the origin of
astrophysical neutrinos with energies above 200 TeV in a statistical manner. It
is found that AGN positionally associated with IceCube events have typically
stronger parsec-scale cores than the rest of the sample. The post-trial
probability of a chance coincidence is 0.2%. We select the four strongest AGN
as highly probable associations: 3C 279, NRAO 530, PKS 1741-038, and PKS
2145+067. Moreover, we find an increase of radio emission at frequencies above
10 GHz around neutrino arrival times for several other VLBI-selected AGN on the
basis of RATAN-600 monitoring. The most pronounced example of such behavior is
PKS 1502+106. We conclude that AGN with bright Doppler-boosted jets constitute
an important population of neutrino sources. High-energy neutrinos are produced
in their central parsec-scale regions, probably in proton-photon interactions
at or around the accretion disk. Radio-bright AGN that are likely associated
with neutrinos have very diverse gamma-ray properties suggesting that
gamma-rays and neutrinos may be produced in different regions of AGN and not
directly related. A small viewing angle of the jet-disk axis is, however,
required to detect either of them.
","[{""version"":""v1"",""created"":""Fri, 3 Jan 2020 18:56:24 GMT""},{""version"":""v2"",""created"":""Mon, 6 Apr 2020 15:43:20 GMT""},{""version"":""v3"",""created"":""Wed, 9 Sep 2020 13:26:25 GMT""}]","2020-09-10"
"2001.00931","Amanda Quirk","Amanda C. N. Quirk and Ekta Patel","Asymmetric Drift of Andromeda Analogs in the IllustrisTNG Simulation","14 pages, 11 figures, accepted to MNRAS for publication July 20, 2020",,"10.1093/mnras/staa2152",,"astro-ph.GA","http://arxiv.org/licenses/nonexclusive-distrib/1.0/","  We analyze the kinematics as a function of stellar age for Andromeda (M31)
mass analogs from the IllustrisTNG cosmological simulation. We divide the star
particles into four age groups: less than 1 Gyr, 1 to 5 Gyr, 5 to 10 Gyr, and
greater 10 Gyr, and compare the kinematics of these groups to that of the
neutral gas cells. We calculate rotation curves for the stellar and gaseous
components of each analog from 2 kpc to 20 kpc from the center of mass. We find
that the lag, or asymmetric drift (AD), between the gas rotation curve and the
stellar rotation curve on average increases with stellar age. This finding is
consistent with observational measurements of AD in the disk of the Andromeda
galaxy. When the M31 analogs are separated into groups based on merger history,
we find that there is a difference in the AD of the analogs that have had a 4:1
merger the last 4 Gyr, 8 Gyr, or 12 Gyr compared to analogs that have not
experienced a 4:1 merger in the same time frame. The subset of analogs that
have had a 4:1 merger within the last 4 Gyr are also similar to AD measurements
of stars in the disk of M31, providing evidence that M31 may in fact have
recently merged with a galaxy nearly one fourth of its mass. Further work using
high resolution zoom in simulations is required to explore the contribution of
internal heating to AD.
","[{""version"":""v1"",""created"":""Fri, 3 Jan 2020 18:57:10 GMT""},{""version"":""v2"",""created"":""Mon, 20 Jul 2020 22:45:30 GMT""}]","2020-08-19"
"2001.00932","Jakub Ripa","Levente Borv\'ak, Attila M\'esz\'aros, Jakub \v{R}\'ipa","The analogy of K-correction in the topic of gamma-ray bursts","3 pages, 2 figures, published in Proceedings of the International
  Astronomical Union","Proceedings of the International Astronomical Union, Symposium
  S346 (2019) 380-382","10.1017/S1743921318008025",,"astro-ph.HE","http://arxiv.org/licenses/nonexclusive-distrib/1.0/","  It is well-known that there are two types of gamma-ray bursts (GRBs):
short/hard and long/soft ones, respectively. The long GRBs are coupled to
supernovae, but the short ones are associated with the so called macronovae
(also known as kilonovae), which can serve as the sources of gravitational
waves as well. The kilonovae can arise from the merging of two neutron-stars.
The neutron stars can be substituded by more massive black holes as well.
Hence, the topic of gamma-ray bursts (mainly the topic of short ones) and the
topic of massive binaries, are strongly connected.
  In this contribution, the redshifts of GRBs are studied. The surprising
result - namely that the apparently fainter GRBs can be in average at smaller
distances - is discussed again. In essence, the results of M\'esz\'aros et al.
(2011) are studied again using newer samples of GRBs. The former result is
confirmed by the newer data.
","[{""version"":""v1"",""created"":""Fri, 3 Jan 2020 18:58:02 GMT""}]","2020-01-06"
"2001.00933","Jakub Ripa","Attila M\'esz\'aros, Jakub \v{R}\'ipa","Gamma-ray bursts: A brief survey of the diversity","5 pages, 2 figures, published in Proceedings of the International
  Astronomical Union","Proceedings of the International Astronomical Union, Symposium
  S346 (2019) 383-387","10.1017/S1743921319000036",,"astro-ph.HE","http://arxiv.org/licenses/nonexclusive-distrib/1.0/","  The separation of the gamma-ray bursts (GRBs) into short/hard and long/soft
subclasses, respectively, is well supported both theoretically and
observationally. The long ones are coupled to supernovae type Ib/Ic - the short
ones are connected to the merging of two neutron stars, where one or even both
neutron stars can be substituted by black holes. These short GRBs - as merging
binaries - can also serve as the sources of gravitation waves, and are
observable as the recently detected macronovae. Since 1998 there are several
statistical studies suggesting the existence of more than two subgroups. There
can be a subgroup having an intermediate durations; there can be a subgroup
with ultra-long durations; the long/soft subgroup itself can be divided into
two subclasses with respect to the luminosity of GRBs. The authors with other
collaborators provided several statistical studies in this topic. This field of
the GRB-diversity is briefly surveyed in this contribution.
","[{""version"":""v1"",""created"":""Fri, 3 Jan 2020 18:59:02 GMT""}]","2020-01-06"
"2001.00945","Bin Chen","R. Kantowski, B. Chen, and X. Dai","Equivalence of the Fermat potential and the lensing potential approaches
  to computing the integrated Sachs-Wolfe effect","14 pages. arXiv admin note: text overlap with arXiv:1410.4608",,,,"astro-ph.CO","http://arxiv.org/licenses/nonexclusive-distrib/1.0/","  We show in detail that the recently derived expression for evaluating the
integrated Sachs-Wolfe (ISW) temperature shift in the cosmic microwave
background (CMB) caused by individual embedded (compensated) lenses is
equivalent to the conventional approach for flat background cosmologies. The
conventional approach requires evaluating an integral of the time derivative of
the lensing potential, whereas the new Fermat potential approach is simpler and
only requires taking a derivative of the potential part of the time delay.
","[{""version"":""v1"",""created"":""Fri, 3 Jan 2020 16:01:10 GMT""}]","2020-01-07"
"2001.00946","Quan-Lin Li","Heng-Li Liu, Quan-Lin Li, Yan-Xia Chang, Chi Zhang","Double-End Queues with Non-Poisson Inputs and Their Effective Algorithms","50 pages, 10 figures. arXiv admin note: text overlap with
  arXiv:2009.02742",,,,"math.PR cs.PF","http://creativecommons.org/licenses/by/4.0/","  It is interesting and challenging to study double-ended queues with
First-Come-First-Match discipline under customers' impatient behavior and
non-Poisson inputs. The system stability can be guaranteed by the customers'
impatient behavior, while the existence of impatient customers makes analysis
of such double-ended queues more difficult or even impossible to find an
explicitly analytic solution, thus it becomes more and more important to
develop effective numerical methods in a variety of practical matching
problems. This paper studies a block-structured double-ended queue, whose block
structure comes from two independent Markovian arrival processes (MAPs), which
are non-Poisson inputs. We show that such a queue can be expressed as a new
bilateral quasi birth-and-death (QBD) process which has its own interest. Based
on this, we provide a detailed analysis for both the bilateral QBD process and
the double-ended queue, including the system stability, the queue size
distributions, the average stationary queue lengths, and the sojourn time of
any arriving customers. Furthermore, we develop three effective algorithms for
computing the performance measures (i.e., the probabilities of stationary queue
lengths, the average stationary queue lengths, and the average sojourn times)
of the double-ended queue with non-Poisson inputs. Finally, we use some
numerical examples in tabular and graphical to illustrate how the performance
measures are influenced by some key system parameters. We believe that the
methodology and results described in this paper can be applicable to deal with
more general double-ended queues in practice, and develop some effective
algorithms for the purpose of many actual uses.
","[{""version"":""v1"",""created"":""Sat, 4 Jan 2020 01:55:44 GMT""},{""version"":""v2"",""created"":""Sun, 19 Jan 2020 12:48:32 GMT""},{""version"":""v3"",""created"":""Sun, 1 Nov 2020 00:15:11 GMT""},{""version"":""v4"",""created"":""Mon, 30 Aug 2021 13:18:15 GMT""},{""version"":""v5"",""created"":""Thu, 28 Apr 2022 14:34:06 GMT""}]","2022-04-29"
"2001.00947","Steven Spurgeon","Steven R. Spurgeon","Scanning Transmission Electron Microscopy of Oxide Interfaces and
  Heterostructures","63 pages, 21 figures",,,,"cond-mat.mtrl-sci physics.ins-det","http://arxiv.org/licenses/nonexclusive-distrib/1.0/","  Thin film oxides are a source of endless fascination for the materials
scientist. These materials are highly flexible, can be integrated into almost
limitless combinations, and exhibit many useful functionalities for device
applications. While precision synthesis techniques, such as molecular beam
epitaxy (MBE) and pulsed laser deposition (PLD), provide a high degree of
control over these systems, there remains a disconnect between ideal and
realized materials. Because thin films adopt structures and chemistries
distinct from their bulk counterparts, it is often difficult to predict what
properties will emerge. The complex energy landscape of the synthesis process
is also strongly influenced by non-equilibrium growth conditions imposed by the
substrate, as well as the kinetics of thin film crystallization and
fluctuations in process variables, all of which can lead to significant
deviations from targeted outcomes. High-resolution structural and chemical
characterization techniques, as described in this volume, are needed to verify
growth models, bound theoretical calculations, and guide materials design.
While many characterization options exist, most are spatially-averaged or
indirect, providing only partial insight into the complex behavior of these
systems. Over the past several decades, scanning transmission electron
microscopy (STEM) has become a cornerstone of oxide heterostructure
characterization owing to its ability to simultaneously resolve structure,
chemistry, and defects at the highest spatial resolution. STEM methods are an
essential complement to averaged scattering techniques, offering a direct
picture of resulting materials that can inform and refine the growth process to
achieve targeted properties. There is arguably no other technique that can
provide such a broad array of information at the atomic-scale, all within a
single experimental session.
","[{""version"":""v1"",""created"":""Fri, 3 Jan 2020 17:20:42 GMT""},{""version"":""v2"",""created"":""Fri, 10 Jan 2020 21:48:05 GMT""}]","2020-01-14"
"2001.00948","Yue Zhang","Yue Zhang","Speeding Up Dark Matter With Solar Neutrinos","10 pages, 3 figures. Final version to appear in PTEP","PTEP 2022 (2022) 01, 013B05","10.1093/ptep/ptab156",,"hep-ph astro-ph.SR hep-ex","http://creativecommons.org/licenses/by/4.0/","  We present a novel mechanism of using solar neutrinos to speed up dark
matter, inspired by the fact that neutrinos are the most energetic particles
from the Sun with a well-understood spectrum. In a neutrino portal dark sector
model, we show that dark matter with sub-GeV mass could be accelerated by the
$pp$ neutrinos to velocities well above $10^{-3}c$ and capable of depositing
large enough energy at direct detection experiments. A crucial ingredient of
this mechanism is the dissociation of stable dark matter bound states that
exist in Nature. The resulting dark matter velocity distribution bears a strong
resemblance in shape to the solar neutrino spectrum. As an application, we
derive a leading limit on light dark matter interaction by reinterpreting a
recent PICO experiment result.
","[{""version"":""v1"",""created"":""Fri, 3 Jan 2020 19:00:02 GMT""},{""version"":""v2"",""created"":""Wed, 24 Nov 2021 15:43:35 GMT""}]","2022-01-25"
"2001.00949","Dimitri Veras","Dimitri Veras, Daniel J. Scheeres","Post-main-sequence debris from rotation-induced YORP break-up of small
  bodies II: multiple fissions, internal strengths and binary production","Accepted for publication in MNRAS",,"10.1093/mnras/stz3565",,"astro-ph.EP astro-ph.SR","http://arxiv.org/licenses/nonexclusive-distrib/1.0/","  Over one quarter of white dwarfs contain observable metallic debris from the
breakup of exo-asteroids. Understanding the physical and orbital history of
this debris would enable us to self-consistently link planetary system
formation and fate. One major debris reservoir is generated by YORP-induced
rotational fission during the giant branch phases of stellar evolution, where
the stellar luminosity can exceed the Sun's by four orders of magnitude. Here,
we determine the efficacy of the giant branch YORP effect for asteroids with
nonzero internal strength, and model post-fission evolution by imposing simple
analytic fragmentation prescriptions. We find that even the highest realistic
internal strengths cannot prevent the widespread fragmentation of asteroids and
the production of a debris field over 100 au in size. We compute the number of
successive fission events as they occur in progressively smaller time intervals
as the star ascends the giant branches, providing a way to generate size
distributions of asteroid fragments. The results are highly insensitive to
progenitor stellar mass. We also conclude that the ease with which giant branch
YORP breakup can generate binary asteroid subsystems is strongly dependent on
internal strength. Formed binary subsystems in turn could be short-lived due to
the resulting luminosity-enhanced BYORP effect.
","[{""version"":""v1"",""created"":""Fri, 3 Jan 2020 19:00:03 GMT""}]","2020-01-22"
"2001.00950","Paz Beniamini Dr.","Paz Beniamini, Rodolfo Barniol Duran, Maria Petropoulou, Dimitrios
  Giannios","Ready, set, launch: time interval between BNS merger and short GRB jet
  formation","15 pages, 8 figures. Accepted for publication in ApJ Letters",,"10.3847/2041-8213/ab9223",,"astro-ph.HE","http://arxiv.org/licenses/nonexclusive-distrib/1.0/","  The joint detection of GW~170817/GRB 170817 confirmed the long-standing
theory that binary neutron star mergers produce short gamma-ray burst (sGRB)
jets that can successfully break out of the surrounding ejecta. At the same
time, the association with a kilonova provided unprecedented information
regarding the physical properties (such as masses and velocities) of the
different ejecta constituents. Combining this knowledge with the observed
luminosities and durations of cosmological sGRBs detected by the Burst Alert
Telescope (BAT) onboard the Neil Gehrels Swift Observatory, we revisit the
breakout conditions of sGRB jets. Assuming self-collimation of sGRB jets does
not play a critical role, we find that the time interval between the binary
merger and the launching of a typical sGRB jet is $\lesssim0.1$~s. We also show
that for a fraction of at least $\sim 30\%$ of sGRBs, the usually adopted
assumption of static ejecta is inconsistent with observations, even if the
polar ejecta mass is an order of magnitude smaller than the one in GRB 170817.
Our results disfavour magnetar central engines for powering cosmological sGRBs,
limit the amount of energy deposited in the cocoon prior to breakout, and
suggest that the observed delay of $\sim 1.$7~s in GW 170817 /GRB 170817
between the gravitational wave and $\gamma$-ray signals is likely dominated by
the propagation time of the jet to the $\gamma$-ray production site.
","[{""version"":""v1"",""created"":""Fri, 3 Jan 2020 19:00:04 GMT""},{""version"":""v2"",""created"":""Tue, 19 May 2020 00:04:55 GMT""}]","2020-06-10"
"2001.00951","Alexandre Emsenhuber","Alexandre Emsenhuber, Saverio Cambioni, Erik Asphaug, Travis S. J.
  Gabriel, Stephen R. Schwartz, Roberto Furfaro","Realistic On-the-fly Outcomes of Planetary Collisions II: Bringing
  Machine Learning to N-body Simulations","20 pages, 10 figures, 3 tables; accepted for publication in ApJ;
  Table 1 is available in full in an ancillary file; the code developed in this
  work is available at https://github.com/aemsenhuber/collresolve","ApJ 891:6 (2020)","10.3847/1538-4357/ab6de5",,"astro-ph.EP astro-ph.IM","http://arxiv.org/licenses/nonexclusive-distrib/1.0/","  Terrestrial planet formation theory is at a bottleneck, with the growing
realization that pairwise collisions are treated far too simply. Here, and in
our companion paper (Cambioni et al. 2019) that introduces the training
methodology, we demonstrate the first application of machine learning to more
realistically model the late stage of planet formation by giant impacts. We
present surrogate models that give fast, reliable answers for the masses and
velocities of the two largest remnants of a giant impact, as a function of the
colliding masses and their impact velocity and angle, with the caveat that our
training data do not yet include pre-impact rotation or variable thermal
conditions. We compare canonical N-body scenarios of terrestrial planet
formation assuming perfect merger (Chambers 2001) with our more realistic
treatment that includes inefficient accretions and hit-and-run collisions. The
result is a protracted tail of final events lasting ~200 Myr, and the
conversion of about half the mass of the initial population to debris. We
obtain profoundly different solar system architectures, featuring a much wider
range of terrestrial planet masses and enhanced compositional diversity.
","[{""version"":""v1"",""created"":""Fri, 3 Jan 2020 19:00:08 GMT""}]","2020-02-28"
