"2010.08172","Pat Devlin","Ross Berkowitz, Pat Devlin","Central Limit Theorem for Majority Dynamics: Bribing Three Voters
  Suffices","16 pages",,,,"math.PR math.CO","http://arxiv.org/licenses/nonexclusive-distrib/1.0/","  Given a graph $G$ and some initial labelling $\sigma : V(G) \to \{Red,
Blue\}$ of its vertices, the \textit{majority dynamics model} is the
deterministic process where at each stage, every vertex simultaneously replaces
its label with the majority label among its neighbors (remaining unchanged in
the case of a tie). We prove---for a wide range of parameters---that if an
initial assignment is fixed and we independently sample an Erd\H{o}s--R\'enyi
random graph, $G_{n,p}$, then after one step of majority dynamics, the number
of vertices of each label follows a central limit law. As a corollary, we
provide a strengthening of a theorem of Benjamini, Chan, O'Donnell, Tamuz, and
Tan about the number of steps required for the process to reach unanimity when
the initial assignment is also chosen randomly. Moreover, suppose there are
initially three more red vertices than blue. In this setting, we prove that if
we independently sample the graph $G_{n,1/2}$, then with probability at least
$51\%$, the majority dynamics process will converge to every vertex being red.
This improves a result of Tran and Vu who addressed the case that the initial
lead is at least 10.
","[{""version"":""v1"",""created"":""Fri, 16 Oct 2020 05:24:41 GMT""}]","2020-10-19"
"2010.08173","Antonios Katsianis","Antonios Katsianis, Haojie Xu, Xiaohu Yang, Yu Luo, Weiguang Cui,
  Romeel Dav\'e, Claudia Del P. Lagos, Xianzhong Zheng, Ping Zhao","The specific star formation rate function at different mass scales and
  quenching: A comparison between cosmological models and SDSS","13 pages, 4 Figures, Accepted to MNRAS",,"10.1093/mnras/staa3236",,"astro-ph.GA astro-ph.IM","http://arxiv.org/licenses/nonexclusive-distrib/1.0/","  We present the eddington bias corrected Specific Star Formation Rate Function
(sSFRF) at different stellar mass scales from a sub-sample of the Sloan Digital
Sky Survey Data Release DR7 (SDSS), which is considered complete both in terms
of stellar mass (${\rm M_{\star}}$) and star formation rate (SFR). The above
enable us to study qualitatively and quantitatively quenching, the distribution
of passive/star-forming galaxies and perform comparisons with the predictions
from state-of-the-art cosmological models, within the same ${\rm M_{\star}}$
and SFR limits. We find that at the low mass end (${\rm M_{\star}} = 10^{9.5} -
10^{10} \, {\rm M_{\odot}}$) the sSFRF is mostly dominated by star-forming
objects. However, moving to the two more massive bins (${\rm M_{\star}} =
10^{10} - 10^{10.5} \, {\rm M_{\odot}}$ and ${\rm M_{\star}} = 10^{10.5} -
10^{11} \, {\rm M_{\odot}}$) a bi-modality with two peaks emerges. One peak
represents the star-forming population, while the other describes a rising
passive population. The bi-modal form of the sSFRFs is not reproduced by a
range of cosmological simulations (e.g. Illustris, EAGLE, Mufasa, IllustrisTNG)
which instead generate mostly the star-forming population, while a bi-modality
emerges in others (e.g. L-Galaxies, Shark, Simba). Our findings reflect the
need for the employed quenching schemes in state-of-the-art models to be
reconsidered, involving prescriptions that allow ""quenched galaxies"" to retain
a small level of SF activity (sSFR $=$ ${\rm 10^{-11} {\rm yr^{-1}}}$-${\rm
10^{-12} {\rm yr^{-1}}}$) and generate an adequate passive
population/bi-modality even at intermediate masses (${\rm M_{\star}} = 10^{10}
- 10^{10.5} \, {\rm M_{\odot}}$).
","[{""version"":""v1"",""created"":""Fri, 16 Oct 2020 05:25:29 GMT""}]","2020-10-28"
"2010.08174","Haruki Nishimura","Haruki Nishimura and Negar Mehr and Adrien Gaidon and Mac Schwager","RAT iLQR: A Risk Auto-Tuning Controller to Optimally Account for
  Stochastic Model Mismatch","To appear in IEEE Robotics and Automation Letters",,"10.1109/LRA.2020.3048660",,"cs.RO","http://arxiv.org/licenses/nonexclusive-distrib/1.0/","  Successful robotic operation in stochastic environments relies on accurate
characterization of the underlying probability distributions, yet this is often
imperfect due to limited knowledge. This work presents a control algorithm that
is capable of handling such distributional mismatches. Specifically, we propose
a novel nonlinear MPC for distributionally robust control, which plans locally
optimal feedback policies against a worst-case distribution within a given KL
divergence bound from a Gaussian distribution. Leveraging mathematical
equivalence between distributionally robust control and risk-sensitive optimal
control, our framework also provides an algorithm to dynamically adjust the
risk-sensitivity level online for risk-sensitive control. The benefits of the
distributional robustness as well as the automatic risk-sensitivity adjustment
are demonstrated in a dynamic collision avoidance scenario where the predictive
distribution of human motion is erroneous.
","[{""version"":""v1"",""created"":""Fri, 16 Oct 2020 05:28:28 GMT""},{""version"":""v2"",""created"":""Fri, 25 Dec 2020 14:55:13 GMT""},{""version"":""v3"",""created"":""Mon, 18 Jan 2021 15:32:04 GMT""}]","2021-01-19"
"2010.08175","Xuanhong Chen","Xuanhong Chen, Xirui Yan, Naiyuan Liu, Ting Qiu and Bingbing Ni","Anisotropic Stroke Control for Multiple Artists Style Transfer","ACMMM2020","ACM Multimedia 2020","10.1145/3394171.3413770",,"cs.CV cs.AI","http://creativecommons.org/licenses/by-sa/4.0/","  Though significant progress has been made in artistic style transfer,
semantic information is usually difficult to be preserved in a fine-grained
locally consistent manner by most existing methods, especially when multiple
artists styles are required to transfer within one single model. To circumvent
this issue, we propose a Stroke Control Multi-Artist Style Transfer framework.
On the one hand, we develop a multi-condition single-generator structure which
first performs multi-artist style transfer. On the one hand, we design an
Anisotropic Stroke Module (ASM) which realizes the dynamic adjustment of
style-stroke between the non-trivial and the trivial regions. ASM endows the
network with the ability of adaptive semantic-consistency among various styles.
On the other hand, we present an novel Multi-Scale Projection Discriminator} to
realize the texture-level conditional generation. In contrast to the
single-scale conditional discriminator, our discriminator is able to capture
multi-scale texture clue to effectively distinguish a wide range of artistic
styles. Extensive experimental results well demonstrate the feasibility and
effectiveness of our approach. Our framework can transform a photograph into
different artistic style oil painting via only ONE single model. Furthermore,
the results are with distinctive artistic style and retain the anisotropic
semantic information. The code is already available on github:
https://github.com/neuralchen/ASMAGAN.
","[{""version"":""v1"",""created"":""Fri, 16 Oct 2020 05:32:26 GMT""},{""version"":""v2"",""created"":""Mon, 14 Jun 2021 14:25:27 GMT""}]","2021-06-15"
"2010.08176","Omid Ardakanian","Leepakshi Bindra, Kalvin Eng, Omid Ardakanian, Eleni Stroulia","Flexible, Decentralized Access Control for Smart Buildings with Smart
  Contracts","26 pages",,"10.1080/23335777.2021.1922502",,"cs.CR cs.DC","http://arxiv.org/licenses/nonexclusive-distrib/1.0/","  Large commercial buildings are complex cyber-physical systems containing
expensive and critical equipment that ensure the safety and comfort of their
numerous occupants. Yet occupant and visitor access to spaces and equipment
within these buildings are still managed through unsystematic, inefficient, and
human-intensive processes. As a standard practice, long-term building occupants
are given access privileges to rooms and equipment based on their
organizational roles, while visitors have to be escorted by their hosts. This
approach is conservative and inflexible. In this paper, we describe a
methodology that can flexibly and securely manage building access privileges
for long-term occupants and short-term visitors alike, taking into account the
risk associated with accessing each space within the building. Our methodology
relies on blockchain smart contracts to describe, grant, audit, and revoke
fine-grained permissions for building occupants and visitors, in a
decentralized fashion. The smart contracts are specified through a process that
leverages the information compiled from Brick and BOT models of the building.
We illustrate the proposed method through a typical application scenario in the
context of a real office building and argue that it can greatly reduce the
administration overhead, while, at the same time, providing fine-grained,
auditable access control.
","[{""version"":""v1"",""created"":""Fri, 16 Oct 2020 05:35:29 GMT""}]","2021-08-19"
"2010.08177","Yuanyu Wan","Yuanyu Wan and Lijun Zhang","Projection-free Online Learning over Strongly Convex Sets",,,,,"cs.LG math.OC","http://arxiv.org/licenses/nonexclusive-distrib/1.0/","  To efficiently solve online problems with complicated constraints,
projection-free algorithms including online frank-wolfe (OFW) and its variants
have received significant interest recently. However, in the general case,
existing projection-free algorithms only achieved the regret bound of
$O(T^{3/4})$, which is worse than the regret of projection-based algorithms,
where $T$ is the number of decision rounds. In this paper, we study the special
case of online learning over strongly convex sets, for which we first prove
that OFW enjoys a better regret bound of $O(T^{2/3})$ for general convex
losses. The key idea is to refine the decaying step-size in the original OFW by
a simple line search rule. Furthermore, for strongly convex losses, we propose
a strongly convex variant of OFW by redefining the surrogate loss function in
OFW. We show that it achieves a regret bound of $O(T^{2/3})$ over general
convex sets and a better regret bound of $O(\sqrt{T})$ over strongly convex
sets.
","[{""version"":""v1"",""created"":""Fri, 16 Oct 2020 05:42:50 GMT""}]","2020-10-19"
"2010.08178","Xuanfu Wu","Xuanfu Wu, Yang Feng, Chenze Shao","Generating Diverse Translation from Model Distribution with Dropout",,,,,"cs.CL cs.AI","http://arxiv.org/licenses/nonexclusive-distrib/1.0/","  Despite the improvement of translation quality, neural machine translation
(NMT) often suffers from the lack of diversity in its generation. In this
paper, we propose to generate diverse translations by deriving a large number
of possible models with Bayesian modelling and sampling models from them for
inference. The possible models are obtained by applying concrete dropout to the
NMT model and each of them has specific confidence for its prediction, which
corresponds to a posterior model distribution under specific training data in
the principle of Bayesian modeling. With variational inference, the posterior
model distribution can be approximated with a variational distribution, from
which the final models for inference are sampled. We conducted experiments on
Chinese-English and English-German translation tasks and the results shows that
our method makes a better trade-off between diversity and accuracy.
","[{""version"":""v1"",""created"":""Fri, 16 Oct 2020 05:50:00 GMT""}]","2020-10-19"
"2010.08179","Rui Wang","Rui Wang, Zhihua Wei, Yibin Zhan, Zhuoxi Chen","Tongji University Team for the VoxCeleb Speaker Recognition Challenge
  2020","4 pages, 1 figures, interspeech workshop",,,,"eess.AS cs.SD","http://arxiv.org/licenses/nonexclusive-distrib/1.0/","  In this report, we describe the submission of Tongji University team to the
CLOSE track of the VoxCeleb Speaker Recognition Challenge (VoxSRC) 2020 at
Interspeech 2020. We investigate different speaker recognition systems based on
the popular ResNet-34 architecture, and train multiple variants via various
loss functions. Both Offline and online data augmentation are introduced to
improve the diversity of the training set, and score normalization with the
exhaustive grid search is applied in the post-processing. Our best fusion of
five selected systems for the CLOSE track achieves 0.2800 DCF and 4.7770% EER
on the challenge.
","[{""version"":""v1"",""created"":""Fri, 16 Oct 2020 05:51:02 GMT""}]","2020-10-19"
"2010.08180","Derek Weber","Derek Weber and Frank Neumann","Who's in the Gang? Revealing Coordinating Communities in Social Media","20 pages, 10 images, accepted by The 2020 IEEE/ACM International
  Conference on Advances in Social Networks Analysis and Mining (ASONAM'20)",,"10.1109/asonam49781.2020.9381418",,"cs.SI","http://arxiv.org/licenses/nonexclusive-distrib/1.0/","  Political astroturfing and organised trolling are online malicious behaviours
with significant real-world effects. Common approaches examining these
phenomena focus on broad campaigns rather than the small groups responsible. To
reveal latent networks of cooperating accounts, we propose a novel temporal
window approach that relies on account interactions and metadata alone. It
detects groups of accounts engaging in behaviours that, in concert, execute
different goal-based strategies, which we describe. Our approach is validated
against two relevant datasets with ground truth data.
","[{""version"":""v1"",""created"":""Fri, 16 Oct 2020 05:59:12 GMT""}]","2022-02-28"
"2010.08181","Raul Jimenez","Ali Rida Khalifeh, Raul Jimenez","Spinors and Scalars in curved spacetime: neutrino dark energy
  (DE$_{\nu}$)","Matches version accepted by the Journal (Physics of the Dark
  Universe)","Physics of the Dark Universe. 31, 100777, 2021",,,"gr-qc astro-ph.CO hep-ph hep-th","http://arxiv.org/licenses/nonexclusive-distrib/1.0/","  We study the interaction, in general curved spacetime, between a spinor and a
scalar field describing dark energy; the so-called DE$_{\nu}$ model in curved
space. The dominant term is the dimension 5 operator, which results in
different energy shifts for the neutrino states: an Aharonov-Bohm-like effect.
We study the phenomenology of this term and make observational predictions to
detect dark energy interactions in the laboratory due to its effect on neutrino
oscillation experiments, which opens up the possibility of designing
underground experiments to detect dark energy. This dimension 5 operator beyond
the Standard Model interaction is less suppressed than the widely discussed
dimension 6 operator, which corresponds to mass varying neutrinos; the
dimension 5 operator does not suffer from gravitational instabilities.
","[{""version"":""v1"",""created"":""Fri, 16 Oct 2020 06:03:06 GMT""},{""version"":""v2"",""created"":""Mon, 25 Jan 2021 11:28:21 GMT""}]","2022-01-24"
"2010.08182","Shengwen Li","Junfang Gong, Shengwen Li, Xinyue Ye, Qiong Peng","Measuring the Dynamic Impact of High-Speed Railways on Urban
  Interactions in China",,,,,"cs.SI cs.CY","http://arxiv.org/licenses/nonexclusive-distrib/1.0/","  High-speed rail (HSR) has become an important mode of inter-city
transportation between large cities. Inter-city interaction facilitated by HSR
tends to play a more prominent role in promoting urban and regional economic
integration and development. Quantifying the impact of HSR's interaction on
cities and people is therefore crucial for long-term urban and regional
development planning and policy making. We develop an evaluation framework
using toponym information from social media as a proxy to estimate the dynamics
of such interactions. This paper adopts two types of spatial information:
toponyms from social media posts, and the geographical location information
embedded in social media posts. The framework highlights the asymmetric nature
of social interaction among cities, and proposes a series of metrics to
quantify such impact from multiple perspectives, including interaction
strength, spatial decay, and channel effect. The results show that HSRs not
only greatly expand the uneven distribution of inter-city connections, but also
significantly reshape the interactions that occur along HSR routes through the
channel effect.
","[{""version"":""v1"",""created"":""Fri, 16 Oct 2020 06:06:47 GMT""},{""version"":""v2"",""created"":""Mon, 26 Oct 2020 08:05:31 GMT""},{""version"":""v3"",""created"":""Thu, 29 Oct 2020 00:01:29 GMT""}]","2020-10-30"
"2010.08183","Despoina Antonakaki","Alexander Shevtsov, Maria Oikonomidou, Despoina Antonakaki, Polyvios
  Pratikakis, Sotiris Ioannidis","Analysis of Twitter and YouTube during USelections 2020",,,"10.1371/journal.pone.0270542",,"cs.SI","http://arxiv.org/licenses/nonexclusive-distrib/1.0/","  The presidential elections in the United States on 3 November 2020 have
caused extensive discussions on social media. A part of the content on US
elections is organic, coming from users discussing their opinions of the
candidates, political positions, or relevant content presented on television.
Another significant part of the content generated originates from organized
campaigns, both official and by astroturfing.
  In this study, we obtain approximately 17.5M tweets containing 3M users,
based on prevalent hashtags related to US election 2020, as well as the related
YouTube links, contained in the Twitter dataset, likes, dislikes and comments
of the videos and conduct volume, sentiment and graph analysis on the
communities formed.
  Particularly, we study the daily traffic per prevalent hashtags, plot the
retweet graph from July to September 2020, show how its main connected
component becomes denser in the period closer to the elections and highlight
the two main entities ('Biden' and 'Trump'). Additionally, we gather the
related YouTube links contained in the previous dataset and perform sentiment
analysis. The results on sentiment analysis on the Twitter corpus and the
YouTube metadata gathered, show the positive and negative sentiment for the two
entities throughout this period. The results of sentiment analysis indicate
that 45.7% express positive sentiment towards Trump in Twitter and 33.8%
positive sentiment towards Biden, while 14.55% of users express positive
sentiment in YouTube metadata gathered towards Trump and 8.7% positive
sentiment towards Biden. Our analysis fill the gap between the connection of
offline events and their consequences in social media by monitoring important
events in real world and measuring public volume and sentiment before and after
the event in social media.
","[{""version"":""v1"",""created"":""Fri, 16 Oct 2020 06:10:35 GMT""},{""version"":""v2"",""created"":""Wed, 21 Oct 2020 08:37:09 GMT""},{""version"":""v3"",""created"":""Tue, 3 Nov 2020 13:23:27 GMT""},{""version"":""v4"",""created"":""Tue, 10 Nov 2020 13:35:37 GMT""}]","2023-05-29"
"2010.08184","Guillaume Sartoretti","Mehul Damani and Zhiyao Luo and Emerson Wenzel and Guillaume
  Sartoretti","PRIMAL2: Pathfinding via Reinforcement and Imitation Multi-Agent
  Learning -- Lifelong","\c{opyright} 20XX IEEE. Personal use of this material is permitted.
  Permission from IEEE must be obtained for all other uses, in any current or
  future media, including reprinting/republishing this material for advertising
  or promotional purposes, creating new collective works, for resale or
  redistribution to servers or lists, or reuse of any copyrighted component of
  this work in other works",,"10.1109/LRA.2021.3062803",,"cs.RO","http://arxiv.org/licenses/nonexclusive-distrib/1.0/","  Multi-agent path finding (MAPF) is an indispensable component of large-scale
robot deployments in numerous domains ranging from airport management to
warehouse automation. In particular, this work addresses lifelong MAPF (LMAPF)
- an online variant of the problem where agents are immediately assigned a new
goal upon reaching their current one - in dense and highly structured
environments, typical of real-world warehouse operations. Effectively solving
LMAPF in such environments requires expensive coordination between agents as
well as frequent replanning abilities, a daunting task for existing coupled and
decoupled approaches alike. With the purpose of achieving considerable agent
coordination without any compromise on reactivity and scalability, we introduce
PRIMAL2, a distributed reinforcement learning framework for LMAPF where agents
learn fully decentralized policies to reactively plan paths online in a
partially observable world. We extend our previous work, which was effective in
low-density sparsely occupied worlds, to highly structured and constrained
worlds by identifying behaviors and conventions which improve implicit agent
coordination, and enable their learning through the construction of a novel
local agent observation and various training aids. We present extensive results
of PRIMAL2 in both MAPF and LMAPF environments and compare its performance to
state-of-the-art planners in terms of makespan and throughput. We show that
PRIMAL2 significantly surpasses our previous work and performs comparably to
these baselines, while allowing real-time re-planning and scaling up to 2048
agents.
","[{""version"":""v1"",""created"":""Fri, 16 Oct 2020 06:23:53 GMT""},{""version"":""v2"",""created"":""Sat, 30 Jan 2021 17:48:38 GMT""},{""version"":""v3"",""created"":""Thu, 4 Mar 2021 14:28:56 GMT""}]","2021-03-05"
"2010.08185","Tanfang Chen","Tanfang Chen, Weiwei Wang, Wenyang Wei, Xing Shi, Xiangang Li, Jieping
  Ye, Kevin Knight","DiDi's Machine Translation System for WMT2020","Accepted at WMT 2020",,,,"cs.CL cs.AI","http://arxiv.org/licenses/nonexclusive-distrib/1.0/","  This paper describes DiDi AI Labs' submission to the WMT2020 news translation
shared task. We participate in the translation direction of Chinese->English.
In this direction, we use the Transformer as our baseline model, and integrate
several techniques for model enhancement, including data filtering, data
selection, back-translation, fine-tuning, model ensembling, and re-ranking. As
a result, our submission achieves a BLEU score of $36.6$ in Chinese->English.
","[{""version"":""v1"",""created"":""Fri, 16 Oct 2020 06:25:48 GMT""}]","2020-10-19"
"2010.08186","Saleh Shahinfar","Saleh Shahinfar, Paul Meek, Greg Falzon","How many images do I need? Understanding how sample size per class
  affects deep learning model performance metrics for balanced designs in
  autonomous wildlife monitoring",,"Ecological Informatics, 2020, 57:101085",,,"cs.CV cs.AI cs.LG stat.AP","http://arxiv.org/licenses/nonexclusive-distrib/1.0/","  Deep learning (DL) algorithms are the state of the art in automated
classification of wildlife camera trap images. The challenge is that the
ecologist cannot know in advance how many images per species they need to
collect for model training in order to achieve their desired classification
accuracy. In fact there is limited empirical evidence in the context of camera
trapping to demonstrate that increasing sample size will lead to improved
accuracy. In this study we explore in depth the issues of deep learning model
performance for progressively increasing per class (species) sample sizes. We
also provide ecologists with an approximation formula to estimate how many
images per animal species they need for certain accuracy level a priori. This
will help ecologists for optimal allocation of resources, work and efficient
study design. In order to investigate the effect of number of training images;
seven training sets with 10, 20, 50, 150, 500, 1000 images per class were
designed. Six deep learning architectures namely ResNet-18, ResNet-50,
ResNet-152, DnsNet-121, DnsNet-161, and DnsNet-201 were trained and tested on a
common exclusive testing set of 250 images per class. The whole experiment was
repeated on three similar datasets from Australia, Africa and North America and
the results were compared. Simple regression equations for use by practitioners
to approximate model performance metrics are provided. Generalized additive
models (GAM) are shown to be effective in modelling DL performance metrics
based on the number of training images per class, tuning scheme and dataset.
  Key-words: Camera Traps, Deep Learning, Ecological Informatics, Generalised
Additive Models, Learning Curves, Predictive Modelling, Wildlife.
","[{""version"":""v1"",""created"":""Fri, 16 Oct 2020 06:28:35 GMT""}]","2020-10-19"
"2010.08187","Guang-Neng Hu","Guangneng Hu, Qiang Yang","PrivNet: Safeguarding Private Attributes in Transfer Learning for
  Recommendation","Findings of EMNLP 2020","Findings of ACL: EMNLP 2020",,,"cs.AI cs.CL cs.IR cs.LG","http://arxiv.org/licenses/nonexclusive-distrib/1.0/","  Transfer learning is an effective technique to improve a target recommender
system with the knowledge from a source domain. Existing research focuses on
the recommendation performance of the target domain while ignores the privacy
leakage of the source domain. The transferred knowledge, however, may
unintendedly leak private information of the source domain. For example, an
attacker can accurately infer user demographics from their historical purchase
provided by a source domain data owner. This paper addresses the above
privacy-preserving issue by learning a privacy-aware neural representation by
improving target performance while protecting source privacy. The key idea is
to simulate the attacks during the training for protecting unseen users'
privacy in the future, modeled by an adversarial game, so that the transfer
learning model becomes robust to attacks. Experiments show that the proposed
PrivNet model can successfully disentangle the knowledge benefitting the
transfer from leaking the privacy.
","[{""version"":""v1"",""created"":""Fri, 16 Oct 2020 06:33:45 GMT""}]","2021-01-14"
