"2010.08334","Aru Beri","Aru Beri, Sachindra Naik, K.P Singh, Gaurava K. Jaisawal, Sudip
  Bhattacharyya, Philip Charles, Wynn C. G. Ho, Chandreyee Maitra, Dipankar
  Bhattacharya, Gulab C Dewangan, Matthew Middleton, Diego Altamirano, Poshak
  Gandhi, Harsha Raichur","AstroSat Observations of the first Galactic ULX Pulsar Swift
  J0243.6+6124","13 pages, accepted for publication in MNRAS",,"10.1093/mnras/staa3254",,"astro-ph.HE","http://arxiv.org/licenses/nonexclusive-distrib/1.0/","  SwiftJ0243.6+6124, the first Galactic ultra-luminous X-ray pulsar, was
observed during its 2017-2018 outburst with \emph{AstroSat} at both sub- and
super-Eddington levels of accretionwith X-ray luminosities of
$L_{X}{\sim}7{\times}10^{37}$ and $6{\times}10^{38}$$ergs^{-1}$,
respectively.Our broadband timing and spectral observations show that X-ray
pulsations at ${\sim}9.85\rm{s}$ have been detected up to 150keV when the
source was accreting at the super-Eddington level.The pulse profiles are a
strong function of both energy and source luminosity,showing a double-peaked
profile with pulse fraction increasing from $\sim$$10{\%}$ at $1.65\rm{keV}$ to
40--80$\%$ at $70\rm{keV}$.The continuum X-ray spectra are well-modeled with a
high energy cut-off power law($\Gamma$${\sim}$0.6-0.7) and one or two blackbody
components with temperatures of $\sim$0.35$\rm{keV}$ and $1.2\rm{keV}$,
depending on the accretion level.No iron line emission is observed at
sub-Eddington level, while a broad emission feature at around 6.9keV is
observed at the super-Eddington level, along with a blackbody
radius($121-142\rm{km}$) that indicates the presence of optically thick
outflows.
","[{""version"":""v1"",""created"":""Fri, 16 Oct 2020 11:53:18 GMT""}]","2020-10-28"
"2010.08335","Sina Foroutan-Barenji","Sina Foroutan-Barenji, Onur Erdem, Savas Delikanli, Huseyin Bilge
  Yagci, Negar Gheshlaghi, Yemliha Altintas, and Hilmi Volkan Demir","Single-mode lasing from a single 7 nm thick monolayer of colloidal
  quantum wells in a monolithic microcavity",,,"10.1002/lpor.202000479",,"physics.optics physics.app-ph","http://arxiv.org/licenses/nonexclusive-distrib/1.0/","  In this work, we report the first account of monolithically-fabricated
vertical cavity surface emitting lasers (VCSELs) of densely-packed,
orientation-controlled, atomically flat colloidal quantum wells (CQWs) using a
self-assembly method and demonstrate single-mode lasing from a record thin
colloidal gain medium with a film thickness of 7 nm under femtosecond optical
excitation. We used specially engineered CQWs to demonstrate these hybrid
CQW-VCSELs consisting of only a few layers to a single monolayer of CQWs and
achieved the lasing from these thin gain media by thoroughly modeling and
implementing a vertical cavity consisting of distributed Bragg reflectors with
an additional dielectric layer for mode tuning. Accurate spectral and spatial
alignment of the cavity mode with the CQW films was secured with the help of
full electromagnetic computations. While overcoming the long-pending problem of
limited electrical conductivity in thicker colloidal films, such ultra-thin
colloidal gain media can help enabling fully electrically-driven colloidal
lasers.
","[{""version"":""v1"",""created"":""Fri, 16 Oct 2020 11:57:29 GMT""}]","2021-06-29"
"2010.08336","Dibyendu Roy","Nilanjan Bondyopadhaya and Dibyendu Roy","Nonequilibrium electrical, thermal and spin transport in open quantum
  systems of topological superconductors, semiconductors and metals","64 pages, 14 figures","J. Stat. Phys. 187, 11 (2022)","10.1007/s10955-022-02902-w",,"cond-mat.mes-hall cond-mat.supr-con","http://arxiv.org/licenses/nonexclusive-distrib/1.0/","  We study nonequilibrium transport in various open quantum systems whose
systems and leads/baths are made of topological superconductors (TSs),
semiconductors, and metals. Using quantum Langevin equations and Green's
function method, we derive exact expressions for steady-state electrical,
thermal, and spin current at the junctions between a system and leads. We
validate these current expressions by comparing them with the results from
direct time-evolution simulations. We then show how an electrical current
injected in TS wires divides into two parts carried by single electronic
excitations and Cooper pairs. We further show ballistic thermal transport in an
open TS wire in the topological phase under temperature or voltage bias. The
thermal current values grow significantly near the topological phase
transition, where thermal conductance displays a sharp quantized peak as
predicted earlier. We relate the quantized thermal conductance to the
zero-frequency thermoelectric transmission coefficient of the open TS wire. We
also observe a large thermoelectric current near the topological transition of
the TS wires. We introduce a differential spin conductance which displays a
quantized zero-bias peak at zero temperature for a spinful TS wire in the
topological phase. The role of superconducting baths in transport is
demonstrated by thoroughly examining the features of zero-temperature
differential electrical conductance and thermal conductance in open systems
with TS baths. Our new thermoelectric and spin transport findings in various
two-terminal geometries are beneficial to the present challenges in probing the
emergence of Majorana quasi-particles in experiments.
","[{""version"":""v1"",""created"":""Fri, 16 Oct 2020 12:08:39 GMT""},{""version"":""v2"",""created"":""Fri, 1 Apr 2022 12:29:50 GMT""}]","2022-04-06"
"2010.08337","Chad Nester","Chad Nester","A Foundation for Ledger Structures","15 pages, many figures","2nd International Conference on Blockchain Economics, Security and
  Protocols (Tokenomics 2020) OASIcs, Volume 82, pages 7:1-7:13","10.4230/OASIcs.Tokenomics.2020.7",,"cs.LO math.CT","http://arxiv.org/licenses/nonexclusive-distrib/1.0/","  This paper introduces an approach to constructing ledger structures for
cryptocurrency systems with basic category theory. Compositional theories of
resource convertibility allow us to express the material history of virtual
goods, and ownership is modelled by a free construction. Our notion of
ownership admits an intuitive graphical representation through string diagrams
for monoidal functors.
","[{""version"":""v1"",""created"":""Fri, 16 Oct 2020 12:08:49 GMT""},{""version"":""v2"",""created"":""Fri, 2 Apr 2021 14:21:50 GMT""}]","2021-04-05"
"2010.08342","Shenxing Zhang Mr","Shenxing Zhang","The virtual periods of linear recurrence sequences in cyclotomic fields","5 pages",,,,"math.NT","http://creativecommons.org/licenses/by-nc-nd/4.0/","  A linear recurrence sequence in a cyclotomic field produces a sequence of the
generating fields of each term. We show that the later sequence is periodic
after removing the first finite terms, and give a bound of its period. This can
be applied to exponential sums.
","[{""version"":""v1"",""created"":""Fri, 16 Oct 2020 12:12:25 GMT""},{""version"":""v2"",""created"":""Fri, 13 Nov 2020 04:03:54 GMT""},{""version"":""v3"",""created"":""Mon, 4 Oct 2021 03:09:01 GMT""}]","2021-10-05"
"2010.08344","Frank Tavares","Frank Tavares, Denise Buckner, Dana Burton, Jordan McKaig, Parvathy
  Prem, Eleni Ravanis, Natalie Trevino, Aparna Venkatesan, Steven D. Vance,
  Monica Vidaurri, Lucianne Walkowicz, and Mary Beth Wilhelm","Ethical Exploration and the Role of Planetary Protection in Disrupting
  Colonial Practices","A submission to the Planetary Science and Astrobiology Decadal Survey
  2023-2032",,,,"astro-ph.IM astro-ph.EP","http://creativecommons.org/licenses/by/4.0/","  We recommend that the planetary science and space exploration community
engage in a robust reevaluation concerning the ethics of how future crewed and
uncrewed missions to the Moon and Mars will interact with those planetary
environments. This should occur through a process of community input, with
emphasis on how such missions can resist colonial structures. Such discussions
must be rooted in the historical context of the violent colonialism in the
Americas and across the globe that has accompanied exploration of Earth. The
structures created by settler colonialism are very much alive today, impact the
scientific community, and are currently replicated in the space exploration
communities' plans for human exploration and in-situ resource utilization.
These discussions must lead to enforceable planetary protection policies that
create a framework for ethical exploration of other worlds. Current policy does
not adequately address questions related to in-situ resource utilization and
environmental preservation and is without enforcement mechanisms. Further,
interactions with potential extraterrestrial life have scientific and moral
stakes. Decisions on these topics will be made in the coming decade as the
Artemis program enables frequent missions to the Moon and crewed missions to
Mars. Those first choices will have irreversible consequences for the future of
human space exploration and must be extremely well considered, with input from
those beyond the scientific community, including expertise from the humanities
and members of the general public. Without planetary protection policy that
actively resists colonial practices, they will be replicated in our
interactions and exploration of other planetary bodies. The time is now to
engage in these difficult conversations and disrupt colonial practices within
our field so that they are not carried to other worlds.
","[{""version"":""v1"",""created"":""Thu, 15 Oct 2020 17:14:18 GMT""},{""version"":""v2"",""created"":""Tue, 27 Oct 2020 21:46:15 GMT""}]","2020-10-29"
"2010.08345","Mohammed Mou\c{c}ouf","Mohammed Mou\c{c}ouf","Some algebraic results concerning linear recurrence sequences","16 pages, some notations changed",,,,"math.RA","http://creativecommons.org/licenses/by/4.0/","  We study the set $\mathcal{L}_{F}$ of all $F$-vector spaces $L(P)$, the set
of linear recurrence sequences over $F$ with characteristic polynomial $P$
monic and splits over $F$. We show that $\mathcal{L}_{F}$ is a commutative
semiring graded by the multiplicative monoid $F$. This study allows us to find
explicitly the polynomial $P\in F[X]$ such that $L(P)=\prod_{i=1}^{m}L(P_{i})$,
where $P_{1}, \ldots, P_{m}$ are any monic polynomials over $F$.
","[{""version"":""v1"",""created"":""Fri, 16 Oct 2020 12:18:19 GMT""},{""version"":""v2"",""created"":""Tue, 3 Aug 2021 11:34:03 GMT""}]","2021-08-04"
"2010.08346","Vili H\""at\""onen","Vili H\""at\""onen and Fiona Melzer","From Talk to Action with Accountability: Monitoring the Public
  Discussion of Policy Makers with Deep Neural Networks and Topic Modelling","Camera ready version",,,,"cs.CL cs.LG","http://arxiv.org/licenses/nonexclusive-distrib/1.0/","  Decades of research on climate have provided a consensus that human activity
has changed the climate and we are currently heading into a climate crisis.
While public discussion and research efforts on climate change mitigation have
increased, potential solutions need to not only be discussed but also
effectively deployed. For preventing mismanagement and holding policy makers
accountable, transparency and degree of information about government processes
have been shown to be crucial. However, currently the quantity of information
about climate change discussions and the range of sources make it increasingly
difficult for the public and civil society to maintain an overview to hold
politicians accountable.
  In response, we propose a multi-source topic aggregation system (MuSTAS)
which processes policy makers speech and rhetoric from several publicly
available sources into an easily digestible topic summary. MuSTAS uses novel
multi-source hybrid latent Dirichlet allocation to model topics from a variety
of documents. This topic digest will serve the general public and civil society
in assessing where, how, and when politicians talk about climate and climate
policies, enabling them to hold politicians accountable for their actions to
mitigate climate change and lack thereof.
","[{""version"":""v1"",""created"":""Fri, 16 Oct 2020 12:21:01 GMT""},{""version"":""v2"",""created"":""Tue, 6 Jul 2021 13:17:37 GMT""},{""version"":""v3"",""created"":""Fri, 9 Jul 2021 16:12:22 GMT""}]","2021-07-12"
"2010.08347","Jan K\v{r}et\'insk\'y","Javier Esparza, Stefan Kiefer, Jan Kretinsky and Maximilian Weininger","Online Monitoring $\omega$-Regular Properties in Unknown Markov Chains",,,"10.4230/LIPIcs.CONCUR.2021.5",,"cs.FL","http://arxiv.org/licenses/nonexclusive-distrib/1.0/","  We study runtime monitoring of $\omega$-regular properties. We consider a
simple setting in which a run of an unknown finite-state Markov chain $\mathcal
M$ is monitored against a fixed but arbitrary $\omega$-regular specification
$\varphi$. The purpose of monitoring is to keep aborting runs that are
""unlikely"" to satisfy the specification until $\mathcal M$ executes a correct
run. We design controllers for the reset action that (assuming that $\varphi$
has positive probability) satisfy the following property w.p.1: the number of
resets is finite, and the run executed by $\mathcal M$ after the last reset
satisfies $\varphi$.
","[{""version"":""v1"",""created"":""Fri, 16 Oct 2020 12:31:06 GMT""}]","2022-07-21"
"2010.08348","Stephan Radonic","Stephan Radonic, J\""urgen Besserer, Valeria Meier, Carla Rohrer Bley,
  Uwe Schneider","A novel analytical population TCP model includes cell density and volume
  variations: application to canine brain tumor",,"International Journal of Radiation Oncology, Biology, Physics,
  (2021), Volume 110, Issue 5, 1530 - 1537","10.1016/j.ijrobp.2021.03.021",,"physics.med-ph","http://arxiv.org/licenses/nonexclusive-distrib/1.0/","  TCP models based on Poisson statistics are characterizing the distribution of
the surviving clonogens. It enables the calculation of TCP for individuals. In
order to describe clinically observed survival data of patient cohorts it is
necessary to extend the model. This is typically done by either incorporating
variations of various model parameters, or by using an empirical logistic
model. The purpose of this work is the development of an analytical population
TCP model by mechanistic extension of the Poisson model.The frequency
distribution of GTVs is used to incorporate tumor volume variations into the
TCP model. Additionally the tumor cell density variation is incorporated. Both
versions of the population TCP model were fitted to clinical data and compared
to literature. It was shown that clinically observed brain tumor volumes of
dogs undergoing radiotherapy are exponentially distributed. The average GTV
size was 3.37 cm$^3$. Fitting the population TCP model including the volume
variation LQ and track-event model yielded $\alpha=0.36 ~Gy^{-1}$,
$\beta=0.045~Gy^{-2}$, $a=0.9$, $T_D=5.0~d$ and $p = 0.36~Gy^{-1}$,
$q=0.48~Gy^{-1}$, $a=0.80$, $T_D = 3.0~d$, respectively. Fitting the population
TCP model including both the volume and cell density variation yields
$\alpha=0.43~Gy^{-1}$, $\beta=0.0537~Gy^{-2}$, $a=2.0$, $T_D=3.0~d$,
$\sigma=2.5$ and $p=0.43~ Gy^{-1}$, $q=0.55~Gy^{-1}$, $a=2.0$, $T_D=2.0~d$,
$\sigma=3.0$ respectively. Two sets of radiobiological parameters were obtained
which can be used for quantifying the TCP for radiation therapy of dog brain
tumors. We established a mechanistic link between the poisson statistics based
individual TCP model and the logistic TCP model. This link can be used to
determine the radiobiological parameters of patient specific TCP models from
published fits of logistic models to cohorts of patients.
","[{""version"":""v1"",""created"":""Fri, 16 Oct 2020 12:33:14 GMT""}]","2021-11-16"
"2010.08349","Francesco Romor","Francesco Romor, Marco Tezzele, Gianluigi Rozza","Multi-fidelity data fusion for the approximation of scalar functions
  with low intrinsic dimensionality through active subspaces",,,"10.1002/pamm.202000349",,"math.NA cs.NA stat.ML","http://arxiv.org/licenses/nonexclusive-distrib/1.0/","  Gaussian processes are employed for non-parametric regression in a Bayesian
setting. They generalize linear regression, embedding the inputs in a latent
manifold inside an infinite-dimensional reproducing kernel Hilbert space. We
can augment the inputs with the observations of low-fidelity models in order to
learn a more expressive latent manifold and thus increment the model's
accuracy. This can be realized recursively with a chain of Gaussian processes
with incrementally higher fidelity. We would like to extend these
multi-fidelity model realizations to case studies affected by a
high-dimensional input space but with low intrinsic dimensionality. In this
cases physical supported or purely numerical low-order models are still
affected by the curse of dimensionality when queried for responses. When the
model's gradient information is provided, the presence of an active subspace
can be exploited to design low-fidelity response surfaces and thus enable
Gaussian process multi-fidelity regression, without the need to perform new
simulations. This is particularly useful in the case of data scarcity. In this
work we present a multi-fidelity approach involving active subspaces and we
test it on two different high-dimensional benchmarks.
","[{""version"":""v1"",""created"":""Fri, 16 Oct 2020 12:35:49 GMT""}]","2021-07-13"
"2010.08350","Javier Hidalgo-Carri\'o","Javier Hidalgo-Carri\'o, Daniel Gehrig and Davide Scaramuzza","Learning Monocular Dense Depth from Events","IEEE International Conference on 3D Vision (3DV), 2020",,,,"cs.CV cs.LG","http://arxiv.org/licenses/nonexclusive-distrib/1.0/","  Event cameras are novel sensors that output brightness changes in the form of
a stream of asynchronous events instead of intensity frames. Compared to
conventional image sensors, they offer significant advantages: high temporal
resolution, high dynamic range, no motion blur, and much lower bandwidth.
Recently, learning-based approaches have been applied to event-based data, thus
unlocking their potential and making significant progress in a variety of
tasks, such as monocular depth prediction. Most existing approaches use
standard feed-forward architectures to generate network predictions, which do
not leverage the temporal consistency presents in the event stream. We propose
a recurrent architecture to solve this task and show significant improvement
over standard feed-forward methods. In particular, our method generates dense
depth predictions using a monocular setup, which has not been shown previously.
We pretrain our model using a new dataset containing events and depth maps
recorded in the CARLA simulator. We test our method on the Multi Vehicle Stereo
Event Camera Dataset (MVSEC). Quantitative experiments show up to 50%
improvement in average depth error with respect to previous event-based
methods.
","[{""version"":""v1"",""created"":""Fri, 16 Oct 2020 12:36:23 GMT""},{""version"":""v2"",""created"":""Thu, 22 Oct 2020 08:33:43 GMT""}]","2020-10-23"
"2010.08351","Piotr Homola Dr.","Piotr Homola, Dmitriy Beznosko, Gopal Bhatta, Lukasz Bibrzycki,
  Michalina Borczynska, Lukasz Bratek, Nikolai Budnev, Dariusz Burakowski,
  David E. Alvarez-Castillo, Kevin Almeida Cheminant, Aleksander Cwikla,
  Punsiri Dam-o, Niraj Dhital, Alan R. Duffy, Piotr Glownia, Krzysztof
  Gorzkiewicz, Dariusz Gora, Alok C. Gupta, Zuzana Hlavkova, Martin Homola,
  Joanna Jalocha, Robert Kaminski, Michal Karbowiak, Marcin Kasztelan, Renata
  Kierepko, Marek Knap, Peter Kovacs, Szymon Kulinski, Bartosz Lozowski, Marek
  Magrys, Mikhail V. Medvedev, Justyna Medrala, Jerzy W. Mietelski, Justyna
  Miszczyk, Alona Mozgova, Antonio Napolitano, Vahab Nazari, Y. Jack Ng, Michal
  Niedzwiecki, Cristina Oancea, Boguslaw Ogan, Gabriela Opila, Krzysztof
  Oziomek, Maciej Pawlik, Marcin Piekarczyk, Bozena Poncyliusz, Jerzy Pryga,
  Matias Rosas, Krzysztof Rzecki, Jilberto Zamora-Saa, Katarzyna Smelcerz,
  Karel Smolek, Weronika Stanek, Jaroslaw Stasielak, Slawomir Stuglik, Jolanta
  Sulma, Oleksandr Sushchov, Manana Svanidze, Kyle Tam, Arman Tursunov, Jose M.
  Vaquero, Tadeusz Wibig, Krzysztof W. Wozniak","Cosmic Ray Extremely Distributed Observatory","59 pages, 23 figures","Symmetry 2020, 12(11), 1835","10.3390/sym12111835",,"astro-ph.HE astro-ph.IM","http://creativecommons.org/licenses/by/4.0/","  The Cosmic Ray Extremely Distributed Observatory (CREDO) is a newly formed,
global collaboration dedicated to observing and studying cosmic rays (CR) and
cosmic ray ensembles (CRE): groups of a minimum of two CR with a common primary
interaction vertex or the same parent particle. The CREDO program embraces
testing known CR and CRE scenarios, and preparing to observe unexpected
physics, it is also suitable for multi-messenger and multi-mission
applications. Perfectly matched to CREDO capabilities, CRE could be formed both
within classical models (e.g. as products of photon-photon interactions), and
exotic scenarios (e.g. as results of decay of Super Heavy Dark Matter
particles). Their fronts might be significantly extended in space and time, and
they might include cosmic rays of energies spanning the whole cosmic ray energy
spectrum, with a footprint composed of at least two extensive air showers with
correlated arrival directions and arrival times. Since CRE are mostly expected
to be spread over large areas and, because of the expected wide energy range of
the contributing particles, CRE detection might only be feasible when using
available cosmic ray infrastructure collectively, i.e. as a globally extended
network of detectors. Thus, with this review article, the CREDO Collaboration
invites the astroparticle physics community to actively join or to contribute
to the research dedicated to CRE, and in particular to share any cosmic ray
data useful for the specific CRE detection strategies.
","[{""version"":""v1"",""created"":""Fri, 16 Oct 2020 12:37:10 GMT""},{""version"":""v2"",""created"":""Mon, 19 Oct 2020 11:38:14 GMT""}]","2021-01-26"
"2010.08352","Alexander Gheorghiu","Alexander Gheorghiu and Sonia Marin","Focused Proof-search in the Logic of Bunched Implications","18 pages content","FoSSaCs 2020",,,"cs.LO","http://creativecommons.org/licenses/by/4.0/","  The logic of Bunched Implications (BI) freely combines additive and
multiplicative connectives, including implications; however, despite its
well-studied proof theory, proof-search in BI has always been a difficult
problem. The focusing principle is a restriction of the proof-search space that
can capture various goal-directed proof-search procedures. In this paper, we
show that focused proof-search is complete for BI by first reformulating the
traditional bunched sequent calculus using the simpler data-structure of nested
sequents, following with a polarised and focused variant that we show is sound
and complete via a cut-elimination argument. This establishes an operational
semantics for focused proof-search in the logic of Bunched Implications.
","[{""version"":""v1"",""created"":""Fri, 16 Oct 2020 12:39:14 GMT""},{""version"":""v2"",""created"":""Tue, 26 Jan 2021 10:38:58 GMT""}]","2021-01-27"
"2010.08353","Zhihao Cheng","Zhihao Cheng, Liu Liu, Aishan Liu, Hao Sun, Meng Fang, Dacheng Tao","On the Guaranteed Almost Equivalence between Imitation Learning from
  Observation and Demonstration",,,,,"cs.RO cs.LG","http://arxiv.org/licenses/nonexclusive-distrib/1.0/","  Imitation learning from observation (LfO) is more preferable than imitation
learning from demonstration (LfD) due to the nonnecessity of expert actions
when reconstructing the expert policy from the expert data. However, previous
studies imply that the performance of LfO is inferior to LfD by a tremendous
gap, which makes it challenging to employ LfO in practice. By contrast, this
paper proves that LfO is almost equivalent to LfD in the deterministic robot
environment, and more generally even in the robot environment with bounded
randomness. In the deterministic robot environment, from the perspective of the
control theory, we show that the inverse dynamics disagreement between LfO and
LfD approaches zero, meaning that LfO is almost equivalent to LfD. To further
relax the deterministic constraint and better adapt to the practical
environment, we consider bounded randomness in the robot environment and prove
that the optimizing targets for both LfD and LfO remain almost same in the more
generalized setting. Extensive experiments for multiple robot tasks are
conducted to empirically demonstrate that LfO achieves comparable performance
to LfD. In fact, most common robot systems in reality are the robot environment
with bounded randomness (i.e., the environment this paper considered). Hence,
our findings greatly extend the potential of LfO and suggest that we can safely
apply LfO without sacrificing the performance compared to LfD in practice.
","[{""version"":""v1"",""created"":""Fri, 16 Oct 2020 12:42:59 GMT""}]","2020-10-19"
