"2010.07996","Nancy Remage Evans","Nancy Remage Evans, H. Moritz Guenther, Howard E. Bond, Gail H.
  Schaefer, Brian D. Mason, Margarita Karovska, Evan Tingle, Scott Wolk, Scott
  Engle, Edward Guinan, Ignazio Pillitteri, Charles Proffitt, Pierre Kervella,
  Alexandre Gallenne, Richard I. Anderson, and Maxwell Moe","Hubble Space Telescope Snapshot Survey for Resolved Companions of
  Galactic Cepheids: Final Results","Accepted by ApJ",,"10.3847/1538-4357/abc1f1",,"astro-ph.SR","http://arxiv.org/licenses/nonexclusive-distrib/1.0/","  Cepheids in multiple systems provide information on the outcome of the
formation of massive stars. They can also lead to exotic end-stage objects.
This study concludes our survey of 70 galactic Cepheids using the {\it Hubble
Space Telescope\} (\HST) Wide Field Camera~3 (WFC3) with images at two
wavelengths to identify companions closer than $5\arcsec$. In the entire WFC3
survey we identify 16 probable companions for 13 Cepheids. The seven Cepheids
having resolved candidate companions within $2""$ all have the surprising
property of themselves being spectroscopic binaries (as compared with a 29\%
incidence of spectroscopic binaries in the general Cepheid population). That is
a strong suggestion that an inner binary is linked to the scenario of a third
companion within a few hundred~AU\null. This characteristic is continued for
more widely separated companions. Under a model where the outer companion is
formed first, it is unlikely that it can anticipate a subsequent inner binary.
Rather it is more likely that a triple system has undergone dynamical
interaction, resulting in one star moving outward to its current location. {\it
Chandra\} and {\it Gaia\} data as well as radial velocities and \HSTSTIS and
{\it IUE\} spectra are used to derive properties of the components of the
Cepheid systems.
  The colors of the companion candidates show a change in distribution at
approximately 2000~AU separations, from a range including both hot and cool
colors for closer companions, to only low-mass companions for wider
separations.
","[{""version"":""v1"",""created"":""Thu, 15 Oct 2020 19:45:06 GMT""}]","2020-12-23"
"2010.07997","Yanyan Li","Yanyan Li, Raza Yunus, Nikolas Brasch, Nassir Navab and Federico
  Tombari","RGB-D SLAM with Structural Regularities",,,,,"cs.RO","http://arxiv.org/licenses/nonexclusive-distrib/1.0/","  This work proposes a RGB-D SLAM system specifically designed for structured
environments and aimed at improved tracking and mapping accuracy by relying on
geometric features that are extracted from the surrounding. Structured
environments offer, in addition to points, also an abundance of geometrical
features such as lines and planes, which we exploit to design both the tracking
and mapping components of our SLAM system. For the tracking part, we explore
geometric relationships between these features based on the assumption of a
Manhattan World (MW). We propose a decoupling-refinement method based on
points, lines, and planes, as well as the use of Manhattan relationships in an
additional pose refinement module. For the mapping part, different levels of
maps from sparse to dense are reconstructed at a low computational cost. We
propose an instance-wise meshing strategy to build a dense map by meshing plane
instances independently. The overall performance in terms of pose estimation
and reconstruction is evaluated on public benchmarks and shows improved
performance compared to state-of-the-art methods. The code is released at
\url{https://github.com/yanyan-li/PlanarSLAM}
","[{""version"":""v1"",""created"":""Thu, 15 Oct 2020 19:56:05 GMT""},{""version"":""v2"",""created"":""Thu, 25 Mar 2021 22:40:42 GMT""}]","2021-03-29"
"2010.07998","Bradley Dober Dr.","B. Dober, Z. Ahmed, K. Arnold, D.T. Becker, D.A. Bennett, J.A.
  Connors, A. Cukierman, J.M. D'Ewart, S.M. Duff, J.E. Dusatko, J.C. Frisch,
  J.D. Gard, S.W. Henderson, R. Herbst, G.C. Hilton, J. Hubmayr, Y. Li, J.A.B.
  Mates, H. McCarrick, C.D Reintsema, M. Silva-Feaver, L. Ruckman, J.N. Ullom,
  L.R. Vale, D.D. Van Winkle, J. Vasquez, Y. Wang, E. Young, C. Yu, and K.
  Zheng","A Microwave SQUID Multiplexer Optimized for Bolometric Applications","6 pages, 5 figures",,"10.1063/5.0033416",,"astro-ph.IM","http://arxiv.org/licenses/nonexclusive-distrib/1.0/","  A microwave SQUID multiplexer ($\mu$MUX) has been optimized for coupling to
large arrays of superconducting transition-edge sensor (TES) bolometers. We
present the scalable cryogenic multiplexer chip design in a 1820-channel
multiplexer configuration for the 4-8 GHz rf band. The key metrics of yield,
sensitivity, and crosstalk are determined through measurements of 455 readout
channels, which span 4-5 GHz. The median white-noise level is 45
pA/$\sqrt{\textrm{Hz}}$, evaluated at 2 Hz, with a 1/f knee $\leq$ 20 mHz after
common-mode subtraction. The white-noise level decreases the sensitivity of a
TES bolometer optimized for detection of the cosmic microwave background at 150
GHz by only 3%. The measured crosstalk between any channel pair is $\leq$ 0.3%.
","[{""version"":""v1"",""created"":""Thu, 15 Oct 2020 19:56:25 GMT""},{""version"":""v2"",""created"":""Tue, 19 Jan 2021 18:23:51 GMT""}]","2021-02-24"
"2010.07999","Jie Lei","Jie Lei, Licheng Yu, Tamara L. Berg, Mohit Bansal","What is More Likely to Happen Next? Video-and-Language Future Event
  Prediction","EMNLP 2020 (17 pages)",,,,"cs.CL cs.AI cs.CV","http://arxiv.org/licenses/nonexclusive-distrib/1.0/","  Given a video with aligned dialogue, people can often infer what is more
likely to happen next. Making such predictions requires not only a deep
understanding of the rich dynamics underlying the video and dialogue, but also
a significant amount of commonsense knowledge. In this work, we explore whether
AI models are able to learn to make such multimodal commonsense next-event
predictions. To support research in this direction, we collect a new dataset,
named Video-and-Language Event Prediction (VLEP), with 28,726 future event
prediction examples (along with their rationales) from 10,234 diverse TV Show
and YouTube Lifestyle Vlog video clips. In order to promote the collection of
non-trivial challenging examples, we employ an adversarial
human-and-model-in-the-loop data collection procedure. We also present a strong
baseline incorporating information from video, dialogue, and commonsense
knowledge. Experiments show that each type of information is useful for this
challenging task, and that compared to the high human performance on VLEP, our
model provides a good starting point but leaves large room for future work. Our
dataset and code are available at:
https://github.com/jayleicn/VideoLanguageFuturePred
","[{""version"":""v1"",""created"":""Thu, 15 Oct 2020 19:56:47 GMT""}]","2020-10-19"
"2010.08000","Felipe Alarc\'on","Felipe Alarcon, Richard Teague, Ke Zhang, Edwin Bergin, Marcelo
  Barraza-Alfaro","Chemical Evolution in a Protoplanetary Disk within Planet Carved Gaps
  and Dust Rings","21 pages,16 figures",,"10.3847/1538-4357/abc1d6",,"astro-ph.EP","http://arxiv.org/licenses/nonexclusive-distrib/1.0/","  Recent surveys of protoplanetary disks show that substructure in dust thermal
continuum emission maps is common in protoplanetary disks. These substructures,
most prominently rings and gaps, shape and change the chemical and physical
conditions of the disk, along with the dust size distributions. In this work,
we use a thermochemical code to focus on the chemical evolution that is
occurring within the gas-depleted gap and the dust-rich ring often observed
behind it. The composition of these spatial locations are of great import, as
the gas and ice-coated grains will end up being part of the atmospheres of gas
giants and/or the seeds of rocky planets. Our models show that the dust
temperature at the midplane of the gap increases, enough to produce local
sublimation of key volatiles and pushing the molecular layer closer to the
midplane, while it decreases in the dust-rich ring, causing a higher volatile
deposition onto the dust grain surfaces. Further, the ring itself presents a
freeze-out trap for volatiles in local flows powered by forming planets,
becoming a site of localized volatile enhancement. Within the gas depleted gap,
the line emission depends on several different parameters, such as: the depth
of the gap in surface density, the location of the dust substructure, and the
abundance of common gas tracers, such as CO. In order to break this uncertainty
between abundance and surface density, other methods such as disk kinematics,
become necessary to constrain the disk structure and its chemical evolution.
","[{""version"":""v1"",""created"":""Thu, 15 Oct 2020 20:01:19 GMT""}]","2020-12-17"
"2010.08001","Long Zhao","Long Zhao, Ting Liu, Xi Peng, Dimitris Metaxas","Maximum-Entropy Adversarial Data Augmentation for Improved
  Generalization and Robustness","Accepted to NeurIPS 2020. Code is available at
  https://github.com/garyzhao/ME-ADA",,,,"cs.LG cs.CV","http://arxiv.org/licenses/nonexclusive-distrib/1.0/","  Adversarial data augmentation has shown promise for training robust deep
neural networks against unforeseen data shifts or corruptions. However, it is
difficult to define heuristics to generate effective fictitious target
distributions containing ""hard"" adversarial perturbations that are largely
different from the source distribution. In this paper, we propose a novel and
effective regularization term for adversarial data augmentation. We
theoretically derive it from the information bottleneck principle, which
results in a maximum-entropy formulation. Intuitively, this regularization term
encourages perturbing the underlying source distribution to enlarge predictive
uncertainty of the current model, so that the generated ""hard"" adversarial
perturbations can improve the model robustness during training. Experimental
results on three standard benchmarks demonstrate that our method consistently
outperforms the existing state of the art by a statistically significant
margin.
","[{""version"":""v1"",""created"":""Thu, 15 Oct 2020 20:02:23 GMT""},{""version"":""v2"",""created"":""Fri, 18 Dec 2020 03:37:02 GMT""}]","2020-12-21"
"2010.08002","Paul Hriljac","Paul Hriljac","Fully Homomorphic Encryption via Affine Automorphisms",,,,,"cs.CR math.AG","http://arxiv.org/licenses/nonexclusive-distrib/1.0/","  Homomorphic encryption is a method used in cryptopgraphy to create programs
that can interact with encrypted data without ever leaving the data in the
clear. This has many potential applications in cybersecurity. This paper uses
automorphisms of affine space to create a form of homomorphic encryption for
straight line programs. The encryption method used for the data is known as
multivariate encryption. This gives a potentially powerful new method in cyber
security based on techniques from algebraic geometry.
","[{""version"":""v1"",""created"":""Thu, 15 Oct 2020 20:03:26 GMT""}]","2020-10-19"
"2010.08003","Georgios Bakirtzis","Georgios Bakirtzis, Cody H. Fleming, Christina Vasilakopoulou","Categorical Semantics of Cyber-Physical Systems Theory",,,"10.1145/3461669",,"cs.LO cs.SY eess.SY math.CT","http://arxiv.org/licenses/nonexclusive-distrib/1.0/","  Cyber-physical systems require the construction and management of various
models to assure their correct, safe, and secure operation. These various
models are necessary because of the coupled physical and computational dynamics
present in cyber-physical systems. However, to date the different model views
of cyber-physical systems are largely related informally, which raises issues
with the degree of formal consistency between those various models of
requirements, system behavior, and system architecture. We present a
category-theoretic framework to make different types of composition explicit in
the modeling and analysis of cyber-physical systems, which could assist in
verifying the system as a whole. This compositional framework for
cyber-physical systems gives rise to unified system models, where system
behavior is hierarchically decomposed and related to a system architecture
using the systems-as-algebras paradigm. As part of this paradigm, we show that
an algebra of (safety) contracts generalizes over the state of the art,
providing more uniform mathematical tools for constraining the behavior over a
richer set of composite cyber-physical system models, which has the potential
of minimizing or eliminating hazardous behavior.
","[{""version"":""v1"",""created"":""Thu, 15 Oct 2020 20:04:59 GMT""},{""version"":""v2"",""created"":""Tue, 23 Feb 2021 17:30:00 GMT""},{""version"":""v3"",""created"":""Mon, 26 Apr 2021 13:07:32 GMT""}]","2021-10-04"
"2010.08004","Ziqin Feng","Ziqn Feng","$P$-bases and Topological Groups",,,,,"math.GN math.GR","http://arxiv.org/licenses/nonexclusive-distrib/1.0/","  A topological space $X$ is defined to have a neighborhood $P$-base at any
$x\in X$ from some poset $P$ if there exists a neighborhood base
$(U_p[x])_{p\in P}$ at $x$ such that $U_p[x]\subseteq U_{p'}[x]$ for all $p\geq
p'$ in $P$. We prove that a compact space is countable, hence metrizable, if it
has countable scattered height and a $\mathcal{K}(M)$-base for some separable
metric space $M$. This gives a positive answer to Problem 8.6.8 in
\cite{Banakh2019}.
  Let $A(X)$ be the free Abelian topological group on $X$. It is shown that if
$Y$ is a retract of $X$ such that the free Abelian topological group $A(Y)$ has
a $P$-base and $A(X/Y)$ has a $Q$-base, then $A(X)$ has a $P\times Q$-base.
Also if $Y$ is a closed subspace of $X$ and $A(X)$ has a $P$-base, then
$A(X/Y)$ has a $P$-base.
  It is shown that any Fr\'{e}che-Urysohn topological group with a
$\mathcal{K}(M)$-base for some separable metric space $M$ is first-countable,
hence metrizable. And if $P$ is a poset with calibre~$(\omega_1, \omega)$ and
$G$ is a topological group with a $P$-base, then any precompact subset in G is
metrizable, hence $G$ is strictly angelic. Applications in function spaces
$C_p(X)$ and $C_k(X)$ are discussed. We also give an example of a topological
Boolean group of character $\leq \mathfrak{d}$ such that the precompact subsets
are metrizable but $G$ doesn't have an $\omega^\omega$-base if
$\omega_1<\mathfrak{d}$. This gives a consistent negative answer to Problem 6.5
in \cite{GKL15}.
","[{""version"":""v1"",""created"":""Thu, 15 Oct 2020 20:06:27 GMT""},{""version"":""v2"",""created"":""Wed, 21 Oct 2020 14:46:30 GMT""},{""version"":""v3"",""created"":""Wed, 19 May 2021 20:02:10 GMT""}]","2021-05-21"
"2010.08005","Kayla Wright","Gregg Musiker and Kayla Wright","Mixed Dimer Configuration Model in Type D Cluster Algebras","49 pages, 46 figures, updated to address properties of the poset as
  well as draw a direct connection to representation theory",,,,"math.CO","http://creativecommons.org/licenses/by/4.0/","  We give a combinatorial model for F-polynomials and g-vectors for type D
cluster algebras where the associated quiver is acyclic. Our model utilizes a
combination of dimer configurations and double dimer configurations which we
refer to as mixed dimer configurations. In particular, we give a graph
theoretic recipe that describes which monomials appear in such F-polynomials,
as well as a graph theoretic way to determine the coefficients of each of these
monomials. In addition, we give a weighting on our mixed dimer configuration
model that gives the associated g-vector. To prove this formula, we use a
combinatorial formula due to Thao Tran and provide explicit bijections between
her combinatorial model and our own.
","[{""version"":""v1"",""created"":""Thu, 15 Oct 2020 20:14:46 GMT""},{""version"":""v2"",""created"":""Wed, 28 Oct 2020 13:59:53 GMT""},{""version"":""v3"",""created"":""Wed, 12 May 2021 20:17:21 GMT""},{""version"":""v4"",""created"":""Wed, 25 Jan 2023 21:34:07 GMT""}]","2023-01-27"
"2010.08006","Siyi Tang","Siyi Tang, Amirata Ghorbani, Rikiya Yamashita, Sameer Rehman, Jared A.
  Dunnmon, James Zou, Daniel L. Rubin","Data Valuation for Medical Imaging Using Shapley Value: Application on A
  Large-scale Chest X-ray Dataset",,,"10.1038/s41598-021-87762-2",,"cs.LG cs.CV eess.IV","http://creativecommons.org/licenses/by/4.0/","  The reliability of machine learning models can be compromised when trained on
low quality data. Many large-scale medical imaging datasets contain low quality
labels extracted from sources such as medical reports. Moreover, images within
a dataset may have heterogeneous quality due to artifacts and biases arising
from equipment or measurement errors. Therefore, algorithms that can
automatically identify low quality data are highly desired. In this study, we
used data Shapley, a data valuation metric, to quantify the value of training
data to the performance of a pneumonia detection algorithm in a large chest
X-ray dataset. We characterized the effectiveness of data Shapley in
identifying low quality versus valuable data for pneumonia detection. We found
that removing training data with high Shapley values decreased the pneumonia
detection performance, whereas removing data with low Shapley values improved
the model performance. Furthermore, there were more mislabeled examples in low
Shapley value data and more true pneumonia cases in high Shapley value data.
Our results suggest that low Shapley value indicates mislabeled or poor quality
images, whereas high Shapley value indicates data that are valuable for
pneumonia detection. Our method can serve as a framework for using data Shapley
to denoise large-scale medical imaging datasets.
","[{""version"":""v1"",""created"":""Thu, 15 Oct 2020 20:18:35 GMT""}]","2021-04-20"
"2010.08007","Shashank Singh","Shashank Singh","Continuum-Armed Bandits: A Function Space Perspective",,,,,"stat.ML cs.IT cs.LG math.IT math.OC math.ST stat.TH","http://creativecommons.org/licenses/by/4.0/","  Continuum-armed bandits (a.k.a., black-box or $0^{th}$-order optimization)
involves optimizing an unknown objective function given an oracle that
evaluates the function at a query point, with the goal of using as few query
points as possible. In the most well-studied case, the objective function is
assumed to be Lipschitz continuous and minimax rates of simple and cumulative
regrets are known in both noiseless and noisy settings. This paper studies
continuum-armed bandits under more general smoothness conditions, namely Besov
smoothness conditions, on the objective function. In both noiseless and noisy
conditions, we derive minimax rates under simple and cumulative regrets. Our
results show that minimax rates over objective functions in a Besov space are
identical to minimax rates over objective functions in the smallest H\""older
space into which the Besov space embeds.
","[{""version"":""v1"",""created"":""Thu, 15 Oct 2020 20:21:44 GMT""},{""version"":""v2"",""created"":""Mon, 26 Oct 2020 14:50:03 GMT""},{""version"":""v3"",""created"":""Tue, 24 Nov 2020 20:22:25 GMT""},{""version"":""v4"",""created"":""Sun, 21 Mar 2021 22:22:25 GMT""}]","2021-03-23"
"2010.08008","Hafiz Anwar Ullah Khan","Hafiz Anwar Ullah Khan, Jip Kim and Yury Dvorkin","Risk-Informed Participation in T&D Markets",,,,,"eess.SY cs.SY","http://arxiv.org/licenses/nonexclusive-distrib/1.0/","  Power producers can exhibit strategic behavior in electricity markets to
maximize their profits. This behavior is more pronounced with the deregulation
of distribution markets, which offers an opportunity for profit arbitrage
between transmission and distribution (T&D) markets. However, the temporally
distinct nature of these two markets introduces a significant risk in profit
for such producers. This paper derives its motivation from the perspective of a
strategic producer and develops a Single Leader Multi-Follower (SLMF) game for
deriving its participation strategies in T&D markets, while accounting for
different T&D coordination schemes based on the individual market Gate Closure
Times (GCT). We compare and contrast joint and sequential market clearing
models with regulated and deregulated distribution environments and evaluate
the risk of producer by leveraging consistent and coherent risk measures. SLMF
game is reformulated as a Mathematical Program with Equilibrium Constraints
(MPEC) and is solved using the seminal Scholtes's relaxation scheme. We
validate the efficacy of our model and solution approach via the case study
carried out on the 11-zone New York ISO, and 7-bus Manhattan power networks,
used as transmission and distribution markets, respectively.
","[{""version"":""v1"",""created"":""Thu, 15 Oct 2020 20:27:03 GMT""}]","2020-10-19"
"2010.08009","Yoji Yamato","Yoji Yamato","Study of Automatic Offloading Method in Mixed Offloading Destination
  Environment","Descriptions of FPGA offloading results were insufficient in section
  4",,,"IEICE Technical Report, IN2020-30, Oct. 2020","cs.DC","http://arxiv.org/licenses/nonexclusive-distrib/1.0/","  In recent years, utilization of heterogeneous hardware other than small core
CPU such as GPU, FPGA or many core CPU is increasing. However, when using
heterogeneous hardware, barriers of technical skills such as OpenMP, CUDA and
OpenCL are high. Based on that, I have proposed environment-adaptive software
that enables automatic conversion, configuration, and high performance
operation of once written code, according to the hardware to be placed.
However, including existing technologies, there has been no research to
properly and automatically offload the mixed offloading destination environment
such as GPU, FPGA and many core CPU. In this paper, as a new element of
environment-adaptive software, I study a method for offloading applications
properly and automatically in the environment where the offloading destination
is mixed with GPU, FPGA and many core CPU. I evaluate the effectiveness of the
proposed method in multiple applications.
","[{""version"":""v1"",""created"":""Thu, 15 Oct 2020 20:30:48 GMT""},{""version"":""v2"",""created"":""Sat, 10 Jul 2021 23:10:09 GMT""}]","2021-07-13"
"2010.08010","Zahra Nourbakhsh","Zahra Nourbakhsh, Nicolas Tancogne-Dejean, Hamed Merdji, and Angel
  Rubio","High-harmonics and isolated attosecond pulses from MgO",,"Phys. Rev. Applied 15, 014013 (2021)","10.1103/PhysRevApplied.15.014013",,"physics.optics cond-mat.mtrl-sci","http://arxiv.org/licenses/nonexclusive-distrib/1.0/","  On the basis of real-time ab initio calculations, we study the
non-perturbative interaction of two-color laser pulses with MgO crystal in the
strong field regime to generate isolated attosecond pulse from high-harmonic
emissions from MgO crystal. In this regard, we examine the impact of incident
pulse characteristics such as its shape, intensity, and ellipticity as well as
the consequence of the crystal anisotropy on the emitted harmonics and their
corresponding isolated attosecond pulses. Our calculations predict the creation
of isolated attosecond pulses with a duration of ~ 300 attoseconds; in
addition, using elliptical driving pulses, the generation of elliptical
isolated attosecond pulses is shown. Our work prepares the path for all
solid-state compact optical devices offering perspectives beyond traditional
isolated attosecond pulse emitted from atoms.
","[{""version"":""v1"",""created"":""Thu, 15 Oct 2020 20:35:47 GMT""}]","2021-01-13"
"2010.08011","Francesco Cellarosi","Francesco Cellarosi","Autocorrelation functions for quantum particles in supersymmetric
  P\""oschl-Teller Potentials","13 pages, 3 figures. Submitted to the Canadian Mathematical Bulletin",,,,"math-ph math.DS math.MP math.PR","http://arxiv.org/licenses/nonexclusive-distrib/1.0/","  We consider autocorrelation functions for supersymmetric quantum mechanical
systems (consisting of a fermion and a boson) confined in trigonometric
P\""oschl-Teller partner potentials. We study the limit of rescaled
autocorrelation functions (at random time) as the localization of the initial
state goes to infinity. The limiting distribution can be described using pairs
of Jacobi theta functions on a suitably defined homogeneous space, as a
corollary of the work of Cellarosi and Marklof. A construction by
Contreras-Astorga and Fern\'andez provides large classes of P\""oschl-Teller
partner potentials to which our analysis applies.
","[{""version"":""v1"",""created"":""Thu, 15 Oct 2020 20:42:49 GMT""}]","2020-10-19"
"2010.08012","Agnieszka Maria S{\l}owik","Alex Lamb, Anirudh Goyal, Agnieszka S{\l}owik, Michael Mozer, Philippe
  Beaudoin, Yoshua Bengio","Neural Function Modules with Sparse Arguments: A Dynamic Approach to
  Integrating Information across Layers",,,,,"cs.LG stat.ML","http://arxiv.org/licenses/nonexclusive-distrib/1.0/","  Feed-forward neural networks consist of a sequence of layers, in which each
layer performs some processing on the information from the previous layer. A
downside to this approach is that each layer (or module, as multiple modules
can operate in parallel) is tasked with processing the entire hidden state,
rather than a particular part of the state which is most relevant for that
module. Methods which only operate on a small number of input variables are an
essential part of most programming languages, and they allow for improved
modularity and code re-usability. Our proposed method, Neural Function Modules
(NFM), aims to introduce the same structural capability into deep learning.
Most of the work in the context of feed-forward networks combining top-down and
bottom-up feedback is limited to classification problems. The key contribution
of our work is to combine attention, sparsity, top-down and bottom-up feedback,
in a flexible algorithm which, as we show, improves the results in standard
classification, out-of-domain generalization, generative modeling, and learning
representations in the context of reinforcement learning.
","[{""version"":""v1"",""created"":""Thu, 15 Oct 2020 20:43:17 GMT""}]","2020-10-19"
