"2008.06213","Seonghyun Jeong","Seonghyun Jeong, Taeyoung Park, and David A. van Dyk","Bayesian model selection in additive partial linear models via locally
  adaptive splines",,,,,"stat.ME","http://arxiv.org/licenses/nonexclusive-distrib/1.0/","  We provide a flexible framework for selecting among a class of additive
partial linear models that allows both linear and nonlinear additive
components. In practice, it is challenging to determine which additive
components should be excluded from the model while simultaneously determining
whether nonzero additive components should be represented as linear or
non-linear components in the final model. In this paper, we propose a Bayesian
model selection method that is facilitated by a carefully specified class of
models, including the choice of a prior distribution and the nonparametric
model used for the nonlinear additive components. We employ a series of latent
variables that determine the effect of each variable among the three
possibilities (no effect, linear effect, and nonlinear effect) and that
simultaneously determine the knots of each spline for a suitable penalization
of smooth functions. The use of a pseudo-prior distribution along with a
collapsing scheme enables us to deploy well-behaved Markov chain Monte Carlo
samplers, both for model selection and for fitting the preferred model. Our
method and algorithm are deployed on a suite of numerical studies and are
applied to a nutritional epidemiology study. The numerical results show that
the proposed methodology outperforms previously available methods in terms of
effective sample sizes of the Markov chain samplers and the overall
misclassification rates.
","[{""version"":""v1"",""created"":""Fri, 14 Aug 2020 07:15:51 GMT""},{""version"":""v2"",""created"":""Fri, 17 Sep 2021 12:19:56 GMT""}]","2021-09-20"
"2008.06214","Asif Imran","Asif Imran, Tevfik Kosar","The Impact of Auto-Refactoring Code Smells on the Resource Utilization
  of Cloud Software",,"In SEKE (pp. 299-304) 2020","10.18293/SEKE2020-138",,"cs.SE","http://arxiv.org/licenses/nonexclusive-distrib/1.0/","  Cloud-based software-as-a-service (SaaS) have gained popularity due to their
low cost and elasticity. However, like other software, SaaS applications suffer
from code smells, which can drastically affect functionality and resource
usage. Code smell is any design in the source code that indicates a deeper
problem. The software community deploys automated refactoring to eliminate
smells which can improve performance and also decrease the usage of critical
resources. However, studies that analyze the impact of automatic refactoring
smells in SaaS on resources such as CPU and memory have been conducted to a
limited extent. Here, we aim to fill that gap and study the impact on resource
usage of SaaS applications due to automatic refactoring of seven classic code
smells: god class, feature envy, type checking, cyclic dependency, shotgun
surgery, god method, and spaghetti code. We specified six real-life SaaS
applications from Github called Zimbra, OneDataShare, GraphHopper, Hadoop,
JENA, and JAMES which ran on Openstack cloud. Results show that refactoring
smells by tools like JDeodrant and JSparrow have widely varying impacts on the
CPU and memory consumption of the tested applications based on the type of
smell refactored. We present the resource utilization impact of each smell and
also discuss the potential reasons leading to that effect.
","[{""version"":""v1"",""created"":""Fri, 14 Aug 2020 07:16:36 GMT""}]","2020-08-17"
"2008.06215","Yulia Solovyeva","Y. Solovyeva (1), A. Vinokurov (1), A. Sarkisyan (1), K. Atapin (5),
  S. Fabrika (1 and 2), A. F. Valeev (1), A. Kniazev (3 and 4 and 5), O.
  Sholukhova (1), O. Maslennikova (1) ((1) Special Astrophysical Observatory,
  Nizhnij Arkhyz, Russia, (2) Kazan Federal University, Kazan, Russia, (3)
  South African Astronomical Observatory, Cape Town, South Africa, (4) Southern
  African Large Telescope Foundation, Cape Town, South Africa, (5) Sternberg
  Astronomical Institute, Lomonosov Moscow State University, Moscow, Russia)","New luminous blue variable candidates in the NGC 247 galaxy","Accepted for publication in Monthly Notices of the Royal Astronomical
  Society Main Journal 2020 July 15",,"10.1093/mnras/staa2117",,"astro-ph.SR astro-ph.GA","http://arxiv.org/licenses/nonexclusive-distrib/1.0/","  We search for LBV stars in galaxies outside the Local Group. Here we present
a study of two bright $H\alpha$ sources in the NGC 247 galaxy. Object
j004703.27-204708.4 ($M_V=-9.08 \pm 0.15^m$) shows the spectral lines typical
for well-studied LBV stars: broad and bright emission lines of hydrogen and
helium He I with P Cyg profiles, emission lines of iron Fe II, silicon Si II,
nitrogen N II and carbon C II, forbidden iron [Fe II] and nitrogen [N II]
lines. The variability of the object is $\Delta B = 0.74\pm0.09^m$ and $\Delta
V = 0.88\pm0.09^m$, which makes it reliable LBV candidate. The star
j004702.18-204739.93 ($M_V=-9.66 \pm 0.23^m$) shows many emission lines of iron
Fe II, forbidden iron lines [Fe II], bright hydrogen lines with broad wings,
and also forbidden lines of oxygen [O I] and calcium [Ca II] formed in the
circumstellar matter. The study of the light curve of this star also did not
reveal significant variations in brightness ($\Delta V = 0.29\pm0.09^m$). We
obtained estimates of interstellar absorption, the photosphere temperature, as
well as bolometric magnitudes $M_\text{bol}=-10.5^{+0.5}_{-0.4}$ and
$M_\text{bol}=-10.8^{+0.5}_{-0.6}$, which corresponds to bolometric
luminosities $\log(L_\text{bol}/L_{\odot})=6.11^{+0.20}_{-0.16}$ and
$6.24^{+0.20}_{-0.25}$ for j004703.27-204708.4 and j004702.18-204739.93
respectively. Thus, the object j004703.27-204708.4 remains a reliable LBV
candidate, while the object j004702.18-204739.93 can be classified as
B[e]-supergiant.
","[{""version"":""v1"",""created"":""Fri, 14 Aug 2020 07:20:43 GMT""}]","2020-09-02"
"2008.06216","Shunchuan Yang","Xiaochao Zhou, Zekun Zhu, and Shunchuan Yang","Formulation of Single-Source Surface Integral Equation for
  Electromagnetic Analysis of Composite Penetrable Objects",,,,,"cs.CE","http://arxiv.org/licenses/nonexclusive-distrib/1.0/","  This paper presents a new single-source surface integral equation (SS-SIE) to
model composite penetrable objects. In the proposed formulation, the surface
electric and magnetic fields on all interior boundaries are first eliminated
through combining integral solutions inside each object. Then, by enforcing the
surface electric fields in the original and equivalent configurations are equal
to each other, an equivalent model with only the electric current density on
the outermost boundaries is derived. Compared with other SIEs, like the PMCHWT
formulation, all unknowns are residing on the outermost boundaries in the
proposed formulation and therefore, less count of unknowns can be obtained.
Finally, two numerical examples are carried out to validate the effectiveness
of the proposed SS-SIE.
","[{""version"":""v1"",""created"":""Fri, 14 Aug 2020 07:25:05 GMT""}]","2020-08-17"
"2008.06217","Lixu Wang","Lixu Wang, Shichao Xu, Xiao Wang, Qi Zhu","Addressing Class Imbalance in Federated Learning","17 pages, Accept by AAAI 2021",,,,"cs.LG stat.ML","http://arxiv.org/licenses/nonexclusive-distrib/1.0/","  Federated learning (FL) is a promising approach for training decentralized
data located on local client devices while improving efficiency and privacy.
However, the distribution and quantity of the training data on the clients'
side may lead to significant challenges such as class imbalance and non-IID
(non-independent and identically distributed) data, which could greatly impact
the performance of the common model. While much effort has been devoted to
helping FL models converge when encountering non-IID data, the imbalance issue
has not been sufficiently addressed. In particular, as FL training is executed
by exchanging gradients in an encrypted form, the training data is not
completely observable to either clients or servers, and previous methods for
class imbalance do not perform well for FL. Therefore, it is crucial to design
new methods for detecting class imbalance in FL and mitigating its impact. In
this work, we propose a monitoring scheme that can infer the composition of
training data for each FL round, and design a new loss function --
\textbf{Ratio Loss} to mitigate the impact of the imbalance. Our experiments
demonstrate the importance of acknowledging class imbalance and taking measures
as early as possible in FL training, and the effectiveness of our method in
mitigating the impact. Our method is shown to significantly outperform previous
methods, while maintaining client privacy.
","[{""version"":""v1"",""created"":""Fri, 14 Aug 2020 07:28:08 GMT""},{""version"":""v2"",""created"":""Tue, 15 Dec 2020 01:56:21 GMT""}]","2020-12-16"
"2008.06218","Wonyoung Shin","Wonyoung Shin, Jung-Woo Ha, Shengzhe Li, Yongwoo Cho, Hoyean Song,
  Sunyoung Kwon","Which Strategies Matter for Noisy Label Classification? Insight into
  Loss and Uncertainty",,,,,"cs.LG stat.ML","http://arxiv.org/licenses/nonexclusive-distrib/1.0/","  Label noise is a critical factor that degrades the generalization performance
of deep neural networks, thus leading to severe issues in real-world problems.
Existing studies have employed strategies based on either loss or uncertainty
to address noisy labels, and ironically some strategies contradict each other:
emphasizing or discarding uncertain samples or concentrating on high or low
loss samples. To elucidate how opposing strategies can enhance model
performance and offer insights into training with noisy labels, we present
analytical results on how loss and uncertainty values of samples change
throughout the training process. From the in-depth analysis, we design a new
robust training method that emphasizes clean and informative samples, while
minimizing the influence of noise using both loss and uncertainty. We
demonstrate the effectiveness of our method with extensive experiments on
synthetic and real-world datasets for various deep learning models. The results
show that our method significantly outperforms other state-of-the-art methods
and can be used generally regardless of neural network architectures.
","[{""version"":""v1"",""created"":""Fri, 14 Aug 2020 07:34:32 GMT""}]","2020-08-17"
"2008.06219","Johannes Schwab","Andrea Ebner, J\""urgen Frikel, Dirk Lorenz, Johannes Schwab, Markus
  Haltmeier","Regularization of Inverse Problems by Filtered Diagonal Frame
  Decomposition",,,,,"math.NA cs.NA","http://arxiv.org/licenses/nonexclusive-distrib/1.0/","  The characteristic feature of inverse problems is their instability with
respect to data perturbations. In order to stabilize the inversion process,
regularization methods have to be developed and applied. In this work we
introduce and analyze the concept of filtered diagonal frame decomposition
which extends the standard filtered singular value decomposition to the frame
case. Frames as generalized singular system allows to better adapt to a given
class of potential solutions. In this paper, we show that filtered diagonal
frame decomposition yield a convergent regularization method. Moreover, we
derive convergence rates under source type conditions and prove order
optimality under the assumption that the considered frame is a Riesz-basis.
","[{""version"":""v1"",""created"":""Fri, 14 Aug 2020 07:36:19 GMT""},{""version"":""v2"",""created"":""Fri, 19 Aug 2022 10:58:01 GMT""}]","2022-08-22"
"2008.06220","Abhimanyu Dubey","Abhimanyu Dubey and Alex Pentland","Kernel Methods for Cooperative Multi-Agent Contextual Bandits","19 pages including supplement, camera-ready at ICML 2020",,,,"cs.LG cs.MA stat.ML","http://arxiv.org/licenses/nonexclusive-distrib/1.0/","  Cooperative multi-agent decision making involves a group of agents
cooperatively solving learning problems while communicating over a network with
delays. In this paper, we consider the kernelised contextual bandit problem,
where the reward obtained by an agent is an arbitrary linear function of the
contexts' images in the related reproducing kernel Hilbert space (RKHS), and a
group of agents must cooperate to collectively solve their unique decision
problems. For this problem, we propose \textsc{Coop-KernelUCB}, an algorithm
that provides near-optimal bounds on the per-agent regret, and is both
computationally and communicatively efficient. For special cases of the
cooperative problem, we also provide variants of \textsc{Coop-KernelUCB} that
provides optimal per-agent regret. In addition, our algorithm generalizes
several existing results in the multi-agent bandit setting. Finally, on a
series of both synthetic and real-world multi-agent network benchmarks, we
demonstrate that our algorithm significantly outperforms existing benchmarks.
","[{""version"":""v1"",""created"":""Fri, 14 Aug 2020 07:37:44 GMT""}]","2020-08-17"
"2008.06221","Ankush Chanda","Surajit Karmakar, Hiranmoy Garai, Lakshmi Kanta Dey, and Ankush Chanda","Existence of Solutions to Non-linear Quadratic Integral Equations via
  Measure of Non-Compactness",,,,,"math.FA","http://arxiv.org/licenses/nonexclusive-distrib/1.0/","  The objective of this manuscript is to enquire for the solvability of a
specific type of non-linear quadratic integral equations via the interesting
notion of measure of non-compactness. Firstly, we inquire into couple of
exciting fixed point theorems involving a measure of non-compactness in the
setting of a Banach space. Subsequently, bringing into play a suitable measure
of non-compactness and the acquired results, we discuss the existence of
solution to the aforementioned kind of non-linear quadratic integral equations.
","[{""version"":""v1"",""created"":""Fri, 14 Aug 2020 07:39:15 GMT""}]","2020-08-17"
"2008.06222","Albert Gatt","Stavros Assimakopoulos, Rebecca Vella Muskat, Lonneke van der Plas,
  Albert Gatt","Annotating for Hate Speech: The MaNeCo Corpus and Some Input from
  Critical Discourse Analysis","10 pages, 1 table. Appears in Proceedings of the 12th edition of the
  Language Resources and Evaluation Conference (LREC'20)",,,,"cs.CY cs.CL","http://creativecommons.org/licenses/by/4.0/","  This paper presents a novel scheme for the annotation of hate speech in
corpora of Web 2.0 commentary. The proposed scheme is motivated by the critical
analysis of posts made in reaction to news reports on the Mediterranean
migration crisis and LGBTIQ+ matters in Malta, which was conducted under the
auspices of the EU-funded C.O.N.T.A.C.T. project. Based on the realization that
hate speech is not a clear-cut category to begin with, appears to belong to a
continuum of discriminatory discourse and is often realized through the use of
indirect linguistic means, it is argued that annotation schemes for its
detection should refrain from directly including the label 'hate speech,' as
different annotators might have different thresholds as to what constitutes
hate speech and what not. In view of this, we suggest a multi-layer annotation
scheme, which is pilot-tested against a binary +/- hate speech classification
and appears to yield higher inter-annotator agreement. Motivating the
postulation of our scheme, we then present the MaNeCo corpus on which it will
eventually be used; a substantial corpus of on-line newspaper comments spanning
10 years.
","[{""version"":""v1"",""created"":""Fri, 14 Aug 2020 07:39:21 GMT""}]","2020-08-17"
"2008.06223","Haijun Liu","Haijun Liu, Xiaoheng Tan and Xichuan Zhou","Parameter Sharing Exploration and Hetero-Center based Triplet Loss for
  Visible-Thermal Person Re-Identification","to be published in IEEE Transactions on Multimedia",,"10.1109/TMM.2020.3042080",,"cs.CV","http://arxiv.org/licenses/nonexclusive-distrib/1.0/","  This paper focuses on the visible-thermal cross-modality person
re-identification (VT Re-ID) task, whose goal is to match person images between
the daytime visible modality and the nighttime thermal modality. The two-stream
network is usually adopted to address the cross-modality discrepancy, the most
challenging problem for VT Re-ID, by learning the multi-modality person
features. In this paper, we explore how many parameters of two-stream network
should share, which is still not well investigated in the existing literature.
By well splitting the ResNet50 model to construct the modality-specific feature
extracting network and modality-sharing feature embedding network, we
experimentally demonstrate the effect of parameters sharing of two-stream
network for VT Re-ID. Moreover, in the framework of part-level person feature
learning, we propose the hetero-center based triplet loss to relax the strict
constraint of traditional triplet loss through replacing the comparison of
anchor to all the other samples by anchor center to all the other centers. With
the extremely simple means, the proposed method can significantly improve the
VT Re-ID performance. The experimental results on two datasets show that our
proposed method distinctly outperforms the state-of-the-art methods by large
margins, especially on RegDB dataset achieving superior performance,
rank1/mAP/mINP 91.05%/83.28%/68.84%. It can be a new baseline for VT Re-ID,
with a simple but effective strategy.
","[{""version"":""v1"",""created"":""Fri, 14 Aug 2020 07:40:35 GMT""},{""version"":""v2"",""created"":""Fri, 4 Dec 2020 01:36:49 GMT""}]","2020-12-07"
"2008.06224","BongJu Kim","BongJu Kim","On cryptological schemes for r-person secret vote and r-person
  authentication",,,,,"math.CO","http://arxiv.org/licenses/nonexclusive-distrib/1.0/","  We introduce a scheme for the membership verification, a scheme for a secret
ballot, a scheme for the unanimity rule which can hide the number of voter
using some partition number identities.
","[{""version"":""v1"",""created"":""Fri, 14 Aug 2020 07:43:22 GMT""}]","2020-08-17"
"2008.06225","Jie Fang","Jie Fang, Jianwu Lin, Shutao Xia, Yong Jiang, Zhikang Xia, Xiang Liu","Neural Network-based Automatic Factor Construction","Accepted by the Journal, Quantitative Finance. 21 Pages",,,,"q-fin.ST cs.LG","http://arxiv.org/licenses/nonexclusive-distrib/1.0/","  Instead of conducting manual factor construction based on traditional and
behavioural finance analysis, academic researchers and quantitative investment
managers have leveraged Genetic Programming (GP) as an automatic feature
construction tool in recent years, which builds reverse polish mathematical
expressions from trading data into new factors. However, with the development
of deep learning, more powerful feature extraction tools are available. This
paper proposes Neural Network-based Automatic Factor Construction (NNAFC), a
tailored neural network framework that can automatically construct diversified
financial factors based on financial domain knowledge and a variety of neural
network structures. The experiment results show that NNAFC can construct more
informative and diversified factors than GP, to effectively enrich the current
factor pool. For the current market, both fully connected and recurrent neural
network structures are better at extracting information from financial time
series than convolution neural network structures. Moreover, new factors
constructed by NNAFC can always improve the return, Sharpe ratio, and the max
draw-down of a multi-factor quantitative investment strategy due to their
introducing more information and diversification to the existing factor pool.
","[{""version"":""v1"",""created"":""Fri, 14 Aug 2020 07:44:49 GMT""},{""version"":""v2"",""created"":""Sat, 3 Oct 2020 16:20:53 GMT""},{""version"":""v3"",""created"":""Tue, 13 Oct 2020 16:20:18 GMT""}]","2020-10-14"
"2008.06226","Xianghui Yang","Xianghui Yang, Bairun Wang, Kaige Chen, Xinchi Zhou, Shuai Yi, Wanli
  Ouyang, Luping Zhou","BriNet: Towards Bridging the Intra-class and Inter-class Gaps in
  One-Shot Segmentation","14 pages, 6 figures, BMVC2020(Oral)",,,,"cs.CV","http://arxiv.org/licenses/nonexclusive-distrib/1.0/","  Few-shot segmentation focuses on the generalization of models to segment
unseen object instances with limited training samples. Although tremendous
improvements have been achieved, existing methods are still constrained by two
factors. (1) The information interaction between query and support images is
not adequate, leaving intra-class gap. (2) The object categories at the
training and inference stages have no overlap, leaving the inter-class gap.
Thus, we propose a framework, BriNet, to bridge these gaps. First, more
information interactions are encouraged between the extracted features of the
query and support images, i.e., using an Information Exchange Module to
emphasize the common objects. Furthermore, to precisely localize the query
objects, we design a multi-path fine-grained strategy which is able to make
better use of the support feature representations. Second, a new online
refinement strategy is proposed to help the trained model adapt to unseen
classes, achieved by switching the roles of the query and the support images at
the inference stage. The effectiveness of our framework is demonstrated by
experimental results, which outperforms other competitive methods and leads to
a new state-of-the-art on both PASCAL VOC and MSCOCO dataset.
","[{""version"":""v1"",""created"":""Fri, 14 Aug 2020 07:45:50 GMT""}]","2021-10-26"
"2008.06227","Alexandros-Apostolos Boulogeorgos","Evangelos N. Papasotiriou, Alexandros-Apostolos A. Boulogeorgos,
  Antigone Stratakou, and Angeliki Alexiou","Performance Evaluation of Reconfigurable Intelligent Surface Assisted
  D-band Wireless Communication","6 pages, 5 figures, accepted for presentation in IEEE 5G World Forum
  2020",,,,"eess.SP","http://arxiv.org/licenses/nonexclusive-distrib/1.0/","  In the recent years, the proliferation of wireless data traffic has led the
scientific community to explore the use of higher unallocated frequency bands,
such as the millimeter wave and terahertz (0.1-10 THz) bands. However, they are
prone to blockages from obstacles laid in the transceiver path. To address
this, in this work, the use of a reconfigurable-intelligent-surface (RIS) to
restore the link between a transmitter (TX) and a receiver (RX), operating in
the D-band (110-170 GHz) is investigated. The system performance is evaluated
in terms of pathgain and capacity considering the RIS design parameters, the
TX/RX-RIS distance and the elevation angles from the center of the RIS to the
transceivers.
","[{""version"":""v1"",""created"":""Fri, 14 Aug 2020 07:46:56 GMT""}]","2020-08-17"
"2008.06228","Farhan Musanna","Farhan Musanna and Sanjeev Kumar","A novel three party Quantum secret sharing scheme based on Bell state
  sequential measurements with application in quantum image sharing",,,,,"quant-ph cs.CR","http://arxiv.org/licenses/nonexclusive-distrib/1.0/","  In this work, we present a quantum secret sharing scheme based on Bell state
entanglement and sequential projection measurements. The protocol verifies the
$n$ out of $n$ scheme and supports the aborting of the protocol in case all the
parties do not divulge in their valid measurement outcomes. The operator-qubit
pair forms an integral part of the scheme determining the classical secret to
be shared. The protocol is robust enough to neutralize any eavesdropping on a
particular qubit of the dealer. The experimental demonstration of the scheme is
done on IBM-QE cloud platform with backends \texttt{IBMQ\_16\_Melbourne} and
\texttt{IBMQ\_QASM\_SIMULATOR\_V0.1.547} simulator. The security analysis
performed on the scheme and the comparative analysis supports our claim of a
stringent and an efficient scheme as compared to some recent quantum and
semi-quantum techniques of secret sharing.
","[{""version"":""v1"",""created"":""Fri, 14 Aug 2020 07:50:35 GMT""}]","2020-08-17"
"2008.06229","Varun Sundar","Varun Sundar, Sumanth Hegde, Divya Kothandaraman and Kaushik Mitra","Deep Atrous Guided Filter for Image Restoration in Under Display Cameras","To appear in ECCV 2020 RLQ Workshop. Supplementary material attached.
  For project website, see
  https://varun19299.github.io/deep-atrous-guided-filter/",,,,"cs.CV","http://arxiv.org/licenses/nonexclusive-distrib/1.0/","  Under Display Cameras present a promising opportunity for phone manufacturers
to achieve bezel-free displays by positioning the camera behind
semi-transparent OLED screens. Unfortunately, such imaging systems suffer from
severe image degradation due to light attenuation and diffraction effects. In
this work, we present Deep Atrous Guided Filter (DAGF), a two-stage, end-to-end
approach for image restoration in UDC systems. A Low-Resolution Network first
restores image quality at low-resolution, which is subsequently used by the
Guided Filter Network as a filtering input to produce a high-resolution output.
Besides the initial downsampling, our low-resolution network uses multiple,
parallel atrous convolutions to preserve spatial resolution and emulates
multi-scale processing. Our approach's ability to directly train on megapixel
images results in significant performance improvement. We additionally propose
a simple simulation scheme to pre-train our model and boost performance. Our
overall framework ranks 2nd and 5th in the RLQ-TOD'20 UDC Challenge for POLED
and TOLED displays, respectively.
","[{""version"":""v1"",""created"":""Fri, 14 Aug 2020 07:54:52 GMT""},{""version"":""v2"",""created"":""Tue, 1 Sep 2020 06:15:45 GMT""}]","2020-09-02"
