"2008.06317","Subhamoy Maitra","Chandra Sekhar Mukherjee, Subhamoy Maitra","Exact Quantum Query Algorithms Outperforming Parity -- Beyond The
  Symmetric functions","22 pages, modified the presentation",,,,"quant-ph cs.CC","http://arxiv.org/licenses/nonexclusive-distrib/1.0/","  In Exact Quantum Query model, almost all of the Boolean functions for which
non-trivial query algorithms exist are symmetric in nature. The most well known
techniques in this domain exploit parity decision trees, in which the parity of
two bits can be obtained by a single query. Thus, exact quantum query
algorithms outperforming parity decision trees are rare. In this paper we first
obtain optimal exact quantum query algorithms ($Q_{algo}(f)$) for a direct sum
based class of $\Omega \left( 2^{\frac{\sqrt{n}}{2}} \right)$ non-symmetric
functions. We construct these algorithms by analyzing the algebraic normal form
together with a novel untangling strategy. Next we obtain the generalized
parity decision tree complexity ($D_{\oplus}(f)$) analysing the Walsh Spectrum.
Finally, we show that query complexity of $Q_{algo}$ is $\lceil \frac{3n}{4}
\rceil$ whereas $D_{\oplus}(f)$ varies between $n-1$ and $\lceil \frac{3n}{4}
\rceil+1$ for different classes, underlining linear separation between the two
measures in many cases. To the best of our knowledge, this is the first family
of algorithms beyond generalized parity (and thus parity) for a large class of
non-symmetric functions. We also implement these techniques for a larger
(doubly exponential in $\frac{n}{4}$) class of Maiorana-McFarland type
functions, but could only obtain partial results using similar algorithmic
techniques.
","[{""version"":""v1"",""created"":""Fri, 14 Aug 2020 12:17:48 GMT""},{""version"":""v2"",""created"":""Mon, 17 Aug 2020 06:25:37 GMT""},{""version"":""v3"",""created"":""Mon, 21 Sep 2020 18:31:58 GMT""},{""version"":""v4"",""created"":""Wed, 10 Mar 2021 09:29:37 GMT""},{""version"":""v5"",""created"":""Sun, 16 May 2021 13:35:55 GMT""}]","2021-05-18"
"2008.06318","Aishah Alsehaim","Toby P. Breckon and Aishah Alsehaim","Not 3D Re-ID: a Simple Single Stream 2D Convolution for Robust Video
  Re-identification","have been submitted to ICPR 2020 and has been ACCEPTED for
  presentation and inclusion in the proceedings",,,,"cs.CV","http://arxiv.org/licenses/nonexclusive-distrib/1.0/","  Video-based person re-identification has received increasing attention
recently, as it plays an important role within surveillance video analysis.
Video-based Re-ID is an expansion of earlier image-based re-identification
methods by learning features from a video via multiple image frames for each
person. Most contemporary video Re-ID methods utilise complex CNNbased network
architectures using 3D convolution or multibranch networks to extract
spatial-temporal video features. By contrast, in this paper, we illustrate
superior performance from a simple single stream 2D convolution network
leveraging the ResNet50-IBN architecture to extract frame-level features
followed by temporal attention for clip level features. These clip level
features can be generalised to extract video level features by averaging
without any significant additional cost. Our approach uses best video Re-ID
practice and transfer learning between datasets to outperform existing
state-of-the-art approaches on the MARS, PRID2011 and iLIDS-VID datasets with
89:62%, 97:75%, 97:33% rank-1 accuracy respectively and with 84:61% mAP for
MARS, without reliance on complex and memory intensive 3D convolutions or
multi-stream networks architectures as found in other contemporary work.
Conversely, our work shows that global features extracted by the 2D convolution
network are a sufficient representation for robust state of the art video
Re-ID.
","[{""version"":""v1"",""created"":""Fri, 14 Aug 2020 12:19:32 GMT""},{""version"":""v2"",""created"":""Mon, 17 Aug 2020 10:49:24 GMT""}]","2020-08-18"
"2008.06319","Christian Hubbs","Christian D. Hubbs and Hector D. Perez and Owais Sarwar and Nikolaos
  V. Sahinidis and Ignacio E. Grossmann and John M. Wassick","OR-Gym: A Reinforcement Learning Library for Operations Research
  Problems","29 pages, 10 figures",,,,"cs.AI cs.LG","http://arxiv.org/licenses/nonexclusive-distrib/1.0/","  Reinforcement learning (RL) has been widely applied to game-playing and
surpassed the best human-level performance in many domains, yet there are few
use-cases in industrial or commercial settings. We introduce OR-Gym, an
open-source library for developing reinforcement learning algorithms to address
operations research problems. In this paper, we apply reinforcement learning to
the knapsack, multi-dimensional bin packing, multi-echelon supply chain, and
multi-period asset allocation model problems, as well as benchmark the RL
solutions against MILP and heuristic models. These problems are used in
logistics, finance, engineering, and are common in many business operation
settings. We develop environments based on prototypical models in the
literature and implement various optimization and heuristic models in order to
benchmark the RL results. By re-framing a series of classic optimization
problems as RL tasks, we seek to provide a new tool for the operations research
community, while also opening those in the RL community to many of the problems
and challenges in the OR field.
","[{""version"":""v1"",""created"":""Fri, 14 Aug 2020 12:21:22 GMT""},{""version"":""v2"",""created"":""Sat, 17 Oct 2020 11:58:49 GMT""}]","2020-10-20"
"2008.06320","Denggao Lai","Deng-Gao Lai, Xin Wang, Wei Qin, Bang-Pin Hou, Franco Nori, and
  Jie-Qiao Liao","Tunable optomechanically induced transparency by controlling the
  dark-mode effect","14 pages, 7 figures","Phys. Rev. A 102, 023707, Published 12 August 2020","10.1103/PhysRevA.102.023707",,"quant-ph","http://arxiv.org/licenses/nonexclusive-distrib/1.0/","  We study tunable optomechanically induced transparency by controlling the
dark-mode effect induced by two mechanical modes coupled to a common cavity
field. This is realized by introducing a phase-dependent phonon-exchange
interaction, which is used to form a loop-coupled configuration. Combining this
phase-dependent coupling with the optomechanical interactions, the dark-mode
effect can be controlled by the quantum interference effect. In particular, the
dark-mode effect in this two-mechanical-mode optomechanical system can lead to
a double-amplified optomechanically induced transparency (OMIT) window and a
higher efficiency of the second-order sideband in comparison with the standard
optomechanical system. This is because the effective mechanical decay rate
related to the linewidth of the OMIT window becomes a twofold increase in the
weak-coupling limit. When the dark-mode effect is broken, controllable double
transparency windows appear and the second-order sideband, as well as the light
delay or advance, is significantly enhanced. For an N-mechanical-mode
optomechanical system, we find that in the presence of the dark-mode effect,
the amplification multiple of the linewidth of the OMIT window is nearly
proportional to the number of mechanical modes, and that the OMIT with a single
window becomes the one with N tunable windows by breaking the dark-mode effect.
The study will be useful in optical information storage within a
large-frequency bandwidth and multichannel optical communication based on
optomechanical systems.
","[{""version"":""v1"",""created"":""Fri, 14 Aug 2020 12:22:56 GMT""}]","2020-08-17"
"2008.06321","Gerd R\""opke","G. R\""opke, J. B. Natowitz, H. Pais","Light element ($Z=1,2$) production from spontaneous ternary fission of
  $^{252}$Cf","13 pages, 1 figure",,"10.1140/epja/s10050-020-00247-0",,"nucl-th","http://arxiv.org/licenses/nonexclusive-distrib/1.0/","  The yields of light elements ($Z=1,2$) obtained from spontaneous ternary
fission of $^{252}$Cf are treated within a nonequilibrium approach, and the
contribution of unstable nuclei and excited bound states is taken into account.
These light cluster yields may be used to probe dense matter, and to infer
in-medium corrections. Continuum correlations are calculated from scattering
phase shifts using the Beth-Uhlenbeck formula, and the effect of medium
modification is estimated. The relevant distribution is reconstructed from the
measured yields of isotopes. This describes the state of the nucleon system at
scission and cluster formation, using only three Lagrange parameters which are
the nonequilibrium counterparts of the temperature and chemical potentials, as
defined in thermodynamic equilibrium. We concluded that a simple nuclear
statistical equilibrium model neglecting continuum correlations and medium
effects is not able to describe the measured distribution of H and He isotopes.
Moreover, the freeze-out concept may serve as an important ingredient to the
nonequilibrium approach using the relevant statistical operator concept.
","[{""version"":""v1"",""created"":""Fri, 14 Aug 2020 12:29:35 GMT""}]","2020-10-28"
"2008.06322","Etsuko Itou","Kei Iida, Etsuko Itou and Tong-Gyu Lee","Relative scale setting for two-color QCD with Nf=2 Wilson fermions","21pages, 5 figures",,,,"hep-lat","http://arxiv.org/licenses/nonexclusive-distrib/1.0/","  We determine the scale setting function and the pseudo-critical temperature
on the lattice in $N_f=2$ two-color QCD using the Iwasaki gauge and Wilson
fermion actions. Although two-color QCD does not correspond to the real world,
it is very useful as a good testing ground for three-color QCD. The scale
setting function gives the relative lattice spacings of simulations performed
at different values of the bare coupling. It is a necessary tool for taking the
continuum limit. Firstly, we measure the meson spectra for various combinations
of ($\beta,\kappa$) and find a line of constant physics in $\beta$--$\kappa$
plane. Next, we determine the scale setting function via $w_0$ scale in the
gradient flow method. Furthermore, we estimate the pseudo-critical temperature
at zero chemical potential from the chiral susceptibility. Combining these
results, we can discuss the QCD phase diagram in which both axes are given by
dimensionless quantities, namely, the temperature normalized by the
pseudo-critical temperature on the lattice and the chemical potential
normalized by the pseudoscalar meson mass. It makes it easy to compare among
several lattice studies and also makes it possible to compare theoretical
analyses and lattice studies in the continuum limit.
","[{""version"":""v1"",""created"":""Fri, 14 Aug 2020 12:29:54 GMT""}]","2020-08-17"
"2008.06323","Andronikos Paliathanasis","Andronikos Paliathanasis and P.G.L. Leach","Symmetry Analysis for a Fourth-order Noise-reduction Partial
  Differential Equation","10 pages, no figures",,,,"nlin.SI math.AP","http://arxiv.org/licenses/nonexclusive-distrib/1.0/","  We apply the theory of Lie symmetries in order to study a fourth-order $1+2$
evolutionary partial differential equation which has been proposed for the
image processing noise reduction. In particular we determine the Lie point
symmetries for the specific 1+2 partial differential equations and we apply the
invariant functions to determine similarity solutions. For the static solutions
we observe that the reduced fourth-order ordinary differential equations are
reduced to second-order ordinary differential equations which are maximally
symmetric. Finally, nonstatic closed-form solutions are also determined.
","[{""version"":""v1"",""created"":""Fri, 14 Aug 2020 12:30:22 GMT""}]","2020-08-17"
"2008.06324","David Gerard-Varet","David Gerard-Varet","Derivation of Batchelor-Green formula for random suspensions","34 pages. Final version. To appear in J. Math. Pures Appl",,,,"math.AP","http://arxiv.org/licenses/nonexclusive-distrib/1.0/","  This paper is dedicated to the effective viscosity of suspensions without
inertia, at low solid volume fraction $\phi$. The goal is to derive rigorously
a $o(\phi^2)$ formula for the effective viscosity. In previous works, such
formula was given for rigid spheres satisfying the strong separation assumption
$ d_{min} \ge c \phi^{-\frac13} r$, where $d_{min}$ is the minimal distance
between the spheres and $r$ their radius. It was then applied to both periodic
and random configurations with separation, to yield explicit values for the
$O(\phi^2)$ coefficient. We consider here complementary (and certainly more
realistic) random configurations, satisfying soft assumptions of separation and
long range decorrelation. We justify in this setting the famous Batchelor-Green
formula. Our result applies for instance to hardcore Poisson point process with
almost minimal hardcore assumption $d_{min} > (2+\epsilon) r$, $\epsilon > 0$.
","[{""version"":""v1"",""created"":""Fri, 14 Aug 2020 12:32:53 GMT""},{""version"":""v2"",""created"":""Thu, 3 Sep 2020 16:06:50 GMT""},{""version"":""v3"",""created"":""Tue, 22 Dec 2020 10:14:07 GMT""},{""version"":""v4"",""created"":""Sun, 14 Mar 2021 18:01:25 GMT""}]","2021-03-16"
"2008.06325","Victor Snaith Prof","Victor Snaith","Derived Langlands IV:Notes on ${\mathcal M}_{c}(G)$-induced
  representations",,,,,"math.RT","http://arxiv.org/licenses/nonexclusive-distrib/1.0/","  This is Part IV of a thematic series currently consisting of a monograph and
four essays. This essay examines the form of induced representations of locally
p-adic Lie groups G which is appropriate for the abelian category of ${\mathcal
M}_{c}(G)$-admissible representations. In my non-expert manner, I prove the
analogue of Jacquet's Theorem in this category. The final section consists of
observations and questions related to this and other concepts introduced in the
course of this series.
","[{""version"":""v1"",""created"":""Fri, 14 Aug 2020 12:34:33 GMT""}]","2020-08-17"
"2008.06326","Shashank Gupta","Shashank Gupta, Antonio Robles-Kelly and Mohamed Reda Bouadjenek","Feature Extraction Functions for Neural Logic Rule Learning","to be published in S+SSPR 2020 proceedings",,,,"cs.AI cs.LG","http://arxiv.org/licenses/nonexclusive-distrib/1.0/","  Combining symbolic human knowledge with neural networks provides a rule-based
ante-hoc explanation of the output. In this paper, we propose feature
extracting functions for integrating human knowledge abstracted as logic rules
into the predictive behavior of a neural network. These functions are embodied
as programming functions, which represent the applicable domain knowledge as a
set of logical instructions and provide a modified distribution of independent
features on input data. Unlike other existing neural logic approaches, the
programmatic nature of these functions implies that they do not require any
kind of special mathematical encoding, which makes our method very general and
flexible in nature. We illustrate the performance of our approach for sentiment
classification and compare our results to those obtained using two baselines.
","[{""version"":""v1"",""created"":""Fri, 14 Aug 2020 12:35:07 GMT""},{""version"":""v2"",""created"":""Tue, 6 Apr 2021 13:01:02 GMT""},{""version"":""v3"",""created"":""Wed, 7 Apr 2021 13:05:17 GMT""},{""version"":""v4"",""created"":""Sun, 11 Apr 2021 06:15:17 GMT""}]","2021-04-13"
"2008.06327","Ji\v{r}\'i Dvo\v{r}\'ak","Ji\v{r}\'i Dvo\v{r}\'ak and Tom\'a\v{s} Mrkvi\v{c}ka","Graphical tests of independence for general distributions",,,"10.1007/s00180-021-01134-y",,"stat.ME","http://arxiv.org/licenses/nonexclusive-distrib/1.0/","  We propose two model-free, permutation-based tests of independence between a
pair of random variables. The tests can be applied to samples from any
bivariate distribution: continuous, discrete or mixture of those, with light
tails or heavy tails, \ldots The tests take advantage of the recent development
of the global envelope tests in the context of spatial statistics. Apart from
the broad applicability of the tests, their main benefit lies in the graphical
interpretation of the test outcome: in case of rejection of the null hypothesis
of independence, the combinations of quantiles in the two marginals are
indicated for which the deviation from independence is significant. This
information can be used to gain more insight into the properties of the
observed data and as a guidance for proposing more complicated models and
hypotheses. We assess the performance of the proposed tests in a simulation
study and compare them to several well-established tests of independence.
Furthermore, we illustrate the use of the tests and the interpretation of the
test outcome in two real datasets consisting of meteorological reports (daily
mean temperature and total daily precipitation, having an atomic component at 0
millimeters) and road accidents reports (type of road and the weather
conditions, both variables having categorical distribution).
","[{""version"":""v1"",""created"":""Fri, 14 Aug 2020 12:37:50 GMT""}]","2022-05-16"
"2008.06329","Simon Becker","Simon Becker, Rui Han, Svetlana Jitomirskaya and Maciej Zworski","Honeycomb structures in magnetic fields",,,,,"math-ph math.MP math.SP quant-ph","http://arxiv.org/licenses/nonexclusive-distrib/1.0/","  We consider reduced-dimensionality models of honeycomb lattices in magnetic
fields and report results about the spectrum, the density of states,
self-similarity, and metal/insulator transitions under disorder. We perform a
spectral analysis by which we discover a fractal Cantor spectrum for irrational
magnetic flux through a honeycomb, prove the existence of zero energy Dirac
cones for each rational flux, obtain an explicit expansion of the density of
states near the conical points, and show the existence of mobility edges under
Anderson-type disorder. Our results give a precise description of de Haas-van
Alphen and Quantum Hall effects, and provide quantitative estimates on
transport properties. In particular, our findings explain experimentally
observed asymmetry phenomena by going beyond the perfect cone approximation.
","[{""version"":""v1"",""created"":""Fri, 14 Aug 2020 12:40:23 GMT""}]","2020-08-17"
"2008.06339","Vladislav Kuidin","Victor Zalipaev, Vladislav Kuidin","Semiclassical approach for excitonic spectrum of Coulomb coupling
  between two Dirac particles",,,"10.1098/rspa.2021.0098",,"cond-mat.mes-hall","http://arxiv.org/licenses/nonexclusive-distrib/1.0/","  The properties of energy spectrum of excitons in monolayer transition metal
dichalcogenides are investigated using a multiband model. In the multiband
model we use the excitonic Hamiltonian in the product base of the Dirac
single-particle states at the conduction and valence band edges. Following the
separation of variables we decouple the corresponding energy eigenvalue system
of the first order ODE radial equations rigorously and solve the resulting the
second order ODE self-consistently, using the finite difference method, thus we
determine the energy eigenvalues of the discrete excitonic spectrum and the
corresponding wave functions. We also developed WKB approach to solve the same
spectral problem in semiclassical aproximation for the resulting ODE. We
compare the results for the energy spectrum and the corresponding
eigen-functions forms for WS2 and WSe2 obtained by means of both methods. We
also compare our results for the energy spectrum with other theoretical works
for excitons, and with available experimental data.
","[{""version"":""v1"",""created"":""Fri, 14 Aug 2020 12:44:26 GMT""}]","2021-08-04"
"2008.06343","Muhammad Sohaib Solaija","Muhammad Sohaib J. Solaija, Hanadi Salman, Abuu B. Kihero, Mehmet
  Izzet Saglam and Huseyin Arslan","Generalized Coordinated Multipoint Framework for 5G and Beyond","11 pages, 7 figures",,"10.1109/ACCESS.2021.3079190",,"eess.SP","http://arxiv.org/licenses/nonexclusive-distrib/1.0/","  The characteristic feature of 5G is the diversity of its services for
different user needs. However, the requirements for these services are
competing in nature, which impresses the necessity of a coordinated and
flexible network architecture. Although coordinated multipoint (CoMP) systems
were primarily proposed to improve the cell edge performance in 4G, their
collaborative nature can be leveraged to support the diverse requirements and
enabling technologies of 5G and beyond networks. To this end, we propose
generalization of CoMP to a proactive and efficient resource utilization
framework capable of supporting different user requirements such as
reliability, latency, throughput, and security while considering network
constraints. This article elaborates on the multiple aspects, inputs, and
outputs of the generalized CoMP (GCoMP) framework. Apart from user
requirements, the GCoMP decision mechanism also considers the CoMP scenario and
network architecture to decide upon outputs such as CoMP technique or
appropriate coordinating clusters. To enable easier understanding of the
concept, popular use cases, such as vehicle-to-everything (V2X) communication
and eHealth, are studied. Additionally, interesting challenges and open areas
in GCoMP are discussed.
","[{""version"":""v1"",""created"":""Fri, 14 Aug 2020 12:46:47 GMT""}]","2021-10-19"
"2008.06347","Kevin Burke Dr","Kevin Burke, B. Ross Barmish","A Data-Driven Control-Theoretic Paradigm for Pandemic Mitigation with
  Application to Covid-19","14 pages, 6 figures",,,,"q-bio.PE q-bio.QM","http://arxiv.org/licenses/nonexclusive-distrib/1.0/","  In this paper, we introduce a new control-theoretic paradigm for mitigating
the spread of a virus. To this end, our discrete-time controller, aims to
reduce the number of new daily deaths, and consequently, the cumulative number
of deaths. In contrast to much of the existing literature, we do not rely on a
potentially complex virus transmission model whose equations must be customized
to the ""particulars"" of the pandemic at hand. For new viruses such as Covid-19,
the epidemiology driving the modelling process may not be well known and model
estimation with limited data may be unreliable. With this motivation in mind,
the new paradigm described here is data-driven and, to a large extent, we avoid
modelling difficulties by concentrating on just two key quantities which are
common to pandemics: the doubling time, denoted by $d(k)$ and the peak day
denoted by $\theta(k)$. Our numerical studies to date suggest that our
appealingly simple model can provide a reasonable fit to real data. Given that
time is of the essence during the ongoing global health crisis, the intent of
this paper is to introduce this new paradigm to control practitioners and
describe a number of new research directions suggested by our current results.
","[{""version"":""v1"",""created"":""Fri, 14 Aug 2020 12:54:28 GMT""}]","2020-08-17"
"2008.06349","Henrik Pedersen L.","Christian Berg and Henrik L. Pedersen","A family of Horn-Bernstein functions","14 pages references updated",,,,"math.CA","http://arxiv.org/licenses/nonexclusive-distrib/1.0/","  A family of recently investigated Bernstein functions is revisited and those
functions for which the derivatives are logarithmically completely monotonic
are identified. This leads to the definition of a class of Bernstein functions,
which we propose to call Horn-Bernstein functions because of the results of
Roger A. Horn.
","[{""version"":""v1"",""created"":""Fri, 14 Aug 2020 13:00:38 GMT""},{""version"":""v2"",""created"":""Tue, 22 Dec 2020 09:05:26 GMT""}]","2020-12-23"
"2008.06350","Viera \v{C}er\v{n}anov\'a","Viera \v{C}er\v{n}anov\'a (Department of Mathematics and Computer
  Science, Faculty of Education, Trnava University, Trnava, Slovakia)","On a Fabric of Kissing Circles","10 pages, 16 figures. Some changes in exposition. The article will
  appear in Bulletin of the Australian Mathematical Society",,"10.1017/S0004972720001367",,"math.MG","http://arxiv.org/licenses/nonexclusive-distrib/1.0/","  Applying circle inversion on a square grid filled with circles, we obtain a
configuration that we call a fabric of kissing circles. The configuration and
its components, which are two orthogonal frames and two orthogonal families of
chains, are in some way connected to classical geometric configurations such as
the arbelos or the Pappus chain, or the Apollonian packing from the 20th
century.
  In this paper, we build the fabric and list some of the obvious properties
that result from this construction. Next, we focus on the curvature inside the
individual components: we show that the curvatures of the frame circles form a
doubly infinite arithmetic sequence (bi-sequence), whereas the curvatures of
the circles of each chain are arranged in a quadratic bi-sequence. Because
solving geometric sangaku problems was a gateway to our discovery of the
fabric, we conclude this paper with two sangaku problems and their solutions
using our results on curvatures.
","[{""version"":""v1"",""created"":""Fri, 14 Aug 2020 13:05:27 GMT""},{""version"":""v2"",""created"":""Tue, 20 Oct 2020 21:43:00 GMT""}]","2021-01-13"
"2008.06351","Richard Moot","Richard Moot","Partial Orders, Residuation, and First-Order Linear Logic","33 pages",,,,"cs.LO cs.CL math.LO","http://arxiv.org/licenses/nonexclusive-distrib/1.0/","  We will investigate proof-theoretic and linguistic aspects of first-order
linear logic. We will show that adding partial order constraints in such a way
that each sequent defines a unique linear order on the antecedent formulas of a
sequent allows us to define many useful logical operators. In addition, the
partial order constraints improve the efficiency of proof search.
","[{""version"":""v1"",""created"":""Fri, 14 Aug 2020 13:06:21 GMT""}]","2020-08-17"
