"2008.06096","William Sutcliffe","Belle II Collaboration: F. Abudin\'en, I. Adachi, R. Adak, K.
  Adamczyk, P. Ahlburg, J. K. Ahn, H. Aihara, N. Akopov, A. Aloisio, F. Ameli,
  L. Andricek, N. Anh Ky, D. M. Asner, H. Atmacan, V. Aulchenko, T. Aushev, V.
  Aushev, T. Aziz, V. Babu, S. Bacher, S. Baehr, S. Bahinipati, A. M. Bakich,
  P. Bambade, Sw. Banerjee, S. Bansal, M. Barrett, G. Batignani, J. Baudot, A.
  Beaulieu, J. Becker, P. K. Behera, M. Bender, J. V. Bennett, E. Bernieri, F.
  U. Bernlochner, M. Bertemes, M. Bessner, S. Bettarini, V. Bhardwaj, B.
  Bhuyan, F. Bianchi, T. Bilka, S. Bilokin, D. Biswas, A. Bobrov, A. Bondar, G.
  Bonvicini, A. Bozek, M. Bra\v{c}ko, P. Branchini, N. Braun, R. A. Briere, T.
  E. Browder, D. N. Brown, A. Budano, L. Burmistrov, S. Bussino, M. Campajola,
  L. Cao, G. Caria, G. Casarosa, C. Cecchi, D. \v{C}ervenkov, M.-C. Chang, P.
  Chang, R. Cheaib, V. Chekelian, C. Chen, Y. Q. Chen, Y.-T. Chen, B. G. Cheon,
  K. Chilikin, K. Chirapatpimol, H.-E. Cho, K. Cho, S.-J. Cho, S.-K. Choi, S.
  Choudhury, D. Cinabro, L. Corona, L. M. Cremaldi, D. Cuesta, S. Cunliffe, T.
  Czank, N. Dash, F. Dattola, E. De La Cruz-Burelo, G. De Nardo, M. De Nuccio,
  G. De Pietro, R. de Sangro, B. Deschamps, M. Destefanis, S. Dey, A. De
  Yta-Hernandez, A. Di Canto, F. Di Capua, S. Di Carlo, J. Dingfelder, Z.
  Dole\v{z}al, I. Dom\'inguez Jim\'enez, T. V. Dong, K. Dort, D. Dossett, S.
  Dubey, S. Duell, G. Dujany, S. Eidelman, M. Eliachevitch, D. Epifanov, J. E.
  Fast, T. Ferber, D. Ferlewicz, G. Finocchiaro, S. Fiore, P. Fischer, A.
  Fodor, F. Forti, A. Frey, M. Friedl, B. G. Fulsom, M. Gabriel, N. Gabyshev,
  E. Ganiev, M. Garcia-Hernandez, R. Garg, A. Garmash, V. Gaur, A. Gaz, U.
  Gebauer, M. Gelb, A. Gellrich, J. Gemmler, T. Ge{\ss}ler, D. Getzkow, R.
  Giordano, A. Giri, A. Glazov, B. Gobbo, R. Godang, P. Goldenzweig, B. Golob,
  P. Gomis, P. Grace, W. Gradl, E. Graziani, D. Greenwald, Y. Guan, C.
  Hadjivasiliou, S. Halder, K. Hara, T. Hara, O. Hartbrich, T. Hauth, K.
  Hayasaka, H. Hayashii, C. Hearty, M. Heck, M. T. Hedges, I. Heredia de la
  Cruz, M. Hern\'andez Villanueva, A. Hershenhorn, T. Higuchi, E. C. Hill, H.
  Hirata, M. Hoek, M. Hohmann, S. Hollitt, T. Hotta, C.-L. Hsu, Y. Hu, K.
  Huang, T. Iijima, K. Inami, G. Inguglia, J. Irakkathil Jabbar, A. Ishikawa,
  R. Itoh, M. Iwasaki, Y. Iwasaki, S. Iwata, P. Jackson, W. W. Jacobs, I.
  Jaegle, D. E. Jaffe, E.-J. Jang, M. Jeandron, H. B. Jeon, S. Jia, Y. Jin, C.
  Joo, K. K. Joo, I. Kadenko, J. Kahn, H. Kakuno, A. B. Kaliyar, J. Kandra, K.
  H. Kang, P. Kapusta, R. Karl, G. Karyan, Y. Kato, H. Kawai, T. Kawasaki, T.
  Keck, C. Ketter, H. Kichimi, C. Kiesling, B. H. Kim, C.-H. Kim, D. Y. Kim, H.
  J. Kim, J. B. Kim, K.-H. Kim, K. Kim, S.-H. Kim, Y.-K. Kim, Y. Kim, T. D.
  Kimmel, H. Kindo, K. Kinoshita, B. Kirby, C. Kleinwort, B. Knysh, P.
  Kody\v{s}, T. Koga, S. Kohani, I. Komarov, T. Konno, S. Korpar, N. Kovalchuk,
  T. M. G. Kraetzschmar, P. Kri\v{z}an, R. Kroeger, J. F. Krohn, P. Krokovny,
  H. Kr\""uger, W. Kuehn, T. Kuhr, J. Kumar, M. Kumar, R. Kumar, K. Kumara, T.
  Kumita, T. Kunigo, M. K\""unzel, S. Kurz, A. Kuzmin, P. Kvasni\v{c}ka, Y.-J.
  Kwon, S. Lacaprara, Y.-T. Lai, C. La Licata, K. Lalwani, L. Lanceri, J. S.
  Lange, K. Lautenbach, P. J. Laycock, F. R. Le Diberder, I.-S. Lee, S. C. Lee,
  P. Leitl, D. Levit, P. M. Lewis, C. Li, L. K. Li, S. X. Li, Y. M. Li, Y. B.
  Li, J. Libby, K. Lieret, L. Li Gioi, J. Lin, Z. Liptak, Q. Y. Liu, Z. A. Liu,
  D. Liventsev, S. Longo, A. Loos, P. Lu, M. Lubej, T. Lueck, F. Luetticke, T.
  Luo, C. MacQueen, Y. Maeda, M. Maggiora, S. Maity, R. Manfredi, E. Manoni, S.
  Marcello, C. Marinas, A. Martini, M. Masuda, T. Matsuda, K. Matsuoka, D.
  Matvienko, J. McNeil, F. Meggendorfer, J. C. Mei, F. Meier, M. Merola, F.
  Metzner, M. Milesi, C. Miller, K. Miyabayashi, H. Miyake, H. Miyata, R.
  Mizuk, K. Azmi, G. B. Mohanty, H. Moon, T. Moon, J. A. Mora Grimaldo, A.
  Morda, T. Morii, H.-G. Moser, M. Mrvar, F. Mueller, F. J. M\""uller, Th.
  Muller, G. Muroyama, C. Murphy, R. Mussa, K. Nakagiri, I. Nakamura, K. R.
  Nakamura, E. Nakano, M. Nakao, H. Nakayama, H. Nakazawa, T. Nanut, Z.
  Natkaniec, A. Natochii, M. Nayak, G. Nazaryan, D. Neverov, C. Niebuhr, M.
  Niiyama, J. Ninkovic, N. K. Nisar, S. Nishida, K. Nishimura, M. Nishimura, M.
  H. A. Nouxman, B. Oberhof, K. Ogawa, S. Ogawa, S. L. Olsen, Y. Onishchuk, H.
  Ono, Y. Onuki, P. Oskin, E. R. Oxford, H. Ozaki, P. Pakhlov, G. Pakhlova, A.
  Paladino, T. Pang, A. Panta, E. Paoloni, S. Pardi, C. Park, H. Park, S.-H.
  Park, B. Paschen, A. Passeri, A. Pathak, S. Patra, S. Paul, T. K. Pedlar, I.
  Peruzzi, R. Peschke, R. Pestotnik, M. Piccolo, L. E. Piilonen, P. L. M.
  Podesta-Lerma, G. Polat, V. Popov, C. Praz, E. Prencipe, M. T. Prim, M. V.
  Purohit, N. Rad, P. Rados, R. Rasheed, M. Reif, S. Reiter, M. Remnev, P. K.
  Resmi, I. Ripp-Baudot, M. Ritter, M. Ritzert, G. Rizzo, L. B. Rizzuto, S. H.
  Robertson, D. Rodr\'iguez P\'erez, J. M. Roney, C. Rosenfeld, A. Rostomyan,
  N. Rout, M. Rozanska, G. Russo, D. Sahoo, Y. Sakai, D. A. Sanders, S.
  Sandilya, A. Sangal, L. Santelj, P. Sartori, J. Sasaki, Y. Sato, V. Savinov,
  B. Scavino, M. Schram, H. Schreeck, J. Schueler, C. Schwanda, A. J. Schwartz,
  B. Schwenker, R. M. Seddon, Y. Seino, A. Selce, K. Senyo, I. S. Seong, J.
  Serrano, M. E. Sevior, C. Sfienti, V. Shebalin, C. P. Shen, H. Shibuya, J.-G.
  Shiu, B. Shwartz, A. Sibidanov, F. Simon, J. B. Singh, S. Skambraks, K.
  Smith, R. J. Sobie, A. Soffer, A. Sokolov, Y. Soloviev, E. Solovieva, S.
  Spataro, B. Spruck, M. Stari\v{c}, S. Stefkova, Z. S. Stottler, R. Stroili,
  J. Strube, J. Stypula, M. Sumihama, K. Sumisawa, T. Sumiyoshi, D. J. Summers,
  W. Sutcliffe, K. Suzuki, S. Y. Suzuki, H. Svidras, M. Tabata, M. Takahashi,
  M. Takizawa, U. Tamponi, S. Tanaka, K. Tanida, H. Tanigawa, N. Taniguchi, Y.
  Tao, P. Taras, F. Tenchini, D. Tonelli, E. Torassa, K. Trabelsi, T.
  Tsuboyama, N. Tsuzuki, M. Uchida, I. Ueda, S. Uehara, T. Ueno, T. Uglov, K.
  Unger, Y. Unno, S. Uno, P. Urquijo, Y. Ushiroda, Y. Usov, S. E. Vahsen, R.
  van Tonder, G. S. Varner, K. E. Varvell, A. Vinokurova, L. Vitale, V.
  Vorobyev, A. Vossen, E. Waheed, H. M. Wakeling, K. Wan, W. Wan Abdullah, B.
  Wang, C. H. Wang, M.-Z. Wang, X. L. Wang, A. Warburton, M. Watanabe, S.
  Watanuki, I. Watson, J. Webb, S. Wehle, M. Welsch, C. Wessel, J.
  Wiechczynski, P. Wieduwilt, H. Windel, E. Won, L. J. Wu, X. P. Xu, B.
  Yabsley, S. Yamada, W. Yan, S. B. Yang, H. Ye, J. Yelton, I. Yeo, J. H. Yin,
  M. Yonenaga, Y. M. Yook, T. Yoshinobu, C. Z. Yuan, G. Yuan, W. Yuan, Y. Yusa,
  L. Zani, J. Z. Zhang, Y. Zhang, Z. Zhang, V. Zhilich, Q. D. Zhou, X. Y. Zhou,
  V. I. Zhukova, V. Zhulanov, A. Zupanc","A calibration of the Belle II hadronic tag-side reconstruction algorithm
  with $B \rightarrow X\ell \nu$ decays",,,,,"hep-ex","http://creativecommons.org/publicdomain/zero/1.0/","  Tag-side reconstruction is an important method for reconstructing $B$ meson
decays with missing energy. The Belle II tag-side reconstruction algorithm,
Full Event Interpretation, relies on a hierarchical reconstruction of $B$ meson
decays with multivariate classification employed at each stage of
reconstruction. Given the large numbers of classifiers employed and decay
chains reconstructed, the performance of the algorithm on data and simulation
differs significantly. Here, calibration factors are derived for hadronic
tag-side $B$ decays by measuring a signal side decay, $B \rightarrow X\ell
\nu$, in $34.6$ fb$^{-1}$ of Belle II data. For a very loose selection on the
tag-side $B$ multivariate classifier, the calibration factors are $0.65 \pm
0.02$ and $0.83 \pm 0.03$ for tag-side $B^{+}$ and $B^{0}$ mesons,
respectively.
","[{""version"":""v1"",""created"":""Thu, 13 Aug 2020 20:11:32 GMT""},{""version"":""v2"",""created"":""Mon, 17 Aug 2020 10:17:50 GMT""}]","2020-08-18"
"2008.06097","Pradeep Thakur","Pradeep Thakur and P. Durganandini","Factorization, coherence and asymmetry in the Heisenberg spin-1/2 XXZ
  chain a transverse magnetic field and with Dzyaloshinskii-Moriya interaction","13 pages","Phys. Rev. B 102, 064409 (2020)","10.1103/PhysRevB.102.064409",,"cond-mat.str-el quant-ph","http://arxiv.org/licenses/nonexclusive-distrib/1.0/","  We investigate the factorization, coherence and asymmetry properties of the
1d Heisenberg spin-1/2 XXZ chain with Dzyaloshinskii-Moriya interaction (DMI)
and a transverse magnetic field using quantum information measures. Both
longitudinal and transverse DM vectors are considered. Using numerical DMRG, we
compute the one-tangle, two-spin concurrence and the Wigner-Yananse-skew
information. We show that a longitudinal DMI destroys the factorizability
property while a transverse DMI preserves it. We relate the absence of
factorizability to the breaking of the $U(1)$ rotation symmetry about the local
magnetization axis at each lattice site. Physically, breaking of the symmetry
manifests in the existence of a chiral current. Although the longitudinal DMI
destroys factorizability, we obtain a `pseudofactorizing' field ($h_{pf}$) at
which entanglement and hence violation of the $U(1)$ symmetry is minimal. Our
calculations indicate a phase coherent ground state at $h_{pf}$. An
entanglement transition (ET) occurs across this field which is characterized by
an enhanced but finite range of two-spin concurrence in its vicinity in
contrast with the diverging range of the concurrence for the ET across the
factorizing field ($h_{f}$). We relate the asymmetry to the `frameness' or the
ability for the state to act as a reference frame for some measurement. In
absence of longitudinal DMI (or in presence of transverse DMI), at $h_{f}$, the
single site magnetization axis specifies the common $z$-axis for the full
system but not the full Cartesian reference frame due to a lack of phase
reference. On the other hand, in the presence of a longitudinal DMI, our
results indicate that at $h_{pf}$, the local magnetization and the chiral
current are sufficient to specify the full Cartesian reference frame, with the
chiral current being the macroscopic quantity to determine the phase reference.
","[{""version"":""v1"",""created"":""Thu, 13 Aug 2020 20:11:53 GMT""}]","2020-08-17"
"2008.06098","Amir Alansary","Vitalis Vosylius, Andy Wang, Cemlyn Waters, Alexey Zakharov, Francis
  Ward, Loic Le Folgoc, John Cupitt, Antonios Makropoulos, Andreas Schuh,
  Daniel Rueckert, Amir Alansary","Geometric Deep Learning for Post-Menstrual Age Prediction based on the
  Neonatal White Matter Cortical Surface",,,,,"cs.CV eess.IV","http://arxiv.org/licenses/nonexclusive-distrib/1.0/","  Accurate estimation of the age in neonates is essential for measuring
neurodevelopmental, medical, and growth outcomes. In this paper, we propose a
novel approach to predict the post-menstrual age (PA) at scan, using techniques
from geometric deep learning, based on the neonatal white matter cortical
surface. We utilize and compare multiple specialized neural network
architectures that predict the age using different geometric representations of
the cortical surface; we compare MeshCNN, Pointnet++, GraphCNN, and a
volumetric benchmark. The dataset is part of the Developing Human Connectome
Project (dHCP), and is a cohort of healthy and premature neonates. We evaluate
our approach on 650 subjects (727scans) with PA ranging from 27 to 45 weeks.
Our results show accurate prediction of the estimated PA, with mean error less
than one week.
","[{""version"":""v1"",""created"":""Thu, 13 Aug 2020 20:15:03 GMT""},{""version"":""v2"",""created"":""Sun, 27 Sep 2020 22:01:44 GMT""}]","2020-09-29"
"2008.06099","David Baum","David Baum, Stefan Bechert, Ulrich Eisenecker, Isabelle Meichsner,
  Richard M\""uller","Identifying Usability Issues of Software Analytics Applications in
  Immersive Augmented Reality",,,,,"cs.HC","http://arxiv.org/licenses/nonexclusive-distrib/1.0/","  Software analytics in augmented reality (AR) is said to have great potential.
One reason why this potential is not yet fully exploited may be usability
problems of the AR user interfaces. We present an iterative and qualitative
usability evaluation with 15 subjects of a state-of-the-art application for
software analytics in AR. We could identify and resolve numerous usability
issues. Most of them were caused by applying conventional user interface
elements, such as dialog windows, buttons, and scrollbars. The used city
visualization, however, did not cause any usability issues. Therefore, we argue
that future work should focus on making conventional user interface elements in
AR obsolete by integrating their functionality into the immersive
visualization.
","[{""version"":""v1"",""created"":""Thu, 13 Aug 2020 20:15:28 GMT""}]","2020-08-17"
"2008.06101","Xiangyu Guo","Xiangyu Guo, Janardhan Kulkarni, Shi Li, Jiayi Xian","Consistent $k$-Median: Simpler, Better and Robust",,,,,"cs.DS cs.LG","http://arxiv.org/licenses/nonexclusive-distrib/1.0/","  In this paper we introduce and study the online consistent $k$-clustering
with outliers problem, generalizing the non-outlier version of the problem
studied in [Lattanzi-Vassilvitskii, ICML17].
  We show that a simple local-search based online algorithm can give a
bicriteria constant approximation for the problem with $O(k^2 \log^2 (nD))$
swaps of medians (recourse) in total, where $D$ is the diameter of the metric.
When restricted to the problem without outliers, our algorithm is simpler,
deterministic and gives better approximation ratio and recourse, compared to
that of [Lattanzi-Vassilvitskii, ICML17].
","[{""version"":""v1"",""created"":""Thu, 13 Aug 2020 20:24:28 GMT""}]","2020-08-17"
"2008.06102","Manuel Maarek","Manuel Maarek and L\'eon McGregor","Development of a Web Platform for Code Peer-Testing","8th Workshop on Evaluation and Usability of Programming Languages and
  Tools (PLATEAU) at SPLASH 2017",,,,"cs.SE","http://arxiv.org/licenses/nonexclusive-distrib/1.0/","  As part of formative and summative assessments in programming courses,
students work on developing programming artifacts following a given
specification. These artifacts are evaluated by the teachers. At the end of
this evaluation, the students receive feedback and marks. Providing feedback on
programming artifacts is time demanding and could make feedback to arrive too
late for it to be effective for the students' learning. We propose to combine
software testing with peer feedback which has been praised for offering a
timely and effective learning activity with program testing.
  In this paper we report on the development of a Web platform for peer
feedback on programming artifacts through program testing. We discuss the
development process of our peer-testing platform informed by teachers and
students.
","[{""version"":""v1"",""created"":""Thu, 13 Aug 2020 20:32:29 GMT""}]","2020-08-17"
"2008.06103","Woojoo Lee","Woojoo Lee, Yi Lin, Li-Shuan Lu, Wei-Chen Chueh, Mengke Liu, Xiaoqin
  Li, Wen-Hao Chang, Robert A. Kaindl, and Chih-Kang Shih","Momentum resolved ground/excited states and the ultra-fast excited state
  dynamics of monolayer MoS2",,,,,"cond-mat.mes-hall cond-mat.mtrl-sci","http://arxiv.org/licenses/nonexclusive-distrib/1.0/","  The emergence of transition metal dichalcogenides (TMD) as crystalline
atomically thin semiconductors has created a tremendous amount of scientific
and technological interest. Many novel device concepts have been proposed and
realized (1-3). Nonetheless, progress in k-space investigations of
ground/excited state electronic structures has been slow due to the challenge
to create large scale, laterally homogeneous samples. Taking advantage of
recent advancements in chemical vapor deposition, here we create a wafer-size
MoS2 monolayer with well-aligned lateral orientation for advanced electron
spectroscopy studies (4-6). Low energy electron diffraction and scanning
tunneling microscopy (STM) demonstrate atomically clean surfaces with in-plane
crystalline orientation. The ground state and excited state electronic
structures are probed using scanning tunneling spectroscopy (STS),
angle-resolved photoemission (ARPES) and time-resolved (tr-)ARPES. In addition
to mapping out the momentum-space quasiparticle band structure in the valence
and conduction bands, we unveil ultrafast excited state dynamics, including
inter- and intra-valley carrier scattering and a rapid downward energy shift by
~ 0.2eV lower than the initial free carrier state at Sigma point.
","[{""version"":""v1"",""created"":""Thu, 13 Aug 2020 20:38:01 GMT""},{""version"":""v2"",""created"":""Fri, 16 Oct 2020 05:49:18 GMT""}]","2020-10-19"
"2008.06104","Jannis Maiwald","Jannis Maiwald, Igor I. Mazin, Alex Gurevich and Meigan Aronson","Superconductivity in La$_2$Ni$_2$In","submitted to Phys. Rev. B","Phys. Rev. B 102, 165125 (2020)","10.1103/PhysRevB.102.165125",,"cond-mat.supr-con cond-mat.str-el","http://arxiv.org/licenses/nonexclusive-distrib/1.0/","  We report here the properties of single crystals of La$_2$Ni$_2$In.
Electrical resistivity and specific heat measurements concur with the results
of Density Functional Theory (DFT) calculations, finding that
La$_{2}$Ni$_{2}$In is a weakly correlated metal, where the Ni magnetism is
almost completely quenched, leaving only a weak Stoner enhancement of the
density of states. Superconductivity is observed at temperatures below
0.9$\,$K. A detailed analysis of the field and temperature dependencies of the
resistivity, magnetic susceptibility, and specific heat at the lowest
temperatures reveals that La$_2$Ni$_2$In is a dirty type-II superconductor with
likely s-wave gap symmetry. Nanoclusters of ferromagnetic inclusions
significantly affect the subgap states resulting in a non-exponential
temperature dependence of the specific heat $C(T)$ at $T\ll T_\text{c}$.
","[{""version"":""v1"",""created"":""Thu, 13 Aug 2020 20:40:44 GMT""}]","2020-10-21"
"2008.06105","Gennady Chernov","Valery Fomichev and Gennady Chernov","Termination shock as a source of unusual solar radio bursts","19 pages, 4 figures",,"10.3847/1538-4357/abad9f",,"astro-ph.SR","http://arxiv.org/licenses/nonexclusive-distrib/1.0/","  Using centimeter wave and decimeter wave solar radio spectral observations of
the flares of November 18, 2003 and September 12, 2004, we have discussed two
type II like bursts at the meter waves. The radio bursts show that the ordinary
frequency drift from high to low frequencies slows down and stops, and a
frequency drift from low to high frequencies appears. An analysis of all data
on the corresponding flares provides evidence of formation of quasi standing
fast mode shocks (termination shocks, TS). TS are able to generate energetic
electrons, responsible for the appearance of new sources of hard X ray
radiation and generation of fast radio bursts (spikes), fibers and zebra
structures. The sources of the radio emission bands with the unusual frequency
drift are situated above the top of the post flare loops (lower TS) or are
connected with the erupting prominence or coronal mass ejection (CME, upper
TS). Estimations of the critical Mach numbers for the ordinary plasma
parameters in the solar flares give the values 1.3 easily realized in the flare
events. The conditions necessary for generation of unusual radio bursts are
likely to occur in the helmet shaped magnetic structures in the solar corona.
","[{""version"":""v1"",""created"":""Thu, 13 Aug 2020 20:44:10 GMT""}]","2020-09-30"
"2008.06106","Akin Yilmaz","M. Akin Yilmaz and A. Murat Tekalp","Effect of Architectures and Training Methods on the Performance of
  Learned Video Frame Prediction","Accepted for publication at IEEE ICIP 2019",,"10.1109/ICIP.2019.8803624",,"cs.CV eess.IV","http://arxiv.org/licenses/nonexclusive-distrib/1.0/","  We analyze the performance of feedforward vs. recurrent neural network (RNN)
architectures and associated training methods for learned frame prediction. To
this effect, we trained a residual fully convolutional neural network (FCNN), a
convolutional RNN (CRNN), and a convolutional long short-term memory (CLSTM)
network for next frame prediction using the mean square loss. We performed both
stateless and stateful training for recurrent networks. Experimental results
show that the residual FCNN architecture performs the best in terms of peak
signal to noise ratio (PSNR) at the expense of higher training and test
(inference) computational complexity. The CRNN can be trained stably and very
efficiently using the stateful truncated backpropagation through time
procedure, and it requires an order of magnitude less inference runtime to
achieve near real-time frame prediction with an acceptable performance.
","[{""version"":""v1"",""created"":""Thu, 13 Aug 2020 20:45:28 GMT""}]","2020-08-17"
"2008.06107","Gen Chiaki","Gen Chiaki and Naoki Yoshida","Disc fragmentation and oligarchic growth of protostellar systems in
  low-metallicity gas clouds","29 pages, 24 figures, 4 tables, accepted for publication in MNRAS",,"10.1093/mnras/stab2799",,"astro-ph.GA","http://arxiv.org/licenses/nonexclusive-distrib/1.0/","  We study low-metallicity star formation with a set of high-resolution
hydrodynamics simulations for various gas metallicities over a wide range
$0$--$10^{-3} \ {\rm Z}_{\bigodot}$. Our simulations follow non-equilibrium
chemistry and radiative cooling by adopting realistic elemental abundance and
dust size distribution. We examine the condition for the fragmentation of
collapsing clouds (cloud fragmentation; CF) and of accretion discs (disc
fragmentation; DF). We find that CF is suppressed due to rapid gas heating
accompanied with molecular hydrogen formation even with efficient dust cooling
for metallicities $\gtrsim 10^{-5} \ {\rm Z}_{\bigodot}$. Instead, DF occurs in
almost all runs regardless of metallicity. We also find that, in the accretion
discs, the growth of the protostellar systems is overall oligarchic. The
primary protostar grows through the accretion of gas, and secondary protostars
form through the interaction of spiral arms or the break-up of a rapidly
rotating protostar. Despite vigorous fragmentation, a large fraction of
secondary protostars are destroyed through mergers or tidal disruption events.
For a few hundred years after the first adiabatic core formation, only several
protostars survive in the disc, and the total mass of protostars is
$0.52$--$3.8 \ {\rm M}_{\bigodot}$.
","[{""version"":""v1"",""created"":""Thu, 13 Aug 2020 20:49:28 GMT""},{""version"":""v2"",""created"":""Mon, 17 Aug 2020 03:36:11 GMT""},{""version"":""v3"",""created"":""Mon, 27 Sep 2021 00:19:17 GMT""}]","2021-10-13"
"2008.06108","Brendan Reed","Brendan Reed and C. J. Horowitz","Total Energy in Supernova Neutrinos and the Tidal Deformability and
  Binding Energy of Neutron Stars","8 pages, 6 figures","Phys. Rev. D 102, 103011 (2020)","10.1103/PhysRevD.102.103011",,"astro-ph.HE nucl-th","http://arxiv.org/licenses/nonexclusive-distrib/1.0/","  The energy radiated in supernova neutrinos is a fundamental quantity that is
closely related to the gravitational binding energy of a neutron star. Recently
the tidal deformability of neutron stars was constrained by gravitational wave
observations. By considering several equations of state, we find a strong
correlation between the tidal deformability and neutron star binding energy. We
use this correlation to sharpen predictions of the binding energy of neutron
stars and the total neutrino energy in supernovae. We find a minimum binding
energy for a neutron star formed in a supernova of $\sim1.5\times 10^{53}$
ergs. Should the neutrino energy in a supernova be significantly below this
value, it would strongly suggest new unobserved particles are carrying away
some of the supernova energy. Alternatively, if the neutrino energy is observed
above $\sim 6\times 10^{53}$ ergs, it would strongly imply the formation of a
(perhaps surprisingly) massive neutron star.
","[{""version"":""v1"",""created"":""Thu, 13 Aug 2020 20:53:15 GMT""},{""version"":""v2"",""created"":""Sat, 10 Oct 2020 04:33:55 GMT""}]","2020-11-18"
